"Register","Text","Left","-5;5","Right"
"w","W-QI09C2A-1434-1883","İkimiz de sahte sahte gülümseyerek","çıkıyoruz","odadan... ""Ne gün başlayabiliriz derse"""
"w","W-TA14B1A-1590-828","İkiii... (Binbirkılık direğin arkasında, torbasından","çıkardığı","uzun sopalı Hacivat tasvirini Karagöz'e"
"w","W-RA16B1A-1211-2489","İki arkadaş ses çıkarmadan yukarı","çıkmaya","başladılar. İkinci kata geldiklerinde adam"
"s","S-ADABCo-0306-1228","İbrahim Öztürk'ün disiplinsizliği ön plana","çıktı.","Bunun üzerine İbrahim Öztürk'ün babası"
"s","S-ACABQq-0426-1661","işçilere yönelikti. Ancak biz, kanunun","çıktığı","ana kadar özelleştirme nedeniyle mağdur"
"s","S-BEABXg-0088-1475","işçi çıkartıyo işçi alıyo işçi","çıkartıyo.","Onda da... Tazminat ödememek için."
"w","W-VI13F1D-4853-2448","işten eve gelene kadar dışarıya","çıkmazdık.","Daha sonra babam Mersin'e tayin"
"s","S-BEABXJ-0076-961","işte... Ben bu rengin dışına","çıkmam","ki. Niye sen hep o"
"s","S-BEABXn-0350-1709","işte. Yok şey yeraltı kaynaklarını","çıkaramazsın","falan filan onların hepsi var."
"s","S-BEABXO-0354-2305","işte, onu bulduk işte, eve","çıktık","derken zart zurt. Hakan'la samimiyet"
"s","S-BEABXu-0435-921","işte şortun var zaten. Neyse","çıkmışız","biz ya sorun yok. Neyse"
"s","S-BEABXs-0130-74","işte şeyi çıkartıyorlar bir hedef","çıkartıyorlar.","Yani hedef kadınsa sen kesin"
"s","S-ADABAo-0433-2451","işte çocuklara isim diye sözlük","çıkarmışlar","ve o kitabın içinde sadece"
"s","S-BEABXs-0130-7","işte Çeto hocada tamam dışarı","çıktı","onları görmüş işte siz ne"
"s","S-ADABPZ-0374-306","işte o etniseyi bundan dolayı","çıkartıyorlar.","Onalrı boş boşuna göstermedim. Bakın"
"s","S-BEABXn-0350-1213","işte hala. Ya şey haberlerde","çıkıyor","Türkiye dünyanın en büyük on"
"s","S-BEABXO-0416-1796","işte ben yapamadım astım alerjisi","çıktı.","Sen gidyo muydun kuaföre? Gittim"
"s","S-BEABX\-0065-456","işte arkadaşlar var diyo. Kadir'in","çıkacağını","düşünüyon Ankaraya amına koyim. La"
"s","S-ACABPA-0434-1080","işleyen düzeyde bulunmayan ülkelerde ortaya","çıkarsa;","o zaman bu kutuplaşma, çoğu"
"s","S-AEABTZ-0337-1011","işlerinde insan yaşamının üstün düzeylere","çıkarma","konusunda <B> birisi insan hakkını"
"w","W-DG37C4A-0529-2472","işlerin gerçek boyutları ile ortaya","çıkarılması","da, mutlaka TBMM'nin ağırlığını gerektirmektedir."""
"w","W-VE09C3A-1051-1367","işlerime kaptırmış, uzun süredir alışverişe","çıkmamış,","üstüme başıma yıllardır yeni bir"
"w","W-DF05A1A-2985-101","işlemine göre GSÜD'ni açıkladığı ortaya","çıkan","ve X5 değişkenlerinin, her ikisi"
"w","W-RI41C2A-1463-2132","işlememesi ya da bir eksiklik","çıkması","durumunda yapılacak olan diğer işleri"
"s","S-AAAAFZ-0383-2000","işlem için yeterli olabileceği ortaya","çıktı.","<D 5> İşte sistem biyolojisine"
"w","W-HE39C3A-0711-1667","işin, anayasayı değiştirmek olduğunu gündemden","çıkarttık.","Düne kadar kendileri için birşey"
"w","W-SD37C4A-1354-98","işimden dolayı bana bir güçlük","çıkarma.""","74- Yine gittiler. Nihayet bir"
"w","W-LA16B3A-0172-262","işi hallettikten sonra, kadını aramaya","çıkacak.","Faydası yok. Kirpiği kirpiğine değdikten"
"s","S-ADAB^Z-0370-1313","işgücünü Evet Çekebilmek açısından ortaya","çıkıyor.","Evet Türkiye'de bir ilk Murta"
"s","S-ADABCo-0218-1362","işgalini noktalamassa sınırın açılmasına karşı","çıkıcaklarını","ilan etti bugün. MHP Genel"
"w","W-QE39C3A-1759-481","işgal etme isteklerine fazla ses","çıkarmıyordu","ama, Fransa böyle bir işgale"
"s","S-ADAB^Z-0370-116","işe girer. Peki üniversiteden dışarı","çıkmak","dediğiniz mezuniyetten mi bahsediyorsunuz? Hayır"
"s","S-BEABXg-0088-2230","işe alıyo 6 ay sonra","çıkartıyo","1 ay bekletip tekra alıyo."
"w","W-NH03A3A-0628-1260","iş, insani varlık alanında ortaya","çıkan","fenomenlerin hepsinde ortak olarak bulunan"
"w","W-PE39C3A-1330-946","iş edinenler, etik değerlerine sahip","çıkanlar,","ben yayıncıyım, diyenlerle stabil hale"
"w","W-HG37C1A-0371-1627","iş alanına dönüşebilirdi Ruhun pazara","çıkmasının","bir uzantısını da ""imgenin özerkleşmesi"""
"w","W-RD02A1B-4582-1372","iş ahlâkı olgusunu ön plana","çıkarmaktadır.","Firmalarda verimlilik artışının doğrudan doğruya"
"w","W-VI19E1A-4001-1313","iğne ikide bir elime batıyordu.","Çıkan","kandan kumaş leke içinde kalmıştı."
"s","S-ADBBI^-0326-2345","içmişim, kafayı bulmuşum, orada sahneye","çıktığım","zaman Seyfi Dursunoğlu muyum, Huysuz"
"w","W-SA16B1A-1488-591","içiyorum, insanlar geliyor buraya. İnsanlar","çıkıyor","buradan. Kadın, erkek ve homoseksüel."
"w","W-KA16B2A-0784-1702","içine sığmıyordu. Geceleri, sevdiği rüyalarından","çıkmıyordu.","Ne yapıp edip bu kızla"
"w","W-LD03A4A-0254-2089","içine giriyor, bitmemiş durumlar ortaya","çıkıyor,","öyle mi? Evet, işin can"
"w","W-ME39C3A-2597-886","içindeyiz. Ben, biraz sonra Çankaya'ya","çıkıp","kabinenin istifa ettiğini bildiririm, dedi."
"s","S-ADBBI^-0042-1184","içindeydik. Lüksemburg Zirvesi'nden beklediğimiz karar","çıktı.","Bizden başka ne kadar istekli"
"s","S-BEABXO-0093-232","içinden çıkıyordu? Yumurtadan. Evet yumurtadan","çıkıyordu.","Kaplumbağlar yumurtalardan çıkarlar dimi? Evet."
"s","S-ADABIi-0124-1288","içinden kalkamazsa emm karakteri, rolü","çıkartamazsa","o zaman devreye girmeyi tercih"
"s","S-AEABAo-0023-711","içinden daha sonra o poşetleri","çıkartın.","İsterseniz kuru bir şişeye onu"
"w","W-RF05A1B-4659-1790","içindeki sıralaması endeksin değerini belirlemektedir.","Çıktı","açısından sektörün en büyük bankası"
"w","W-SA16B4A-0063-212","içinde olduğu için sokağa da","çıkamaz...","O gece şansının lüzumundan fazla"
"s","S-ACABPA-0434-1979","içinde insan sorunu hiç öne","çıkartılmıyor.","Demokrasi de bir oyunsa, oyuna"
"w","W-QA16B2A-0321-1464","içinde bulunduğumuz zorluğun faturasını Marx'a","çıkarmaya","başladık. Ben bu ikinci durumdan"
"w","W-CD18E1C-4140-1390","içinde birden fazla kararname çıkarılıp","çıkarılamayacağını","gösterir."" hükmüne yer verilmiştir. Sözü"
"s","S-BEABXu-0435-2265","içinde ağlama yar. Bunu şeyi","çıkmış","mıydı? Neyi? Papazı çıkmadı mı?"
"s","S-ADBBI^-0326-1317","için. Yani, yaptığı işe sahip","çıkan","iyi bir sanatçıdır bana göre."
"s","S-BEABXg-0070-2235","için. Belki de o son","çıkan","televizyonlu trenlerden vardır. Belgesel falan"
"s","S-BEABXO-0071-241","için. Babamdan da deneme sınavı","çıkartacam","diyorum para istiyorum tamam mı"
"w","W-MG37C3A-0006-2231","için, bu kişilerin gözüpekliğini öne","çıkarırlar,","her şeye ekonomi açısından bakanlar"
"w","W-HE22C2A-0368-1798","için çırpınıyorlar da, ""kısmet""leri ""kısmet""leri","çıkmıyor","gibi. Oysa erkekler için durum"
"s","S-ADABCo-0244-1767","için çalışıyorduk. Aynı günde işten","çıkarıldık.","Üniversite mezunuyum ama çadırda yaşamak"
"s","S-ADAACo-0284-1448","için zabıta devreye girince olaylar","çıktı.","Bazı pazarcılar tezgah demirlerini zabıtalara"
"w","W-II09C3A-0600-922","için yer yer birbirimize bağlanarak","çıkıyoruz.","Hava son derece sıcak ve"
"w","W-CA16B2A-0159-298","için tüm mahalleden yardım toplamaya","çıktı.","Esnaflar gönüllerinden ne koparsa, caz"
"s","S-ADABIi-0124-1296","için tragedya kavramı o dönemde","çıktığı","için... Evet. Tiyatronun tarihi gelişiminin"
"s","S-AEABTZ-0040-996","için sadece 5 gramlık karbondioksit","çıkartıyorsunuz.","Ve daha da ilginci bu"
"w","W-OI42E1B-2937-564","için para ister. Adam kesesini","çıkarır","ve bir sürü irili ufaklı"
"w","W-TF25D1B-2153-1056","için ortaya ""maceracı bir fiyat""","çıkmasını","beklemiyor. Bunun nedeni ise yıllık"
"w","W-VB04A1B-4527-1956","için kontrol grubuna göre düşük","çıkmıştır.","Fakat normal fenotipli dişi bireylerin"
"w","W-JC06A3A-1024-1976","için kenarlarına biraz su dökülür.","Çıkarma","işlemi sırasında bozulan kısımlar elle"
"s","S-BEABXO-0386-1927","için Karaköylü gelin... Karaköylü geline","çıkmış","adı Zor değil mi? Rufiye!"
"s","S-ACABQq-0422-83","için değerli arkadaşlar, sadece kanunları","çıkarmak","yetmemektedir. Hepimizin sorunudur; kanunları çıkarmak,"
"s","S-BEABXW-0173-1392","için dedim hani orda bişi","çıkarsa","dedim tabi ki kızım dedi"
"s","S-AEABTZ-0040-1379","için daha az karbondioksit emisyonu","çıkartıyor.","Bunlar da çok önemli mesela"
"s","S-BEABXO-0444-123","için at yapsam teklesem çıkmıcak.","Çıkmıcak.","Duvarına girmem lazım. Senin duvarında"
"s","S-BEABXO-0343-723","içi böyle ham, taze fırından","çıkmış.","Ekmek elastikliğinde. Hmm. Yumuşak böyle"
"w","W-UF10A2A-1868-1717","içermektedir. Riskten Kaçınma Riskin ortaya","çıkmasına","veya artmasına sebep olan faaliyetlere"
"s","S-ACABQq-0425-2411","içerisine girecek konularda da kürsüye","çıkan","hatipler görüş belirttiler. Elbette, bugün,"
"w","W-HA16B2A-0077-1406","içeri. Öyle bir bekleyiş. Talihime","çıkan","titreşim sertliğine uygun sesleri çağırıyor"
"w","W-WI44F1D-4753-1813","içerde bulamıyorum sonra bi odadan","çıkıyor","'tühh ya unuttum yer ayırtmayı'"
"s","S-ACABTZ-0336-266","izotopun solunumuna maruz kalıyor. Burdan","çıkan","maden taş toprak ayrıldıktan sonra"
"w","W-UE36E1B-3356-164","izninizle yazarın tahmininin doğru çıkıp","çıkmadığıyla","ilgili bir şey söylemeyeyim, fakat"
"s","S-BEABXn-0352-1908","izni olmadan, yani onlara karşı","çıkarsan","ya direk öldürürler yani. Onların"
"w","W-LG37C2A-0455-1850","izleyen bir sürü yapıtın ortaya","çıktığı","görülür. Bu konudaki yapıtların çokluğu"
"s","S-ADABCo-0239-1880","izleriyle karşılaştırılması durumunda haklılığım ortaya","çıkıcaktır.""","Dönmez Başbakan'a suikast düzenliceği iddalarına"
"w","W-RF18E1C-4091-1341","izleri saptanıp, eğer yurt dışına","çıkarılmışlarsa","ülkeye geri getirilmeleri için gerekli"
"w","W-FA16B2A-0872-1959","izledi bir süre. Sonra kitabını","çıkarıp","karıştırmaya başladı; ikinci sınava az"
"s","S-BEABXg-0072-1464","izine çıkıyor mesela <gülerek> izine","çıktı","zaman kapanıyor... Harbi mi? He"
"s","S-BEABXg-0072-933","izin verirse. Gittiğin yerde yine","çıkabilirsin","yani. Ya orda kalman büyük"
"w","W-SH43C4A-1885-2190","izin verilmedi. Daha sonra vatandaşlıktan","çıkarıldı","ve milletvekilliğine son verildi. 2001'de"
"s","S-ACABPA-0434-2102","izin veren sisteme RP karşı","çıkmış.","Son derece doğal bence, beni"
"w","W-JI27D1B-2457-1948","izin istedi. Gülümsün'le birlikte yemeğe","çıktı.","Ondan, 'Böyle bir şeye müsaade"
"s","S-AAAAFZ-0383-399","iyonik dengeden sorumlu olduğu ortaya","çıktı.","Ve hemen söyleyim bu genlerin"
"s","S-ADBBI^-0042-1364","iyiydi. Hatta New York'un keyfini","çıkardım","bile diyebilirim. Benim keyfim fotoğraf"
"w","W-WI45F1D-4817-2443","iyice kısalttırdım ki gözlerim meydana","çıksın","Sonra Lady Charlotte ile Ortaköy'de"
"s","S-BEABXp-0156-2316","iyi. Ses kayıtları... Pragmatics'ten yapar","çıkartır","da hani ordaki işte o"
"w","W-RH42A2A-0306-2327","iyi'nin, mutluluk olduğu böylece ortaya","çıkınca,","mutluluğu daha da açıklığa kavuşturmak"
"s","S-BEABXO-0343-1320","iyi yapıştırmış ya. Açarken yapıştırmış.","Çıkmıyor.","Hmm."
"w","W-SD36C3A-0070-2393","iyi biz biliyoruz. Sabah evden","çıkıyor,","akşama kadar koşturuyor, akşam evde"
"s","S-ADBBI^-0326-414","iyi bir sesinin olması, sahneye","çıkabilmiş","olması; onları hep kıskandım. Ama"
"w","W-ED37C3A-0401-2273","iyi açıklıyorsun. Bu ayrı eve","çıkma","konusunda büyüklerin cinsellikle ilgili telaşlarına"
"s","S-AEABTZ-0040-2092","ivmesi daha da yukarıya doğru","çıkıyor.","ABD'de yapılan anketlerde halkın %65'i"
"w","W-IE05A1A-2620-1463","ittifak gibi gevşek birlikler olmaktan","çıkarak","daha sıkı bir birliği ifade"
"w","W-VE05A2A-2688-1450","itiraflarının (Confessions) bir yapıt olarak","çıkmasını","kabul etmekle ikrarda bulunmuştur. Bir"
"s","S-ADABPZ-0135-664","itibaren bir liberal özne karşımıza","çıkıyor.","Kendini tamamen özgürleştirme adına geliştirebilir"
"w","W-QF05A1B-4669-360","ithalat içinde %40'a yaklaştığı ortaya","çıkmaktadır.","1924 yılından sonra ara ve"
"w","W-SD02A2A-0810-896","isyanları bastırma harekâtını vesile ederek","çıkardıkları","93 Harbi'nde Osmanlı Devleti'ni yalnız"
"w","W-RE39E1B-3035-1221","istiğfarsız bir şekilde bu yolculuğa","çıktığınızda,","ruhani âlemlerin iyileriyle mi, yoksa"
"s","S-BEABXp-0156-1945","istiyosan... Böyle bi şeyin farklılık","çıkartacağını","düşünüyosan yani soru gibi sorabilirsin."
"w","W-PI22C1A-0209-375","istiyorum. Oysa birkaç sayfa sonra","çıkıp","gidebilirim. 1993 1993 yılında, yaşadığım"
"w","W-HI09C2A-0805-1124","istiridye açılıyor ve içinden Cahide","çıkıyordu.","Üzerinde, uzaktan çıplak duygusu veren,"
"s","S-AEABPZ-0331-1360","istihdam çok daha yüksek seviyeye","çıkıyor.","Alınan ücretler daha yüksek oluyor."
"s","S-ADABCo-0334-1463","isterseniz Savaş Ay‘a Ay‘a Ay‘a","çıkalım","orda konuşalım bunları. Yok Savaş"
"s","S-ADABAo-0355-1673","istemiyo, çok önemli bu. Şimdi","çıkmış","Türkiyeli olalım, Türkiyeli olalım ya"
"s","S-ACAAQq-0424-2196","istemeyerek de olsa, araçlarında ortaya","çıkan","zararlara rağmen, kaçak akaryakıta yöneldi."
"w","W-JA16B4A-1093-407","istemem ben. Elini cebine atıp,","çıkarıp","paralara baktıktan sonra. ""Kahretsin paralı"
"s","S-ADABAo-0388-37","istemeleri nedeniyle bu seyahatnameler ortaya","çıkmış oluyor.","çıkmış oluyor. Daha sonra 18.,19. 18.,19."
"s","S-ADAASK-0036-1492","istemek, yardım istemek lazım. İzin","çıkarsa","sen de onlardan olursun. Bir"
"w","W-QI31D1B-2343-756","istekli oyunu, ilk sınavına tedirgin","çıkan","Ersun Yanal'a güven verdi. Genç"
"w","W-PG37C3A-0343-139","istediğin kadar' dedi. Sonra sokağa","çıktık...""","Sahneleme ya da gösterme ise"
"w","W-RI45F1D-4812-1073","istediğim mevzu öğle yemeği. Restorana","çıktık,","""açık büfe, self servis"" dendi,"
"w","W-PI36C2A-0609-2420","istediği için, valiyle anlaştığı için","çıktık.","Hiçbir köylü oradan çıkmak islemedi."
"w","W-ID37C3A-1061-2060","istediklerini yerine getirsin, yatakta ses","çıkarmasın,","fazla bir talepte bulunmasın, dışarıda"
"w","W-LH09C2A-0276-542","istediklerimi başaramamış olsaydım, onların karşısına","çıkmazdım.","Beni yemeğe davet ediyorlar. Daha"
"s","S-ADABAo-0433-1936","isimleri için ayrı bir kitap","çıkarmışlar","sırf bu isimlerde yabancılara yani"
"w","W-KF10A2A-1875-533","ise, Euro'nun fiziki olarak piyasaya","çıkıp","tek para sistemine dahil olan"
"w","W-QD36E1B-2841-894","ise, Eczacı Orhan Kır tarafından","çıkartılan","""Turunç"" aylık kültür, edebiyat ve"
"w","W-TA16B1A-1215-21","ise Kesik Kuyruk garip sesler","çıkartarak","hoplayıp zıplıyormuş. ""Ne kralı? Hangi"
"w","W-SB04A2A-1269-235","ise kahve tohumlarının, tohum kabuklarının","çıkarılmasıyla","elde edilir. Burada tohum kabukları"
"w","W-IE39E1B-2837-532","ise İstanbullu gençler o gün","çıkan","Rumca gazetelerin büyük bir kısmını"
"w","W-PF10E1B-2867-263","ise enflasyon yüzde 26.3 düzeyine","çıktı.","Ardından 50'li düzeyler, sonra 60'lar"
"w","W-QH42C2A-0477-1881","ise durum şu şekilde açığa","çıkmaktadır","Kayınvalidemin eşime verdiği evde oturuyoruz."
"w","W-HE39E1B-2836-2298","ise asgari 300 milyar liraya","çıkıyor.","Herşey, Tansu Çiller'e Kilis ilçe"
"w","W-GD03C3A-0667-1630","irdelemenin ötesinde bireysel gerçekliğin dışına","çıkamamaktadır.","Üstelik bu irdelemenin boyutlarının sınırlılığı"
"s","S-ADBBI^-0042-58","Irak'ın içinde bulunduğu ekonomik sıkıntılardan","çıkması,","ambargoların hafiflemesi için Irak'la dünya"
"w","W-VE39C4A-1180-1997","Irak ve İran'ı ön plana","çıkarırken,","cephe faaliyetlerini Avrupa ve Kıbrıs"
"w","W-HE05A2A-2621-479","iradesiyle yürüyemezdi. Büyük projelere sahip","çıkacak","kadrolar ve sosyal güçler yoktu."
"w","W-MD05A2A-0682-801","ipucu vardır. Konuya ilişkin basında","çıkan","haberler ve bu tür hareketlerin"
"w","W-IC06A2A-3319-2305","inşaasından dolayı işverenle müteahhit arasında","çıkan","ihtilaflar genellikle, şartname ve sözleşmelerin"
"w","W-QE30D1B-2107-1604","internet sitesi de olayın ortaya","çıkmasından","sonra siteye parola koydu. Fotoğraflar,"
"s","S-ADABAo-0382-1170","insanım. Ben 18 yaşımda yola","çıktığımda","hani babama kafa tuttum derken"
"w","W-VI45F1D-4720-525","insanoğlu uygun bir ortamda önüne","çıkan","fırsatı değerlendirmeğe hazır oldu mu,"
"w","W-RE39C4A-1386-916","insanlık dramlarını yüklenmiş olduğu açığa","çıktı.","Duygulara seslenmek için değil, işgalin"
"s","S-ACABQq-0421-2299","insanlarının oluşturduğu bir törenle ortaya","çıkmaktadır.","Bu töreni, yirmi civarında ülke,"
"s","S-ADABAo-0333-910","insanların karşısına çok daha profosyonel","çıkmak","zorundasın yani kendinize bakmanız lazım"
"w","W-PI32D1B-2491-1871","insanların hangi özellikleri ön plâna","çıkıyor?","Güzellikleri mi, yoksa dilleri mi"
"w","W-DE39E1B-3023-317","insanları tarafından temsil edildiğinde ortaya","çıkabileceğinde","ittifak halindedirler. Einstein, ""ilim bize,"
"s","S-ADABPZ-0135-2112","insanlarla etkileşim, ilişki içinde ortaya","çıkarıyoruz.","Yarışıyoruz. Burası söylemsel alan. Discoursive"
"w","W-SG37C0A-0189-377","insanlardaki bedensel, fiziksel ""anormallikler"" öne","çıkıyor.","Yapışık ikizler, cüceler, ikiden fazla"
"s","S-ADAB]o-0110-1558","insanlara hitab ederken dışarıdakilere sahip","çıkma","ihtiyacı ya da sahip çıkması"
"s","S-ACABQq-0426-1841","insanlar, toplum şuurundan ve hatırasından","çıkmayacak","olayların başında gelmektedir. 10 Temmuz"
"w","W-DA16B3A-1494-2418","insanlar kıpırdadılar ve canlandılar. Dışarı","çıkıp","çıkmama tartışması yapılırken Oğuz döndü,"
"s","S-BEABIs-0015-180","insanlar bile ağızlarından bile zor","çıkarırlar","kelime olarak. Bi kere 9"
"s","S-ADABAo-0366-1323","insani toplumsal süreçlerde de ortaya","çıktı.","Neyi beraberinde getirdi arkasından? O"
"w","W-LA15B1A-1725-104","insancı derneklerini yoklarım Kapıda gönlümü","çıkarır","Ayakkaplarımı giyerim tatava'nın ÇARE Ankara"
"s","S-ADAB^Z-0370-1433","insan üniversiteye başlarken eğitimin tadını","çıkarmak","yerine ee! ne olacam, gelecekte"
"s","S-BEABXs-0130-1301","insan öldü yani. Gökhan kaçta","çıkıcan?","Hadi çıkalım. Çıkalım. Hadi."
"s","S-ACABQq-0427-2116","insan bunu yapamaz. Efendim. Kavga","çıkacak","kavga. Sayın Taşar. Ayıp ediyorsunuz."
"s","S-BEABXE-0082-551","inmedik mi? Abov. Sonra yukarıya","çıkıyoz","falan. Bana macera gibi geliyordu"
"w","W-SI27D1B-2465-42","inerek ilk defa magmayı delebilmişti.","Çıkarılan","yüzlerce metre parçanın sadece dokuz"
"w","W-EE02A1A-2624-624","inen yamaç siluetinde bugün ortaya","çıkan","durum inşaat daha tamamlanmadığı halde"
"s","S-ADABAo-0308-2364","indirerek piyasayı canlandırmaya çalışıyo, durgunluktan","çıkarmaya","çalışıyor Türkiye'yi. Emm tabi sadece"
"w","W-RE39C3A-0473-1876","inceleme, araştırma ve sorgulamalarla ortaya","çıkarılacak","idi... Ancak, buna olanak verilmemiştir."
"s","S-ACABPA-0434-2127","inanıyoruz. Ayrıca uyum yasalarının süratle","çıkartılarak","yurt dışında bulunan vatandaşların oy"
"s","S-AEABTZ-0040-82","inanılmaz rakamlar da az karbondioksit","çıkartarak","güneş enerjisinden elektrik üretiriz. tabi"
"s","S-BEABXs-0130-356","inanılmaz bir ego var ben","çıkim","ben oynim herkes bana baksın"
"s","S-ADABPZ-0374-144","inançlarımızdan gelir. Bi evden cenaze","çıktığında","yedisinde mevlüt okutursunuz, kırkında mevlüt"
"w","W-XI45F1D-4803-402","inanmışlar. Daha bundan öte başa","çıkamazsın.","Yenildiğini kabul edeceksin. Bitti. Değiştir"
"w","W-LA16B4A-1948-206","imparatorlukta yokluk başgösterdi, salgın hastalıklar","çıktı.","Türk askerleri önce Rus cephesinde"
"w","W-QE30D1B-2107-548","imha silahları olduğu istihbaratının yalan","çıkması","yüzünden sert eleştirilere uğrayan CIA"
"w","W-LI22C2A-0352-1824","imgenin bir araya getirilmesiyle ortaya","çıkmış","bir yorganın sıcaklığı sarar zihininizi."
"s","S-BEABXf-0406-851","imam var. Niye hiçbi tanesi","çıkıp","da Emrullah gibi liderlik vasfına"
"s","S-BEABXO-0378-553","ille de kaldı. Yani bayası","çıktı.","Ta Zela ingen diyi çıkar"
"s","S-BEABXO-0092-1370","illa tuvalette yapacak. O havuzdan","çıktı.","Hiç üşenmedi. Ben mecbur zaten"
"w","W-VD05A1A-2035-1116","ilkesini zedelediği kanaatinde birleşiyorlar. Görüşmelerden","çıkardığımız","sonuç, yer değişikliğinde liyakat ve"
"s","S-ACABTZ-0336-2053","ilkesi. Kirleten öden ilkesi 1983'te","çıkan","emm yasada da vardı. Emme"
"w","W-DE05A1B-3419-1238","ilk seçim sonuçlarının bekledikleri gibi","çıkmadığını","öğrenince dükkanlarını kapatarak gösteri yapmışlardır."
"w","W-TI22E1B-2913-1525","ilk olarak Cin Ali kitapları","çıktı.","Daha okula başlamadan elime geçen"
"w","W-TA16B1A-0069-284","ilk kez hastane binasının dışına","çıkacaktı,","iyileşme aşamasındaki hastalara verilen iki"
"s","S-BEABXO-0128-704","ilk kez görüşüyoruz. Siz şimdi","çıkıp","göl etrafında dolaşmaya başlayınca karşıdan"
"w","W-NH42A1A-1327-2197","ilk ilgi, oyun şeklinde ortaya","çıkacaktır.","Namaz esnasında sırta atlama veya"
"w","W-IH09C2A-0650-1652","ilk dönemlerde babamın yaptıklarına karşı","çıkan","annem artık ona destek veriyordu."
"w","W-TD02A1B-4608-1904","ilk başlarda işgal güçlerine ses","çıkarılmamış;","ama işgalin geçici olmadığı anlaşıldığında"
"w","W-FA15B1A-2678-45","ilk aşkıydı Poseidon, dalgalı Kıbrıs'ta","çıkmadan","önce karaya Yunuslar sevişerek eşlik"
"w","W-FC06A3A-1058-1275","ilişkisi başlıca iki noktada ortaya","çıkmaktadır","Birincisi, çevrenin, çevre değerlerinin korunması"
"s","S-ADBBAo-0443-546","ilişkileri söylüyorum, zaten gazetelere de","çıkmış","şeyler bunlar. Ayşegül Aldinç gerçeği"
"w","W-SI37E1B-3061-714","ilişkileri suç haline getiren yasa","çıkartılırken,","yasa kapsamına lezbiyenliğin alınmasını reddetmiştir,"
"w","W-LC06A1B-3794-1231","ilişkiden yararlanılmayı gerektirmiştir. Kayıtlarda sürüden","çıkma","nedeni ve sürüden çıkma yaşı"
"s","S-AEABUZ-0022-1002","ilginç. Ya çık dışarı. Sokağa","çık.","Buna direnmen lazım. Yarın 1"
"w","W-MF05A1B-4436-1037","ilgili olarak daha sonra ortaya","çıkan","kur farklarının ise, ilgili bulundukları"
"w","W-HE39E1B-2836-2084","ilgili notlar. Bu notlardan yola","çıkarak","araştırdığı kişilerin ailelerini tesbit ettiği"
"s","S-ACABQq-0422-1440","ilgili halen herhangi bir yasanın","çıkarılamamış","olması oldukça üzüntü verici ve"
"w","W-NA16B3A-0661-635","ilgili grafikleri inceledim. Kendimce notlar","çıkardım.","Doğru kararlar verdiğim de oldu,"
"s","S-AEABTZ-0040-1557","ilgili altını çizin. Bunlara hayır","çıktığımız","için bize karşı cevap vermeyin."
"s","S-BEABXn-0350-1984","ilgilenmiyolar falan. Ondan sonra ölünce,","çıkıyo","bi emniyet müdürü işte. Bundan"
"w","W-JG03A1B-3220-1884","ilgilendiriyordu. Bu ilkelerin sınırlarından dışarıya","çıkan","ve aslında ülkede meydana gelen"
"s","S-ADABCo-0209-953","iletelim Baykal'ın. MGK'nın sonucunda ne","çıkacağı","olduğunu bilmedikleri bir sürece destek"
"w","W-FE39E1B-3025-936","ilerleyen İslâm fatihleri de İspanya'ya","çıkarma","yapmışlar ve yaklaşık 715 yılında"
"s","S-ACABQq-0422-1001","ilerleme raporlarını en iyi şekilde","çıkarmak","için üzerine düşen her şeyi"
"s","S-BEABXO-0093-645","ilerisinde karşılarına büyük bir kaya","çıkacak","bu kayanın yanındaki yolsa ilerleyecekler,"
"w","W-SH32D1B-2571-1974","ileri götürmüş, bisikletle Türkiye turuna","çıkmışlar.","Üniversite yasası tümüyle değiştirilmiş, YÖK"
"s","S-BEABXA-0129-2052","ile yazılmış ve ben haklı","çıktığımı","gördüm. N ile yazılıyor di"
"w","W-RD03A2A-1380-1150","ile toplum arasında bir uyumsuzluk","çıkarsa","sorumluluk topluma verilmektedir. Nitekim 1920'lerde"
"w","W-JE05A1B-3582-1602","ile tahvil ya da bono","çıkardığı","zaman, sözleşmeci kişileri bütün hükümleri"
"w","W-RI41C2A-1464-1755","ile omzu arasına sıkıştırdı, ceketini","çıkarıp,","fırlatıp attı bir koltuğun üstüne."
"w","W-QG37E1B-3045-1387","ile kölenin ancak topuklarına kadar","çıkıyor.","Ya suyun bulanıklığı... Mümkün değil"
"w","W-ED02A3A-2708-1563","ile ilgili tüm etkenleri ortaya","çıkararak","ortadan kaldırmaktır. Bu amacı gerçekleştirilmesi"
"w","W-UE36C0A-1679-462","ile ilgili on yıllardır karşımıza","çıkan","inkarcı söylem, devletten ve bu"
"w","W-JD30D1B-2221-888","ile ilgili olarak farklı sonuçlar","çıktığına","dikkat çeken parti kurmayları, BBP'nin"
"w","W-ND30D1B-2175-2145","ile ilgili gerçek nedenler ortaya","çıkacaktır.","-F tipi cezaevlerine sevk edilenler"
"w","W-IA16B3A-0602-285","ile iki arkadaşı, örgütün gazetesini","çıkarıyorlardı.","Gazetenin amacı direnişi yaymak ve"
