"Register","Text","Left","-5;5","Right"
"s","S-BEABXO-0068-36","sonra çıkacaksın dışarı. Çıkılısa öyle","çıkılacak","oğlum. Çıkılmazsa çıkılmayacak. Gündüz vakti"
"s","S-BEABXO-0323-363","sonra çok büyük birikimle askerden","çıkarsın.","Evet. Ee! zaten artık terörle"
"s","S-ADABIO-0437-1684","sonra teyzem dedi ki Ben","çıkarttım","attım onu. Neden dedim Çok"
"s","S-ADABII-0439-730","sonra siz ödeyeceksiniz dedi. Sistem","çıktığında","yani biz özel emeklilik ile"
"w","W-OA16B2A-1253-10","sonra sen de onların yanına","çıkacaksın.","Ama, daha önce yapmamız gereken"
"w","W-LE05A1B-3677-852","sonra oğlu Arthur Chester yola","çıkmıştı.","Eylül ortalarında ise Clayton-Kennedy ve"
"s","S-BEABXw-0057-274","sonra merdiveni var ya merdivenle","çıktık","Meltem, ben, Bilal, dutun altına"
"w","W-UG24D1B-2322-1075","sonra Madrid ve Zaragoza'da sahneye","çıkacak.","Pozuelo Escenica Festivali için 11"
"w","W-NC06A4A-1973-1410","sonra kireçtaşları da problem olmaktan","çıkabilir.","9) Baraj aks yerindeki kalın"
"w","W-LI37C4A-0635-450","sonra kagir bina yapılması yolunda","çıkarılan","padişah fermanlarına bile aldırış edilmemesi"
"s","S-AEAASO-0039-948","sonra işini bitirecek uykusunu alacak,","çıkacaktı.","O zamana kadar sabredebilseler idi"
"s","S-AEABTZ-0337-1445","sonra grafoz diye bir alet","çıktı.","Biz medeniyetin son kademelerine vardığımızı"
"s","S-BEABXO-0321-1961","Sonra geyik muhabbeti tabiri babamdan","çıkmış.","Tüm Türkiye'ye yayıl… yayıl… <gülme>"
"s","S-BEABXl-0008-1522","sonra geriye ne kalıyor? Trafiğe","çıkmak","kalıyor dimi? Bana öğret demiyon"
"s","S-ACABTZ-0336-1542","sonra evimize gidiyoruz. Yarın kanun","çıkıyor.","İhale çıkıyor. Yani bilhassa ben"
"s","S-ACABPZ-0329-272","sonra da emmı ses emm","çıkartma","aşamasından gelmeden önce iyi bir"
"s","S-BEABXO-0120-28","Sonra biz orda kiradaydık kiradan","çıktık","şeye dedesigilin evi vardı. Yukarda"
"s","S-ACAAFZ-0048-373","Sonra Birleşmiş Milletler bir karar","çıkarıyor","""İnsani Müdahale"" diyorlar oraya. Ve"
"s","S-BEABXd-0172-1940","sonra biraz ara merdivenlere kadar","çıktı,","orda biraz güya düşüyomuş gibi"
"w","W-SE20C0A-0238-120","sonra bir yılın altına düşecek.","Çıkınca","sen bize taktik verirsin artık."
"s","S-ADAABo-0367-17","sonra bir endüstriyel uygarlık ortaya","çıkmıştır,","modernleşme başlamıştır. Ve bu süre"
"w","W-KE39E1B-2839-1984","sonra bazı gazetelerde benzeri yazılar","çıktı.","Eğer internette dolaşma imkanına sahipseniz,"
"w","W-GE39C0A-0208-57","sonra baklayı ağzından çıkarıyordu. Hapisten","çıkınca","gazeteciliğe devam edecekti. Yapacağı yayınlarla"
"w","W-TG24D1B-2321-803","sonra Astoria Queens'e doğru yola","çıkan","Dito'nun hafızası, bu parçalarla doludur.15"
"s","S-ACABTZ-0336-67","sonra 150 ton atık ortaya","çıkıyor.","Ve emm bu emme zenginleştirme"
"w","W-NC06A4A-1973-729","sondajın ilerleme hızıyla sondaj takımından","çıkan","seslerle ve delikten çıkarılan çamurun"
"w","W-VI39C3A-0869-1432","sona kaydedildi. Kaydın birkaç kopyasını","çıkartmak","isteyen İstihbaratçılar çaresizdi. Ödünç bir"
"s","S-BEABXO-0345-1013","son... En sonda ne sonuç","çıkıyosa","sonuçların değerlendirilmesi ve geliştirilmesi. Tamam"
"s","S-ACABQq-0423-825","son, 6 Mart tarihli, ortaya","çıkmış","müşterek bir mutabakatı vardır ve"
"s","S-BEABXO-0452-1279","son sınav işte. Felsefeden fazla","çıkmıyo","ki. Felsefe şimdi değişti ya"
"w","W-KA16B5A-0098-1154","son romanımı da okumuş. ""Nereden","çıktı","bu polisiye sevdası?"" diye sormuştu."
"s","S-ADAB]o-0193-140","son olarak değinirsek maçta öne","çıkan","isimler hani Volkan ıslıklayan taraf"
"s","S-ACABQq-0422-1768","son derece olumlu yaklaşımlar ortaya","çıkmaya","başlamıştır. Çeşitli faktörlerin etkisiyle, Avrupa"
"s","S-ACABQq-0423-381","son derece karmaşık bir tablo","çıkardığını","ve insanları çok uzun yıllar"
"s","S-ACABQq-0421-1347","Son bayramda, Gelibolu ziyaretimizde ortaya","çıkan,","Sayın Başbakanımıza tarım destekleme primleri"
"s","S-BEABXp-0156-2090","solunda bu var, bunla beraber","çıkmış","bak böyle bi şey olmuş."
"w","W-VE30D1B-2092-1328","solcu gerilla Jose Mujica'nın zaferle","çıkması","bekleniyor. Rakipleri, Jose Mujica'nın seçimleri"
"s","S-BEABXO-0080-1376","sol ayağıyla bide. Keşke Fırat","çıksa","ya. Moruk o değil de"
"s","S-ADAB^Z-0370-587","sizin emm yeteneklerinizi ön plana","çıkarma","şansı verilicek. Hemen. Bunu hiç"
"w","W-NA16B2A-0051-1979","sizi görmeden galiba dağılmayacaklar. Padişah,","çıkacak","her olaydan İttihatçıların kendisini sorumlu"
"w","W-TD13C3A-0216-1331","siz muhalefet görevini beceremeyeceksiniz, sonra","çıkıp","""asker böyle dedi de ondan"
"w","W-JE05A2A-2610-948","siyasal hareketler olduğu tezine karşı","çıkmaya","çalışıyorum. Biz aynı zamanda ferdi"
"w","W-UI39C4A-2639-1473","sivilin açtığı ateş sonucu çatışma","çıkmıştır.","Bu olaylarda otuz kişinin yaralandığı"
"s","S-BEABX\-0065-210","sivilce şurda. Şurlarda hep sivilce","çıkıyo,","bi de şurda. Bunu ben"
"s","S-BEABX\-0065-1811","Sivilce olarak çıkmıyo hiçbi şey","çıkmıyo.","Onu anlamadım. O yüzden rahatsız"
"s","S-ACABPA-0434-1178","sivil, demokratik, kalıcı bir çözümle","çıkmanın","tek yolu, tansiyonu sürekli yükselten"
"w","W-LH09C2A-0276-2226","sitemler vardı. Ama ben yoldan","çıkmıştım","artık. Bunu amcam anlamıyordu. Dönecek"
"w","W-LE39E1B-3031-1675","sistemlerde, yeni organizasyon prensiplerinin ortaya","çıkmasıdır.","Dolayısıyla parçalarda olmayan özellikler, bu"
"s","S-ACABPA-0434-2252","sistemini yapıyorsunuz, en iyi yasayı","çıkarıyorsunuz,","fakat yanlış uyguladığınız için onda"
"s","S-ADABPZ-0112-1962","sistemindeki bi takım organların ses","çıkarma","faktörlerinin emm bunun yanı sırada"
"s","S-ACABPA-0434-1726","sisteminde de aynı durum ortaya","çıkmaktadır.","İşte şimdi Fransa, yeni bir"
"w","W-TA16B0A-0136-2086","sinyor reis, hadi artık huzura","çıkalım!","Sükût bazen konuşmaktan evladır. Horozlanmanın"
"w","W-HB04A4A-1981-674","sinyalin yanlış bir zamanda ortaya","çıktığını","göstermektedir. Esas felaket, bu sinyalin,"
"w","W-KA16B4A-0147-2180","sinirlerimi bozuyordu. Düşüncesi bile canımı","çıkarmaya","yetiyordu. Daha önce böyle işler"
"w","W-VD30D1B-2183-181","sinirlenen Fakıbaba, kameraların kapatılmasını istedi.","Çıkan","arbedede Fakıbaba, kameraman Ömer Pınar'ın"
"s","S-ADBBAo-0443-1706","sinirlendirme doğuruveririm arabanın içinde, nereden","çıktı","şimdi bu saçmalık diye sinirlendim."
"w","W-OF32D1B-2722-2046","sinerji yaratması gerektiğini de akıldan","çıkartmayacaklar.""","Tüketiciye yakın olmak Doğuş Grubu"
"s","S-BEABXw-0409-1534","sindirelim yemekleri. Daha sonra odaya","çıktık.","Dedim ben yarın yine 5'te"
"w","W-OG24D1B-3361-389","Sinan Üniversitesi, heykel müzesine sahip","çıkmamıştır.","Resim ve heykel müzesinin aidiyeti"
"w","W-TE36E1B-3295-1356","siluetinin bozulacağı gerekçesiyle projeye karşı","çıkıyor.","Geçen iki yılın en hararetli"
"w","W-OA16B1A-0103-1929","silip atabilir miydi seni?"" Sesim","çıkmıyor.","Söyleyemediklerimi duyuyormuş gibi, ""Çok safsın,"""
"s","S-BEABXX-0411-1637","silerler. Duymamıştım. Öyle bi şey","çıkıyo","ya süt içiyorum acaba ondan"
"s","S-ACABTZ-0336-1324","silahlara sahip İncirlik üstüne karşı","çıkarak","gösteriyordu. İstanbul 1968 öğrenci olayları"
"s","S-ACABTZ-0336-640","silahlara sahip İncirlik üstüne karşı","çıkarak","bir noktada nükleer enerji kullanımını"
"s","S-BEABXn-0352-602","Silah üretmiş işte. Böyle haberlere","çıkmış","işte o ara. 4.2 şiddetinde"
"s","S-BEABXn-0349-273","sigara içtiği yer işte. Ordan","çıktı","tamam mı bu çocuk. Ay!"
"s","S-BEABXO-0453-2160","sidir ayın muhtemelen gönül kırgınlığın","çıkmış","ama kalbin içinde de kalp"
"w","W-LD30D1B-2223-77","seçimlerinde sürpriz bir şekilde sandıktan","çıkan","Dışişleri Bakanı İsmail Cem'in birinci"
"w","W-VC29D1B-2437-2109","seçimleri akla dayandırmak adına ortaya","çıktığı","yorumunu yapmıştır. Londra Üniversitesi'nden bilişsel"
"w","W-HC05A2A-1772-449","seçim yöntemleri arasındaki teftiş gezimize","çıkarak","çoğunluğa saygı ilkesini sağlayıp sağlamadıklarını"
"s","S-ACABPA-0434-780","seçim sistemiyle ilgili bir reform","çıkabileceğinden","duyduğu kuşkuyu da belirtti. Biz"
"w","W-EE05A1B-3456-1134","seçim sistemine Adalet Partisi karşı","çıkmıştır.","Çünkü sistem küçük partiler için"
"w","W-HC05A2A-1772-914","seçim bölgesinden ab komitesi galip","çıkacaktır.","Burada seçim yöntemlerinin verdikleri sonuçlar"
"s","S-BEABXO-0080-1788","seçilmiş. Vay. Tabi lan o","çıktığı","sene Dünya'daki en iyi takım"
"s","S-AEABTZ-0040-1034","seçenekler bio kütle olarak karşınıza","çıkıyor.","Şimdi biraz kafanızı karıştırıcam. Şu"
"s","S-BEABXO-0080-2340","sezon ama bi türlü ortaya","çıkmayan","20.45 tek kutladıkları saçmalık o."
"w","W-EA16B3A-0490-1178","Seyt Eminof. Grevdeki işçiler işten","çıkarılmış.","""Kadınlar günü"" yürüyüşüne katılan kadın"
"s","S-BEABXO-0056-826","Seyhan'a fal bakmışlar çok güzel","çıkmış","falcı. Gazipaşa'da. Çarşıda. Kahve içiyorsun"
"w","W-CA16B3A-0735-2351","Seyfi saat ona doğru evden","çıktı.","Birinci katın merdivenlerinden inerken, koltuğunda"
"w","W-FF05A3A-2959-142","Seyahat acentalarında kadın çalışanların 36'lara","çıktığı","ve kadın çalışma oranının arttığı"
"w","W-OI41C4A-1312-992","sevkedemez. Hedefinin yoluna hiç kimsenin","çıkmasını","istemez ve buna aşırı dikkat"
"w","W-HE22C2A-0368-18","sevişiyorlar. Kız ""normal"" yaşamının içinden","çıkarak,","tam mimar olacakken, günü gününe"
"s","S-ADABIO-0437-1343","seviyorum. Tuvalet için o mu","çıkmış","onu alıp bir de inanıyorsunuz"
"s","S-BEABXO-0074-38","seviyorum böyle birden durmak birden","çıkıp","gitmek istiyorum. <D 4> Ayy"
"w","W-VH20C4A-4854-2040","sevindim. Yeni kitabını DÜŞÜN Yayınevinde","çıkarırız.","DÜŞÜN Yayınevi için dizgi makinesi"
"s","S-BEABXD-0446-444","sevgiliye dönmek ev tişötüyle dışarı","çıkmak","gibi rahat bildik ama özel"
"w","W-UI27D1B-3261-2230","sevgilisi Didem Uzel, ""Biz hakkımızda","çıkan","dedikodulara kulaklarımızı tıkarken siz bu"
"s","S-AEAASO-0039-2420","Sevgili Peygamber'imiz evde istirahatteler. Efendimiz'in","çıkmasını","beklemiyorlar. Dışarıda, evinin dışında, odanın"
"w","W-PI27D1B-2822-2014","sevgili kahramanının maceraları, Can Yayınları'ndan","çıkıyor.","İkinci favorimiz ""Pıtırcık""lar ""Pıtırcık""lar da"
"s","S-BEABX\-0065-2314","seversen? Gidiyon dün akşam bi","çıktık","aynı yer. Şurdan dolandık. Nerden,"
"w","W-WI45F1D-4817-1555","sevdiklerine kavuşmak için yürürken Sekiz","çıkageldi.","Bıçağı tık diye dayı'ya sapladı,"
"w","W-JE39E1B-2895-1820","seslerinin hissedilebildiği bir sırada ortaya","çıkan","bu aşırı yoğunlaşmanın başka bir"
"s","S-ADABCo-0242-1635","seslerini yükseltenler kendi lehlerine imkanlar","çıkartmaya","başladı. Federasyonumuza güveniyoruz ama sessizliğimizin"
"s","S-AEAASO-0039-513","sesleniyorlar dışarıdan, ""Ey Muhammet, dışarı","çık""","falan, işte ""bi şey danışıcaz"""
"w","W-ND39C4A-1760-1280","sesle, ""Grupta?.. Belki"" dedim. Ses","çıkarmadı.","Bendeki izlenim şu Vaziyete göre"
"w","W-PA16B4A-0291-182","sesimle beraber sıkıntım da benden","çıkıp","uzayın derinliklerinde kayboluyordu. Bazen de"
"w","W-OE30D1B-2105-959","ses yok. Yargısız infazlar ayyuka","çıktı","Seyid'in masumiyetine kefil olan Müslüman"
"w","W-TF10A1A-1830-1671","sermaye-yoğun biçimin kullanılma olanağını ortaya","çıkarır.","Bu tür üretim tekniği genellikle"
"w","W-JH42A2A-0870-1893","sergilenirse, elbetteki buna öncelikle karşı","çıkılacaktır.","O halde, ""ahlaksızlık ve zulüm"
"w","W-QD30D1B-2202-1594","serbest kalan Mustafa Bayram'a sahip","çıktı.","CHP ve Deniz Baykal'ın bu"
"s","S-AEABTZ-0040-2461","sera gazı artışı 65 grama","çıkıyor.","Yani ithal ederseniz başka ülkelerden"
"s","S-BEABXR-0010-2056","Senin dudağın da uçuk mu","çıktı?","Nerde? Burda. Sanki uçuk çıkmış."
"w","W-KA16B2A-1335-1527","seni!"" yumruğu atıp, babasıyla beraber","çıkmıştı","evden. Artık, çok şükür, kurtarma"
"s","S-ADBBAo-0443-1337","seni hamile bıraktı ""ibo"" deyince","çıkıyordum","ortaya ben. Yine böyle bıyık"
"s","S-BEABXO-0347-988","Seni gidi seni! Bi de","çıkarmış","şeyini bak. Surdan çıkarmışsın, izi"
"s","S-ADABCo-0194-249","Senger ""Cumhuriyet yok edicileri kürsüye","çıkıyor""","diye bağırdı. Öğrenciyi yakalıyan polis"
"s","S-ACABTZ-0336-61","senelik ihtiyacı olan madeni burdan","çıkaracaz,","öğütecez, işliyecez. Fabrikasını yapacaz. Reaktörü"
"s","S-BEABXn-0067-707","senedir gidip gelicez. İnsanın işi","çıkıyo,","yorgun oluyo, canı istemiyo. Oğlum"
"s","S-BEABXO-0136-2311","sene öyle demiyodun; böyle batıyorum","çıkıyorum","falan diyodun. Sana bişey söylicem"
"w","W-OA16B3A-0409-2003","senden daha sıcağım, kahırdan ateşim","çıktı,","hastayım... Otelde miyiz? Heyet otele"
"w","W-DA16B1A-1504-2129","sende var, yazarsan... Kapıdan tam","çıkacakken,","Cumali, diyorum. Cumali... Beni öldürür"
"s","S-BEABXT-0066-1793","sen şimdi bakıyorum çocuk sınavdan","çıktı","böyle biraz mıyıkladı iyi falan"
"s","S-BEABXB-0003-23","Sen onları yazıp kâğıda mı","çıkaryosun","flaşla mı veryosun? Bununla veriyosun."
"s","S-AAABOp-0011-6","Sen ne diyon. Ben dışarı","çıkmıyodum","yağmur yağarken. <D 1624> <Gülme>"
"w","W-SA16B1A-0914-1146","Sen benim kardaşımsın. Sınırlarından hiç","çıkmamamız","gereken o her yanı tezek"
"s","S-ADABCo-0271-970","sen bana karışamazsın diyerek karşı","çıktı.","Rektörlüğe taşınan olay sırasında Profesör"
"s","S-ACABFZ-0049-415","Sempatizanları"" ve en son olarak","çıkan","""Kumarhane Kapitalizmi"". Atatürkçü düşüncenin ve"
"s","S-BEABXw-0353-944","Selim beyi dedim benim dedim","çıkarttın","da dedim bana yönlendirdin dedim."
"w","W-KE39C2A-2617-2417","sebat gösterecektim. Kendiliğimden, mecbur olmadıkça","çıkmak,","geri çekilmek, Deyrizor gibi burasını"
"w","W-HC06A2A-1975-1518","sağlamakta ve işin tarafları arasında","çıkabilecek","anlaşmazlıkları en aza indirmektedir. Uygulama"
"s","S-BEABXg-0072-2320","sağlam durdurur adamı. Kasların tam","çıkmasa","da iyi yani. Yaa evin"
"w","W-JH03A1B-3121-1353","sağda da daha sonraları ortaya","çıkacaktır.","Hukuksal veya şekli meşruluk olarak"
"s","S-ADBBI^-0042-1194","sağ bacağımda bir ağrı ortaya","çıktı.","Yaz yaklaşıyordu. Ben gene Türkiye'ye"
"s","S-BEABXB-0077-2423","Saçımı çekme. Canım dökülmüş dışa","çıkıyodu.","<B> Dökülmüş değil o. Çıkmış."
"w","W-IA16B3A-0602-2470","saçımda gezdirirken... Bu sözcükleri yazarken","çıkan","sesler. ""Ezra Pound mu okuyorsunuz?"""
"s","S-BEABXu-0435-1191","sayıyo resmen ya bi koz","çıktı","üç goz kaldı beş oldu"
"w","W-MF25D1B-2141-2022","sayısının 2020 yılında 1 milyara","çıkacağını","hesaplayan uzmanlar, yaşlanan dünya nüfusunun"
"w","W-CA16B3A-0140-1737","sayısı, on bir yıl önce","çıkmış","bir fotoromanın eski sayılarından biri"
"w","W-FA14B1A-2669-474","sayısı Skettin polisinin... YARGIÇ Nereden","çıktı","o gazete şimdi? DİMİTROF (Sakin,"
"s","S-ADABCo-0283-493","sayısı günde onbeşken iki misline","çıktı.","Hattı arayan her iki kadından"
"s","S-ADABPZ-0374-406","sayısı emm... misyoner sayısı yüzseksene","çıkmış","yerli görevli sayıları binleri bulmuş,"
"w","W-IF10A2A-1880-420","sayısı 68 binden 265 bine","çıkmıştır.","Türk turizminin önündeki darboğaz tesis"
"w","W-SD02A2A-1391-562","sayının 260'ı bulduğu görülmektedir. 1911'de","çıkardığı","""Türk Yurdu"" adlı dergisinden başka,"
"s","S-ACABQq-0423-1103","Sayın Öymen. İstediğiniz anda kürsüye","çıkma","hakkı veremem size, kusura bakmayın,"
"s","S-ADABCo-0178-195","Sayın seyirciler bisikletle dünya turuna","çıkmışlardı","ama Ordu'ya geldiklerinde odunla dayak"
"w","W-TF10E1B-2871-2031","sayımızı 2 binden 4 bine","çıkararak,","yüzde 100 oranında büyüdük. Bu"
"w","W-OA16B3A-0409-980","sayılır orada hocam. Beyoğlu'na bir","çıkayım,","Sanatkârlar Kıraathane'sine bir gideyim izniniz"
"s","S-BEABXO-0389-1629","sayı elinde kalır. He. Şunun","çıkmış.","Tamam. Tamam. Bi taş atın."
"w","W-JE39A3A-2945-958","saygınlık kazandıran bu gerçek akıldan","çıkarılmamalıdır.","Halkla İlişkiler'in bir başka ilkesi"
"w","W-WI44F1D-4753-2296","sayfa aralarından deste deste para","çıkıyor","bir destede yabancı para hatta"
"w","W-EG03A1B-3186-1123","sayesinde, bu ülkelerin tiyatroları seviyesinde","çıkarılır","ve en önemli bir eğitim"
"w","W-EC06E1B-3077-1698","sayesinde gizil kalmış olanakları bulup","çıkartmak","ve bu yolla dünyayı değiştirmektir."
"w","W-OF25D1B-2143-1841","sayan ve istenildiği anda işten","çıkarılmalarını","sağlayacak olan sözleşmeleri birçok müfettiş"
"s","S-ACABPA-0434-671","sayan bir başka hükümet herhalde","çıkamazdı.","Ayrıca bu hükümet, yalnızca iktidarı"
"s","S-BEABXO-0345-763","say. <gülerek> Bu iki maddeyi","çıkartalım","mı? Hangisi? Çıkartalım. Çıkart. Şunlar"
"w","W-QE39C3A-0328-2434","savunma girişimleri arasında Mazlumder'e sahip","çıkmakla","kalmaz, yıllık raporlarında, ""okullarda ve"
"s","S-ADABCo-0361-1851","Savaşı'nın çıktığı nedenler ve ortaya","çıkardığı","sonuçlar biraz da insanlığın artık"
"w","W-QI22C1A-0532-2391","savaşçılarıyız biz. Sevdamızın karşısına ne","çıkarsa,","kim çıkarsa devirip yürümeye devam"
"s","S-AEABPZ-0331-1198","savaşlar, sanayileşme ve Dünya'da ortaya","çıkan","sanayi devriminden itibaren bugüne kadar"
"s","S-ACABQq-0420-1755","Satış, Hibe, Devir ve Elden","Çıkarılması;","Diğer Devletler Adına Yurt Dışı"
"s","S-ACABQq-0420-308","satış, hibe, devir ve elden","çıkarılması;","diğer devletler adına yurt dişi"
"s","S-ACABQq-0420-797","Satış, Hibe, Devir ve Elden","Çıkarılması;","Diğer Devletler Adına Yurt Dışı"
"w","W-KF25D1B-2781-2404","satış fiyatı 154 bin liraya","çıkarıldı.","Yeni düzenlemeyle bir kilogramlık küp"
"s","S-ADBBI^-0326-1303","Satış benden olduğu için ses","çıkartmıyordu.","Ama güzel şeyler yapardık. O"
"w","W-HE39C4A-1039-2186","satın alma bedeli de ortaya","çıkınca,","Özer U. Çiller açıklama yapmak"
"w","W-SA16B2A-0738-1250","satılmak üzere ait olduğu topraklardan","çıkarılmış,","yurt dışına kaçırılıyor. Ama bu"
"w","W-SI27D1B-2465-1276","satıldığı tribüne dalınca büyük panik","çıktı.","Boğa tribündeki yedi kişinin yaralanmasına"
"w","W-TE36E1B-3355-1152","Satrapi'nin kendi hayat hikâyesinden yola","çıkarak","yarattığı çift ciltlik otobiyografik çizgi"
"w","W-WI44F1D-4749-257","sarılıyor ve dersten ağlayarak zorla","çıkarıyorduk","servise kadar eşlik ediyordu bize"
"s","S-BEABXl-0008-989","sarkyor, fermuar kapanmamış, boxer dışarı","çıkmış...","Rezillik rezillik. Yol da gidyoruz"
"s","S-BEABXs-0130-2303","sardı Ulaş abi baktı dişli","çıktı","Güvenç abiye sardı Güvenç abi"
"s","S-ADAACo-0205-2385","Saraç gelecek yıl da denizden","çıkacak","bir Atatürk figürü hazırlicağını söyledi."
"w","W-NA16B4A-0519-516","sarayın emniyetli havasından fazla çıkmamış,","çıktığı","zaman da daima çevresinde, en"
"w","W-VC06A1B-4115-910","saptanmıştır. Java 1995 yılında ortaya","çıkmış","yeni bir programlama dilidir. Java"
"s","S-ADBBAo-0443-333","sanıyorduk. Fakat İbrahim Bey, ""kesinlikle","çıkamaz,","çıkarsa kıyameti koparırım"" demiş. O"
"s","S-AEABUZ-0022-2212","sanıyor Meri Jane'nin karşısına. Tesadüfen","çık","çakı gibi bizim deniz subaylarımız"
"s","S-ACABTZ-0336-2317","sanırım buradan çok olumlu şeyler","çıkacak.","Ama bu kürsüler herkese açık."
"w","W-VI45F1D-4801-1695","sanırım Avrupa Birliğine de karşı","çıkıyor.","""Muhafazakâr anarşizm"" diyebileceğimiz bir çizgiye"
"s","S-ACABTZ-0336-1976","santralin herhangi bir temizlik işleminden","çıkan","atıklardan tutun da emm yakıttan"
"s","S-ACABQq-0422-2453","sanayi kenti olmuş. Zonguldak'ın beyninden","çıkan","5 milletvekili, özellikle iktidar partisi"
"s","S-ADABCo-0335-2358","sanatçılar vardır. Ve bunlar <B>","çıkarmışlardır.<B>","çıkarmışlardır.<B> gibi. Ama bütün bunların"
"s","S-ADABPZ-0135-439","sanat ve edebiyat alanında ortaya","çıkan","pek çok kuramda post takısının"
"w","W-UG03A2A-2009-613","Sanat Galerisi'nden bir gün batışı","çıkıyorum.","Serginin son günü. Tarlalarda uzar"
"w","W-MG03A4A-1036-1618","sanat da bir güç olmaktan","çıkıp,","yozlaşacaktır. II. dönem olarak adlandırılan"
"s","S-BEABXW-0069-340","sana 7.00, 7.30 diye. Babam","çıktı","ondan sonra Mali aradı. Mali"
"w","W-RH03A1B-2403-1854","salt bir fiziksel gerçeklik olmaktan","çıkarak,","insani durumları yaşayan tinsel bir"
"w","W-HA16B2A-1293-480","salondan. Yavaş yavaş ferdileşen yürüyüşlere","çıkmaya","başladı. Hayatı öylesine özlemişti ki."
"w","W-QA16B3A-1131-2324","sallanıyor, kendi kendine mırıldanırken istavroz","çıkarıyordu.","Kimse konuşmaya, sormaya, söylemeye cesaret"
"w","W-KA16B1A-0722-322","salkım söğüdün gölgesine oturdu. Heybesinden","çıkardığı","azığından yedi, derenin suyundan kana"
"s","S-BEABXO-0444-1692","Salak. Bence de. İzzet'ten ses","çıkmadı","ha. Gerizekalı. Tamam yazarım Elif"
"w","W-JA16B3A-1133-2458","saklı sırları bir bir ortaya","çıkartırdı.","Gözlerinin tılsımı diline vurduğundan, bir"
"w","W-PA16B4A-0162-639","saklayamaz, yüzünden belli olur. ""Nereden","çıktı","şimdi,"" diye sordum. ""Hadi bana"
"w","W-VI19E1A-4019-2318","Saklanır beklersin ağacın arkasında; Ses","çıkarmaz,","Kımıldamaz. Kuş bazen çabuk gelir,"
"s","S-BEABXd-0172-2205","saklandı ondan sora şey kadın","çıktı","artık, umudu kesti. Kadın heralde"
"w","W-WI45F1D-4817-2479","sakladığı MAGNUM MINI paketini ortaya","çıkarttı","dostlar, valla helal olsun dedim,"
"s","S-ADABCo-0289-476","sahte ilaç ticareti 6'dan %14'e","çıkarak","75 milyar dolara ulaştı. Türkiye'de"
"s","S-BEABXO-0431-2045","sahip çıkıyomuş şeylerine. Onlar sahip","çıkmak","olarak değil de barbarlık olarak"
"w","W-TE39C4A-0359-1867","sahip çıktınız. Bundan sonra da","çıkacağınızı","biliyorum. Bu mutlu ve çok"
"w","W-MD39C2A-1315-205","sahip çıkamayan ulusların, diline sahip","çıkması","mümkün değildir. Ahfeş'in Keçileri.... Ahfeş,"
"w","W-SE05A1B-4206-2172","sahip ve bu kültürün ortaya","çıkardığı","aktivitelerin toplumsal kontrolü için mücadele"
"w","W-QH03A1B-2400-1510","sahip olduğu ve onun tadım","çıkardığı","gerçekliktir... Devlette özgürlük nesneleşir ve"
"w","W-II13C2A-1288-89","sahici derslerden birini, bir sanatçı","çıkarmıştı.","O yıllarda iyiden iyiye ünlenmiş,"
"w","W-XI45A1D-4790-1545","sahibi tesadüfen Türk bir hanımefendi","çıktı.","Telefonda konuştuk, güvendim. Depozito çeki"
"s","S-ACAAQq-0419-167","sahibi olmak, halkı refaha yönlendirmek","çıkmıştır.","Kardeş Türk Halkının Büyük Meclisi"
"w","W-LI31D1B-2325-1629","sahasında oynayacağı maça tam kadro","çıkmaya","hazırlanıyor. Teknik Direktör Karol Pecze,"
"w","W-TG24D1B-2310-28","sadık kalmam."" Köran, defterlerinden yola","çıkarak","eser üretirken aslında bir anlamda"
"s","S-ACABPA-0434-1819","sadece üniformalı kesimin durumdan vazife","çıkarmasına","bakmamamız lazım. Burada konuşulmayan hususlardan"
"w","W-VD05A1A-2035-1360","sadece teftişi eleştirerek kendimizi temize","çıkaracak","bir camia değiliz, bu mesleğin"
"w","W-KE05A1B-3621-1099","sadece koşullu bir yakınlaşma ortaya","çıkmaktadır.","Yani kişi-başına reel gelir düzeylerinin"
"s","S-BEABXO-0339-974","Sadece denize giriyorsun. Akşamları sahile","çıkıyorsunuz.","Geziyosunuz. Ee! tabi dolaşaceğiz. Ben"
"s","S-BEABXc-0167-1174","sadece böle kaldı. Kaldı, sesi","çıkmadı","Sesi çıkmadı. Bi de bana"
"s","S-AEABTZ-0337-178","sadece 40 yılda 6 milyara","çıktı.","Ne demek bu? Tabi bir"
"s","S-AEABI^-0330-2336","Sabancı Lisesi'ndeyim. Bir gün koridora","çıkmış","müdür yardımcısının biri elinde bir"
"w","W-VA16B3A-2629-668","Sabahtan beri yaşadıklarına ilişkin aklından","çıkartamadığı","yığınla detay, bir korku panayırına"
"s","S-BEABXO-0064-2069","Sabah mı geldin? Hıı. Kaçta","çıktınız","ordan şeyden yola? Emm... 9"
"w","W-HD39C2A-0420-985","sabah da avluda volta atmağa","çık.","Bugün Mayıs'ın 21'i sevgili arkadaşlar,"
"w","W-RI09C3A-0837-1825","sabah da altıdan sonra evden","çıktığı.","Sırf dershanenin öğrencileri başarılı olsun"
"s","S-AEABAo-0020-1487","sabah canlı yayına daha iyi","çıkmak","için cildime bu maddeyi yapıyorum."
"s","S-ACABQq-0423-21","saatten sonra, referandum sürecine karşı","çıkmak,","Türkiye'yi uluslararası kamuoyunda son derece"
"w","W-OE09C2A-0411-152","saatte sorgu olmadığı için dışarı","çıkacağım","diye umutlanmıştım. Polis önden bir-iki"
"w","W-RB04A3A-1997-1","saatte (x) kg kurutulmuş pigment","çıktığını","düşünelim. Kurutucuda kuru madde denkliğini"
