"Register","Text","Left","-5;5","Right"
"s","S-ACABQq-0421-1369","saygıyla selamlıyorum. Teşekkür ederiz Sayın","Bakan.","Sayın milletvekilleri, bugün 3 gündemdışı"
"w","W-NA14B1A-1624-1309","saygılı olmalıydınız."" Bir an Hernandez'le","bakıştık,","bu adam böyle neler söylüyordu?"
"s","S-ACABQq-0423-2026","saygılar sunuyorum. Teşekkür ediyorum Sayın","Bakan.","Sayın milletvekilleri, Hükümet adına, Dışişleri"
"s","S-ACABQq-0423-2399","Savunma Bakanının, Dışişleri Bakanının, başka","bakanların","üye olduğunu biliyoruz ve şunu"
"w","W-PA16B4A-0162-24","satılıktı, isterseniz bir de oraya","bakın...""","""Sağol bakarız,"" dedi Fuat. Gülerek"
"s","S-ACAAQq-0424-2294","satılmaktadır. Bence, öncelikle, buraya da","bakmak","gerekir fazla uzağa gitmeden. Değerli"
"s","S-ACABQq-0429-1032","sataşmaya! Sayın Meclis Başkanını, buradaki","bakanın","vekili, burada, İçtüzüğü rafa kaldırıyor."
"s","S-BEABXO-0444-154","sarışın ya... <gülme> Bakar tabi","bakar.","Nedir bu sarışın hayranlığı sende"
"w","W-QI42E1B-2939-1383","sarılıp uyuduklarını, yüzüme yabancıymışım gibi","bakarlar.","Hele de bolluğa düşmeyiversinler, dünyayı"
"w","W-OF10A2A-1787-2050","sarf etmeyişinde yatmaktadır. Bu açıdan","bakıldığında","Ar-Ge departmanlarının hayati bir önem"
"s","S-ADBBAo-0443-2178","sapa gelmez bir şeyler yaşamadım.","Bakalım","daha programın sonuna gelmedik belli"
"w","W-NA16B0A-1683-2179","sanıyorsunuz?"" demiştim. ""Siz benim bacağıma","bakabilirsiniz","örneğin."" Verdiği söylevin içeriğiyle kendi"
"s","S-BEABXO-0392-2405","Sanırım çekiyor. Memo atacaksan at","bak","üçüncü hah! Suzan çeksene o"
"w","W-EA16B2A-1563-2026","sanır, ama hiçbir şey düşünmez.","Bak","şimdi yan taraftaki masada oyun"
"s","S-AEABTZ-0040-2094","santral yapmalı mı, yapmamalı mı?","bakın","bu tercih hem ekonomik hem"
"w","W-PI41C1A-1421-262","santral mesajı ""Eğer ÖSS sonucuna","bakacaksan","ek olarak 1 milyon lira"
"s","S-AEABTZ-0040-821","santral emm macerasının geçmişine bir","bakalım.","76 yılında Akkuyu için yer"
"s","S-BEABXO-0007-2159","sanki öyle. Ben tek iyi","bakmadım.","Şey benim benim benim derdim"
"w","W-PI09C4A-1491-1640","sanki içlerinden ""Herif iyice korkmuş.","Bak","daha beteri olmadı diye Allaha"
"w","W-PA16B4A-0291-1270","sanki inadına, ortaokul öğrencisi gibi","bakıyordu.","Üzerinde beyaz fanila vardı. Vücuduna"
"s","S-BEABXO-0444-217","sanki dimi bi ara. Hani","bakmayınca","artık. Bi baksanız gerçekten tanıdığınızı"
"w","W-NA16B2A-0051-2421","sanki bir şey söyleyecekmiş gibi","baktı","Hikmet Bey'e, sonra o ruhani"
"w","W-NA16B1A-0858-1240","sandığın üzerine oturmuş, konuşmadan bize","bakıyordu.","Bu savaşta biz ne karar"
"w","W-LD02A4A-0537-48","sandığı yerlere bakacaktır; ve nereye","bakılırsa","bakılsın, bu yapı, kendisini okumayı"
"w","W-GE05A2A-1075-89","sanayileşmedeki rolüne emek süreçleri açısından","bakarken","""baskıcı bürokratik fabrika rejimi"" kavramını"
"w","W-PI31D1B-2329-1800","sanayi ve ticaret odası veya","Bakanlar","Kurulu. Hepsi trilyonluk işlerini bırakmışlar,"
"s","S-ADABLp-0061-1408","Sanayi dersin, liman dersin. Yani","bakın","şunu söylemek istiyorum. Diğerlerini bitirim"
"s","S-ACAAPZ-0028-694","sanatı çok seviyorlar. Eğer tarihimize","bakarsanız","bundan 2000 yıl önce yapılan"
"s","S-AEABUZ-0021-580","sanatçısı. Özellikle yerli dizi filmlere","bakın.","Dikkat ettiyseniz mesela bakıyorsunuz Özcan"
"w","W-RE30D1B-2121-2003","Sana'daki Türk okulunu ziyaret etti.","Bakan","Gül, ziyareti sırasında yetkililer tarafından"
"w","W-IA15B3A-0555-495","sana ne yahu? Kendi işine","baksana.","O, onun sorunu. Bak, nasıl"
"s","S-BEABXc-0167-2371","Sana kurşun kalem de getirdim.","Bak","her istedini yapıorum senin, kıymetini"
"s","S-BEABXO-0002-1486","Sana imzalatmaya getirmiştim. Nilay inceliyordu.","""Bakın","bakın ne yazmış"" dedi. Öğretmen..."
"s","S-BEABXO-0080-1833","sana hemen buluyorum. Tamam bak","bakalım.","<D 15> <B> almış lan"
"s","S-BEABXO-0093-1097","sana gösterecem, öğretecem. Hadi otur","bakalım.","Anlatmışlar burada. Bunlar nedir? Bak"
"s","S-BEABXO-0344-1448","sana diğcektik aslında gir bi","bak","diye. Ama sonra göremezsin diye"
"s","S-BEABXw-0408-38","Sana bi şey diyim mi","bak?","Birkaç sana ben kitap önereyim."
"s","S-BEABXO-0086-2239","sana bakıyım yeter. Tamam dostum","bak.","<B> Senin o güzel yüzünü"
"s","S-ADABLp-0062-493","saman. Dış koşullardan etkilenir. Burda","bakın","Türkiyede en yaygın olan budur."
"w","W-JA16B4A-1747-2446","sallıyor Çıt. ""Kalmayacağım, şöyle bir","baktım!""","İhtiyar, Çıt'ın kaslı omuzlarına, gençlik"
"w","W-OG37E1B-2922-565","sallayarak yaşlı bir adamın yüzüne","bakan-","bir prenses görmüş olabileceğini düşündüm"
"s","S-BEABXE-0082-2296","sallandırmadan böyle yakınlaştır. <D 3.08>","Bak","kameranın mesela gece özelliği var."
"w","W-CA16B1A-1286-1109","sallanan tüller, ağustos böcekleri, ona","bakıyorum,","söylediği o dönüşsüz yerde şimdi,"
"w","W-UA16B1A-3338-1191","salladı. ""Bu bir domates. Tadına","baksana.""","Ada, domatesten bir ısırık aldı."
"w","W-RA16B3A-0257-1882","saldırıyorlar ya... Gözlerini kısıp masadakilere","bakmadan","çelik gibi bir sesle sordu"
"s","S-BEABXu-0435-2126","salak bi kızım. Şu ele","bak","ele. Abarii! Ya çok iyi"
"s","S-BEABXl-0008-2096","Sakız. Yara bandı. <Gülme> Sakız.","Bağarmadan","oğlum bağarmadan. Yok lazım değil"
"w","W-LA16B0A-0287-592","saklı sanki... ZTteSQ, Alice'in nabzına","bakar","gibi tutuyor bileklerini, kendi bileğinde"
"w","W-KA16B1A-0546-470","saklı kalmış tecellisi de burada.","Bak","şöyle arzı izah edeyim. Şimdi,"
"s","S-BEABXO-0449-2161","Sakin. Ama Yasemin şunun kafasına","bak.","Bakma onlara şimdi bakma. Hayır,"
"s","S-BEABXO-0389-1741","sakat yerde. Çifte değil mi?","Bak","burası gelse zaten bu buraya"
"w","W-KA16B4A-0121-1873","sakalı karmakarış olmuş, hiçbir yere","bakmayan","anlamsız gözlerinden bir şey anlamanın"
"w","W-QD36E1B-2841-1402","sahtekâr gibi bakar. Aslında ona","bakılırsa","doğrusunu yapan da kendisidir; eline"
"s","S-BEABXO-0347-552","sahnesi, yok... Dört tane zaten.","Bak","burayı Eylül hiç şey yapmıyorum."
"w","W-OD02A2A-1413-1469","sahip olmasıdır. TOPLUM İnsanlık tarihine","baktığımızda","insanların hem karşılıklı gereksinimlerini gidermek"
"s","S-ACABFZ-0049-491","sahip olmadığı görülmüştür. Mazlum milletlere","baktığımız","zaman ise onların gerçekten de"
"w","W-MG37C4A-1285-527","saflığı olduğu, zamanın bugünkü noktasından","bakıldığında","daha iyi anlaşılıyor. Ismarlama özgürlüğün"
"w","W-UA14B1A-1597-2277","SADIK (Çobanın ensesinden tutar) Gel","bakayım.","ÇOBAN Ne var kurban? MUHTAR"
"s","S-BEABXw-0409-112","Sadede gel. Ne konuşcam, şimdi","bak.","Gürsel'imdeki geçen yıldan bu yıla"
"w","W-DA14B1A-1672-1049","sadece o, göz ucuyla ikimize","bakardı.","Burada... Ya da dönme dolaptâ;"
"w","W-LH09C2A-0276-1300","Sadece içkimi içiyordum. Her sayfaya","baktığımda,","""Acaba annem gördü mü? Bu"
"w","W-RA16B2A-0406-418","sadece ikimiz ve bize endişeyle","bakan","Serdar kalmıştık. Dide öfke dolu"
"w","W-SE36E1B-3294-25","Sadece ""İyi ki hep umutlu","bakmışım","ileriye"" diyebilirim. Edebiyat üzerinden hesaplaşmak"
"w","W-KE39E1B-3300-1071","Saddam rejimine, geçmişin kalıntılarını eşeleyerek","bakmak","gerekiyor. Hüseyin'in henüz Saddam olmadığı"
"w","W-KA16B4A-0712-960","Sabri. İçi rahatlamıştı. Isınmıştı. ""İşe","bak","sen!"" diye söylendi irikıyım olan."
"s","S-BEABXO-0091-2340","sabah oldu işte haberlere bakarken","baktım","2-2 kalmış. Son dakkada yediler"
"s","S-BEABXO-0012-2435","sabah akşam yakalım. Anne dedi","bak,","bir ayda bitti. <B> Bi"
"w","W-MA16B1A-0730-39","Saatlerdir uğraştım, söz dinletemedim. Uzaktan","baktım,","sizinle iki dakika konuştu, gidip"
"w","W-TH32D1B-2487-134","saatlerde ayrıldılar. Buddy son kez","baktı","Ege'ye her şey için teşekkür"
"w","W-PA16B4A-0162-1556","saat tamir ediyordu. Gözlüklerinin üstünden","bakıp","bizi görünce elindekileri bırakıp ayağa"
"w","W-TE09C2A-1267-1373","saat sekiz-dokuz arası gelip işarete","bakacağız","ve her şey yolunda anlamında"
"w","W-DA16B2A-1719-2090","saat geçtiğini sanıyordum. Kulübeden çıkıp","baktığımda,","çoktan iş işten geçmişti. Düşman"
"s","S-ACABTZ-0336-578","sa emm çalıştırılan nükleer santralardan","bakın","12.000-13.000 yıla yakın reaktör yıl"
"w","W-DF10A3A-1844-1928","Rumeli ve Anadolu kentlerinde muhtesiplerin","baktıkları","işlerin bütünü ""ihtisap Nazırı"" denilen"
"w","W-SA16B2A-1070-216","Rukiye çocuğu yanına çağırdı. ""Gel","bakayım","Abdullah."" Abdullah, iyice esmer kadına"
"w","W-RA16B3A-0257-626","Ruh fahişesi de olacaksın. Haa,","bak,","bu pazarda müşteri olmak da"
"s","S-BEABXO-0440-970","Robinyo ya pide gibi adam","baksana.","Ronaldinyo gitmiş mi lan Madrid'e"
"s","S-AEABI^-0330-2311","riyakat denen olaya hiç kimse","bakmıyor.","Riyakati olan insan idarecilik yapabilir."
"w","W-TI44F1D-5102-988","ribaundlara asılsın, biraz da sert","baksın","ya, kedi gibi saf bakıyo"
"s","S-BEABXu-0435-1213","rezil etmesin dedim ben. Haydi","bakalım","gece on ikiden sonraki muhabbetlere"
"w","W-NA16B4A-0431-2164","Reyhan teyzem olsa. Sonra saatine","baktı,","yerinde huzursuzca kıpırdadı. Gitmem gerek."
"w","W-NF25D1B-2157-1260","Resmi Gazete'nin dünkü mükerrer sayısında,","Bakanlar","Kurulu'nun kamu personelinin maaşlarının hesabına"
"w","W-FH09C1A-0807-2121","resim. Yeniyetme yaşlarındaki Hetzer; resme","bakan","gözlerini kapatır, tanıyıp tanımadığını tam"
"w","W-MA16B3A-0655-2036","renkli ışıkların yansıları arasından kendine","baksa...","Edinilmiş bilgilerle kurduğu bu düşünce"
"s","S-BEABXO-0056-2350","renk? Ne renk mi? Hiç","bakmadım.","Bergüzar Korel'inki pembeymiş. Pembe mi?"
"w","W-OI22E1B-2908-286","rengin.' Kelaynak hindiye şöyle bir","bakmış,","Ey sahtekâr demiş, utanmaz mısın?"
"w","W-HF10A2A-1876-1745","REFORM GEREĞİ Yukarıdaki çerçeve içinde","bakıldığında","kamu açıklarının Türkiye'nin ekonomik istikrarını"
"w","W-MH13C2A-1091-1726","reddetmek, olaylara günün retoriği çerçevesinde","bakan","birisi için kolay görünebilir; fakat"
"w","W-OD03A4A-0253-430","Recep olarak hatırladığım vardiya başına","baktı.","O, ""Koyuyorlar hocam, memnunuz!"" dedi."
"s","S-ADABPZ-0112-2033","reaksiyonu ve o sese sıcak","bakması.","Şimdi işitme kaybı olan bebek"
"w","W-TD43A2A-1811-2206","rağmen yapılıyor. Şiddete kurbanı açısından","baktığımızda","da şiddet hep yaşama hakkının"
"w","W-QB38E1B-2882-526","rastlıyoruz. İzlerin başladığı yere dikkatle","baktığımızda","hayretler içinde kalıyoruz. Çünkü kumlar"
"w","W-QA16B2A-1435-2498","Rakısından bir yudum alır, ""Verin","bakalım","reyinizi, size müstahaktır,"" diye mırıldanır."
"w","W-LH09C2A-0276-412","rakı alemi yaptım sormayın"" diyene","bakıyorum.","""Ne zaman lan?"" dediğimde çıkıp"
"s","S-ACABTZ-0336-728","rakamlar üzerinden gerçekleştiriliyor. Ve sayın","bakan","diyor ki işte 253 milyar"
"w","W-UE30D1B-2135-1082","Rajuthevar Baalu gibi birçok önemli","bakan","ve bürokrat ile görüştü. 5"
"w","W-LE39C4A-0571-2301","rahatsız. Ancak, rahatsız olan sadece","bakan","mı? Başesgioğlu'nun ""şu sözleri"" çok"
"w","W-MA16B4A-0772-1375","rahat bırakmazlar ki... O beklese,","bakalım","elin oğlu bekler mi? Mehmet'i"
"w","W-FA16B3A-0986-1615","PÜSSS... Bizim Büyük Oğlan, Vahdet,","Bak","Ne Yapmış? ""Sisi, Yunanistan Dışişleri"
"w","W-OF39C2A-1412-2223","puan ile ödüllendirmektedir. Buraya kadar","bakıldığında,","herhangi bir sorun görülmemektedir. Ancak,"
"s","S-BEABXT-0066-966","puan değil. Bu sen şimdi","bakıyorum","çocuk sınavdan çıktı böyle biraz"
"w","W-JE39E1B-2838-2238","psişik bir varlık olan insana","baktığımızda","meselenin böylesi bir izahla geçiştirilmesi"
"s","S-BEABXO-0091-2381","provaya çağırdı bugün. Lan cekete","baktım.","Dedim gitti paralar. Valla? Baban"
"s","S-ADABI\-0438-1435","Promosyonlardan hangilerini gördünüz? Can bebeninkine","baktım","çok nadir kullanıyorum. Can bebe"
"s","S-ADABI\-0438-2252","promosyon var. Girişte sol reyona","bakmadım","işte bebek mamalarını felan çok"
"w","W-QF10E1B-3065-2144","projesinin finansmanı tamamlandı. 7 Ekim'de","Bakanlar","Kurulu tarafından onaylanan anlaşma, Resmi"
"w","W-RI27D1B-2805-985","proje için uygun bir yer","baktığını","söyleyebiliriz. Bildik yarışma/yarıştırma yarışma/yarıştırma pratikleri"
"s","S-ADBBI^-0326-653","programı yaptım bitirdim. Odama geçiyorum,","baktım","Seda'nın odasında Aykut Işıklar. Birileri"
"s","S-ADABAo-0333-1516","profosyonel çıkmak zorundasın yani kendinize","bakmanız","lazım öncelikle ya bu hayatın"
"s","S-ACABQq-0425-2427","profilimize, vergi fotoğrafımıza, vergi çerçevemize","baktığımızda","karşımıza bu garip tablo çıkıyor."
"w","W-UD39C3A-1189-1737","Prof. Pars Tuğlacı'nın yüzüne nasıl","bakacağız","şimdi? Yarım asırdır Kulis adlı"
"w","W-PA16B4A-0089-1769","poster güzeli edasıyla durmuş, kendine","bakıyordu.","Uzun etekli krem rengi ipek"
"s","S-ADABPZ-0135-2196","post modernizme büyük ölçüde böyle","baktım.","İçlerinde samimi düşünürler olduğunu da"
"s","S-BEABXO-0104-1876","polis olucam hatta... başkomiser Oo!","bak","başkomiser olucakmış Görkem. Sen ne"
"s","S-BEABXg-0090-1060","polis ol <B> Bakalım yaa.","Bakalım","yok. Oğlum onun yaş geçti"
"s","S-BEABXO-0344-1540","podcast'e baktın mı google'dan? Bak","bak","bi de iş yapar gibi"
"w","W-EA14B1A-1616-1288","plastik çiçeğe bakıp.) Şu işe","bak.","Sen sahicisini kes, yerine bu"
"w","W-ME05A1A-2616-2478","planlara itilmektedir. Konuya strateji açısından","bakıldığında","ise, sivil toplumcu söylem, birincisi,"
"w","W-VI44E1D-4738-1634","plajda oturup önündeki stringli bayana","bakmıyor...","bir şeyler hissediyormusun diye soruyorum.."
"s","S-ADBBAo-0443-848","pişirdi herhalde. Birçok üretken insana","bakıyorum","geçmişleri çok büyük sıkıntılarla geçmiş."
"s","S-BEABXO-0089-547","pişer. Limon yok muydu pazarda?","Baktım","hiç yok. Limonsuz olmuyor o"
"w","W-VE05A2A-2710-1264","piyasa payını geliştirmek. Yukarıdaki maddelere","bakıldığında,","devlet yardımlarının toplam refahı hem"
"w","W-TA16B2A-0694-1827","Piramitleri adında bir yerdeyiz. Göklere","bakıyorum,","benim Güneş'ten olma çocuklarım Yıldızlar"
"w","W-HH13C2A-3335-1441","Pikabı vardı. CD çalan aygıtla","bakıştılar.","Plaklardaki şarkılar unutulmuştu. Eşya arasına"
"w","W-NA16B1A-1736-196","pijamalarım... Pencerenin yanında oturup dışarıya","bakıyorum.","Gözlerimde uyku yok. Rüyamda Harun'la"
"w","W-GI09C4A-1927-1214","Piazzale Loreto'ya varır. Bir de","bakar","ki, başka bir kamyonet alanın"
"s","S-BEABXO-0012-1714","peynir yok ortada. <B> Haa,","bak","beyaz peynir yokmuş. Tabi, beyaz"
"s","S-BEABXW-0069-239","Perim bi tane. Hadi ya.","Bak","senin için 2'lileri de per"
"w","W-JE02A2A-1523-1685","performans gösterilmektedir. Konuya bu perspektiften","bakıldığında","iyileştirme önlemleri de farklı olacaktır."
"w","W-RA16B0A-0292-2460","perdeyi yırtar gibi açtı ""Lütfen","bakınız!","Bu tren, az önce Eskişehir'den"
"w","W-PG37C3A-1420-2342","pencerenin açıldığını duyuyor ve ""Dur","bakalım","ne olacak?"" diyor. Hırsız eve"
"s","S-BEABXO-0378-141","pembeyi vereyim Emine diksin. Ver","bakalım.","Azır şimdi gitmiyi fabrikaya. Şimdi"
"w","W-CA16B3A-0577-1558","Pekiyi Tapu Memuru Fikret, hâlâ","bakmadın","mı, anayasada posta memurları ihtilal"
"s","S-ADABIO-0437-1465","peki. Yani dediğim gibi işte","bakıyorsunuz","bitecek gibi ise market e"
"s","S-ADABLp-0062-1211","Peki. İkisi arasındaki farklara bakalım.","Bak","bu da büyükbaş di mi?"
"s","S-BEABXO-0093-790","Peki saçlarımız nası uzar Nehir?","Bak,","bak… bak… Saçlarımız kök kısımlarından"
"s","S-BEABXs-0130-2348","pek.<gülme> Kalmadı her şeyin tadına","bakıcaksın","ben bide domuz etiyle kalmadım."
"s","S-ADBBI^-0326-311","paşalar, albaylar, hepsi orada. Çıktım","baktım;","bizim Ertan, bizim Namık... İki"
"w","W-DA16B4A-1493-49","Paşa'nın yağlıboya resmine suçlu gözlerle","bakar,","için için kendisinden özür dilerdim."
"w","W-VD02A4A-2691-1471","Paşa ile işbirliği yapmış nazırların","(bakanların)","bulunuşu, yüksek hükümetinizin görüşleriyle, ulusal"
"w","W-KD02A4A-0638-1452","Paşa ""Ayinesi iştir kişinin, lafa","bakılmaz.","Şahsın görünür rütbei aklı eserinde."""
"s","S-BEABXO-0140-2136","paylaşalım mı bitanesini? Tamam paylaşalım.","Bak","al. Teşekkür ederim. ES. Şunu"
"w","W-NE39C3A-0779-2335","patlarken, 15 katlı binanın yola","bakan","tarafı enkaz haline geldi. Patlamanın"
"s","S-BEABXO-0444-866","patlak werir mi? Bilmiyorum. Bak","bak","olaya bak! Midem zaten <B>"
"s","S-ADABAo-0355-2433","patladı, ya 18. yüzyıldan beri","bakılmıyo.","18. Asırdan beri? Asırdan beri"
"w","W-MA16B3A-0331-1239","Paslanmış kilitlerine, derisi soyulmuş saplarına","baktım.","Daima kilitli olurdu, bundan emin"
"w","W-TE09C2A-1267-1579","pasaport istiyoruz. Ayrıca bir öğren","bakanın","seferberlik sırasında askere alınmamak için"
"s","S-BEABXO-0392-1639","pasa bak defansın belini kırıyorum","bak.","Bak şimdi ve oldu eğer"
"w","W-MA16B4A-0102-2094","parıldadı. Şiş saplamayı bırakıp, merakla","baktı","Esra'ya. ""Hiç duymadım"" dedi. ""Ama"
"s","S-BEABXA-0129-1976","parçasını yap. Dedik de du","bakalım","yeni başladık işe. Bir de"
"w","W-LA15B1A-1725-730","parça şimdi kırık bir aynaya","bakmaktan","ah! nasıl ulaşsın çığlığım kumtanesine"
"s","S-ACABQq-0425-1526","Partisinden sizin partinize geçenler Sayın","Bakan?!.","Onlar konuşmuyorlar. Sizin icraatınız yok."
"s","S-ACABQq-0423-444","partinizin... (CHP sıralarından gürültüler) Sayın","Bakan,","lütfen, konuşmanıza devam ediniz. Sayın"
"w","W-NI09C3A-0652-2182","parlamentoysa, konuya temsil açısından da","bakmalıyız.","Merve Kavakçı bir vekil. Milletin"
"w","W-HH37C4A-0360-313","parlamento için, 60 milyonluk nüfusa","bakarak","""bir grup"" diyemezseniz, Senato için"
"w","W-QA16B2A-0672-1036","paranın kendilerine ait olup olmadığına","baktığını","gördüler. Düşmanı olmayanın... Kimseye zararı"
"w","W-CA16B3A-0735-958","para alırsam onun yüzüne nasıl","bakarım.","Bir daha bu meseleyi açma."
"w","W-JA16B3A-0774-2287","pansiyon mu? Evet şimdi soralım","bakalım,","canım ben resepsiyon görevlisiyim ya."""
"w","W-LI22C1A-0776-2181","Pablo Nureda'nın şu dizeleri bize","bakın","nasıl anlatıyor. ANLATALIM Hani ya"
"s","S-BEABXO-0381-1115","pa nerde bu kızanlar? Bakıyız","bakıyız","yok. Ama nasıl koca çukur"""
"w","W-HC05A2A-1772-215","P üzerindeki r tercih profiline","bakılarak,","m(k,p) m(k,p) m(k,p) tane seçenekten"
"w","W-FI09C3A-1292-786","Oğuzoğlu. Esen (Bülent Nuri) fırladı","""Bakın","Rektör yaptınız, bir de Reis"
"s","S-BEABXO-0456-882","oğlunu kestiler. Burda sey ettiler","bak","Güvo Mazgirtte aldi onu eyle"
"s","S-BEABXW-0069-1920","oğlum. 2 eldir biz bitiyoz","bak.","<Gülerek> 2 eldir biz bitiyoz."
"s","S-BEABXO-0091-2346","Oğlum tanıdığım nerden olsun manyağa","bak.","<B> Şerefsizler yaa niye Kocamaz"
"s","S-ADABLp-0061-1600","oğlum olacak diyor. Mesela 70'lere","bakarsanız","çoğunuzun annesi, babası, dedesi nedir"
"s","S-BEABXW-0069-306","oğlum el nerden nereye geldi","bak","bak. Helal olsun. <B> çok"
"s","S-BEABXO-0071-2438","oğlan. Bence de. Şuan rahatıma","bakıyorum.","Rahat rahat derse çalışabiliyorsun. Ses"
"w","W-SF32D1B-2726-1132","oğlan çocuk da yaşlandıklarında kendilerine","bakar.","Kız çocuk ise nasıl olsa"
"w","W-VA16B3A-2629-1425","oyuncular hakkında ne diyebilirsiniz? Kusura","bakmayın","ama bu benim ilk oyunum."
"w","W-KI37C3A-0997-2231","Oysa her insan geriye dönüp","baktığında","""Acaba?"" sorusunu sormak ister. Hata"
"s","S-BEABXO-0056-1387","oynuyor... Bu çukulatadan ver. Anne","bak","dur şundan ye. C. Hakan"
"s","S-BEABXO-0093-2045","oynayalım Aa! Nehir, Nehir, Nehir","bak","sana burda ne gösterecem bitanem."
"s","S-BEABXY-0063-2295","oynamayon ki. Hep yanların var","bak.","Abi napak almayan eli almaz"
"w","W-NE39C0A-0215-291","oynadığı inkar edilemeyecektir. İsyanın anatomisine","bakıldığında","Şeyh Said'i galeyana getiren asıl"
"s","S-BEABXO-0392-1192","oyna ya. Artık kabullenecek misin","bak","ben seni yenersem tamam diyeceksin."
"s","S-BEABXO-0339-105","oturuyor? Tarık... Müşteri geldiğinde hiç","bakmıyor","bile. Kendi kafasına göre oturuyor."
"s","S-BEABXg-0090-670","oturuyor. Evet Levent Bey dediler.","Baktım","form okuyor nerde çalıştığını, adını"
"w","W-EA16B1A-0856-5","oturulmaz öyle..."" diye geçirirdi içinden...","""Bak","şu oğlan ne çalışkan... Biraz"
"s","S-BEABXw-0408-625","oturmam. <D 5>. Bak kardeş.","Bak","kız güzel kız. Ama abi"
"w","W-RA16B1A-1213-570","oturdu, gözlerini ovuşturarak sağına soluna","bakındı.","Erenle Mete horul horul uyuyorlardı."
"w","W-HA16B1A-0728-2468","oturdu ve başından tacını çıkardı.","""Bak","bu migreni kontrol altında tutabilmek"
"w","W-EA16B2A-1007-1789","oturan. ""Kendisi ne diyor?"" Tufan'a","baktılar.","Oturanların yüzüne bakıyor, hafif gülümseyerek."
"w","W-UA16B3A-1065-1629","oturan ve tek bir noktaya","bakan","Bedri birden yerinden fırlayarak annesinin"
"w","W-VI19E1A-3987-1592","oturacağı yeri gösterdi. Burak etrafına","baktı.","Bazı arkadaşlarının henüz gelmemiş olduğunu"
"s","S-BEABXO-0093-891","otur. Vav! Ya hadi otur","bakalım.","Bu banyo oyuncağı. Evet canım."
"w","W-SI45F1D-4793-1322","otobüste giderken bile yolda yürüyenlere","bakıp","onların bir zamanlar minicik bebekler"
"w","W-VI19E1A-4006-1657","otobüs yavaşlayıp durdu. Ön camdan","bakınca","onu gördüm. Palas Gölü, ilerimizde"
"s","S-BEABXc-0167-778","Otel'den arıorum. Ee, aradınız hanıma","baktım","ancak havuz kenarında da yok,"
"w","W-EE02A1A-2624-1603","Otel Turizm Merkezi"" ilan etmiştir.","Bakanlar","Kurulu'nun, 2634 sayılı yasanın 3."
"w","W-KE09C3A-0599-1643","Osmanlıca deyimleri anlayabilmek için sözlüklere","bakıyordum.","Oysa sözlüklere bakarak şiir okumak"
"w","W-IE39C3A-1108-428","Osmanlı'dan miras aldığı birikime nasıl","baktığını,","nasıl reddettiğini gösteriyor ""Arkadaşlar! Şu"
"w","W-QE05A0A-0221-1376","Osmanlı kadısı sadece Müslümanlar'ın davalarına","bakmaz,","dinler arasındaki ihtilafları da halletmekle"
"s","S-BEABXs-0130-1793","Osmanlı dediğin zaman bu dünyaya","baktığın","zaman bir çok yeri kaplayan"
"w","W-NF10A4A-1820-451","ortaya çıkmaktadır. Kamunun borçlanma derecesine","bakıldığında,","getiri farklıkları arasında bir bağlantının"
"s","S-ADABPZ-0134-2147","ortaya çıkartmak, sonra onun içine","bakmak","yapılmadığı dediğim budur. <B> Yani"
"w","W-LE05A1B-3705-904","ortaya atılmıştır. Nitekim stagflasyonun tanımına","baktığımızda","Türk ekonomisinin >aşadığı gözlenmektedir. Çalışmamızda"
"w","W-SA16B2A-1232-1438","ortasında bir süre şaşkın şaşkın","bakındıktan","sonra bağırdım; ""Bizimle ilgilenecek kimse"
"w","W-PD39C4A-1191-338","ortasına ve satırın alt kısmına","bakmak","daha çok kelimeyi bir arada"
"s","S-BEABXB-0003-734","ortalamasına bakmıcaksın genel not ortalamasına","bakacaksın.","O benim iki yirmiki mi"
"s","S-ADABPZ-0373-1087","Ortadan ikiye bölünmüş bir elmaya","bakıldığında","diğerleri çekirdekleri görürken hemşireler çekirdeklerin"
"s","S-BEABXO-0068-372","orlarda ottum. Oğlum ne <B>","bak","öyle alıştı şimdi oğlum. Olsun"
"s","S-AEABUZ-0021-622","orjinaline yakın olmamış olabilir kusura","bakmayın.","<Alkış> Buyrun. <B> Duyuluyor. Duyuluyor"
"w","W-CA16B4A-0734-804","Orhan'a doğru yürüdü. Gözlerini kaldırıp","bakmaya","cesareti bile yoktu. Çekingendi. Yüzünde,"
"s","S-AAAAFZ-0383-1327","organizma düzeyinde incelendi. Şimdi aslında","bakarsanız","emm bitki biyolojisinin gelişim <D"
"w","W-VI45F1D-4698-343","organ bağışını kabul etme oranlarına","bakıldığında","çok ciddi farklar mevcut. Mesela"
"s","S-BEABXd-0170-67","orda şey Sude anlamına bakın.","Bak","sen Firdevs ablası, Sude ne"
"s","S-ADABLp-0061-1618","orda oluşunu engelledi. Yer şekilleri.","Bakın","yer şekilleri de etkiliyor. Arkadaşlarım"
"s","S-BEABXO-0455-2257","Orda iki şeyin arasında durmuş","bak","görüyorsun iki tane. Verme lan"
"s","S-BEABXO-0007-447","orda ben bakmadım şey diyorlar","""Bak","bak yukarda bi şey yapmışlar."""
"s","S-BEABXs-0130-1556","orda askerler emm <B> giyiyorlar.","Baktı","anladı tabi biz yeni askeriz"
"s","S-BEABXO-0093-1596","orası? Yengeçlerin... Yengeçlerin evi dimi,","bak","burada ne yazıyor. Ama o"
"s","S-BEABXO-0358-832","orası öyle, doğrudur. Bilmem ki!","Bakalım","artık. Kim bu, Bülent Arınç"
"s","S-ACAAPZ-0328-489","oranın tahmin edilmekte. Kardiyovasküler gerçeklere","baktığımızda","tüm Dünya'daki ölümlerin 1 numaralı"
"w","W-OF10E3C-3369-1384","oranları düşmektedir. Ancak işsizlik sürelerine","bakıldığı","zaman çok daha homojen bir"
"w","W-UF10A1A-1888-856","Oranları (2007 Yılı) Bölgesel olarak","bakıldığında","ise, okul öncesi eğitim hariç,"
"w","W-LF10A2A-1877-2130","oranda genel tarife indirimine sıcak","bakılmamaktadır.","İhracatçı ülkelerin ihracatı yasaklama ve"
