"Register","Text","Left","-5;5","Right"
"s","S-ADAA^o-0133-762","karın ve göbek bölgelerine dövme","olarak","ağacı işletmeleri ve bu ağacın"
"w","W-EA16B3A-0490-2216","karıma sarılıp yatmak ne harika","olurdu.""","""Önce sarılıp yatacak bir karın"
"s","S-ADABAo-0355-2302","Kardeşim benim mesleğimde öle bişi","olabilir","mi yani? İstiyo ama yeni,"
"s","S-ADABDp-0187-1339","kardeş miydi? Yok be kardeş","olsalar","biraz benzerler. Ben yanlış yere"
"w","W-CA16B3A-1003-1213","Kararsızlık içinde bocaladı. Durumun çaresiz","olduğunu","anlayınca sormaya başladı Neden böyle"
"w","W-LD30D1B-2208-1083","kararsızlar (veya bize o konumda","olduklarını","söyleyen) çok. Samsun ""modern muhafazakâr"""
"w","W-TE36E1B-3354-755","kararlar veren, iletişimci bir insan","olduğunu","anlıyoruz. Ay'ı Koç'ta ve 9.evde."
"s","S-ACABQq-0425-702","Karar yetersayısı... Karar yetersayısı istenmiş","olduğundan,","oylama sırasında karar yetersayısını arayacağım."
"w","W-MA16B1A-0730-1095","karar vermek, her şeye sahip","olmak","istiyor. Kibarca istese belki verirdim"
"w","W-UE05A1B-4291-627","karar fonksiyonlarını yönlendiren karar merkezleri","olmaktadır.","Bir işletmenin lojistik sistemi satın"
"s","S-ADABI\-0438-2474","karar değişikliği yaşayan insanlar için","olabilir.","Ben sabit fikirli olduğum için"
"w","W-VD05A2A-2602-840","karar alma süreci""nin süreci""nin neresinde","olduğunu","teşhis etmek çok önemlidir. Müşteri"
"w","W-WI45F1D-4817-1712","kar tipisi yüzünden yolda kalmak","oldu","ki, bunu da yazıp tekrar"
"s","S-BEABXO-0417-128","Kapkara. Hah! Şu inşaatın iti","olmasın?","Bilmem ben korkuyordum ama sonra"
"w","W-SE39E1B-2904-2413","kapitalizm-öncesi bir çağa hapsedilmesi olanaksız","olan","Latin Amerika ""devrimci"" örneklerin temel"
"w","W-NI09C3A-1445-458","kapattığını öğrendik. Ama dernek adı","olarak","hep kaldı. Sokak Çocukları İçin"
"s","S-BEABXT-0066-50","kapasitesi var. Belli yani belli","oldu.","Hıı. Dersanenin o kadar da"
"s","S-ADABPZ-0116-156","kapasitelerini daha bölgenin veyahutta ulusal","olarak","bu kapasiteleri bilmediğimiz sürece bir"
"w","W-HA16B4A-1363-1","kapanıyordu. Bu kez de ne","olduğu","belli olmayan girdaplara kapılıyor, hızla,"
"s","S-ACABQq-0421-2492","kanunu olan tek millî park","olmuştur.","Gelibolu Yarımadası, Tarihî Millî Parkı"
"s","S-BEABXO-0441-2039","kanki? Sen gördün evde evde","oldum.","Ya playstation oynarken… oynarken… Haa"
"s","S-ADABIO-0437-1229","kandırmaca işte biz uğraştık ama","olmadı","bir dondurma şeyi gibi çıkıyor"
"w","W-JF02A3A-3318-601","Kanada hükümetinin belirlediği standartlara uygun","olması","gerekmektedir. Bu konuya ilişkin düzenlemeler"
"w","W-UD30D1B-2182-1824","kamuoyu yoklamalarına göre sürekli yükselişte","olduğunu","ve tek başına iktidara gelme"
"w","W-VF10A2A-1859-617","kamu kesimi ile birlikte belirleyici","olduğu","görülmektedir. Bu dönemde kamu harcamalarının"
"s","S-ADABCo-0364-1825","kameraların karşısına çıkıcak. Durum böyle","olunca","da İMF ve Dünya Bankası"
"s","S-BEABXO-0324-1262","kalıyoduk? Ya gece 3'dü. Ee!","olsun.","Ee? Nasıl haber verelim? Size"
"s","S-BEABXw-0399-1238","kalırız gece. Hıı. Yani. Hiç","olmadı","<B>. Şurdan battaniye verin bana."
"s","S-ACABQq-0423-46","kalıcı derogasyonları asgarîye indirme eğilimi","olduğu","dikkate alınarak ve bütün tarafların"
"w","W-UA16B1A-1233-1772","kalsa ne âlâ... Ardından gelecek","olanlar","büsbütün dehşet vericiydi... Çoğu kez"
"w","W-JI22C0A-0232-878","kalpten de gider hiç haberleri","olmaz.","iYaşlı babalar kalpten bakımsızlıktan, kansızlıktan"
"s","S-ADBBAo-0443-887","kalmış. Peki iyi bir kayınvalide","olur","musunuz? Olurum olurum. Annem kayınvalide"
"s","S-ADABPZ-0134-2412","kalmış dünya bir anlamda bize","olduğundan","farklı şekilde ters yüz edilerek"
"w","W-PA14B1A-1630-100","Kalmayacak düzen dirlik, Haydi çabuk","olalım","birlik. (Tüm kediler toplanmıştır.) BAYAN"
"w","W-KE39E1B-3300-230","kalmadığını anlıyor; müzik üzerinde hakim","olduğu","yeteneğini dil üzerinde de gayet"
"s","S-ADAB^o-0199-138","kalktıktan sonra da kendileri yok","oluyolar.","Emm Anavatan Partisi gerçekçi olmamız"
"w","W-UF10C4A-1193-475","kaldıysa ciddi şeklinde aklından zoru","olmalı.","Dolayısıyla işi bu noktalara kadar"
"w","W-RD02A1B-4579-154","kaldırılmıştır. Böylece, Devlet yardımı esas","olarak,","2839 sayılı Milletvekili Seçimi Kanununun"
"s","S-ADAB^Z-0370-966","kaldım. O yüzden. Kendi bölümüm","olarak","görmüyorum yani işletmeyi öyle deyim"
"w","W-RA16B1A-0153-797","Kalanlar arasında."" ""Sizce niye gelmiş","olabilirler","doktor bey? Bir tahmininiz var"
"w","W-SH39C0A-0142-534","kalan sürem altı aydan az","olduğu","için Ermenek Cezaevine gönderildim. O"
"w","W-TE36E1B-3353-1633","kalacak yeni bir yer arayışında","olan","Klaus için bu harika bir"
"w","W-RE30D1B-2121-1510","kalabalık arasında, ""bir intihar saldırganı","olduğu""","söylentisini çıkaran bir teröristin yüzlerce"
"w","W-DB04A1B-3853-1315","kahverengi tüylü. Scutellum üçgen şeklinde","olup","gri tüylü. Elitra, gri tüylü"
"w","W-DD39C2A-0680-237","kahkahayı duyunca herkeste bir rahatlık","oldu.","Biz de durumu kabullenmiş olduk""."
"s","S-ADABPZ-0119-2441","Kafanız diyor <B> diyor. Boş","olur.","Gözlemlerle bunu dolduracaksınız. Gerçek gerçekleşecek."
"w","W-SH43C4A-1885-911","kadınların örtünmesinin ""soylu bir başkaldırı""","olduğunu","ifade etmişti. Bulaç'a göre, feminizm,"
"w","W-SI22C0A-0272-2191","Kadınların avuç içindeki nokta hassas","olduğu","için hoşlarına gidermiş. Parmakla avuç"
"w","W-KD02A3A-1913-149","kadınları da o dönemde revaçta","olan","süslenme ile ilgili bazı malzemeleri"
"w","W-UI45F1D-4072-466","kadınlarla iletişimin de, İç Anadolu'da","oldukça","zor olmasıymış. Gittikçe muhafazakârlaşan ülkemizin"
"s","S-BEABXX-0411-1728","kadın geldi ya gözlüklü... Gözlüklü","olan","Muhammed'in annesi. Muhammed'in mi Dicle'nin"
"w","W-OE39E1B-2900-2372","kadrolaşma ve iç işleyişte dinamizm","olarak","sıralayabilirim. OKURLARLA Gelenek'in birinci sayısı"
"w","W-UE05A3A-2590-207","kadrolar hiçbir şekilde karamsarlık sebebi","olmamalıdır.","Türkiye'nin, Kıbrıs Türkünü ayakta tutacak"
"s","S-ADBBAo-0443-849","Kadriye Hanım'ın yaşayan üçüncü çocuğu","olarak","dünyaya geldin. Bakalım Özcan Deniz"
"s","S-ACABTZ-0336-372","kadarıyla 1961 yılı 1962 yılı","olması","gerekir. Hemen onun arkasından da"
"w","W-KF07A2A-1860-1930","kadardır. Bir diğer yenilenebilir kaynak","olan","jeotermal akışkan, bünyesindeki yoğuşmayan gazlar"
"w","W-SH42E1B-2919-720","kadar. Bir anda ördek yavrusu","olan","civciv, sürüden ayrılmış ve gölcüğe"
"s","S-AEABUZ-0038-538","kadar, özerkliğini, ne kadar önemli","olduğuna","değineceğim. Şimdi tabi tarihte hiçbir"
"w","W-WI45F1D-4721-928","kadar önemli bir konudur. Bilinçli","olarak","inşa edilmeli, şirketin her kademesinde"
"w","W-GA16B3A-0794-2314","kadar hızlı yürüdüklerinin farkında değillerdir","olmak","da istemezler zaten, öyle hızlı"
"w","W-UE05A3A-2692-2363","kadar herkes malikâne alıp, mutasarrıf","olduğu","malikâneyi kendi mülkü gibi kullanıp,"
"w","W-FF05A1B-4382-2215","kadar birikim rejiminde bir değişme","olmadı.","Fordizm olarak tanımlanan bu (yoğun)"
"w","W-JI39C2A-0646-570","kadar akıllısınız çünkü. Ama böyle","oldu.","Ben hiçbir zaman Türklüğümü inkar"
"w","W-TC05A2A-1158-2496","kabul görmelidir. Birinci madde böyle","olmalıdır.","İkincisi, ""yasalar doğru oldukları için"
"w","W-LA16B2A-0621-1756","kabul edeceklerini söyleyince, konukluk başlamış","oldu.","Yanlarında hâlâ hırlayarak yürüyen köpeklerle"
"s","S-BEABX[-0163-269","Kabartsa daha çok top kafa","olursun.","Arkası kabarsın. Çok yüzüm küçük"
"w","W-TC06A1A-0259-2109","İşte oluşturulan bu model sürekli","olarak","farklı çağlarda ama benzer şekillerde"
"w","W-ED36C2A-0413-1715","İşte insanların Batılı anlamda özgür","olmaları","demek, soylulara ait ayrıcalıkları paylaşır"
"s","S-BEABXO-0012-54","İşte hani oraları böle şey","oluyosun","böle bi eşit yapısına. Kimse"
"s","S-BEABXg-0088-1011","İş olsa çevren genişler şu","olur","diyo. Şimdi o yüzden bide"
"s","S-BEABXO-0056-2303","İğrenç bir duygu. Hayır aşık","olmadığın","birine katlanamazsın. Neden? Aşk diye"
"s","S-BEABXX-0411-71","İzle hatta. Halil Sezai manyağı","oldum","dedim. Ben bu yaşıma kadar"
"s","S-BEABX[-0163-47","İyi mi böyle? Biraz sıkıntı","olabilir.","Yok, yok. Problem değil. Yastığınız"
"s","S-ACABTZ-0336-1102","İtalyanların bir deyimi vardır emm","olmayacak","şeyler için beyaz bir sinek"
"w","W-ME39C3A-2597-2409","İsviçre'ye yerleştim. Evlenemiyorum. Evlenirsem çocuğum","olacak.","Halbuki ben yüzlerce masum çocuğun"
"s","S-BEABXO-0006-571","İsteseydi askerlerini toplardı. Sen istersen","olur","sen istemezsen olmaz. Olur mu?"
"s","S-ADABPZ-0374-2231","İstanbulun fethedilmiş Türkler tarafından alınmış","olduğunu","veya batlılıar tarafından düşünürsek İstanbul'un"
"w","W-OE05A1A-2599-1791","İstanbul'daki saltanat aslında varlığını borçlu","olduğu","Anadolu Türk varlığından giderek uzaklaşır."
"s","S-ACABPA-0434-284","İstanbul Üniversitesi Hukuk Fakültesi'nden mezun","olmuştur.","Ankara Üniversitesi Hukuk Fakültesi Ticaret"
"w","W-NG43C1B-1886-2041","İsmet Özel İslâmi devlet kavramı","oldukça","yeni bir şey fakat şu"
"s","S-BEABXx-0394-678","İsmail yerken böyle yapıyo. <Gülme>","Olmaz.",""
"w","W-CI22C3A-0678-1145","İsmail Tipi arkadaşımızın konuyla ilgili","olarak","yaptıkları araştırmaları şöyle Milli Damat"
"w","W-ND39C2A-1757-2226","İslami esaslara dayanan Devlet nasıl","olur?","Kur'an ve Hadis bir Devlet"
"w","W-JH42A2A-0870-1296","İslam'ın en nazik kurumlarından biri","olan","tasavvufu, zaman içinde bir tür"
"s","S-ADABCo-0242-2026","İnsanın kendi gözünün rengiyle problemi","olan","adamdan benim ne işim olur"
"s","S-BEABXO-0122-1436","İnsanın karşısında öyle bi örnek","olunca...","Tabi örnek iyi olunca insan"
"w","W-PD03A0A-1674-1130","İnsanlar sevişme içgüdülerini ""iyi kul","olmak""","adına pek de bastıramadılar. Hatta"
"s","S-ADABAo-0366-902","İnsan neyse o. Nasıl önemli","olması","gerekiyorsa öyle alıyor. Bunun da"
"s","S-BEABXw-0397-1484","İnsan Hakları Mahkemesi'ne mi vermiş?","Olabilir","Olabilir çünkü Türkiye'ye açmış, devlete"
"w","W-DD36E1B-2846-158","İnsan Hakları derneklerinde öneri sahibi","olmaya","başladılar mı? Kürtlerle evli olan"
"s","S-BEABXO-0080-491","İngiltere milli takım formasını giymemiş","olan","Ryan Giggs var ya Manchester’daki"
"s","S-BEABXW-0005-581","İngilizceyi Almanca'ya bencetmeye çalıştım ama","olmadı.","<Gülerek> Kaç almışsın Almanca'dan. Hayır"
"w","W-CB04A1B-3852-2106","İnceleme alanında pH değerlerinin düşük","olduğu","gerek istasyonlar arasında ve gerekse"
"s","S-ADBBAo-0443-1291","İnanır'la Marziye'yi çektin. Çok başarılı","oldun","ve sevilen bir ikili oldunuz."
"w","W-MA16B1A-0689-295","İnan hocam, Latinceyi yardımcı ders","olarak","seçmemin benim yararıma olacağını söyledi."
"w","W-SD02A1B-4588-2247","İmajı Ölçeği için ise .88","olarak","belirlenmiştir. Yeme Tutum Testi. Yeme"
"w","W-LF10A2A-1874-1019","İkinci olarak, fiyat istikrarını sağlayacak","olan","denge faiz oranının belirlenmesinde yaşanması"
"s","S-BEABXO-0390-1214","İki görevi birden nasıl yasal","olarak","yürütüyor? Valla bilmiyorum. Bende duyduğumda"
"w","W-MA16B4A-0150-1382","İki büklüm oldu Media. Ne","olduğunu","anlayamamış, Volkan Bey'in Kaybedenler'den ve"
"s","S-BEABXn-0352-2384","İki bin bir yılında şey","olan","İkiz Kule'lerin patlaması. Onun 94"
"w","W-IC06A2A-3319-1285","İdareye ve Sosyal Sigortalar Kurumuna","olan","borçları ile ücret ve ücret"
"s","S-BEABXO-0431-968","Işıklar belli aralıklarla boş yol","olunca","hızlı gidiyosun. <D 24> Dilgam"
"s","S-ADABCo-0232-42","Işıkaltın'ın Zekeriya Öz'den daha kıdemli","olması","nedeniyle soruşturmada daha yetkili olucağı"
"w","W-PA16B4A-0099-726","işte; ne kadar tehlikeli olursa","olsun","olayların içindeyken sakinliğimi korurdum fakat"
"w","W-RI09C2A-0023-1223","işte! İçlerine biniyoruz. Salakça mutlu","oluyoruz","nedense! Çocukluğumuzda böyle bir Amerikanlaşma"
"s","S-BEABXp-0156-886","işte onların arkadaşlarını toplarım, gözlemci","olarak","katılırım aralarına. Tamam olur olur."
"s","S-BEABXO-0122-2056","işte insan duyuyor. Ne kadar","olsa","birinin niyeti oldu mu, bi"
"s","S-ADBBI^-0326-256","işte Hülya Avşar olsun, Gülben","olsun;","gelen konuğu evine çağırmış, evde"
"s","S-BEABXO-0075-712","işte duyulmamış işte Bad albümünde","olmayan","şarkıları var. Yemin etsene. Süper"
"s","S-BEABX_-0270-972","işte böyle neden korkuyosun, doktor","olamamaktan","korkuyorum demiş. Haa yazık, doktor"
"s","S-ADABPZ-0112-1296","işte bu tür bir problemin","olduğu","ne kadar erken dönemde fark"
"s","S-BEABXO-0012-822","işte bana herkes diyo, mesleki","olarak","niye dönmüyosun? Ya abi dedim"
"s","S-BEABXs-0130-2447","işte aaa habercimiz geldi felan","oldu.","Emm bölük komutanının eski habercisiyle"
"w","W-OF10E3C-3369-1922","işsizlerin iş arama etkinliğinin yüksek","olduğunun","bir göstergesi olmaktan uzaktır. İşsizlerin"
"w","W-HD02A1B-3799-932","işlevi olan dizelerdir. Çok az","olmakla","birlikte, kalıp dizelerin son iki"
"w","W-VI45F1D-4717-2368","işlerin azaldığını bildirmiş; daralan sektör","olarak","sivil ürünler belirtilmiş. Haftalık Bakış-6"
"s","S-ADABAo-0307-2116","işler bitmedi. Yeni bir gelişme","olursa","o zaman bir başka bu"
"w","W-TC40E1B-2879-2248","işlemciye de ihtiyaç var. Kullanmakta","olduğumuz","AMD ve Intel işlemciler, Windows"
"w","W-RF25D1B-2761-918","işlem hacmi, 1.3 milyar YTL","olan","toplam işlem hacminin yüzde 11'ini"
"w","W-DE02A4A-1483-284","işkencenin Türk kültürünün bir parçası","olduğunu,","işkence ve Türkün pek birbirinden"
"w","W-QF25D1B-2166-1209","işin bittiğini anlatan Erdoğan, ""Uzlaşmamış","olanlar,","onlar gelip oturacaklar. Uzlaştı uzlaştı,"
"s","S-AAABLp-0161-1010","işimize yarayabilir. Emm burda görüşmede","olabilecek","abartılar gözlemle saptanabilir. Gözlemle elde"
"s","S-ADABCo-0365-853","işi ciddiye almamaktan kaynaklanan bişey","oluyo.","O yüzden çok sıkı bi"
"s","S-ACABQq-0420-461","işgal edenlere gerçek anlamda örnek","olmasını","diliyorum; birincisi bu. Bir diğer"
"w","W-SI37E1B-3061-311","işaret etmektedir. Bu bağlamda, ""görünür""","olanın","""nasıl görüldüğü ve gösterildiği"" üzerinde"
"w","W-TA16B0A-0122-1331","iş tuttum. Züppeliğimden. Bugünkü aklım","olsaydı,","adamların bir cüzdanına bakardım, bir"
"s","S-ACABTZ-0336-447","iş gücünü yetiştirmek için kurulmuş","olan","ODTÜ özellikle İstanbul'daki antiemperyalist eylemler"
"s","S-ADAB^Z-0370-112","iş dallarında iş bulacak insanlar","olarak","karşımızda bulunuyor bu öğrencilerimiz şimdi."
"w","W-QE37C2A-0186-1672","içtim ve bir anda kokainman","olarak","bellendim; çevremdeki kişiler, bekâr olarak"
"s","S-BEABXO-0376-2429","içine. Undan sonra dedim ""Ayır","olsun,","noldu böyle?"", dedim. Dedi ""bubam"""
"w","W-SG03A1B-3273-372","içine açılan bir geçişin olup","olmadığını","düşündürtmektedir. Ancak, burcun bu bölümü"
"s","S-ADAACo-0205-1727","içinden Atatürk'ün maketinin çıkarılmasına bakanlık","olarak","Ulu Önder'in manevi şahsına yapılmış"
"s","S-ADABCo-0289-935","içindekinin uyumlu olmamasının ilacın sahte","olması","anlamına geldiğini hatırlatan uzmanlar halkı"
"w","W-NE06A1B-3964-1386","içindeki payı gelişmiş ülkelere oranla","oldukça","düşüktür. Konuya yenilik açısından yaklaştığımızda"
"w","W-MB04A3A-1261-390","içindedir. Başta ""kalkındırma"" amaçlı kredilendirmeler","olmak","üzere, söz konusu kaynak aktarma"
"s","S-ADBBAo-0443-1880","içinde, aynı şirketle çalışmak durumunda","olmak","çok hoş değil. Bağımsız ve"
"w","W-RD02A1A-1612-2283","içinde rasyonel bir varlığa sahip","olabilir","der ve ""insan tüm varlığını"
"w","W-QA16B3A-0617-1931","içinde kurumazlarsa misafirler yüzgeç sahibi","olacak.","Üstelik ne söz verdiğim güveç"
"s","S-ADABAo-0368-165","içinde hakikaten… hakikaten… Dışarı şiddet","olarak","yansıyor. Tabi ki hem şiddet"
"w","W-MF05A1B-4434-1424","içinde demokratik bir meşruiyete sahip","olduğunu","iddia etmesi oldukça zordur. Böyle"
"s","S-ADBBAo-0443-2022","içinde büyümüşsün. Bu kadar da","olmaz","diyesi geliyor insanın. O yoksulluklardan"
"w","W-NI09C3A-1445-285","içinde baktığım davalar. 1980 darbesi","olduğu","zaman, bu olaylar yeniden yaşanmaya"
"s","S-ADBBAo-0443-385","için. Yok biraz da iltifat","olsun","diye söylüyor. O yoğrulmuş geldi."
"w","W-JF05A1B-4413-301","için, ürünlerin zamanında ve mümkün","olan","en düşük maliyetle üretmeleri ve"
"s","S-ADBBAo-0443-676","için, özellikle de benim annem","olduğun","için çok mutluyum. Seni seviyorum."
"s","S-AEABTZ-0040-2124","için, teknoloji düşmanı dediler, ne","olacak","ki dediler, temiz bile dediler."
"w","W-UE05A1B-4257-496","için “kadın “kadın işgörenlerin sahip","oldukları","eğitim düzeyleri ile işte yükselme"
"w","W-JA16B4A-0146-859","için önemli bir şeyin eksik","olduğunu","hissedecek kadar da ayıktım. Tıpkı"
"s","S-ADBBI^-0042-324","için çok yakından görme imkânım","olmadı","ama biraz biliyorum ""Efendim, buğdayın"
"s","S-ACABUZ-0035-2404","için çok teşekkür ediyorum. Sağ","olun","var olun efendim. <Alkış> Plaket"
"w","W-PF10E1B-2867-1646","için tasarlanmış, teminatı oldukça fazla","olan","ve lüks arabalar için geliştirilmiş"
"w","W-PG22C1A-0518-1651","için sıcak bir köprü kurulmuş","olabilir","aramızda. Arkadaş, çok güzel bir"
"w","W-SD37C4A-1354-2211","için siyah bir motosiklet sahibi","olmaktan","başka bir seçenek yok mudur?"
"w","W-VH20C4A-4854-1460","için onları göstermek istiyorum. Yararlı","olur.","Bir de kendi öğretmenleriyle karşılaştırsınlar."
"w","W-QE39E1B-2902-2007","için makul ve kabul edilir","olmayan","asıl şey, Sovyetler Birliği'nin bu"
"w","W-FC06A1B-3583-1566","için literatürdeki benzeri sonuçlarla karşılaştırılmalı","olarak","incelenmesinde yarar görülmüştür. Tarama niteliğinde"
"w","W-JF10A2A-1836-1981","için korunma tekniklerinden yararlanılması yönünde","olmaktadır.","Kontrol çalışmaları ise iç denetimin"
"s","S-ADABI]-0126-301","için ilk aşamaya girdiğimde, ne","olduğunu","anlamadım çünkü hani konservatuar sınavı"
"s","S-ADAB^o-0132-2095","için güvenlik sağlayan bir mevkide","olan","ilk yerleşim, bugün bir yarımada"
"w","W-SI32D1B-2551-980","için evlenmeden cinselliği yaşamak yanlışlık","olsaydı,","eminim ki Allah o duyguyu"
"w","W-UI42E1B-2943-1554","için ekmeği ufaltıp küçültmeye râzı","oluyordu.","Bu şekilde o sıcak günde,"
"s","S-BEABXO-0120-1367","için diyor hani insanların şey","olarak","tavır olarak davranış olarak insanların"
"s","S-AEAA@O-0154-2205","için büyük bir çiftliğe sahip","olmakmış.","Ahırlar, atlar herşey istiyormuş gönlünden"
"s","S-ADABPZ-0135-2201","için bir nedeni olacaktır. Yapmakta","olduğumuz","şeyi ancak kendi varoluşumuzu geniş"
"w","W-KE13C2A-1474-855","için artık çok geç! Şimdi","olsa","olsa bir aydınlık karşı devrimden"
"s","S-ADBBI^-0042-2425","için anne ailesi gibi Fenerbahçeli","oldu.","Oğlum Kerim babamı göremedi. Babam"
"s","S-ADABPZ-0135-836","için ahlaki fenomenin gayri rasyonel","olduğunu","söylemek rasyonel olduğunu, yalnız rasyonel"
"w","W-XI45E1C-5070-32","içimde işte. Koskoca Blake Lively","olsan","bile arabaya tek tek koymak"
"w","W-UF10A2A-1868-308","içi bağımsız bir sahipliğinin belirlenmiş","olması,","Görev ve sorumlulukların açık bir"
"s","S-ACABTZ-0336-501","içersinde ne oldu? Mucizeler mi","oldu?","Matem çanları derken Amerikalılar bile"
"w","W-PF10A2A-1849-404","içeriğini farklılaştıracak bir dizi değişiklik","olmaktadır.","Bunlar Teknolojik ve ekonomik gelişmelerin,"
"s","S-ACABQq-0422-387","içerisinde ziyaret eden tek kişi","olmuştur.","Genel başkanımız bütün Avrupa Birliği"
"w","W-PI42E1B-2938-2088","içerisinde olmalıyız. Kulluğumuzun bir ifâdesi","olan","namaz ibadetini âilemize tavsiye etmemizi,"
"s","S-ADABPZ-0374-1935","içerisinde değerlendirirseniz aslında Türkiyenin yapmış","olduğu","Gürcistan,Azerbeycan Gürcistan,Azerbeycan emm... birlikteliğiyle üçlü"
"w","W-TD09C4A-0211-220","içeride saklanan gruplara ulaşmak mümkün","olmadı.","Tugay komutanımızla yüz yüze ne"
"s","S-ADBBAo-0443-788","içeri girsin mi? Sizin evde","olmamanız,","çocuklarla Kadriye Hanım'ın mücadelesi... Peki"
"w","W-GH02A2A-0496-1399","içeren değişkenlerin, ferdin davranışları üzerine","olan","etkileri bütün sosyal ve psikolojik"
"s","S-BEABXs-0130-478","izninden sonra Ankaraya birliğime teslim","oldum.","Emm şeylerimiz vardı bizim mesela"
"s","S-ACABTZ-0336-2489","izler nükleer endüstride. Amerika'da ne","oluyor","ne bitiyor. Şimdi Amerika yeni"
"s","S-ADABAo-0312-2168","izin vermiyoruz. Sonucu ne olursa","olsun","o bu ülkenin çocuğudur. İnsanıdır."
"w","W-OB04A1A-1983-2147","iyonlardan dışardakilerin içerdekilere oranına eşit","olması","gerekir. B) Aktif İyon Alınımı"
"s","S-ADABAo-0355-2459","iyidir onu da biliyoruz, iyi","olduğunu.","Ee! çok fazla da alınacak"
"w","W-DI36C2A-2973-1363","iyice zayıflar. Bir Uygur Türkü","olan","Alâeddin Eretna Bey'in Karanbük Savaşın'ndaki"
"s","S-BEABXO-0149-1480","iyi ol sade de saçın","olmasın,","saçtan nolcak. Hiç... Vay kardeşim"
"s","S-ADBBI^-0326-1733","iyi kötü benzeyen bir tarafı","olacak","ki, espri değer kazansın. Saçı"
"s","S-BEABXB-0003-1537","iyi geçti. Çıkmazsa kadın gıcık","olur","zaten. Nasıl yani? Yani mesela"
"w","W-EC06A1B-3576-1782","iyi emilmesi için yağda çözünür","olması","gerekir. Yağda çözünen ilaçlar hücrenin"
"s","S-BEABXO-0086-1884","iyi değildi oranın. Ondanda kaynaklanıyor","olabilir","evet ama biraz şey oldu"
"w","W-NC06A2A-1737-1738","iyi bir örneğinde bu fay","olmadığı","çok daha açık görülmektedir. Pichon"
"s","S-ADBBAo-0443-2306","iyi bir kayınvalide olur musunuz?","Olurum","olurum. Annem kayınvalide değil daha"
"s","S-ADABCo-0241-2374","iyi anlaşıyor birbiriyle. Günün kaptanı","oluyosun.","Tekneyi çok iyi kontrol edebiliyosun."
"w","W-QE39E1B-2902-988","itibarını yükselten çok önemli adımlar","olmuştur.","Kurtuluş Savaşı'na yapılan maddi yardımların"
"s","S-ACABQq-0421-2139","itibarla, sağlık hizmetini satın alacak","olan","kamu sigortacılığının, standardizasyonu yapılmış ve"
"w","W-VD02A1B-4628-39","itibaren bir temel üretim faktörü","olan","sermayenin önemi giderek artmış ve"
"w","W-VH20C4A-4854-114","istiyoruz. Doktora araştırmalarına başlamak üzere","olan","öğrenciler, yani ikinci, üçüncü yıllarındaki"
"s","S-ACABUZ-0035-1417","istiyorum. Ve sizden böyle sorularınız","olursa","bunları böyle büyük bir mutlulukla"
"s","S-ADAB^Z-0370-411","istiyorum. Bi de bana verilmiş","olan","hak tanınmış olan işte ayrı"
"w","W-UI32D1B-2553-888","istiyorum. Beni ne kadar üzmüş","olsa","da onu istiyorum. Ancak onunla"
"s","S-ADBBI^-0326-2352","istiyorlar çünkü. Yıllardır iki kişi","olarak","yaşıyorsunuz. Hayır! İki karakter... Bir"
"s","S-ADAASK-0036-421","istiyor. Katılmak güzel. Ama güzel","olan","sırf katılmak değil. Yarışı bitirmek."
"s","S-ADABCo-0314-2083","istiyor. Ama hayatında hiç bağkurlu","olmamış","birisinin şimdi sistem bağkur numarası"
"w","W-PF25D1B-2159-723","istiyor. 1999'da 6 bin ton","olan","ABD'ye fındık ihracatı, 2000 yılında"
"w","W-PD30D1B-2189-1287","istikrarı sağlamak adına bulunacağız. Üçüncü","olarak","elbette ABD de müttefikimiz olarak"
"w","W-VE05A1B-4300-1581","istihdam koşullarına karşı esnek, adapte","olabilir,","daha becerikli hale getirmeye yardımcı"
"s","S-ADABII-0439-1204","isteyen kişiye bir imkan sunuyor","olması","fırsat yani. Hobi alanında anlaşmalı"
"s","S-BEABXp-0156-987","istersen sen yani soruyu soracak","olan","sensin anladın mı? Hı-hı. senin"
"w","W-LA16B1A-1366-2221","isterim diye yolda tutturma bak!""","""Olur,","olur..."" dedim. Dayım elimden tutmuş,"
"w","W-FE39C0A-0250-1638","istenir. Medya, kimseye verilecek özeleştirisi","olmadığını","söyler. Bu biçimde uzun süre"
"s","S-ADABAo-0433-1777","istemiyorum ama çok da duryarlı","olduğumuzu","söylüyemem açıkçası. Duyarlı mıyız? Maalesef"
"s","S-AEABTZ-0040-1243","istemez. Siz oturduğunuz dalı kesmiş","oluyorsunuz.","Sonuçta ben olarak yani kişisel"
"s","S-AEABTZ-0040-977","istemez bu nükleer santral sempozyumu","oluyor.","Konu bizi buraya çekiyor. Bilimde,"
"w","W-NG37C0A-0192-2333","istemediğini bilerek olabildiğiniz kadar iyi","olmaya","çalışın."" Saatler geçti ve ayrılık"
"w","W-RI22C4A-0842-999","istek gerek... Yıldız olmaya, ay","olmaya","istek gerek... Yani nurla beslenmek"
"w","W-MH03A1B-3134-654","istediğimiz tek konu, bir imkan","olarak","insanın ""ağır şartlar altında"" çalışmaya"
"s","S-ADABIi-0124-1275","istediğimiz gibi oluşturamadık, esprileri tam","olarak","oturturamadık ama bunları emm yaparken"
"s","S-ADBBAo-0443-1808","istedim. Ama sonuçta ne olursa","olsun","bir nikah yaptınız. O bir"
