"Register","Text","Left","-5;5","Right"
"s","S-BEABXg-0090-1058","İşkur'da ol. Tamam. Çıktım buradan","baktım","8'e çeyrek var 9 yarım"
"s","S-ACABQq-0429-106","İçtüzüğün bütün maddelerine tek tek","bakın;","seçim işleriyle ilgili herhangi bir"
"s","S-BEABXO-0089-1930","İçeri terliği alim dedim unutmuşum","bak","pazardan. Niye yok mu ki"
"s","S-BEABXO-0068-1498","İyi sen sınava girmişsin gari","bakam","şider, belli olur oğlum. Allah'ın"
"w","W-CA16B3A-2682-1492","İyi misin? Islak elleriyle çekti,","baktı.","Yalnız başını çıkararak. Saçlarından sular"
"w","W-UF10A2A-1882-863","İstihdam verisinin zaman içerisindeki gelişimine","bakıldığında,","1993 ve 2000 yıllarında seride"
"w","W-VI39C3A-0869-1110","İstihbaratçılar şaşkındı. B.'nin B.'nin anlattıklarına","bakılırsa","bütün Kürt grupları birleşmişti. Bu"
"w","W-UE36E1B-3357-1585","İstanbul'a döndüğümde yaşadığım çevreye farklı","bakmaya,","İstanbul'un yollarını, kaldırımlarını planlayan, yapımını"
"s","S-BEABXW-0173-888","İstanbul planlarım var da ama","bakalım.","He gidersin. Ben sömestıra kalmadan"
"s","S-BEABXO-0345-1912","İso sen şunları yapıyo musun?","Bakıyorum","hepsine baştan bakıcam. İlkelere göre?"
"w","W-EF10A3A-1838-2176","İslâm Bankacılığının, yasal dayanağını oluşturmuştur.","Bakanlar","Kurulu, Bankalar Hakkında 70 sayılı"
"w","W-NA16B4A-0120-66","İskender, tümülüsleri rahatça seçebildiği ovaya","baktı.","Gökyüzü incecik renk katmanlarına ayrılmış,"
"s","S-BEABXO-0143-1914","İrem de oynadı mı? Ay!","bak","simdi beni o zaman da"
"s","S-ACABQq-0425-44","İnşallah, bundan sonra yapacağı işlemlerde","Bakanlar","Kurulu daha dikkatli olurlar. Yüce"
"w","W-OE39C0A-0235-1265","İnsanlarına bakın, rakamlara bakın, gençliğine","bakın.","Pek bir şey yok. Hepsinden"
"w","W-NG43C2A-1805-2222","İnsanlar dünyaya Greimasçı göstergebilimin odağından","baksalardı,","birçok olguyu daha iyi görme"
"s","S-BEABXO-0091-907","İngilizce yapmışım oranın haberim yok.","Baktım","İngilizce konuşuyor. Öyle ses arasındaki"
"s","S-BAABXj-0001-1278","İngilizce nasıl deniliyor? Hadi bilin","bakalım.","Biline bitane araba alacam. Rusça"
"s","S-ADABLp-0061-611","İmamın oğlu, imamın kızı diyor.","Bakın","ülkemizde imam, imamlı imam uşağı"
"w","W-QA16B1A-0713-1664","İlk insan halinin esirgeme, yekdiğerine","bakma","hali olduğuna dair, nereden edindiğini"
"s","S-ADABI\-0438-1431","İlgilenmedim. Peki böyle bu reyonda","baktığınız","oldu mu hiç? Bebek bezlerine"
"w","W-SI44F1D-5101-84","İkisine uygulamayı yapacaksınız ikisine normal","bakacaksınız.","Özel verdiğiniz solüsyon dışında herşey"
"w","W-QI41C3A-1457-2331","İkinci olarak da kapıdaki menülere","bakıp","fiyatlarının makul olup olmadığını anlamak"
"s","S-BEABX{-0085-1599","İki masa orda kurulmuş gel","bak","diyor oda masayı bırakmış gelmiyorum"
"w","W-MG03A4A-1036-710","İdeolojinin ve ideolojik öznenin dümdüz","baktığı","ve yöneldiği alanlara, sanatçı ve"
"w","W-ID39C2A-0756-371","İbrahim bırakmıyor. Bir de ben","bakayım","kim çalmış kapıyı dedi. O"
"s","S-ADAABo-0367-1685","İbn-i Haldun'un söyledikleri üzerine düşünmek,","bakın","içinde yaşadığımız dünya hakkında bize"
"s","S-BEABXO-0436-1413","işte. Padişahında arkasından atılıyo. Şimdi","bak","bazı şeyler vardır insanlar her"
"s","S-BEABXO-0002-137","işte. Bizim binaya gelen çocuk","bakan","kadınlar var. Anne bizim binaya"
"s","S-BEABXO-0263-840","işte, gittik. Orada indik, adama","baktım","oturuyor, ha dedim burası dedim."
"s","S-BEABXp-0156-1856","işte şu şu şu kullanımları","bakın","buna gönderme yapıyo. Aslında güzel"
"s","S-ADABIA-0109-2407","işte yok da siz.. sen","bakıyon","da... şu da bu da..."
"w","W-UA16B1A-1218-1423","işte tam onun önüne gelince,","baktım","bir boğa güreşçisi resminin içinde"
"s","S-BEABXW-0173-422","işte iftar oldu babam geldi","baktık","elinde limon yok limonu unutmuş"
"s","S-BEABXO-0056-1762","işte böyle. Kim kahve falımıza","bakacak?","Sen bakar mısın? He bakacam"
"s","S-BEABXw-0353-1412","işte bak diyor bak bak.","Bakıyok","İsmail dedim. Bakıyok ismail. Ben"
"s","S-BEABXO-0091-783","işte al açtı mı bak","bakalım?","Oho vın o zaman... Benim"
"s","S-BEABXO-0006-1945","işliyorsun Yıldız Hanım? Ne istersen.","Baktım","Yıldız Abla evdeymiş ama sen"
"s","S-ADABPZ-0135-758","işlevlerine emm hep olumlu açıdan","bakmaktır","amacım. Emm aşırılıkları tabiki kimse"
"s","S-ACABQq-0425-2046","işlerini yürütmeye çalışıyorlar. Son dönemlerde","bakanların","bir bölümü, özellikle Başbakan da"
"w","W-FD05A3A-0569-2320","işlerinde eşlerine yardım etmeleri, çocuklarına","bakmaları","gibi. Ne var ki bu"
"s","S-BEABXO-0140-171","işkence oluyo. Şurası olsun fırın;","bak","o da tepsi gibi zaten"
"s","S-ADABAo-0308-764","işinize yarıyor mu? Sektörünüz açısından","bakıldığında","yani merkez bankası faiz indirerek"
"w","W-PI05C3A-0573-1976","işini, sorumluluğunu, Güldal'ın karşı çıkışına","bakmadan,","coşkuyla üstlenmişti. Anne adayının sağlığı"
"s","S-BEABXn-0349-877","işimiz çıktı falan dedi. Tamer'e","baktım","şey dedi. Yok kardeş sen"
"w","W-UA16B4A-0695-1184","işimden ayrılmaya. Geriye dönüp bir","baktım","neler kaybetmişim neler. Zorunlu olarak"
"s","S-ACABQq-0423-881","işe eşit ücret"" ilkesinden hareketle,","bakın,","bir jandarma assubay çavuşun ekgöstergesi"
"w","W-JI37C3A-0091-1892","işe bir de onun açısından","bakayım,","belki öğrenebileceğim şeyler vardır, diyerek"
"w","W-QA16B2A-0011-932","işaret etti. ""Rakıları hazırla,"" dedi,","""bak,","iki ayı teşrif etti."" Adamlar"
"s","S-ADABPZ-0125-2344","iş ortamı sonuçlarına göre çıkar.","Bakarlar","her yıl. Biz 2 yılda"
"w","W-HA16B3A-0781-2417","iş arasında başlarını kaldırıp birbirlerine","bakmaları","yok mu, hepimizin yüreği cız"
"w","W-DG03A4A-2997-1003","içten nişlerle teşkilâtlandırılmış halindedir. Kuzeye","bakan","portal, camiye doğru sonradan bir"
"s","S-BEABXA-0145-2336","içmi.. bırakıcam diyor. Dedim teyzecim","bak","sigarayı da öyle yap nolursun"
"s","S-BEABXO-0344-415","içme filan derken bitti. Genellemeye","bak","ne kadar yanlış. İçki içen"
"w","W-LA16B1A-1252-2433","içinden. Barış, yan gözle anneannesine","baktı.","""Tamam, Anacık. Bugün havanda değilsin."
"w","W-LC35C4A-0471-1692","içindedir. Her an biri eşine","bakmakta,","her an eşinin bir yerleri"
"w","W-IA16B1A-0094-2000","içinde."" ""Gölgem de burada, Nasuh,","bak!""","""Gölgen burada olduğuna göre demek"
"s","S-ACABTZ-0336-474","içinde. Büyük kentlere geldiğimiz de","bakın","Dünya'nın en büyük kentleri Paris"
"w","W-TF25D1B-2153-1902","içinde yer aldığına işaret eden","Bakan","Ali Babacan, ""Strateji olarak 1"
"w","W-FG03A2A-2016-1299","içinde silindirler, daireler ve konilerden","bakın.","Bir eşyanın her yüzeyi merkezi"
"w","W-PH42C3A-0808-1140","içinde kıvranırken yaralarından akan kana","bakıyor","diğer taraftan da kendisini öldürmek"
"w","W-KF05A1B-4422-790","içinde kadınların çalışmasına iyi gözle","bakılmıyor,","kadının çalışabilmek için önce ailesinin"
"w","W-IA15B3A-0555-1944","içinde eridiği, yok olduğu yere","bakması,","o insanlarla ilgilenmesi... gerekir. Yine"
"s","S-BEABXO-0091-483","içinde diyor. Pantolon çıkarttı gene","baktı","yok. Traktörle mi gittiniz oraya?"
"s","S-BEABXO-0380-1001","için. Değil değil. Ee! em","bak","daa parladı bu. Bu bitti"
"w","W-TI45F1D-4908-2233","için. Bir kez olsun aynaya","bakmak","yerine sürekli ""senin yüzün benden"
"w","W-NA16B1A-0753-2237","için, gözleri bantlı kelimeler biriktiriyorum.","Bakıyorum","da, iyi bir koleksiyoncu değilim"
"w","W-SE39C3A-0543-1267","için, bulvarın karşı kaldırımına geçip","bakabilirsiniz.","Buradan şu anlam çıkıyor Yarımadanın"
"s","S-AEABPZ-0331-2423","için önemli. Bu tablonun tamamına","baktığımız","zaman Türkiye'nin Avrupa Birliği'ne uyumda"
"s","S-ACABQq-0429-1457","için yeterli sebep değildir efendim.","Bak,","oyunuzu kullanmayabilirdiniz, kullandınız; en son"
"w","W-FE05A2A-1057-853","için U. Eser (1990)'e (1990)'e","bakılabilir.","TÜRKİYE SANAYİİNDE YAPISAL DEĞİŞME 4."
"s","S-ACABTZ-0336-1370","için teşekkür ediyorum. <Alkış> Kusura","bakmayın","vaktimi aştığım için ama hatırlatın"
"w","W-RA16B0A-0295-2402","için savunmasını henüz kuramamıştı. ""Kusura","bakmayın...""","dedi delikanlı sağ gözü üst"
"w","W-UH03A2A-0494-1959","için rahat giyinip soyunabilirsin diyor.","Bakın,","bir taraftan kendisine zaten haram"
"w","W-QE30D1B-2097-1582","için parlamentonun karar alacağını açıkladı.","Bakanlar","Kurulu'nun bugünkü toplantısının ardından yapılan"
"w","W-BE39C1A-0857-2327","için ne ümit veriyor, ona","bakmak","lazım."" dedi. Belli sayıda üretim"
"w","W-LA16B2A-0621-1450","için konuya giren Cemalüddin Efendi","""Bak","Stavro"" dedi, ""Senden geçmişini lanetlemeni"
"w","W-PI05C3A-0573-2133","için ikinci kitabın hemen çıkmasına","bakardı","kimi yazarlar. Uğur'un çıkar çıkmaz,"
"w","W-KE05A1B-3624-1587","için eğitim içsel getiri oranına","bakıldığında;","durum acı bir şekilde ortaya"
"w","W-DA16B4A-3349-1498","için durup bir an ona","baktı.","Babam onlara aldırmadı bile. Tehdit"
"w","W-QA16B2A-0066-203","için doğurdum. Ve ikisine de","bakamadım.","On sekizinde cinsellikle, evlilikle, anne"
"s","S-ADABI\-0438-1324","için dikkat etmedim. Şöyle bir","bakın","isterseniz metaryallere promosyona reyonlara şöyle"
"s","S-AEABUZ-0038-482","için de ormanları kesiyorlar. Ormanlar","bakıyor","ki bu gidişle bitecek. O"
"s","S-BEABXz-0387-192","için böyle bir sıcaklık var.","Bak!","Evet. <gülme> Bak ben... Bak"
"w","W-CF10A2A-1845-992","için bankalar bunlara ""hazır-para"" gözüyle","bakabilmekte","ve dolayısı ile açacakları kredileri"
"s","S-ADABCo-0179-1168","için asıldı. Mesela hemen arkanızdaki","bak","bu görüntüleri olan havuz <B>"
"w","W-RA15B4A-0542-2450","için arkasını döndüğünde kendisine manidar","bakan","Vicdan'a dil çıkardı. Bu kez"
"w","W-SA09C1A-0240-407","içimde. Heyecanım geçtikten sonra, dikkatle","bakarak","yüzünde keder izi aradım, bulamadım."
"s","S-AAABOp-0011-1225","içersinde değerlendiriyo. Dolayısıyla <D 1841>","baktınız","seçeneklerde sihirsel bi düşünme tarzı"
"w","W-TA16B2A-1188-1403","içeriye çağırdı. Kızlar merakla arkalarından","baktılar.","Sabırsız Sevil ellerini çırparak bağırdı"
"s","S-ADABII-0439-544","içerik ve kullanım kolaylılığı açısından","bakarsanız?","Güzel kolay yani mesela şunlarla"
"w","W-LF25D1B-2155-90","içeride hem dışarıda önünü açacaktır.","BAKAN","ŞAHİN'DEN MORAL Sanayi ve Ticaret"
"w","W-HA16B1A-0367-2169","içeri süzüldü. Çiço, antreden salona","baktığında,","halayla birlikte, anneye benzeyen üç"
"w","W-HG37C1A-0371-129","izleyiciye açtığı bir ""uzun, geriye","bakan","eğim""den eğim""den söz ederler Bir"
"w","W-SA14B3A-1588-2147","izleyebilirsiniz. 2.İŞÇİ Bey efendi. Buraya","bakın.","CERO Ne oldu? 2.İŞÇİ Şu"
"w","W-OE05A2A-1794-914","izlenebilir ve ölçülebilir olduklarına da","bakmak","gerekmektedir. Dolayısıyla, denetim ve hesap"
"s","S-ACABQq-0425-1424","izlemeyi tercih ediyorsunuz?! Sayın Başkanım,","bakın,","Galataporttaki ihaleleri izlemek Başbakanın görevi,"
"s","S-ADABI]-0126-2013","izledim ama İstanbul'a izlediğim oyunlar","bakıyorum","şöle gerçekten daha fazla emek"
"w","W-RA16B2A-1050-1881","izin koparmaya çalışıyorum. ""Ama kızım","bak","baban haberleri seyredecek dedim, duymadın"
"w","W-DA14B1A-1672-612","iz sürmektesin. Telefonla aranabilecek evler,","bakılabilecek","kahveler, lokantalar, otel lobileri... MELTEM"
"w","W-HA16B4A-0979-1073","iyiyi dinlesin. Ve ancak güzele","baksın.""","O hanım, kıyamette senin pak"
"s","S-ADABAo-0382-565","iyiydim. Emm fakat bu dönem","baktığımızda","AB grubu emm daha ilgi"
"s","S-BEABXl-0008-1548","iyisi bi su içyim. Anne","bak","ben... Sen niye kendine bi"
"s","S-BEABXs-0130-1294","iyilikten dolayı çok kazık yedikte","bakalım","daha nereye kadar ben aslında"
"w","W-MA16B2A-0017-59","iyice yaklaştı, önünde durdu, yüzüne","baktı","kadın. Adam bir süre gözlerini"
"w","W-EE09C3A-3304-2224","iyi."" ""Yoo. Bir de ben","bakacağım.","Türk sefiri gözünden rahatsız diye"
"s","S-BEABXO-0149-691","iyi. Ama iphone'a benziyo. Telefona","bak.","O da Seydamet'i babasından fazla"
"w","W-LD02A2A-1477-1189","iyi uygulayan ABD'nin parti yapılanmasına","baktığımızda","Türkiye'den oldukça farklı. Amerika'da siyasi"
"s","S-ADABCo-0242-519","iyi oynamış mı? Açın bi","bakın""","diyo. Eğitimle ilgili de çok"
"w","W-FA16B1A-1920-325","iyi gelir mi? Sen söyle","bakalım","evladım fırın odunla mı çalışıyor,"
"s","S-BEABXT-0066-689","iyi bir yer olur. Ama","bakıyosun","ne olabilir, ne olabilir? İşte"
"s","S-BEABXz-0387-1396","iyi biliyor, bunları aslında emm","bak","bizim bir şeyimiz de Boyabatlıymışız"
"s","S-BEABXW-0069-1858","iyi bak Şöyle bakıyorum. Taşa","bakıyorum","okeye bakıyorum. <Gülme> <B> Oyna"
"w","W-SI27D1B-2831-625","itibaren hayata başka bir açıdan","bakmayı","öğrenen Sebahattin Genli, hayata küsmeden"
"s","S-BEABXD-0446-1527","Isır. Beş yüz kere uyandırıp","baktım.","<gülerek> Nefes alıyo mu falan"
"s","S-BEABXO-0056-1037","istiyorum. Cansu'yu götürün bir gün","baktırsın.","Tamam götürrüz. Dedi ki üçüncü"
"s","S-BEABXB-0073-795","istiyorum açıkçası ya. Bence gör","bak","ciddi söylüyorum. Aslında keşke şimdi"
"s","S-AEABUZ-0038-1383","istiyorsan bi problemle mi karşılaştın?","Bakacaksın","daha geçmişte bu olmuş mu"
"s","S-ADABCo-0315-473","istiyor ben doğum yaptım, çocuğuma","bakmak","için işe gidemedim. Parasız kaldım"
"s","S-ACABQq-0425-1986","istihdam vergisidir. Bu yönüyle de","baktığımızda,","yine, Türkiye gibi, işsizliğin yoğun"
"w","W-KA16B0A-0118-1325","isteyen yalnız kadına kötü kötü","baktı","resepsiyondaki genç. Kimliğimi gösterdim, paramı"
"w","W-SA16B4A-0047-2366","isterseniz"" diyerek önündeki kasa defterine","bakıyor.","""Borcunuz, sekiz yüz yetmiş bin"
"s","S-BEABXO-0379-2443","isterse tutsun. Nası isterse öyle","baksın","gidicem artık dayanamıyum. Boğazım kuruyu."
"w","W-SA16B4A-3367-476","istemiştiniz, dedi. Gözleri yapışık yapışık","bakan","adam hiç bir şey istemedi."
"s","S-ACABQq-0426-333","istemiyorsunuz saygıdeğer AK Partili milletvekilleri.","Bakınız,","burada, geçmişte bütün gücümüzle, detaylarıyla"
"w","W-DA16B4A-3349-267","istekli görünmediği çok uzaklıktaki ağaçlıklara","bakıp","duruyor öyle. Ablalarım avluda ağaçların"
"s","S-ADABAo-0433-437","istekleriniz de var. Şöyle bi","bakıyorum","istek panelime kimler istek yapmış?"
"w","W-UI22E1B-2914-1162","istedi. Biz de anlattık. Öğretmenimiz,","Bakın","çocuklar herkesin fıtratı yani yaradılışı"
"w","W-VI44F1D-4747-1476","ismi yazdım bi kenara arıcam","bakalım","inş. bulurum.. iyi geceler cnm"
"s","S-ACABFZ-0049-2369","isim bulmak lazım. Bu açıdan","bakıldığında","""küreselleşme"" çok isabetle seçilmiş bir"
"w","W-QF10E1B-3065-2049","ise katrilyon Lira olarak belirlendi.","Bakan","Unakıtan, 2004'te Gayri Safi Yurtiçi"
"w","W-KC29D1B-2794-1894","ise istenmez hatta öcü gibi","bakılan","olgular haline gelmiş olmasıdır. Eleştiri"
"w","W-RD36E1B-2842-661","Irmağı (biraz da ses benzerliğine","bakarak)","genellikle Seyhan (Saros) ile eşitlenmek"
"w","W-UI42E1B-2943-1686","Irmak kıyılarında gözyaşı döken şâirlere","bakmışlar.","Altına dönmüş toprak yanları. Bakmışlar,"
"w","W-JA16B2A-0759-900","iriyarı kahveci bu yana hiç","bakmıyordu","artık... Sanki o küçük, yer"
"w","W-TE39C4A-0264-941","Irak'ta olası gelişmelere bu açıdan","bakmak","her zaman milliyetçiliği körükleyecek Kürt"
"w","W-NA16B1A-0858-1195","ipucunu vermişti. Avucumda parlayan inciye","baktım.","Cado'yu çok sevmiştim. Bu inci"
"w","W-KA16B0A-1703-2333","inşallah... Olmalı be Bekir, olmalı...","Baksana","elâlem sırt hamallığından otel sahipliğine"
"s","S-BEABXO-0056-588","inşallah. Belki Pınar hamiledir. İnşallah!","Bak","benim falıma anne. <B> Anne"
"w","W-TI44F1D-4754-2395","inşallah saol arkadaşım kendine iyi","bak","hoşçakal slm ben şu tüp"
"w","W-KD05A3A-0725-285","intihar? Ama son birkaç yıldır","bakıyor","ki insanlar köprüye çıkanın başına"
"w","W-LD02A0A-1700-4","intihar girişimi arasında bağlantı ihtimaline","bakılmıştır.","45 (%60) olgunun çocuk bakmadığı,"
"s","S-BEABXE-0082-1492","internetten ordan çalıştığım gün sayısına","bakacam.","E-devlet aldın mı? Aldım. Hiç"
"s","S-ADABPZ-0134-679","insanın varlığıyla ilgili. Biraz geriye","baktığınızda","aa bizim emm Aristo'dan beri"
"s","S-BEABXT-0066-1047","insanın kendisi çalışmadıktan sonra. Valla","bak","İlkin saınavda girdi, dersane falan"
"w","W-RD36E1B-2842-2457","insanların ve toplumların hep ileriye","bakmasını,","geleceğe uzanmasını, yaptıklarının büyüklüğüyle değil,"
"w","W-VI45F1D-4796-2494","insanların ""kendilerine"" olmasa da görüntülerine","bakıp","onlarla ilgili hikayeler uydurmayı seven,"
"w","W-EA16B4A-0383-2145","insanları? O sevimli köyevleri, gökdelenlere","bakıp,","çarpuk çurpuk boy atıyor artık..."
"s","S-BEABXO-0091-193","insanlarda... Çocuklarda bal yedirilmez. İşte","bak","o götveren de dinlemiyo. Bakteri"
"w","W-PG37E1B-2923-519","insanlara. Kaskatı suratlarına, cansız gözbebeklerine","bakarak","küçük insanların küçük masallarını anlatacağım."
"s","S-ACABUZ-0035-733","insanlara emm dini çerçeve içinden","bakmaya","alışmışlar. Tevfik Fikret ee beklide"
"w","W-HI27D1B-2824-294","insanlar çocuk sahibi olmamalı. Ama","bakabileceklerse","çok çocuk yapmalı topluma pırıl"
"s","S-BEABXw-0395-2320","insanlar ne kadar beni, böyle","bakarsa...","Evet. Onun hoşuna gidiyor çünkü."
"s","S-ADABPZ-0374-1890","insanlar içindir yazar birinci cümlesi","bakın","Müslümanlar için değil, Türkler için"
"w","W-SE36E1B-3352-517","insanlar değiliz. Vekilleriz. Bir davaya","bakan","avukatlar gibiyiz. Nasıl ki bir"
"s","S-ADABDp-0187-711","insan... Tamam içmicem tamam. Şimdi","bakın.","Şimdi bir saniye <B> Hadi"
"s","S-BEABXO-0092-1269","insan geliyor. Bir iki saat","baktığı","zaman o daha çok değere"
"w","W-KA16B4A-0121-1381","insan bir insanın yüzüne baka","baka","onu kolay öldüremez. Bir insanın"
"w","W-OA16B4A-0127-1886","inmemişti ve Tanrım, dosdoğru bana","bakıyordu.","Başımı çevirdim. Ayak seslerim hızlandı."
"w","W-TG37E1B-3067-1868","inerek bunları anlattılar. Olayın tümüne","baktığınız","için avantajlı olduğunuzu düşündünüz mü?Projeye"
"w","W-NA16B2A-0497-757","indirmeden küçük kızın parlayan gözlerine","baktı","ve ona gülümsedi... O sırada"
"s","S-BEABXs-0130-451","indi aşağı kimmiş bu bi","bakalım","dedi konuşuyor bizim arkadaşlar dedim"
"w","W-FA14B1A-1502-1107","inceliği bütün yaratıkların dilinde. Uzungaga","Bak,","bak!.. Aşağıya doğru süzülüyorlar... Laklak"
"w","W-DA16B2A-0032-1017","ince çalışılmıştı ki, insan anahtarlığa","bakmaya","doyamıyordu. Yalnız bu söylediklerim işin"
"w","W-CA16B2A-1299-1496","ince tozlar yığınının ince ufuklarından","baktığım,","ilk anlatıları dinlediğim, çocukluk şafağımın"
"w","W-UA16B2A-0398-1901","inançla onlara, kutsal insan gözüyle","bakmaya","başladılar. Bu inanç yaygınlaşınca, köylüler"
"w","W-JA16B4A-1747-825","inanmaz gibi. Saklı saklı Ayten'e","bakmaya","çalışıyor. Karşısında dikilen Metin'e bakıyor."
"s","S-BEABXO-0456-2362","imza verdi. Bah hem gendi","bah","iki sene at yapti iki"
"w","W-FA16B3A-0986-1028","imtihanının suallerinden de, şöyle bir","baktım","da çoğunu havada karada çözerim."
"w","W-TD09C4A-0211-102","imkanlarını kesince örgütte çökme başladı.","Bakın","bunun aksi, demin anlattığım olaylardan"
"w","W-WI44F1D-5089-2100","imişim, nedenmi?? ameliyattan önce Photoraflara","bakarken","yaşadığım kente tanıdığım çok iyi"
"w","W-KI37C3A-0997-378","imge. Her şey sahte... Bir","bakmışsınız","karşınıza bir macera adası çıkıyor."
"s","S-BEABXO-0392-838","imansız Memo. Ya nereye geliyor.","Bak","ben geliyor deyince bak başka"
"s","S-ADAB^Z-0370-1353","ilk önce emm üniversite açısından","bakarız.","Bu üniversite yönünden bakıyorum ben"
"w","W-ME39C0A-0349-103","ilk yaşam dersini Erciyes'in zirvesine","bakarken","almıştı. ""Başını kaldırdığında şapkanı düşürmeyeceksin!"""
"w","W-GE37C2A-0549-118","ilk komünist avı gerçekleştirilmiş ve","Bakanlar","Kurulunun 23 Ocak 1921 tarihli"
"w","W-KD03A0A-0261-334","ilk kez bu sözün anlamıyla","bakmıştım.","Kadının dikkat çekici hiçbir özelliği"
"s","S-ADABAo-0308-1394","ilk iki teşvik dönemindeki trendlere","bakarsanız","emm ilk teşvik konduğunda 15"
"s","S-ADABII-0439-1476","ilişkin açıklama yok. Evet mesela","bakın","Latin danslarını açıklamış pazartesi Çarşamba"
"w","W-NE22C2A-0113-549","ilişkilerine, ""cinayet işleyip işlememe"" açısından","bakmayı","huy edinmeniz halinde, işleyeceğiniz cinayetler"
"w","W-PF10A0A-2034-123","ilişkilerine daha eleştirel bir gözle","bakıyor,","sistemi içselleştirmiyor; bu yüzden yolsuzluğun"
"w","W-IE39C4A-0513-2343","ilişkiler içinde alındığıdır. Bu açıdan","bakıldığında,","1990'a kadar ""varolan sosyalizm"" ya"
"w","W-LA16B1A-1366-427","ilişecek, oturup denize, geçen vapurlara","bakacaklar;","babaannem de büyük babamı çekiştirecek."
"s","S-BEABXO-0436-1847","ilin gızı onu şi itmiyo","bak","çayı demliyon ya sevmiyo ya"
"w","W-JD02A1B-3832-2345","ilgisini anlayabilmek için aşağıdaki şemalara","bakalım","(10a) ve (10b) arasındaki ilk"
"s","S-ACABQq-0425-510","ilgili tavsiyenizi yapın. Ben de,","Bakanlar","Kurulu üzerinde konuşuyorum. Şimdi, bu"
"s","S-BEABXp-0156-2285","ilgili o sosyodilbilim kitaplarına yine","bakıp","nasıl olmuş... Evet. Yine neler"
"s","S-ADABAo-0433-2279","ilgili konuşalım, Eris yazmış şimdi","bak","ne diyor türk dil kurumunda"
"w","W-KI13C3A-1368-647","ilgili kararları oluşturanlar da bunlar...","Bakın","kentlerimize, hemen göreceksiniz; ne çocuklar"
"w","W-OA16B2A-1253-1532","ilgilenmesini bekledi; ama çocuk ona","bakmadı","bile. Ancak çizgi film bittikten"
"s","S-ADABII-0439-2083","ilgilenmedim... nasıl üye olurum hepsine","bakmıştım","bunların etkinlik takvimine bakmıştım sizin"
"s","S-ACABQq-0425-1778","iletilir, tutanaktan takip eder Sayın","Bakan.","Şöyle söylemiştim Eğer malî politikalarında"
"s","S-ADBBI^-0326-626","ilerlerler ben hemen arkalarından söylerim,","""Bak","şimdi bunlar flört ediyor ya,"
"w","W-SA16B2A-0311-2363","ileri gittiğinde de..."" Hasta halasına","bakarken","ara sıra eve gelen enişteyle"
"w","W-GD36C4A-0206-2103","ile Mehmet Yazıcıoğulları çıkar!"" ""Araştır","bakalım;","27 Temmuz 1992 tarihinde Mazgirt"
"w","W-FH13C2A-3313-1238","ile karyolasına bağlıyor. ""Böyle bırakma.","Bak","demir parmaklığı kırabildiğine göre, bu"
"w","W-QC05A2A-2047-909","ile bilişsel gelişimin arasındaki ilişkiye","bakan","araştırmalar; 2) Oyun ve oyuncak"
"w","W-GD36C4A-0206-361","ile Batmanlı Adem Yakın var.","Bak,","Alaattin Kanat kesinlikle tetik çekemez."
"s","S-ADABI\-0438-2010","ile ama sonra beğenmedim.Sonra bunlara","baktım","ama bunlarda duş jeli imiş."
"s","S-ADABLp-0061-1048","il Tunceli. Başka olay Türkiye'de,","bakın,","kent nüfusu 10.000'den fazla olan"
"s","S-ACABQq-0422-548","il konumundadır. Yine, yol sorununa","baktığımız","zaman, kazmayla, kürekle otuz kırk"
"s","S-ACABQq-0425-2274","iktidarın direttiği uygulamaya şöyle bir","baktığımızda,","istihdam oluşturan yatırımcının sanki... Buyurun"
"s","S-ADABLp-0061-2282","iklim diyebilir misin? Diyemezsin. Şimdi","bakın","Marmara Bölgesi'nin tamamında nüfus çoktur"
"s","S-ACABTZ-0336-235","ikisi de profesör ikisi de","bakanın","danışmanı. Bu raporu internette her"
"w","W-HI09C4A-0481-1523","ikiletmeyecekti. Kahvaltı masasındaydık. Tahir'e yalvarırcasına","baktım.","Neyse Meral'e arka çıkmadı bu"
"s","S-BAABXj-0001-872","ikide işte üçe geçecek. Hocam","bakar","mısınız ya? <D 3> Ben"
"s","S-BEABXO-0006-1036","iki. Hep iki yaş aralarında.","Baka","belki daha eksik daha fazla"
"s","S-BEABXO-0389-26","iki üç dört çiftim var.","Bakayım","bir alternatif sunalım <B>. Alternatifin"
"s","S-ADBBI^-0326-1051","iki sıra da çamaşır ipi.","""Bakın","sokak tarafı burası, ev tarafı"
"w","W-TE30D1B-2134-643","iki kıyısından tarihe aynı şekilde","bakabileceğini","ve geleceğin uzlaşı ve işbirliğinin,"
"w","W-QA16B1A-0731-1399","iki kol bandını uzattı. ""Takın","bakalım,","siz ikiniz bu hafta temizlik"
"s","S-BEABXO-0006-572","iki kere falan da. Bi","baktım","Kenan geldi ben banyoya giryorum."
"w","W-PA16B4A-0162-1782","iki eliyle yüzümü tuttu, gözlerime","bakıp,","""Asıl günün birinde sana rastlayacağımı,"
"s","S-AEABUZ-0021-439","ihtiyaçlarınızı karşılarsanız, bencil olun demiyorum","bakın","bakın o yanlış... <B> Bakın..."
"w","W-TI12F1D-4852-1351","Ihlara vadisi idi. En tepeden","bakınca","oyulmuş çukur gibi görüntü sergiliyor."
"w","W-JA16B2A-0994-1374","ifadeyi gülümseyerek seyretmekte olan Somi'ye","baktım.","""Sen bunu biliyor olamazsın"" dedim."
