"Register","Text","Left","-5;5","Right"
"w","W-RF25D1B-2146-2400","sonu yaptığı görüşmelerde, ""Fona alım","olmamalı,","denetimi murakıplar yapmalı, yabancılar banka"
"w","W-TA16B4A-0090-1179","sonsuz. Nilhan'ın kendisine doğru gelmekte","olduğunu","gördü. Kalkıp karşıladı onu, kucaklayıp"
"s","S-ADABCo-0314-2241","sonrasında ilk defa isteğe bağlı","olacak","olanların bağkurlu sayılacağına dair bir"
"w","W-VE05A1A-2715-185","sonrasında ikincil bir tehlikeye neden","olmaması","için hasar görebilirlik açısından öncelikli"
"s","S-ADABAo-0368-1722","sonrasında dua ediyordu. ""Allah'ım ne","olursun","işte inşallah oğlum akıllanır normal"
"s","S-ADABAo-0308-1119","sonrası için daha kalıcı bişey","olması","gerekiyor. Emm örneğin hurda teşviği"
"s","S-ADAASK-0036-1357","Sonra, işte kazalar oluyor, boşanmalar","oluyor,","cinayetler oluyor. Yapılan istatistikler bunu"
"s","S-ADABAo-0355-541","sonra üniversite, ol yani bu","olabilir.","Olur, sizin sisteminiz bu da"
"s","S-BEABXs-0130-223","sonra önüme konservatuara girmek isteyen","olursa","söylicem tiradlarına çalış fazla düşünme"
"w","W-WI45F1D-4802-1682","Sonra pişkin pişkin gülüp ""aa","olur","mu, bizde herkes yasalar önünde"
"w","W-PA16B4B-3311-2460","sonra oraya ulaşacaktır. Lütfen rahat","olunuz.""","dedi. Kiraz'ın korktukları başına gelmeye"
"s","S-BEABXO-0344-2102","sonra konvoy oluşturuluyo ordan şey","oldu","yaylaya çıkardılar bi de yaylada"
"s","S-ACAAPZ-0327-1326","sonra konuşmanın ne kadar zor","olduğunu","biliyorum. Ama mecburen konuşacam. Başka"
"s","S-ADABII-0439-288","sonra ilk rocke coke festivali","olarak","başladı. Hı-hıı. Gerçekten çok büyük"
"s","S-BEABXO-0344-1494","sonra gelin ve damat pişman","oluyo","ben bunu biliyorum. Keşke sade"
"s","S-ADBBI^-0326-1962","sonra da unutuyorsunuz; her şeyde","olduğu","gibi. Vefalı dostluklar kurulamıyor, herkes"
"s","S-ACABFZ-0049-235","sonra da küreselleşme olgusunun tarihsel","olarak","ortaya çıkmasıyla sosyal devlet arasındaki"
"s","S-ADABCo-0202-1947","sonra da gelemezdim. Başınıza bela","olurum","diye gelemedim. <Gülme> Senin gimi"
"w","W-VI13C3A-2641-1035","sonra da Biz bilemedik, teslim","olduk,","cevabı siz söyleyin, demişler. Bir"
"w","W-HB04A1A-1537-1829","sonra bitki ekilmesi kanın mineralize","olması","bakımından uygun olmaktadır. Kan tozunun"
"w","W-KE39E1B-2839-289","sonra açılır. Sivas'ta Maarif Müdürü","olarak","görev yapan ünlü şairin düzenlediği,"
"s","S-ADABPZ-0134-1361","Son. Zaman yetersizliği nedeniyle böyle","olmak","zorunda, buyrun. Ferhat Aslan, Ferhat"
"w","W-DE39E1B-2889-1882","somutluğunda bir ulusal hareket olarak","olabilecek","en sol konumlardan birisini almıştır."
"w","W-OD36E1B-2857-1805","solda bırakmazlardı. ""Evet"" cümlesi ""Hayırlı""","olmaya","başladığında, ""evet""in ""evet""in tarihen ve"
"w","W-HE22C2A-0368-791","sohbet koyulaşıyor, genç çiftin balaylarında","olduklarını","öğreniyoruz. Bir ara genç damat"
"s","S-BEABXO-0431-699","sloganında bile hangi inanca sahip","olursan","ol bütün insanlar bi yerde"
"w","W-PI31D1B-2430-1695","skoru ile ilgiliyse, kendisine yardımcı","oluruz.","Güneş, ekibine o kadar güveniyordu"
"w","W-SH42E1B-2919-235","sizin niteliğinize, ne aradığınızın bilincinde","olmanıza","bağlı. Tanıma işini adayla da"
"s","S-ADABPZ-0373-320","sizin bilgi ve donanımınıza bağlı","olduğunu","bilmektesiniz. Ancak içinde görev aldığınız"
"s","S-ADABII-0439-2315","sizi? Evet biraz daha esnek","olabilir.","Peki arkadaş çevrenizde bir değişiklik"
"w","W-TE36E1B-3295-322","Size en yakın isimlerden biri","olan","MİT Müsteşar Yardımcısı Hiram Abas'tı."
"s","S-ACABQq-0425-2418","size de herhangi bir hakaret","olursa","buna tepki gösterin. Değerli arkadaşlarım,"
"s","S-ADBBI^-0042-1282","siz istemeseniz dahi sizi taraf","olarak","gösterirler, bundan güç almaya çalışırlar;"
"s","S-ADABPZ-0374-91","siz Amerika Birleşik Devletlerinin yerinde","olsanız","ve şu bölgeye hakim olsanız,Orta"
"s","S-ACABQq-0422-1018","Siyasî Kriterlerine uyum durumumuzu değerlendirecek","olan","2003 yılı ilerleme raporu yaz"
"w","W-OA16B4A-0326-557","siyasi basiretsizliğin son ürünlerinden biri","olan","ve güzelim ülkemizin, arş-ı âlâyı"
"s","S-ADBBI^-0042-1128","siyasi anlamı olan son toplantımız","oldu.","Belki daha sonraki tarihlerde hükümet"
"w","W-EI22C4A-0868-943","siyah boyaları temizleyecek, ortalık tertemiz","olacak,","hihiho, tertemiz olacak, hihihoohiyyttttt, en"
"w","W-CE05A1B-3394-991","sivrilmesi, başbakanlığını ortaya çıkmasına neden","olmuştur.","Kabine, parlamentoya karşı sorumluluk altına"
"s","S-ACABTZ-0336-2129","sivil toplum örgütlerinin davranış biçimiyle","olan","bir olay. Gayet tabiki emm"
"s","S-ADABI]-0127-1346","sistemin bozuk olduğunu sistemin yanlış","olduğunu","görücekler. Bu da oyuncunun hani"
"w","W-MI29D1B-2449-1575","sismik yöntemler arazinin büyüklüğünden bağımsız","olarak","zeminlerin kesme modülünü belirlemede etkin"
"s","S-BEABXO-0436-1056","sinmiş yinmiyo hani böle laflar","oluyo","demi hani kötü şisine değil"
"w","W-PC06A3A-1954-2222","silindirik koordinatlarda yazalım. Sınır değeri","olarak","viskoz akışkanın hızının tübün duvarında"
"w","W-KA16B4A-0886-125","silerek, sanki bütün bunların hiçbiri","olmamış","gibi bizi alıp gene mahzenin"
"w","W-UG03A2A-2014-1790","silahların yine doğadan alınmış silahlar","olduğunu","anlatan bir bilgedir şaman. Şaman"
"s","S-ADAABo-0367-1097","silahlar değildir. İşte tüfeng icat","olmuş","mertlik bozulmuştur. İşte artık göçebe"
"w","W-IE39E1B-2837-2398","silah üretirler. Ancak bu silahlar,","olmayan","bir savaşta kullanılmayacağı için Marko'nun"
"w","W-NI22C1A-0290-2322","silah çıkarmasını önlemek için başlamış","olabilir.","Ancak sonraları dostluğun bir ifadesi"
"s","S-BEABXO-0091-754","Siktir git lan sadıçın madıcın","olmuyom","git kimi buluyorsan bul amına"
"w","W-SE36E1B-3352-1354","Siirtli gençlerle de görüşme şansımız","oluyor.","Harran'da gençlerin aklı bir gün"
"w","W-QF07A2A-1871-1895","sigortası ve sakatlık sigortası primi","olarak","da işlev görür. Normal emeklilik"
"w","W-JI39C2A-0646-78","Show TV? Inter olmaz. Star","olur.","Ölçü köken değildir. Star var"
"s","S-ADABII-0439-2253","seçtiniz? Evet okudum seçtim uygun","olanı","gidebilirliyim dedim sonra ayarladım gittim."
"s","S-ACABPA-0434-654","seçmenimden çok daha yüksek seçmen","olacaktır.","Dar bölgenin birçok mahzurunu biliyorum,"
"w","W-GD36C4A-0206-1886","Sezgin'den alıyorduk"" şeklindeki sözlerine inanmak","oldukça","güç! Gerçekten Türkiye Cumhuriyeti'nin İçişleri"
"s","S-BEABXg-0090-830","Sevmiyorum değil ben senin yerinde","olsam","anında şuan yani şuan... Şuan"
"s","S-ADBBI^-0326-86","sevmediğim siyasetçiyi sevmiş olabilir, itici","olabilirim.","Söylemek istemiyorum. Benim siyasetçilerden sevmediğim"
"w","W-PG03A1B-3257-18","seviyordu. Böylesine zayıf ve silik","olması","önemli değildi, yanında biri olmadan"
"s","S-ACABPA-0434-1397","seviyeye indirilmelidir. Bu %3-%5 %3-%5","olabilir.","Gerçek bir yazılım sağlanırsa, biz"
"w","W-JI37C3A-0091-630","sevgiyi iletemiyoruz. Kimimiz iyi terbiye","olsun","diye, kimimiz çocuk disiplinle yetişirse"
"w","W-SI22C4A-0828-1719","severlerin yönlendirmeli bir oyun karşısında","oldukları","da herkesin malumu. Fakat içten"
"s","S-BEABXg-0090-1890","sevdiğim goller böyle adam deli","oluyorum.","Kaydı ama yetişemiyor. Ya vuruş"
"w","W-CH42C3A-0981-28","Sevdiği bir atı, kimsenin sahip","olmadığı","bir sarayda göz kamaştırıcı ziynetlerle"
"w","W-OG37C0A-0191-950","sessizce Jozi'yi gösterdi. Jozi tip","olarak","hiç de benim önyargılarımdaki müzisyene"
"s","S-ADABAo-0433-81","seslenen dj Şafak sizlerin iyi","olmasını","istiyor çünkü sizleri seviyor ve"
"w","W-QA16B2A-3350-1839","sesle. ""Başka bir yerde Süleyman","olamayacağını","sanıyor galiba."" Ağlamamak için kendini"
"w","W-ED36C2A-0116-934","sesin hep aynı şeyleri söyler","olmasından","hiç şüphelenmediler. Bireyi ezen ideolojilerden"
"s","S-BEABXr-0078-194","sesin gelmiyo. <D 22> Ne","oldu?","Sıkıldım Duygu. Sıkıldım <fısıldayarak> Niye"
"w","W-MI32D1B-2565-955","ses verenler çoğalacak. Hiç kuşkunuz","olmasın.","Açın bilgisayarlarınızı, bu ses nasıl"
"w","W-OE07A0A-2038-2292","Service 2000"" programını anmak doğru","olur.","ABD'de Clinton yönetiminin 1993'te başlattığı"
"w","W-FE39E1B-2891-176","sermayenin varolan miktarının da kârlı","olarak","çalışabileceği yeni bölgelerin aranmasıdır. Emperyalizmin"
"w","W-PG24D1B-2301-2175","seride mevcut. Cool'cuların etkilendiği isim","olan","Lester Young'ın 1936-1943 dönemindeki kayıtları"
"w","W-RF25D1B-2162-133","sentetik ve özellikle polyester kumaş","olmak","üzere tekstil ve konfeksiyon, otomotiv"
"w","W-RA16B2A-0840-367","sensiz olmuyor Hatice. Sensiz de","olmuyor","İsmail. Senin gibi temiz yürekli,"
"s","S-BEABXO-0455-2267","senin. Var yaa! bi hazır","olsa","Şule Abla direk senin yanındayım"
"w","W-JA14B1A-1689-1774","senin tatlı hırlamaların... KELOĞLAN Sağ","ol","beyim, sayende. Ama bir müşkülüm"
"w","W-JH42C0A-0337-1778","senin oğluna vereceğim."" Dikkat edilecek","olursa","Tanrı, bu sözleriyle insaf ve"
"s","S-BEABXQ-0009-2186","Senin hedefin kime benzemek? Vücut","olarak.","Ajda Pekkan. İdolüm. <Gülme> Salak."
"s","S-AAABXN-0004-12","Senin buraların hep çizgi çizgi","olmuş","ha. Dicekler ""niye yemiyosun"" falan"
"s","S-BEABXT-0066-2118","senin bu şeyler? Hemen belli","olmaz","di mi bu tür işler?"
"w","W-RA16B2A-1246-1064","seni evlendirelim' dediler. Ben de","'Olur'","dedim. Nikahımız kıyıldı, deve yükleri"
"w","W-TE41C1A-0447-347","sene müddetince chatin bir bağımlılık","olduğunu","söyleyebilirim. Dersten geldiğim zamanlar, asgari"
"s","S-BEABXJ-0076-1133","sende şey yapma. Kan dolaşımı","olmuyo","ya baş ağrısı yapıyo ha."
"w","W-WI44F1D-4753-586","sen rüyanda da gerçek kardeşine","olan","duygularını görüyorsun ama başka birini"
"s","S-BEABXw-0353-1109","Sen dedi beni yanlış anladın","olur","mu dedi ben sana hemen"
"w","W-JA16B4A-0875-1208","sen de o zaman barmen","olursun,","dedim. Küskün küskün yüzüme baktı,"
"s","S-BEABXw-0391-1743","Sen bi şeyler yapmak istiyor","olabilirsin.","Ama sahne sanatlarında sen niye"
"w","W-RF25D1B-2770-1176","sektöründeki artış yüzde 4.2 düzeyinde","oldu.","Ocak-Kasım 2004 dönemindeki toplam üretim"
"s","S-ADABAo-0310-1691","sektöründe diğer bozulmaya yüz tutmuş","olan","emm çabuk yüz tutan gıda"
"s","S-BEABXO-0147-721","sekiz çarpı dokuz çarpı on","oluyo","şu an. Hmm. Yani sekiz"
"s","S-BEABXv-0407-1029","sefer ya. <gülme> Yarım saat","olmadı","bile. Salak yerine koyuyo bu"
"s","S-ADABLp-0062-2340","Sebebi hammadde olması, ulaşım yollarında","olması,","Marmara'ya yakınlık. Başka. Arkadaşlarım yeraltı"
"w","W-LE39E1B-3031-1908","Schopenhauer'ı okuduğum bir zamanda, insani","olanı","merkezinden kovan kentin soğuk ve"
"s","S-ACAAPZ-0034-2068","sağlık bilimleri fakültesi olacak. Birlikte","olmasına","gayret göstericez. Yani biz kendimize"
"w","W-VI45F1D-4708-1133","sağlıcakla"" Facebook'ta her eklediğiyle dost","olmaya","çalışan arkadaş canlısı bir insan."
"s","S-ACAAPZ-0328-2324","sağlanamadığı bildirilmektedir. Yani problem gerçekten","oldukça","büyüktür. Problemi yaratan kronik hastalıklar"
"s","S-ADAB^Z-0370-2044","sağlanabilir. Gelişir üniversite, zararı da","olur.","Emm örneğin iyi bir iş"
"w","W-MG24D1B-2298-2015","sağlama alacaksınız. Her şeye açık","olacaksınız","ancak dikkatli olmakta yarar var."
"w","W-UI19E1A-4003-451","sağlam gömleklerimiz, şunlar da özürlü","olanlar,","dedi. Özürlü olanlar daha ucuz."
"s","S-ACABUZ-0035-1421","sağ olun. Bizi aydınlattınız sağ","olun.","Ben şey söylemek istiyorum. Tevfik"
"s","S-BEABXO-0344-1907","Saçı nasıl anlatcaz? Saçsız mı","olcak?","Mesela saç yapalım da... Şunun"
"s","S-BEABXO-0344-961","saçma maçma... Komik olsun. Komik","olsun.","Rengarenk olsun. Zaten komik baksana"
"w","W-HE39E1B-2836-900","sayısının yarıya yakınını oluşturuyor. İlçe","olmak","için mücadele veren belde sayısı"
"s","S-ACABPA-0434-240","Sayın Özal geliyor. Şimdi kim","olacak","onun tartışması var, Çiller veya"
"s","S-ACABQq-0420-417","Sayın Dışişleri Bakanımız keşke burada","olsa","da, gerektiği yerde rahatlıkla konuşabilsek."
"w","W-OI22C2A-0414-2059","sayıları arttıkça avcıların tadı güzel","olanlara","rastlama şansı artacağından denge bozulur."
"s","S-ACABQq-0421-1041","sayılabilecek Büyük Atatürk'ün doğduğu yer","olarak","kabul ettiğimiz güzel Çanakkalemiz Gelibolu"
"w","W-KE39C3A-1352-1164","sayıdaki belgede ve onlarla çağdaş","olanlarda,","eski Babil çağının geç zamanlarına"
"w","W-TE41C1A-0447-2070","sayıda da olsa entellektüel birikimi","olan","insanların gelip, paylaşımda bulunduğu bir"
"s","S-ACAAPZ-0032-2228","saygı duyuyorum. Ve ben örnek","olarak","kendime onu aldım ve almaya"
"s","S-ADABPZ-0373-1867","saygı duyacağıma Bana bireylerle ilgili","olarak","verilen Bana bireylerle ilgili olarak"
"s","S-ADABPZ-0135-881","Saxon'un etik dünyasında. Neden ahlaklı","olmalıyım?","Yani benden herkes dürüst olmamı"
"w","W-KE39E1B-2839-895","savunuyorlar. Baykal'ın, üniversitelerde başörtüsünün yasaklı","olmamasına","inandığı da aktarılıyor. Kamu koleksiyonculuğuna"
"s","S-BEABXO-0440-1993","savunur muydun? Aa! Adama gıcık","oldum","ben. Bu maçtan sonra varya"
"w","W-RE30D1B-2099-1018","savundu ve ""Süreç sonunda uzlaşma","olmazsa","Anayasa da olmaz. O zaman"
"w","W-RE39E1B-2903-1400","savunanlar da var, tanrının var","olmadığını","savunanlar da.... Benzer şekilde, bazılarının"
"w","W-NE41C3A-1031-113","savcısı nezaretinde yapılan tatbikatlarda öyle","olmadı","mı? Mumcu Cinayeti'yle ilgili tatbikat"
"w","W-MA16B1A-0689-1409","savcım, olmuyor, insana insan yardımcı","olmak","zorunda. Acil olan neymiş?"" ""Adam,"
"s","S-ADABCo-0250-1203","savaşında da böyle bir anlaşmazlık","olmuştu.","Bu krizi de atlattık ve"
"s","S-ADABAo-0388-2151","savaş meydanında ölmektir. Yatağında ölene kahraman","olmayan","biri gözüyle bakılıyor. Bir ölüyle"
"s","S-ADAB^o-0132-513","savaşlardan bıkmış Yunanlı bir kadın","olarak","izleyicilerinin karşısına çıkmaktadır. Bu kadın"
"w","W-CI22C3A-0678-1826","Satın alırken, akıllara zarar buluşları","olan","iki kafadar, bir hata yapmışlar"
"w","W-JF32D1B-2575-254","satın aldığı mallardan çok memnun","olduğunu","ya hakem heyetinden habersiz olduğunu"
"w","W-EF10A3A-1838-761","satılması için yapılan bir anlaşma","olarak","tanımlanabilir. Para swapı için; iki"
"w","W-SB04A2A-1993-182","sarılma) Locaların sarılması, Miliolidae familyasında","olduğu","gibi, çok sayıda ve farklı"
"s","S-BEABXO-0389-815","Sarı derim. Yok. Ama sarı","olsun","yani. Ne bileyim. On iki"
"s","S-BEABXA-0145-638","sarhoş olur pislik olur mislik","olur.","Evet. Bizimkleri de oynuyodu işte"
"s","S-ADAACo-0205-1110","Saraç da biraz önce bütün","olarak","göreceğiniz bir figürün maketin diyelim"
"w","W-VF10A3A-1814-1342","saptayalım. Düopol piyasasında, alışverişe konu","olan","malın piyasa talebinin p= -(125/8)q+250"
"s","S-ADABCo-0186-1353","sanığı Veli Küçük kendilerinin mahkum","olmadıklarını","Cumhuriyet için askerlik yaptıklarını söyledi."
"w","W-HE22C2A-0368-1313","sanmıyorum. Nasıl anlayacağız peki aşık","olduğumuzu,","içlerinden kimin ""farklı"" olduğunu? Şöyle;"
"s","S-BEABXO-0444-1582","sandım. Otobüs biraz daha eski","olsaydı","yanlız kırılabilirdi. Resmen zıpladı ama"
"w","W-IF05A3A-1268-2447","sanayinde bu 5-10 yılla sınırlı","olabilecekken,","orman ürünleri sanayinde 50 yıla"
"s","S-ADAB^Z-0370-1279","sanayi üniversitesiyle işbirliğine doğru kayış","olmazdı.","Öyle diil mi hocam? Olmazdı"
"s","S-ACAAPZ-0032-1440","sanayi turizmi <B> 5. Odak","olarak","her zaman Mersin Üniversitemizi ön"
"s","S-ADAB^Z-0370-1584","Sanayi Odasının emm web sitesinin","olduğu","kadar, Mersin Üniversitesinin web sitesini"
"w","W-LE05A4A-1076-2064","sanayi devrimini yaşayan Avrupa'nın sahne","olduğu","sömürü ve sınıf çelişkisi manzarasından"
"w","W-OA16B4A-0326-655","sanatı üzerine kimlerin konuşmaya hakkı","olup,","olmadığına ilişkin önyargılarına takılıp kaldılar."
"w","W-TI42E1B-2942-2135","Sanat Tarihi doktoru ünvanını kazanmış","olan","Emel Esin hanım, bir devrin"
"s","S-BEABXO-0390-312","sana çok iyi bi şey","olur.","Hiç bi şey olmasa bile"
"w","W-VD05A1A-2035-1362","sana yakın gelen insanlarla doğal","olarak","zaten gelişiyor. Hâkimler tarafından kaleme"
"s","S-BEABXT-0066-535","sana ordaki işlediği o sistem","olarak","iyi olmuyo yani <B>. Ders"
"s","S-BEABXL-0123-906","sana geldiği zaman zaten asil","olarak","kaydını yaparlar. Ya dediğim gibi"
"s","S-BEABXW-0058-1897","samimiyetim de yok. Tanıdık kimse","olmayınca","da sıkılıyosun. Yoruluyosun ama hani"
"w","W-TE36E1B-3355-2203","Sami Yusuf'un şarkılarının ilahi olup","olmadığı","konusunda sessizliğini korurken müziği konusunda"
"s","S-BEABXB-0410-13","salı günleri de ameliyat günü","olduğu","için gelceğini tahmin etmiyodum. Velhasıl"
"w","W-CE05A1B-3394-128","saltanat kaldırılmış, Cumhuriyet ilân edilmiş","olmasına","rağmen yeni devletin temel düzenini"
"w","W-KI09C2A-1525-46","salladığını gördüm. Anneanneme hangisinin annem","olduğunu","sordum. O anda kalbimi, bu"
"w","W-QA16B2A-0488-838","salak Suriyeliyi dinleseydik şimdi burada","olmazdık.","Geride kalıp hayatı pahasına bizi"
"w","W-DD39C3A-0982-127","sahte ve müfsit bilgilerden hâsıl","olma","o şeytani irfanın sıtmaları, hepsi,"
"w","W-SA16B1A-0914-167","Sahte de olsa cennet yolunda","olmanın","verdiği haklı gurur ve kibirle"
"s","S-ADABPZ-0134-1415","Sahra Hanım sizi duymuyorlar mikrofon","olmadığı","için. Modernizmin çok eski dönemlerde"
"w","W-OG03A1A-3307-2481","sahnede uygulayan bir tiyatro adamı","olarak","çok önemli bir yere sahip."
"s","S-ADBBI^-0326-615","sahnede ise serbest bıraktığı yanı","olabilir","mi? Hayır! Zapturapt altına almıyorum."
"s","S-ADABAo-0366-2011","sahip olma ve bireyin kendi","olmasını","beraberinde getirdi. Yani birey kendi"
"w","W-HC06E1B-3081-860","sahip olan teknolojilerdir. Başta enformasyon","olmak","üzere, esnek üretim/esnek üretim/esnek otomasyon"
"w","W-ZI45F1D-4824-1050","sahasındayken elinde bir Hakan Şükür","olması","için dualar etmeyecek teknik direktör"
"w","W-LE39C3A-1263-2239","saflık ve iyi niyetle kuşatılmış","olarak","yaşıyoruz. Aptallığımızı yiyor, salaklığımızı içiyoruz."
"w","W-MG03A1B-3238-1034","sadelik ve sanatına temel malzeme","olarak","benimsediği sosyal kavramlar, yeni düşünceler"
"w","W-JA16B2A-0859-5","sadece takılıyordum."" Ohh, annemin kucağında","olmak","ne güzeldi. Ben de ona"
"w","W-ND02A1B-4525-2417","sadece parıamentonun toplantı dönemlerinde geçerli","olmaktadır.","Parıamentonun tatil dönemlerinde bu dokunulmazlık"
"w","W-II22C2A-0745-1684","sadece güzelliklerin, iyiliklerin, doğrulukların var","olduğu","bir dünyada çalışacaksınız. Gerçek şu"
"s","S-ADBBI^-0042-1768","Saddam'ın çok sayıdaki sarayından biri","olduğunu","daha sonra anladığımız görkemli bir"
"s","S-ADBBI^-0042-1198","Saddam verecekti. Anlaşılan öyle de","oldu.","Ertesi gün öğlene doğru, ""Cumhurbaşkanı"
"s","S-ADABAo-0309-293","sabitte olan sabit telekekominikasyon hizmetlerinde","olan","ama mobilde olmayan geniş bant."
"s","S-ACABQq-0423-681","saatten sonra, mantıkdışı bir olay","olacaktır;","çünkü, Kuzey Kıbrıs Türk Cumhuriyeti"
"s","S-ADABCo-0274-2329","saatine kadar 33 milyon lira","olması","bekleniyo. 11 haftadır devreden Süper"
"s","S-BEABXO-0160-1038","saat 12'den sonra. Perdeleri güzel","olmuş","mu? Evet. İyi beğendi mi"
"w","W-SI45F1D-4715-77","S118 Okeanos S119 Pontos Genel","olarak","Türk Deniz Kuvvetleri'ndeki Ay sınıfı"
"w","W-OE39C3A-1415-1388","rızasını almaya pek de lüzum","olmayan","bir ""yığın"" olarak telakki ederler"
"s","S-AEABTZ-0040-207","rüşvet alınır veya bi şey","olursa","bize söylemezler deniyor. Burada biz"
"s","S-BEABX{-0085-780","rütbe veriyor sana ya çavuş","oluyon","ya bişey oluyor rahat ediyon"
"s","S-ADABPZ-0114-1572","Rönesans döneminde ne denli yaygın","olduğunu","ve bunun içinde Kilikya’nın Kilikya’nın"
"s","S-ACABQq-0423-1706","Rum tarafının da tersinden ısrarı","oldu;","ama, neticede bizim dediğimiz oldu."
"s","S-ACABQq-0423-507","Rum sakinlerinin herhangi bir sınırlama","olmadan","eski mülklerine dönmeleri hususu, Birleşmiş"
"w","W-UI27D1B-2456-809","Ruhsal hastalıkların en önemli sorunlarından","olan","intiharın her geçen gün arttığının"
"w","W-VI45F1D-4801-470","ruhban okulu açıyorlar, casus masus","olmasınlar""","diye şak diye emreder, tak"
"w","W-TE30D1B-2101-600","Ross Wilson'ın operasyonlarda ABD'nin etkili","olduğu","yönündeki açıklaması."" PKK militanlarının salıverilmesine"
"s","S-BEABXO-0075-1863","Rooney'in saçı ne kadar gıcık","olmuş","dimi? Dimi? O saç ektirdi"
"w","W-HD02A1B-3816-2022","rol oynadığı söylenebilir. Bunlara bağlı","olarak","aile otorite yapısı, eşlerin rolleri,"
"w","W-IE39E1B-2837-1703","riyle Kusturica'nın diğer bir filmi","olan","Çingeneler Zamanı'nı hatırlatıyor. Aslında Yeraltı"
"w","W-PI36C2A-0609-2167","Rio Tinto adlı dev firma","olan","Freeport McMoran adlı maden şirketi,"
"w","W-PG09C4A-0224-2192","Resmi yaparken hissettiğim kuvvetle Utrillo","olduğuma","ya da bende ondan birşeyler"
"s","S-BEABIs-0015-2262","resmi kurum bünyesi adı altında","olduğu","için şehir tiyatrosu artıları olduğu"
"w","W-SC03A2A-1306-729","resmi kanaatiyle değil, başta babası","olmak","üzere çevresinin kendisine duyduğu güven"
"s","S-BEABXO-0104-1406","renge boyuyosun bayrak kırmızı renk","olur.","Ama kırmızı rengin ucu... ucundakini"
"s","S-ACABQq-0429-2493","rejimi, o rejimin ana beşiği","olan","Türkiye Büyük Millet Meclisinden yönlendirebilmek"
"w","W-ME02A2A-2615-2052","rejimdir. Bu sistemde yönetilenler konumunda","olan","ümmet, idarecinin kendi isteği doğrultusunda,"
"s","S-ADBBI^-0326-1183","Reisicumhurlar kısa ve kaim mi","olur,","bunun hiç ince uzunu yok"
"w","W-QF07A2A-1871-2472","reel ücretlerde büyük miktarda artış","olacağını","göstermektedir. Siyasi yönden çeşitli zorluklarla"
"w","W-RE09C2A-1384-1040","reddedildi. İlkelerim ve yalnızlığı seçmiş","olmam","nedenleriyle, bağımı koparttığım arkadaş sandıklarımdan"
"s","S-ACABQq-0421-839","rağmen, 9 ulus, savaşın tarafları","olarak,","bu savaşları törenlerle anmaktadır. Devletimiz,"
"w","W-PH42C3A-0808-2396","Rasûlü ise, Amr'in kolay adam","olmadığını","biliyordu ve hatırlattı; ""Bu Amr'dır,"
"s","S-ADAABo-0367-131","rasyonel bir şekilde kavranabilmesinin mümkün","olduğunu","söylemiştir. Bu çok önemlidir. Toplumların"
"s","S-ADABCo-0174-1881","raporda yaşanan olayın töreyle ilgili","olmadığı,","katliamın birbirine bağlı olarak ekonomik,"
"w","W-KF10A3A-1767-2045","rakamları dolayısıyla ""Avrupa'nın Hasta Adamı""","olarak","nitelendirildiği dönemde bile İngiltere yurtdışından"
"s","S-BEABXO-0080-2219","rahatsız hastaneye falan gittik. Geçmiş","olsun.","Cübbeli hapiste değil mi birader?"
"s","S-ADABPZ-0374-1869","rahatlıkla kendi şirketlerinizin işletimine açmış","olduğunuz","bunları nemm... ekonomik alana sürebilmek"
"s","S-ACABQq-0429-2181","rafa kaldırırsak, orada, fiilî durumlar","olur;","orada, bu kurumun şanına, şöhretine,"
"s","S-ADBBAo-0443-1034","radyoda çocuk saatine. Şimdi gelecek","olan","arkadaşın taaa çocukluktan bir arkadaşın."
"w","W-DC06A3A-3364-1872","Radyasyon Komitesi (INIRC) gibi periyodik","olarak","lazer maruziyeti limitlerinin (exposure limit,"
"s","S-BEABXO-0325-2148","pırt benim yanıma geliyo. Basamak","olarak","kullancaktı. <gülme> Hı-hıı basamak olarak,"
"w","W-EC06A3A-1964-452","pyk Yk=1, diğer Y'lerin sıfır","olmaları","halinde, her çubukta meydana gelen"
"s","S-BEABXT-0066-248","puanlar belli oluyo, puanlar belli","olduktan","sonra taban puan belli oluyo."
"w","W-IE39C0A-1693-1352","psikolojik ve siyasi neticelerinin bilincinde","olmasına","bağlıdır. Bu konuların dikkate alındığını"
"w","W-ED37C3A-0551-1138","Prusya Sanat Akademisi'nin üyesi de","olan","ünlü mimar Prof. Bruno Taut,"
"w","W-MC06A2A-2000-2493","proximal uç, asıl depo bölgesi","olan","ve daha şişkinleşmiş olan bir"
"s","S-ADABCo-0283-1744","projelere yeteri kadar devlet desteği","olmadığından","yakınıyor. Günaydın! Bütçe ayırması gerekiyor."
"s","S-ADAB^o-0132-2392","programınızdan bize zaman ayırdınız. Son","olarak","söylemek istediğiniz bir şey var"
"w","W-VC06A1B-4115-1683","programını desteklememesi Öğretimsel niteliğin zayıf","olması.","Bilgisayar Destekli Öğretimde Öğretmenin Rolü."
"s","S-ACABTZ-0336-716","program emm bütünü emm burada","olacak.","Emm Profesör Doktor Uğur Oral"
"w","W-OA16B4A-0046-614","Profesör Kemal'in ölümüne gelince böyle","olmasını","istememiştik."" Ali tiksinti dolu bakışlarla"
"w","W-JE39E1B-3029-50","prensip Covey tarafından ""Şahsi Zafer""","olarak","adlandırılır. Olumlu düşünmek ve hareket"
"s","S-ADAB^Z-0370-445","pratiğe indirebilmesidir. Ya bunu yapabilecek","olarak","burda pratik olarak üniversitede bize"
