"Register","Text","Left","-5;5","Right"
"w","W-IF18E1C-4145-308","kültür ve tabiat varlıklarını da","koruyan","ve sürdürülebilir kalkınma anlayışını temel"
"w","W-SD18E1C-4173-698","kültür mirasının ve tabiat varlıklarının","korunmasının","önemi, 7. İşsizlere yönelik İstihdam"
"s","S-AAABLp-0159-11","köyün bekçisine, muhtarına karşı napıyor?","Koruyor,","beni koruyor. Temel hak ve"
"w","W-SH42C4A-0495-2376","kötüye kullanamaz"" hükmüyle vicdan özgürlüğünü","koruması","altına almıştır. Dini inanç ve"
"w","W-JE42C0A-0284-1899","kötülük bizzat devletler tarafından kanunlarla","korunmaya","alınacağına, dine ait hakikatlerin gericilik"
"w","W-EF07A3A-2664-1314","kömür ve çelik girdileri önemini","koruyordu.","İtalya, daha önceleri endüstriye yönelmeye"
"w","W-TC18F1D-1663-2278","köklü eğitim kurumu olma özelliğini","koruyan","Yüksek Öğretmen Okulları, çeşitli nedenlerle"
"w","W-KD39C3A-0386-1509","kuvvetlerinin ileride ittifakın yaşamsal çıkarlarını","korumak","için ""görev alanı dışına"" gönderilebileceği"
"s","S-AAAAFZ-0383-170","kuvvetleri bazı yerlerde besin stoklarını","korumaya","başladılar. Şimdi çözüm ne? <D"
"s","S-ACAAFZ-0048-192","kuvveti, gittiği yerdeki diplomatik misyonları","korumakla","görevlidir. Amerika, ""ben görevli değilim"""
"w","W-FH03A3A-2022-1333","kutsal ruh tarafından mahşere dek","korunacaktır.","Hz. Muhammed'in bir hadisine göre"
"w","W-QF10E1B-3065-1039","Kurumu'nu ""telekomünikasyon sektöründe tüketici menfaatlerinin","korunması","için gerekli tedbirleri almakla"" görevlendirmiştir."
"w","W-UG03A1B-2547-1525","kurumsal yapısına sağladığı ayrıcalıklar sayesinde","korunabilmiştir.","XV.-XVIII. XV.-XVIII. Yüzyıllar arasında Balkanlar’da"
"w","W-QE02A0A-1783-2406","kurumlarını devlet bugüne kadar Lozan'ın","koruması","altında saymamıştır. Fakat, 02 Ocak"
"w","W-PF05A1B-4677-1536","kurumlan ile teslim olmuştu. Topraklarını","korumak","için yapılan uzun sürekli harpler,"
"w","W-IF05A1B-4414-1845","kurum-kuruluş ve uygulamalar ile bunlann","korumaya","aldığı nüfusa ilişkin rakamlar aşağıdaki"
"w","W-DE05A1B-3415-1630","Kurum'a düşeri görev haklarında mahkemelerce","korunma","kararı verilen okul çağındaki özürlü"
"w","W-ID02A1B-3820-772","kurum bakımı Türkiye için önemini","korumaktadır.","3.2. Örneklemin Çapraz Tablolarının Değerlendirilmesi Tablo"
"w","W-GF10A4A-1841-189","kurulan sanayilerin korunmasını gereğini getirmiş,","korunan","sanayiler dışa açılmak, kaliteyi artırmak"
"s","S-ACABQq-0423-219","Kurucu devletlerin, kendi millî kimliklerini","korumak","amacıyla, diğer kurucu devlet vatandaşlarının"
"w","W-SF10A2A-1854-2327","kurmanın yanında kurumun ürettiği teknolojilerin","korunması","da sağlanmıştır. Üniversitelerle olan ilişkinin"
"w","W-KE05A2A-2053-1084","kurmak ve bunları etkili biçimde","korumanın","yollarını araştırmak olduğu için, yerel"
"w","W-HD02A1B-3796-1033","kurallar, bazı ufak değişikliklerle aynen","korunmuştur.","Buna, yasaların yerelliği ilkesi denilmiştir."
"w","W-KE30D1B-2081-958","kum torbaları ile sel sularından","korunmaya","çalışılıyor. Ülkenin güneyindeki Baden Baden"
"w","W-TE36E1B-3295-820","Kulüpler? Federasyonlar? Hayır. Kendi iktidarını","korumak","isteyen küçük bir çevre. Benim"
"s","S-AAAAFZ-0383-142","kullanımı tarımsal alanlarda, biyolojik çeşitliliğin","korunması","problemi <d 2> ve biyotik,"
"w","W-SF10A1D-2031-2096","kullanılmadığı için o vergiler iyi","korunmadığı","için kasalarında hak etmeyen insanlara"
"w","W-DC06A3A-3364-2339","kullanıldığında göz konjuktivilerine raslanmıştır. Derinin","korunması","Derinin korumasını gerektiren tesisatlar gözün"
"w","W-DC06A3A-3364-1471","kullanılarak topraklanırlar. Ekranlama elbisesi ile","korunmada","şu elverişsizlikler vardır Topraklama zordur"
"w","W-NG37C4A-0002-1487","kullanılan maskelere, gaz maskelerinden mikroplardan","korunmak","için yüze takılan sterilize maskelere,"
"w","W-NC06A4A-1973-1932","kullanılan bir yöntemdir. Şev stabilitesini","korumada,","göçme tipine hiç bakılmadan uygulanacak"
"w","W-OF10@0A-1778-1597","kullanılabilmesi, federal hükümetin küçük işletmeleri","koruyacak","şekilde programlar geliştirmesi ve eyalet"
"w","W-LD36E1B-2854-2231","kullanmama zorunluğu"", ""Haber kaynağının gizliliğinin","korunması"",","""Şiddet ve zorbalığın özendirilmemesi"", ""Kişi"
"w","W-GD05A2A-0427-762","kullanma yeteneğinden mahrum olan kişileri","korumak","amacıyla düzenlenmiş bir kurumdur. Onsekiz"
"s","S-ADBBI^-0042-131","kullanarak, büyükelçilik binasında misafir edilmesi,","korunması,","olacak iş değildi. Fakat şunu"
"w","W-PG22C1A-0518-2329","kulağa; büyük şehirlerde daha rahat","korunur","inziva hareketleri. Kimsesizin en büyük"
"w","W-CE39E1B-3022-339","Krus-taseler adıyla anılmaktadır. Bizim çevre","korumasıyla","alâkalı mevzumuzu ilgilendiren bu enteresan"
"w","W-LE05A2A-1115-1829","krallığın demografik yapısı eski niteliğini","korumuştur.","Bununla birlikte, yönetici sınıf mensuplarının"
"s","S-ADABPZ-0372-178","koşullarında mesleğimizin varlığını ve önemini","koruması","için yeniliklere açık olmalı ve"
"s","S-ACABQq-0423-49","koşulları, birliği, tarafsızlığı ve onuru","koruyacak","nitelikte olmalıdır. Polisler adil bir"
"w","W-DD02A3A-1781-852","koşulları paylaşan insanların, dışa karşı","korunma","ve dayanışma gereksinmelerini karşılayan bir"
"w","W-SF05A1B-4662-761","koşullarda iç kontrol sisteminin etkinliğini","koruyabilmesi","için banka çalışanlarına kontrol kültürü"
"w","W-PI09C4A-1491-1195","koşulla hırsızlık için bile kendini","korumuş.","Oysa sokak köpeği ""malı"" göz"
"w","W-RA16B3A-0257-607","koşarak yanına geldi. Açılan ateşten","korunmak","için birbirlerine iyice sokuldular. Elleri,"
"w","W-BA16B1A-0880-994","koyunlarını ve kendilerini yabanıl hayvanlardan","korumak","için topraktan koca koca canavarlar"
"s","S-AEABUZ-0021-210","koymalıyız ve kendi ruh sağlığımızı","korumak","için bulunduğumuz noktayı iyi gözlemeliyiz."
"w","W-JA16B2A-0873-1377","koymak için, hastane kuyruğundaki sıralarını","koruyabilmek","için, trafikte doğru dürüst gidebilmek"
"s","S-BEABXf-0406-187","koyim, şey araçlarda geziyor emm,","korumalı","araçlarda. Dini lider olarak bakma"
"w","W-NC06A4A-1970-948","kota belirleyecek ve hangi türlerin","korunmaya","alınacağını saptayacaktı. IWC'nin elinde uygulama"
"s","S-BEABXO-0093-8","koruyorlar başka? Üşüyoruz dimi? Üşümekten","koruyorlar,","soğuktan koruyorlar. Evet. Peki. Gel."
"s","S-ADAB]o-0193-13","koruyor. 30 metrelik bir mesafe","koruyor.","Ama zil çalıp da son"
"s","S-BEABXO-0093-20","koruyo? Soğuktan. Aferin sana. Soğuktan","koruyo","değil mi? Eğer eğer kürkü"
"w","W-PA16B4A-0099-1970","koruyan Galata gibi, kendi bağımsızlığını","korudu...""","Katya sözlerimi çok inandırıcı bulmamıştı."
"s","S-ADABPZ-0373-53","koruyacağıma Ve hemşirelik mesleğinin bütünlüğünü","koruyacağıma","And içerim. And içerim. <Alkış>"
"w","W-FE05A1A-2057-62","korunmasına yöneliktir. Ancak dolaylı olarak","korunan","kişinin mensup olduğu grup lehine"
"w","W-PB04A3A-1986-2445","Korunmasına İlişkin Önlemler Toprak kaynaklarının","korunması","için alınacak önlemlerin çok acele"
"w","W-PD05A2A-3342-1483","korunması, başkalarının şeref ve haklarının","korunması,","gizli bilgilerin açığa vurulmasının önlenmesi,"
"w","W-CF05A4A-0445-1107","korunması hakkı, 2. Ekonomik çıkarların","korunması","hakkı, 3. Zararın tazmin edilmesi"
"s","S-AEABTZ-0040-152","korunma kabının olmaması. Sonuçta Dünya'da","korunma","kabı olmayan bi reaktörü batıda"
"w","W-JC05A4A-1768-753","korunamaz. Memuru yerli yersiz iftiralardan","korumak,","ona özendirici bir çalışma ortamı"
"w","W-KA16B2A-0308-50","korumuyor, ben de kendi kendimizi","korumak","için bir çete kurulmasını öneriyorum."
"w","W-FF10A2A-3019-1619","korumaya yönelik müdahaleler İç pazarı","korumaya","yönelik müdahaleleri içeren piyasa düzenlemeleri,"
"w","W-EA14B1A-1616-2495","korumasız. Allah sizin gibilerden bizi","korusun.","Hem sizin de saygıdan sözetmeye"
"w","W-MD37C0A-0157-1120","koruması öneriliyor. Annesi Tanrıça onu","koruması","için Güneş Tanrısı'na dualar ediyor."
"w","W-GE05A1B-3500-1022","korumanın mı, yoksa fikri hukuk","korumasının","mı daha uygun olduğu uzun"
"w","W-NA16B1A-1466-2159","korumalar nerede... Odamı Teröristler bastı,","korumalara","haber verin çabuk... Yaklaşmayın Smith"
"w","W-TD13C3A-0216-1143","korumak kisvesi altında mevcut devleti","koruyan","ve temsil eden insan kalabalığı."
"w","W-QD05A2A-0767-1578","korumak için değil, öncelikle devleti","korumak","için çıkartılır. Bütün ideolojik devletler"
"w","W-IE39C4A-1358-405","korumak için davranmışsa kişilik hakkı","korunmadan","yararlanamaz... Davalı milletvekilinin sözleri, hakaret"
"w","W-RE39C2A-0358-205","koruma altında yaşıyorum. Bir yakın","korumalar","var, bir de evde yirmi"
"w","W-UI44F1D-4755-1065","korktum. bide ben 2,5 yıldır","korunmuyorum","oda beni korkutuyor. bi kere"
"w","W-LE09C3A-1183-1535","koridorlarının kesişmesi halinde, Fügen Gülertekin'i","koruması","gereken kurumların çürük ve özürlü"
"w","W-TC40E1B-2879-2380","kopya koruması değil, bir içerik","koruması","taşıyor. Alıcı ve verici, yani"
"w","W-KE39C3A-0357-569","Kooperatifin usulsüzlüklere maruz kaldığını, çıkarlarının","korunmadığını,","üzülerek tespit etmiş bulunuyoruz..."" Kooperatifin"
"w","W-QA16B4A-0152-759","konuşma çok duygusaldı. Kimse şehri","koruyabileceklerini","düşünmüyordu ama mümkün olduğunca çok"
"w","W-OC03A3A-1418-592","konusunda bu kapalılığını sonuna kadar","korudu.","Farklı coğrafya mutfaklarından beslendi ama"
"w","W-PF10A2A-1849-1272","konuma erişme ve bu konumu","koruyabilme","yetisini belirlerler. Rakipler karşısında kârlı"
"w","W-LI31D1B-2426-447","kontrollü bir defans anlayışıyla kalesini","korudu.","Johnson, Preko ve Boliç'in yararlanamadıkları"
"w","W-II22C3A-0566-536","kontakların atması, aslında sistemin bütününü","korur.","İkinci sigorta sistemi ise sübaplardır."
"w","W-OE05A1B-4181-1223","Konseyi, uluslararası barış ve güvenliğin","korunması","için gerekli önlemleri alıncaya kadar,"
"w","W-GD39C3A-0387-1652","komutanının niye yalnızca vilayet binasını","korumak","için havaya ateş ettirdiğinin, askerlerini"
"w","W-OE30D1B-2105-420","Komutanı Abdül Rauf Tac, yeni","korumaların","suikasta karışmış olabileceklerini söyledi. Ülkenin"
"w","W-RA16B0A-0292-2013","koltuğun arkalığına dayadı ""...İngilizlere güvenimizi","koruyarak,","Ankara'daki olayların gelişmesini bekleyelim."" Gözlerini"
"s","S-AEABUZ-0021-93","kollayabiliriz. Kendi ruh sağlığımızı nasıl","koruruz.","Ruh sağlığımız iyi olursa ruh"
"w","W-CG03A1B-3170-1556","kolejlerde başlatdan bu çalışmalar prenslerin","koruduğu","ve çoğu aynı zamanda birer"
"w","W-GD39C2A-0283-1555","kişiyi sadece taraftarı olduğu için","koruduğunu","belirtiyorlardı. Polat ve arkadaşlarının bildirisinde"
"w","W-OI22C3A-0691-73","kişisel dostuydu. Edebiyatı özel olarak","korudu","ve Rus edebiyatının gelişmesini sağladı."
"w","W-VC29D1B-2437-1300","kişinin doktor tavsiyesi olmaksızın kanserden","korunmak","veya vücut direncini artırmak amacıyla"
"w","W-MH42A2A-0890-1211","kişiliğine özgü vakarı da titizlikle","korurdu.","Eklerde yer alan icazetnamelerde kendisi"
"w","W-TI45F1D-4696-998","kişilere kitabın taslak halini parola","korumalı","bir web ortamında açmış durumdalar"
"s","S-AEABPZ-0331-44","kişi karşısında çevresel değerlerin önemini","koruyamazsınız.","Neden? Aç insanla, muhtaç insanla"
"w","W-QE39E1B-3034-1327","kitlesinin artması şeker hastalığına karşı","korunmada","da faydalı olabilmektedir. Egzersizler bırakıldığında"
"w","W-RE13C3A-1379-794","Kissinger, Dışişleri Bakanı olarak koltuğunu","korumuştu.","Ben de bu durum üzerine"
"w","W-SF05A1B-4665-733","kimler için turizme açılacağı, nasıl","korunacağı,","nasıl pazarlanacağı sorularının yanıtlanmasıdır. 2023"
"w","W-UH42E1B-2921-2162","ki, herkes elindeki kıymetli sermayesini","koruyor,","kasalarda saklıyor. Ben, Allah Teâlâ'nın"
"w","W-SA14B1A-1586-439","ki kafam karıştı. Hastalıklardan nasıl","korunacağını","da yazıyor demek. (seyircilere) Siz"
"w","W-QA16B5A-0175-2411","kez ""Teşekkür"" ve ""Allah sizi","korusun""lar","korusun""lar arasında, yolcu ettik iki"
"w","W-IE39E1B-3028-1268","keskince"" bir yolun adıdır denge.","Korunması","oldukça önemli ve önemi ölçüsünde"
"w","W-NF10E1B-3062-1615","Kernel'a yönelik uzun vadeli yatırımlarının","korunması","ve ProLiant sunucularındaki Windows 2000"
"w","W-SD36E1B-2843-1754","kentten ayrılarak geri dönmesine rağmen","korudu.","Kentin ünlüleri Stoiklerdir... Ancak bize"
"w","W-OH42C3A-0757-478","kendisini ibadetsizlik gibi bir haksızlıktan","korumak","demektir. Yukarıda sayılan belirtilen hak,"
"w","W-IA16B3A-0602-782","kendisinden hoşlanmasını istiyor. Kadın, kendini","korumaya","kararlı. Alışverişin sınırlarını çizmiş. Umursamazlığıyla,"
"w","W-SI22C2A-0830-187","kendini salıvermemek ve bulunduğu seviyeyi","korumak","veya daha da yükseklere tırmanarak"
"w","W-QD03A2A-1033-767","kendini bu sömürgeci güce karşı","koruyabilmek","için modernize etmek gereğini duymuş"
"w","W-MI37E1B-3057-510","kendimi inandırmaya çalışıyordum. Vahşi ritüellerden","korunmaya","ve saklanmaya çabaladıkça; ""şeylerin"" dokunuşlarımı"
"w","W-SF05A1B-4662-2501","kendilerini yenilemeleri, gelişen pazardaki yerlerini","koruyabilmeleri,","güvenilirlikleri açısından önemli olmaktadır. Bu"
"w","W-CH03A1B-3097-70","kendilerini Mekke'den kovan Kureyşlifere karşı","korumaları","küçümsenecek bir başarı değildir. Hz."
"w","W-GE39C2A-1062-77","kendilerini korumaları olanaksız olurdu. Annenin","koruması","aynı zamanda yavruların kendini koruması,"
"w","W-SD02A3A-0815-2492","kendilerini Hristiyanların bilhassa Ortodoksların zulmünden","korumak","için çırpınmaktadırlar. Hâlâ bugün, Atina'da"
"w","W-JH42C0A-0337-2287","kendilerini herhangi bir saldırıya karşı","koruyacak","durumda olmadıktan gayri yardımından yararlanabilecekleri"
"w","W-KE39E1B-2839-1613","kendilerini her türlü kuvvete karşı","koruyacak","bir güç bulundurmak istemektedirler. Diyarbakırlı"
"w","W-VG24D1B-2323-379","kendilerini geleceğe ait bir hayalden","korumak","amacıyla onu tekrarlayarak taklit etmeye"
"w","W-VI22E1B-2915-610","kendilerini bu yabancı maddelere karşı","korumaya","çalışırlar. Bunun için de iç"
"s","S-ADABPZ-0135-173","kendi temel hak ve özgürlüklerini","koruması","ile ilgili bir duyarlılık içinde."
"w","W-OA16B2A-0787-1388","kendi ruhunu ve bedenini nasıl","koruyabilecek,","kendi çocuklarına ne verebilecek diye"
"w","W-GE05A1B-3501-833","kendi kendini koruma yanında yasal","korumaların","dahi yetersiz kaldığı görülmektedir. Örneğin"
"w","W-GG09C2A-0377-373","kendi kendime, sunabildiğim için. Tanrı","korusundu,","işin içinde ""sunamayıcı"" olmak da"
"w","W-RD03A2A-1380-1708","kendi hizmetlerine alarak başardılar. Sultanın","korumakla","ilgili olduğu değerler, adalete dayanan"
"w","W-RD39C3A-0585-1589","kendi heyetindekilere Türkiye'yi öyle fazla","korumadığını","göstermek için söylemişti bunu. Bozer,"
"w","W-ME43C2A-3340-2398","kendi başına bireyi ve aileyi","koruyan","bir düzenlemedir. Ancak, aynı yasa"
"w","W-JE04A3A-1580-717","Kemer Burgaz çöplüğündeki tehlikeler güncelliğini","korumaktadır.","İstanbul'un yalnız Rumeli tarafında günlük"
"w","W-ND36E1B-2856-2180","Kemalizmde ""halk"", özellikle Müslüman kimliğini","korumakta","ısrarlı kesimler ve Kürtler, tehdit"
"w","W-FD18E1C-4084-2049","kazınacaktır. Bunun için rüşvet alanı","koruyan,","suçun belirlenmesini zorlaştıran kanuni kayıtlar"
"w","W-WH13E1C-4890-97","kazanıyorsunuz?” diye yineler. Adamımız dinginliğini","korumaya","çalışarak “kalemle “kalemle be adam,"
"w","W-GD36E1B-2849-433","kazanç değil, sahip olduğunuz değerin","korunması","vardır.) Yasaklanan faizin yerine getirilecek"
"w","W-PD03A3A-0867-1045","kaynağı olurmuş. Göz sembolü nazardan","korumak","için hâlâ kullanılan en yaygın"
"w","W-MB04A2A-1569-729","kaynaklarını hoyratça harcamaz. Hayvan kendisini","koruyacaksa","bunu ya boynuzları ya da"
"w","W-PE30D1B-2086-1748","kaynaklarına göre, aralarında Rantissi'nin 3","koruması","ve oğlunun da bulunduğu yaralılardan"
"w","W-OI22C1A-0665-2176","kaynaklanır. Her yerde, her şeyi","korumak","ve güçlü kanatlarının altına almak"
"w","W-OD37C2A-0365-278","kaymış bacağımı korumuş. Bir şekilde","korunmuşum","yani. Çocuklarımı koruyamadım diyordum ama"
"w","W-NE39C3A-0613-1705","kaygısı; burada bulunan polisler beni","korumak","için değil, olan biteni gözetliyorlar."
"w","W-SI22C4A-0847-2069","kaygılı ikliminden ""dil""e ""dil""e sığınarak","korunmuştur.","Çünkü varlıktaki en küçük kımıltının"
"w","W-QD30D1B-2228-711","kaydetti ""Parlamento'nun polis kuvvetleri tarafından","korunması","bütün Avrupa'nın ortak uygulamasıdır. Ancak"
"w","W-JH02A0A-0330-2055","kaybetmiş, ama Tanrı'ya olan inancını","korumuştu","Tanrı'nın varlığından hiç şüphe etmedim."
"w","W-SI19E1A-3995-2450","kavuşmak mümkün olacaktır. 1. Selden","korunmak","için konutlar nerelere yapılmalı? 2."
"w","W-FE05A1A-2057-1787","kavim ve kavim benzeri toplumların","korunması","ve bağımsız devletlere entegrasyonu hakkındaki"
"w","W-FE05A1A-2057-378","kavim ve kavim benzeri toplumların","korunması","ve bağımsiz devletlere entegrasyonuna ilişkin"
"w","W-SG03A0A-0168-1928","katılıyor"". Sonradan fark ediş olasılığı","korunuyor.","Biçim konusuyla içe başlamak, ve"
"w","W-IE05A1A-2620-125","katılması veya ulusal paranın değerinin","korunması","ile ilgili bir düzenleme yapması,"
"w","W-KD02A3A-0603-107","katılma hakkı, keyfi gözaltına alınmaktan","korunma","hakkı, yargılanma hakkı, ibadet hakkı"
"w","W-JI37C3A-0091-1529","karşısında çabuk çözülen biridir. Kendini","koruyarak","fırtınanın geçmesini bekleyecek sabır, sebat"
"w","W-ED37C3A-0401-599","karşısında ""doğal ve insancıl cinselliğin""","korunup","geliştirilmesi son derece güç olacaktı,"
"w","W-UD36C3A-0891-892","karşılıklı çıkarların dengeli bir biçimde","korunması;","iktisadi, siyasi kültürel ve güvenlik"
"w","W-SF09C4A-0012-1340","karşılıklı saygı ve sevgi ortamının","korunmasına","azami dikkat ve titizliği göstermeniz"
"s","S-ACABQq-0429-193","Karşılıklı konuşmayalım. Sizler asıl sükûneti","korumakla","yükümlü insanlarsınız. Siz buna katkı"
"w","W-KE05A1B-3627-647","karşılık, gelişmiş ülkeler rekabet güçlerini","koruyabilmek","için teknolojik gelişime önem vermektedir."
"w","W-LC06A2A-1976-407","karşılaşılan ve aşırı zararlı etkilerden","korunmuş","normal yapılar için öngörülmüştür. (c)"
"w","W-LF10A3A-1826-1458","karşılaşan çiftçilerin enflasyon karşısında kendilerini","koruyamamalarına","neden olmaktadır. Tarım kesiminde sivil"
"w","W-UE30D0B-2102-1713","karşılanmaması halinde Türkmenlerin kendi toplumlarını","korumak","için milli gücü oluşturacakları ima"
"w","W-JA14B1A-1689-1794","karşı, öteki kefenin ağırlıklarıdır. Çocuğu","korur,","kendini ve başkalarını aldatır. Merhametlidir"
"w","W-TE39C4A-0359-497","karşı çıktım, haklıyı savundum, garibanları","korudum.","Bu acımasız kurtlar sofrasında başımı"
"w","W-FE05A1A-2057-1074","karşı yapılan savaş, azınlıkların diskriminasyondan","korunmasına","matuf garantilerin özel bir görünüm"
"w","W-VI45F1D-4801-1187","karşı temel hak ve özgürlüklerin","korunmasını","savunan güçlü fikirler ileri sürmüş."
"w","W-FF05A1B-4384-104","karşı nasıl davranmaktadır? Kurum, çevreyi","korumakta","mı, yoksa tahrip mi etmektedir?"
"w","W-UE05A1B-4296-1386","karşı kıyılara yakın yerleşim yerlerini","korumak","üzere gece-gündüz görevdeydiler. Kaleler kıyılarda"
"w","W-RE39C4A-0703-1695","karşı kimi kimden ve nasıl","koruyacaklar","bu belirsiz. Zaten kurtarıcılık misyonuyla"
"w","W-VC40E1B-2881-2052","karşı Internet Explorer'dan daha iyi","korur.","Bununla birlikte, tıpkı Microsoft'un ürettiği"
"w","W-CD02A1B-3398-1071","karşı değil, gerçek yurttaş özgürlüklerinin","korunmasına","karşı da olumsuz etkilerde bulunurlar."
"w","W-DA16B4A-0288-917","karşı bebeğini umutsuz bir çırpınışla","korumak","isteyen anne gibi. Kadınca bir"
"w","W-RI41C3A-1462-1820","karışıklıktan nefret eder; ruhsal dengesini","koruyabilmesi","için gerçekten her şeyin uyum"
"w","W-UE05A1B-4299-1879","karışıklıklar çıkararak fesadçılık yapan Ermenileri","koruması,","O’nun O’nun O’nun Osmanlı Devletini"
"w","W-NI45F1D-4063-78","karı hepimizi bastırdı şirretliğiyle, Allah","korusun","hepimizin anneannesi var. Daha durun."
"w","W-CI22C3A-1079-2087","kararı ile, devlet müzesi olmuş,","korunuyor.","Barakalar, işkence tesisleri, gaz odaları,"
"w","W-RI37C1A-0848-1530","karanlık bir dünyanın eşiğindeyim. Kendimi","koruyabilmem","çok zor... Babacığım, ne olur"
"w","W-QD36C0A-0222-493","karakol kendi bulunduğu mekanda kendisini","koruyordu.","Gerçekte ise koruyamıyordu, çünkü birliğin"
"w","W-IC01A1B-3722-184","karaciğer ve pankreasın uzun süreli","korunmasında","klinik ve deneysel çalışmalarda kullanılmaktadır."
"w","W-TG37E1B-2936-1856","kapı bırakıyor, bu davranışıyla çocuklarını","korumak","isteyen ailelerin korkulu rüyası olmayı"
"s","S-ACAAPZ-0030-132","kapsayan anne ve çocuk sağlığının","korunması","ve geliştirilmesinde sağlık insan gücünün"
"w","W-SH42E1B-2919-1552","kapsamaktadır. Böylece fesat vesilelerinden uzaklaşarak","korunmuş","olacaklardır. Zira kadınların ihtiyaç haricinde"
"w","W-LC06A3A-1960-79","kaplama yapılması boruyu tam olarak","korumak","için yeterli olmamaktadır. Endüstriyel koşullarda"
"w","W-ME05A4A-2614-419","kapitalizmin oluşturduğu yeni ekonomik düzenlemeyi","korumak","ve kollamak üzere bir dizi"
"w","W-QC06A2A-2041-1073","kapağa sahip olan kaplardır. Çocuk","korumalı","kaplar Çocuklar tarafından açılmasını önleyecek"
"w","W-NC01A3A-1083-1811","kapanmamasıdır. Sağ diafrağma karaciğer tarafından","korunduğundan,","%80-90 olguda sol posterolateral yerleşim"
"s","S-ADABCo-0282-30","Kapalı kaldığı sürece gündemdeki yerini","koruyan","Heybeliada'daki Ruhban Okulu'na dönüyoruz şimdi."
"w","W-WI45F1D-4713-1242","kanunlarla yönetilen ve bu yapıyı","koruyabilecek,","gelişmesini sağlayabilecek bütün kurumları kapsayan"
"w","W-RE05A1B-4276-1948","Kanunlar Külliyatına işlenmesi aşamasına kadar","korunması","gerekir. Aksi takdirde Başbakanlıktaki ya"
"w","W-NF05A1B-4440-748","Kanun ve 4077 sayılı Tüketicinin","Korunması","Hakkındaki Kanunu, ayrıca Franchısıng ilişkilerine"
"w","W-QE18E1C-4165-1550","kanalı kurulmalıdır. Irak'ın toprak bütünlüğü","korunmalı,","bağımsız bir Kürt devleti kurulmaması"
"w","W-OE07A0A-2038-1025","kamuda iş güvencesini siyasal baskıdan","korunma,","uygulamalarda istikrar ve hukuka uygunluk"
"w","W-JF18E1C-1661-791","kamu kesimi açığının yüksek düzeyini","koruması","ve iç talepteki canlılığa paralel"
"w","W-SD18E1C-4173-1770","kampanyalarının desteklenmesi, 3. Ormanların bakımı,","korunması,","orman alanlarının genişletilmesi ile orman"
"w","W-MA16B3A-0504-92","kamaşmıştı. Elleriyle, gözlerini güneşin ışınlarından","koruyarak","ileriye baktılar. Bunu yaparken de,"
"w","W-SI19E1A-4010-458","kalırdı? Ormanlar gibi hayvanlar da","korunmalıydı.","Uzaktan gördüğü kayalık, şimdi düzgün"
"w","W-KD02E3A-1646-1072","kalıplar biçiminde kalmaktan kurtulup, devletin","koruması","ve geliştirmesi gerekli önemli işlevlerin"
"w","W-LA16B3A-1947-963","kalmadım, kışın beni kardan, yağmurdan","koruyorsun.","Ormanın en genç, en güzel"
"w","W-KC06A2A-1089-710","kalkınmasını sürdürmesi ve doğal sistemini","koruması","konularında, önemli bir engel oluşturur."
"w","W-CI22C3A-1079-543","kalkan, simgedeki kızcağız acaba kendini","koruyabilmiş","mi?.. Evet. Polonya'nın koruyabildiği kadar."
"w","W-GD39C3A-0381-1732","kalem""den kalem""den yapmak zorunda kaldı...","Korumanın","işine ""ertesi gün"" son verildi."
"w","W-RD39C4A-0651-1823","kaldırıp yaprakları alın. Yapraklar şekillerini","koruyacak","kadar mumlanmış olacaklardır. Sonra bu"
"w","W-OB04A1B-4228-454","kaldırmaktan çok su eksikliğinin zararlarından","korunmak","amacına yönelik olduğunu düşündürmektedir. Osmotik"
"w","W-LD02A0A-1779-1533","kaldırma önerisi yoktur; bunların aynen","korunmasından","yana bir tavır alınmıştır. Bu"
"s","S-ADBBAo-0443-94","kaldı. Evde kimse olmayınca kendimi","korurum.","Farklı bir çocuktu, ""bilim adamı"
"w","W-SE36E1B-3352-518","kalbi ve ruhu olarak anneyi","korur,","destekler ve kutlar. Modern dünyada"
"w","W-VI19E1A-3999-1094","kalan sıcak hava bizi soğuktan","korur.","Soğuk havalarda atkı takar, başlık"
"w","W-TA16B0A-0145-829","Kafam karışmasın diye aramıyor, beni","koruyordur.","O da yeni bir başlangıç"
"w","W-LA16B4A-0289-531","kadının yanına geldi. Kadın kendini","korumak","için kolunu kaldırdı. Ama asker"
