w,W-SA16B4A-0269-1950,kalacağı şeklindeki şartlan uzun uzun,anlatıyordu.,Mesut Barzani Lozan antlaşmasını ise;
w,W-FH03A3A-2022-1237,kakao şarabına karıştırarak içerler. Herodot'un,anlattığına,"göre, bazı toplumlar, hastayı ölmeden"
s,S-BEABXO-0120-224,kafanı karıştırdı şimdi. Ben ne,anlattım?,Ee! bi anlatayım da sen
s,S-BEABXg-0070-1026,kafalarında net bir şey yok,anlatabildim,mi? Bişeyin garantisi yok onlar
w,W-UA16B4A-0320-2225,"kadın, ""gel içeriye. Ne oldu,","anlat!""","""Adam bıçakladım, birahanede."" ""Nee!.. Nasıl?"""
w,W-OI22C1A-0665-702,"kadın için kadınlık, kızına şöylece",anlatılacak,"gizli saklılar ve ""erkeklere boyun"
s,S-AEABTZ-0040-309,kadar? Osmanlı'da <B> biraz önce,anlattığı,gibi işte bu bombaların ondan
s,S-AEABUZ-0022-605,kadar. Bu olmuş bir hikayeyi,anlatıyorum.,Bütün bunları yazıp çiziyorlar. Ve
s,S-AAABLp-0161-331,kadar önce kim anlattı hanginiz,anlattı,onu? <B> Teyit etme ihtiyacından
s,S-ADBBI^-0042-538,kadar yanlış bir iş yaptığımı,anlatmak,için söylüyorum. Hiç kontrol yaptırmazdım.
w,W-TI09C3A-1086-1758,"kadar sonra, o gece gördüklerimi",anlatmak,fırsatı buldum Bedih ustaya. Ne
s,S-ADBBAo-0443-336,"kadar seviyor ki, gözleri dolarak",anlattı.,Ben de çok değer veririm.
s,S-BEABX{-0085-1100,kadar olur bana kısaca bi,anlat,bakayım. Kasa sağlamsa zaten monitör
w,W-TI42E1B-2942-160,"kadar merhametli ki, bize kendisini",anlatması,için peygamberler göndermiş. İşte son
s,S-ADBBAo-0443-988,"kadar kimseye anlatmadım, ilk size",anlatacağım.,Biz aslında ikizdik. Ben kıskançlıktan
w,W-RG09C4A-1169-1928,kadar hoşuma gitti ki herkese,anlatmak,istiyorum. Yaşar Kemal de anlatırken
s,S-BEABXn-0352-1061,kadar da bilgimiz yok yani.,Anlat,bakiyim. Adamlar ta bin altı
w,W-RI45F1D-4714-1214,kadar bu süreci adım adım,anlattı.,İşte Aksiyon'un ele geçirdiği ve
w,W-QG37E1B-2933-1173,kadar bağırmadı. Avazı yetmedi yüreğindekileri,anlatmaya.,Az söyledi ama hiç susmayan
s,S-BEABXO-0120-477,kadar anlatmadınız yanı. Oğlum annenin,anlatması,daha güzel. İyi anlatsın o
w,W-TE30D1B-3263-1321,"kadar ""ters"" bir sistem olduğunu",anlatmaya,çalıştığını kaydetti. Paris'in uyanıklığı Dedesinin
w,W-RD37C2A-0811-811,kabarık bir dosyası var. Bunları,anlatan,"anne, ibadetini yapan hatta hacca"
w,W-SI45F1D-4813-936,Jean Webster Yani Judy'nin hikayesini,anlatan,Daddy Long Legs'in devamı! Heyecanla
s,S-ACABTZ-0336-836,Japonya'daki kazaların nasıl örtbas edildiği,anlatılıyor.,Emm Çernobil nükleer kazasından sonra
s,S-BEABXB-0073-411,İzzet vardı ya. Biliyorum Rıza,anlatmıştı.,Ne biçim adam ya. Bak
w,W-RG24D1B-2290-1828,İstanbul'u her türlü bağnazlıktan uzak,anlatır.,1950'lerde -ve sonraları da- İstanbul
s,S-ADAABo-0369-489,İstanbul'u anlatmaya çalışacağız. Ama İstanbul'u,anlatmanın,bizim haddimizi aştığının da farkındayız.
s,S-ACABFZ-0049-912,"İsmet Paşa'nın, Atatürk'ü çok iyi",anlatan,"bir tümcesi vardır. ""İnsanlık idealinin"
s,S-BEABXO-0344-701,İsmail gel podcast'e bakalım biz.,Anlatıyo,ağbi burda gösteriyo. Gel yanıma
w,W-SD30D1B-2230-1498,"İslâm'ın yayılması"" Meşhur ""İrtica"" brifinglerinde","anlatılanları,",muhtemelen brifinglere katılanlar bile unutmuştur.
w,W-CH03A1A-1515-883,İMAMI AZAM EBU HANİFE'NİN HAYATINI,ANLATIR,MISINIZ? Ebu Hanife 690 yılında
w,W-QD02A0A-1696-1301,"İlk defa bir yaşamı dinlerken,",anlatılanlardan,teşhis koymaya çalışırken gözyaşlarıma hâkim
w,W-NA16B3A-0615-484,İleriye dönük ne yaptıysam hepsini,anlattım.,"O kadar direnmese, belki ayıplamasın"
s,S-BEABXO-0444-921,İlaç milaç kullanamam ben ya.,Anlatamıyorum,bu çocuğa. O iğneler aslında
w,W-MA16B4A-0772-15,İbrahim kesik kesik herşeyi bize,anlattı,"""Ben deyim yirmi, siz deyin"
s,S-BEABXO-0117-1012,işte. Sağlık sorunlarını biraz bize,anlatabilir,misin? Eğer özel değilse yani.
w,W-SA16B4A-1492-1778,işte sonra ev gitti. Demin,anlattım,"ya. Ver dedi, evi bana"
s,S-BEABXs-0130-474,işte sen söyle biri birilerinin,anlatması,lazım. O da yok bizde
s,S-BEABXO-0121-377,işte o. Niye olmadı onu,anlatsana.,O da garip bir hikayesi
s,S-BEABXB-0410-556,işte hele bi anlat anlat,anlatmadın.,Bekirle ne yaptınız? Yaa şimdi
s,S-ADABCo-0360-354,işsizlik rakamı. Ee! size ne,anlattı,bu rakam efendim? Hii! Erhan
w,W-[I12F1D-4840-1674,işliyoruz. Dersimiz Matematik. Hoca ders,anlatma,çabaları içerisinde alnından terler aka
w,W-RH32D1B-2570-1294,işi yaptıklarını pek bir övünerek,anlatırlar.,Şu hızla değişen dünyamızda değişmemekle
w,W-TG37E1B-2936-419,işgalini ve iç savaşı da,anlatmakla,"birlikte, asıl olarak Yunan Komünist"
s,S-BEABXn-0102-341,işe yarıyomuş? Bak şimdi beyefendi,anlattı,"ya, bunlardan alıyoruz şimdi hangisini"
s,S-ADABPZ-0125-842,işe başladım yıl 1980. Hep,anlatılırdı,çalışır ama çalışır gayri safi
s,S-BEABXO-0440-539,işaret sıfatı yeter yani Diyara'yı,anlatmak,için. Ne ne ne? Diyara
s,S-ADABIA-0265-514,"iş moda tasarımcılığı, hani felsefeyi",anlatmak,"açısından. Ben de onu kullanıyorum,"
w,W-GA16B1A-0643-776,içiyorlar. Hepsi dehşetle yüzüme bakıyor.,"""Anlat,","anlat, neler oldu?"" diyorlar. Dudaklarım,"
w,W-II22C2A-0745-1133,"içindekiler, size bu konuları açıklayarak",anlatmaktadır.,Ulufer Oğuzcan'ın sevgiyle dinlediği ve
s,S-ADBBAo-0443-262,içinde uzun uzun sohbet ettik.,Anlattık,"bir şeylerin yanlış gittiğini, konuştuk."
s,S-BEABXs-0130-1047,içinde olmaz. Hoşuna gitti dimi?,Anlat,şimdi anlat. Oğlum ne adamsın
w,W-IE39C4A-1358-366,içinde olanları Ferit ve Hanifi'ye,anlatmaktaydı.,"""Ben bunlara ne yaptım?"" diyerek"
w,W-JI37C3A-0091-45,içinde konuşurken öyle zorlanıyorum ki,anlatamam.,"Dinleyici olmaya öyle alışmışım ki,"
w,W-UI45F1D-4795-2047,içinde capcanlıdır ya... öyle işte...,anlatamadım,"pek... Eskisi gibi değil, ama"
w,W-TH32D1B-2572-1092,içinde bulunduğumuz durumu çok iyi,anlatıyordu,Adam gazeteye bakıyor ve sevinçten
w,W-QD36E1B-2841-1373,"için varolmadığını anlarsan, sen de",anlatabilirsin.,"Batılı insan, bir yandan elini"
s,S-ADBBAo-0443-493,için sevilen sayılan toplumun gözünde.,Anlatmam,gerekiyorsa ben öncelikle mütevaziliğe ağır
w,W-IA16B1A-0094-2224,"için saat veriyor, ne yapacağımızı",anlatıyor.,Küçük bir planı olduğunu söylüyor
s,S-AEABTZ-0040-978,için ciddi çalışmalar var. Bunu,anlatacak,değilim. Uzman arkadaşlarım var. E
w,W-TI27D1B-2466-1304,için ciddi kilo kaybı yaşadıklarını,anlatıyor.,"""O iyice ölmedi, bir daha"
w,W-RG37C1A-0844-1684,"içimize akıverir. Sonra, gidip görenlerin",anlattığına,"göre; o yerde ağaçlar, çiçekler"
w,W-HA16B1A-0367-2067,"içi titredi, yüreği hopladı. Çiço'nun",anlatması,gereken şeyler olduğunu bildi ama
w,W-IA15B3A-0555-165,içe gömülüştür? Kıza her şeyi,anlatmak,"istiyor, ama yapamaz bunu, yapmamalı."
s,S-ADABAo-0385-777,izlenimlerini anlatır mısın? Valla izlerimi,anlatırım.,Tek başıma bayan ee! olarak
s,S-BEABXO-0094-1052,izin vermediler? Havuzdayken. Nasıl oldu?,Anlat,bakalım. Ben koşarken kaydım ama
s,S-ACAAPZ-0032-534,izin verirseniz emm bir anımı,anlatmak,istiyorum. Yıllarca önce ameliyathanede bir
s,S-ACABQq-0429-731,izah etmek istiyorum. Oturumun sonunda,anlatırsın.,"Efendim, lütfen. Sayın Başkan, bir"
s,S-ACABQq-0423-352,iyileştirmeler de yaptırmıştır. -Sayın Bakan,anlattı-,"ama, bizim gördüğümüz kadarıyla, yapılan"
w,W-CH42A3A-1378-1378,"iyidir."" Bu ayette açıkça şunlar",anlatılıyor,"İnsanlara mal varlıklarını, veren, TANRI'dır."
s,S-BEABXO-0122-660,iyi. İşte evin içindeki şeyden,anlatıyor,işte şöyle olacak böyle olacak.
w,W-VH20C4A-4854-633,iyi gitmiyor. Nasıl canım sıkılıyor,anlatamam.,Herşey bozuldu. Ama buna karşılık
s,S-BEABXO-0322-1033,"iyi dedi diyo, <gülerek> Suna'yı",anlata,anlata bitiremedi falan diyo yani
s,S-ADABPZ-0112-257,iyi bir takip. Bütün bu,anlattıklarımızı,şu şekilde özetlemek istiyorum. Kısaca
s,S-BEABXn-0352-399,iyi bence. Daha geniş... Ayrıntılı,anlatmıştır.,Aynı yazarın Da Vinci Şifresi
s,S-ACABQq-0423-258,"istiyoruz. Değerli arkadaşlarım, bütün bu",anlattıklarımdan,"daha mühim, daha önemli bir"
s,S-AEABAo-0016-773,istiyorum. Müze kısmını belki sonra,anlatırım,ama masumiyet kısmı tabi ki
w,W-JA16B4A-1747-490,"istiyor, güzel, çok güzel şeyler",anlatmak,"istiyor Metin'e. Nereden başlayacağını, neler"
w,W-RD02A2A-0809-860,istifade ettiğini kendi ifadeleriyle şöyle,anlatmaktadır,"""İngilizler Asya'da yüz elli milyon"
w,W-MF10A4A-1822-241,istek ve ihtiyaçlarını ve sorunlarını,anlatmada,"büyük güçlük çekerler. Bunun nedeni,"
w,W-PD30D1B-2177-2058,istediğini vurguladı. G. olayı şöyle,anlattı,"""Kaçırıldığımı gören bir kişi 'Durun"
w,W-GD03C3A-0667-1665,"istediğini bildirir. ""Eser"" kayboluşun öncesini",anlatmaktadır.,Selim Işık adlı biri intihar
s,S-ADBBI^-0042-233,"istediğimizi, Irak'ın bazı kaygıları bulunduğunu",anlattım.,Barış yoluna bir katkı yapmış
w,W-JA16B2A-0372-2029,istediğim çok şey vardı. Ona,"anlatmak,",ona susmak istiyordum. Bir şehri
s,S-BEABXO-0339-1069,ismini ya. Ee? Valla sen,anlat,ne yaptın ya? Annenle ne
w,W-KI45F1D-4056-1536,isimli bir özel şirket çözmüş.,Anlatıyorum,Her insanın dark focus denilen
w,W-LF25D1B-2155-2211,insanının girişimci ve sanayici ruhunu,anlatan,bir eser özelliği taşıdığını söyledi.
w,W-UE36E1B-3296-1697,insanın bir panayırda geçen hikâyesini,anlatıyor.,"Filmi izleyenler, panayırın yakınındaki inşaatta"
w,W-HD39C2A-0420-2154,insanlık dışı uygulamaların pençesine düşmeyenler,anlattıklarımı/yazdıklarımı,anlattıklarımı/yazdıklarımı büyük bir dikkatle bir
s,S-BEABXB-0410-1115,insanlar. Ee! Velhasıl ne yaptınız,anlat,bakim. Üç gün onun yanında
s,S-ADABIA-0108-872,"insanlar da var, bilmiyorum. Yani",anlatılacak,gibi değil çok çektim ben
w,W-SE09C3A-0408-2180,insandan söz etmem istense Berhan'ı,anlatırdım.,"Bir gün, artık hatırlayamadığım bir"
s,S-ADABPZ-0118-850,insan var. Milli mücadele kısa,anlatıldığı,için de milli mücadeleden heyecan
w,W-SA16B2A-0502-2004,"insan kimseye anlatamadığı şeyleri, sigarasına",anlatıyor.,Dünya neden böyle bir yer?
s,S-ADBBAo-0443-365,insan gelsin ve her şeyi,anlatsın.,Dilara Hanım içeri girsin. İnanmıyorum
w,W-TI22C4A-0825-1338,"inlemelerine kapılıyorsak, telefonlar da meramı",anlatmaya,"kâfi gelmiyorsa, kaleme kâğıda sarılıp"
w,W-TE09C2A-1267-518,inerler. Bağdat'tan niçin erken döndüğünü,anlatır,"Yakubov'a. ""Seninle uzun uzun konuşmamız,"
s,S-BEABXO-0147-724,inceleyin olmazsa bi dahaki ders,anlatıyım,tekrar... Bence sen kolay çözmeden
s,S-BEABXp-0156-410,incelenir biz zaten biraz küçücük,anlatmıştı,bizim kitap da. Yani bu
s,S-ADABCo-0183-837,ince ayrıntısına kadar aşama aşama,anlatılıyor.,Hedefin hangi saatlerde evden ayrılarak
s,S-ADBBAo-0443-393,inanıyorum. Bana bunları hiçbir zaman,anlatmıyor,ama. Şimdi birisi telefonda aloo.
s,S-ACABTZ-0336-860,inanmamak emm sizin elinizde. Ama,anlatılan,bir kısım gelişmelerin doğru olduğunu
w,W-II22C3A-0889-978,inancın ve güvenin sayesindedir. Bunu,anlat,ona... Hürriyet ile bir sorunu
s,S-ADBBI^-0042-267,"imkânı bulunmadığını, karanlığı, her şeyi",anlattık.,Sonradan duyduğumuza göre de dikkate
w,W-IE39C2A-0676-659,imkândan mahrumdur. Yapılan idamların haklılığı,"anlatılamayacak,",İngiltere'nin yalan propagandasına destek verilmiş
s,S-AEABUZ-0022-781,imkanın yok. Şimdi çok güzel,anlatırdı.,Bi yerden bulabilsem size okucam.
s,S-ADABCo-0214-328,ilkeli siyaset öğüdünü kendisinden örneklerle,anlattı.,Hiçbir siyasetçi cumhurbaşkanlığı makamını elinin
w,W-FA16B3A-0393-2151,ilk ötüşünde duyduğu sevinci böyle,anlatır.,Bu öyküyü küçük kızıma okuduğumda
s,S-BEABXw-0396-548,"ilk haftamı nasıl değerlendirdim, onu",anlatmak,istiyorum. <B> ben daha önce
s,S-ADABIA-0108-1013,"ilk evlendin, onun biraz zorluklarını",anlatabilir,misin küçük yaşta bi evlilik.
w,W-OE09C2A-1533-2160,ilk düşünceleri de vermişti. Baylar,anlatmak,istiyorum ki; ilk ilham ana
w,W-PG24D1B-2306-958,ilişkileri ve yarattıkları anıtsal eserler,anlatılıyor.,Metropolitan Müzesi sanat tarihçilerinden Barbara
w,W-QI09C4A-1373-940,ilgili ve hazır oluşu onun,anlattıkları,"konusunda beni şaşırtmadı. Konuşmalarımız esnasında,"
w,W-VD36C1A-2703-614,ilgili oyun oynama ve hikâye,"anlatma,","konsantrasyon ve öğrenme bozuklukları, uyku"
w,W-VI19E1A-4006-125,ilgili izlenimlerimi öğretmenime ve arkadaşlarıma,anlattım.,Hasan amcanın kişilik özelliklerini defterinize
s,S-AEABUZ-0021-981,ilerde. Ben emm Ekrem Bey,anlatacak,heralde çünkü onun bi sunumu
w,W-SA16B4A-0269-1947,ile ilgili olarak bildiklerini şöyle,anlatıyordu,"""1993 yaz aylarıydı. Ben o"
w,W-TF10A2A-1173-2107,ile halk üzerinde yapacağı etki,anlatılmalıdır.,Devletin ve özel sektörün uzun
w,W-JE02A2A-1523-1056,ile bugünkü durumları ayrıntılı olarak,anlatılmaktadır.,Seksen altı kamu AR-GE birimi
w,W-SE39C3A-0205-2023,ile belli oluyordu. Hayat hikâyesini,anlatmak,ihtiyacı içinde bulunduğu da aşikâr
s,S-ADABPZ-0115-454,ilave gereken şimdi bizim burada,anlatmaya,çalıştığımız şey <B>. Evet. uluslar
s,S-BEABXO-0416-1111,iki metre kadar Gülüş köpekleri,anlat.,"Böyle durmuş, kafasını kaldırmış, bize"
w,W-SA16B2A-1196-2442,iki katlı bir ev diye,anlatmıştı,Kuzey. Yakınında başka yapı yoktu
s,S-AAABLp-0161-332,iki hafta kadar önce kim,anlattı,hanginiz anlattı onu? <B> Teyit
s,S-BEABXO-0147-1003,"iki bi iki daha dört,",anlatabiliyo,muyum? Atmış beş tane sayı
s,S-ADBBAo-0443-1048,iki arkadaşın arasını ne açtı?,Anlat,ama isim vermeden anlatırsan sevinirim.
w,W-OH42C0A-0319-1879,iken Din Psikolojisi Profesörümüz sınıfta,anlatmıştı.,"Ankara'nın köylerinden birinde, muskacılığı, üfürükçülüğü"
w,W-TE30D1B-3263-1994,ihtiyaçlarının neler olduğu konusunu komşularına,anlatmada,güçlü pozisyonda olacaklarına dikkat çekti.
s,S-AAABOp-0011-610,ifadesine uygun olduğu için burada,anlatıyorum.,Monolog konuşma ise <D 735>
w,W-HI22C4A-0860-184,ifade edebildiği fikirleri varmış... Karşılıklı,"anlatıp,",yararlanıyoruz... Bu arada onların da
w,W-TE36E1B-3354-1307,"idi, ya Mersin"" diyor ve",anlatmayı,"sürdürüyor ""Pasaportunun süresi dolduğu için"
s,S-ADABPZ-0119-225,iddiasının başına gelir ki bunu,anlattım,size. Renk kavramı. Diğil mi?
w,W-PD20C3A-0512-408,idamını ve sarı zarfı millete,anlatmak,mecburiyetinde kaldık. Şimdi de Koray
s,S-BEABXO-0147-384,Hı-hı. Ya da şunu şöyle,anlatsam.,İki en eksi biri almasam
s,S-BEABXO-0390-776,Hı-hı. Ben haftaya sivil toplumu,anlatırım,büyük ihtimal etnisiteye de kısa
s,S-ADABAo-0033-348,Hüseyin biraz evvel çok güzel,anlattı,o hadiseyi. Ben tekrarlamıyorum. Peki.
w,W-TD09C4A-0211-512,"hâlâ şehitler veriyor olmazdık, geçmişi",anlatmamızın,"sebebi de bu zaten, yetkililer"
w,W-QI27D1B-2452-1548,Hz. İsa'nın son 12 saatini,anlatan,"""The Passion"" filmi nedeniyle büyük"
s,S-ADBBI^-0326-195,Huysuz Virjin'in kişilik özelliklerini başta,anlattınız.,Peki Seyfi Dursunoğlu'nun kişilik özellikleri
w,W-TE36E1B-3353-2136,"hukuk, içtihat yaratmak üzerinden meramını",anlatıyor.,"Biz de, bize karşı uygulanan"
s,S-BEABXs-0130-1072,Hoşuna gitti dimi? Anlat şimdi,anlat.,Oğlum ne adamsın lan. Ben
s,S-BEABXO-0128-1038,hoşuma gitti Nazan diye böle,anlata,anlata bitiremediydi. İşte öğlene doğru
s,S-ADBBAo-0443-228,"hoşlandım, o bir gerçekti. Aileme","anlattım,","zaten bir şeyler yapılacaktı, ailemde"
s,S-ACABTZ-0336-508,"hoş, muhteşem de emm bunu",anlatmak,çok zor. Hakikaten nükleer konularda
w,W-TF25D1B-2153-1952,"Holding bugün yoktu. Ancak, bu",anlattıklarım,Oyakbank'ın ING'ye satılmasına karşı çıktığım
w,W-MF10A4A-1822-1079,hiç söz etmiyorsa bunun bir,anlatma,biçimi olduğunu bilmemiz ve bu
w,W-JA16B2A-1738-1278,Hiç olmazsa kalede olup bitenleri,anlatıyorum,sana. Bu da az şey
w,W-NE39C4A-0081-1031,hiç güvenmiyordu. Burada bir ayrıntı,anlatayım;,"bizim ""işlerde"" tepeden tırnağa yani"
w,W-QD36C0A-0222-772,"hiç görmedim, ama saygımın derecesini",anlatamam.,Yüce görevinizde Tanrı ve aziz
s,S-BEABXO-0454-816,hiç bizimle umursamıyolar bile derslerini,anlatıp,geçiyolar. Hı-hıı. Yazılıya giriyoruz şimdi
w,W-PA16B3A-0503-655,hizmetlerinde gençler üzerinde yaptığı gözlemleri,anlatıyor,"""Sağ ve sol gruplara düşünce"
w,W-JA16B3A-1133-2170,hikâyeyi sanki sade kendisi için,anlatmaya,başlamıştı. İşte boy uzatma oyununun
w,W-PI13C4A-1531-393,hikâyelemedir/Kayseri Beckett'lemesidir bilemeyeceğim. Ama aşağıda,anlatacağım,"fıkranın varlığı, Türkiye Cumhuriyeti demokrasisinin"
w,W-QD36E1B-2841-838,"hikayen bile yok, bira bardaklarına",anlatacağın.,"İnce bir sokağa süzülüp, her"
w,W-CD09C2A-0207-536,herşeyi en ince ayrıntılarına kadar,anlattı.,"""Behçet Cantürk, Türkiye'nin en büyük"
s,S-BEABXO-0392-775,herhalde. Murat abi anlattırma bak,anlatırım,"zararlı çıkarsın. Yeter, Lütfü amcam"
s,S-BEABXO-0147-1019,heralde öyle biraz daha basit,anlatabileceğini,düşünmüş. Yani bahçenin etrafına dediği
w,W-MA16B4A-0588-1094,her şeyini değiştirmişti. Bunları Namlı'ya,anlatıp,rahatlamak istiyordu. Son olarak Lübnanlı'yı
s,S-ADAA^o-0133-927,her şeyi anlatmaz ya da,anlatamazlar.,Bir sembolün herhangi bir yerde
w,W-LI22C4A-0783-880,"her şeyi ""Hayat Güzeldir""de Güzeldir""de",anlattı.,İzleyicileri bu programın daima çok
w,W-FC06A3A-1049-1047,her zaman bazı kayıpların olacağını,anlatır.,"Geleneksel tarımda, her ürünü kendine"
w,W-UD02A1B-4618-2337,her resim hakkında bir öykü,anlatmanızı,"istiyorum. Burada ne olduğunu, kahramanın"
w,W-IA16B1A-0094-1562,her gün bu işi yaptığını,anlatıyor.,Ondan önce yaptığı ise düz
w,W-ND02A3A-1266-583,henüz dahilde bile kendi vaziyetimizi,anlatmadık.,"Köyler, hatta kazalar ve vilayetler"
w,W-SA16B2A-0836-2371,Henry üstlendi Şey... Doğrusu nasıl,anlatacağımı,"bilemiyorum. Ben, çocukluğumdan beri sürekli"
s,S-ACABQq-0422-486,"hediye ederseniz, hepimiz öğreniriz. Bunu",anlatmanıza,"gerek yok. Gündemdışı ikinci söz,"
w,W-NE39C3A-0779-2286,hedefinin hep insan hayatı olduğunu,anlatmaya,çalışıyordu. Bush Artık Türkiye de
s,S-ACABPZ-0329-511,hedefi size birazcık kemanın hikayesini,anlatmak.,Kemanın öyküsü adını koyduk. Bu
s,S-BEABXn-0349-1063,hazırlanıyo. Siz nasıl tanışmıştınız? Onu,anlat,hele? Dur anlatacaz daha dur
s,S-BEABXO-0344-897,hazırlamadık ki. Onlar hazırlamışlar ya,anlatanlar.,Ee? Elimizdeki bizim bir sürü
w,W-PI42E1B-2938-1036,hazır dinleyen birini bulmuşken başlamış,anlatmaya.,"Yenilerden, eskilerden anlattıkça açılmış uykusu,"
s,S-BEABXO-0117-1078,hayırlısı. Hayırlısı canım. Serhat sen,anlat,biraz. Okuldan bahset. Okuldan Hocalardan
s,S-ADBBI^-0326-536,hayatımı anlatırken bunu da özellikle,anlatmak,istedim. Kimlerle çalıştınız onlardan sonra?
w,W-RE39C3A-0721-2267,"Hayatı, sadece ekmek kavgasına indirgeyerek",anlatmak,yalın bir anlatım olur. Halbuki
w,W-NA16B4A-0040-406,hayattaydı ve Halit'in ballandıra ballandıra,anlattığı,o geniş toprakların bir parçasını
w,W-QG37E1B-2933-1151,"Hayatlarımızın Resmini"", yoksulları ve ezilenleri",anlatıyor.,Otoriteden yana olanlara ne yaparsanız
s,S-BEABXx-0394-879,"hayat var. Emm, ben ne",anlatcaktım,"lan? <D 4> Hıı, Schopenhauer"
s,S-AEAA@O-0155-422,hayallerini en ince ayrıntısına kadar,anlatmış,hatta hayallerindeki bir çiftlik varmış
s,S-BEABXp-0156-820,hatta şey kurultayda filan da,anlatılmıştı.,Hı-hı belli sözcüklerin şey olması...
w,W-OD30D1B-2176-1662,hatta bu zarfların komisyonda düzenlendiği,anlatılan,"gerekçeli kararda şöyle denildi ""Böylelikle"
s,S-BEABXn-0349-1062,Hasangilin sınıfı. Ee! <gülme> Sınıfını,anlat,hele sen Hasan. Ya sınıfta
s,S-BEABXn-0349-1065,Hasan sıra sana geldi. Sen,anlat,bakalım. Ya benim anlatacak bi
s,S-BEABXO-0342-315,"Harp, harp, harp var, babası",anlattı,savaş var. Sürekli kaçıyorlar. Elaziz'de
s,S-ADABPZ-0112-925,hareketleri annesine gülmüyor belki isteklerini,anlatamıyor.,Emm Bunlar fark edilince kimi
w,W-NI09C2A-0592-2466,hareket ettim. Ağabeyim Ankara'daydı. Durumu,anlattım.,Sorup soruşturduk. Adı aklımda yanlış
s,S-ADABCo-0335-898,Hanlığını bi anlasak veya Nemrutluları,anlatan,bi roman oo romantizmden ölürsün
s,S-ADABAo-0332-409,hani bi emm arkadaşımız şey,anlatmıştı,buna kendi elleriyle yağlı dürüm
s,S-ADABAo-0388-687,hangi kabilelerin nasıl Türkçe konuştuklarını,anlatıyor.,En beğendiği Türkçelerin Oğuz Türkçe'si
s,S-BEABXO-0453-962,hallice bir şey anlatacam fıkra,anlatacam.,"Hadi Damlaa. Ne fıkrası, ayıp"
w,W-UI45E1C-5076-1864,halini buldum. Ne kadar sevindim,anlatamam.,Çünkü önceki kopya çok silik
w,W-LI27D1B-2828-714,Halil Helvacı da savaşı şöyle,anlatmıştı,"""Üç gün hiç durmadan süngüleştik."
w,W-NI09C2A-0592-953,"halde içerlemiş ama, olayı kimseye",anlatacak,hali yok. İster istemez sineye
w,W-VE05A1A-2593-842,haklarının beşiği ve savunucusu olduğu,anlatılır.,"Sonra da, para karşılığında Avrupa"
w,W-TA16B1A-0069-418,hakkında anlatılanları ve zaten ne,anlatılsa,"inanırlardı. Sözgelimi, Amca'nın başına şöyle"
w,W-RD36E1B-2842-1990,"hakkı olmalıdır. 3. Tarihler, gerçekleri",anlatmadıklarına,"göre, hikâyenin anlattıkları en azından"
s,S-ADAASK-0036-433,Hak hakkı ve hakikatı kolaylıkla,anlatmayı,siz aziz dinleyenlerime de kolaylıkla
s,S-AEAASO-0039-432,Hak hakkı ve hakikati kolaylıkla,"anlatmayı,",siz değerli dinleyenlerime de kolaylıkla
w,W-RA14B1A-1582-1193,hadi. Ama kısa da olsa,anlatmadan,"yapamayacağım. Biliyor musunuz çocuklar, babanız"
s,S-BEABXW-0059-715,Hadi yaa. <D 7> Abimde,anlatıyo,yaa! Diyo bi sürü menü
s,S-ADAB^A-0317-381,haddimiz değildir. A-ah! Yani onu,anlatsan,ne olur anlatmasan ne olur
w,W-VF25D1B-2766-1363,haciz memuru kapıya getirmedim' diye,anlattı,bana. Yani en büyük başarısı
s,S-ADABAo-0388-916,haberim yok. Lehçeleri en iyi,anlatan,"Kaşgarlı Mahmut'tur. Kendisi bir prens,"
s,S-BEABXO-0120-301,Haa şimdi babayın bir zaman,anlattığı,senin kafanı karıştırdı şimdi. Ben
s,S-BEABIs-0015-563,Ha tabi çok detaylı yine,anlatmadı,ama en azından anlatıyordu. Saati
w,W-EA16B2A-0744-1877,güçlü kişiliğinin ona verdiği başkalığı,anlatmak,istiyorlardı belki de. Diğerleriyse Bahar'ın
w,W-PA16B4A-0591-471,Güzelce çıktı. Maymuncukların nasıl kullanılacağını,anlatan,bir minik broşür vardı. Onu
s,S-ADABAo-0318-1001,güzel ne mutlu tabi yani.,Anlatabiliyo,muyum? Bu iki kere iki
s,S-ADABPZ-0118-908,güzel insanımıza anlatırsak bütün bunları,anlatan,insanlar <B> olursa neye inansınlar?
w,W-SE39C3A-0543-1740,Güya bisiklet rotama bağlı kalarak,anlatacaktım,"ben size, değil mi, burada"
w,W-MD39C2A-1315-1792,Güvenen'i yorumlamak yerine Miraç Kandil'ini,anlatıyordu.,"Neysi ki, Cengiz Çandar ile"
w,W-NI27D1B-2829-2242,gürültüye bakmak için dışarıya çıktığını,"anlatarak,","""Gürültüyü duyunca çok korktum. Yerin"
s,S-BEABXw-0409-587,Gürsel'le. Ben de sana şeyi,anlatim,"yaa, bizim Soner'le tanıştığımız ilk"
w,W-VD30D1B-2207-1389,günkü açıklamasına göndermede bulunarak şöyle,anlattı,"""Konuşulan şeyler, zaten güzelce açıklanmış."
s,S-AEAASO-0039-772,günden beri ben bunu <B>,"anlatırım,",anlattım. Ve bugün de tekrar
s,S-BEABXB-0410-1116,gün işte hele bi anlat,anlat,anlatmadın. Bekirle ne yaptınız? Yaa
w,W-UA16B2A-1041-1712,gün dershane çıkışına gelen Erhan'a,anlattım,olanları. El ele metro istasyonuna
w,W-OG13C3A-1800-1673,"gün dayanamadım, Ali Rıza Efendi'ye",anlattım,olanı biteni. Hemen muhtara götürdü
w,W-UA14B1A-1595-2189,gümbür dolaşmak sade suya macera,anlatmaktan,daha tatlı gelse gerek üstadımıza.
s,S-AEABTZ-0337-826,gülmece dili olduğu düşüncesinin insanlara,anlatılmaya,çalışılmasında bir saçmalık oldu ne
w,W-TA16B4A-0910-748,"gülerdik. ""Tolga Bey, diğer olayı",anlatsanıza,"biraz. Kimmiş o kadın?"" dedim."
s,S-ADBBAo-0443-632,Gülben'in annesi tüm dobralığı ile,anlatıyordu,"her şeyi. Annen ""gözlerinle bakıp"
w,W-LH09C2A-0276-271,gücü becerileri vardı. Ben bunları,anlattığım,zaman en küçük bir ilgi
s,S-ADABCo-0204-438,gözler yaş doldu. Herkes üzüntüsünü,anlatmaya,çalıştı. Niye onlar geliyor özgür?
w,W-TD03A1A-1516-85,götürürken esas aldığı metodu şöyle,anlatır,"Ben özgürüm, kimsenin kölesi değilim."
w,W-SI22C3A-0559-2405,göstermek için getirmemiştim. Sana gerçeği,"anlattım,",ama sen dinlemedin ve yanlış
s,S-BEABXO-0093-416,"gösterecem, öğretecem. Hadi otur bakalım.",Anlatmışlar,burada. Bunlar nedir? Bak bu
w,W-UA16B2A-1163-1375,"görüyor musun, adını da unuttuğunu",anlatıyor.,Yalan söylüyor işte. Kadın olması
w,W-PG24D1B-2306-1267,"görüntüler yakalaması, olaylarının perde arkasını",anlatması,gerektiğini söylüyor. Pledge'e katılıyor musunuz?
w,W-LD02A1B-4490-920,"görülmektedir. Öte yandan, Aşıkpaşazâde'nin olayları","anlatırken,",Türk halk hikâyelerinde çok yaygın
s,S-ADBBAo-0443-360,görmüş olabilirler. Canım bir şeyler,anlatsın,"da, başka şeyler anlatsın. Bak"
w,W-QF41C2A-1482-826,görmüş gibi büyük bir heyecanla,anlatır.,Bu konuşma esnasında üstelik sık
w,W-KA16B2A-0056-1940,"görmemizdir,"" dedi öteki. ""Görmeyene kırmızı","anlatılamaz.""","""Münkirler, zındıklar, inançsızlar da Allah'ı"
