"Register","Text","Left","-5;5","Right"
"w","W-HE39C4A-1359-2035","de aç olduğunu anlatıyor. Yani","anladık","zeka yaşın tehlike kavramını sözel"
"s","S-BEABXO-0165-373","de anlatsana dayı, devamını da","anlatsana","çalılıkların arasına düştünü, artistlik yaptını,"
"w","W-FE39C4A-1346-14","de ""bireycilik"" ile bireysellik yanlış","anlaşıldı;","bir kavram kargaşasına düşüldü. Aslında"
"w","W-SE09C3A-0408-2002","dağılma başlamamıştı henüz. Annemle gözlerimizle","anlaşmaya","başlamıştık. Konuşamıyordu, konuşmayı neredeyse unutmuştu."
"s","S-BEABXB-0410-875","dağtacaz işte grubun bi konu","anlatıcaz","bi de şeyden klinikten yapıcaz"
"w","W-KA16B4A-0712-331","dağların yamacında bir kasaba olduğu","anlaşılıyordu.","Sabri kaygılı bakındı dışarı. Trenden"
"w","W-DA16B2A-0111-1455","dayanılmaz sıkılmasına kapılmadıklarını bir bakıma","anlamış","mı oluyorum böylece? Elektrik kesintileri"
"w","W-MD39E1B-3360-339","davranışının ona bir şey kazandırmadığını","anlamasına","yardımcı olacaktır. Güvenilir bir çevre"
"s","S-ADABAo-0312-43","davranışından. Soruşundan emm ne olduğunu","anlıyorsunuz.","Herşeyinden anlıyorsunuz. Dolayısıyla Sadık bey"
"w","W-CH37C1A-1109-1841","davranışta) iletilmek duygu ve dünceyi","anlatmak","ta bir sanat kültürünü gerektirir."
"w","W-ED02A3A-2028-794","davranışların rolü, yeri ve önemi","anlatılarak","başlanır. Hastaya endişe, kaygı, korku"
"w","W-GE05A1B-3495-622","davranışlar""ı anlamaktadır29. Yukarıdaki tanımlardan da","anlaşılacağı","üzere sarkıntılık suçunun oluşabilmesi için"
"w","W-GA16B2A-0606-1019","davranamayacaksın; masal değilim ben; işte","anlattıkların","bitti; son bakışının da çizgisi"
"s","S-ACABPZ-0329-970","davet ediyorum. Bize güzel şeyler","anlatacak","sanırım. <Alkış> Evet sesim çok"
"w","W-PA16B4B-3311-611","danışmanlar, Kiraz'ı öylesine ballandıra ballandıra","anlatmışlardı","ki!... Abdullah, randevu verdikten sonra"
"w","W-QA16B2A-0011-1501","dantel örtülerini düzelten kadın, pazarlığın","anlaşmayla","sonuçlandığına karar vererek kalktı, gümüş"
"s","S-BEABXg-0070-2118","dans hareketleri bulmam lazım. Evet.","Anladım.","Zaten o da lazım ya."
"w","W-UA16B1A-3337-1521","damlasının, ay pardon, kar tanesinin","anlattıklarından","hiçbir şey anlamamışsın sen."" diye"
"w","W-LC06E1B-3086-326","damar kaslarının gevşemek üzere uyarıldığı","anlaşıldı.","Bu bulgular Furchgott ve Zawadzki"
"s","S-BEABXO-0342-1045","Dalman dünyaya geliyor. Aman Allah'ım.","Anlat.","Eniştem bu, benim zaten başka"
"w","W-FI09C3A-1292-668","Daldal Çok acayip bir mektep.","Anlamıyorlar","insanı. İnsanın erkek arkadaşları çok"
"s","S-ACABQq-0421-546","dakikalık sürede, değil tarımın sorunlarını","anlatmak,","paragraflarını bile ifade etmek zordur"
"s","S-BEABXO-0416-2255","dakikalık ihtiyaç molası veriyorlar. Hıı","anladım.","Tam olarak normalde yarım saat."
"s","S-ACABQq-0422-929","dakika gibi kısa bir sürede","anlatamayacağım","bu büyük şahsiyeti, sizlerin huzurunda,"
"s","S-BEABXC-0047-1636","daha... Hocam şerit çizgisi yok","anlamıyorum","bazen. Deneyelim de yolun ortası"
"w","W-CA16B3A-1003-1417","Daha önce Ürgüp'e turist götürmüşsün...","Anladım.","Ben hasta olduğunu bilmediğim için"
"s","S-ADABCo-0197-1323","daha önce bunun öncesinde üçlü","anlaşma","yapılacak. Normal olarak böyle olması"
"s","S-ADAASK-0036-1466","daha çok misaller verebiliriz de.","Anlaşılıyor","mesele. Tabi. Velev ki aleyhimize"
"s","S-BEABXO-0342-576","daha yicem. <B>. <Gülme> Şimdi","anlatim","da, siz de gülün. <Gülme>"
"w","W-JC06A1A-1999-387","daha tehlikeli olur. Bundan da","anlaşılıyor","ki, sera kurulacak yerin rüzgâr"
"w","W-PA16B0A-0158-1925","daha soğumadan, derdi olan, sanattan","anlayan","birkaç kişiye satıyor. Meto ve"
"s","S-BEABXg-0070-2226","daha sonra hani komik olduğunu","anladım","hani küfürleriyle adama komik geliyor"
"w","W-PG37E1B-2932-598","daha o an nelerle karşılayacağımızı","anladık.","Her dayak öncesi aşina olduğumuz"
"w","W-UA16B4A-1185-328","Daha neler, neler..."" ""Ohoo kızım,","anlaşılan","senin işin iş,"" dedi Dilek,"
"w","W-OA16B0A-0112-2152","daha mı iyi bir hikâye","anlatacaktı?","Belki de anlatacaktı. Bir aktris"
"w","W-EA16B4A-0383-1581","daha hiç görmediler. Görevi devraldığı","anlaşılan","Captain Remy, ilk tanıştıkları gün"
"w","W-SA14B1A-1586-451","daha hançer sokmak olur bu.","Anlayın","işte hocam. Zavallı arkadaşımız ve"
"w","W-QG03A1B-3264-494","daha geniş bir yüzeye işleneceği","anlaşılınca","çerçevenin silinerek genişletildiği gözlenmektedir. Resimler"
"w","W-UA16B1A-1249-175","daha fazlaydı. Büyüklerin yaptıklarını hiç","anlamıyorum.","Jale teyze haftada üç gün"
"w","W-NF10A2A-1648-2068","daha fazla bilgi bulabilirsiniz. İşletmelerarası","anlaşmalara","göre işletmeler; işletmeler, pazarlara daha"
"s","S-ACAAPZ-0032-1740","daha farklı düşünmesi mümkün diğildi.","Anlamayan","insanlara bunu vurgulayarak belirtmenin bir"
"s","S-ACABQq-0423-559","Daha Danimarka'yı anlatmadım, daha Hollanda'yı","anlatmadım,","Fransa kapalı kutudur... Oralardan da"
"w","W-LC03C3A-0743-1087","daha da depresyon gelmedi. Sedat","Anlattıkların","bilimkurgu filmi gibi geliyor. Tamer"
"w","W-IH42A2A-1345-11","daha büyük yazık. Çünkü okuduğunu","anlamamışsın,","yahut Kur'an hakkında yalan söyleyerek"
"w","W-OH37C0A-0219-1809","daha birçok teori ve deney","anlatılabilir.","Ama hepsinin temeli aynı Hem"
"w","W-IC01A1B-3741-623","daha az memnun kaldıkları ifadelerinden","anlaşılmıştır.","Epidural uygulamanın meperidin gereksinimini önemli"
"w","W-FA16B1A-1920-267","da... Kasap anladı, bana baktı","Anladım,","küçük, kuzu beslemek istiyor, amma"
"s","S-ADABAo-0033-564","da. Şimdi aslında Hazreti Hüseyin'i","anlatmadan","evvel, İslam'ın nasıl ortaya çıktığını"
"w","W-QA16B4A-0299-669","da, neden nişanlından ayrıldın. Onu","anlat","bana."" Bir an durakladım; konuya"
"w","W-RI09C3A-0837-1147","da, insanlara iyiyi, doğruyu, güzeli","anlatmak","olunca da... Sıla hasreti bile"
"w","W-EE09C3A-3304-1265","da, benim bildiğimi o bilmiyordu.","ANLADI","TERES! Hikâye gerçektir. Yalnız geçtiği"
"s","S-ADABAo-0318-935","da şey o attan düşüşünü","anlatamam","ben çok üzülmüştüm abi ben"
"s","S-ADABAo-0366-828","da önemli olabileceği yavaş yavaş","anlatılmaya","başlanıyor. Bu bir karşı çıkış"
"s","S-BEABXc-0167-329","da öle. Ona da zor","anlattı.","<B> Yani her zaman şurda"
"w","W-JA16B3A-1721-1564","da yüzbaşı Deli Mehmet Beyi","anlatır","dururdu. Ne kadar çok dinlemişimdir"
"w","W-MF25D1B-2156-1734","da yenileyerek, daha yalın ve","anlaşılır","görünüm kazandırdı. E.C.A teknoloji ödülüne"
"w","W-JI37C3A-0642-1155","da yaşamıştı! Dostoyevski, Türgenyev bunu","anlatır.","Aynı filmi sanayileşme döneminde Türkiye"
"s","S-AEABUZ-0038-1185","da var. Bugün Amerika Kyoto","Anlaşmasını","imzalamıyor. Niye? Refah payından geriye"
"s","S-ACABQq-0423-1355","da Türkiye'yle yapmış olduğu 57","anlaşma","kabul edilmiş ve eklere girmiştir."
"w","W-SI22E1B-2912-1393","da söz nasıl tutulurmuş, gör.","Anlat","babam! Hani boya işi yapan"
"s","S-ADABI]-0127-579","da sorucaktın. Of!, şimdi şöyle","anlatim","dedim ya şurdan alıcam yine"
"w","W-KH03A3A-1449-345","da sevinç gibi duygulan, duymadan,","""anlayabilir"".","Bu anlamda, örneğin hoş değeri"
"s","S-AAABOp-0011-999","da onundur, çevresindekiler de onun.","Anlatabiliyor","muyum? <D 942> Her araba"
"w","W-QA16B1A-1198-119","da onun yabancı biri olduğunu","anlamış.","Efendim beni huzurunuza kabul ettiğiniz"
"w","W-OA16B4A-0777-1060","da ne? Çiseleyen yağmur altında","anlatılmaz","bir düzenle, bir o yana"
"s","S-ADABIi-0124-580","da nasıl bulunduğu mu şöle","anlatim","size isterseniz ben bugün tiyatroyu"
"w","W-FA16B3A-0393-2462","da mektubu çöpe atarsa nereden","anlarız""","sorusu geldi. Karısı işi ciddiye"
"s","S-BEABIs-0015-676","da işte emm olmadık olumsuzlukları","anlatıyor.","Yani tarihi de öğreniyor bu"
"w","W-YI45F1D-4810-562","da hiç bitmiyor, bitemiyormuş. Anlamıyorum,","anlayamıyorum...","Neyin kavgası bu? Neyi paylaşamamak?"
"w","W-NI22C4A-0366-18","da her şeyi olduğu gibi","anlatacaktım.","İkinci yolu seçtin eminim. Evet,"
"s","S-ACABUZ-0035-2358","da hasar ister.” ister.” Herkes","anladı","heralde. Hasar nedir? Ne diyor"
"w","W-QD36E1B-2841-237","da gerici vb. tanımları mı","anlamalıyız?","Elbette ki hayır. Zaten bu"
"w","W-QF10A2A-1817-291","da dahildir. Bu bakımdan TBT","anlaşması","ticari engelleri çok daha geniş"
"w","W-SH39C0A-0142-637","da daha çok dünya devrimlerini","anlatan","romanlardan seçilir. Seni Halk Adına"
"s","S-BEABXf-0171-2067","da daha devam ediyo işte.","Anladım.","Fethiye de güzelmiş. Güzel ben"
"w","W-NE39C0A-0215-354","da bunları imrenerek seyredurması sanırım","anlatmak","istediklerimi daha net ifade etmeye"
"s","S-ADABPZ-0135-1743","da bu ya böyle mi","anlamaya","çalışıyorum ama bu konuda görüşlerinizi"
"s","S-ADABPZ-0135-956","da ben size ayrı olarak","anlatacam.","Ama bazen bu eleştiri tipini"
"w","W-TG09C3A-0019-1532","da babamdır. Ama daha önce","anlattığım","gibi, ben bu işte aşırıya"
"w","W-PE39C0A-0197-1869","da atlatılarak bir gizli ittifak","anlaşması","imzalanması üzerinedir. Burada da gerekli"
"s","S-ADABAo-0355-110","da aspirasyondan <B> gidiyo. Ne","anlıcak","o adam? Kuyulu kıyamet girmiş"
"w","W-VI39C1A-2642-1660","cümlelerimizi kısa ve net tutmalıyız.","Anlaşılmayan","dolambaçlı cümlelerden uzak durmalıyız. Doğrusu"
"s","S-ACABQq-0423-1248","Cumhuriyetindeki askerî varlığımız. Bu garanti","anlaşmalarının","işlevsiz ve fonksiyonsuz hale geldiği"
"s","S-ACABQq-0423-1800","Cumhuriyeti Devletinin demokratik vasfını tam","anlamamak","demektir. Yalnız, satmak için hükümet"
"s","S-BEABXO-0392-189","ciğerleri çıktı herhalde. Murat abi","anlattırma","bak anlatırım zararlı çıkarsın. Yeter,"
"w","W-OA16B4A-0061-124","ciğer, rakı getirin ordan Muşmula'ya!","Anlat","Muşmula, nedir derdin? gibisinden bir"
"s","S-ADBBAo-0443-2302","ciddi olarak birbirimizden çok uzaklaştığımızı","anladık.","Mesafe olarak mı, duygusal olarak"
"w","W-NE39C4A-1284-1726","cezalandırılmıştır. 10. Ceza ile uslanmayacakları","anlaşılan","Esat, Rauf ve Abdullah isminde"
"w","W-EI09C4A-0726-1353","CEZAEVİ BUNALIMI Dr. Neşati Üster","anlatıyor","İkinci Dünya Savaşı'nın ortalarında Nâzım'da"
"w","W-GC03A2A-1177-933","cevapları, yüzündeki mimikleriyle müdüre iletiyi","anlayamadığını","ya da neleri nasıl anladığını"
"w","W-TE39C4A-1397-995","cesur hamlelerin önemini daha iyi","anlıyor.","Bir Akşam Yemeği ve Şarap"
"w","W-KA16B4A-0712-670","ceplerini karıştırıyordu, sürekli bir şeyler","anlatıyordu.","Sağ yanında, on yaşındaki büyük"
"s","S-ADABAo-0355-2315","cemaat... Ya şimdi cemaat sizin","anladığınız","cemaat değil. Yani o orda"
"s","S-ADABAo-0355-1402","cemaat geldi yalnız. Zannediyorum yanlış","anlaşılmış.","Yani hocanın bahsettiği cemaat... Ya"
"w","W-TE39C0A-1396-1686","celp edilen tahkikat evrakının tetkikinden","anlaşıldığından","sözü geçen maddenin maksadına uygun"
"s","S-ACABUZ-0035-2349","cehennem bir şiirinde. Ama onların","anladığı","manada dindarlık değil. Tevfik Fikret'in"
"w","W-MI09C2A-0014-1615","cebiri başından sonuna kadar onlara","anlatmıştım.","Yaldızlı filan bir şahadetname almıştım."
"w","W-CA16B3A-1003-2312","canım. Şimdi neden feministliği bıraktığımı","anlatayım.","Yalnız sabırla dinlemeni rica edeceğim."
"w","W-JI22C2A-0797-1863","canım sivrisinek çalmak istedi, siz","anlayasınız","diye. Hadi bakalım seçimini doğru"
"w","W-BE39C1A-0857-961","Cansen'in görüşü ""Alman firmasıyla yapılan","anlaşma,","alelade bir ticari anlaşma değil,"
"s","S-AAAAFZ-0383-1539","canlılarda ve bitkilerde ortak olduğu","anlaşıldı","ki çok önemlidir hücrelerdeki iyon"
"s","S-BEABXg-0070-345","canlı adam arkadaşın bi tanesi","anlattı","bunu. Direk kendisi görmüş yani."
"w","W-SI42E1B-2941-1376","can kurtuldu!"" dedi ve hikâyeyi","anlattı.","Padişah hikâyeden memnun oldu, ihtiyarı"
"w","W-VG03A3A-2718-797","Camii'nin geçmişini ayrıntılı bir biçimde","anlatan","bu makalede, mimarın dinsel duygularının"
"w","W-TA16B2A-1204-1065","cadı ansızın neler olup bittiğini","anladı.","""O zaman..."" ""Evet, Şeroks. Dilimizi,"
"w","W-VA14B1A-1606-225","Bıyık Bak sana bir hikaye","anlatayım.","İyi dinle. Hikayenin sonunda hala"
"s","S-AAABOp-0011-1957","bırakırsanız sevinirim ve çok önemlidir","anlamadığınız","herhangi bi şey olursa lütfen"
"w","W-MA16B3A-0331-2477","bırakırlar diye endişeleniyor."" ""Anlıyorum."" Ne","anlıyor","ne de inanıyordum oysa. Bunu"
"s","S-BEABXO-0345-1569","bırakır mısın? <gülerek> Ya da","anlaşılabilir","olma da yazabilirsin sen bilirsin."
"w","W-RA16B0A-0292-1120","bırakılması ve Bekir Sami Bey","anlaşmalarının","onaylanması lehinde kuvvetli bir akım"
"s","S-ACABQq-0426-1201","bırakılan Osmanlı devleti, Mondros Ateşkes","Anlaşması","ile imparatorluk topraklarının pek çoğunu"
"w","W-UH42C2A-0412-43","bırakılan hayvanların bu haline öfkelendiği","anlaşılan","Hz. Peygamber şöyle buyurdu ""Allah'tan"
"w","W-TG24D1B-2321-851","bıraktığı telefonun, kendi telefonu olmadığını","anlayan","Levent komutan, akşama kadar hiç"
"s","S-AEABI^-0330-955","bırakacam, ama aileme bunu nasıl","anlatacam","bunu bilemiyorum dedi. Benim tek"
"w","W-RD36C3A-0076-61","büyütüyor. İnsanlık kavramını, hümanizmayı, Akdeniz'i","anlatmıyor...","Onlara sanat kültürü aşılamıyor... İnsanın,"
"w","W-HF10A2A-1876-1524","büyük ölçüde düşürmeye söz verdiği","anlaşılmaktadır.","Bu köklü değişimin gerçekleştirilmesi ise"
"s","S-AEABUZ-0022-1291","büyük gümrük anlaşmalarının içinden çıktığı","anlaşmalar.","Vazel 1, Vazel 2, Vazel"
"w","W-EA16B2A-1145-392","büyük duvara yaslanmış duruyorduk,"" diye","anlatmaya","koyuldu. ""Küçücük beyinlerimizle idrak ettiğimiz"
"s","S-AEAASO-0039-871","Büyük devlet. Çok büyük nimettir.","Anlatılacak","gibi bir nimet değil. Ancak"
"w","W-HG37C3A-0598-903","Büyük bir tutkuyu ve acıyı","anlatıyorlar.","Onulmaz bir acıyı. O anda"
"w","W-EA16B4A-1042-2044","büyük bir sosyologun ağabeyi olduğunu","anlatırdı,","bilmeyenlere... Tek masa hepimize yetmez."
"s","S-ADABAo-0388-744","büyük bir kısmı şehirleri, ülkeleri","anlatırlar","buna büldan coğrafyacılığı denilir, bir"
"w","W-DH41C3A-0699-1779","büyük bir kuyruklu yıldız olduğu","anlaşıldı.","Satürn ve Uranüs arasında yer"
"s","S-BEABXO-0448-2027","büyük bi ev olsa böyle","anladın","mı yani hiç değilse şu"
"w","W-VA14B1A-1602-870","Büyük Baba Ben de seni","anlayamıyorum.","Reyhan ile neden bu kadar"
"s","S-AEAA@O-0153-902","Büyüdüğü zaman ne olmak istediğini","anlatan","bi öykü yazmasını istemiş. Çocuk"
"w","W-SG37C0A-0189-371","bütünleşmek istemektedir. Sacher-Masoch kurbanın öyküsünü","anlatmaktadır.","Marquis de Sade'da doğa yasalarıyla"
"s","S-ADABPZ-0135-444","bütün konuşmalarımda onu amaçladım. Onu","anlatmaya","çalıştım. Ama sonra baktım ki"
"w","W-VD02A3A-2701-1634","Bütün bunlar çocuğa uygun yöntemlerle","anlatılabilmeli","ona doğru yöneltiler andırılmalıdır. Ancak"
"s","S-ACABQq-0423-1165","bütün bu süreç tamamlandıktan sonra","anlaşmayı","imzalayabileceğini söylüyor; yani, Plana, şu"
"w","W-GE39C2A-1367-2414","büromda. Köylülerin de karşı olduğunu","anlatıyordu.","Ne yapılabilirdi? Partide konuyu açtığım"
"s","S-ADABII-0439-1386","bünyesinde kurs açamıyorsa bir yerle","anlaşıp","öğrencilerini oraya yönlendirebilir hepsinde de"
"s","S-BEABXW-0058-415","böyle. Gördüm konuştum monuştum da,","anlatmışlardı","biraz da hani öyle çok"
"s","S-ADABAo-0388-915","böyle yapmaz sadece iklime göre","anlatan","coğrafyacılar bu planı izlerler. Bunun"
"w","W-OC03A3A-1418-871","böyle uzayıp gider. Kısacası, yazı,","anlattığı","şeyin de, onu anlatanın da"
"s","S-ADBBI^-0326-1391","böyle olursa- rahatsız ediyor. Hemen","anlaşılsın,","hemen yapılsın istiyorum ki, bu"
"s","S-BEABXO-0344-1892","Böyle mi tutcaz nasıl tutcaz","anlamadım","ben. <gülerek> Neresinden tutabiliyosan tut"
"s","S-BEABXR-0010-769","böyle kapanır. Sonlanır arama. Anladın?","Anlatırım","sana. Şimdi orya koy. <Gülerek>"
"s","S-BEABXs-0130-2194","böyle gösteriyor Ethem abiyi ne","anladım","diyor yemiyor onu göstermeye <B>"
"w","W-RA16B2A-0441-265","böyle görmemelisin. Canım sıkıldı birden","Anladık,","Ferit'in arkadaşısın. Öyleyse daha fazla"
"w","W-GA16B4A-0078-839","böyle bir şey görmemiştim. Şimdi","anladım.","Buralarda gece gerçekten de bir"
"w","W-UA16B3A-1065-283","böyle bir karar aldıklarını ağlayarak","anlattı.","O âna kadar hiç tepki"
"s","S-ADABDp-0432-594","böyle bi sonucu? Biz hep","anlatıyoruz","varislerinizde önce azalmayı görceksiniz, ondan"
"s","S-ACABQq-0423-1216","böyle basit bir denizcilik hakları","anlaşması,","denizde çalışanların güvenliğiyle ilgili bir"
"s","S-BEABXO-0321-709","böyle arkadaşa anlatsana diyorum. Bi","anlatıyo","arkadaşa falan, arkadaş gülcek gülemiyo,"
"s","S-ADABI\-0438-164","böyle anlatmam onun yaşına göre","anlayacağı","biçimde anlatırdım. Anneciğim derdim içersi"
"w","W-EI41C4A-1309-986","bölümünü, İngiltere'deki yakınlarına İstanbul'daki hayatı","anlatan","mektuplar yazarak geçiriyordu. Dünya Edebiyat"
"s","S-ACAAFZ-0048-1317","Bölüm Madde 46'da diyor ki;","""Anlaşma","sağlandıktan sonra, Rum kesimi ile"
"w","W-OG37C0A-0191-664","bölgesine ait değerleri tüm dünyanın","anladığı","ortak bir dille, yani müzik"
"w","W-TD39C2A-1753-1607","bölgesel milliyetçilik yapmakla eleştiriyor. Asıl","anlatmak","istediği ise Ak Parti'nin, DTP"
"s","S-BEABXc-0167-947","böle yavaş yavaş çalıştı ama","anlatamadı,","böle Türk şey konuştu de"
"s","S-ADABIi-0124-2340","böle bir şey söz konusu","anladığım","kadarıyla. Çünkü hani bizde tiyatro"
"s","S-ACABQq-0423-612","buyurun. Ben, size, kendi izlenimimi","anlatıyorum","arkadaşım. Basında okudunuz, Sayın Başbakan"
"w","W-OA16B0A-0174-395","buyursun... Amin!.. GIYBET ETTİĞİNİ NASIL","ANLADI?","Cüneyd-i Bağdadi bir gün evinin"
"w","W-GA16B1A-1217-895","buruktu. Annesinin sözleri üzerine ayrıldığımı","anlamıştı.","Onu üzmek istemezdim ama... Hadi"
"s","S-ADABIi-0124-452","burjuvazinin yıkılışının gelişini kendi çağından","anlatmaya","başlamıştır. Döneminde anlaşılmamıştır ama yıkıldıktan"
"w","W-LA16B4A-0298-791","Burhan. ""Bana bunu neden yaptın,","anlat.","Böyle bir cezayı hak etmek"
"s","S-BEABXf-0406-1940","burda… İşte budur. Yaa ben","anlamadım.","Tamam da bu şeyin sürmesi"
"s","S-BEABXs-0130-2198","buraya oyuncu sözleşmeli alıcaklar. Anladım","anladım.","Özgür abi sözleşmeli değilmiydi daha"
"w","W-EA16B1A-0856-1110","buraya geliyorlardı... Ağlama duvarı gibi","anlatıyor,","anlatıyorlardı... (Yapraklarım bunun için mi"
"s","S-BEABXO-0389-2157","buraya anladın mı tek taş?","Anladım.","Mesela o taşı bırakıp alıyor."
"w","W-KI13C2A-1498-1831","buralara geldiklerini biraz daha iyi","anlamam","için benim Kazakistan'a gitmem, orada"
"w","W-NG43C2A-1805-944","burada?"" diye sordu. Her şeyi","anlattım.","Çok kızdı, birçok hekimi başıma"
"w","W-QA16B4A-0152-2407","Burada köprübaşını tutmak kolay olmayacaktı","anlaşılan.","Şiddetli bir çatışma uzun bir"
"s","S-ADAA^o-0133-426","Bununla birlikte semboller, her şeyi","anlatmaz","ya da anlatamazlar. Bir sembolün"
"w","W-UA16B2A-1248-2165","bunun çok zor olduğunu da","anlıyordu.","Hatta, imkânı yoktu bunun. İş"
"w","W-FA16B3A-0986-1984","bunun neticelerini açık seçik tartışıp","anlatmamız","lazım oradakilere. Müstakil devlet olmaları"
"w","W-SA16B4A-3367-1179","bunun inanılmaz bir rahatlık verdiğini","anladı.","Artık ondan tamamen kurtuluyordu; sonsuza"
"s","S-AEAASO-0039-2304","bunun hesabını herkes verir. Ne","anladık","şimdi biz buradan? Cenab-ı Allah"
"s","S-AEABTZ-0337-1529","Bunun hablis kanserinin olduğu sondajlarla","anlaşıldı.","Ameliyat edildim. Sol ak akciğerim"
"w","W-SG03A0A-0168-560","bunun gibi kutlamalar gösteriyor ki,","anlaşıldığı","kadar bile, anlaşılabildiği kadar bile,"
"w","W-CH42A3A-0766-1910","Bunun evrensel sebeplerini uzun uzun","anlatmak,","bu eserin çerçevesini ve hedefini"
"s","S-AEABUZ-0021-1214","bunu, TRT'de sonuna kadar çünkü","anlaşması","gereği, uluslar arası bir anlaşma"
"s","S-ACABQq-0421-259","bunu yakalayacağımıza inanıyoruz. Tabiî, bu","anlattıklarım,","gerçekten, başarılması zor işler gibi"
"w","W-SE13C2A-1487-346","Bunu unutmayacağım. İyi, o zaman","anlatıyorum.","Boyutlar evrensel sistemin gerekli bölümlerindendir."
"s","S-BEABXO-0447-2030","bunu sürdüğümde kalem ihtiyacı hissetmiyorum","anladın","mı? Ama onu sürdüğümde emm..."
"s","S-BEABXp-0156-2181","Bunu incelemeyi düşünüyorum. Hıı anladım","anladım.","Ama polysemantic'le ilgili çok fazla"
"w","W-PI43C1A-0522-343","bunu güneşe söyleyecek kimse yok.","Anlıyorum.","Güneş de biraz ebel o"
"s","S-ADABLA-0266-215","bunu geçen yıl da biraz","anlattım","di mi, hıı?, kaldı mı"
"w","W-UC01A3A-0773-756","Bunu enjekte ederim, daha önce","anlattığım","gibi karşısındaki kişilerin de kendisiyle"
"s","S-BEABXO-0344-1872","Bunu direk böyle vericek miyiz?","Anlamadım","ben. Hı-hıı. Eğitimde podcast... Açılmadı"
"s","S-ADABAo-0366-1503","bunu böyle açıklamaya çalışıyorum daha","anlaşılır","olsun diye. Örneğin akıl, eleştirel"
"s","S-ADBBAo-0443-217","bunu bir trafik kazası olarak","anlattım","herkese. Öyle geçiştirdim. Peki neden"
"s","S-ADABAo-0433-1937","bunu bilmiyorum. Ne yazdığını da","anlamadım.","Nutella 20. Lerzan Mutlu'dan bi"
"s","S-ACABTZ-0336-645","Bunu Batılı nükleer emm sanayiciler","anlatıyor","halka. Bizim sistemimiz de Çernobil"
"s","S-ACABUZ-0035-2233","bunu anlamıyanınız var mı? Yani","anladım","veya hakikat başka yoldan mı"
"s","S-ACABQq-0421-964","bunların çok daha fazlasını bize","anlatacaktı.","Gerçekten, ülkemiz, sağlık göstergeleri ve"
"w","W-QD36E1B-2841-240","Bunları, dünyanın bizim için varolmadığını","anlarsan,","sen de anlatabilirsin. Batılı insan,"
"w","W-OA16B4A-0049-198","bunlarla hiç ilgisi olmayan anılarını","anlaşılmaz","bir biçimde canlandırıyor, ona hem"
"s","S-BEABXO-0012-2238","Bunlarla bi şeyimi tüketiyim diyosun","anladım.","Bi tüketiyim. Doğru, haklısın. İşte,"
"w","W-OA16B3A-0043-1588","bunlar üvey kardeşimin peşindeki adamlardı.","Anlamadığım","konu ise Doğanla konuşmamı istemeleriydi."
"s","S-ACABQq-0426-1463","bunlar çalışıyor. Burada bir yanlış","anlaşılma","olmadı. Bir sürü adam dışarıdaydı"
"s","S-ADABIA-0265-285","bunlar hep işte o demin","anlattığım","baskılar. Ee bunların artık <D"
"s","S-BEABXn-0099-2215","Bunlar da beş lira. Hı-hıı","anladım.","Onların başka rengi olsaydı olabilirdi"
"s","S-ACABUZ-0035-1841","bunlar bizi kurtarmaz. Türkiye'nin bugününü","anlamak","için bugünlere nasıl geldiğini iyi"
"s","S-ACABQq-0423-914","bundan ne kadar rahatsızlık duyduğunu","anlatan","bir ifade. Amerika'nın Sesi Radyosunda"
"s","S-ADABIA-0264-175","bundan da bir kız hoşlanıyo","anlayabiliyo","muyum. Yani bunu şu anlamda"
"s","S-ACABQq-0423-1177","bunda ısrarcıyız. Bununla ilgili metne,","anlaşmaya,","şu metin, aynen, şu şekilde"
"w","W-KA16B2A-0056-1158","bunağa hiçbir suçum olmadığını ağlayarak","anlatmaya","çalışmıştım. O zaman da, tıpkı"
"w","W-LG22C3A-0892-370","Bunalıyorum. Çok bunalıyorum. Yani size","anlatamam","nasıl bunaldığımı."" ""Tahmin edebiliyorum Dirayet"
"w","W-EA16B4A-0489-212","buluştuk. Şöyle yürüdük biraz. O","anlattı.","Özgür nişanlanmayı iyice koymuş kafasına."
"w","W-SI22C3A-0559-1188","buluyordum. Sonra hayat bana kendini","anlattı.","Onu tanıdım. Ondan öğrendiğim dersleri"
"s","S-BEABXu-0055-1495","bulur veya gelen birisiyle... Hıı","anlaşılır.","Mesela sizin gibi bir başkası"
"w","W-PI09C3A-1078-232","bulunurdum. Mutfakta yaşananları ise hiç","anlatmayayım","daha iyi çünkü bu kitabın"
"w","W-NF10A2A-1847-1642","bulunulan ülkelerin dağılımı aşağıda verilmiştir.","Anlaşmanın","tamamlanmamış olması nedeniyle AB ile"
"w","W-SA14B1A-1587-1914","Bulunduğum evin penceresine gelirlerdi. Ama","anlayamadım","bir şey var, siz nereden"
"w","W-EE05A1B-3450-1062","bulunduğu, ülkesinde ilmi çalışmaları başlattığı","anlaşılmaktadır.","Bir süre önce ortaya çıkarıp"
"w","W-WI45F1D-4721-2048","bulunduğu kültürdeki yerini çok iyi","anlaması","gerekir. Fakat bu anlam sabit"
"s","S-ACABQq-0423-1254","bulundurmayacaktı. Biz, yine, daha önceki","anlaşmaların","gereği bunda çok ısrarcı olduk"
"s","S-BEABXp-0156-1896","buludurucam şimdi ben onu tam","anlamadım.","İstersen yani istersen sen yani"
"w","W-GD39C3A-0736-957","bulmakta çok zorlanıyorum. Aslında ""sağdakileri""","anlamak","daha kolay. Zira Cumhuriyet bunlara"
"s","S-ACABQq-0421-895","bulma olanağımız vardır. Bir anımı","anlatarak,","sözlerimi bitirmek istiyorum. 1995 yılında,"
"w","W-JA16B3A-0796-2292","bullak olmuş bir ses tonuyla...","""Anladık,","sen de haklısın... ama, ben"
