"Register","Text","Left","-5;5","Right"
"s","S-ADABPZ-0134-2058","duygudur, çatışma, değişme her zaman","olacaktır.","Bunu sonuna kadar önlemenin bir"
"w","W-NH37C2A-0073-546","duygu ve davranışı tasarımlarına bağlı","olduğu","için de, yalnızca dilinin bunları"
"w","W-DA16B2A-0639-276","duvar delmeyi düşleyen bir hükümlü","olmak","istemem!"" Öyle de yapmış, bir"
"w","W-PA16B4A-0099-1587","duruyordum. Güzel bir yemek fena","olmazdı.","""Yemedim, nereye gidelim."" ""Hacı Salih'e"
"w","W-RA16B1A-0788-661","duruyordu. Ayça'yla Elif ilk iş","olarak","koşup yavrulara sarıldılar. Onlar için"
"s","S-BEABXO-0347-1373","duruyor. Ben neye çok sinir","olmuştum,","herkes öyle yapıyordu ya böyle"
"s","S-BEABXO-0089-1292","duruyor. Babası Kayra Kayra laf","olsun","diye söylüyor. Lafları geçiremiyorlar. Ben"
"w","W-KE39E1B-3030-1345","durumunda, ABD'nin sınai bakımdan gelişemeyecek","olduğunu","belirtiyor."" Japonya'nın Farkı ABD, 70'li"
"w","W-KE39E1B-2839-1876","durumunda hükümetin daha da başarılı","olacağını","düşünüyordu DSP'liler. DYP veya FP"
"s","S-ADABCo-0249-2328","durum Rusya'nın en zengin kadınını","oldukça","üzdü ve Baturina çareyi devletten"
"w","W-PD39C4A-1191-1486","durmasıdır."" ""Tek kurtuluş yolum. Ya","olacak","ya olacak!"" ""ÖSS, benim anam,"
"s","S-BEABXn-0067-2273","Durdum şöyle dedim Cem sakin","ol.","Sen de içiyo muydun? İçiyodum"
"w","W-FD36E1B-2848-432","duran ihtiyaç, özdeşleşmenin yerine ""ait","olma""","faktörünü koymakla, böylece bir topluluk"
"w","W-IF09C3A-1008-664","Dupont kolay kolay ""evet"" demiyordu","Olmaz","sen evlisin, ICI ile münasebetlerin"
"w","W-RE36E1B-3293-673","Dubai Kuleleri ise 300 metre","olacak.","İstanbul'daki dünya Anti-aging Kongresi'nde 120"
"w","W-SA16B2A-1394-93","dua etsem azdır. Bana insan","olduğumu","tersinden de olsa hatırlattığı için!"
"s","S-ADABCo-0207-1138","DTP Amerika Birleşik Devletleri'ne temsilci","olarak","Nazmi Gür'ü göndermeyi kararlaştırdı. Gür"
"s","S-AEABTZ-0337-2036","dramatik hadiselerden birisi de bu","olsa","gerek. <D 13> <B> devlet"
"w","W-NA16B4A-0054-1579","Dr. Evangelista'nın 'mafiyoza örgütlenme biçimi'","olarak","tanımladığı 'büyük aileler' şeklinde örgütlüydü."
"s","S-ADABPZ-0119-1186","doğumla beraber bu bilgiye sahip","oluyoruz.","Bu bilgi biliyorsunuz Hıristiyanların dinsel"
"s","S-ACABPA-0434-2106","doğrultuda yapılması başarıyı sağlayan unsurlar","olarak","değerlendirilmektedir. Ben parlamenter-başkanlık sistemi ayrımına"
"s","S-AEABTZ-0040-1903","doğrudur. Ama modernite alt yapılı","olmayan","bir gerçeklik ilkesiyle simulasyon kurarsanız"
"w","W-VI44F1D-5105-975","doğrudur ve adalet için öylede","olması","gerekiyor. O yönetmeliğe nasıl ulaşırız."
"s","S-ACABPA-0434-302","Doğru Yol Partisi Amasya Milletvekili","olan","İyimaya, TBMM Anayasa Komisyonu Başkanlığı'nı"
"s","S-AEABTZ-0041-204","doğru terimse saldırdılar. Çok kaba","olduğunu,","bir Amerikalıya hakaret ettiğimi, onu"
"s","S-BEABXO-0147-2383","doğru pardon, burayı on iki","olarak","düşündünüz burayı da on iki"
"s","S-ADABAo-0368-1272","Doğru mudur? Değil midir? Önemli","olan","onu ona anlatabilmek. Bir insanı"
"w","W-UD22C1A-0510-2344","doğru eğitemeyen, despot, sıkıcı, yapıcı","olmayan,","hep potansiyel suçlu gözüyle değerlendiren"
"s","S-ADABPZ-0119-1060","doğru buldu. Ee bu nasıl","oldu?","Şimdi tek çıkar yolu olarak"
"w","W-QH42C3A-3331-2066","doğan ve ağzından şahadet kelimesi","olarak","çıkan anafor, gene hanımın ruhuna"
"w","W-IE39C2A-2619-613","doğan genç bir kadına isim","olduğunda","tam aksi bir anlam kazanıyor."
"w","W-EC06A2A-1972-716","doğada ve eski yapılarda benzeri","olmayan","yeni taşıyıcı sistemlerin yapılarda kullanılmasını"
"w","W-EI36C4A-0468-1340","dostunu Semra Özal'ın bir modeli","olarak","gördüğünde nasıl irkildiğini, biraz da"
"w","W-JA16B4A-0347-72","dostuna. Güley konuştuğu başlıca konu","olup","çıkmıştı. Oysa Güley, Sevinç'in yaşı,"
"s","S-ADBBI^-0326-879","dostuna ""Ben sizle görüşmüyorum"" demiş","olması,","bu sözün ağzından çıkması mühim."
"s","S-ADBBI^-0326-1627","dostluğunun hala devam etmesinden mutlu","olduğum","bir arkadaş kazandım. Bunun için,"
"w","W-UH03A1B-2409-974","donatılan dizgelerin insanlardan daha hassas","olması,","bazı tehlikeli durumlarda akıllı bulanık"
"w","W-HA16B2A-1440-211","dolu, gürültülü, dar, hem de","oldukça","pis sokakta bir köşeye büzülür,"
"w","W-UI37C1A-0912-2298","Dolu tanelerinin büyüklüğü o zaman","olduğu","gibi şimdi de zihnime eski"
"w","W-RI42E1B-2940-556","dolu bir halde durulmayı beklemiş","olanlar,","Seni seviyorlar. Bu da nedir?"
"w","W-II22C2A-0745-604","Dolaşırken nasıl olsa karşısına çıkacak","olan","bilgilerin arasından frekansına uygun olanları"
"s","S-ACABTZ-0336-1249","dolayısıyla çevreye son derece duyarlı","olan","bir ülke. Emm teknolojik aşamalarda"
"s","S-ADABPZ-0134-1014","Dolayısıyla mantığın efendim emm kurucusu","olmasa","da mantığı disiplin haline getiren"
"s","S-ACAAPZ-0384-1051","dolarlık bir yatırım gücüne sahip","olması","lazım. O nedenle dış desteğe"
"s","S-ACAAQq-0424-2286","dolar civarında vergi kaybına neden","olduğu","tahmin edilmektedir. Özellikle ülkemizde son"
"s","S-ACAAQq-0424-332","dolar civarında ve petrol arzı","olarak","da rakama bakarsak, 34 400"
"s","S-BEABXB-0410-936","dokuzlu olabilir. Otuz otuz otuz","oluyo","dört cigabayt. Kamuluysa o da"
"s","S-ACABPA-0434-1062","dokunulmazlığın soruşturmaya, kovuşturmaya, yargılamaya engel","olmayacak","şekilde düzenlenmesi gerekir. 1995'te Fransa'da"
"s","S-ACAAPZ-0032-483","Doktor Süha Aydın İngilizce bilmekte","olup","evli ve 1 çocuk babasıdır."
"s","S-ADABPZ-0372-1181","diğillermiş diğilmiş. Emm... çok başarılı","olucaklarını","biliyorum. İnşallah onların içinde araştırmaya,"
"s","S-BEABXu-0442-1230","diğerleri de zengindi ama fakir","olmuşlar.","Tamam tamam hatırladım filmi. İşte"
"w","W-PD36E1B-2858-1720","diğeri de bizzat bir yaratma","olarak","""değişimin"" kendisidir. Bu telakki kendi"
"s","S-ADABPZ-0134-1121","diğer kişilerden ayıran özelliklerinin bilincinde","olmasıyla","karakterize olur ve bu bakımdan"
"s","S-ADABCo-0365-862","diğer branşlarda da söz konusu","olabilir.","Ama bugün henüz daha bu"
"s","S-BEABXX-0411-2133","dizi çekti, adını Feriha koydu","oldu","benim adım Feriha. <gülme> Hıı."
"s","S-BEABXO-0006-2189","diz altı giyin bura böyle","olacak.","Açık olacak gerdan. Ya bazi"
"w","W-RA16B2A-1050-2379","diyorum Tibet'e. ""Hiçbir zaman tam","olarak","hazır olamazsın derler,"" diyor Tibet."
"s","S-BEABIs-0015-978","diyorum ki benim oğlum şöyle","olacak","böyle olacak değil. Değil. Yok"
"w","W-OA16B3A-0409-17","diyorlar, çok ayıp! İlk oyun","olarak,","Molyer, Hastalık Hastası'nı oynayacağız onun..."
"w","W-JA16B4A-1747-1983","diyordu. Bir iki haftadır da","olsa,","parayı nereden buluyordu? Gerçekten yatıyor"
"w","W-RD37C2A-0811-732","diyor. Onlar da ""Bakalım ne","olacak?!""","diye ""içebilirsin."" diyorlar. Besmele çekip"
"w","W-RI09C2A-0023-1561","diyor. Karanlık bir işin içinde","olduğumu","algılıyorum. Merdiven sahanlığına bakan bir"
"s","S-ADAASK-0036-1221","diyor ki bırak o senin","olsun.","Ben Allah'ın yolundan gideceğim. Vakıf"
"s","S-ADABPZ-0119-151","diyor ki <B> kitap ne","olursa","olsun <B>. Ee şimdi ne"
"s","S-ACABPA-0434-1749","diyor de Vrais, ""siyasetin kendisi","oluyor.""","Ondan otoritesini alan ve onun"
"s","S-BEABXO-0393-356","diyor <D 2> paranız sizin","olsun.","<D 2> Orda diyorkine yani"
"s","S-BEABXO-0339-1653","diyom kırmızı kırmızı oldu. İsilik","oldu","çok sıcak ya. Allah Allah."
"s","S-BEABXp-0156-588","diyo. Arkasından da onların ne","olduğunu","sana göstermeye çalışıyo evet, o"
"s","S-BEABXO-0440-170","diyo. Aferin sana. Ya Onur","olsaydı.","Onur'la bu maçı bi yorumlasaydık"
"w","W-CH03A1A-1515-1376","diyerek bu vasiyetin yazılmasına mani","olmuştur.","Hz. Muhammedin (ss) ahirete irtihallerinden"
"w","W-RH42E1B-2918-343","diyenlerin bu tür bir mazeretleri","olabilir","mi?.. Evet, siz bildiklerinizle amel"
"w","W-LA16B3A-0439-530","diyelim. Şimdi böyle yönetim mi","olur?","Bölge sorumlusu mu olur? Bunun"
"s","S-ADABDp-0187-1033","diyecek. Bu da ""afiyet şeker","olsun""","diyecek. Hadi kapatın da Şehriban"
"s","S-ADABPZ-0135-1274","diyebilir ki ben çok açık","olduğumu","düşünerek konuşurum. Yani açıklığın emm"
"s","S-BEABXO-0122-1420","diye... Ondan sonra ertesi gün","oldu.","Artık şeye de mi çıksınlar,"
"w","W-PF10E1B-2867-2099","diye... Bomba patlayınca, yemek ""hayırlı","olsun""a","olsun""a döndü. Şimdi burada hemen"
"w","W-TC29D1B-2793-412","diye. Hâlâ bile bayılan çok","olduğuna","göre bu lakırdıya, dikkat etmek"
"s","S-AEABUZ-0021-345","diye zaten beden dilini katmış","oluyor.","Siz birine evlenme teklif etseniz"
"s","S-AEABAo-0016-1703","diye kelimeyle söyleyip sonra şöle","oldu","böle oldu yok. Aşık adamın"
"w","W-MA16B4A-0772-1158","diye güldü sadece. ""Konuşmuyor kurban","olduğum","konuşmuyor. Konuştuğu tek şey, Arpacı"
"s","S-ADABAo-0311-1567","Diye düşünüyoruz. Yani temeli sağlam","olsun.","Tabi tabi kesinlikle sağlam olsun."
"w","W-KD30D1B-2184-850","diye değerlendiren Kutan, üstü kapalı","olarak","DYP liderini uyararak ""Ortada bir"
"s","S-ADABAo-0382-1800","diye bi emm kaygım tabiki","oluyor","ve bunun içinde her daim"
"s","S-AEABTZ-0040-630","diye bana cevap verdiler resmi","olarak.","İkincisi TAİK'in yetersizliği ıı konusunda"
"s","S-BEABXO-0436-242","dirlerdi ki pırının gızı bişi","olunca","artık herkes pırının gızı oldu"
"w","W-TI31D1B-2333-2362","direktör Feldkamp'ın bu mücadelede sakat","olan","Hakan Şükür ve Ümit Karan'ın"
"s","S-BEABXO-0168-2442","dio, orda kaç tane müdür","oldu","senin haberin var mı? Dedim"
"s","S-ADABPZ-0116-710","dinleye biliriz ama kredi sorunumuz","olduğu","zaman bunun emm bu noktaya"
"s","S-BEABXO-0074-1509","dinlediği yok. Söyleyince biz kötü","oluyoruz.","Biz bi şey biliyoruz da"
"w","W-MD05A0A-0280-1856","dini gruplardan, isterse yerli halktan","olsun,","tüm insanlar arasında dostluk ruhuyla,"
"w","W-TD03A3A-0523-2110","dinde özel bir bilgi kaynağı","olarak","kabul edilmediği zaman, dinin teolojik"
"w","W-SD02A1B-4591-1383","diller arasında bir iletişim aracı","olmaktan","çok, bir kültürü besleyen, ona"
"w","W-EG03C2A-1729-11","dilin sınırları içinde ve dil","olarak","değil. Şair, yontucunun mermeri aşması"
"w","W-QB04A2A-1576-1866","dile tercüme ederseniz translasyon yapmış","olursunuz.","Ökaryotik bir hücrede DNA replikasyonu"
"w","W-PE39C3A-1330-1767","dikkatini çeken birtakım tuhaf gelişmeler","olmaktadır.""","Nedir bu tuhaflıklar, derken Çukurova'ya"
"w","W-II22C3A-0566-1299","dikkat! Her dönem iktidara yakın","olduğunu","söyleyip, her işi hallettiklerini iddia"
"s","S-ADABPZ-0135-2399","dikkat etmenin sorumluluğumuz alanının içinde","olduğunu","düşünüyorum. Her post modernler hak"
"s","S-ADABI\-0438-946","dikkat etmedim zaten olsa da","olmasa","da pınar kullanıyorum değiştirmeyeceğim bir"
"s","S-BEABXB-0410-1290","diceğini beklemiyorum yok hayır yaa","olmaz","felan demesi lazım. Sonra dedi"
"s","S-BEABXO-0056-1376","dicek. Olmaz yengem doğurursa anca","olur.","Onu da alırız karıyı buraya"
"w","W-DA16B4A-0384-291","dibe kendimizi temize çıkarmaya çalışıyoruz.","Olup","bitenlere başka nasıl dayanırız? Eksik"
"s","S-ADAB^Z-0370-1363","di mi. Ama biz öğrenciler","olarak","artık kendi ayaklarımızın üzerinde üniversiteye"
"s","S-ADABCo-0315-895","değiştirmiş değilim. Ama çok ciddi","olarak","bir siyasi bir başbakanımız veya"
"s","S-BEABXz-0387-512","değiştiriliyor onlarda ama seninki nasıl","oluyor","bilmem benimki değiştiriliyor seninde vardır"
"w","W-KI37C3A-0997-479","değiştirebilirsiniz. Eğlenme olasılığını ve katil","olma","riskini aynı kadehlere, aynı tavernaya,"
"w","W-LE39C3A-0067-1316","değişmez unsurudur. İlle MİT görevlisi","olması","gerekmez. O, kalitede (burada ""kalite"""
"s","S-ACABFZ-0049-1779","değişmemiştir. Tekelleşme, artık görülmemesi imkansız","olan","boyutlara ulaşmıştır. Buna rağmen halen"
"s","S-ADABPZ-0135-2017","değişmektedir. Evet biraz önce <B>","olursak","şimdi çiftçi çocuğunun üniversite hoca"
"s","S-ADABCo-0242-155","değişiminin organizasyon iptaline bile neden","olabiliceğine","dikkat çeken Fransız sekreter ayrıca"
"s","S-BEABXO-0007-1511","değişiklik oldu. Dedim bir şey","olmadı","sonra bi daha döktü dedi"
"w","W-RI42E1B-2940-1924","değişik maddeleri yiyebilir. İştahsızlığa bağlı","olarak","büyüme geri kalabilir. Teşhis (Tanı)"
"w","W-RI09C2A-0023-1512","değişik aksilikler yüzünden bir türlü","olmuyor","bu plan. Kaportayı açıp içine"
"s","S-ADABLA-0266-647","değişen yapılaşma... Onbeş-onaltıncı yüzyıllarda yazılı","olanla","bağlantının, matbaanın bulunuşundan sonra gittikçe"
"w","W-TG03A1B-3280-1167","değiliz"", ""Hiçbirimiz kendimiz olamayız"" görüşünde","olan","yazar anlatıcı, bunun için hep"
"s","S-BEABXO-0358-1091","değilim. Valla canım zaten Eylül","olsun","burdan tüyeceğiz ya. İnşallah. Adam"
"w","W-SI22E1B-2912-2277","değildir."" İnsan hangi mesleğe sahip","olursa","olsun sahip olduğu mesleğin hakkını"
"w","W-VG03A3A-2717-1102","değil; bunun ötesinde bir işlevi","olacak.","Çünkü yaşanan bu dönüşüm kentlerin"
"s","S-ADABAo-0433-809","değil. Çünkü gençlik seçiyor. Seçici","olan","biziz biz seçiyoruz. Buna özentilik"
"s","S-BEABXW-0069-593","değil. Ortamlarımız farklıydı şimdi. Öyle","olunca","hani hiç fazla görüşemedik. O"
"s","S-AEABUZ-0021-1702","değil. Kendisinin daha çok çıkarı","olduğunu","düşünen. Geçelim. Bayanlarda da çok"
"w","W-QI43C2A-1809-27","değil. Evet, tepki gösterenler de","oldu.","Ama açık konuşayım, beklediğimden çok"
"s","S-ACAAFZ-0048-544","değil. Ben dünyada yeni yöntem","olarak","askeri gücümü kullanacağım. Askeri güç"
"s","S-ACABTZ-0336-340","değil. Ama onu işte sunuşları","olacak.","Dün de olmuştur belki. Kesinlikle"
"w","W-OF10A2A-1787-2190","değil, yurt dışında da başarılı","olmakta,","övgüler almaktadır. Örneğin, 1992 yılından"
"w","W-LD02A2A-1477-1718","değil, doğrudan Başbakan'a karşı sorumlu","olması","ve Md. 3'deki Milli Güvenlik"
"s","S-ADABAo-0366-2143","değil diye? Böylece hümanizmle başlatmış","oluyoruz","bir bakıma aydınlanmayı. Bir müzik"
"s","S-BEABXO-0415-686","değil de diğer ufak ufak","olanlar?","Neyi? Mantı yani yüzük çorbası"
"s","S-ACABQq-0421-2060","değerlerimize sığınabiliriz. Biz, Türkiye Cumhuriyeti","olarak,","bölgemizde, Irak'ta, Türklerin de, Arapların"
"s","S-ADABPZ-0357-1855","değerlendirme olmadan bilim olmaz, olsa","olsa","felsefe ve edebiyat olur"" dediler,"
"w","W-RF10E1B-3066-2028","değerinde bir verimlilik artışına sebep","olması","bekleniyor. Avrupa'da yapılan işlemlerin halen"
"w","W-VF05A1B-4642-691","değer ve davranışlarını değiştirmeleri yeterli","olmayacaktır","çünkü tüketim alışkanlıklarının değişmesi zor"
"w","W-VI45F1D-4061-203","deyip kaldırıyor bizi. Bir Karadenizli","olarak,","Lazların eline kimse su dökemez,"
"w","W-OG37C0A-0191-2337","devrin kıyafetleri içinde stilize edilmiş","olarak","düşündüm. Ama hayallerimiz uzun sürmedi."
"s","S-ADABPZ-0372-1968","Devrimlerinin temeli olan laik vatandaşlar","olmaktır.","Ülkemizin ne kadar zor şartlarda"
"w","W-QD02A1B-4560-1505","Devrimi, iktisatta yaşanılan gelişmelere bağlı","olarak","iktisadi ve toplumsal yapıda dönüşümlere"
"w","W-QA16B4A-0015-2367","devrimcileri çevirmişti... Emniyet tedbirleri sıkı","olduğundan","silah vermemişler ancak takibi yapılması"
"w","W-CE39E1B-2888-649","devrimci krize dönüşmesinin bir biçimi","olarak","tüm sektörleri, dalları kapsayan ancak"
"w","W-PE18E1C-4162-483","devredilecektir. 3. Toprak ayarlaması yapılacak","olan","bölgelerde halen yerleşmiş bulunanların hak"
"s","S-ACABQq-0426-327","Devletleri, Müşerref ve onun taşeronu","olan","El Kaide'nin payı büyüktür. Biz,"
"w","W-ME05A1A-2616-156","devletlerdeki uygulamalarının bir kriz içinde","olduğunu","kabul etmektedir. Bunun en önemli"
"w","W-UE30D1B-2112-1629","devletinde Yahudi olmayanlara karşı katliam","olmayacaktır""","diye çattı. İsrail kabinesi ise"
"w","W-RI45F1D-4905-606","devleti ve toplumunun çöküşüne neden","olmuştur.","Yasa ve düzen tamamen ortadan"
"w","W-JE39E1B-2838-710","devamı konusundaki gerçek niyetinin ne","olduğu","tam açıklığa kavuşmasa da hergün"
"w","W-VH13F1D-4850-593","devam ettirmesi, yaşayabilmesi için gerekli","olan","paradır. Para insanı kendine çeken,"
"s","S-ACABQq-0423-1278","devam ettirmek Planın ana gayesi","olduğu","için, bu egemenlik tam olarak"
"w","W-UG03A2A-2009-1541","devam ediyoruz. Yanlış olan, gerçek","olmayan,","diğerleri ile olan ilişkilerimizde yaşadıklarımızdır';"
"w","W-VE39C4A-1180-880","devam eder? Yine kampta kalacak","olanlardan","yüzde kaçı Türkiye'deki faaliyet alanlarına"
"w","W-JE39C4A-1476-689","devam eder. İlgilenenlerin gönülleri rahat","olsun","diye söylüyorum. Nitekim, Güney-Doğuda, süper"
"s","S-ADABAo-0309-148","dev bazı sıkıntılar ilk günlerde","oldu.","Ama bu bütün sektörlerin yani"
"w","W-II09C3A-1943-1812","desteğini alarak öteden beri desteklemekte","olduğu","İngiltere ve Fransa'nın imdadına koştu."
"w","W-KE39C2A-2612-35","desteğin, Kurtuluş Savaşımızda büyük payı","olduğunu","iddia edecektir ama gerçek bu"
"w","W-LD30D1B-2197-1784","destekliyorlar. Muradiye Vakfı Ankara'da ağırlığı","olan","Nakşiler'in önemli bir kolu. Vakfın"
"w","W-UI27D1B-2446-930","destekleyerek kullanmak çok daha doğru","olur","Türkiye izleyicisine ulaşmak açısından. Zamanla"
"s","S-BEABXO-0345-719","desek acaba onlara? <gülerek> Aşama","olabilir","mi? Şunlar ilke. O zaman"
"s","S-ADAASK-0036-2453","dese, hayır diyebilir miydik? Merkep","olarak","yaratılacaksınız. Bizi o mahlukatın arasından"
"s","S-BEABXp-0156-1563","description vermiş olucam yani sonuç","olarak...","Tabi tabi. Öyle düşündüm yani"
"w","W-HA16B2A-0717-258","Derya'yla konuştuğu konular genellikle İslâmi","olurdu.","Derya sorar Emin cevaplamaya çalışırdı."
"s","S-BEABXO-0086-1533","dershaneler bu sene ne kadar","olur","ya? Hiç bi bilgim yok."
"s","S-BEABXw-0391-1515","derse hani diğer bölümlerden arkadaşlarınız","olsun","falan gibilerinden diye konuşmuştu bizim"
"s","S-BEABXO-0344-1718","ders planı sizin bilgisayarda yazılı","olarak","var mı yazıcak mıyız? Soner"
"w","W-QI22E1C-2910-1958","derman, Bol bol yük taşıyarak,","olacağız","perişan!' Bir süre sonra merkep,"
"w","W-SI22C3A-0813-1676","deriniz. Bu mektup; Yakup Bey'e","olduğu","kadar onlara yol açmış olan"
"w","W-PA16B0A-0297-558","derin bir teorik donanıma sahip","olmadıkları","bir gerçektir. Örneğin Gandi'nin dört"
"s","S-BEABXO-0007-418","derileri pişirmeden atın bari şeyde","olsun.","Et derinin altında beyaz kalyor."
"w","W-RF05A1B-4664-2428","derecede mesleki alan bilgisine sahip","olmalıdır.","Personelin sahip olduğu bu bilgiyi"
"w","W-PI42E1B-2938-657","derece bereketli ve insanda meknuz","olan","ulvi güzellikleri yeşertici bir husûsiyet"
"s","S-AAABOp-0011-321","der. Emm. Doktorlar emm erkek","olur.","Kızı da hemşire olur. <D"
"w","W-NA16B3A-1752-2454","depremleri ne kadar güçsüz olursa","olsun","duyuyorum. SERİN KÖŞELER PEŞİNDE Olağanüstü"
"w","W-TE36E1B-3354-756","depremler arasında nasıl bir ilişki","olduğunu","ise şöyle açıklıyor ""Yer kabuğunda"
"w","W-RE09C2A-1384-126","depo sorumlusu sivilin hırsızlıktan sabıkalı","olduğu","ve arandığı ortaya çıktı. Aynı"
"s","S-AEABAo-0016-1369","denmez hani de en tipik","olanları","en belirgin olanlarını eleyerek yazdım."
"s","S-BEABXO-0147-1315","denk olan mesela bunun katı","olan","kesirlerdir, iki katı iki katı,"
"w","W-FE05A1B-3481-1900","denizcilik, çelik, sentetik, lif, kağıt,","olarak","sıralanmaktadır. Sözkonusu ürünler Toplulukdışı Akdeniz"
"w","W-JE05A3A-0648-1992","denizaşırı genişlemesi ve kendini medeni","olarak","tanımlaması sonucu, coğrafya ile tanımlanmaz."
"w","W-JC06A3A-1958-554","denilir ki, bu yolun üzerinde","olacak","herhangi bir gecikme bütün projenin"
"w","W-SI22E1B-2912-1560","dengesizliklerle doludur. Davranışlarından onun akıllı","olmadığını","anlarız. Yine bir insanın davranışlarını"
"w","W-LF25D1B-2140-1589","dengesi açısından yüzde 4-5 fazla","olması","gerekir. Bunu yapmazsanız enflasyon düşmez"
"w","W-JB04A3A-1994-1238","dengenin bozulması olaylarının temelinde neden","olarak","insan unsurunun yattığı değişik örneklerle"
"w","W-TA16B4A-0090-2297","deneyimlerim hüsranla bitince fazla yetenekli","olmadığımı","da anladım. Artık hayatımı sürdürebileceğim"
"w","W-HG03A4A-3317-2146","denen varlığın alışkanlıklarını, göreneklerini binektaşı","olarak","almış bir yasa koyma kurulu"
"w","W-JD36C2A-0114-1255","denecekse, genel tablo bunun böyle","olmasını","gerektiriyordu."" Zamanlama iyiydi, tam vaktiydi,"
"w","W-TB04A1B-4334-1006","den itibaren sistemin sıvı fazda","olduğu","gözlendi. Qi ve arkadaşları (Qi"
"w","W-ID02A3A-1302-1645","demokrasisini değiştirecek en önemli gelişme","olarak","değerlendirdiler. OECD Kamu Yönetim Komitesi"
"w","W-ME05A3A-0764-364","demiyorum. Fakat ben bir sonuç","olarak","bunu düşünürken Heraklit'in eski bir"
"s","S-ADABPZ-0135-1437","demin dediğim gibi. Yani önemli","olan","bütün sorunları çözecek olan özneler"
"s","S-ADABIi-0124-449","demeyim ileriyi gören bir sanatçı","olması","gerekiyor. Evet. Üstünden burnunun ucuyla"
"s","S-ACABPA-0434-464","demektir. Yönetimin, ülkenin ayağının bağı","olduğu","kanaati yaygın ve herhalde de"
"s","S-ADABPZ-0135-159","demek. Ee! olumlu bir şey","olarak","görünüyor ama ee! bunun bazı"
"s","S-ADABAo-0355-983","demek, <B> şey olan, atı","olan","demek. Doğrudan doğruya yani o"
"s","S-BEABXg-0090-1379","demek yeni başlamışlar öyle bişey","olur","mu dedi. Ya gitmiyolar oraya"
"s","S-BEABXw-0353-1802","demek ya hadi bana bişey","oldu","hani. Amaan bi kere girmemeliymiş"
"s","S-BEABXO-0006-1608","demedim. <B> yine tanıdıkta... Ayıp","olur","tabi canım ben geldim erkenden"
"s","S-ADBBAo-0443-521","demedi. Babamı o şartlarda göndermiş","olmamın","ezikliği var. Eminim şimdi beni"
"s","S-BEABXu-0435-1215","dedorantı falan satılmıyo ki. Ne","olacak","ki başka şeydeki gibi değil"
"s","S-BEABXL-0123-1301","dediğim gibi bi misafir öğrenci","olarak","müraacat ettiğinde onları bir, bir"
"w","W-ED37C3A-0551-2300","dedirtecek denli büyük bir mimar","olan,","görkemli Osmanlı mimarlığının başyapıtlarından, İstanbul'daki"
"s","S-BEABXn-0349-392","dedim hiç şapmasınlar dedim. Bahar'la","olan","olayımızı da anlattım hocaya. Yok"
"s","S-ADABII-0439-1325","dediler bende kabul etmedim. Yani","olmaz","dedim ama illa ki artırma"
"s","S-ADABII-0439-642","dediler ama bunlar aşama aşama","olmalı","yani sürekli hale getirilebilinir yani"
"s","S-ADABCo-0281-1817","dedik ama bi tek evladımız","olsun","didik. Bene yaşakcam dimedi. Sadece"
"w","W-EA16B2A-0448-804","dedi. Şöyle bir doğrulur gibi","oldu","çoban. Berber Ahmet itti göğsünden."
"s","S-ADBBI^-0326-2120","dedi. Yani, bunları kendin bulursan","olur","kardeşim. Bulamazsan olmaz. İşte Armağan"
"s","S-ADBBAo-0443-1716","dedi. Ben de mümkün değil","olamaz","dedim. Nasıl olur benim eşyalarım"
"s","S-BEABXE-0082-2190","dedi. Anası da cilt kanseri","olmuş.","Halla hala. Tedavisi? Ne bilim"
"w","W-TE36E1B-3355-745","dedi. ""Herkes bu kadar soğukkanlı","olabilir","mi"" diye sorduğumda en zor"
"s","S-AEABTZ-0040-1823","dedi yani ben biz ülke","olarak","Türkiye olsun, diğer ülkeler olsun"
"s","S-BEABXO-0445-2167","dedi ya. <gülerek> Elif yapınca","olmadı","diyo. Dedim...<B> Dedim...<B> İçmezse ben"
"s","S-BEABXB-0073-1836","dedi o zaman dedi uygun","olursak","anlaşırsak dedi gelirsiniz dedi. Ben"
"s","S-BEABXO-0007-388","dedi ne hisedyorsun? Ne değişiklik","oldu.","Dedim ayağım dolaşmıyor. Hıı dedi"
"w","W-MA16B3A-0039-89","dedi Füreya, ""inip çıkması zor","oluyor.""","""Ben de seninle yatarım."" ""Divan"
"s","S-BEABXO-0064-575","de. Yav olmadım mı da","olmuyor","gardaş. İnsan kötü hissediyor kendini."
"s","S-ACABUZ-0035-2353","de. Bu Tevfik Fikret'e düşman","olan","kesim anti emperyalist bir grup"
"w","W-TA16B2A-0325-382","de, bir vakitler de Arap","olduğunu","iddia ettiğinden, bu sözleri önemsemezdim."
"s","S-ADBBAo-0443-2416","de şaşırdım. Ne kadar beraber","oldunuz?","20 gün, bir ay kadar."
"w","W-NI22C4A-0366-854","de şaşkınım, bildiğim bu. Helal","olsun","sana.. Hani ben çok rahatımdır"
"s","S-AEAA@O-0150-2216","de öğretmenleri onlara ev ödevi","olarak","emm hayallerini anlattıkları bi şey"
"w","W-NH37C2A-0073-635","de özdeş olmayan fakat eşleşmiş","olan","kavramlar her birinde meydana getirilmekle"
"s","S-BEABXO-0447-222","de öyle. Ben de öyle","oldum","niye öyle oldumsa. O kadar"
"w","W-UA16B2A-0884-696","de çok seviyordu besbelli; buruşuk","olmasaydı","böyle, bu kadar ince ve"
"w","W-SI22C3A-4728-1098","de çevirebilirsiniz. 3. Yağın kızgın","olmasına","dikkat edin. 4. Hamsiyi tavaya"
"s","S-ADABPZ-0135-2490","de yapmak gerekir. Felsefenin sosyolojik","olarak","hangi ee! sosyal nedenlere dayalı"
