"Register","Text","Left","-5;5","Right"
"s","S-BEABXT-0066-507","diğer günler hepimiz kahvaltı yaparak","çıkıyoruz","ama evde hep beraber yemek"
"w","W-MA16B1A-0459-2257","Dizginlenmez bir hevesle keyfe sahip","çıkmaya","çalışıyor. Oysa misafir üstüne misafir"
"w","W-LE36C4A-0463-358","dize getirmek amacıyla çıkarıyorlar mahkemeye.","Çıkarıldıkları","hakim soruyor Ne yapıyordunuz? Görgümüz"
"s","S-BEABXu-0435-2402","diyo… diyo… Ay! bi kız","çıkmış","valla. Hıı o kızı kıskanıyo"
"s","S-ADAB]o-0193-1240","diyoruz ama böyle daha tedirgin","çıkacağı","maçlar hangileri? Yok <D 2>"
"s","S-BEABXO-0122-830","diyorum. Öyle veriyorlar. Sonradan rapor","çıkarttık","ta. Öyle bir bu eylül"
"w","W-OI37C3A-0483-492","diyorlar. Dört bin gazeteci, işten","çıkartılmış.","Çocuk hâlâ, gazeteci olmak için"
"s","S-BEABXl-0008-63","diyordum ben. Tek başıma trafiğe","çıkma","cesaretim yok diyordum. Anladın mı?"
"s","S-AEABUZ-0022-1919","diyor. Ve bu ıhm tesadüfen","çıktığını","sanıyor Meri Jane'nin karşısına. Tesadüfen"
"s","S-BEABXO-0441-1180","diyor. Tamam hadi içek. Şurdan","çıkarırdı.","Bu ne lan diyordum. Eğleneceyik"
"s","S-ADABCo-0315-838","diyor. Sonra diyor ki, işten","çıktığın","tarihten itibaren 300 gün içinde"
"s","S-ADBBAo-0443-2005","diyor. Bizi o kanalda da","çıkartmıyor.","Mesela bizden Seda Sayan ve"
"w","W-DA16B4A-0088-2209","diyor. ""Bir sergide karşılaştık, birlikte","çıktık.","Kurtulamadım, çok üsteledi, kırmak istemedim"
"s","S-BEABXw-0353-1211","diyor sen de inkarv et","çık","diyor. Ondan sonra da Selim"
"s","S-BEABXE-0082-1723","diyor konuşmasından anladım diyor. Biz","çıktık","yukarı diyor fiş yazıyor eve"
"s","S-BEABXO-0091-1728","diyor donumun içinde diyor. Pantolon","çıkarttı","gene baktı yok. Traktörle mi"
"s","S-BEABXO-0120-1731","diyor başkası iki senelik kiraya","çıkartır.","Yani demir o kadar şey"
"s","S-ADABI]-0126-1993","diyince çok farklı bir şey","çıkıyor","ortaya. Konservatuarı kazanmadan önce önümüzde"
"s","S-BEABXw-0057-788","diyin bi gidin. <B> yumurta","çıkmıyo","canım. Evet biz kaliteliyiz. Yumurtalarımız"
"w","W-FD36C3A-0389-1514","diyerek, bir kez daha haklı","çıkıyorlardı.","Turgut Bey'in iktidarda olduğu sürede,"
"s","S-ACABQq-0421-1169","diyen Barbaros Hayrettin Paşa'yı haklı","çıkaracak","bir deniz potansiyeline sahip olduğumuzu"
"w","W-RD03A4A-0831-2052","diyecekken, ""Sen benim kederimin önüme","çıkardığı","insansın"" der. Tabii, filmin orijinalinde"
"w","W-CG37C4A-3365-2259","diyecek. Gazeteler bu duyarlılık üzerine","çıkacak...","""Gazetenin patronu. 'Ben halkın ithal"
"s","S-ADABAo-0433-1134","diyebilirim bu yaptıklarıyla. Kesinlikle sahip","çıkıyor","bakalım daha sizlerden ahngi mesajlar"
"s","S-BEABXO-0075-2367","diye Sadri Şener'in ta kendisiymiş","çıktı","her şey ortaya. Nankör kaynıyor."
"w","W-PA16B2A-0692-812","diye mırıldandı. Sesi yalvarır gibi","çıkmıştı.","Soner, müdür muavinine baktı. Kenan"
"w","W-RF25D1B-2770-2161","diye konuştu. Tull, AB Zirvesi'nden","çıkan","kararın Türkiye'ye açısından yararına da"
"w","W-SE09C1A-1534-1705","diye gürledi, ""15 tane çapulcu","çıkacak,","hepimizi teslim alacak ve biz"
"s","S-BEABXg-0088-1472","diye ee şe yapıyolar 30'a","çıkartıyolar.","Yani 28-30 arası. Yani onu"
"s","S-ADABPZ-0112-1123","diye düşündüğümüz ama başka hastalık","çıkan","çocuklarda olabilir. Bunları da yani"
"s","S-ADABIi-0124-2298","diye de bir şey ortaya","çıkmıyor.","Aynı emm batının emm kurgusal"
"s","S-ADABIA-0265-1294","diye böyle <gülme>, aynen öyle","çıktı,","ee! ve onun çizimleri var,"
"w","W-JA16B2A-0336-1326","diye bir nakarat tutturarak dışarı","çıktı.","Nihad son anda ona kendi"
"w","W-UI45F1D-4712-1008","Diye bağırdım. Çocuk da baskın","çıktı.","Bu kara kuru çocuklar çok"
"s","S-ADABAo-0033-1205","diye <B> değerli canlar. Dersler","çıkarmalı.","Peki. Teşekkürler. Ben teşekkür ediyorum."
"w","W-GE39C3A-0410-2275","Diyanet İşleri Başkanlığı Yasası'nın yenisi","çıkartılmıyordu.","Her yıl ortalama 234 yeni"
"w","W-NA15B1A-1727-899","divanına İNTİHAR SONRASI bir aşk","çıktı","çantasından bir mask deniz çıktı"
"w","W-JI09C4A-1294-1660","direnmeli. Gün doğmadan neler doğar...","Çıkmadık","candan umut kesilmez... Koskoca şehir"
"w","W-QD05A2A-0767-1336","diredikleri gün gibi ortadadır. ""Yasaları","çıkartsanız","bile biz uygulatmayız!"" mantığı, Türkiye'yi"
"s","S-BEABXO-0093-1137","dinliyorsun wuv diye bir ses","çıkarıyor.","Neydi bunun adı? Kulaklık. Hayır."
"s","S-ADABAo-0433-482","dinliyor. Ajda Pekkan'dan ""Arkanı dön","çık""","çalar mısın demiş, ama Ajda"
"w","W-LE39E1B-2840-569","dinleyeceğimizi, kimin, hangi albümün öne","çıkacağını","ve kimin daha ""star"" olacağını"
"w","W-NE39C0A-0215-1386","dininin mükâfatlandıracağı cennet gerçeğinden yola","çıkarak","yaşamına son vermekteydi. Zira, PKK"
"w","W-UD30D1B-2206-190","dinini, bir din olarak kalmaktan","çıkararak","siyasal amaçlara araç eden, kadınlarımızın"
"s","S-BEABXO-0444-2272","dimi sıkılınca bayılmaya. <gülerek> Dışarıya","çıkcaz","hadi bayılayım da izin alayım."
"w","W-HA16B1A-0728-2030","dimdik, küçük kabartılar öne doğru","çıkartılmıştır.","Mandal torbasını el çantası olarak"
"s","S-BEABXE-0082-840","Dillerini dışarı çık... Dillerini dışarı","çıkardıkları","zaman terlemezmiş. Dillerinden... Terliyor. Şeyi"
"w","W-RG22C4A-0022-2299","dillendirdiğim damarım; romanlarımda kendiliğinden ortaya","çıkabilen,","çıktı mı kendi başına, bana"
"s","S-ADABPZ-0135-577","dille bu post modernizm önümüze","çıkarıldı,","lanse edildi, reklam edildi derseniz"
"s","S-ADAB^o-0132-2350","dilimize çevrilen ve Remzi Kitapevinden","çıkan","Kuşlar adlı eseri ve yine"
"s","S-ADAB^o-0132-1149","dilimize çevirdiği İş Bankası yayınlarından","çıkan","Eşek Arıları, Yargıçlar, Lysisrata adlı"
"w","W-SF10E1B-2870-507","diliminde yüzde 33'ten yüzde 34'e","çıkacak.","Çeşitli BT hizmetlerinden oluşan pazarın"
"w","W-OH36C4A-0237-2250","dil medeniyet ve kültürüne sahip","çıkması","gerekir. Şimdi harekete geçme zamanı"
"w","W-VA14B1A-1632-1866","dikkatli olun... Ali Çavuş sahip","çık...","Bu cepheye sahip çık... Ali"
"w","W-RE39E1B-3035-221","dik olarak bir de yükseklik","çıkarsak","üç boyutu elde etmiş oluruz."
"s","S-BEABXO-0269-75","diil mi o insanlara? Dünyadan","çıktık.","Nerdesiniz? Uzaya gittik. Burası uzay"
"s","S-AAABXN-0004-898","diceksin. Diceksin saat bu oldu","çıkyım","mı diceksin. Yapacağım bişey yok."
"w","W-QC29D1B-2441-1434","değiştiğinin farkına varmayabilirler. Araştırmanın ortaya","çıkarttığı","en önemli nokta, neyin güzel,"
"w","W-KE13C2A-1474-348","değiştirmeyecek ve sanat değerlerine sahip","çıkacağız.","Onlar, insanlık bilinciyle özdeş sanat"
"w","W-DE05A3A-1909-1308","değiştirilmesini istemiştir. Sovyet-lrak ilişkilerinde ortaya","çıkan","bu durum güç dengesi sistemlerinde"
"w","W-MB04A2A-1569-1224","değiştirilmesinde önemli bir değişikliğin ortaya","çıkması","ile gerçekleşir. Kurak olmayan bir"
"s","S-BEABXO-0091-742","değiştirecem ben ya. Yarrağım sende","çıkmıyor","mu da am biti? Yok."
"w","W-LC06A2A-1976-735","değişiminden ötürü önemli gerilmelerin ortaya","çıkabileceği","yapılarda sıcaklık etkisi göz önüne"
"s","S-ACABPA-0434-2312","değişikliği ile ilgili uyum yasaları","çıkarılmadan,","seçim yasaları bir komisyon nezaretine"
"s","S-ACABTZ-0336-2223","değişiklik yapılmasına dair bir kanun","çıkıyor.","Şimdi eğer bir çevre politikası"
"w","W-FG03A1B-3193-49","değindiğim roman veya tiyatroda karşımıza","çıktığı","zaman, oldukça karmaşık, içinde çağrışım"
"w","W-MA16B3A-0331-511","değildir ama o Nilüfer'dir işte.","Çıktığı","çocuklardan hiçbiriyle tanıştırmadı beni. Böyle"
"w","W-RA16B1A-1214-1546","değildi. Önemli olan gerçeklerin ortaya","çıkmasıydı.","Babam bunların aynısını Murat'ın ailesine"
"w","W-SE09C3A-1518-2131","değildi. Yassıada Duruşmalarından idam kararları","çıkınca","İsmet Paşa'ya telefon ettiği anlatılıyor"
"w","W-KA16B2A-0637-678","değildi. Günde iki saat odamdan","çıkmama","izin veriyorlar, ben de bu"
"s","S-AEABTZ-0040-1872","değildi. Bazı birikim sonucunda ortaya","çıkan","şeylerdi. Kuantum Fiziği'nin manipülasyonu oldu."
"s","S-ADABPZ-0135-1992","değil. Bu da <B> yola","çıktığı","için en çok onun üzerinde"
"s","S-ACABQq-0421-1029","değil, dostluk ve barış fikrinin","çıktığı","bir proje"" olarak tanımlamış ve"
"w","W-IE05A4A-1946-468","değil, bilakis bunları, şirketler elden","çıkartmak","istiyorlar. Çünkü artık bunlar kârlı"
"w","W-EA16B2A-1007-508","değil!"" Soluk mavi eşarbını da","çıkartmıştı.","""Yarım saat önce ablam telefon"
"s","S-BEABXX-0411-2063","değil yani. Adam ütü reklamında","çıkıyo","yani Arzum'da ben ütüye mi"
"s","S-ADABLp-0062-121","değil doğru mu bakın bunu","çıkartıyoruz.","Ondan sonra <B> takılması. Peki"
"s","S-ADABII-0439-755","değil de çok farklı şeylerde","çıkmıştır","bence orda ödüllü online yarışalar"
"s","S-BEABXw-0353-1441","değil de zorluk ve sorun","çıkarmıyor.","Tabi ki izinin çoğundan müdürün"
"w","W-PD20C3A-0512-2496","değerleri ve hedefleri ön plana","çıkarmalıydı.","Vatan ve bayrak sevgisi, Atatürk,"
"w","W-SA16B2A-1394-629","değerler ortalığa döküldükçe ucuzluyordu. Dosyadan","çıkacak","olanın da böyle bir şey"
"w","W-QF10A1A-1883-1650","değer-istihdam ilişkisinin bir miktar zayıf","çıktığı","düşünülebilir. Dolayısıyla büyümenin istihdam yaratma"
"w","W-KC06A1B-3757-2481","değer kesinlikle 50 nin üzerine","çıkmamalıdır.","Aksi durumda yumru verimi ve"
"w","W-FE02A1B-3480-1760","dezenfekte edilmişlerdir. Hemen ardından hastalığın","çıktığı","ve Yahudiler'in yoğun olduğu yöreler"
"w","W-HG41C1A-1181-766","deyimin anayurdu Amerika, tabandan tavana","çıkanların","yolculuk hikayeleriyle dolu. Ama kim"
"s","S-ACABFZ-0049-2033","Devriminin sentezinden bir devlet modeli","çıkarmış","olan biridir. Bu müstesna varlık"
"s","S-ACABTZ-0336-770","devriminden sonra birtakım kuşkular ortaya","çıkmıştı.","Emm Almanya bu santralı tam"
"w","W-LE39E1B-2897-64","devrimci dinamiklerin tehdit unsuru olmaktan","çıktığı","dönemlerde bile karşı-devrimci güçlerin belli"
"w","W-LA16B4A-1948-467","devrildiğini ve Sultan Murat'ın tahta","çıktığını","duymuştu. Mithat, Rüştü ve Hüseyin"
"w","W-ME05A4A-2614-1476","devredilir ya da durumdan görev","çıkarılabilir.","Ve cumhurbaşkanından oluşan ve sekreterliğini"
"s","S-ACAAQq-0419-2318","devleti ayakta tutmak için kanunlar","çıkaran,","halkı kaale almayan, milleti devlet"
"w","W-HF10A2A-1850-396","devlet müdahalesiyle çözümlenebilir. Ekonomide ortaya","çıkan","istikrarsızlıklar (fiyat istikrarının bozulması, eksik"
"s","S-ACABQq-0426-1310","Devlet Memurları Kanunu'nda bir madde","çıkarttığımızı","ve böylece yıl sonu itibarıyla"
"s","S-ADABPZ-0118-2435","devlet gökten yağmadı. Alaeddin'in lambasından","çıkmadı.","Bu devlet yani dişimizle tırnağımızla"
"w","W-OG24D1B-3361-913","Devler""in Devler""in hiçbir zaman galip","çıkamayacakları","savaşlarının görsel çekiciliğine kapılmak isterseniz,"
"w","W-KA16B3A-0550-1992","devam etmekteydim ""Enginar Bey'den çıksa","çıksa","Bergama sütunu çıkar. Bu arada,"
"s","S-ACABTZ-0336-2175","devam etmektedir. Şimdi emm reaktörlerden","çıkan","çubukların bu biraz sonra göstereceğim"
"w","W-OA16B4A-0167-621","devam etmektedir. Dosyaların birer örneğinin","çıkarılarak","istihbarat birimlerine verilmesi çözülmesi yolunda"
"s","S-ADAACo-0297-46","devam ediyoruz. Bir ilköğretim okulunda","çıkan","kavgada 15 yaşındaki öğrenci 13"
"s","S-AEABPZ-0331-344","devam ediyor. bazı teknik aksaklıklar","çıktı,","mayıs ayı itibarıyla 81 ilin"
"w","W-LE41C2A-1360-85","devam edelim. Seksenlerin başında ortaya","çıkan","ve etkisini hâlâ sürdüren yani"
"s","S-ADAB^o-0132-1157","devam edecek öğrenciler çevirmen olarak","çıkacaklar","ordan. Onlar için düşünülen program"
"s","S-ADBBAo-0443-2267","desteğe ihtiyacı olan birine sahip","çıkıp","yükselmesini sağlamak. Bu artık yükselmiş"
"s","S-BEABXO-0147-2195","dersiniz? <D 12> A'dan Be'yi","çıkartıcaz","ne olabilir? Be cinsinden onu"
"w","W-RA16B4A-0104-1856","dersin? Tamam... Bu akşam işten","çıkınca","gelirim. Haydi eyvallah."" Cemal Fehmi,"
"s","S-BEABXO-0444-2344","derler. Zaten geçen gün düğünden","çıktık","dövücektim. Bi sarışın hatun. Sarışın"
"w","W-UG03A2A-2009-93","derler ama ben yine ortaya","çıkarmam.","Karma sergiye katılırım. Aldığım tepkiden"
"s","S-ADBBAo-0443-1681","derken, o arada hamile olarak","çıkılıyordu.","Ben bir çıkıyordum, kim seni"
"w","W-JA16B4A-1093-1538","derinliklerinden birer Tahir ahı olup","çıkıyorlar.","Ah Tahir ah... ""Nene len"
"w","W-RA16B2A-3329-793","derinlerinde ""Yelda'nın bir adamla koşuya","çıkacağı""","gerçeği bulunduğundan olsa gerek kendini"
"w","W-SC06A1B-4030-630","dereceleri ortalaması 3,36 olarak ortaya","çıkmıştır.","Aynı zamanda sistem analisti-kullanıcı görüşmelerinde"
"w","W-TE36E1B-3354-1271","derdimizi anlatmaya çalıştık. Kısmet yarışmaların","çıkmasınaymış.""","Yarışmalardan sonra hayatı tabii ki"
"w","W-QI42E1B-2939-473","Deprem mi oldu? Yangın mı","çıktı?","Niye bağırıyorsun?"" ""Bu ne diyorum"
"w","W-PD05A3A-1094-2356","denkleştirilebileceği görüşü terk edilmiştir. Ortaya","çıkan","alternatifler ya kamuoyuna duyarlı olmayan"
"w","W-SA16B1A-1351-797","denkleştirdiğinde ev fiyatları beş misline","çıkmıştı.","Birkaç yıl daha dişlerini sıktılar,"
"w","W-LE41C2A-1360-1901","Deniz Müzesi'nin topları! Yunanistan'la ortaya","çıkan","hemen her sürtüşmede kahvelerde yapılan"
"w","W-RI31@1B-2418-1730","denilmesine rağmen iğne olarak maça","çıktı.","Federasyon başkan vekili Şekip Mosturoğlu"
"w","W-OC06A1B-3939-302","dengesindeki oluşumun göstereceği farkları ortaya","çıkarmıştır.","Malzeme çapının artması ile birlikte"
"w","W-HF10A2A-1876-2325","dengesi cari işlemler hesabında ortaya","çıkacak","olan açığın giderilebilmesi için reel"
"w","W-VI45F1D-4698-1812","deneyin. İsterseniz süreyi 20 dakikaya","çıkaralım.","Yahut 2 saate. Kaç yazarın"
"w","W-PE39C4A-0243-2219","dendi, sonradan bu sayı 350'ye","çıkarıldı.","Bir dönem mülkiye ve hukuk"
"s","S-AEABTZ-0040-2478","demokratik kitle örgütleri, halkımız karşı","çıkmalı.","Direnmeliyiz. Şimdi karşı çıkmak derken"
"s","S-ADABCo-0220-644","demokratik açılım sürecinin başlatılmasına karşı","çıkıyor","ve engellemek için her türlü"
"s","S-ADBBI^-0042-1958","demişlerdi. Son hastalık nasıl ortaya","çıktı?","Karıkoca doktor olan, çok sevdiğim"
"s","S-ADBBI^-0042-1063","demişler. Üç buçuk saatte doktor","çıkıp","da, ""Bitti"" deyince ferahlamış. Allah'tan"
"s","S-ADABII-0439-1597","demişler ama Cuma dan mı","çıkacağım","ne zaman olacak hiçbir fikrim"
"s","S-ADABAo-0355-1286","demiş. O heralde… heralde… Nerden","çıkardınız","bilmiyorum ama zor bi soru."
"s","S-ADBBI^-0326-317","demiş olması, bu sözün ağzından","çıkması","mühim. Aramazsın, sormazsın, gelmezsin, gitmezsin;"
"s","S-ADABAo-0309-1349","demek. Emm 170 megabitte kadar","çıkıyor","bu hızlar yani bir dakikanın"
"w","W-DI37C1A-3009-704","demek, mert demek, haksızlığa karşı","çıkan","demektir ki. Ciriti tarihte olduğu"
"s","S-BEABXO-0089-1625","Demek öyle ha Kayra yukarı","çıkınca","değişiyor. Hareketler de değişmiş. Dün"
"s","S-ACAAFZ-0048-143","demedi. Bir kaç tane adam","çıktı,","bağırdı çağırdı, onları da Birleşmiş"
"s","S-BEABXO-0068-1547","dek gidiveruda. İnşallah. Hı-hıı. <B>","Çıkıveru","belki bu sene çıkmaz gelecek"
"w","W-GE39C4A-0195-1689","defa yazsın, bir defadan ne","çıkacak","ki. Nitekim çok... Basın hala,"
"s","S-BEABXs-0130-709","defa hani atmışbeş kiloya kadar","çıkmıştım.","Bu da demek ki domuz"
"s","S-ADABII-0439-1782","dediğimde mesela yedi göller başlangıcı","çıkmalı","yani mesela yedi göller e"
"s","S-BEABXL-0123-1182","dediğim gibi yani yurdun çıkıp","çıkmaması","önemli değil, dediğim gibi bi"
"s","S-ADBBAo-0443-1923","dediği insanlarda, hep bir şeyler","çıkmıştır.","Demek ön sezileriniz güçlü! Evet"
"s","S-BEABXs-0130-1944","dedim. İşte onbeş yirmi kişi","çıktı","dedi bende girmim işte nasıl"
"s","S-BEABXw-0353-651","dedim. Ay dedi Sinan da","çıktı","mı dedi? Ne o ney"
"s","S-BEABXO-0007-1496","dedim. Ay dedi biz evden","çıkyoruz","dedi akşam yemeği şey var"
"s","S-BEABXw-0353-455","dedim Elmas Sinan'ın yüzüne mi","çıktı?","E dedi yediği dayaklar dedi"
"s","S-BEABXn-0349-368","dedik biz de. Böyle sert","çıktık","biraz. Böyle dengesiz bi kız"
"w","W-RA16B2A-1246-273","dedi. Muzaffer de selamını verdi,","çıktı","gitti. Ama kafası karışıktı, bu"
"s","S-BEABXO-0447-1161","dedi. Hani öyle içinde az","çıkarttı.","Bu dedi kalmamış hali düşün"
"w","W-GE09C4A-0248-1131","dedi, 'iş profesörün dediği gibi","çıkarsa,","adam ölür'."" Hasan Rıza Soyak"
"s","S-BEABXs-0130-1821","Dedi otur sen dedi yarın","çıkarsın.","Sonra bir baktım komutan arkayı"
"s","S-BEABXs-0130-2339","dedi olmaz dedi sonra ben","çıktıktan","sonra işte kızçıkıcak işte bu"
"s","S-BEABXO-0006-428","dedi ben kızmamda sen zaten","çıkman","öyle. Adam bilyor malını. Bir"
"s","S-BEABXn-0349-2406","dedi ben dedi eğer birisiyle","çıkmak","istersem falan dedi onla ciddi"
"s","S-BEABXg-0070-346","dedi bana. 7 Temmuzda sınavdan","çıktıktan","sonra beni bi ara dedi."
"w","W-SE36E1B-3352-1644","Dede, dört gecelik bir Babylon","çıkarmasıyla","huzurlarımızda. Kendileri 1 mart gecesi,"
"w","W-JA16B2A-0759-1500","DECCAL Sevgilim her zaman karşı","çıkıyordu.","Oysa ben o ahşap, hoş"
"w","W-NG37C4A-0002-2199","de. Böylece, bir romandan yola","çıkan","bir film, yorumun yorumudur; Eco'nun,"
"w","W-FE09C3A-0417-1183","de, o tehditkârlığından ötürü öne","çıkartıldı","ve burada yalıtılmaya çalışıldı. Ama"
"w","W-EA16B1A-0856-1214","de, haksız olduğu halde haklı","çıkma","çabasında olan var... ""Ben senin"
"w","W-SI09C2A-0405-1126","de, bari yanımdakilerle bir ""yolculuğa""","çıkayım","dedim. Yanımda oturan bey Amerikalı,"
"w","W-UI09C4A-1027-271","de"" dedim yeniden. Canım zeytinim","çıktı","avluya ""Kuşlaaayy günaydııınn"" dedi onlara."
"w","W-OI22E1B-2908-567","de şehzadeleri yetişmeleri için sancağa","çıkartmaları","idi. Fatih Sultan Mehmet'in oğlu"
"s","S-BEABXE-0082-424","de üçlen mi çıkacam? Üçlen","çıkacan","tabii. Nadar küçük viteslen gidersen"
"s","S-BEABXg-0088-1230","de ücretli öğretmenlik ücretli öğretmenlik","çıkarıyorlar","ücretli öğretmenlik diye bi saçmalık"
"s","S-ADAASK-0036-812","de öyledir. Ama birisi de","çıkıyor","ki, ben mazlumun yanındayım, ne"
"w","W-KE39C3A-0586-116","de öyle. Türkiye'de yeni liderler","çıkması","gerekli. Siz bu konuda bir"
"s","S-BEABXO-0347-2091","de çıkarmış şeyini bak. Surdan","çıkarmışsın,","izi kalmış. Bilmiyorum valla, benden"
"s","S-ADBBI^-0326-160","de çok güzel bir program","çıkmıştı.","Ama bu demek değil ki,"
"s","S-BEABXw-0391-1456","de çok absürd bi şey","çıkacak.","Ee? Söylediğiniz mi peki hani"
"w","W-UI45F1D-4719-352","de yoktu. Bütün o çalkantıların","çıktığı","19 Şubat haftası sona ermeden,"
"w","W-PA16B4A-1247-1733","de yerimizden fırladık. Tam bahçeden","çıkmak","üzereyken, önünü kestik. ""İyi günler,"
"w","W-ND30D1B-2210-1918","de yaparak bu zor dönemden","çıkmak","zorundayız"" şeklinde konuştu. ANAP, bakanlıkların"
"w","W-II09C3A-0600-1536","de onlara katılacağım. Khan-Tengri'nin bizim","çıktığımız","rotası ilk kez 1975'te çıkılmış,"
"s","S-BEABXO-0455-315","de okul bittikten sonra önüne","çıkacak","bilmiyorum. Bak daha karşında, karşına"
"s","S-BEABXn-0352-1107","de mi? He. Kiliseye karşı","çıkan","insanlar. Dinle alakaları yok zaten."
"w","W-KB04A2A-1573-1662","de gereksinim duyulur. 1. Ses","çıkarma","Son yıllarda duyarlı ses alıcı"
"w","W-SE36E1B-3294-903","de geleceğinizi karartırlar"" gerekçesiyle karşı","çıktı","ve 2001 yılında 116 yaşındayken"
"s","S-ACABQq-0425-64","de fark etsin, durumdan vazife","çıkarıp","üzerine düşeni yapsın. Türk halkı,"
"s","S-BEABXO-0339-638","de Eser abi bi şey","çıkarttı.","Tema. Iı işyerimizde asgari ücret"
"s","S-ADABCo-0361-1330","de en büyük yıkımları ortaya","çıkarmıştır.","İşte aslında 1. ve 2."
"w","W-KD03A0A-0261-2041","de dişilerini uyarmak için ses","çıkarırlar.","Dikkati çeken yan, bu hayvanların"
"w","W-KA16B4A-0886-62","de böyle tuhaf bir yolculuğa","çıktığımı;","birkaç saniye gibi kısacık bir"
"s","S-ACAAQq-0424-1716","de bunu hazırlarken araştırmalarımızda ortaya","çıkan","rakamsal bazda bazı sonuçları sizlerle"
"w","W-TI19E1A-4012-1439","de bunlardan edindikten sonra, yeni","çıkan","paralardan birer tane saklamakla işe"
"s","S-ACABQq-0422-2083","de bundan kazançlı çıkacağı ortaya","çıkmıştır;","dolayısıyla, iki taraflı bir kazanç"
"s","S-ADAB^o-0199-480","de bi panzehir olarak ortaya","çıkabiliceğini","ben düşünemiyorum dilerim yanılıyorumdur. Efendim"
"w","W-LI31D1B-2338-2388","de Amerika kupasında başarılı maçlar","çıkaran","Uruguaylı Salyete'nin adını ön plana"
"w","W-TE36E1B-3295-2321","de ""Ayışığı Operasyonu"" iddiaları ortaya","çıkmadan","kısa süre önce yayımlanan ""Ya"
"s","S-AEABTZ-0040-1533","dağıtımını özelleştirdiler. Diğil mi? Kanun","çıktı.","Ama ihaleyi açmadılar. İletimi de"
"w","W-SE05A1B-4193-268","dağılımında servete bağlı olarak ortaya","çıkan","dengesizliğin giderilmesinde arazi, bina gibi"
"s","S-AEABPZ-0331-1775","dağa çıkıyorsunuz? Toros Dağları'nın başına","çıkıyorsunuz?","Her gittiğiniz yerde bir tabiat"
"w","W-WI45F1D-4789-1515","dayanılmaz, sinir bozucu bir öğrenci","çıktı.","Ben yine de kendisini notla"
"w","W-UD03A1A-0902-2174","dayanılmaz bir gülme isteği açığa","çıkmaya","başlıyor. Deleuze sağ olsaydı, bu"
"w","W-GD05A2A-0427-82","dayanılarak çıkarılabilecek kanun hükmünde kararnamenin","çıkarılma","amacının, kapsamının, ilkelerinin, kullanma süresinin"
"w","W-OG37E1B-2922-477","dayanamam. Görebildiğim en yüksek yere","çıkıp","son şiirimi okuyup denize dalarım."
"w","W-TE36E1B-3354-435","dayanaksız ve mutsuz insanlar topluluğu","çıkıyor","ortaya. Hepimizin son anda dayandığı,"
"w","W-OE07A0A-2038-1095","davranışsal/tutumsal ayrışma üzerindeki etkisini öne","çıkarmasından","kaynaklanmaktadır. Şöyle ki Örneğin gene"
"w","W-MF10E1B-2864-1897","davranmayıp fiyat kırmaları halinde ortaya","çıkacak.","Bu durumda pazar paylarını kaybedecekler"
"w","W-UA16B2A-0884-1191","davranmaktan vazgeçirecek herhangi bir ses","çıkarmaktan","bile korkuyordu. Ayakkabıcı ölçü alma"
"w","W-OA16B4A-0072-403","David tuvalete gitmek için dışarı","çıktı.","Koridorda Selva, Perla'ya bir şeyler"
"w","W-KE05E1B-3299-1121","davetle Yunanistan'a davet edildiği ortaya","çıkıyordu.","Toplantıda Abdulah Öcalan'ın bu davete"
"s","S-ADABCo-0229-791","davayla ilgili bi mesele ortaya","çıkan","silahların aydınlatılması. O Susurluk'a mı"
"s","S-BEABXO-0120-281","dardayız. Çıkıp yani eşyamızı alıp","çıkıp","koyabileceğimiz hiçbir yer yok. Düşünüyoruz"
"w","W-UI31D1B-2356-1067","darbeyi, Ayhan'ın ABD'li kampta dopingli","çıkması","vurdu. Henüz resmiyet kazanmasa da"
"s","S-ACABPA-0434-347","dar bölgede uygulanıyor. Buna karşı","çıkan","meslektaşlarımız var, siyasetçiler var, bundan"
"w","W-LA16B2A-0436-1444","damdan. Damından isli mertekler fırlayıp","çıkmış","evin önünde, alaca karanlığın içinde,"
"w","W-DA16B2A-0863-122","Dalmışız affet. Lafı duyunca delirip","çıktık.","Seni çok düşündüğümüz için, kızım."
"w","W-LC06E1B-3086-1383","dalgaboylarının yüksek sığalı bağlantıya girip","çıkmalarına","izin veriyor. DWDM sistemi optik"
"w","W-JE39E1B-2838-1535","daldılar. Yangını söndürmek için gemiye","çıkmışlardı","ama, gelecek tehlikenin farkında değillerdi."
"s","S-ADBBI^-0326-1828","dakika program yapabildim. Peruğumu da","çıkardım,","kıyamet alkış kopuyor, yürüdüm gittim."
"w","W-PD05A3A-1094-1642","dahi yine de yasa ortaya","çıkmayabilir.","Yasa bunlardan daha ötede bir"
"w","W-PC01A2A-3312-1196","daha önemli olduğu sonucu da","çıkarılabilir.","Uykunun algılanması konusunda sıklıkla karşılaşılan"
"s","S-ACABTZ-0336-1473","daha önceki emm 1983 yılında","çıkan","birinci maddesi bu şekildeyken zamanımı"
"w","W-JI22C2A-0797-1039","daha çoktu, bu hesabın içinden","çıkamıyordu","bir türlü. Hep, ""işim var"""
"w","W-QC05A2A-2047-583","daha çok okul bahçelerinde ortaya","çıkıyor","gibi görünmektedir. Okul bahçelerinde sıklıkla"
"s","S-BEABXn-0100-1882","daha yukarda. Biz Aya Yorgi'ye","çıkıcaz","ama. Tamam işte. Ama lunapark"
"s","S-BEABXO-0342-2128","daha var. ama üstte böle","çıkmıyorsun.","Ama üstte daha namuslu bi"
