"Register","Text","Left","-5;5","Right"
"s","S-ACABQq-0426-474","durumuna düşürdüğü bir düzenleme görüntüsü","vermektedir.","Sigara kötüdür. Bu doğrudur. Peki,"
"s","S-ACABTZ-0336-1019","durumu tahminlerinin oldukça farklı sonuçlar","verebileceği","anlamına geliyor. Emme bu başlangıç"
"w","W-OD02A1B-4540-1153","durumlarda yararlanılan kaynakların tarihleri fikir","verebilir.","3. 9. Kabul Edilebilirlik ve"
"s","S-ACABTZ-0336-427","durum. Bütün bunlar Dünya'da karar","veren","merciler için çok önemli bir"
"s","S-BEABXO-0455-2186","durmuş bak görüyorsun iki tane.","Verme","lan verme fakiriz, hemen veriyo."
"w","W-IH39C3A-1295-637","durmaktadır. Onun içinde süreçlere yön","veren","zekâlı içkin bir güç, işleyişinin"
"s","S-BEABXl-0008-2138","Dur dur şu mısırları bana","ver","bari. Özgür öyle yenmez oğlum."
"s","S-ACABQq-0423-2485","Dumlupınar İlçesinde görüştüğüm bir vatandaşımız","verdi.","Vatandaşımız Halk Partili değildi... (AK"
"w","W-GA16B2A-0606-667","dudağımı boyayıp filim öpücüğü de","vermem-","gün geçiyor, umurunda değil pezevenklerin."
"w","W-NF18E1C-4157-2078","dramatik bir biçimde artmasına izin","verilmemiştir.","Banka aktiflerinin GSYİH'ya oranı kriz"
"s","S-ACABQq-0421-1692","Dr. Sayın Recep Akdağ cevap","vereceklerdir.","Buyurun Sayın Bakan. Süreniz 20"
"s","S-ADABPZ-0113-1602","Dr Hamdi Beteri nin emm","Vereceği","bir konferans var ve öncesinde"
"w","W-SG24D1B-2291-877","Doğuş Çocuk Senfoni Orkestrası, 2006'da","verecekleri","konserlere hazırlanıyor. İlk hedef de"
"s","S-ADABPZ-0125-2371","Doğu Teknik Üniversitede bir fırsat","verildi","ben o ara TÜBİTAK'ta çalışıyorum."
"s","S-ADABPZ-0373-2471","doğrultusunda En üst düzeyde bakım","vereceğime","En üst düzeyde bakım vereceğime"
"w","W-LE09C2A-0589-1093","doğrulayan bilgi ve belgeleri bize","vermişlerdir.""","Genel-İş sendikasının Diyarbakır şube başkanı"
"w","W-VD05A0A-2036-323","doğrudan doğruya yurttaş hakkında hüküm","verip","onun hayatına doğrudan müdahale edebilir,"
"s","S-AEABTZ-0040-835","doğru değildir diye bana cevap","verdiler","resmi olarak. İkincisi TAİK'in yetersizliği"
"s","S-ADABIO-0437-1880","doğru değil ama biraz para","vereceksin","yani ama alamayanlar var yani"
"w","W-TF10A2A-1173-1391","doğru bir değerlendirme yapılmasına imkan","verecektir.","Hükümetlerin karşılaştıkları mali riskler, Dünya"
"w","W-RC01A3A-0697-1448","doğal ağırlık düzeyinden uzaklaşmasına izin","vermemektedir.","Ve bu da diyetçilerin hiç"
"w","W-UH42E1B-2921-2069","doyurur, öfkesini yutar, kimseye eza","vermez,","ezalara sabırla katlanır, insaflı olur,"
"w","W-QA16B4A-0015-2360","Dostlarımız bunları aklayacak bana söz","verdiler!...","Sizler de artık dağ adamısınız"
"w","W-TG37E1B-2936-1893","dostları tarafından memleketi Denizli'de toprağa","verildi.","26 Nisan 35 yıldır söylediği"
"w","W-UA14B1A-1594-1538","Dora benim yardım etmeme izin","vermiyorlar.","DORA Tabii çünkü sen daha"
"s","S-AEABUZ-0038-2006","Donmuş ve kalıplaşmış düşüncelere prim","vermez.","Fikri hür, vicdanı hür bi"
"s","S-ADABAo-0355-2489","dondurma yersin ancak, bunlara cevaz","vermemek","lazım. Mesela orda yaşıyan Türkler"
"w","W-EF10A3A-1831-2396","Dondurarak kurutmacılık en çok lezzet","vermek","için kullanılan dere otu, frenk"
"w","W-TG37E1B-2936-2147","doluyor coşkuyla yüreklerimiz. Arkadaki ekran","veriyor","haykıran genç kadının yüzündeki bütün"
"s","S-BEABXO-0379-1559","dolorex, bi şurup te geçti.","Vermedi","mi fitil? Zelaa inge gibi?"
"s","S-ADABCo-0201-2266","Dolmabahçe'ye yürümek istedi. Polis izin","vermiyince","ulaşmak için Dolmabahçe'ye tranvayı kullandı."
"w","W-JI37C3A-0091-797","dolaşacağım süpermarkete onlar bir günlerini","veriyorlar.","Biliyorum çok meşguller ama beni"
"s","S-ACABQq-0423-1209","dolayısıyla, herhangi bir mağduriyete sebep","verilmediğini","de özellikle ifade ediyorum ve"
"s","S-ACABQq-0423-1218","Dolayısıyla, bu, bizim en önem","verdiğimiz","bir konu idi. Bunun dışında,"
"s","S-AEABTZ-0040-2036","dolayısıyla bir nükleer santrala lisans","vermesi","doğru değildir diye bana cevap"
"w","W-KE39E1B-2839-1879","dolayı müthiş bir rant savaşı","veriliyor","burada. Taşradan gelen hastalar hemen"
"s","S-BEABXO-0453-2501","dolarlardır. Ay! hıı, Allah belanı","vermeye.","<gülme> 1 mi 2 mi"
"w","W-EE05A1B-3449-698","dokunulmazlığı ve yasama sorumsuzluğu adı","verilen,","gerek hukuki nitelikleri gerekse amaçlan"
"w","W-UE36E1B-3296-1598","Doktoru Alfred Körblein, İstanbul'daydı. Körblein'ın","verdiği","rakamlar daha sonra yürütülen çalışmalarla"
"w","W-SC18F0A-1784-1805","Doktora öğrencilerine öğrenimlerini sürdürmeye olanak","verecek","mali olanakları sağlamak, 3. Doktora"
"w","W-VI44F1D-4756-549","doktor bana 10 tane iğne","verdi","vuruldum kontrolde bana sana yine"
"w","W-QI09C2A-0631-19","DM'lik fiyatı çok bulduğumdan yüz","vermedim.","Satış yerlerinin önüne askıyla çıkarıyorlardı"
"w","W-JC01A1B-3745-2444","dişde ise 19.08 mm olarak","vermektedir.","Bu değerler hafif farklılıklarla araştırmamız"
"s","S-BEABXO-0344-126","diğil de alien yapmaya karar","verdik.","Alien mı? Nağaptınız? Yaa bi"
"w","W-MD36E1B-2855-548","diğer yanda da prenseslik payeleri","veriliyor,","ya da tıpkı Nilgün Marmara'ya"
"w","W-PE39C4A-1427-729","diğer Avrupalı parlamenterlerin, Afganistan savaşma","verdikleri","destek nedeniyle özellikle İtalyan heyeti"
"s","S-AEABTZ-0041-1545","dizisi yazmak. Bizde bir konferans","verdi","ben de o konferansta olanları"
"s","S-BEABXO-0380-669","diyu çektiler beni. Çekmeyediler diyu...","Verilmiş","sadakası varmış adamın. Ama kaç"
"s","S-BEABXO-0441-1608","diyorum. Yav diyor ne olacak","veririk","diyo 10 lirayı. 10 liraya"
"w","W-TE36E1B-3353-1804","diyorum, ""Galatasaray"" diyor. Avcılar'da hizmet","veren","Medyum Hoca Zeynel Eroğlu, el"
"s","S-BEABXs-0130-1205","diyorsun? Hmm oğlum bir cevap","ver","ona göre. Ya burası açık."
"s","S-BEABXB-0003-2455","diyorm ki şey diyorum. Çekinerek","veriyorum","falan. Diyorki biz para veryoruz"
"s","S-BEABXw-0353-219","diyor. Onun parasını güya şeye","veriyormuş","babasına. Aman gızım onun ne"
"s","S-BEABXR-0010-1090","diyor. Böyle insanlara ne borç","verecen","ne ideaya girecen. Adam yerine"
"s","S-BEABXn-0067-1631","diyo. <B> çakmağı yokmuş ateşi","versene","oğlum diyo. Abini biliyorlar mı?"
"s","S-BEABXO-0322-885","diyo Tatmin edici bi hediye","vericem","diyo. <gülme> Ya o yüzden"
"s","S-BEABXw-0391-1317","diyo hakkını vereceksiniz. Ben lütfetmişim","vermişim","size orayı sunum yapmanız için"
"s","S-BEABXO-0345-173","diyim size şu şekilde kalemi","ver.","Sponge Bob şeklinde keselim mi"
"w","W-IE39C4A-1358-145","diyerek üstü kapalı ""beraat kararı","verilmesini""","istiyorlardı. Bunu anlayacak incelikte olan"
"s","S-ADABPZ-0374-1927","diyerek üniversitelere ve bilim adamlarına","verdiği","önemi dile getirmiştir. Bizler de"
"w","W-KA16B2A-0798-1877","diyenlere en büyük cevabı önerimizle","verdik.","Bu pazar günü tüm yurtta"
"s","S-ADBBI^-0326-1711","diyemem. Ben şovuma çok emek","verdiğim","için onun dışındaki şovlarda; işte"
"w","W-SI41C4A-1393-415","Diyelim ki ışık yetmedi. Karar","veremiyorsunuz,","o zaman saçın tepesine bakın."
"s","S-ADBBAo-0443-46","diye. Tabi kolay değil gurbetin","verdiği","bir gariplik oluyor. Bilmediği bir"
"s","S-BEABXO-0074-1897","diye. Anne dedim bozuk varsa","ver","ben de 500 bin liralık"
"s","S-ACABPA-0434-2004","diye, ayrı ayrı partilere oy","verilsin,","dolayısıyla partiler kimliklerinden vazgeçmesinler. İşte"
"s","S-ADABAo-0433-2062","diye çok önemli bi bilgi","vermiş","bize. Emm, onun haricinde Lilcandy"
"s","S-AAABXN-0004-738","diye yemiyorum. Karnım tok kilo","vermeye","çalışyorum falan diyorum. Vallahi. Ver"
"w","W-VI44F1D-4739-1067","diye sorarsa buna nasıl cevap","verebiliriz.","Birincisi, çok çukulata tüketilmiştir ve"
"w","W-PE39C0A-0249-2154","diye soran gazetecilere şu yanıtı","vermiştir","""Hiç! Esaret altına girmeyi kabul"
"w","W-PA16B0A-0297-2014","diye sana esprili bir cevap","verecek","kadar yırtık değilim. Bu yüzden"
"s","S-ADBBAo-0443-1515","diye o kötü evi bile","vermek","istemediler. Vermiyorlar. Çok zor anlaştık."
"s","S-BEABXW-0005-1342","diye geldik. Yani bizim senemizde","verilyodu","zaten. <B> Ama istediğin sene"
"s","S-BEABXO-0344-449","diye düşündüm. Oğlum şu ayıcığı","versene.","Çok yamuk oldu. Saçı nasıl"
"s","S-BEABXO-0013-1542","diye bize vermezse onu. Belediye","vermicek","ki. Konuşacaz da. Bahçemiz var,"
"w","W-UD05A3A-2606-1958","diye bağıranlar milletin ihtiyacına cevap","veremiyorlar.","ATATÜRKÇÜLÜK demek vatan ve milleti"
"w","W-PD30D1B-2201-290","Diyanet'e 34 bin 762 kadro","verildiğini,","1997 yılında 16 bin 667"
"s","S-ACABQq-0423-1070","disiplinli, çalışkan, halkla ilişkilere önem","veren,","sorun çözücü, çağın gelişmelerini takip"
"w","W-KA16B3A-0706-2105","Disiplin işleri. ""Tüh Allah belanızı","versin!...","Ne bu be? Zekai, bak"
"w","W-NC01A3A-1083-1945","disfonksiyonu gelişir. 15-30 mg/kg'dan mg/kg'dan","verildiğinde","hepatoksisiteyi arttırmaz. Diğer yan etkileri;"
"w","W-KG43C4A-3334-258","dirilttiğim Çiçeğimi kopardın sen Ellere","verdin","Dağlar dağlar, kurban olam yol"
"w","W-UH03A2A-0494-1662","dirhemin üzerinde kantar kantar servet","verebilir,","mehir verebilir veya o hanımlardan"
"w","W-PC06A3A-1954-1213","direnç kuvvetlerini bulunuz. 16. Aşağıda","verilen","kompleks potansiyel fonksiyonlardan potansiyel ve"
"s","S-ACABQq-0426-946","direnişe geçen Türkler büyük kayıplar","vermişler,","buna rağmen, Kasım 1920 sonlarında"
"w","W-VI31D1B-2422-946","direktör adayının Eriksson olduğuna karar","verdiklerini","bildirdiler. Eriksson ise bu teklifi"
"w","W-PD02A1B-4556-1565","dinsel bölünmelere ve parçalanmalara izin","vermemiş;","Sünni-Şii, hatta Hıristiyanlık öğretilerini dahi"
"w","W-PE39C4A-0243-865","dinleyenlerle ilgili soruşturma tamamlansın' talimatını","verdi.","Valinin emriyle harekete geçen İstanbul"
"w","W-CH03A1B-2378-1395","dinde baskı olamayacağı ilkelerine yer","verdi.","Mecelle ile İslâm Hukuku açısından"
"s","S-ACAAPZ-0028-1415","dinamiklerinin, bütün kurumlarının bu festivale","vermiş","olduğu destektir. Zaman zaman bazı"
"w","W-PD18E1C-4164-586","din duygusunu güçlendirecek konulara ağırlık","verilecek,","anlama ve kavrama düzeyi göz"
"s","S-BEABXO-0346-1708","din din AÇ-TIM! Çüüüüşşşşş! Bana","verir","misin? Her şey yeşil oldu"
"w","W-EC37C2A-0662-1803","dillerini kullanma biçimleri açısından fikir","vermektedir.","Andrea de Joria'nın bu çizgilerinin"
"s","S-ADAASK-0036-2008","dilini çeviremezsin. Nefesini alamazsın, alsan","veremezsin.","Daha ne hususunda bana yardım"
"s","S-ADAB^Z-0370-183","dili öğrenmememize gerek olduguna karar","vermemiz","lazım Evet tabi. Kesin, kesin,"
"s","S-ACAAFZ-0048-777","dileriz, savaş bu, tazminatı neyse","veririz""","diyor. Birleşmiş Milletler'in Genel Sekreterinden"
"w","W-NA16B4A-0054-1447","dilediğini yapma özgürlüğü' olarak revaç","verilmiştir.","Birbirinden bağımsız gelişen bu uygulamaların"
"s","S-BEABXO-0358-1378","dil bilgisidir, yabancı dil bilgisi","veriyolar,","hani işte şu böyledir, bu"
"w","W-HA16B2A-1938-1979","Diktatörlüğe başladım hemen. Sorularına yanıt","vermiyordum.","Hem suçlu, hem de güçlüydüm."
"w","W-IF18E1C-4144-1628","dikkatle uygulanması ve piyasalara güven","verilmesi","bu kredibilitenin unsurlarıdır. Para politikasının"
"w","W-QF10E1B-3065-710","dikkat çekici tarzıyla ilgili ipuçları","veriyor.","Hayatın tüm renkleri objektifinizde Motorola"
"s","S-BEABX`-0096-247","di mi şimdi içeriye? Anahtarı","veriyorum","ben. Tabii tabii kalıyorum ben."
"s","S-ADABCo-0314-2261","değiştirme haklarına sahipler. Mesela dilekçe","verip","benim kazancımı 1000 lira alın"
"w","W-TC06A1A-0259-598","değişir ve hızlı bir şekilde","verilir.","Ölüm bir haberden bir sonraki"
"s","S-ADABCo-0225-1529","değiliz. Biz vermiyecek bu şirketler","vermiyecek","güçte değil ki. Ne dediler"
"s","S-AEABTZ-0040-2330","değilim yani o yüzden benim","vereceğim","bilgiler size siyasi bilgi yani"
"w","W-RI22C2A-0827-2426","değildir bize en çok acı","veren","ve bizi gurbet duygusunun kucağına"
"w","W-MG09C3A-0355-40","değildi. Birdenbire çok ters etki","verebilirdi.","Onun hesabını yaptım, doğrusu. Yapamayacağıma"
"s","S-AEAASO-0039-806","değil. Onlar, Dünya'ya böyle değer","vermediler","çünkü Dünya'nın değeri yok. Biz"
"w","W-ND02A1B-4513-1480","değil, ilk derece mahkemelerinin, karar","verirken","yanlışlık yapmaları ihtimalinden yola çıkarak,"
"s","S-ACAAPZ-0029-1301","değil, bu mesleğin üyeleri tarafından","verilmesi","zamanı çoktan gelmiştir. Çünkü hemşire"
"s","S-BEABXO-0324-1761","değil, artık okumuş... <B> Alevi'si","veriyo.","Alevi'si şuyu buyu… buyu… Kürtlerin"
"w","W-QD30D1B-2178-1256","değil"" dedi. Ulusoy, tartışmalara son","verebilmek","için hâkim ve savcı kararnamelerini"
"s","S-BEABXO-0012-2309","değil yani. Allah başka dert","vermesin","Tabi başka dert vermesin. Çaresi"
"w","W-VI44F1D-4748-11","değil verebilirsin diyo... ama nasıl","verebilirim","çocuğum kusuyo, ishal oluyo... napıcamı"
"s","S-BEABX{-0085-255","değil mi ya bilgisayar başına","veriyorlar","ya şoför oluyor bir şey"
"w","W-UE36E1B-3356-2369","değil herkes sarsılmış. Kimseye zarar","vermesek","bile sanki her an hedefte"
"s","S-AEABUZ-0021-435","değil diğer sanat dallarına da","verilen","değer ne yazık ki emm"
"w","W-ID03A4A-0580-1546","değil de ona ""entelektüel hava""","verecek","iyi türden Avrupa giysileri geçirin,"
"s","S-BEABXg-0090-387","değil aylık 740 milyon para","veriyolar","Oha. Evet. 6 ay felan"
"s","S-ACABQq-0426-2243","Değerli milletvekilleri, konuşmama burada son","verirken,","çıkacak olan bu yasanın ülkemize"
"w","W-JF02A3A-3318-2168","değerli madenlerin bulunamaması nedeniyle ara","verilen","kolonileşme çabaları ise yarım yüzyıllık"
"s","S-ACAAPZ-0327-1537","değerli dinleyicilerin üstün katkılarının karşılığını","vererek","sizleri en iyi şekilde ağırlıyabilmek"
"w","W-MC06A3A-0770-1983","değerleri arasındaki dönüşümleri aşağıdaki gibi","verilebilir.","DEPREMİN DİĞER ÖZELLİKLERİ Bazen büyük"
"w","W-NC06A1B-3880-1488","değerler Çizelge 1’de 1’de 1’de","verilmiştir.","Çizelge 1 Yeşil Gübre Uygulamalarındaki"
"w","W-DB04A4A-1989-1719","DEĞERLENDİRME SORULARI Aşağıdaki soruların yanıtlarını","verilen","seçenekler arasından bulunuz. 1. Aşağıdaki"
"s","S-BEABXO-0006-1063","Değerlendiryosun yani. Öğrenmek için para","vereceğine","sana para veriyorlar. Gidip gelyon."
"w","W-OE05A2A-1794-1667","değerlendirilmesi gerekmektedir. Kime Hesap Veriliyor/Verilmelidir?","Veriliyor/Verilmelidir?","Hesap verebilirliğin yapı taşlarından ikincisi,"
"s","S-ACABQq-0423-625","değerlendirelim ve buna göre karar","verelim.","Buna göre, biz, oturduk, kendimiz"
"s","S-ADABPZ-0116-2130","değerleme yatırım çoğaltanının yatırım çoğaltanının","verilecek","olan karara bağlı olaraktan etkileye"
"w","W-KG24D1B-2234-546","değeri olan ürünlere de yer","veriliyor.","Bu dergileri Türkiye'ye transfer ederken"
"w","W-NE39C0A-0215-2299","değer kazanabileceğimi öğretiyordu. Kısacası PKK'nın","verdiği","emirlerle kişiler, yüklendikleri görevlerin meşguliyetine"
"w","W-II13C2A-1288-1801","deyişle sessizliğe ulaşmak. Sessizlik dünyaya","verilecek","tek sahici yanıttır. AŞKTA İncir"
"w","W-TI22C3A-0750-1208","deyişiniz o ilk anlamına referans","veriyor","""Tatlım deme bana!"" Ve siz"
"s","S-ADABPZ-0373-1588","devrimciliğin çeşitli ve yaşamsal görevler","verdiği,","Türk vatandaşının sağlığı ve sağlamlığı"
"w","W-MA16B2A-0017-544","devrilişini, 'Timber!' diye bağırarak haber","verirlermiş.","Katherine Hepburn'ün babası da oduncuymuş."
"s","S-ADABCo-0315-552","devletten satın almaya çalışıyor. Para","vermeye","çalışıyor. Bizde tam tersi. Tam"
"w","W-PE39C3A-0881-1653","devletten daha fazlasına sahibiz"" karşılığını","veriyor,","""Federasyon gelecekle ilgili bir şey."
"w","W-LE05A1B-3684-1329","devletin halka, çocuklarını Müslümanlar tarafından","verilecek","sivil ve askeri hizmet için"
"s","S-ACABQq-0421-848","devletimizin, hükümetlerimizin özel bir önem","vermesinde,","özel bir dikkat göstermesinde yarar"
"s","S-ACABQq-0420-1094","devlete, kurum ve kuruluşlara yetki","verilmesini,""","1'inci madde üzerinde söz talebi?"
"s","S-ACABQq-0420-358","devlete, kurum ve kuruluşlara yetki","verilmesi,","bu kanunun 2'nci maddesinde açık"
"w","W-VG24D1B-2312-1325","Devlet Opera sanatçılarının Cer Atölyeleri'nde","vereceği","""Yaza Merhaba Üç Tenor"" konseriyle,"
"s","S-ADABLp-0062-1915","devlet kredi ve arkadaşlar destek","verecek","doğru mu? Peki devlet bu"
"w","W-UE30D1B-2124-2240","devlet kimliklerine kavuştuklarını belirterek, pasaportların","verilmesiyle","devletin tesis edilmesinde önemli bir"
"s","S-ACABPZ-0329-468","devam edecekleri bir temizlik formülü","veriyoruz.","Ve bu emm formülü de"
"w","W-QE30D1B-2120-1348","detaylı şekilde belirtildiği bir mektup","verildi.","Bugün ise Saddam, bir eskort"
"w","W-LF10A3A-1826-487","destekleme alımlarında Merkez Bankası kredi","verme","uygulamasına son vermiştir. Merkez Bankası"
"w","W-KA16B1A-1730-2261","desenli kravatından yapışmış, son nefesini","verdirmek","üzereydim. Kulak mememe bir el"
"w","W-JI37C2A-1336-726","Derviş bu işe hiçbir anlam","verememiş.","Dedim ya, Derviş katliama uğrayan"
"w","W-TI45F1D-4704-1686","deruni çerçevesinin varlık sebebi ""şifa","verme","ve şifa alma dinamiği""nin dinamiği""nin"
"s","S-BEABXO-0012-2164","dert vermesin Tabi başka dert","vermesin.","Çaresi olan dertler olsun da"
"w","W-DD02A3A-2967-137","derslerinin içeriğini özetleyen bir konferans","vermiştir.","Heidegger etçik olarak temel sorununu,"
"w","W-GA16B3A-0789-1631","dersiniz? Pasit bir nihilist fotoğrafı","vermiyor","anlatılar. Aktif bir nihilizme de"
"w","W-FD02A2A-0647-1240","dersini bundan dört yıl önce","verirken","aralarında benim de bulunduğum bir"
"s","S-BAABXj-0001-994","dersini ben istersem bana bedavaya","verecekler","bebeğim ama ben gitmedim. Hiç"
"s","S-ADABI]-0126-1327","dersine girdikten sonra bize ne","veriyorlar","ki bu kadar zor olsun"
"s","S-ADAB^o-0132-1274","ders programlarımıza ve yaptığımız araştırmalarımıza","verebildik.","Bu çok büyük bir şans"
"s","S-AAABLp-0159-2188","deriz, biz bunlara töre ismini","veririz.","Türklerde ilk hukuk kuralları yazısızdır,"
"w","W-MA16B3A-0331-136","derinliklerine iyice gizlenmiş, soluk alıp","veren","bir canlıydı sanki. Deliliğin çekici"
"w","W-EA16B3A-0344-1030","dergi kurulmasına önayak olmaya karar","verdi.","Ama yapılması gereken ilk şey"
"w","W-GF10A4A-1841-599","derecede ve en çok önem","vermek","zorundayız. Zamanımız tamamen bir ekonomi"
"w","W-JD02A1B-3834-2084","derecede İngilizce bildiğini belirterek cevap","vermişlerdir.","İngilizceden başka ikinci dil olarak"
"w","W-JA16B1A-1718-1095","derdi babama. Doktor ona damla","vermişti.","Gözleri görmediği halde ikidebir o"
"w","W-QA16B2A-1432-1947","der Okan. Kaba hemen cevap","verir","""Renkler aslında yalanların şahitleridir. Asıl"
"s","S-BEABXB-0410-1511","depozito. <Gülerek> Devlet malına zarar","vermekten.","<Gülme>. Oğlum siz ne yaptınız"
"w","W-PG37C4A-0201-626","denizine karşı silaha sarılıp son","vermek","mi onlara? Ölmek, uyumak... Hepsi"
"s","S-ADABAo-0388-2333","denilir, bir kısmı yollara önem","verirler","onlara mesalik ve memalik denilir,"
"s","S-ADABCo-0241-1863","denilen bir Amerika'daki yelken okulunun","vermiş","olduğu sertifika programında başlamış olduğumuz"
"s","S-AEABUZ-0022-1085","denilebilir. Her numara var. Son","verelim.","Yani bunların hepsini aynı anda"
"w","W-VI19E1A-4052-519","deneyimlerini bir kitapta toplamaya karar","verdi.","Yazılarını önce görme engellilerin kullandığı"
"s","S-BEABXO-0375-2370","deneyim. O biraz sert kızım","vereyim","makas? Ben diyrum beya te"
"s","S-ADABAo-0366-755","deneyerek, gözleyerek, belki sınayarak karar","verme,","sonuçlar elde etme öne geçiyor."
"w","W-VD02A1A-2714-2032","denetimine dair belgelerin yapı sahibine","verilmesi","Yapı ruhsatı (izni) başvurusunun ilgili"
"s","S-ADABAo-0355-528","denen büyük okulları ekol <B>","veriyor","falan. Bizde de Tanzimat'tan sonra"
"w","W-KI13C2A-1498-95","Demokrasilerde sayısal çokluklara erişmek için","verilen","kavga ortadadır. Medeni insanın bedevi"
"s","S-ADAB]o-0110-700","demokrasilerde kendisine mevdu yani ona","verilmiş","gücü ölçüsüz bi şekilde kullanmamaları"
"w","W-UI44F1D-4764-942","demişsin herkese kimse sana cevap","vermemiş","iyi geceler hocam sana da"
"s","S-ACABQq-0421-315","demişlerdir ki, doğrudan tarım desteği","verelim,","dekarına 10 000 000 Türk"
"s","S-BEABXO-0440-87","demiş. O zaman demiş hiç","vermem.","Diğer çalışanlara ne demiş biliyor"
"s","S-BEABXp-0156-1685","deminden beri social situation'lar... Situation'ları","verip","işte nası hitap edersiniz? Hı-hı."
"w","W-LE09C2A-0896-1946","demenin zamanıdır artık... ""Rahat"" komutunu","vermesi","gerekenler, o fotoğraftan ""rahatsız"" olanlardır."
"w","W-JG03A3A-2013-1980","demektir. Bir millet sanata ehemmiyet","vermedikçe","büyük bir felakete mahkûmdur. Sanatın"
"s","S-AEABUZ-0038-5","demektir. Bilim adamı çalışırken, ders","verirken,","sadece acaba ben bilimsel yönteme"
"w","W-JA16B1A-1718-2181","demek. Yani..."" Sözünü bitirmesine fırsat","vermedi","genç adam. ""Tamam arkadaş, nasihat"
"s","S-BEABXO-0121-2111","demek ki. Ya şimdi <B>","veriyorlarmış","öyle kolay kolay. Ama şöyle"
"s","S-BEABIs-0015-1349","Demek ki bize bir ödenek","veriliyor","ve biz bu ödeneği sonuna"
"s","S-BEABXA-0129-1045","demek Farsçada. Ama hepsi Uçhisar'a","veriliyor.","Burdan şey, Uçhisar'ın batısındakiler tamamı."
"w","W-QE09C4A-1157-1545","dek. Savaşın çıkacağına hiçbir ihtimal","vermiyordum.","Çünkü hayatımın ilk yirmi altı"
"w","W-ID39C2A-0756-1169","defa bize legal basında yer","verdi.","Ben de yazılarıma imza olarak,"
"s","S-ADABPZ-0112-1784","dediğimiz yapışıklıkları engellemek pas tür","vermek","ve emm Dolayısıyla çocuğun rahat"
"w","W-DE36C2A-0610-2449","dediğimde oturulacak. Hiç kimseye zarar","vermeden,","antipati yaratmadan yolumuza devam edeceğiz"""
"w","W-FA16B3A-0986-311","dedin? Yoook! O şimdi olmaz.","Vermem.","Buna serbest rekabet olarak bakın."
"s","S-BEABXO-0415-2246","dedim. Nazşı teyzesine hiç pas","vermiyormuş.","Benle oynuyordu ya. Ee? Ben"
"w","W-IA16B2A-0771-324","dedim. ""Olmaz canım. Anneme söz","verdim","'geleceğim' diye. Bekler beni"" dedi"
"s","S-ADBBI^-0042-104","dedim ve o desteği hep","verdiler","bana. Bunlar çok güzel şeyler;"
"s","S-BEABXw-0353-1072","dedim sonuçlarınızı hocaya ben görmeden","vermeyin","demiş yarın saat 13'te alacam."
"s","S-BEABXw-0398-279","Dedim bak seyircilerin önünde izin","veriyorum","sana dedim. Dedi ay!, şey"
"s","S-ADABCo-0225-2285","dediler peki dedik. Verdik verdik","verdik…","verdik… Halis Toprak ve eşi"
"s","S-BEABXO-0074-2376","dedi. Kimle konuşursak karşılığını hemen","vereceğiz","dedi. Hmm. Gelin de olsa"
"s","S-BEABXO-0074-1639","dedi. Dedim 3-4 ay sonra","verecekmişiz","dedim. Öyle söyledi dedim. Yok"
"w","W-TI22E1B-2913-2203","dedi. Dedesi, ""Hayır!"" diye cevap","verdi.","""Ben bir şey söylemedim."" Kâmil"
"w","W-OA16B2A-0787-2488","dedi. Bu tavrına pek anlam","veremedim;","aynı soğuklukla karşılık verdim. Bir"
"s","S-BEABXO-0344-597","dedi. Bize bi tane kumaş","verdi","yolladı. Ne var dedi? İşim"
"w","W-UI45F1D-4773-1472","dedi. ""Kim dağıtıyormuş, her isteyene","veriyorlar","mı?"" diye sordum. Bilmiyorum, ben"
"s","S-BEABXO-0263-2031","dedi, evet dedim. Bir zarf","versem","götürür müsün, dedi bana. Ondan"
"s","S-BEABXO-0074-1547","dedi veremem nerden bulursa bulsun","vermem","dedi. Anladım yani evde olduğunu."
"s","S-BEABXO-0343-1297","dedi ne dedi borç mu","verdi","naptı karıyı üstümüze sardı felan"
"s","S-BEABXW-0005-826","dedi ki ""İstediğiniz kadar kâğıt","verebilirim.""","Falan dedi. Sonra millet dolduryo."
"s","S-BEABXW-0173-878","dedi hee seneye onlara söz","verme","dedi söz verdin mi dedi"
"w","W-LA16B4A-0298-603","dedi Hana. Fiko cevap bile","vermedi","Mutfakta, ""Bak anne,"" dedi Nimeta,"
"s","S-BEABXO-0092-1935","dedi fark etmez yedi şani","verdikten","sonra ister aylık ver... Doğru."
"s","S-BEABX\-0065-382","dedi evden çıkarken sana haber","veririm","sen zaten 15 dakkada anca"
"w","W-KD30D1B-2222-1729","Dedelek, 55. Hükümet'in tartışmalara son","verdiğini,","toplumsal kutuplaşmaları engellediğini söyledi. Dedelek,"
"w","W-LD02A4A-0537-459","de çok kaba bir örnek","verecek","olursak, Cezayir Arap kültürünün Fransız"
"w","W-RE05A1B-4267-1481","de çeşitli kanallar tarafından haber","verilen","toplu bir isyan hareketinin ön"
"s","S-ADABCo-0316-1096","de yok. İtiraz dilekçesi de","verdim.","Tarafıma herhangi bir cevap gelmedi."
"s","S-BEABXO-0418-394","de yirmi beş milyon lira","verdim","on beş milyon da öyle"
"s","S-ADABIO-0437-2318","de yeni ürünler var onlardan","verelim","size Hah! Henkel teşekkür ederim"
"s","S-ADABCo-0197-420","de verdiğiniz Anadolu Ajansı'nın emm","verdiği","haber var Başbakan'ımızın sözleriyle ilgili."
