"Register","Text","Left","-5;5","Right"
"w","W-UE36E1B-3357-1336","dil, tarih, komşuluk vb. hısımlıklara","bakın.","Nitekim telefon oylamasına geçildiğinden beri"
"w","W-RI45F1D-4714-2109","dikmiş, sabit bir biçimde Marten'e","bakıyordu.","Efendim müsaade ederseniz devam edeyim..."
"w","W-GA16B4A-0048-435","dikkatle dinledi, sözleri bitince gülümsedi","""Bak","kızanım"" dedi, ""belki farklı sözlerle"
"s","S-BEABXO-0354-771","dikkatimi çekti, döndüm. Hıı. Bi","baktım,","çok benzettim, sonra bakmadım bi"
"w","W-OF25D1B-2767-1991","dikkat çekti. Ekonomi gündemiyle toplanan","Bakanlar","Kurulu'nda Merkez Bankası Başkanı Süreyya"
"s","S-ADABI\-0438-1017","dikkat etmedim. Peki şöyle bir","bakın","isterseniz burada promosyon ürünleri var"
"w","W-KA16B1A-1730-1201","dikenli tellerle çevrili yolun kenarındayız.","Bakıyorum,","Burcu'nun hâlâ gözleri kapalı. ""Aç"
"w","W-KA16B2A-1335-1874","dik duruyordu... Dimdik!.. Gülerek, överek","baktı","oğluna. ""Bugün benim iltifat günüm,"""
"w","W-SD36E1B-2843-2201","Dibini bulduğumuz şu yüzyıla dönüp","bakınca","suç genetiktir yutturmacası ile istekleri"
"s","S-ADABAo-0355-1826","di mi? Yani tuhaf dememe","bakmayın","da, bir anda televizyonda tarih"
"s","S-BEABXX-0411-837","Di mi? Bi de biriyle","bakıştığım","zaman göz göze geldiğim zaman"
"s","S-BEABXO-0339-2468","değiştiririz işte böle. Iı internete","bakar.","Yerimizi değiştiririz işte böyle. Allah"
"s","S-BEABXB-0073-1924","değişmiş dikkat ettiysen. Yıkandığı için","bak","beyaz beyaz olmuş. Bundan bi"
"w","W-PD03A3A-0867-994","değişime uyum sağlayan, geleceğe umutla","bakan","bir kuşaktır. 1995-2003 milenyum kuşağı"
"w","W-QA16B2A-3350-1918","değişen politik tavrım."" Pathummal gülerek","baktı","ona. ""Biz Eksi 8000 dünyasının"
"s","S-BEABXB-0073-1686","değiyor. İlginç. Sağa sola şöyle","baktığım","zaman adamlar hep yukarıya bakıyor."
"s","S-ACABQq-0423-2106","değinmek mecburiyetim var. Ben, Sayın","Bakanın,","herhalde dikkatinden kaçtı diye düşünüyorum."
"s","S-ACABPA-0434-185","değinmek istiyorum. Birincisi, işin pratiğine","bakarsak,","bir seçim ortamına giriyor muyuz?"
"s","S-AEABTZ-0040-721","değinmedi. Bu yönetmeliği ve son","bakanın","ve otomatik enerji fiyatla elektrik"
"s","S-AEABTZ-0040-425","değilse olmaksa eğer, o zaman","baktığınızda","hidroelektrik potansiyelinin tümünü kullansanız, var"
"s","S-ADABPZ-0135-432","değildir. Şimdi Dünya'ya bu çerçevede","bakarsanız","yani hesaplanabilirlik, öngörülebilirlik ve verimlilik"
"w","W-PE39E1B-2901-590","değildir. Aslında meseleye tamamen dışardan","bakan","mekanik bir gözlemci için, ortada"
"w","W-KI09C2A-1544-801","değildi. Çocukların bütün itirazlarına, benim","Bakan","nezdindeki temas ve ricalarıma, hatta"
"w","W-VI44F1D-5120-1590","değil. Çünkü, ülkemizdeki kaza oranlarına","bakıldığında","kazaların %40'ı trafik kazaları, %20'si"
"s","S-ADABLp-0062-1851","Değil. Niye? Ekmek yeme <B>","bak","<Gülme> tamam mı? Peki arkadaşlarım"
"w","W-QA16B2A-3350-933","değil. İnsanlar inanç ufukları içinden","bakar","dünyaya. Herkes görmek istediği şeyi"
"s","S-BEABXO-0056-218","değil. Hep burayı yaptırdım burayı.","Bak","ne güzel ben kıllı erkekleri"
"w","W-PI22C3A-0210-1070","değil. Biraz geri çekilip böyle","bakmak","lazım. Özgürlük filan dediğiniz şeyler,"
"s","S-BEABXO-0440-2024","değil, önemli değil. Götü kalktı","bak","pozisyona girdi ya. Hmm güzel"
"w","W-JA16B2A-0873-28","değil, çalışma, yetenek ve bilgilerine","bakılacağını","bilerek kendilerini yetiştiriyorlar. Akıllı sistemlerin"
"w","W-SE39E1B-2904-2275","değil, sanayileşme benzeri dinamiklere de","bakmak","gerekiyor... Gelelim ona... Dünya ile"
"w","W-JA16B3A-0999-1852","değil, on beş gösteriyordum, dışardan","bakana.","Babamla gidip geliyordum, ama benden"
"w","W-JA16B4A-1720-1794","değil, o da bana bakıyor.","Bakar","tabii... Ben yaşımı hiç göstermem."
"w","W-RG22C4A-0022-2423","değil, kötülüklerden söz edene bakan,","bakıp","da küsüveren kadınlar... Onlara bu"
"s","S-ADBBAo-0443-1554","değil, eşya gelecek akşama dedim.","Bakar","mısın dört dörtlük plan. Evet"
"w","W-RI09C3A-0837-1812","değil, deyince, Hacı Kemal Bey","Bak","kardeşim, ben Allah'ın bana ihsan"
"s","S-BEABXz-0387-929","değil Zeynel Seynel... Haa bak","bak","bundan sonradan çıkacak Minnas mı"
"s","S-BEABX{-0085-2268","değil yapamıyorlar iş yapmasını bilmiyorlar.","Bak","burda fırın yok burayı komple"
"s","S-BEABXO-0389-1254","değil sayıya çevirebilirim. Çiftlerini bozma","bakalım.","Elim açık ama. Hıı? Elim"
"w","W-EI22C4A-0864-1972","değil miyiz? Dönüp sağa sola","bakmıyoruz,","ama hayır, herkes kendi âlemine"
"s","S-AAABOp-0011-320","Değil mi? Nasıl derken? <B>","Bak,","yani kendisinin o şekilde hareket"
"s","S-BEABXO-0006-2052","değil mi? Ev sahibi fal","bakacak","mı? Önce bi kendime bakyım"
"s","S-ADABAo-0033-2500","değil mi hocam? Dolayısıyla buradan","bakıldığı","vakit, Ehli Beyt'i ve Ehli"
"s","S-ACABUZ-0035-804","değil meslekleri nasıl icra ettiğine","bakmalı","diye düşünüyorum ben. Bir insan"
"s","S-BEABXz-0387-809","değil hemen yapılacak bişe... Ama","bak","aslında şeye <B> yazabilirlerdi eğer"
"w","W-HE09C3A-0579-347","değdiği noktada, Ecevit'in dönüp bize","bakacağını","umuyorduk. Görmedi, ya da unuttu."
"s","S-ADABPZ-0374-407","deyinmeden önce bu iki konuya","bakalım.","Afganistana bakın eğer Orta Asyadan"
"w","W-RA16B3A-0627-224","deyince, akla genç, güzel, yüzüne","bakınca,","bir daha bakmak isteyeceğin bir"
"w","W-SE02A2A-1165-398","devşirirken hangi etnisitiden olduğuna hiç","bakmaz.","Nitekim pekâlâ Orta Anadolu'da Karamanlı"
"w","W-EE05A1B-3451-694","devletçilik ve demokrasi ilişkisine nasıl","baktığını","şu şekilde açıklıyor ""Görülüyor ki,"
"w","W-TE36E1B-3295-1616","devlette var. Tabii ne anladığınıza","bakar!","Her devletin, kendi vatandaşına karşı"
"s","S-ACABQq-0425-2086","devam ediyoruz. Dolayısıyla, söylenen üsluplara","bakıldığı","zaman, konuşmalara bakıldığı zaman, dağ"
"s","S-ADABCo-0360-1158","detayları alt rakamları da var.","Baktığımızda","tarım dışı işsizlik oranı %16.4"
"w","W-ND36C2A-3363-1653","destek veren bir konuma getirildi.","Bakın","bu olaylar, Türkiye içerisindeki birkaç"
"s","S-BEABXW-0069-1071","desene okey o diye. Ben","bakmıyodum","ki gerizekalı baksana şuraya. 4"
"s","S-BEABXO-0075-507","desem. <gülme> <gülme> Şeylere falan","bakcam","işte. <B> Şeyden mi bakcan"
"s","S-BAABXj-0001-1788","ders çalışıyorum. <B> Buarda ÖBS'den","bakamıyorsun.","ÖBS yenilenmiş zaten. E <B>"
"s","S-BEABXO-0390-1301","ders seçerim falan diye. Bi","baktım","gittik dedi yo yo dedi."
"s","S-BEABXw-0353-1511","derlerdi. Geçen yemekhanede burcuya nası","bakıyor.","Şöyle de bi de yapıyor."
"w","W-EA16B3A-0570-861","derken izleyici de sıkıldı, ben","bakmaktan,","kamera çekmekten yoruldu. Böyle bir"
"s","S-BEABX{-0085-761","derece. Ya ne kalkar ya...","Baksana","diyorlar yoh bankaya para ödeyecen"
"w","W-SF05A1B-4665-128","derece zor olması nedeniyle, bugüne","bakarak","2020 yılının turizm devlerini doğru"
"s","S-BEABXO-0325-1444","derece var ama, alt sınıflara","bakın.","Tabi canım onlara göre ama"
"s","S-BEABXO-0093-2465","Deniz yıldızı. Deniz yıldızı. Tamam.","Bak","saklandı. Bak burada diyor ki;"
"s","S-BEABXB-0077-767","Denir ne denir ki bu?","Bak","şurayı şey yapsana bak görüyor"
"s","S-AEABTZ-0040-412","dengeyi neyle kuracağıma da iyi","bakarım.","İthal enerji kaynaklarıyla yerli enerji"
"s","S-ACABPA-0434-88","denetim mekanizmalarının mahiyetiyledir. Türkiye Cumhuriyeti'ne","baktığınız","zaman, Mustafa Kemal Atatürk, İsmet"
"w","W-ZI45F1D-4811-1439","denemenin başarısızlıkla sonuçlanmasından sonra etrafa","bakınırken,","yoldan geçen bir traktör görür."
"s","S-BEABXs-0130-223","dene şansını benden sana tavsiye.","Bak","tipin Müjdat'ada uygun. Böyle tipler"
"s","S-ACABQq-0429-1671","Demokrat Türkiye Partisinin... Kürsüye bir","bak,","kürsüye! Efendim? Kürsüye bir bak."
"s","S-BEABXO-0091-616","demiş. Dur demiş ben bi","bakayım","demiş. Hafiften papağanın perdesini bi"
"s","S-BEABXO-0120-234","demirden yapıyor. Ordakiler gelip demirlere","bakıyor.","İçi boş demirler var bide"
"w","W-BE39C1A-0857-2108","demekle birlikte, proje bazında olaya","bakıldığında,","üretim miktarıyla kâr sağlanıyorsa, yatırımın"
"w","W-SA14B1A-1585-2491","demek hala, ne demek! Kusura","bakmazsan","ben hemen gideceğim. Emmim nasıl"
"s","S-BEABXO-0168-788","delmedi. Her yanı karalamışın buraya","bak.","Ayy! Pühh, hadi dondurma yemeden"
"s","S-BEABXJ-0076-95","Delilere benziyo. Eveet. Bak bak","bak","şimdi nasıl dövecek. <D 10>"
"w","W-CE09C3A-0382-1317","deli numarası yapıp vakit kaybetme.","Bak","ben buraya bu kabini kuracağım"
"w","W-OA15B1A-1409-535","Defalarca ölünmüş, olunmuştur bu odalarda","Bak","şu sandalyede Acıyla titremiş bir"
"w","W-KE05E1B-3299-860","def'e kaadir olalar. Bu taraftan","bakınca","Yiyecek içecek sektöründe ""iftar"" bereketi"
"s","S-BEABXp-0156-1091","dediği gibi çiftli çiftli kimse","bakmamış.","Evet o açıdan bakmayı düşünüyorum"
"w","W-RA16B1A-1496-1067","dedim; Fiyatları da iyidir. Yüzüne","baktı,","söylemek istediği sözleri aklında toplayarak"
"s","S-BEABXg-0090-419","dedim. Orda oturuyorum dedi. Hıı.","Bak","dedi kimseye yapmadım seni dedi"
"s","S-BEABXn-0349-1531","dedim. Kantindeyiz ha. Sonra gel","bakıyım","sen benle biraz konuşacaz senle"
"s","S-BEABXO-0071-202","dedim. Dedim sana dedim kim","bakacak","dedim. Erkeksin dedim. Paran bile"
"w","W-HE09C3A-0579-2131","dedim. Ali Eraslan şaşkın, yüzüme","bakıyordu.","Odama döndüm. Biraz sonra demeç"
"w","W-RD39C4A-2646-893","dedim. ""Orada kalır"" dedi, yüzüme","bakmadan.","""O kadar mı?"" ""Evet."" Suskunlaşmıştı."
"w","W-UG37E1B-3049-852","dedim, o da dinlemedi beni.","Baktım","yüreğini gördüm, baktım gözlerini. Duvarlar"
"s","S-BEABXw-0398-271","dedim, ben hiç çekiniyo muyum,","bak","bana. Dedim bak -Atacan diye"
"s","S-BEABXO-0092-2006","dedim kızım al konuş. Ama","bak","dedim büyük anneanne seni çok"
"s","S-BEABXg-0072-1120","dedim hızlıydı dedim hatta. İndim","baktım","arkadan şey yazmışlar... Hızlı geldi."
"s","S-BEABXw-0353-1969","dedim herkes ne yaparsa. Şimdi","baktıydım.","Baktıydım Sinan'lan ne kız pek"
"s","S-BEABXO-0144-904","dedim ben de. Hıı. Baa","bakalım","hangisi? Daa aşağa inmedi heralde,"
"s","S-BEABXO-0392-179","dedim ama Allah aşkına... Şuna","bak","ya duyulmayacak gibi değildi. Uyandırdın"
"s","S-BEABXg-0090-1796","dedi. İyi güzel. Ondan sonra","baktım","taa Tarsus'a dedi sen dedi"
"s","S-BEABXw-0409-1608","dedi. Hocam <gülme>. Gürsel şöyle","baktı","tipime. Oturabilirsin kardeş dedi. Oturdum,"
"w","W-TA16B4A-0910-2225","dedi. Bense bu kadar basit","bakmıyordum","konuya. Ne de olsa Kenan"
"w","W-RA16B1A-1211-990","dedi. Ak sakallı ihtiyar gülümseyerek","Bak","yavrum doğruyu söylemekle şikâyet etmek"
"w","W-EA16B2A-1007-1583","dedi. ""Uyuma!"" Adam, oğluna gülerek","baktı.","Yaşar! Çocuğu da yok. Belki"
"w","W-UA16B1A-3337-501","dedi. ""İnecek miyiz aşağıya? Hem","bak,","sapasağlam geldim."" ""Tamam, tamam. Gece"
"w","W-WI44F1D-4753-1068","dedi çıktım. Sonra ben fal","baktırmak","istedim kadının odasına gittim bana"
"w","W-TA16B0A-0122-481","dedi Moris. Nancy pencereden göğe","bakıyor","ve işte bir çığlık, daha"
"w","W-LA16B1A-1252-918","dedi Korkut Çetin'e sert sert","bakarak.","Öteki hiç aldırmadı. İki adım"
"s","S-BEABXO-0056-1110","Dedi ki sana bi daha","bakmam.","Kime kime? Dedi ki falcı"
"w","W-JA16B1A-1718-696","dedi Hamit, beni destekleyerek. ""Gidip","bakalım","mı?"" dedi sonra. ""Ya bize"
"w","W-HD36C4A-0064-2009","dedi Eda. Tabagımdaki ızgara köftelere","bakarak...","Mesajı çakar gibi oldum. Ne"
"w","W-PA16B4A-0291-1358","dedi adam, sırayla ikimize de","bakıp.","""Ben iki oda ayırtmıştım."" ""Öyle"
"w","W-RI09C1A-1473-1096","de. Yüzüme muzip bir tebessümle","bakıyordu.","Sanki ""Sen çok meraklandın. Al"
"s","S-BEABXO-0444-1868","de. Ama ama... Ama ağlarım","bak","hayatım. Ağlama şeyi yapalım. Yer"
"w","W-ND41C0A-0335-449","de. ""Bu maçı unuttuk, önümüze","bakacağız,","yolumuza devam edeceğiz"" diye çevirdiler."
"s","S-BEABXc-0167-534","de. <gülme> Firdevs. İnanmıorum. Hepsine","baktım.","<D 9> Sen ismini yaz."
"w","W-ED36E1B-2847-114","de, memurlarına da, bu çerçeveden","bakılmakta","ve değerlendirme yapılmaktadır. Gerçi Türkiye'de"
"s","S-BEABXO-0080-2226","de şuanda hatırlayamadım. <D 10>","Bak","bak. Eskilerden ya. Bu Ercan"
"s","S-ADBBI^-0042-1242","de üyesiydi. Evimizdeki hayvanlara esas","bakan,","bunlarla ilgilenen de babamdı. Annem"
"w","W-PG37C4A-0201-488","de örneğini oluşturuyor. Bu açıdan","baktığımızda","da, Leni Riefehstahl'ı Istvan Szabo'nun"
"w","W-OA16B1A-1221-1700","de çevreme başka bir gözle","bakmaya","başladım. Ağaçlara, kuşlara, balıklara, karşı"
"s","S-BEABXu-0435-640","de çek! Hadi bakim şimdi","bak","en iyi bundan çekerim ha."
"s","S-BEABXO-0392-971","de yeniyorum ha. 1-0 yeniyorsun.","Bak","bu kadar konuşuyor. Yendiğim halde"
"w","W-GA16B1A-1926-1938","de yakışmışsın o koltuğa... Haydin","bakalım","duydum duydum, sesler duyuyorsunuz, ha,"
"s","S-BEABXu-0435-2480","de valla. Tarot falı gibi","bakıyo","yukardaki kız. Hangi kız? Hadi"
"w","W-MA16B3A-1550-2435","de uygun bir yer arayalım.","Bakarsın","şansımız yaver gider, kurtuluruz. Kim"
"w","W-FI09C3A-1292-1793","de tanıttı. Komiser bize de","bakmadı.","Fehmi konuşuyor. CMUK (sonradan ünlü"
"w","W-HH42C2A-0709-450","de sonra git! Bir de","bakar","ki rahmetli Hacı Muzaffer Ozak."
"s","S-BEABXO-0089-1307","de seyretti biraz. Bilmem. Maça","bakacam","diye gitmem diyordu... Kızının yanına."
"w","W-LA16B4A-1045-2087","de sevmeyecekti ileride- nereden bakılırsa","bakılsın","her şeyden önce bir yer"
"s","S-BEABXd-0170-2165","de orda şey Sude anlamına","bakın.","Bak sen Firdevs ablası, Sude"
"s","S-BEABXO-0449-1491","de onu dedim. Belki dedim","bakarsın","ben oraya gelirim, orda iş"
"w","W-OD02A2A-2052-315","de oluşturulabilir. Diğer ülkelerdeki uygulamalara","baktığımızda","gelişmiş batı ülkelerinde okul müdürlüğü"
"w","W-GE39C3A-0410-1831","de Kültür Bakanı'nın şu sözlerine","bakın","""Kur'an-ı Kerim gelmeseydi bilgisayar olmazdı."
"w","W-NE43C2A-1884-426","de kullanabileceğini söyledi. Siz nasıl","bakıyorsunuz?","BELGE Tabii dünyanın bu bölgesinde"
"w","W-FA16B1A-1202-847","de kapatmak zorunda kaldım. Şimdi","bakıyorum,","on yedi yıl geçmiş aradan."
"w","W-JA16B3A-0999-1020","de kalsın, sonra bir daha","bak,","iyi bak yavrum. İyice bak,"
"s","S-BEABXs-0130-1956","de işte. Ben on günde","bak","on gün sonra sınav var"
"w","W-PE39C4A-1427-881","de işaret ettiği gibi, içeriden","bakıldığında","hareketi birçok yöne doğru çekiştiren"
"s","S-BEABXO-0418-352","de hemen buraya telefon ediyo,","bak","işte araya daha taziyede oturuyorlar."
"s","S-ADABDp-0432-1310","de hamlık yapacaktır. Şeker bi","baktınız","350 olacak. Bi baktınız 60"
"w","W-RA15B4A-0542-1200","de göz ucuyla sürekli etrafına","bakınıyor","ve Haset'in de onlara katılıp"
"s","S-ADABAo-0388-1161","de görüyoruz. Seyahatnamelere bu gözle","bakınca","seyahatnameler eğer basılmış yayınlanmışsa basılmış yayınlanmışsa tarihçiler"
"s","S-BEABXO-0056-712","de gidyim ilaçlarımı içyim. Bak","bak","ne kadar ben çıkmış sende."
"w","W-SD02A1B-4588-1015","de geçerlik ve güvenirlik değerlerine","bakılmıştır.","Bu çalışma sonuçlarına göre ölçeğin"
"w","W-RA14B1A-1582-1684","de geleyim. NEFIN Tamam. Kusura","bakmak","yok ama... HAÇUG Biz yabancı"
"w","W-VA14B1A-1598-467","de geldi. OLTAN Kamp dönüşünde","bakarız.","ŞULE Kamp dönüşünde olmayacağını parayı"
"s","S-BEABXW-0069-557","de ettiği yok ki. Öyle","bakıyo.","Hepimiz <B> bu kadar ne"
"s","S-BEABXO-0093-2089","de denizin içinde yaşar. Midye","bak.","Aa! Bu ne sayfa böyle"
"s","S-AEABTZ-0040-1165","de bunu sunarken yanlış yapıyorlar.","Bakan","geçen komisyonda dedi ki ""kardeşim"
"w","W-SI32D1B-2551-1213","de bu derecede emin olabildiğinize","bakarak","birtakım dokunuşlarla yakınlık kurmanız, cinselliği"
"s","S-BEABXO-0375-554","de bu akşam yedi. Öbürü","bağarsın","arkadan. Bağarsın bana ne. Ben"
"w","W-HI09C2A-0805-1862","de boyamaya başlamamışlar mı? Orhan'a","bakıyorum.","""Üzülmeyin Ercüment bey"" diyor. ""Ben"
"w","W-MD37C0A-0157-1230","de birden üzüldü ve kocasına,","""Bak","şu Gılgameş'in haline. Sözde kendine"
"w","W-OA16B0A-0112-2114","de biliniyor. Çekildiği dönem açısından","bakıldığında","Kuyu aslında sıradışı bir film."
"s","S-BEABXO-0006-2445","de banyoya girecem. Ayıp oldu.","Bak","bak gündüz girme banyoya. Gir"
"s","S-BEABXy-0146-647","de bakman gerekiyo. Haa, ordan","bakmayı","planlıyodum yani. Gerçi fotoğrafların altında"
"s","S-BEABXO-0084-1661","de 2 tl. Bakıyım. Yok","bakma","ya boşver sen ne anlarsın"
"w","W-TA16B4A-0910-550","Dayın kaval çalıyor. Arkanda. Dönüp","bakıyorsun.","Yok. Dayının kaval sesi bu."
"s","S-BEABXn-0102-2212","dayıma aldım ya. İyi tamam","bakalım.","Oley tamam. Toparlayın poşetin içine"
"s","S-BEABXO-0056-2211","dayı... Kız bir ara şeye","bakmışlar","Pınar'a Pınar'a. Aynı işte dediler"
"s","S-BEABXO-0056-1923","Dayı sana inanamıyorum! Kolay gelsin.","Bak","anneannen gelmiş kızım. <gülerek> Hoş"
"w","W-RA16B1A-0153-554","dayayıp bir süre boş boş","baktı,","neredeyse ağlamak üzereydi. Kendine geldiğinde"
"s","S-BEABXJ-0076-1577","davranıyo çocuklarına. Delilere benziyo. Eveet.","Bak","bak bak şimdi nasıl dövecek."
"w","W-XI45E1C-5070-1422","David Beckham bile ""Ben böyle","bakmıyomuşum","gibi yapıyım sen de çek."""
"w","W-NI09C3A-1445-1600","Davası 1970'li yıllarda birçok davaya","bakmıştım.","Bunların içinde bizim Ashworth Davası"
"w","W-KE05A2A-2053-951","dava konusu edilebilmektedir. Bu tabloya","bakıldığında","İspanyol Anayasası'nın, anayasa şikayeti için"
"w","W-WI44F1D-4753-680","dar dükkanların yanından geçerken vitrinlere","bakıyorum","ama hep beyaz kumaşlarla kapatmışlardı"
"w","W-FA16B1A-1920-1142","damlara bakan oda değil, caddeye","bakan","oda, aa kendi odası caddeye"
"w","W-JA16B1A-0862-2115","damdaki leylekler, Yavru Leyleğe üzgün","baktılar.","Sonra Ana Leylek göç yollarının"
"w","W-SA16B2A-0516-599","dalgın bir şekilde Ahmet amcaya","bakıyordu.","Ahmet amca da Atilla'nın yaralı"
"s","S-BEABXn-0067-2313","dakka. Kafayı kaldırdım tahtaya bi","baktım","sınav süresi 3 saat diyo."
"s","S-BEABXO-0345-2472","dakka ağbi. Pardon sözünü kestim.","Bak","burda ana başlık... Ana başlık"
"w","W-TA16B1A-0835-2095","dakika! Ellerin temiz mi senin?","Bak","tırnakların simsiyah görünüyor. Sebzeci, bir"
"w","W-PG37E1B-2923-119","dahil, hiç kimse dönüp ardından","bakmadı","bile... Kimse tek laf etmiyordu."
"s","S-ADABAo-0312-2396","dahi öğretemiyor. Biz kendi konseptimize","baktığımız","zaman bizim bünyemizde Marmara eğitim"
"w","W-MA16B1A-0270-1983","Daha şık bir şekilde söyleyebilirsin.","Bak","şimdi sorun şu İnsanlar artık"
"s","S-ACABPZ-0329-530","daha çok yeni. Ama Dünya'ya","bakacak","olursak emm yüzyıllar sözkonusu. Bu"
"w","W-KD03A0A-0261-583","daha yapacak çok işleri vardır.","Bakalım,","bir kadife kelebeği erkeği eşini"
"w","W-IA16B3A-1015-962","daha var mı gibilerden yüzüme","bakıyorlardı.","""Hele durun siz!"" dedim, ""Bu"
"w","W-SE09C3A-0408-42","daha var İnsanların gözlerinin içine","bakamıyorum","ben. Eğer gözlerinin içine bakarsam"
"s","S-BEABXO-0447-1039","daha uygun bi fiyata olabilir.","Bak","o gün yaptığımız Gamzeyle şey"
"s","S-BEABXO-0415-2353","daha tadına bakmadım. Ne orda","baktım,","ne burda. Vallaha şey de"
"s","S-ADABLp-0062-639","daha soğuktur arkadaşlarım. Şu anda","bakın","hamsi Akdeniz'den gitti, nereye gitti?"
"w","W-ME39C5A-0196-2413","daha sonra partisinden milletvekili ve","bakan","yaptığı Mehmet Ağar'ı bulunduruyordu. MİT'in"
"s","S-BEABXO-0071-1875","Daha olmadı. Yani internetle mi","bakıyorsun","postacı mı eve mi getiriyor?"
"s","S-BEABXz-0387-1216","daha merhametli. Hah! Bak onu","bak","Senem <B> Baybora'yı <B> hayır"
"w","W-PA16B4A-0511-1567","daha içebilirsin,"" diye çeviriyorum. Vahit'e","bakıyorum.","O bana bakmıyor. O öyle"
"s","S-ACABQq-0425-449","daha hatırlatıyorum, 13 Nisan 2005.","""Bakalım,","öngörülen değişiklikler, gerekçelere ve gerçeklere"
"s","S-BEABXu-0435-1622","daha güzel görünüyo? Ülkü! Bana","bakma","ben bakmıyom o bana bakıyo."
"s","S-BEABXw-0408-646","daha geri oturmam. <D 5>.","Bak","kardeş. Bak kız güzel kız."
"s","S-BEABXO-0007-1326","daha dikkat ederim. Hizmetçilerin var.","Baksana","Suna sanki bacaklarım kara görünyor."
"w","W-NA16B0A-0314-385","daha derinde var bu, oraya","bakalım!""","Birincisi yabancı ideale duyulan koşulsuz"
"w","W-RE30D1B-2121-295","daha da şiddetlendirdi"" diye konuştu.","Bakan","Gül, Türkiye'nin, Müslüman çoğunluklu nüfusuyla,"
"w","W-KD02A1B-4476-820","daha da pekişmiştir. Bu açıdan","bakıldığında","""THKP-C geleneği""nin geleneği""nin 1980'li yıllara"
"s","S-BEABXw-0395-104","Daha da kötü duruma gelecektik.","Bak,","ufak, güzel sözlerin ne kadar"
"w","W-QA16B2A-1435-1287","daha da karıştı. Birbirlerine endişeyle","baktılar.","Ateş, Sonra, monra yok işte."
"s","S-ACABFZ-0049-858","daha bulunmaktadır. Genellikle soyut tahlillere","bakarak","karar verilmez. Toplumun bir şeyi"
"s","S-BEABXu-0435-2231","daha bak. Bi daha istesende","bakmam.","Fal bakan var mı ya?"
"s","S-BEABXs-0130-1429","daha arkadaş var emm bir","baktım","bu girdi içeri tabi ben"
"s","S-BEABXz-0387-398","daha 12 yaşlarında falan dur","bakayım.","Çay veriyim mi? Sağol! Sağol"
"w","W-NA16B2A-1242-531","da... Biraz rötar yaparsam, kusura","bakma","ama."" ""Önemli değil, canım. Seni"
"s","S-BEABXO-0378-443","da... Bilemiyim. Ben de bilemiyom.","Bakalım","ya. Ama bugün televizyon dedi"
"s","S-BEABXT-0066-1065","da. Yani. Ama bu hayata","baktığından","senin bi 10 yılın gitmiş."
"w","W-MA16B1A-0689-753","da. Karıncaezmez Şevki, Küsme Galatasaraylılara.","Bak","onlar da zorda. Çarşamba gecesi"
"s","S-ADABAo-0307-486","da şirket kurmak istiyorlar. Buradan","bakıldığı","zaman Türk sigorta pazarı krizin"
"s","S-ADABDp-0187-796","da Şehriban şöyle bir falımıza","baksın.","Yes yes. What is your"
"s","S-ADABPZ-0134-2303","da üzerime üzerime gelen olgulara","bakıyorum,","yaşanılamıyacak bir dünya kirletiliyor, tahrip"
"w","W-TE36E1B-3353-1237","da önermelerine biraz daha yakından","bakmak","gerekiyor. Adeta bir Sisyphos görevi"
"s","S-ADABLp-0061-867","da önemli bir zımbırtı. Geldik,","bakın","tekrarlıyorum. En çok göç alan"
"w","W-VI45F1D-4788-1964","da çok alışkın değilmişim. Öyle","bakakalıyordum","bu aşk ile coşma anlarında,"
"w","W-RI45F1D-4905-399","da torununuzun fotoğraflarına, filmlerine, yazılarına","bakıp","""bunlar benim gibilerden çıkmış"" deyip"
"w","W-QE09C4A-1157-143","da tam karşıma oturuyor. Onlara","bakarken","şöyle düşünüyorum Eskiden eşkıyalar kuşak"
"s","S-AEABUZ-0038-2449","da sosyo-ekonomik ülkeler gelişmiş ülkelere","baktığımız","zaman, bi çoğunda cumhurbaşkanından sonra"
"s","S-BEABXO-0347-1240","da sevmiyorsun. <gülerek> Evet. Cidden","bak","bi daha yapmicam, güzel mi"
"s","S-AEABUZ-0022-1437","da Port Mersin Porttan adamlar","bakın","14 Mart 1009 2009'da bunların"
"w","W-KA16B2A-1335-2295","da omzunda koca patisini. ""İşine","bak","aslanım! Kız sana kapıyı açıyo"
"s","S-BEABXW-0069-1748","da okeye dönüyo. Gsöterge gösterdi","bak.","Gelecek mi artık? Bitmedin. <B>"
"s","S-BEABXO-0056-2420","da o reklamları göryor... Çiçeğin...","Baktı","baktı. Ben çevirmedim ben çevirmedim."
"s","S-ADBBI^-0326-2193","da mutlaka bir nedeni vardır.","Bakın","hiç unutamayacağım birini anlatayım. Yeşil'de"
"w","W-QI22C2A-0670-240","da kutsal kitaplardan herhangi birini?","Bakın","bir hadiste nasıl buyuruyor Sevgili"
"s","S-BEABXO-0345-1228","da kalınlaştırabiliriz. Kendimi kötü hissettim","bakmayın","bana. <gülerek> Devam et devam"
"s","S-BEABXW-0173-1729","da işte üç ay <B>","bakıyolarmış","çok işe yarıcak bi tipse"
"s","S-BEABXO-0348-1033","da itici bir şeyi var.","Bakıyorsun","böyle adama, tipi ben iticiyim"
"w","W-OA16B4A-0072-751","da ikram ederiz."" ""Bir konuşayım","bakayım","içlerinden biriyle. Şu esmer olanı"
"w","W-KA16B1A-0722-256","da herkes orda toplanan âşıklara","baktılar.","Âşıklar, öylece suspus olup kalakaldılar..."
"w","W-TA16B4A-0090-1921","da Handan'a kaçamak ama dikkatle","baktı","Volkan. Bir kadının yumuşak sıcaklığını"
"s","S-ADABPZ-0134-1934","da felsefe tarihine, düşünce tarihine","baktığımızda","gerçekleşmemiştir. Şöyle tuhaf bir durumla"
"s","S-ACABPZ-0329-617","da elimizi yıkıyamıyoruz tabi. Bir","bakıyoruz","çocuklarımızın enstrümanlarında kirli kirli emm"
"s","S-BEABXO-0445-1351","da donuma kadar alıyo. Yalana","bak","kim kimin donunu alıyo? Allah"
"w","W-GA16B3A-0020-1174","da değil, bambaşka bir şeye","bakar","gibiydi. Bu haliyle müzik kutularının"
"w","W-TE36E1B-3295-931","da canımı sıkıyor. Ermeni diye","bakmıyorum;","bir Türk vatandaşıydı. Gazetecilerin hedef"
