"Register","Text","Left","-5;5","Right"
"w","W-SD02A2B-4594-2300","• Kültürel turizm temel olarak","korumaya","olanak sağlar ancak iyi yönetilemediği"
"w","W-SE05A1B-4201-1501","“Direktifin sağladığı sui generis hakla","korumanın","amacı, daha sonra bir veri"
"w","W-OA16B3A-0394-1161","şöyle der ""Vatanı, namusu, bayrağı","korumak","farzdır. Ben fetva veriyorum. Hiçbir"
"w","W-PH42C3A-0819-126","şöyle buyurur ""İhsan insanlık vasfını","korudukça","kabul edin. Fakat bu, dine"
"w","W-CG22C3A-0622-1249","şövalyelerinin kenti. Bütün tarihsel görkemini","koruyor","eski semtleri. İki güzel gün"
"w","W-LD03A4A-0254-2321","şunu söylemekle yetinelim. Kişinin sınırlarını","koruması,","bu sınırların diğerleri tarafından tanınması"
"w","W-KA16B4A-0470-1796","şu videonun zararlarından çocuklan nasıl","koruyacağız?","Üç kuruş para kazanmak için"
"w","W-EA14B1A-1616-1531","şişeleri toplayıp buraya yığmanın çevre","korumaya","ne katkısı olacak ki? Fazla"
"w","W-NF32D1B-2736-601","şirketlerin sosyal sorumluluğunda önceliğin istihdamı","korumak","olduğu konusunda kimsenin kuşkusu olabilir"
"w","W-PA16B0A-0160-450","şirketlere, hatta çokuluslu şirketlere sistemlerinin","korunması","için işler yaparız. Hackerler çoğaldıkça,"
"s","S-BEABXO-0379-89","şimdi izliyoz ya ani ""melekler","korusun""da","korusun""da arcı marcı. Kim ne"
"w","W-QE30D1B-2107-2218","Şii lider Ayetullah Sistani'nin halkı","koruyamamakla","suçladığı ABD, yabancı savaşçılara karşı"
"w","W-LC06A2A-1976-655","şiddetli yağmur vb. hava etkilerinden","korunması","ve kullanılacağı zaman yeniden karıştırılması"
"w","W-OH42C3A-0757-2301","şeylerden sakınırsa dinini ve ırzını","korumuş","olur (yani kimse onlar hakkında"
"w","W-TE39E1B-3037-1469","şeylerden sakınan kimsenin dinini, ırzını","koruyabileceğini,","şübühâta düşen kimsenin ise, harama"
"w","W-VC40E1B-2881-1712","şeyin gerçekleşmesini engellemek kolay. BELGELERİ","KORUYUN","Az önce tanıttığımız GnuPG yazılımı"
"s","S-BEABXW-0058-69","şeye türbülansa mürbülansa girer Allah","korusun.","İyi sağ salim gelmişin. 12"
"w","W-MA16B1A-0270-851","şeye hazırlıklı olması gerekir. Masumları","koruması","gerekir. Suç oranları gittikçe artıyor."
"w","W-SH42C4A-0495-1502","şeyden önce şu amaçların önemle","korunmak","istendiğini görürüz. Bunlar da; dinin,"
"w","W-SA14B1A-1586-916","şeyden korkmana gerek yok, ben","korurum","seni. Sincap Teşekkür ederim. Tilki"
"w","W-PD36E1B-2858-1113","şeyden evvel Müslümanı, kimliğini nasıl","koruyacağı","meselesiyle başbaşa bırakır. Ne var"
"w","W-KD30D1B-2172-1207","şey yapmamak olmaz. Hem çevreyi","koruyacağız,","hem yatırım yapıp iş alanları"
"s","S-ADABAo-0355-105","şey yaparlar müzeyi, dernekler çalışırlar,","korur","gardiyan olarak çalışır öle yani"
"w","W-QE02A0A-1783-1018","şey düzelmemektedir; diğer yandan, ""azınlıkların","korunması""","politikası uygulanırsa, yani gerek yasa"
"w","W-HH42C3A-0418-514","şerefli bir okuma parçasıdır İhtimamla","korunmuş","bir kitaptadır Ona iyice temizlenenlerden"
"w","W-ME09C4A-1026-174","şeref masasına yöneldiyse de yaklaşmasıyla","korumalar","tarafından ""get get"" diye geri"
"w","W-IE39E1B-2837-1849","şekline almıştır. Tabiatıyla onun özünü","koruması","mümkün değildi. Tahrif edildiğinden bağrında"
"w","W-TG37E1B-3067-2166","şeklindeki tepkimle öğrendim. Kalıplar dikkatle","korunuyor.","Bende tecrübelerimle hareket ediyorum oradan"
"w","W-GE05A1B-3492-459","şekilde mücadele etmek ve otoritesini","korumak","için gereken hukuk kurallarını yasalaştırmak"
"w","W-HF10A2A-1850-1351","şekilde kişileri sosyal risklere karşı","korur","ve gözetir. Sosyal yardım ve"
"w","W-UE05A1B-4296-2429","şekilde bölge halkını da kıyı","koruması","ile sorumlu tutan bir uygulama"
"w","W-HB04A1A-1537-2175","şekil üzerinde durulacaktır. Ahır dışında","korunması","çevre ve hayvan sağlığı açısından"
"w","W-HE39E1B-2836-2073","şehir. Mimari özelliklerini bugüne kadar","koruyabildiği","gibi adını da değiştirmeden günümüze"
"w","W-MG37C3A-0024-1315","Şeddi örerek kirlenmeden saltık boyutta","korunmayı","başaran Ertuğrul Oğuz Fırat'ta, çevresine"
"w","W-SI44F1D-5122-1173","şaşırtın 15-30 Mayıs geç donlardan","korumak","için üzerlerini örtün 15 Haziran"
"s","S-BEABXO-0056-75","şaşıracaksın nasıl böyle değiştiğine. Allah","korusun!","Allah korusun. Bak. Allah şaşırtmasın."
"w","W-SC29D1B-2444-620","şarkılar WMA, AAC gibi kopya","korumalı","değil; MP3, OGG gibi açık"
"w","W-RI22E1B-2911-1694","ışıktan ve yabancı maddelerle kirlenmekten","korunmuş","olur. Üstelik hiç çaba sarf"
"w","W-IE05A1B-3542-1189","ıı bugüne kadar 23 devletin","Korunmasına","İlişkin 2 Sözleşmesi'ni daha etkin"
"w","W-NI22C1A-0290-2160","ısısını nasıl ayarlıyor? Vücudumuzun ısısını","korumasına","kış aylarında üzerimize giysiler giyerek"
"w","W-QA16B1A-1198-1920","ısırıp zehirliyormuş. Sadece cüceler şehrini","korumak","için o çevrede gördüğü insanları"
"w","W-GE39C0A-0208-304","ıstırap verdiğini belirtiyor, yakınıyorlardı... Müsteşar","Korur,","öğrendiklerini satır satır Başbakan Menderes'e"
"s","S-BEABXO-0093-9","ıslanıyoruz. Islan... Tamam bizi ıslanmaktan","koruyorlar","başka? Üşüyoruz dimi? Üşümekten koruyorlar,"
"w","W-UD39C3A-1189-1261","ırkçı-Turancı Nihal Atsız'dı. ""Tanrı Türk'ü","Korusun""","pankartı altında toplanmışlardı. Orta Asya"
"s","S-BEABXO-0093-7","Üşüyoruz dimi? Üşümekten koruyorlar, soğuktan","koruyorlar.","Evet. Peki. Gel. Evet. Peki"
"w","W-LF10A1A-1825-1092","üzerine, ABD Doları karşısındaki değerini","korumuştur.","Özellikle bazı küçük şirketlerin durumunu"
"w","W-DC06A2A-1355-1543","üzere yerleştiriniz ve şiddetli rüzgârlardan","korumak","üzere çit veya duvarla siper"
"w","W-DE05A3A-1909-1021","üzere gerekli her türlü araçla","koruyacağını","ve bu doğrultuda askeri yardım"
"w","W-OH42C0A-0319-2147","üzere bazı tedbirlere başvurulmaktadır. Bunlar","korunma","ve kurtulma tedbirleri olmak üzere"
"s","S-ACABPA-0434-158","üyesi. Demek ki farklılıklar, yerellikler","korunarak,","bütünleşmeye doğru gelişme sağlanabiliyor. Türkiye"
"w","W-ND02A1B-4525-215","üyelerini sadece hukuki takiplere karşı","korur.","O nedenle, bu dokunulmazlığın kaldırılamaz"
"w","W-OF05A2A-1349-604","Üye devletler, yerel yönetimlere çıkarlarının","korunması","ve geliştirilmesi için birliklere üye"
"w","W-PD02A2A-1167-1431","üstünlüğünü, İnsan Haklarını ve azınlıkların","korunması","ve saygı görmesini teminat altına"
"s","S-ADABAo-0388-224","üstün taraflarını ortaya koyarak onları","korumak istiyor.","korumak istiyor. Burada Türkler'in iyi birer"
"w","W-SI22E1B-2912-320","Üstelik kar, tarım yapılan toprakları","koruyup","nemli tutuyormuş. Yeryüzü ve yeraltı"
"w","W-TF25D1B-2169-1219","üssü ve limanı olma özelliğini","koruduğunu","vurguladı. Halen Samsun-Ceyhan petrol hattı"
"w","W-UF10A2A-1872-216","ürünler sektörü de yüksek payını","korumuştur.","2001 yılından itibaren, parasal olmayan"
"w","W-TD18E1C-4079-676","üretiminde insan sağlığı ve çevrenin","korunması","konusunda Biyogüvenlik Kanunu çıkaracağız. Gıda"
"w","W-TD36E1B-2844-2119","üretimin sürekliliği ve beslenme ortamının","korunup","geliştirilmesine bağlıdır. Kent, kendi aydınlarını,"
"w","W-MB04A3A-1261-2456","üretim ilişkilerinin niteliği, ormanların, varlığının","korunması","ve verimli olarak işletilmesi, öncelikle"
"w","W-KE39E1B-2839-371","üreticisi oluyorlar. Batmaz değil, ""Allah","korusun""","deyin İnanın Titanic'i yazmayı hiç"
"w","W-UF10A2A-1866-1681","üreticilerdir. Ancak, Türkiye, bölgesel avantajını","korumaktadır.","Ayrıca, kalite devamlılığı ve yaratıcılık"
"w","W-TD18E1C-4079-672","ülkeyle ""Yatırımların Karşılıklı Teşviki ve","Korunması","Antlaşması"", 8 ülkeyle ""Çifte Vergilendirmeyi"
"s","S-ADABAo-0433-212","ülkeyi bir araya getiren değerleri","korumak","kollamak. Yani aslında hani Kurtuluş"
"w","W-QE30D1B-2131-1086","ülkenin normalleşmesinin sürdürülmesi ve diyalogun","korunmasının","üzerinde durulduğunu kaydetti. Kafkasya'da kapsamlı"
"w","W-TE36E1B-3295-1786","ülkenin içte ve dışta menfaatlerini","korumak,","siyasal ve ekonomik gücünü artırmak"""
"w","W-GD02A1B-3768-876","ülkenin genel olarak edebi eserlerinin","korunması","hakkındaki mevzuatında yer almamasıdır. Talimatı"
"w","W-RF18E1C-4088-608","ülkemizde de uygulanmaya geçirilmeli. Küçüklerin","korunması","ve kaçakların/sahteciliğin kaçakların/sahteciliğin önlenmesi ile"
"w","W-OE05A1B-4181-1116","ülkelerin uluslararası barış ve güvenliğin","korunması","amacıyla, bölgesel anlaşmalar yapıp, örgütler"
"w","W-KF10A2A-1795-539","ülkeler, Karadeniz bölgesinde deniz yaşamının","korunması","ve geliştirilmesi için bölgesel işbirliğine"
"w","W-TE36E1B-3295-1170","ülkedeki Nobel'li yazarları, azınlık gazetecileri","koruyamazken,","başkalarının külot korumasından alacağımız dersler"
"w","W-GE05A1B-3500-2076","ülkede bu programların aynı şekilde","korunmasını","sağlamak mümkün olacaktır. 5. Bilgisayar"
"w","W-GD02A1B-3768-7","ülkede bu programların aynı şekilde","korunmasını","sağlamak mümkün olacaktır. 5. Bilgisayar"
"w","W-PD05A3A-1094-1375","ülke üzerinde yerleşmiş olan insanların","korunmasını","ve devamını sağlar. Devlet bu"
"w","W-ME05A1B-3920-2457","ülke sanayilerini dış rekabete karşı","korumaktır.","Vergi ya fiziksel birimler üzerinden"
"w","W-FC06A3A-1058-618","ülke olmakla birlikte, sulak alanların","korunması","açısından ciddi sorunlarla karşı karşıyadır."
"w","W-PE30D1B-2086-2185","ülke de Irak'ın toprak bütünlüğünün","korunması","ve Kürt devleti kurulmamasına dikkat"
"w","W-[I12F1D-4844-1493","öğretin ki onlarda doğayı nasıl","koruyacağını,","nasıl sahip çıkacağını öğrensin. Sizler"
"w","W-MA16B1A-0270-250","Öğrenilmeden, bilincimizin müdahalesi olmaksızın bedeni","korumak","için yapılan hareketler. Elimizin ateşten"
"w","W-IG03A1B-3213-648","özveri ile Hint minyatür ülbümünü","koruyup","saklamış ve bu albümdeki minyatürlerin"
"w","W-HE05A1B-3507-1937","özgürlüğünden yoksun bırakılan kişinin hukukun","koruması","dışına çıkarılmasına dayanır. ""Kayıp"" kişinin"
"w","W-RD02A1A-1612-2205","özgürlükleri tebaası oldukları İslam devletinin","koruması","altına alınıyordu. Osmanlı padişahının reayalığını"
"w","W-OE05A1B-4179-496","özgürlüklere ilişkin aldıkları kararlarla, azınlıkların","korunması,","bioteknik, kişisel bilgilerin korunması gibi"
"w","W-LH13C1A-1559-681","özgürlük, ne barış anlatılabilirdi. Seni","korumak","için karşı durdum tüm bunlara."
"w","W-LE36C4A-0463-1633","özgürlük, insan hakları, çevre, doğanın","korunması","için verdikleri mücadelede, onlarla yan"
"w","W-PG22C1A-0518-1363","özerk bir kitap olarak mı","koruyacağımdan","emin olamadığım, Elma'nın kesin basımına"
"w","W-LD36C2A-0013-2109","özen göstermesi, bunun için çevre","korunması","reformunu gerçekleştirmesi gereklidir. Türkiye bilgi"
"w","W-UC06A1B-4104-1275","özelliği, ters polarite, kısa devre","korumalı","ve güçlendirilmiş gibi teknik özellikleri"
"w","W-GH03A1B-3106-1063","özelliklerini sürdürebilecekleri belirtilmiştir. Azınlık haklarını","korumak,","onlara özel imtiyazlar tanıyarak değil,"
"w","W-DF10A3A-1844-314","Özellikle vali ve mutasarrıfların güvenliği","korumak","için yanlarında besledikleri askerlerin sayısında"
"w","W-UC29D1B-2445-1002","özellikle taşınabilir bilgisayarlarda parmak izi","korumasıyla","ilgili büyük gelişmeler yaşandı. Pc"
"w","W-SI22E1B-2912-444","Özellikle küçük, yaramaz canavarlardan itinayla","korunacak.","Sağlam bir dostluğumuz var şimdi."
"w","W-WI45F1D-4817-14","özelleşmekle meşgulken o dev şirketleri","korumakla","yükümlü ülkeleri AB dümenine içişlerini"
"w","W-KF10A2A-1875-985","özel yatırımcılar, kendi portföylerindeki çeşitliliği","koruyabilmek","amacıyla EMU-dışı paralara kayma gereğini"
"w","W-HI22C3A-0423-311","özel manyetik bir alanla (kılıfla)","korurlar.","Uzay gemileri, yıldızların ve gezegenlerin"
"w","W-DF10E2C-2663-1360","özel kesimde de aynı seviyesini","korumuştur.","Kıdem tazminatı tavanı da, Ocak"
"w","W-CF05A1B-4364-2427","özel hukuk karakterli olsun, işçileri","koruyan","kanunları, sosyal sigortalar ile İlgili"
"w","W-DC06A3A-3364-2488","Özel giysiler göz ve deriyi","korusa","bile gereksiz maruziyelten kaçınılmalıdır. e."
"s","S-BEABXW-0058-238","öyle çok ayrıntılı konuşmamıştık. Allah","korudu","yani var ya yoksa. Ben"
"s","S-ADABPZ-0134-45","öyle bu aşkınlığı başka türlü","koruyamazsın.","Demokrasiyi nasıl yöneltiyorsunuz? Efendim? Demokrasiyi"
"w","W-TI42E1B-2942-2017","öyle bir yerdir ki, korudu,","koruyor,","korur... Sığınmaktır, aczini bilmek... Gönlün,"
"w","W-OG24D1B-3361-2108","öyküsü vehmine kapılmamış. Ana temayı","koruyarak","oyuna, klasik tragedyaya yaraşır bir"
"w","W-SG37C0A-0189-1802","ötekine karşı kurduğu katı mesafeyi","korumak,","ondan gelen bulaşıcı tehlikeyi kendinden"
"w","W-TI41C2A-1343-1816","Öte yandan Satürn gerçekçilik anlayışınızı","koruyamadığınız","takdirde nasıl hayal kırıklığı yaşayabileceğinizi"
"w","W-TC01A3A-1258-325","Östrojenin kemiği PTH'nın yıkıcı etkilerinden","koruduğu","düşünülmektedir. Kortikosteroidler hem PTH duyarlığını"
"w","W-QI22E1C-2910-152","örttüğü organları hem de kendini","korur.","Savunma sistemlerine rağmen yine de"
"w","W-HD02A1B-3796-784","örneği olmuştur. Jus sanguinis esasını","korumuş","olan bu yasa da çifte"
"w","W-FC06A3A-1058-960","örnekleri ihtiva eden ve mutlak","korunması","gerekli olup, sadece bilim ve"
"w","W-SI27D1B-2465-87","önünde gider yollarını açar, onları","koruyup","kollayarak hayatta yürümelerine yardım ederdim."
"w","W-VI41C2A-1461-615","önleyerek, vücudu erken yaşlanmaya karşı","koruyor.","Antibiyotik ve nefes darlığını gideren"
"s","S-ADABLp-0062-108","önlenmesi. 8. Var olan meraların","korunup","iyileştirilmesi. Bakın meraları azaltmıcam arttırmıcam"
"w","W-NF10A4A-1820-1354","önlenerek sosyal dayanışma ve istikrarın","korunmasına","katkı sağlanmış olur. Bütün bu"
"w","W-PB04A3A-1986-1647","önlemlerle, orman varlığı dolaylı olarak","korunabilir.","Brezilya ormanlarında yapılan bir araştırmaya"
"w","W-CD02A1B-3520-823","önemlisi olarak yerini ve geçerliğini","korumaktadır.","Yükseköğretim sorunları ise, çok defa"
"w","W-QE02A0A-1783-779","önemlidir. Çünkü böylece azınlık kimliği","korunmuş","olur, azınlığın kendini itilmiş veya"
"w","W-UI27D1B-2456-170","önemli sulak alanlarından Eğirdir Gölü'nün","korunması","için proje başlatıldı. Doğal Hayatı"
"w","W-ED02A1A-2707-1461","önemli sorunlardan biri olma özelliğini","korumaktadır.","Bu sorunun güncelliği, çalışmamızın konusunu"
"w","W-IC06A1B-3739-46","önemli biyotoplar ve fizyolojik özellikler","korunurken","bilimsel araştırmalara da imkân yaratılır."
"w","W-CI22C3A-0678-977","önemli bir şekilde kullanılması ve","korunması","önemine işaret edilmiştir. Hususi hukuk"
"w","W-FC01A1B-3606-336","önemli bir sorun olma özelliğini","korumaktadır.","Doğrudan morbidite ve mortalitesinin yanısıra"
"w","W-NE39E1B-2899-210","önemi, sosyalist şemsiyenin kapitalist-yolcuları da","koruyabilme","özelliğini örneklemesindedir. Hatta böyle bir"
"w","W-OD05A2A-2605-1274","önem kazanırlardı. Logadesler Atilla'nın hayatını","koruyan","en güvenilir adamlarıydı. Bunlardan Edekan"
"w","W-ME30D1B-2115-288","öne sürülen Bin Ladin'in artık","korumalarını","Pakistanlı, Bangladeşli ve Keşmirli yandaşları"
"w","W-OE39E1B-2900-945","önderlik yeteneğini sorgulamayı gerektirmez. Geçerliliğini","koruyup","korumadığı en fazla tartışma konusu"
"w","W-QD02A3A-1429-1832","önceliği ve asgari devlet gereği","korunurken;","geleneğin, dinin, ailenin ve milli"
"w","W-MF05A1B-4436-1725","Öncelikle, kur değişmelerinin olumsuz etkilerinden","korunmak","ve kur riskini minimize etmede"
"w","W-GC01A1B-3654-1840","önceki eğitim döneminde kazandıkları cevapları","korudukları","(hatırladıkları) görüldü. Bu yeni deney"
"w","W-SE36E1B-3294-387","önce Soner'e söyledim. Alaçatı rüzgârını","korumaya","çalışıyor Sörf merkezinde villa kavgası"
"w","W-MI22C3A-0508-1980","önce bireylerin sağlıklarını ve özgürlüklerini","korumaya","yönelikti, onların sağlıklarını ve özgürlüklerini"
"w","W-GA16B2A-1931-780","ölümü kılım kıpırdamadan göze alır,","korurdum","onu. Otelde bizi aramaya başlayan"
"w","W-HB04A1A-1537-1512","ölçüde kaliteli olur. Ayrıca gübrenin","korunma","ve ayrışma biçimleri de kalite"
"w","W-SH42C4A-0495-166","ölen varsa vatandır."" Manevi değerlerin","korunması","için bir önceki kuşağın, bir"
"w","W-ID30D1B-2220-1406","ölen asker ve polisler devletin","koruması","altında değil midir ki, onların"
"w","W-JI22C2A-0797-1580","öldürüyorlar da Allah niçin beni","koruyor?","Beni onlardan daha çok sevdiği,"
"w","W-SD02A1B-4587-384","öldürebilir. Ayrıca, biyosantrik etiğin, iyiliklerini","korumak","için bütün canlıların eşit olduğu"
"w","W-OA16B4A-0061-322","öbür elindeki kör makası kulak","koruyan","eline dayayarak, kulak dibini tıraş"
"w","W-DA16B4A-0088-1785","çılgın gibi dönerek uçuyor. Ondan","korunmak,","sakınmak için oradan oraya koşuyorum."
"w","W-TI44F1D-5102-2196","çıktı. ondan sonra da farkı","korumaya","çalıştı. sonlara doğru telekom 3"
"w","W-SI22C4A-0822-686","çıktı, ama, kökleriyle bağlarını daima","korudular.","Artık pek çoğu toprak olan"
"w","W-QE39C3A-1759-356","çıkmıştı. Uzak ülkelere yatırılan sermayenin","korunması","sorunu, gelişmiş ülke devletlerinin ana"
"w","W-PG37C3A-0343-1579","çıkmaması, kendini dağıtmaması ve bütünlüğü","koruması","şartıyla... Kar Yağıyor ve ölü"
"w","W-SH42E1B-2919-2100","çıkmalıyız, onları kör batı taklitçiliğinden","korumalıyız.","Mehmet Akif bu kör taklidi"
"w","W-UH42E1B-2921-161","çıkmaktan, Mahkeme-i Kübra'dan çekiniyor, sakınıyor,","korunuyor.","Rabbinin kitabından âhiret, ölüm, hesaba"
"w","W-ND39C3A-1754-2203","çıkarılmalı, devlet ve hükümet otoritesi","korunmalı,","saldırıya uğramaları önlenmelidir"" sözü iyi"
"w","W-KC29D1B-2794-1627","çıkarılan kerpiç yapılarının bir kısmının","korunması","ve müzecilik anlayışında değerlendirilmesi öngörülmüştür."
"w","W-ID39C3A-0001-1604","Çıkarı yok düştün ocağıma. Koltuğu","korumak","istiyorsan sarıl bacağıma. Burnundaki yaralan"
"w","W-ME05A1A-2616-1818","çıkarları peşinde koşan bireylerin haklarının","korunması","dürtüsü yer alır. Buna göre"
"w","W-QF25D1B-2166-727","çıkardığı servetiyle ilk sıradaki yerini","korudu.","Gates'i, geçen yıl olduğu gibi"
"w","W-JH03A1B-3121-1784","çıkan hükümet arasındaki bağ genellikle","korunur.","Siyasal sistemde esaslı değişiklik yapmış"
"w","W-CA16B3A-1557-2448","çürükler küçük pamuk yastıkçıkları ile","korumaya","alınıp bol eteklerin altında kamufle"
"w","W-GA14B1A-1489-1549","çünkü, kendimi korurken yuvamı, yuvamı","korurken","de kendimi korumuş olurum. Aynı"
"w","W-SE05A1B-4201-736","Çünkü sui generis veri tabanı","korumasının","amacı, verilerin yaratılmasına değil, mevcut"
"w","W-UE36E1B-3296-206","çünkü sallanan yumruklardan, tekmelerden kendimi","korumaya","çalışıyordum. O korkunç günden bizi,"
"w","W-VC40E1B-2881-1067","çünkü işletim sistemi için donanım","koruması","bir seçenek. Bunun için geliştiriciler"
"w","W-TC40E1B-2879-1836","çözünürlüğünü sınırlandırma şansına var. Parola","korumalı","PDF oluşturmak FreePDF yazıcısına herhangi"
"w","W-RD36C3A-0076-1220","çözülmüş. Otlakların doğru kullanımı, bakımı,","korunması","ve ıslahı güvence altına alınmazsa"
"w","W-TA16B2A-0325-410","çöküntüsü ile iç havza niteliğini","korumakla","beraber Akdeniz belirtileri de gösteren"
"w","W-SD36E1B-2843-1464","Çukuru""na attırmışlardır. Tanrı dürüst Danyel'i","korur,","aslanlar kendisine dokunmazlar ve aynı"
"w","W-ID02A2A-0640-1825","çoğunun işçi olması, öte yandan","korunmaya","özellikle kadın işçilerin gereksinme duyması"
"w","W-HC05A2A-1772-1994","çoğunluğun fertlerden ya da azınlıklardan","korunması","için tedbirler düşünmeye alışkın iken,"
"w","W-MC06A2A-1956-292","çoğunluğu, yalıtılmış olarak taksonomik durumlarını","korumaktadır.","Dağlık kesimlerdeki iğne yapraklı orman"
"w","W-DE05A3A-2689-1923","çoğunluğa ve yasalara karşı da","korunması","gereğini acı bir biçimde ortaya"
"w","W-RG37C1A-0844-553","çoraklaşan gönüller, aşka tutunarak canlılıklarını","koruyabiliyorlar.","Ancak aşk bir imkân olduğu"
"w","W-FD36C3A-0389-682","çoktan Üsküdar'ı geçmişlerdi. Makamın Kutsallığı","Korunmalıdır...","Semra Hanım, şimdi bu sorunların"
"w","W-QD36C3A-0075-1060","çok önemlidir. Aynen Başkan Bush'un","korumalarının","bizim politikacılara yaptıkları gibi, her"
"s","S-AAAAFZ-0383-141","çok önemlidir hücrelerdeki iyon dengesinin","korunması","için, membran potansiyelinin sağlanması için."
"w","W-MD39E1B-3359-751","çok önem verdiği doğal çevremizin","korunmasına","olan bilincimiz gelişecektir. Böylece büyükler"
"w","W-MF05A1B-4436-627","çok çeşitli döviz kullanarak da","korunabilmektedir.","Döviz kurlarındaki değişmelerin olumsuz etkilerinden"
"w","W-TC01A1B-4085-1032","çok çalışmada, kanal aktivasyonunun önkoşullama","koruması","üzerine etkisi net bir şekilde"
"w","W-LF10A2A-1858-855","çok ziyaret ettikleri ülke konumunu","korumaktadır.","Yukarıdaki verilerden anlaşıldığı gibi Rusya'daki"
"w","W-TG03A1B-2539-29","çok yapraklı çiçek motifli bezemeleri","korunarak,","üst kısmı yarım daire ile"
"w","W-VI19E1A-3999-2213","çok seviyorsunuz? Neden? 2. Sağlığımızı","korumak","için neler yaparız? 3. Hava"
"w","W-TE36E1B-3354-696","çocukluk aşkı Roxanne'i (Eva Mendes)","korumak","için şeytanla anlaşma yapmıştır. Şeytan"
"w","W-QA16B4A-0152-113","çocuklarını askere gönderirken korkmamalıydı. Onları","korumak","için her şey yapılıyordu ve"
"w","W-JE39E1B-3029-382","çocukların eğitimi ve yetiştirilmesi ve","korunması","konusunda orijinal araştırmaları ve tavsiyeleri"
"s","S-ADBBAo-0443-182","çocukların bakımını, hem de namusunuzu","korumanın","mücadelesini vermişsiniz. Hatta bazen evde"
"w","W-KI31D1B-2324-2466","çizgi tutturduğunu ve bu çizgiyi","koruyacağını","söyledi. Amokachi 18. Uluslararası Futbol"
"w","W-OH42C0A-0319-865","çeşitli hastalıklardan, belâ ve kazalardan","korunacaklarına","inanırlar. Hâlâ bazı nesneleri ""uğur"
"w","W-IE05A1A-2620-1280","Çevrenin korunması 3. Doğal hayatın","korunması","ve kırsal çevrenin geliştirilmesi 4."
"w","W-JE05A2A-1906-1291","çevre birimleri varlık ve ayrıcalıklarını","koruyordu.","Üstelik, 16. yüzyılda askeri çevresel"
"w","W-CD02A1B-3499-1295","çevirmenin yaptığı çevirisiyle toplumda düzeni","korumakla","yükümlü olan polisi, toplumu oluşturan"
"w","W-UC29D1B-2445-169","çevirdiğinizde harita yönünü otomatik olarak","koruyor.","A-GPS ise, GSM şebekesinin yardımıyla"
"w","W-ED02A3A-0594-817","çerçevesinde Bakanlık adına da umudumu","korumak","istiyorum. Bu arada, resmi politika"
"w","W-FG03A1B-3189-1245","çelişik beklentileri olan bireylerden oluşur.","Korumaya","karşı olanlar veya korumacı görünenler"
"w","W-OA16B3A-0043-2291","çelikten bir zırh gibi beni","koruyan","dinginlik, yerini üzüntü, öfke, yenilmişlik"
"w","W-HD02A1B-3796-600","çekişme, uygulamada kadının nasıl vatandaşlığını","korumasına","ve bununla birlikte, çoğu kez"
"s","S-ADABPZ-0134-119","çağda öznenin kendi özerklik alanlarının","korunmasının","koşulları da ortadan kalkmıştır. Özne"
"s","S-ADAB^o-0132-112","çağ yerleşimi, Anadolu'nun en iyi","korunmuş","metropolü, küçük antik tiyatrosu ve"
"w","W-SC35A1A-1389-72","Çayın ağız içi kanserlerine karşı","korunmadaki","rolüne ilişkin gözlemler bulunmaktadır. Araştırmalardan"
"w","W-IE39E1B-3028-959","çapta tekrarı demek olacaktır. Dengenin","korunmasında,","onu şahsında bütünüyle ve eksiksiz"
"w","W-CE05A1B-3388-509","çanak çömleğin saklandığı, tütün dizilerinin","korunduğu","bir depo işlevi görür. Tuvalet,"
"w","W-NF05A1B-4440-1814","çalışılsa da herkesin kendi çıkarlarını","korumak","ve arttırmak için kıyasıya kapıştığı,"
"w","W-MF05A1B-4436-1028","çalışılmıştır. Vadeli döviz kontratı ile","korunma","vadeli döviz kontratı, kontrat tarihinde"
"w","W-MD02A1B-4502-2059","çalıştığı gibi, uzun süre geçerliğini","koruyan","resmi bir 'kopuş söylemi'ne karşılık,"
"w","W-PE05A1B-4234-1305","Çalışmamızın bundan sonraki bölümlerinde, çevre","korumanın","neden gerekli olduğunu gösteren ortak"
"s","S-ADABCo-0222-181","çalışmalarına atıfta bulunarak ""Milli birliğimizi","korumanın","gereklerini unutmamız lazım"" dedi. <ses"
"w","W-SH39C0A-0142-2262","çalışmalarda tekrar yapılıyor. Örgütsel yapının","korunması","adına her gün yeniden tekrar"
