"Register","Text","Left","-5;5","Right"
"w","W-SE05A1B-4201-2220","edebielcektir. Aynı şekilde Kanunun eseri","koruyan","cezai hükümlerinden de diğer eser"
"w","W-PF10A2A-1867-629","ecza süreçleri ve ürünlerinde patent","korumasını","içermemekteydi. Ticari markaların tescil edilmesi"
"w","W-VI05A1A-2640-1308","ebeveynleri ise, çocuklarının kişisel hakkını","korumak","ve var olan yeteneklerini geliştirmek"
"w","W-DE05A1B-3411-1349","ebedi bir dünya barışının yaratılıp","korunmasında","insan kendisine düşen görevleri daha"
"s","S-ADAASK-0036-111","dışındaki insanlar mahfuz değildir günahtan.","Korunmuş","değil. Günahları olur, hataları olur."
"w","W-OC03A3A-1418-2471","dışında tutmaya ve özgül alanını","korumaya","büyük özen göstermiştir. Bu nedenle"
"w","W-QE39C3A-0328-660","dışı örgütlerle (NCO'lar) yakın ilişkilerini","korumaktadırlar.""","Kendinden başkasına ""şeffaflık"" dayatmasında bulunan"
"w","W-PF25D1B-2144-2232","dışı fazla Yüzde 6.5'luk hedef","korunarak","19.7 katrilyon lira olarak öngörüldü."
"w","W-MG09C3A-0355-1436","dışarıyla/dışla ilişkilerinize baktığımızda; kendini sürekli","koruyan","birisiniz... Çok doğru söylediniz. Birçok"
"w","W-FC01A2A-1511-1387","dış membranlarındaki proteinler ile bakteri-yojlsisden","korunurlar.","Bakterilerin kan dolaşımından beyin omurilik"
"w","W-UB29D1B-2443-1721","dış etmenlerden gelecek darbelere karşı","korur.","Spesifik bölgelerde birikim yapan mekanik"
"w","W-LE39C3A-0067-199","dış düşmanlara karşı devletin kendini","koruyacağı","sırları olmasa olur mu? Düşmanlar"
"w","W-SE39E1B-3036-1896","düşüyoruz, derinlere... Böylelikle daha çok","korunuyoruz","hayattan, hayat onca şeyi aşıp"
"s","S-BEABXB-0003-62","Düşünsene ben ölüyorum. Ayy Allah","korusun.","Bide kız beş kişilermiş araba"
"w","W-QH03A1B-3146-213","düşüncesinin ya da toplumun mahremiyeti","korumak","ve küresel erişimi sağlamak gibi"
"w","W-TE05A1B-4230-36","düşüncesini, ""...tüketici ve toplum refahını","koruyacak","veya artıracak..."" ifadesinin altına gizleyerek"
"w","W-CG22C3A-0622-653","düşünce, dilediğim gibi yaşamak özgürlüğümü","korumak","isterim. Her zaman da istedim."
"w","W-LG24D1B-2297-1147","düşünce ve ifade özgürlüğü kavramlarını","korumak","için gözetim ve denetim mekanizmalarını"
"w","W-QF10A2A-1817-2115","düşük ölçekte seyretmektedir. Yerli sanayii","korumak","amacıyla özellikle tekstil, otomotiv (nihai"
"w","W-LA16B2A-0514-2002","düştüğüm o yapaylığa düşmüyordum... Yazılarımı","korumak","için ruhumu ateşe atmıyordum. Başkalarının"
"w","W-HE39E1B-2893-375","düştüklerinde eski iddia ve saygınlıklarını","koruyamadılar.","Gelenek, belli dönemlerde kendi içerisinden"
"w","W-ED02A1A-2707-1653","düşmeden, bu düzen içinde bulup","korumak","durumundaydı. Kim olması, ne yapması"
"w","W-UG03A2A-2009-2206","düşman saydığı kişilere karşı kendini","korumak","için saldırgandır, kavgacıdır. İçindeki birikmiş"
"w","W-KA16B2A-0056-409","düğününde bütün zengin kızlarını gözlerden","korumak","için üzerlerine geriliveren kan kırmızısı"
"w","W-TE13C2A-1322-465","düzlemlerde ve adeta zorla bağlarını","koruyabilir","bir duruma düşmüş... Böyle bir"
"w","W-MD02A2A-2685-144","düzeylerinin belgesi olan taşınmaz varlıkları","korumak,","bunları çağdaş koruma ilkelerine uygun"
"w","W-IF18E1C-4145-56","düzeyinin ihtiyaçlarına cevap verememektedir. Markaların","korunması","ile ilgili 551 sayılı Markalar"
"w","W-SC01A2A-1178-1835","düzeyini yükseltip santral sinir sistemini","korumaya","çalışırlar. Kanda şeker düzeyi düşünce"
"w","W-II37E1B-3053-1229","düzeyine ulaşmalarına ve bu düzeyi","korumalarına","hizmet etmelidir. Psikoloji eşcinseli nasıl"
"w","W-FE39E1B-2891-1172","düzeydeki kalıcı kimi etkilerini hala","koruyan","kemalizmin bir yeniden canlanması görüntüsünü"
"w","W-EE05A3A-2686-1605","düzenliliği korumak demektir."" GENEL ASAYİŞİN","KORUNMASI","Asayiş, bir toplulukta güvenliğin egemen"
"w","W-IF18E1C-4144-1765","düzenleyen söz konusu madde aynen","korunarak","ortaya çıkan yasal boşluk giderilmiştir."
"w","W-VF10A1A-1889-1976","düzenlenme amacı çocuk ve ailenin","korunması","olmasına rağmen yukarıda belirttiğimiz sakıncalar"
"w","W-VE05A1B-4307-196","düzenlemesi ile doğal/ tarihi mirasın","korunması","konularında ciddi bir hizmet açığının"
"w","W-EE05A3A-2686-305","düzeni gibi feda edilemeyecek durumları","korumak","için, idarenin, mevcut kanunlara aykırı"
"w","W-SH32D1B-2514-1462","düzen"" olduğuna ve bu düzenin","korunması","gerektiğine inanan insandır. Tanımdaki anahtar"
"w","W-OC03A3A-1418-1888","düzen sansürle, yasalarla, hatta Anayasa'yla","korunuyor.","Çok ters biçimde, sivil alan"
"w","W-CD02A4A-2029-426","dürtüsü, tehlikeden korunma dürtüsü, tehlikeden","korunma","gayesine yönelik saldırganlık dürtüleri gibi,"
"w","W-QA16B2A-3350-416","dünyaya karşı kendilerini daha kolay","koruyabilirler.","Ayrıca bizim arkamızdaki asıl güç"
"w","W-NG24D1B-2304-1881","dünyasında yarattığına benzer bir zarardan","korumak","için geliştirildi. Servisten yalnızca hızlı"
"w","W-MI31D1B-2326-2148","dünya şampiyonu olduğu yıl) formumu","koruduğuma","inanıyorum"". Bakan Ünlü açıkladı Taşçı"
"w","W-KF10A2A-1795-623","Dünya Kültürel ve Doğal Mirasının","Korunmasına","Dair Sözleşme Avrupa'nın Yaban Hayatı"
"w","W-JE04A3A-1580-1149","dün olduğu gibi bugün de","koruduğu","vurgulanmaktadır. Böylece gerek ev idaresi"
"w","W-QE30D1B-2087-2436","dün Arafat'ın yokluğunda bölgede sükûnetin","korunması","ve birliğin sağlanması amacıyla dün"
"w","W-FD02A2A-1166-254","dövizi üretememesinde, kendisini uluslararası rekabetten","koruyacak","önlemleri almış olmasının ve önemli"
"w","W-MF05A1B-4436-1051","döviz kurundaki değişmelerin işlem etkisinden","korunabilmeleri","için hedging tekniklerinden yararlanmaları gerekmektedir."
"s","S-AEABPZ-0331-59","dönümlük bir park. Fakat yaptığımızı","koruyabiliyor","muyuz? koruyamıyoruz. İnsanlarımızın elinde çekirdek,"
"w","W-GE05A3A-1907-923","dönme belirtileri gösterince Türkiye tarafsızlığını","korurken","Müttefikler'e eğilimli bir tavır içine"
"w","W-QA16B4A-0155-99","dönen annem, kendini tamamen güzelliğini","korumaya,","Nedim baba da kendini işine"
"w","W-TD30D1B-2181-20","döneminde işkence altındayken bile kalemini","korumuştur.","Taraflı ve tarafsız pek çok"
"w","W-LE39E1B-2840-1950","dönemin değişen şartlarında NATO'nun itibarını","koruyacak,","gelecekteki rolünü belirleyecek temel kural"
"w","W-SG03A1B-3271-2061","dönemin anlayışına göre aile namahremini","korumak","amaçlanmıştır. Bunun altında yatan gerçek"
"w","W-DF10A2A-3021-795","duymasından dolayı yönetici, bankasından kurun","korunacağı","tutar üzerinden faiz-opsiyonu temin etme"
"w","W-NG24D1B-2304-1152","duygularını kontrol etmek ve tahtını","korumak","için mücadele ediyordu. Gladriel'in ise"
"w","W-II09C3A-1943-1213","duyduğumuz, İsmet İnönü'nün tarafsızlığını titizlikle","koruduğu","Türkiye Cumhuriyeti'nin egemen olduğu topraklardan"
"w","W-SD03A0A-0244-1451","duyarlı olması ilkesi de geçerliğini","korumaktadır.","Psikanalizin gelişim psikolojisine belli başlı"
"w","W-GA16B4A-1239-1432","duvar, çiçeklerin de kedilerin de","korunmasını","kolaylaştırmaktadır.) Çocukların, satıcıların halini hatırını"
"w","W-OB04A3A-1566-1447","durumlarına bağlıdır. Zararlılarla beslendiklerinden dolayı","korunmaları","gerekir. Kozmopolit dağılış gösterirler. 2"
"w","W-UI39C4A-2639-728","durumlara neden olanlar ve kaleyi","koruyanlar","arasında ayrım oluşturulmaktadır. ""Sapkın"", ""yoldan"
"w","W-FD05A3A-0569-154","durumdan kurtarmak, kavgaların kötü etkilerinden","korumak","amacıyla onları evden uzaklaştırmaya, bir"
"w","W-TE36E1B-3354-2092","durum yok. Ama muhafazakâr, aileyi","koruyan","bir partiyiz. Kadının birey olarak"
"w","W-RF25D1B-2146-842","durulan ikinci konunun da esnafın","korunması","olduğunu kaydeden Bakan Coşkun, bunun"
"w","W-FE02A1B-3468-157","dulların ve yetimlerin bakılması ve","korunması","sorumluluğunun Devlete ait olduğu fikrine"
"w","W-UD02A2A-2649-383","dul kalan kadın ve kızları","korumaya","yönelik bir koruyucu tedbir olarak"
"w","W-GA16B2A-0616-2282","dudaklarının şekli sanki değişiyor. Sizin","korunmaya","ihtiyacınız olduğunu hiç sanmıyorum, diyorum"
"w","W-SD30D1B-2230-448","DSP ise partilerin kurumsal kimliklerini","koruyarak","seçim öncesi bir ittifaktan yana."
"w","W-RE39C3A-0882-1258","DP Vicdan ve Toplanma Hürriyetinin","Korunması","Hakkındaki Kanun Tasarısı'nı 20 temmuz"
"w","W-OH02A4A-1416-33","doğuştan varolduğu kabul edilen hakların","korunmasında","etkin rol oynamasının anlaşılmasından sonra,"
"w","W-EE05A1B-3453-1198","doğurabilir. Bayrak, geminin o devletin","koruması","altında olduğunu gösteren bir simgedir."
"w","W-ME03A2A-1792-2392","doğum ve annelik koşullarında kadınların","korunmasına","ya da emeklilik yaşına ilişkin"
"w","W-TA16B4A-0342-2237","doğrusu. Beni uzaktan da olsa","korumak","istiyordu demek Niça! ""Sonunda o"
"s","S-ADABPZ-0134-149","doğrultusundaysa örneğin tüketici haklarının yeterince","korunmadığı","doğrultusunda. En az sayıdaki bazı"
"w","W-MB04A2A-1569-1527","doğru çekilirler. Bunların filogenezı, onu","koruyan","ve hareketine olanak veren kılıflı"
"w","W-NF10A2A-1827-2131","doğmamış ve Türk Lirası'nın değeri","korunmuştur.","Bu sonuç içerde enflasyonun dizginlenmesini"
"w","W-IE05A2A-2080-1077","Doğan özellikle Türkleri ve Müslümanları","korumak","için ""Haklar ve Özgürlükler Akımı""nı"
"s","S-ADBBI^-0042-126","doğa, çevremizdeki güzellikler, o güzelliklerin","korunması","için, o duyarlılıkların canlı tutulması"
"w","W-NC40E1B-2873-195","dosyaları çok iyi bir şekilde","korunan","bir işletim sisteminde Norton araçlarının"
"w","W-VG37E1B-3069-2270","dostları için her zaman önemini","koruyan","bir organizasyondur. Etkinlik dünyanın pek"
"w","W-UE05A1B-4296-398","donanmaya katılacakları ve hangilerinin sancak","korumasında","kalacakları ise genel olarak sahip"
"w","W-GA16B2A-0616-793","dolu bir ses tonuyla, ""beni","korumaya","çalışıyorsunuz?"" diyor. Gözleri sanki ufalıp"
"w","W-TA16B4A-0500-595","dolmuş içime. Tutunmak, edindiğim iktidarımı","korumak","için, kendimden vazgeçmişim. Ne kadar"
"w","W-SA16B2A-0311-970","dolduran komşularına inat evini, bahçesini","korumuştu.","Bir kişi de olsa, başkalarına"
"w","W-ID13C2A-3303-1972","dolaşarak, lordun haklarını ve çıkarlarını","korumaktı.","Steaward, her manorda ne kadar"
"w","W-MB04A2A-1569-1839","dolarak, kaslara bir sürtünme ortamından","korunma","olanağı sağlar. Böylece kaslar işlevlerini"
"w","W-VI22E1B-2915-1947","dol Bahçemin çiçekleri..."" ÇEVREM ""Çevremizi","koruyalım","Doğamızı temiz tutalım Yerlere çöp"
"w","W-SD02A1A-0176-2360","dokusu ve doğal evrimi, hem","korunma","güdüsü, hem etkinliğini muhafaza arayışı"
"w","W-VB04A2A-1984-911","dokunun görevi, gövdeyi dış etkenlerden","korumak,","korteksin görevi madde depo etmek,"
"w","W-RE36E1B-3293-701","Dokuma sırasında tabloların orijinal hali","korunuyor.","Altı bardakta tarih arkası ""Altı"
"w","W-UI42E1B-2943-188","DİŞİ Haram ve şüpheli lokmalardan","korunmuş,","helâl lokmalarla beslenen temiz bir"
"w","W-GE39E1B-3026-306","diğer zararlı orman böceklerinin saldırısından","korumaktadır.","Yani bir nevi immün sistemi"
"w","W-DF10E2C-2663-1753","diğer iki mesele de önemini","korumuştur.","1988 yılında sanayi sektöründeki üretim"
"w","W-JD36C2A-0114-1570","Diğer güç, devlet mekanizmasının varlığını","koruyabilmiş","parçaları da olabilir, çağ dönümünün"
"w","W-PF10E1B-3064-913","diğer dillerin olumsuz etkilerine karşı","korunmaya","alınmıştı. Konsept, trend, lansman, global,"
"w","W-RA16B2A-1050-1898","diye avutmuştum kendimi, ama nasıl","koruyabilirdi,","onu bilmiyordum. Yine de içimdeki"
"w","W-IA16B3A-0041-1592","diye atıldı Hanife hanım. ""Ne","koruyup","duruyorsun bu arsızı sen de!"""
"w","W-PG37E1B-2923-516","direnç noktasını oluşturan şiir, ben'i","koruyup,","acıma gösteriyor mu? Neden? Salih"
"w","W-PA16B1A-0246-1526","Dinozorları eden nedenden Büyüklüğü artık","korumuyor","tersine sonunu hazırlıyor. Ancak küçük"
"w","W-KE05A4A-2596-781","dinamik bir husus olarak özelliğini","korumasından","kaynaklanmaktadır. Yönetime katılma, işçilerimizle yöneticiler"
"w","W-GE05A1B-3487-1011","dilleri sosyokültürel bir unsur olarak","korunmak","istenilmektedir. Yine Tablo l'e bakıldığında"
"w","W-LD43A3A-1798-1951","dile getirmiş ""Sonunda yalnız sevdiğimizi","koruyacağız,","yalnız anladığımızı seveceğiz, öğretileni anlayacağız."""
"w","W-DE05A3A-2974-786","diktatörlüğü Gorbaçov, Sovyetler Birliği'nin ""bütünlüğünü""","korumak","için kuruyordu. Kongre'nin ilk gününde"
"w","W-QC01A4A-1081-109","dikkatimi çekmişti. Sanki Serdar annesinin","korumasından","ayrılıyor, adeta onun sevgi ve"
"w","W-PC06A1B-3957-2079","dikkate alınınca, bu kültürel mirasın","korunması","ancak içinde yaşayanların mali açıdan"
"w","W-SA16B2A-0738-2302","dikkat çekmek ya da güneşten","korunmak","amacıyla yerleştirilmiş. A canım! Bana"
"s","S-ADABCo-0279-129","dikkat çeken UNESCO bu binaların","korunması","için hükümeti uyarıyor. UNESCO raporunda"
"w","W-PD18E1C-4164-885","dikkat etmesi, kaza ve tehlikelerden","korunabilmesi","yolunda bilgi kazanmasına, 7. Çocuğun"
"w","W-TA16B2A-0325-1205","dikenli tellerle, sınırlarla, silahlı askerlerle","koruduğu","toprak parçalarından hiçbirine ait değil"
"w","W-VI44F1D-4747-142","diet ben yaptım. Beni Allah","korudu","herkes benim kadar şanslı değildi."
"w","W-HE06A1A-2069-673","değiştirmişler ve bu uyumu sürdürüp","koruyabilenler","günümüzde su yaşamını oluşturmuşlardır. Jeolojik"
"w","W-NC40E1B-2873-934","değiştirmeyi mi yoksa, varolan sayfaların","korunarak","kendi yükleyeceği sayfaları başka bir"
"w","W-EE05A2A-2699-69","değiştirileceği için farklı ulusal kimliklerin","korunması","ayrılıkçı sorunlar yaratmayacaktı. Alt yapının"
"w","W-JC06A3A-1958-611","değiştirdiğinde sıra ve sütun koşulları","korunabilir.","Örneğimizde x13=3, x14=7 ve x34=7'dir."
"w","W-OE30D1B-2128-394","değişmesi ve ülkenin toprak bütünlüğünün","korunması","istemiyle son buldu. Avanos'ta düzenlenen"
"w","W-MF05A1B-4436-1812","değişmelerinin ekonomik etkisinden de işletmeler","korunabilecektir.","Çünkü, ekonomik etki döviz kurlarındaki"
"w","W-KD36E1B-2853-3","değişmeden 16. yüzyılın ""eşitlikçi"" yapısını","korumuş,","bu yüzden ülkede topraksız köylü"
"w","W-VI19E1A-4022-1381","değişikliklere rağmen onun eserleri, değerini","korumaktadır.","Kötü doğa koşulları, yağmurlar, rüzgârlar,"
"w","W-SH42C4A-0495-1676","değildir. Vatanı her türlü tehlikeden","korumalıyız.","Örneğin; erozyonla mücadele etmeliyiz. Ormanlarımızı"
"w","W-UE39C4A-0903-1520","değildir. Elimizden geleni yaptık, haklarımızı","korumaya","çalıştık. Koruyabildiklerimiz de var koruyamadıklarımız"
"w","W-KA16B4A-1297-249","değildir. Bir şeyler yaparken özgürlüğünü","korumaya","özen göstermesini de istedim ondan."
"w","W-HE39E1B-2836-425","değil. Türkiye'de her zaman gündemini","koruyan","işadamlarından biri olan İshak Alaton"
"w","W-GE05A1B-3500-1830","değil, üzerinde kaydedilmiş bulunan programın","korunmasını","talep etmektedir. Diğer taraftan, kanuna"
"w","W-SE39C3A-0205-1168","değil, liyakat kazanarak almalıydı!.. Mahremiyeti","koruyarak","Batılı kadınların kürk kıyafetini giyen;"
"w","W-IF39C0A-0194-165","Değil mi? Sanık Ahmet Salih","Korur","Tabii abone bedeli olamaz. Belki"
"w","W-ME30D1B-2083-1686","değil dehşet yarattı Kosova'da barışı","korumakla","görevli ABD'li çavuş önce bir"
"w","W-QH42C2A-0477-1344","değerleri ve ritüeller öğretmek, kutsalları","korumak,","istihza etmemek, gerekmektedir. Toplumsal kabuller"
"w","W-RB29D1B-2442-545","değeri kazandıran özgün malzemelerin korunması,","korumada","temel yaklaşımdır ve farklı disiplinlerdeki"
"w","W-CI22C2A-0677-1606","değer. Hedef Bugünkü saat sayışını","korumak.","İspanya'da büyük mağazalar hariç, esnafın"
"s","S-ADAB^A-0317-198","değer veriyoruz. Ve eski eserleri","korumak","için bütün varlığımızla çalışyoruz. Bizim"
"w","W-MI22C3A-0508-1743","değer ve kurallarla ve yasalarla","korunur.","Akıllı insan, bireysel özgürlüklerinin sınırları"
"w","W-ND39C3A-1754-822","devrim yasaları da 4. madde","korumasına","alınmalıdır. Bir yurttaş olarak, birer"
"w","W-CE39E1B-2888-2312","devrim ve devrimin kazanımları nasıl","korunacak?","Bu soruların yanıtları ile uyumlu"
"w","W-OH37C0A-0219-1404","devretmesi ve bunun karşılığında da","korunma","beklemesiyle oluşacaktır. İşte insan ancak"
"w","W-JE39C1A-1657-860","Devletten aldıkları silahlarla hem kendilerini","koruyor,","hem de köylü üzerindeki otoritelerini"
"w","W-OE39C2A-0608-1629","Devletten aldıkları silahlarla hem kendilerini","koruyor,","hem de köylü üzerindeki otoritelerini"
"w","W-UI45F1D-4705-1303","Devletlû varken, kendi memleketinin haklarını","koruması","gerekirken, el-âleme şikâyet eden ve"
"w","W-ME30D1B-2115-1470","devletini ilan etme konusundaki ısrarını","koruyor.","ABD devrede İsrail ve Filistin"
"w","W-IE05A1B-3565-1745","devletidir. Sosyal hukuk devleti güçsüzleri","koruyarak","gerçek eşitliği, yani sosyal adaleti"
"w","W-IE39C4A-1358-406","Devleti'nin savcısı ne demekti... Cumhuriyeti","korumaktı","onun başlıca görevi, unvanında Cumhuriyet"
"s","S-ACABFZ-0049-55","devlet, iktisaden zayıf durumda olanları","koruyacağım,","sosyal adaleti sağlayacağım, ekonomiye canlılık"
"s","S-ACABPA-0434-2","devlet kurumlarını, ülkenin dış itibarını","koruyup","gözetme görevlerini etkinlikle yerine getirmesine"
"w","W-WH13E1C-4888-766","devekuşu olmaktır. Zaman zaman soğukkanlılığını","koruyamamak","ve bu yüzden kendine öfkelenmektir."
"w","W-UC03A2A-1470-2362","devamı ve eşleri çeşitli olumsuzluklardan","koruyan","bir kalkan olarak görülmüştür. İnsanın"
"w","W-IF39C0A-0194-1638","devam olundu.) Başkan Bu Bengi","Korur","kim? Sanık Ahmet Salih Korur"
"w","W-TE05A2A-1399-1334","destekler hale gelmiştir. Amerika çıkarlarını","korumak","için aynı zamanda en muhafazakar"
"w","W-IE05A2A-1910-1924","destek vermesi, ilişkinin bu niteliğini","korumuştur.","Uzmanlar Arap-İsrail barışının Türkiye'nin ilişkilerini"
"w","W-JI39C2A-0646-123","derse? Siz sık sık ""kültürümüzü","korumak","için çareler düşünmeliyiz"" diyor ve"
"w","W-EA16B4A-0383-739","derin kuyular açtı. Ekolojik dengeyi","korumak","için, belli derinlikten aşağı kuyu"
"w","W-KA16B2A-0544-133","deriden yapılmış kitaplardı hepsi. Rutubetten","korumak","için kitapları, tahta raflar okuma"
"w","W-VE39C2A-2700-2265","derhal uzaklaştıracaklar. Ergenekon iddianamesi savcılarını","koruyor","mu AKP? Kesinlikle koruyor. Savcıyla"
"w","W-SB38E1B-2884-47","deniz kaynaklarına ait doğal populasyonların","korunması,","biyolojik çeşitliliğin sağlanması ve kaynakların"
"w","W-PC06A3A-1954-571","denir. Açıların korunması şekli de","koruyacağından,","büyüklük değişik olabilir, bu tür"
"w","W-VE05A1B-4309-982","dengenin sağlanması ve serbest rekabetin","korunmasıdır.","Yeni açılacak ve büyüklüğü 400"
"w","W-PE06A1B-4255-1685","dengenin bozulması yönetimlerin doğal çevrenin","korunması","konusunda daha bilinçli olmasına ve"
"w","W-TB38E1B-2885-685","dengelediğini, damar tıkanıklığını önleyerek kalbi","koruyup","kuvvetlendirdiğini, çarpıntıyı engelleyip, tansiyonu düşürdüğünü"
"w","W-RE36E1B-3293-2335","deneysel hareket etmemeniz sizi zarardan","koruyacak.","Planlarda gerçekçilik en iyisi. Ayrıca"
"w","W-QD02A1B-4570-1082","demokratikleşme, insan haklan, doğal çevrenin","korunması","ve daha adil bir gelir"
"w","W-NE05A1B-3958-2239","demokratik hukuk devletinin varlığı ve","korunması","yönünden,, terörle mücadele kadar bu"
"w","W-QD03A2A-1033-1659","demokratik düzenin geleceğini ve esenliğini","koruyan,","çok gelişmiş sivil denetim mekanizmalarını"
"w","W-EE39C4A-0975-1477","demokrasinin gerektiğinde şiddete başvurarak kendini","koruması","gerektiğini savunanlar da çıkacaktır. ""Mutlak"
"w","W-HD39C2A-0420-2371","demiyor/diyemiyor. ""Milletin kayıtsız şartsız egemenliğini","koruyacağıma,","Anayasa'ya, hukukun üstünlüğüne, demokrasiye bağlı"
"w","W-SE36E1B-3294-494","demektir. ""Allah bizi iktidar olmaktan","korudu,","Kuzey Irak'taki bu cehennemi gelişmelerin"
"w","W-PC06A3A-1954-1208","Demek ki dönüşüm fonksiyonunun açı","koruyan","bir dönüşüm olması ikinci düzlemde"
"w","W-GG03A1B-3202-741","deliğin içinde bakır bir kutuda","korunan","bir tahta parçasının yer aldığını"
"w","W-RD36C3A-0351-2451","dek efendiliğini ve sessizliğini hep","korumuş","olan teknik direktörü Mircea Lucescu'nun"
"w","W-OA16B4A-0046-1883","dehşet içinde büyüyor. ""İşte bu","korumaya","çalıştığın kız"" diyorum, elimle kapıyı"
"w","W-QA16B0A-0227-966","dedim. ""İstemem, beni de seni","koruduğu","gibi korur."" dedi. Uğursuz boğazdan"
"s","S-ACABQq-0423-58","dedik; sınır güvenliğini askerlerimiz korusun.","Koruyabiliyor","mu; koruyamıyor; askerlerimizin sınıra yaklaşması"
"w","W-KA16B4A-0100-489","dedi, odaya girdiğinden beri suskunluğunu","koruyan","Dimitriy. ""Tamam sen başla"" dedi"
"w","W-TA16B0A-0093-1321","dedi ki, 'Benden sonra sizi","koruyup","kollayacak bir erkek evlat bırakamadım,"
"s","S-BEABXO-0452-243","de. Getir Ali. Onu da","gorumağ","önemli Ali. Yani. Sanki başka"
"w","W-QI13C2A-1530-1608","de, dedenin adı yaşatılacak, anıları","korunacak","ve ciddi ciddi resim yapılacak."
"w","W-GE39C2A-1062-1156","de çok üzüleceğimi, aslında beni","koruduğunu","söylüyordu. Daha o zamanlardan 'annem"
"w","W-QI22C2A-0670-880","de çocuklarımıza sahip çıkmamız, onları","korumamız,","sevgiyle büyütmemiz, bilgiyle donatmamız, onlara"
"w","W-UI03C3A-1471-1246","de yapılmış olması bu düzenin","korunması","açısından ve elbette ki o"
"s","S-ACABQq-0429-214","de yanlış yapıyorsunuz, Meclisin itibarını","korumak","zorundayız Sayın Başkanım. Ara verin."
"w","W-VA16B3A-2629-2197","de uzun bir süre varlığını","koruyabilirdi,","İşi şansa bırakmamak için ve"
"w","W-OD02A1B-4545-2233","de tehlikenin bilincine varanlar dilimizin","korunması","için çalışmışlardır. Kaşgarlı Mahmut, Hoca"
"s","S-AEAASO-0039-80","de olabilir. Bedduasını alırsa Allah","korusun.","Üzerse Allah korusun. Bu hususta"
"w","W-LE05A2A-1115-1171","de İngiltere, Fransa ve ABD'nin","korumasında","gelişeceği ikinci döneme girmiştir. Rusya'da"
"w","W-QF10A2A-1817-2189","de iyi bir düşüncenin (sağlığın","korunması)","kötü bir sonuca götürmesini (ticaretin"
"w","W-JC05A4A-1768-502","de istisnai ve özel olmaklık","korunarak,","nesnel açıdan daraltılmalıdır. B- Yargıda"
"w","W-SE20C0A-0238-2248","de insanın kendisini bir başkasının","korumasına","terk etmesi ve kendine dokunulmasına"
"w","W-HE05A1B-3522-2434","de hiç kuşkusuz telif haklarının","korunması","sorunu. Diğer taraftan giderek daha"
"w","W-VE30D1B-2103-2173","de göğsüne dayayarak intihara kalkıştı.","Korumaların","iknaları sonucu silahlarını indiren emekli"
"w","W-TI27D1B-2471-1601","de glikojen ve yağ depolarını","koruyarak","ısı üretimine yakıt sağlarlar. Isı"
"s","S-ACABPZ-0329-29","de gerçekten zarar vermeyen enstrümanı","koruyan","bi şey var. Ama toz"
"w","W-FB04A2A-1577-2385","de dış etmenlerden kendilerini yeterince","koruyabilmek","için desteklik sağlayabilecek dokulara gereksinim"
"w","W-FD02A4A-0645-532","de düşünce özgürlüğünden, kişi hukukunun","korunmasından,","özgürlük ve bağımsızlıktan yanadır; ama,"
"s","S-ADBBI^-0042-237","de durum kolay değildi; yıllardır","koruduğu,","kol kanat gerdiği bir kişiyi"
"w","W-TI22C2A-0845-1678","de değildir. Soğuklar tehlikedir, ondan","korunmak","için evler kurarız; ""başkası"" yabancımızdır,"
"w","W-QG09C2A-0369-1623","de bir yandan Yeşilçam kimliğini","korurken,","farklı da olmalıydı. Yeşilçam sinemasında"
"w","W-KI27D1B-2827-799","de beraber getirdiği insani değerleri","korumak","için giriştiği mücadelenin hikayesi. ""Milli"
"w","W-KE05A4A-2596-995","de başlamıştır. Mikroşirket kültürleri dinamikliğini","koruyacaktır.","Bu nedenle, iki kişilik bir"
"s","S-BEABXE-0082-240","de aynı. Başka türlü nasıl","korucaklar.","Yani içine mutlaka bişe atıyorlar"
"w","W-KI22C4A-0752-1551","de artırdık... Mallarımızı daha iyi","koruyasın","diye, güvende uyuyalım diye, sana"
"w","W-SE39E1B-2904-376","de alay konusu haline getirip","korunabilen","mizah dergileri gibi, tıpkı ""komünizm"
"w","W-SG03A0A-0168-583","de (kurgusunda), salt duygulanımla bağını","koruduğu","ölçüde, dil-dışı bir vahşiliği bilincin"
"w","W-HC06E1B-3081-61","dağılım göstermesi bozunma olayında enerji","korunması","ve momentum korunması ile birlikte"
"w","W-EE02A1B-3447-1052","dağılacağı konusu ile ilgilidir. Çevrenin","korunması","amacıyla getirilmesi sözkonusu olan vergi"
