"Register","Text","Left","-5;5","Right"
"w","W-SD18E1C-4173-616","Türk aile yapısının olumlu değerleri","korunurken,","değişim ve gelişim içinde bulunan"
"w","W-SB04A3A-1271-1511","Tüm yeryüzüne arka çıkmaya onu","korumaya","başlıyorsunuz."" 1968'lerde dünyanın uzaydan bir"
"w","W-DG37C4A-0529-1926","tüm yasaklar kalkmalı. Atatürk'ü yasaların","korumasından","kurtarmalıyız. Korkmayalım, Atatürk kendini savunacak"
"w","W-IF18E1C-4145-1657","tüm teşebbüsler arasında fırsat eşitliğinin","korunması,","küçük ve orta ölçekli işletmelerin"
"w","W-KF07A2A-1860-2307","tüketime kadar tüm aşamalarda enerjinin","korunmasını,","yerinde verimli ve israf edilmeden"
"w","W-ED36C4A-0527-1900","tüketicinin zararına oldu. Gümrükte vb.","korunan","sanayici, diyelim ki bir ampul"
"w","W-NF10A2A-1847-340","Tüketici sağlığı ve güvenliğini, çevre","korunmasını","içeren çeşitli düzenlemeler amacını aşarak"
"w","W-LF10A3A-1826-863","tüketici kesimlerini fiyat dalgalanmalarına karşı","korumak","ve dengeli ve adil bir"
"w","W-UE05A3A-2692-1843","tüccarların özlük haklarını çok iyi","korumaktaydı.","İngiltere ve ona bağlı yerlerden"
"w","W-SD18E1C-4173-236","tutumunu yansıtan güvenlik uygulamaları, ""Mahremiyetin","Korunması","ve Kişisel Bilgilerin Sınırlararası Akışına"
"w","W-ND02A1B-4513-1395","tutulmalarıdır. Kişisel hakların gerçekleştirilmesi veya","korunmasını,","tarafsız ve bağımsız bir yargı"
"w","W-UI09C2A-2993-1918","tutmağa koşanları kim yolluyordu? Onları","korumak","için ateş eden şu gence"
"w","W-LE09C3A-1183-1821","tutarak kendisini o pislikten ayırmaya,","korumaya","çalıştı. Kâğıt ve kalem kıtlığında,"
"w","W-IF18E1C-4145-2485","turizm yatırımlarına tahsisinde doğal çevrenin","korunması,","özellikle turizm alanı ve merkezi"
"w","W-HI22C2A-0785-1132","turizm Goa'nın sonu demektir. Goa'yı","koruyalım.","Hemen şimdi."" diyorlar. İki tören."
"w","W-PI31D1B-2430-971","Trabzon'u ikiye böldü Trabzonspor'un haklarını","koruyamıyorum","diyerek istifa eden Özkan Sümer'e"
"w","W-RE30D1B-2088-211","topraklarının büyüklüğü, yoğun nüfusu ve","koruması","gereken uzun sınırları olduğunu hatırlamakta"
"w","W-JE39C4A-1476-312","topraklarımızı, milli akarlarımızı ve bağımsızlığımızı","korumaya","ve kollamaya hiç bir şekilde,"
"w","W-KB04A3A-1259-1545","toprak ve su kaynaklarının verimli","korunmasını","ve geliştirilmesini sağlamak"", ""Toprak muhafaza"
"w","W-JC06A1A-1999-1969","toprak ilaçlaması veya sterilizasyonu geçerliliğini","koruyacaktır.","Sera toprağının sterilizasyonu üç şekilde"
"w","W-PD30D1B-2201-268","toprak bütünlüğünün ve siyasal birliğinin","korunmasının,","Irak'ın ve bölgenin istikrarının vazgeçilmez"
"s","S-ACAAQq-0419-113","toplumun gündeminden çıkarılabilmiş hem demokrasi","korunmuş","hem de Türkiye'nin çağdaşlaşmaya yönelik"
"w","W-MI41C3A-0395-1837","toplumun da futbol federasyonlarının özerkliklerini","korumaları","kaydıyla, Dünya Kupası'nda Kıbrıs'ı ortaklaşa"
"w","W-PD37C2A-0634-695","toplumu aydınlatıcı bilgi vermek ve","korunma","yolları konusunda aydınlatmaktır."" Depremlerin önceden"
"w","W-VD36C1A-2703-1961","toplumsal bağların yeniden kurulması ve","korunması","sağlanmalıdır. Müdahaleler, hem sosyal yapıyı"
"w","W-PD18E1C-4164-1298","toplumlara maddi ve manevi değerlerini","korumaları","için sağlanan imkânlar, verilen haklar,"
"w","W-OI42E1B-2937-342","toplumlar, hanımlık haysiyet ve vakarını","koruyan","sâliha annelerle âbâd; koruyamayan annelerle"
"w","W-PD36E1B-2858-335","toplumlar kendi dinamizm ve istikrarlarını","koruyarak","yaşadılar. Fakat modern tarihin getirdikleri,"
"w","W-VI19E1A-4001-2455","toplumda saygı uyandırırlar. 1. Mikroplardan","korunmak","için neler yapmalıyız? 2. Her"
"w","W-FG03A1B-3189-212","topluma gösterebilmemiz gerekiyor. Bunu sağlayabilmek,","korumanın","tüm boyutlarını kavramaktan ve bu"
"w","W-SE05A1B-4201-1669","Topluluğunda üye ülkelerin veri tabanı","korumasına","ilişkin düzenleme ve uygulamaları arasında"
"w","W-EE05A3A-2686-2260","toplulukların bulaşıcı ve yaygın hastalıklardan","korunması,","toplumun sağlık koşullan içinde tutulmasıdır."
"w","W-VE05A2A-2710-1114","Topluluk çevre politikasının; çevre kalitesinin","korunması","ve geliştirilmesi, insan sağlığının korunması,"
"w","W-TE36E1B-3353-915","toplantımda fiziksel saldırıya uğradım. Polis","korudu","beni. Benim bütün toplantılarıma bu"
"w","W-TI44F1D-5116-2468","toplanarak paketlenecek ve böylece kalite","korunacak.","Hurma zeytinin en fazla üretildiği"
"w","W-HF10A2A-1876-330","ticaretle bağlantılı fikri mülkiyet haklarının","korunması","ile ilgili hukuki düzenlemeler her"
"w","W-KF32D1B-2576-65","Ticaret Bakanlığı Tüketicinin ve Rekabetin","Korunması","Genel Müdürlüğü yetkilileri, otomobili değiştirilen"
"w","W-GB04A1B-3945-1313","Thunb bu önemini günümüzde de","korumaktadır.","Bodenheimer, bu türün ülkemizde 1833,"
"w","W-PE05A1B-4256-1842","teşebbüslerce devralınmasını önlemek (milli ekonominin","korunması)","ve pazar gücünde eşitsizliğin önlenmesi"
"w","W-KB04A3A-1259-1523","tezini de benimsiyorum. Özellikle de","korunacak","olanın herhangi bir orman ağacı"
"w","W-VE05A2A-2600-2240","tesahup edendir; sizden daha fazla","koruyandır.","Adaleti icra ederken de nefsinizin"
"w","W-DC06A3A-3364-1852","termal incinme (İR katarat)'lerden katarat)'lerden","korunma","için bir ön termal yük"
"w","W-TE36E1B-3295-1124","tercih edilmeli. Boğaz ve boyun","korunmalı.","Çocuktan Yana Şanslı Bu hafta"
"w","W-UD36C3A-0891-975","Tepkiden de öteye, ""toplumsal bir","korunma","içgüdüsüdür"". Tarihte Batı içinde sıkça"
"w","W-OF10A2A-1788-251","Temsil ettikleri toplumsal grupların çıkarlarını","korumada","başarılı olamayan ya da iktidardayken"
"w","W-FC06A3A-1058-1649","temizleyen alanlar olarak, hava kalitesinin","korunmasına","da katkıda bulunurlar. Ülkemizde çayır"
"w","W-UD03A3A-3310-1701","telgraf metnini andırır. En iyi","korunan","isimlerdir ve fiiller genellikle yanlış"
"w","W-PE05A1B-4234-1958","teknolojik yardımlar yapılarak, gelişmeleri çevre","korumayla","beraber uzun vadeli politikalara yansıtılmalıdır."
"w","W-MD30D1B-2209-1934","teknolojik işbirliği, kültür, çevre, yatırımların","korunması,","denizcilik ve enerji işbirliğiyle ilgili"
"w","W-OG24D1B-2305-435","Tekand'ın ""Oidipus Nerede?""sinde Nerede?""sinde de","korunmuş.","Bu duygular kare biçiminde 12"
"w","W-DE02A4A-1483-2137","tek temsilcisi olarak hem adaleti","koruyan","ve kollayandı hem de cezalandıran."
"w","W-OD05A3A-0720-944","tek demokratik ülke olma özelliğini","korumuştur.","Kısa süren üç askeri darbeye"
"w","W-QI31D1B-2352-1154","tek başına göğsünü siper ederek","koruyan","Aurelio'nun açılımı Brito Dos Prazeres"
"s","S-ADABCo-0217-189","tehlikesi yaşadı. İzdiham nedeniyle Başbakanın","korumaları","duruma müdahale etti ve Başbakan"
"w","W-HE05A1B-3524-2242","tehlikelere karşı önlem almak, ülkenin","korunması","ve kollanması amacı ile ilgili"
"w","W-IC06A1B-3723-1869","tehlikelere karşı önem ve özenle","korumak;","gençleştirme çalışmalannın yapay (dikim) yolla"
"s","S-ACAAQq-0419-223","tehditlerle karşı karşıya bulunan çocukları","korumak","için çeşitli girişimler yürütmektedirler. Birçok"
"w","W-SC01A1B-4033-1783","tedavi, antikonvülzan ilaçlar veya havayolunun","korunması","gibi spesifik semptomlara yönelik olacaktır."
"w","W-FC06A1B-3598-1323","taşıyıcı sistemi betonarme mi? Yangından","korunmuş","çelik bünyeli mi? Yoksa ikisinin"
"w","W-SE36E1B-3294-1714","taşıyan paranoia'sından geliyor. Düşünce berraklığının","korunmasına","rağmen yapılan yorumlarda gerçeklikten tam"
"w","W-MB04A3A-1261-576","taşınmasının gerekçesi olarak yalnızca ormanların","korunması","ve bulundukları yerlerde kalkındırılmaları olanaksız"
"w","W-SA16B2A-1199-2452","taşı onlardan daha iyi kim","koruyabilir.","Ha haa haa."" ""Ha haaa,"
"w","W-RF05A1B-4664-2351","tatmininin sağlanması, otelin rekabet gücünü","koruyabilmesi,","gelir elde etmesi ve hatta"
"w","W-ED36C2A-0116-1953","Tatlıses, tabancasını taşır, vurulur, hedeflenir,","korunur,","gözaltına alınır, o hayatın tam"
"w","W-ND02A1B-4515-2438","tasavvurlarınla, bireylerin onurunu ve eşitliğini","korumaya","matuf insan haklarının da dahil"
"w","W-MB04A3A-1261-389","tasarrufu altındaki yerlerin kamu yararına","korunmasına","veya kamu yararına kullanılmasına katkıda"
"w","W-LF10A2A-1877-1237","tarımda da bu ürünlerin sanayi","korumaları","karşılıklı sıfırlanmıştır. Ancak Türkiye bu"
"w","W-LF10A3A-1826-768","tarım kesimini dış etkilere karşı","korumak","amacıyla müdahale politikalar uygulamaktadırlar. GATT"
"w","W-JE39C3A-1250-1488","tarzının eviçi mobilyalarını ve aksesuarlarını","koruyan","Tunus bakır, pirinç işçiliğinde de"
"w","W-OE39C2A-0143-1971","tartışmalı Papaları'ydılar. Fransa kralları tarafından","korunan","bu Papalar 13. ve 14."
"w","W-QH42A2A-1645-2425","tarihte gelecek müridi'ni, Tanrı buyruğuyla","koruyacağını","bildiriyor. ""Evet biçare Said olarak"
"w","W-KE05A2A-2053-2353","tarihli Weimar Anayasası'nın, anayasal düzeni","korumakta","yetersiz kalması ve Almanya'da rasyonel-sosyalist"
"w","W-IE05A1B-3540-1294","tarihinde imparatorların, merkezi imparatorluk birliğinin","korunması","için (Moğol ve Türk baskısı"
"w","W-IE05A4A-1946-1729","tarihi ve kültürel ağırlığını hep","koruyabilmiş.","Bugünkü, neredeyse kitlesel düzeydeki, göç"
"w","W-HD09C2A-0440-345","tarife -eğer artmamışsa- hâlâ geçerliliğini","korumaktadır.","Üstelik yurtdışı rakamlarına masraflar dahil"
"w","W-IE05A2A-2048-2368","tarafının ve üçüncü kişilerin menfaatlerinin","korunmasını","amaçlar. Objektif yöntemle tayin edilen"
"w","W-SI19E1A-4010-1338","tanıtmalıyız. Doğayı tanıyan çocuk, onu","korumasını","da öğrenir. Zamanla, doğayı korumanın"
"w","W-VF07A2A-1857-262","tanımlar. Bu ilişkide üstün astı","koruması,","bir aile büyüğü gibi sosyal"
"w","W-FE05A1B-3465-1642","tanımlanabilir a. Sayrılık sırasında bilincini","koruyan","kişinin gönüllü ölümü, b. Sayrılık"
"w","W-MD05A2A-1159-347","tanık dinleme gibi esaslar aynen","korunmaktadır.","Bu durumda, ön inceleme ile"
"w","W-DD02A1A-2690-866","Tanzimat Fermanı ile verilen hakları","koruyacak","durumda değildir; ancak Kemâl'e'göre gazetelerin"
"w","W-PD03A3A-0867-67","tanrıların canlıları, insanları, ruhları, ölüleri","koruyan","simgesi olarak kabul edilmiştir. Eski"
"w","W-LC06A3A-1960-2216","tanklarının taban iç yüzeylerinin katodik","korunmasında","diğer anotlara göre daha ekonomik"
"w","W-GD02A1B-3768-2247","talimat yazısı, bilgisayar programlarının hukuken","korunması","konusunda milli kanunlarda yapılması gereken"
"w","W-}I22C1A-0428-2277","takan hanımlar kendilerini fort belasından","koruyabilirler.","Lastiğin yumuşak dokusu hamle yapan"
"w","W-VI45F1D-4061-709","takalım ve nesli tükenenler kategorisinde","korumaya","alalım. Baba olmuşum 7 ay"
"w","W-UE36E1B-3356-1142","tahminlerini açıklamayan Eğilmez, Türkiye'nin krizden","korunmasının","yolunun yapısal reformları süratle gerçekleştirmekten"
"w","W-PF10A2A-1867-726","tabanının korunmasına, Yarı iletkenlerin topografyalarının","korunmasına,","Ticari sırların korunmasına, Bitki türlerinin"
"w","W-SE05A1B-4201-2123","tabanı olarak nitelendirmek mümkündür. 2.","KORUMANIN","HUKUKİ GEREKÇELERİ Veri tabanlarına sağlanan"
"w","W-SC35A1A-1389-329","tabakayı sakın kazımayın, aksine özenle","korumaya","çalışın. Çünkü, kaynayan su sabaha"
"w","W-OH42C0A-0319-2007","sığınırsa o kişiyi Yüce Allah","korur.","İhlası tam olan Müslümana sihir"
"w","W-JA16B2A-0336-902","Sırp tetikçilerden ve top mermilerinden","koruyan","beton paravanlardan birinin üzerine iri"
"w","W-GA16B1A-1929-2446","Sırma'ya. Anlıyorsun ya. Karagöz kuyruğunu","korumak","zorundaydı."" ""Baksana Coco'm nasıl mahzun,"""
"w","W-TI27D1B-2471-941","sırasında yer alan kalp-damar hastalıklarından","korunmanın,","sağlıklı beslenme, sigara ve alkolün"
"s","S-ACABQq-0426-215","sırasında buralarda çalışan işçilerin hukuklarını","korumak","hususunda bugüne kadar ne yapmışsak,"
"w","W-LF10A2A-1858-537","sıralanabilir Karayolu taşımalarında yakalanan hacmin","korunması","ve arttırılması için giriş belge"
"w","W-DC06A3A-3364-952","sıradan pamuklu laboratuvar giysilerinin deriyi","koruduğunu","göstermiştir. Gözün korunması Yanlarında katı"
"w","W-LA16B4A-0173-2101","sır sayılmaz. Ben tam aksine","korudum","Barbie House'un yeni sezon modellerini."
"w","W-EE05A3A-2686-2382","sınırlamalar, ""kamu güvenliği ve düzeninin","korunması,","konut ihtiyacının giderilmesi, salgın hastalıklara"
"w","W-PG24D1B-2301-642","sıkı kurallarla denetlenen yapımcı haklarının","korunması","konusu, Türkiye'de neden bu kadar"
"w","W-FC01A2A-1511-879","sık yıkanmasıdır. Rinit'in tedavisi ve","korunma","da son yıllarda en çok"
"w","W-KC06A1B-3773-2235","sıcaklık artışının kontrolü, ozon tabakasının","korunması,","ormanların korunması ve sürdürülebilir kalkınma"
"w","W-MI27D1B-2813-1569","sıcak bölgelerinde, yemeklerin uzun süre","korunması","için uygulanan bir yöntemin parçası"
"w","W-UE36E1B-3296-2361","sürtünmenin dezavantajlarından en üst seviyede","koruyarak","yüzücülere hız kazandırıyor. Yüzücü mayoları"
"w","W-TE37E1B-2905-1864","süreçte ise, BM'nin tasfiyesi güncelliğini","koruyor.","BM'nin tasfiyesini isteyen ABD'nin BM"
"w","W-JE05A0A-1780-754","süremeyeceğidir. İkinci fıkra, başka kültürlerin","korunması","amacının güdülmesini bile cezalandırarak kültür"
"w","W-TD18E1C-4177-1076","sürekli yenilenebilmesi, yakaladıkları kalite çizgisinin","korunabilmesi","ve daha geliştirilebilmesi amacıyla öğrencilere"
"w","W-VI19E1A-4022-1612","sürede tamamlamıştır. ""Ülkesini, yüksek istiklâlini","korumasını","bilen Türk milleti, dilini de"
"w","W-IB04A3A-1904-1616","süre boyunca ""biricik geometri"" kimliğini","koruyan","Euclides geometrisinden farklı geometrilerin ortaya"
"w","W-FD18E1C-4084-1846","süratle ağaçlandırılacaktır. Mevcut bitki örtüsünün","korunması","ve çoğaltılması için, orman ve"
"w","W-TG37C1A-0277-117","sözü mirasını akıl almaz rakamlarla","""koruyan""","Zeynep Talu'ydu. Nitekim Minik Kuş"
"w","W-SE05A1B-4203-1582","Sözü edilen ok ucunun tamamı","korunmuş","olup baskılama tekniği ile üretilmiştir."
"w","W-OE05A1B-4192-1034","sözleşmelerindeki ihtilaflarda kamunun genel menfaatlerinin","korunması","imkanı ortadan kaldırılmaktadır, ki bu"
"s","S-BEABXO-0091-67","söylüyorum ha kardeş yani Allah","korusun","yaa. Kardeş ben sana bişe"
"w","W-SI27D1B-2470-2236","söyleyen Kayabal, sağlıklı bir kiloyu","koruyabilmek","için spor yapmanın harika bir"
"w","W-HH42C3A-0418-568","söyle, gözlerini (haramdan) sakınsınlar, ırzlarını","korusunlar.","Süslerini göstermesinler. Ancak (elbise, yüzük"
"w","W-FE39C3A-0397-862","sökülüp atılması konusundaki kararlılık aynen","korunuyordu.","Ondan vazgeçilemezdi... Ordunun başındaki kumandanlar"
"w","W-KE05A4A-2618-1690","system 19. yüzyıla kadar canlılığını","korumuştur.","Avrupa'da endüstriyel gelişmeler döneminde ailenin"
"w","W-DF10A2A-3021-530","Swap-işlemler, özellikle finansal kredilerde kurun","korunması","amacıyla da kullanılabilmektedir. Döviz rizikosunu"
"w","W-IE05A1B-3542-1277","suçu, 68. maddede, yurt içinde","korunması","gerekli kültür ve tabiat varlıklarını"
"w","W-GG22C1A-0531-2106","suçu hafifletmez, yaygınlaştırır. Hayvanları seven,","korumağa","çalışan bir insan olmam, isyan"
"w","W-IE39E1B-2837-1828","suçlular, hep sürücüler oluyor. Allah","korusun,","İstanbul'da yaşanması muhtemel bir tehlikede"
"w","W-BF10A2A-1365-1097","suçlayacaklarını biliyorum. Ama 20 yıldır","koruduğumuz","ve tüketici olarak yüksek fiyat,"
"w","W-OE39C2A-0608-953","Susurluk bu yapısını uzun yıllar","korudu.","İçinden her gün binlerce kişinin"
"w","W-QF32D1B-2724-1064","Suriye'yi İsrail ve Amerika'nın hışmından","koruyabilecek","yegâne ülke. Dahası Balkanlar'a, Avrupa'ya"
"w","W-FA16B4A-3306-1012","Suratı kızarıyor Ergin'in ama soğukkanlılığını","koruyor","yine de Ben polisiye olay"
"w","W-TI22C4A-0507-1831","sunuyorlardı. Hedefteki kişi ne denli","korunursa","korunsun, bir yolunu bulup üzerine"
"w","W-PA16B0A-0181-708","Sultanahmet benim için hâlâ büyüsünü","koruyordu.","Akşam işten çıkar çıkmaz, Sultanahmet'in,"
"w","W-AD19A1A-2078-1524","suların sonradan bu temizliklerini koruyup","korumadıkları,","nerelerde, nasıl kirlenmiş olduklarının saptanması"
"w","W-FA14B1A-1502-431","Subaylara, erlere karşı kendimi bununla","koruyacağım.","(Cüce kılıcını çeker; Subaylara, erlere"
"w","W-IF18E1C-4145-1875","Su ürünleri sektöründe, doğal ortamların","korunması","ve kontrolu, kaynakların sürdürülebilir şekilde"
"w","W-VD02A1B-4629-461","standartlar sağlanmaktadır ve toplumsal düzen","korunmaktadır.","İktidar aracılığıyla gözetim altında tutulan"
"w","W-FC06A2A-2004-1726","Stabilite ve aktivitelerini uzun süre","koruyabilirler.","Dondurulmuş Kültürler Bakteri içeriği konsantre"
"w","W-TD18E1C-4079-1697","spor ortamı, yaşanabilir kentler, tüketicinin","korunması,","gıda güvenliği, hayvanların korunması, bitki"
"w","W-MC06A2A-1956-1746","soğuklarında ve yaz sıcaklarında yeterince","korunmayı","sağlar. 2. Therophyt'ler (terofitler) Tohum"
"w","W-OI22E1B-2908-886","soyguncular, postahane kasasının otomatik olarak","korunduğunu","ve sabahtan önce açılamayacağını öğrenince,"
"w","W-ME39C5A-0196-870","Sovyetler Birliği'nin dağınık halde kalmasını,","korumak;","hatta gerekirse, bu dağılmayı hızlandırmak;"
"w","W-JD02A3A-1347-2372","sosyal şeratın maktulü değil, katili","koruyan","hapis cezaları uygulanmaya konulmuş... Peki"
"w","W-UF10A2A-1868-1118","sosyal sorumluluk, şeffaflık, yatırımcıların haklarının","korunması,","kurumsallaşma, kontrol, risk yönetimi gibi"
"w","W-CE05A1B-3406-370","sosyal refah hizmetinden yararlanma, özürlülerin","korunması,","ailenin tam gelişmesini sağlamak için"
"w","W-VD02A1B-4629-120","sosyal kontrol, yani toplum düzeninin","korunması","kaygısı, yabancılara ve toplumun kiri"
"w","W-KD02A1B-4476-962","Sorunu kavramak ve çözmek kalıpları","korumaktan","çok daha önemli ve öncelikliydi"
"w","W-NE18E1C-0317-1554","SORUNU HALA ÇÖZÜMLENEMEDİ! Uluslararası Radyasyondan","Korunma","Komitesi (ICRP) tarafından, nükleer santrallerde"
"w","W-KE39E1B-2839-828","sorunlarına yönelik önlemler alınması, çocukların","korunması,","kadın girişimcilerin desteklenmesi"" gibi hedeflere"
"w","W-KE05A1B-3630-887","sorunlarla devam ederek güncelliğini hep","korumuştur.","Hatta buna, tehdit algılaması içine"
"w","W-RE30D1B-2088-1595","sorunlara da işaret ediliyor. Azınlıkların","korunması","ve kültürel haklar Azınlıklara fiili"
"w","W-TA16B4A-0090-71","sorun mu var?"" Melike'ydi. Beni","korumaya","çalışıyor, diye düşündü Volkan. Beni"
"w","W-CE39E1B-2888-248","sonuçları etkileyecek tecavüzlere karşı sandıkları","koruyorlardı.","Sonuçta sandıktan yüzde 43.4 ""Evet"""
"w","W-JC06E1B-3084-1115","sonuçlar umut verici bulunmamıştır. Enfeksiyondan","Korunma","Enfeksiyondan korunmak için kemirici popülasyonunun"
"w","W-OE07A0A-2038-252","sonuçlar arasında optimal bir orantının","korunmasıyla","ilgili bir işletmecilik kavramıdır. Bağlantılı"
"w","W-TI22C3A-1184-1457","Sonunda sinir sistemini bu kaostan","korumak","için kendini zorlamamaya karar veriyorsun."
"w","W-KI31D1B-2425-1270","sonuna kadar ilk sıradaki yerimizi","korumak","zorundayız. Ancak bu konuda tek"
"w","W-SE09C1A-1534-1324","sonucundan emin gibiydi. Savaş felaketinden","koruduğu","milletin kendisine minnettar olduğunu zannediyordu."
"w","W-ME05A1B-3920-853","sonra ülkeler kendi iç pazarlarını","korumaya","çalışmış, Gümrük Vergisi uygulamaları artmış,"
"w","W-KC06A2A-2001-1516","sonra siyahlaşan lekeler meydana gelir.","Korunmak","için, koruyucu önlemlerin alınmasına ilave"
"s","S-BEABXW-0173-65","sonra işte şey yolda allah","korusun","bişi olur ne var niye"
"w","W-RD37C2A-0811-159","Sonra içinden ""Burası ne kadar","korumalı?","Aman başına bir şey gelmesin!"""
"w","W-NC06A2A-1966-1199","sonra demirlerin titreşmemesi gerekir. Betonun","Korunması","Yüksek veya derin elemanların beton"
"w","W-ID03A2A-0525-1773","sonra ancak kendi toprak bütünlüğü","korumaya","çalışan bir ordu haline gelmiş."
"s","S-ACAAQq-0419-118","son yıllarda geliştirdiği yeni projelerle,","korunmaya","muhtaç çocuklarımıza verdiği hizmetlerde önemli"
"w","W-FE39C0A-0250-669","son damlasına kadar Türkiye Cumhuriyet'ini","koruyacağım.""","""Ama tabi kendi imkanlarımla başa"
"w","W-PI31D1B-2351-177","Son 10 dakikada Ay-Yıldızlılar farkı","korumaya","çalışırken Stojakoviç ve Guroviç'in sürüklediği"
"w","W-JF32D1B-2575-1893","Sky Holford'dan ""kulübün nezih ortamını","korumak","için üye kaydında bu yöntemi"
"s","S-ADABPZ-0372-41","sizlere ödeyeceğiz. Eczacılık mesleğinin onurunu","koruyan","ve yücelten, evrensel bilim ve"
"w","W-RH42E1B-2918-777","Sizden öncekilere yazıldığı gibi (günahlardan)","korunmanız","için sizin üzerinize de oruç"
"w","W-PG37E1B-2932-462","Siyasi kimliğimizi ve devrimci onurumuzu","korumak","için kenetlenecektik birbirimize. Zaman zaman"
"w","W-GD02A1B-3720-1966","siyasi gelişmelerini sağlamaları ve sınırlarını","korumaları","için uluslararası ve hatta uluslar"
"w","W-PI09C4A-4727-2484","siyah-beyaz filmi bir süre daha","korudu,","sonra o da rengârenk olup"
"w","W-EC06A1B-3559-2184","sistemini oluşturan elemanların doğal dengesinin","korunması","ve sürekliliği, orman kaynağından faydalanan"
"w","W-IE05A2A-1016-813","sisteminde doların kilit para statüsünü","korumanın","bir yolu olarak mı petrol"
"w","W-NF10A2A-1821-2288","sistemin mantığında doğa ve çevrenin","korunmasının","yattığı ve bu amacın gerçekleştirilmesinde"
"w","W-KD02A3A-1913-909","sistemin işlemesi derecesinde yetim çocuklar","korunma","şansına sahip olmuşlardır. C. EĞİTİM"
"w","W-ND02A1B-4511-499","sistemdeki gibi sağlanacak; firmalar, rekabetin","korunmasına","İlişkin mevzuatla bağlı kalacaklardır. Yukarıdaki"
"w","W-MG24D1B-2298-1109","sinir sisteminin merkezidir. Sadece işçinin","korunması","amacına hizmet etmemekte; örgütlü işverenlerin"
"w","W-PG09C4A-0224-900","sinik ve aşırı alaycı olmaktan","koruduğunu","düşünüyorum. İlgilendiğim her konuya, kalbimin"
"w","W-NG09C3A-0416-897","sinemamızın namusunu bir yere kadar","korumuş","ve yerli filme gitmek isteyen"
"w","W-PF10A2A-1867-2479","sinai ve ticari mülkiyet haklarının","korunması","mevzuatı da, AB mevzuatına büyük"
"w","W-TE05A2A-1399-1263","silah sattığını öne sürerek kendilerini","korumaya","çalışmışlardır. Muhafazakar bir yazar; komünizm"
"w","W-LF32D1B-2719-1339","sigortaladı Bankaların, müşterinin parasıyla kendilerini","korumaya","yönelik sigortaları son dönemde ardı"
"w","W-RD02A2A-0809-1355","seçimlerde Osmanlı Devleti'nin toprak bütünlülüğünün","korunmasından","yana olan Muhafazakar Parti iktidardan"
"w","W-GE39E1B-3026-1384","seçilmezler ve özel güvenlik tedbirleriyle","korumaya","alınmazlardı. Nitekim çeşitli tedbirlerin alınması,"
"w","W-HG37C1A-0371-53","sezdiği için. Mithat Şen'in güçlükle","korunmuş","bir iç dünyayı betimlemediğini mi"
"w","W-TE36E1B-3354-1112","seyrettiğimde de ilk izlenimim değişmedi.","Korumasıyla","aynı kravatı taşıdığı fotoğraf da"
"w","W-VI22E1B-2915-1059","Sevgiyi gerçek duyan Her fırsatta","koruyan","Bana gönülden uyan Sensin güzel"
"w","W-QI22E1C-2910-1656","Sevgiyi gerçek duyan Her fırsatta","koruyan","Sensin güzel anneciğim Kucağında gezdiren"
"w","W-KE09C2A-0307-1448","sevgisinin ileride tekrar yaşanacağı umudunu","korumasını","sağlıyordu. Yaklaşık bir buçuk yıl"
"w","W-RI22C2A-0827-59","sevgisini, ilk coşkusunu, ilk güzelliğini","koruyamayacak,","Her güzellik yavaş yavaş pörsümeye"
"w","W-RI22C3A-0520-1438","sevgili değiştiren, iffetini ve namusunu","korumayan","bir gencin herhangi bir yönünden"
"w","W-MI22C3A-0508-946","sevgi dolu ama konulan kuralların","korunması","açısından her zaman disiplinli bir"
"s","S-ADABAo-0318-99","sette. Evet. Bizim yanımızda bizi","korurdunuz.","Şerif Gönen de aslında onun"
"s","S-BEABXO-0269-19","sesler. Niye, o arabayı kim","koruyo","peki? Kendisinde yapışkan var tekerleklerinde."
"w","W-GD39C3A-0381-1226","sesler geldi, Özer Çiller'in haykırışlarına","korumaların","koşuşturmaları eklenince meraklanan Bayan Bakan"
"w","W-IA16B4A-1334-160","sesler bile duyarken, Allah aklımı","korusun,","sesler duydum, ama ben uydurmuştum,"
"w","W-VD02A1B-4633-222","sert bir cisimle (tahta, karton)","korumaya","alınarak bandajla sarılır. Her gün"
"w","W-SE39E1B-2904-584","sermaye sahipleri değil, küçük birikimlerini","korumak","isteyenler de, döviz kurlarını takip"
"w","W-SA16B2A-0738-1422","serinkanlı olmalı ve çıkarlarımızı gözetip","korumalıyız.","Aşırı duygusallık bize yarar sağlamaz."
"w","W-MC06A1A-1952-1329","serin ve kuru bir yerde","korumaya","almak gerekir. Yazları sıcak kışları"
