"Register","Text","Left","-5;5","Right"
"w","W-QI09C4A-1373-940","ilgili ve hazır oluşu onun","anlattıkları","konusunda beni şaşırtmadı. Konuşmalarımız esnasında,"
"w","W-VD36C1A-2703-614","ilgili oyun oynama ve hikâye","anlatma,","konsantrasyon ve öğrenme bozuklukları, uyku"
"w","W-VI19E1A-4006-125","ilgili izlenimlerimi öğretmenime ve arkadaşlarıma","anlattım.","Hasan amcanın kişilik özelliklerini defterinize"
"s","S-ACABQq-0423-1271","ilgili hükümetlerin o metin üzerinde","anlaşmaları","gerekiyor, uluslararası uygulama budur; önce"
"s","S-ADABCo-0197-1286","ilgili düzenlemelerde bu üçlü emm","anlaşmalar","çerçevesinde adımlar atılır. Aksi takdirde"
"w","W-FI09C2A-1377-665","ilgi yağmuruna tutulmayı beklemiştim. Öyle","anlaşılıyordu","ki ben çok fazla beklentilere"
"w","W-NC40E1B-2873-131","iletişim kuralı ile boş yere","anlaşmayı","denemeyecektir. Servis sağlayıcınızda bulunan Windows"
"w","W-RI22C0A-0212-762","ilerlemesiyle kadınların neleri, nasıl istediğini","anlamaya","çalışalım. Haydi ders başına! Yirmili"
"w","W-VH03A2A-2026-1445","ilerleme sürecidir. Varlığı Madde Olarak","Anlamak","Varlığı madde olarak kavrayan anlayışa"
"w","W-CI37C3A-0469-693","ilerledikçe""de Yaşım ilerledikçe daha çok","anlıyorum","Ne büyük nimet olduğunu ah"
"s","S-AEABUZ-0021-981","ilerde. Ben emm Ekrem Bey","anlatacak","heralde çünkü onun bi sunumu"
"s","S-ACABFZ-0049-1278","ile veya IMF ile yapılan","anlaşmalarda","ifadesini bulan ilkeler ve taahütler"
"s","S-BEABXO-0389-2267","ile sarısıyla alman lazım. Tamam","anladım.","Açacağız bu sefer dur hissediyorum"
"w","W-SA16B4A-0269-1947","ile ilgili olarak bildiklerini şöyle","anlatıyordu","""1993 yaz aylarıydı. Ben o"
"s","S-ADABII-0439-1381","ile ilgili bir şey ile","anlaşırlarsa","ben kullanamam yani benim arabam"
"w","W-TF10A2A-1173-2107","ile halk üzerinde yapacağı etki","anlatılmalıdır.","Devletin ve özel sektörün uzun"
"w","W-HI09C2A-0805-2071","ile gidip Erika Renberg ile","anlaştık.","O yılların gözde artistlerinden biri"
"w","W-JE02A2A-1523-1056","ile bugünkü durumları ayrıntılı olarak","anlatılmaktadır.","Seksen altı kamu AR-GE birimi"
"w","W-SE39C3A-0205-2023","ile belli oluyordu. Hayat hikâyesini","anlatmak","ihtiyacı içinde bulunduğu da aşikâr"
"s","S-ADBBI^-0042-1149","ile anlaşmış, öteki beriki ile","anlaşmış,","yeni hükümet hemen kurulacakmış"" vs..."
"s","S-ADABPZ-0115-454","ilave gereken şimdi bizim burada","anlatmaya","çalıştığımız şey <B>. Evet. uluslar"
"s","S-BEABXO-0448-1932","ilan vermemişler ki bu sene","anlamadım","yani bunun mantığı nedir. Nası"
"w","W-TE30D1B-2111-2221","ilan etme yetkisi bitecek. Uluslararası","anlaşmalar","için parlamento onayı gerekecek. Yargıç,"
"w","W-TE36E1B-3295-1430","iktidar sahibi olmak korkmak demek,","anlayacaktı...","Sayfalar ve aradan geçen hayli"
"s","S-ADABAo-0388-1480","iklimin etkisiyle uzun boylu oldukları","anlaşılıyor","eski yazılardan. Cahız Türk ülkeleri Türk ülkeleri"
"s","S-ADABAo-0313-2059","ikisini birbirinden ciddi şekilde ayırcaz.","Anladım.","İkiside çok farklı. Çünkü artık"
"w","W-UA16B4A-0320-132","ikisi de odada, ne olduğunu","anlayamadın.","Ama duydun işte, kız isyan"
"s","S-BEABXL-0338-2048","ikinci öğretimleri. Evet. Yazarsak olur.","Anladım.","İşte o zaman sen şey"
"s","S-BEABXO-0084-1981","ikinci yarı bu önde bitirecek.","Anladın","mı? Anladım. Bu maç ilk"
"s","S-BEABXl-0008-1658","ikimizle ilgili. Aliye anlıyor sen","anlamıyorsun","yani. Onu diyorum. Ben kendimi"
"s","S-ACABQq-0425-1269","ikili veya çok taraflı vergi","anlaşmaları","yapar"" hükmü, yine ""görev alanına"
"s","S-BEABXn-0349-1125","iki üç ay çok iyi","anlaştık.","Sonra işte Aybatu falan. Hamza"
"w","W-NE30D1B-2084-9","iki ülke arasında ""hükümetler arası","anlaşmanın""","ziyaret sırasında imzalanması bekleniyor. Sezer"
"w","W-LG24D1B-2297-825","iki parti de böyle bir","anlaşmanın","olmadığını ileri sürdü. Gizli anlaşma"
"w","W-FE39C4A-0461-2084","iki milletin şerefini koruyan bir","anlaşma","yapılacaktır. Bu kadar ağır şartları"
"s","S-BEABXO-0416-1111","iki metre kadar Gülüş köpekleri","anlat.","Böyle durmuş, kafasını kaldırmış, bize"
"w","W-TD36E1B-2844-1379","iki köpeği"" diye hitap eder.","Anlaşılan","şair, tanrının iki elinde tuttuğu"
"s","S-BEABXO-0319-96","iki kişi olcak ki, derdinden","anlıycak","yani. Evet. Bazen şeyde sinir"
"s","S-ACABQq-0423-1306","iki kesimliliğin önünü açan bir","anlaşmadır.","Bu anlaşma, Enosisin yolunu açmıştır."
"w","W-SA16B2A-1196-2442","iki katlı bir ev diye","anlatmıştı","Kuzey. Yakınında başka yapı yoktu"
"w","W-TD43A2A-1811-1009","iki insan bir araya gelir,","anlaşamıyorlarsa,","önce tartışma başlar, sonra küfürleşme,"
"s","S-AAABLp-0161-332","iki hafta kadar önce kim","anlattı","hanginiz anlattı onu? <B> Teyit"
"s","S-BEABXO-0147-1003","iki bi iki daha dört,","anlatabiliyo","muyum? Atmış beş tane sayı"
"s","S-ADBBAo-0443-1048","iki arkadaşın arasını ne açtı?","Anlat","ama isim vermeden anlatırsan sevinirim."
"w","W-OH42C0A-0319-1879","iken Din Psikolojisi Profesörümüz sınıfta","anlatmıştı.","Ankara'nın köylerinden birinde, muskacılığı, üfürükçülüğü"
"w","W-TE30D1B-3263-1994","ihtiyaçlarının neler olduğu konusunu komşularına","anlatmada","güçlü pozisyonda olacaklarına dikkat çekti."
"w","W-FD05A4A-2607-66","ihtiyaç zoruyla mutlaka anlaşmalara varacak,","anlaşmalar","arayacak ve o zaman Avrupa'nın"
"s","S-ADAB^o-0240-2331","ihtimalle binicilik dersleri de aldınız","anladığım","kadarıyla çünkü çiftlikte bi şekilde"
"s","S-AAABOp-0011-610","ifadesine uygun olduğu için burada","anlatıyorum.","Monolog konuşma ise <D 735>"
"w","W-RI09C2A-0023-853","ifadesinden ve gülüşünden anladığını özümsedik.","Anlamadığımız","bir şeyler söyleyerek bastı gaza"
"w","W-UG37E1B-3068-2139","ifadeden ve onun yönlendirdiği olaydan","anlaşılacağı","üzere sokak ortasında yapılan infaz"
"s","S-ACABQq-0423-1575","ifade ediyor. Buyurun. Yani, yanlış","anlaşılabilecek","bir şey söylemiş!.. Sayın Başkan,"
"w","W-HI22C4A-0860-184","ifade edebildiği fikirleri varmış... Karşılıklı","anlatıp,","yararlanıyoruz... Bu arada onların da"
"w","W-TE36E1B-3354-1307","idi, ya Mersin"" diyor ve","anlatmayı","sürdürüyor ""Pasaportunun süresi dolduğu için"
"s","S-ADABPZ-0119-225","iddiasının başına gelir ki bunu","anlattım","size. Renk kavramı. Diğil mi?"
"s","S-BEABXO-0084-2218","iddaası yatmış. Yatacak tabi ben","anladım","zaten. 9 tane maç yapmış"
"s","S-BEABXO-0084-1617","iddaada aa! Nerden anladın? Ben","anlarım.","Kupskua piyo O ne lan."
"s","S-AEABUZ-0038-1798","idari özerklik deyince sadece seçim","anlamamalıyız.","Her konuda üniversite kendi tercihini"
"w","W-PD20C3A-0512-408","idamını ve sarı zarfı millete","anlatmak","mecburiyetinde kaldık. Şimdi de Koray"
"w","W-VE30D1B-2113-10","Ian Tomlinson'ın iç kanamadan öldüğü","anlaşıldı.","İkinci otopsinin ardından 47 yaşındaki"
"s","S-BEABXB-0003-1119","Hıı evet. <Gülme> Çok iyi","anlaşyolardı","yani. Hani face de bugün"
"w","W-ND39E1B-3298-92","hızına paralel olarak, yeni yaklaşımları","anlayacak,","benimseyecek, uygulayacak birikimde ve deneyimde"
"w","W-MA16B3A-0504-1574","hızlı bir şekilde toparladı sözlerini","Anladığım","kadarıyla konuşacak daha çok şeyimiz"
"s","S-BEABXO-0147-384","Hı-hı. Ya da şunu şöyle","anlatsam.","İki en eksi biri almasam"
"s","S-BEABXO-0447-2142","Hı-hı. Mesela gün içinde tazeliceksin.","Anladım.","Bi daha sürcen siliyo kendi"
"s","S-BEABXO-0390-776","Hı-hı. Ben haftaya sivil toplumu","anlatırım","büyük ihtimal etnisiteye de kısa"
"w","W-OD30D1B-2226-1186","Hüseyin Kıvrıkoğlu'nun, ""İsrail'le yapılan tank","anlaşmasına","karşı çıkanlar doğuştan Yahudi düşmanıdır."""
"s","S-ADABAo-0033-348","Hüseyin biraz evvel çok güzel","anlattı","o hadiseyi. Ben tekrarlamıyorum. Peki."
"w","W-FE39C4A-1346-2134","hüneri, kullandığı ürün markası Polo'dan","anlaşılabileceği","gibi, geleneksel İngiliz üst sınıf"
"w","W-JE05A1B-3588-1349","hümanist, insanlığa karşı sorumlu hissettikleri","anlaşılan","yargıçların, böylesine can alıcı bir"
"w","W-DC06A2A-1355-2230","hücresinden ana arının doğacağının yaklaştığını","anlamak","pek kolaydır. Bu hücrenin ucunu"
"w","W-TD09C4A-0211-512","hâlâ şehitler veriyor olmazdık, geçmişi","anlatmamızın","sebebi de bu zaten, yetkililer"
"w","W-UI45F1D-4719-1895","hâkimdir. Aslında bu kurgunun hakimiyeti,","anlaşılmayacak","bir şey değildir çünkü marka"
"s","S-ADAABo-0369-123","Hz. Süleyman. Dünyanın her dilden","anlayan","tek sultanı olduğu halde bir"
"w","W-QI27D1B-2452-1548","Hz. İsa'nın son 12 saatini","anlatan","""The Passion"" filmi nedeniyle büyük"
"s","S-ADBBI^-0326-195","Huysuz Virjin'in kişilik özelliklerini başta","anlattınız.","Peki Seyfi Dursunoğlu'nun kişilik özellikleri"
"w","W-TE36E1B-3353-2136","hukuk, içtihat yaratmak üzerinden meramını","anlatıyor.","Biz de, bize karşı uygulanan"
"s","S-BEABXs-0130-1072","Hoşuna gitti dimi? Anlat şimdi","anlat.","Oğlum ne adamsın lan. Ben"
"s","S-BEABXO-0128-1038","hoşuma gitti Nazan diye böle","anlata","anlata bitiremediydi. İşte öğlene doğru"
"s","S-ADBBAo-0443-228","hoşlandım, o bir gerçekti. Aileme","anlattım,","zaten bir şeyler yapılacaktı, ailemde"
"s","S-ACABTZ-0336-508","hoş, muhteşem de emm bunu","anlatmak","çok zor. Hakikaten nükleer konularda"
"w","W-CI37C3A-0469-33","hovardalığındaki cömertliğin bir tadı olduğu","anlaşılıyor.","Neyzen Tevfik iyi ki ömrünün"
"w","W-QA14B1A-4729-620","Hop hemşerim.. Al voltanı... Müdür","Anlamadım...","Öğretmen (üzerine yürür) Anlamadıysan (tanır)"
"w","W-TF25D1B-2153-1952","Holding bugün yoktu. Ancak, bu","anlattıklarım","Oyakbank'ın ING'ye satılmasına karşı çıktığım"
"s","S-BEABXO-0454-2241","hocan yani hep kitaptan. Hıı,","anladım.","Hani bazı hocalar vardır gelir"
"s","S-ADABAo-0355-1508","hocam, yani tam o alarak","anlaşıldığını","düşünüyo musunuz bilmiyorum? Ama sonra"
"s","S-ADABAo-0355-1652","hocam meselabu açılım meselesinden? Hiçbişi","anlamıyorum.","Haa bugüne gelinen noktada ne"
"s","S-BEABXL-0338-2049","Hmm. Onları okumadan tercih etmesin.","Anladım.","Peki mesela ona bakmadan yazar."
"s","S-BEABXO-0390-2344","Hmm çünkü. Ama şunu benim","anladığım","kadarıyla onun aslında İslami yönü"
"s","S-BEABXu-0052-2127","Hiçbir yere bağlı değil burası.","Anladım.","Burası tek kişilik bakın. Burada"
"w","W-FA16B4A-3306-545","hiç. Yalnız... bana doğru söyle...","Anlıyor","ve hırçın bir şekilde sözümü"
"w","W-MF10A4A-1822-1079","hiç söz etmiyorsa bunun bir","anlatma","biçimi olduğunu bilmemiz ve bu"
"w","W-EC37C2A-0662-1941","hiç olmazsa ne anlama geldiğinin","anlaşılmasına","yol açmıştır. Bundan başka başın"
"w","W-JA16B2A-1738-1278","Hiç olmazsa kalede olup bitenleri","anlatıyorum","sana. Bu da az şey"
"w","W-NE39C4A-0081-1031","hiç güvenmiyordu. Burada bir ayrıntı","anlatayım;","bizim ""işlerde"" tepeden tırnağa yani"
"w","W-QD36C0A-0222-772","hiç görmedim, ama saygımın derecesini","anlatamam.","Yüce görevinizde Tanrı ve aziz"
"s","S-BEABXO-0454-2136","hiç bişey yapma şansı yoktur.","Anladım","hıı. Ayy! ne günlerdi onlar"
"s","S-BEABXO-0454-816","hiç bizimle umursamıyolar bile derslerini","anlatıp","geçiyolar. Hı-hıı. Yazılıya giriyoruz şimdi"
"s","S-ADABAo-0355-1650","Hiç bi şi anlamıyorum. Ben","anlamıyorum","yani, anlıyan var heralde. Ben"
"s","S-BEABXp-0156-1717","hiç anlamıcaktır. Evet işte hiç","anlamıcaklar.","Çünkü yani o o şeyin"
"w","W-KF10A2A-1864-1946","hizmetlerle sınırlı kalmıştır. Münhasır Satmalına","Anlaşmaları","Blok Muafiyeti Ekonomik gerekçe Münhasır"
"s","S-BEABXO-0091-81","hizmetlerindeki hiçbir yaram diyemez bana","anlıyon","mu? <gülerek> O yüzden lafı"
"w","W-PA16B3A-0503-655","hizmetlerinde gençler üzerinde yaptığı gözlemleri","anlatıyor","""Sağ ve sol gruplara düşünce"
"w","W-LD39E1B-2927-2376","hissediyorsanız, bu kâfidir"" demiştir. Atatürk'ü","anlamak,","yaşadıklarını ve fikirlerini bilmekle mümkündür."
"s","S-AEABTZ-0337-1662","hissediyor ama ne olduğunu da","anlamıyor.","Eksik olan ne? Havva ana"
"w","W-JA16B3A-1133-2170","hikâyeyi sanki sade kendisi için","anlatmaya","başlamıştı. İşte boy uzatma oyununun"
"w","W-PI13C4A-1531-393","hikâyelemedir/Kayseri Beckett'lemesidir bilemeyeceğim. Ama aşağıda","anlatacağım","fıkranın varlığı, Türkiye Cumhuriyeti demokrasisinin"
"w","W-QD36E1B-2841-838","hikayen bile yok, bira bardaklarına","anlatacağın.","İnce bir sokağa süzülüp, her"
"w","W-IA16B3A-0300-989","hezeyanı bana yabancı değildi, onu","anladım","ve yemin billah ettim ""Hem"
"w","W-QE02A0A-1783-1239","heyetinin de teklifidir. Tabii, yanlış","anlamalara","yol açmayı önlemek için hemen"
"s","S-BEABXs-0130-65","heycanlı mı yoksa? Kendine güveniyormu","anlıyor","cin gibi hepsi ona görede"
"s","S-BEABXO-0012-2133","heves ettiğim şey buydu. Hani.","Anladım.","Bunlarla bi şeyimi tüketiyim diyosun"
"w","W-GF05A1B-4390-396","hesap açılırken, bankaya aksine bir","anlaşma","sunulmamışsa, aktif teselsüllü müşterek hesabın"
"w","W-RA16B2A-0403-663","hesabın defterini, iki deprem dürecek","anlaşılan!""","Kendi bakanı Rene Clement, ilk"
"w","W-CD09C2A-0207-536","herşeyi en ince ayrıntılarına kadar","anlattı.","""Behçet Cantürk, Türkiye'nin en büyük"
"w","W-UI22E1B-2914-153","Herkes şaşkındı ama ben meseleyi","anlamıştım.","Canım öğretmenim nasıl da güzel"
"s","S-BEABIs-0015-131","Herkes aynı. Şimdi asla asla","anlayamıyorsun.","Kimin ne yaptığını, kim olduğunu"
"w","W-UI09C2A-1758-684","herhangi bir şey olup olmadığını","anlamak","amacıyla son bir kontrol daha"
"s","S-BEABXO-0392-775","herhalde. Murat abi anlattırma bak","anlatırım","zararlı çıkarsın. Yeter, Lütfü amcam"
"w","W-OA16B4A-0127-496","herhalde. Cümleler kesik kesik, konuşulanlar","anlaşılmazdı.","Filmi sürekli ileri sararak izlemek"
"s","S-BEABXO-0147-1019","heralde öyle biraz daha basit","anlatabileceğini","düşünmüş. Yani bahçenin etrafına dediği"
"w","W-WI44F1D-5089-974","heralde başkaları ile ilgili olduğunu","anlamışsındır.","seninle bir problemim hiç olmadı"
"s","S-ADABPZ-0135-1825","Herakleitos'un söylediği şeyi çok derinden","anlamak","lazım. Hayata karşı bir tutkusuzluk"
"w","W-MA16B4A-0588-1094","her şeyini değiştirmişti. Bunları Namlı'ya","anlatıp","rahatlamak istiyordu. Son olarak Lübnanlı'yı"
"s","S-ADAA^o-0133-927","her şeyi anlatmaz ya da","anlatamazlar.","Bir sembolün herhangi bir yerde"
"w","W-LI22C4A-0783-880","her şeyi ""Hayat Güzeldir""de Güzeldir""de","anlattı.","İzleyicileri bu programın daima çok"
"w","W-MF10E1B-2864-477","Her şey dolara çevriliyor onlar","anlasın","diye. Fakat çok faydasını görüyoruz."
"w","W-PI09C2A-1320-2046","her zaman en doğruyu oluşturmadığını","anlamaya","başladılar. Bu da akılları karıştırdı"
"w","W-LD37C2A-1742-1577","her zaman bir anlamdır. Ama","""anlamak""","yorumlamaktan farklı olarak (ve tıpkı"
"w","W-FC06A3A-1049-1047","her zaman bazı kayıpların olacağını","anlatır.","Geleneksel tarımda, her ürünü kendine"
"s","S-BEABXO-0006-1240","her yer. Özel kişiler anlaşmış.","Anlaşmalı.","Hıı. İş kur anladın mı?"
"w","W-UD02A1B-4618-2337","her resim hakkında bir öykü","anlatmanızı","istiyorum. Burada ne olduğunu, kahramanın"
"w","W-DH42C2A-0980-2202","Her hal ve suretle onunla","anlaşınız.","Kendisiyle iyi, gereği gibi ve"
"s","S-BEABXg-0070-2116","her gün dinliyceksin anlatabildim mi?","Anladım","ama yani bide sevdiğimiz işi"
"w","W-IA16B1A-0094-1562","her gün bu işi yaptığını","anlatıyor.","Ondan önce yaptığı ise düz"
"w","W-NA16B1A-1736-1218","her an beni mi gözetliyor,","anlayamıyorum;","pat diye bitiveriyor yanımda. Bir"
"w","W-PI36C2A-0609-1387","Hepsine bunları anlattık. Önce inanmadılar,","anlamadılar","da. İnatla defalarca anlattık. Siz"
"w","W-NI31D1B-2327-301","hepsi de zorlu karşılaşmalardı. Federasyonu","anlamak","mümkün değil"" diye konuştu. G.Saray"
"w","W-GA16B2A-0460-2395","hepimiz okuduk, dedikten sonra Acaba","anladık","mı? diye sordu. Yadoha ile"
"s","S-AEABUs-0037-1787","hep istediğimiz, beklediğimiz, hep birbirimizi","anlamamız,","birbirimizi dinlememiz, birbirimizle bir bağ"
"s","S-BEABXO-0448-1931","Hep geçen seneninki falan çıkıyo","anlamadım","yani. Yine buldum bi şeyler"
"s","S-BEABXQ-0009-2252","Hep bebarer. <D 3> Aliye","anladım.","Hı? Aliye napyon anladım. Diyorum"
"w","W-ND02A3A-1266-583","henüz dahilde bile kendi vaziyetimizi","anlatmadık.","Köyler, hatta kazalar ve vilayetler"
"w","W-SA16B2A-0836-2371","Henry üstlendi Şey... Doğrusu nasıl","anlatacağımı","bilemiyorum. Ben, çocukluğumdan beri sürekli"
"w","W-TA16B2A-1204-1097","hemen Prenses Alina. Öfkelenmişti. ""Sizi","anlamak","olanaksız, güzel prensesim,"" dedi Prens"
"w","W-GC03A2A-1177-53","hemen hiç birinin geçerliliği olmadığı","anlaşıldı.","Sağ, dinsel köktenci partilerden biri"
"w","W-QA16B4A-0155-1975","hem de çok sevdiğim ve","anlaştığım","bir babaya kavuşmuştum. Kardeşim doğduktan"
"w","W-FE03A2A-1782-1891","hem de yuvarlak kafalıların varlığının","anlaşılması","üzerine, bu ayrım bilimsel anlamını,"
"s","S-ACABQq-0422-486","hediye ederseniz, hepimiz öğreniriz. Bunu","anlatmanıza","gerek yok. Gündemdışı ikinci söz,"
"w","W-NE39C3A-0779-2286","hedefinin hep insan hayatı olduğunu","anlatmaya","çalışıyordu. Bush Artık Türkiye de"
"s","S-ACABPZ-0329-511","hedefi size birazcık kemanın hikayesini","anlatmak.","Kemanın öyküsü adını koyduk. Bu"
"s","S-BEABXO-0358-1136","Hazırlarım, hazırlarım. Merak etme. Tamam,","anlaştık","o zaman. Hı-hıı. Jonny Ama"
"s","S-BEABXn-0349-1063","hazırlanıyo. Siz nasıl tanışmıştınız? Onu","anlat","hele? Dur anlatacaz daha dur"
"w","W-PD05A2A-2042-222","hazırlanmaktadır. Uygulama Rehberi, üniversitelerin Kurumsal","Anlaşma","önerilerini hazırlarken yararlanabilmeleri için web"
"s","S-BEABXO-0344-897","hazırlamadık ki. Onlar hazırlamışlar ya","anlatanlar.","Ee? Elimizdeki bizim bir sürü"
"w","W-PI42E1B-2938-1036","hazır dinleyen birini bulmuşken başlamış","anlatmaya.","Yenilerden, eskilerden anlattıkça açılmış uykusu,"
"s","S-BEABXO-0117-1078","hayırlısı. Hayırlısı canım. Serhat sen","anlat","biraz. Okuldan bahset. Okuldan Hocalardan"
"s","S-ACABQq-0423-1297","hayır, onlar da görüşülmedi. Bu","anlaşmalar,","yarın, Kıbrıs Devletinin anlaşmaları olacak,"
"s","S-ACABQq-0423-2324","hayır, alınmamıştır. Basına yansıyan haberlerden","anladığımız","kadarıyla, kendi devletinizin anayasasını kendi"
"w","W-OI42E1B-2937-666","hayatının zinetidir..."" meâlli bölümü okudu.","Anladım","ki, kâfilenin içinde oğulları var."
"s","S-ADBBI^-0326-536","hayatımı anlatırken bunu da özellikle","anlatmak","istedim. Kimlerle çalıştınız onlardan sonra?"
"w","W-RE39C3A-0721-2267","Hayatı, sadece ekmek kavgasına indirgeyerek","anlatmak","yalın bir anlatım olur. Halbuki"
"w","W-NA16B4A-0040-406","hayattaydı ve Halit'in ballandıra ballandıra","anlattığı","o geniş toprakların bir parçasını"
"w","W-QG37E1B-2933-1151","Hayatlarımızın Resmini"", yoksulları ve ezilenleri","anlatıyor.","Otoriteden yana olanlara ne yaparsanız"
"s","S-BEABXx-0394-879","hayat var. Emm, ben ne","anlatcaktım","lan? <D 4> Hıı, Schopenhauer"
"s","S-AEAA@O-0155-422","hayallerini en ince ayrıntısına kadar","anlatmış","hatta hayallerindeki bir çiftlik varmış"
"s","S-AEABUZ-0022-1145","Hayale kapıldık. Sevr yerine Türklerle","anlaşsaydık","biz çok şey kazanırdık. İngilizler"
"s","S-ADABAo-0312-44","Havası belli oluyor. Çok net","anlıyorsunuz.","Hı-hıı. Bakışından, duruşundan. Soruşundan, davranışından."
"s","S-ACABTZ-0336-51","havadaki metran gazının konsantrasyonun arttığını","anlıyorlarsa","biz de günümüzde bu kirleticilere"
"w","W-UE36E1B-3357-1383","haute couture koleksiyon da muhteşemdi.","Anlayacağın","çok şık ve eğlenceli bir"
"w","W-PD02A2A-2046-1282","hatırlatmalar çocuklar tarafından anlaşılmayabilir. Bunun","anlaşılması","çocukta zaman kavramının gelişmesine bağlıdır."
"w","W-SI22C0A-0272-2465","hatırlamıyorum'' cümlesini şimdi daha iyi","anlıyorum.","Ya evlenmeyelim ya da en"
"s","S-BEABXp-0156-820","hatta şey kurultayda filan da","anlatılmıştı.","Hı-hı belli sözcüklerin şey olması..."
"w","W-VA16B2A-1243-1354","hatta tersine körüklüyor, işime gelmediğinde","anlamazdan","geliyordum. Ya da kısa yoldan"
"w","W-OD30D1B-2176-1662","hatta bu zarfların komisyonda düzenlendiği","anlatılan","gerekçeli kararda şöyle denildi ""Böylelikle"
"w","W-VI13C3A-2641-1862","hasbi ve rızaen lillah okumaktalar.","Anlaşılan","öyle bir hayat yaşa ki,"
"s","S-BEABXn-0349-1062","Hasangilin sınıfı. Ee! <gülme> Sınıfını","anlat","hele sen Hasan. Ya sınıfta"
"s","S-BEABXn-0349-1065","Hasan sıra sana geldi. Sen","anlat","bakalım. Ya benim anlatacak bi"
"s","S-BEABXO-0342-315","Harp, harp, harp var, babası","anlattı","savaş var. Sürekli kaçıyorlar. Elaziz'de"
"w","W-CA16B3A-0140-1579","Harikaülke'nin bu yazının çevirmeni olduğunu","anladılar.","Asıl yazar Arnavut bir matematik"
"w","W-SA16B4A-0063-1582","harici bir şeydi onun ölümü","anlaşılan","-tabii öldüyse eğer. Sezen Hanım'ın"
"s","S-ADABPZ-0112-925","hareketleri annesine gülmüyor belki isteklerini","anlatamıyor.","Emm Bunlar fark edilince kimi"
"w","W-SE05A1B-4200-1989","hareket ettiği de aynı kitaptan","anlaşılmaktadır.","Bu bölümde aktarılanlar ışığında yazarın"
"w","W-NI09C2A-0592-2466","hareket ettim. Ağabeyim Ankara'daydı. Durumu","anlattım.","Sorup soruşturduk. Adı aklımda yanlış"
"w","W-QD36E1B-2841-77","hareket etmeden çalışmaları izliyordu. Kimsenin","anlamadığını","ben anlamıştım; Kral Peygamber ölmüştü."
"s","S-ADABCo-0335-898","Hanlığını bi anlasak veya Nemrutluları","anlatan","bi roman oo romantizmden ölürsün"
"s","S-BEABXA-0129-2204","hani. Hı hı hı hı,","anladım.","<B> Hani bilgi konusunda temel"
"s","S-BEABXO-0325-157","hani, biz üç kişiyiz dese","anlayacam","hani, çok geliriz falan dese"
"s","S-BEABXO-0012-2239","hani kendime de. Hıı. Anladım,","anladım.","Ama, hani 11 ilde yapmışlar."
"s","S-BEABXX-0411-133","hani hiç fark etmedik diyo.","Anlayamazsın","ki. Bi şey söleyim mi"
"s","S-BEABXs-0130-2077","hani ha bölüm yabancı dil.","Anladım","anladım. Kimin işte kime verilcek?"
"s","S-BEABXw-0395-2153","hani bizi görmemiş gibi yapıyor.","Anladım.","Halbuki bu bir şeydir, emm,"
"s","S-ADABAo-0332-409","hani bi emm arkadaşımız şey","anlatmıştı","buna kendi elleriyle yağlı dürüm"
"w","W-GI37C1A-2952-847","hangisinin en iyi netice verdiğini","anlarsınız.","Zoom ise mekanizmanın iyi çalışmasına"
"w","W-VG03A1B-3285-135","hangi vokal türün tercih edildiği","anlaşılmaya","çalışılıyor. Katılımcıların büyük bir çoğunluğu"
"s","S-ADABAo-0388-687","hangi kabilelerin nasıl Türkçe konuştuklarını","anlatıyor.","En beğendiği Türkçelerin Oğuz Türkçe'si"
"w","W-MA16B3A-0457-463","hangi hukuk ilkesine dayandığını da","anlamaya","çalışın lütfen. Asıl suçluları, kuruluşu"
"w","W-FD03A4A-0255-146","hangi duygusal durumda olduğunu hemen","anlayabilir;","ne var ki, yakından tanımayan"
"s","S-BEABXw-0057-2024","Hamını lan! Hamını. Sen ne","anladın","ki? Hamını! Hıı. Ham yani"
"s","S-BEABXO-0453-962","hallice bir şey anlatacam fıkra","anlatacam.","Hadi Damlaa. Ne fıkrası, ayıp"
"s","S-ADABAo-0366-1504","halk idi. Dolayısıyla halkın dilinin","anlaşılır","olması gerekir. Eğer gazete, dergi,"
"w","W-UI45E1C-5076-1864","halini buldum. Ne kadar sevindim","anlatamam.","Çünkü önceki kopya çok silik"
"s","S-ACABQq-0423-1230","halinde, Avrupa Adalet Divanının, bu","anlaşmanın","Avrupa Birliğinin mülkiyet ve dolaşım"
"w","W-LI27D1B-2828-714","Halil Helvacı da savaşı şöyle","anlatmıştı","""Üç gün hiç durmadan süngüleştik."
"w","W-DA14B1A-2668-2270","hali. Karşındakinin bir kadın, olduğunu","anlamıyan","adam... KÂMİL Görünüşüm bu benim..."
"s","S-ADAABo-0367-1791","Haldun yoluyla içinde yaşadığımız dünyayı","anlamamız","bir anlamda mümkün olur. Ama"
"w","W-NI09C2A-0592-953","halde içerlemiş ama, olayı kimseye","anlatacak","hali yok. İster istemez sineye"
"w","W-SI44F1D-5111-1787","halde anlaşılmıyor ve sonunda bir","anlayan","çıkıyorsa bu ifade doğrudur ama"
"w","W-EA16B2A-0744-2003","halamla aram pek iyi değil,","anlaşamıyoruz.","Benim dediğimi o ters anlıyor,"
"s","S-BEABXA-0129-1729","Hala Makedonca konuşuyorlar. Yunan da","anlamaz","onu Arnavutta anlamaz. Ben ne"
"w","W-OE39C3A-1415-129","hala geçerli olabildiğinin daha iyi","anlaşılmasını","sağlamasıdır. Yine başka bir müsbet"
"s","S-ADBBI^-0326-161","haklı olabilir. Belki de ben","anlayacağını","zannederek gereğinden kısa konuşuyorum. Daha"
"w","W-VE05A1A-2593-842","haklarının beşiği ve savunucusu olduğu","anlatılır.","Sonra da, para karşılığında Avrupa"
"w","W-TA16B1A-0069-418","hakkında anlatılanları ve zaten ne","anlatılsa","inanırlardı. Sözgelimi, Amca'nın başına şöyle"
