w,W-KE39C3A-0586-1095,"dikkat et. Çiller, görüşmeyi gazetecilere","anlatırken,","Demirel'in sözlerini İngilizceye çevirdi Cumhurbaşkanı,"
w,W-LE39C3A-0067-916,değildir efendim. Bir cehennemdir). Sürücünün,anlatmak,istediği pek masum. Yazın havanın
s,S-BEABXO-0086-602,değil mi ben sana böyle,anlatıyorum.,Yok sen anlat ben seni
w,W-CA16B2A-0159-1702,deyip iyi olduğunu iki kelimede,anlattı.,"Ali'nin karısı İmine, çizgi roman"
s,S-ADABAo-0388-847,deyince yalnızda belirli İslam ülkelerinin,anlatıldığını,kabul ediyor. Peki iklim iklim
s,S-ADABAo-0388-686,"devlet yönetme şekillerini, inanışlarını, yaşayışlarını",anlatıyor,"bu kitapta. Oradaki Bulgarlar'ın yaşayışları,"
w,W-DE05A3A-2976-35,devlet ricali ile yaptığı görüşmeleri,anlatırken,"""Sonra Rumeli Beylerbeyi, Şam naibi"
s,S-BEABXO-0343-371,devam edip gidiyor. Bide şeyi,anlatsana,ya <B> Ne? <B> Domates
w,W-JD03A3A-0897-98,"Destanı'nda ""Ak Îne-Ülgen"" ilişkisi şöyle",anlatılır,"Dünya birdeniz idi, ne gök"
s,S-BEABXg-0088-1096,dersin ki bana şu konuyu,anlat,bana bu konuyu anlat. Rahatlıkla
s,S-ADABIi-0124-830,dersi yani emm günlerce... Evet.,Anlatılması,gerekir. Belki saatlerce <gülme> ben
s,S-ADABCo-0241-649,Deniz Malkoç kamp günlerini şöyle,anlatıyor.,Yazın yıldızlar takımının kampına gittim.
w,W-SI22C2A-0701-1400,"denirdi. Malum, seksen öncesi dendiğinde",anlatılan,"dönem gibi, sancılı. Bir adam"
w,W-UI44F1D-4762-1025,"denesem devletten yana, ama senin",anlattıklarına,göre devlette yükselme şansımız yok
w,W-DA16B3A-0478-837,demli çay içerek anlatır da,anlatırdı.,"""Köftehorlar!.. Köftehorlar!"" derdi ha bire."
w,W-SA14B1A-1587-1550,demedim. DENİZCİ Sanki bir şey,anlatıyor,gibi gözlerin. Keşke konuşabilseydin. Konuşamıyorsun
w,W-UE39C3A-1162-1462,Delege Rıza Nur Meclis'te şöyle,anlatacaktır,Oraya gittiğimiz zaman karşımızda bütün
s,S-AEAB]o-0017-413,defterlerinde hatta yiğit orayı da,anlatmıştı.,Hatırlarsın o tahrir defterlerinde Anadolu
w,W-UE36E1B-3356-836,Defalarca teybi kapattırıp konuşan Sümbül'ün,anlattığı,bazı hikâyeler insanın aklını donduruyor.
w,W-KI09C2A-1544-1638,dedim. Kendi görüşümü uzun uzun,anlattım.,Kafasında tereddütler doğduğu açıktı ama
s,S-BEABXn-0349-209,dedim. Bahar'la olan olayımızı da,anlattım,hocaya. Yok bana sınıfın ortasında
w,W-DA16B2A-0032-917,"dedim. ""Bu gece burada olanları",anlatsam,"kimse bana inanmaz."" ""Her şeyi"
w,W-VI44F1D-4739-1163,dedim ve biraz düşüncelerimi hislerimi,anlatmayı,denedim ama farkına vardım ki
w,W-SI22E1B-2912-1837,dedim gülümseyerek. Ona tüm olanları,anlattım.,"Selin kendisini tanıtmadan önce, ailesini"
s,S-BEABXs-0130-219,dediler ya kesin yani çıktığımda,anlattım,sınavımı ooo tamam abi sen
s,S-ADABPZ-0119-958,dedi. Şimdi neler yaptığını burda,anlatacam,size. Şimdi <B> söylediği şu
w,W-SI22C3A-0559-197,"dedi Özgür. Ona, bu bölgeyi",anlatması,"için ısrar ettim. ""Benim anlatacaklarım"
w,W-RI27D1B-2460-87,dedi ve tek tek yatırımları,anlattı.,"Baykal'ın, bir Alman televizyonunda altyapı"
s,S-BEABXO-0343-1067,dedi ki e Sebahat Hanım,anlat,bakalım nası yapıyolar dedi. Çok
s,S-BEABXO-0322-1032,"dedi diyo, <gülerek> Suna'yı anlata",anlata,bitiremedi falan diyo yani o
s,S-BEABXz-0387-238,dedi bana <B> Şey size,anlattım,mı ben işte Orhangazi'de çalışırken
w,W-UI45F1D-4072-1337,"Dede, Çağlar'a o yılları şöyle","anlatmış,","""1948 senesi çok kış yaptı."
s,S-BEABXw-0353-982,de... kişiye hayrın olacak? Nasıl,anlatacak,ne diyecek? Uyuşuk uyuşuk. Bi
s,S-BEABXO-0342-617,de. Ama sen çok yanlış,anlatıyorsun.,Neyi? Şimdi bu kadıncağızı ağabeyleri
s,S-ADBBAo-0443-987,"de, benimkinin ismini verme! Ben",anlatacağım,artık biliyorum. Biz aynı evdeydik
w,W-QI42E1B-2939-1675,"de şikâyet değil, ancak, olanı",anlatmaktır.,"Allâh'tan, dayanıklıyım da, buruşup sökülmüyorum."
w,W-TI22C4A-0507-1694,de ölenlerin ruhlarının göğe çıkışları,anlatılmaktadır.,Bu Avesta bölümlerinden eksik ya
w,W-NA16B4A-0040-458,de yenilikleri pek severdi. Mühendisin,anlattıklarını,işitince büyük bir keyif ve
s,S-ADABAo-0388-398,de vardır. Ölü düğününü ayrıntılarıyla,anlatmıştır.,Düğünün nasıl yapıldığını soruyor Ruslar'a
w,W-UE39C3A-1162-1136,de tarihte saltanatla hilafeti ayırdığını,anlatır,"Selçuklu hükümdarı Melikşah'ı örnek verir,"
w,W-NG37C4A-0002-1718,"de onlara kulak veririz,"" sözüyle",anlatmak,istediğine bir örnek oluşturabilir bu.
w,W-VI19E1A-4054-58,de milletin en büyüğü olarak,anlatır.,"Bunların hepsi, gerçeği anlatan nitelikler"
w,W-RA14B1A-1582-2009,de lekenin hikayesini tüm delikanlılara,anlatırım.,"GUPSE Abi, şuna baksana ya!..."
w,W-DA16B1A-1504-2317,"de en hassas yerimden, üstelik",anlattığım,hikâyedeki benle ve oradaki hırsızlık
s,S-BEABXO-0117-1020,de düşünce fark ortadan kalktı.,Anlatabildim,mi? Öyle bir güzellik var.
w,W-SA16B4A-0047-1816,de bütün bunları bana neden,"anlatıyorsunuz""",diyorum sıkılmış bir yüz ifadesiyle.
s,S-BEABXO-0344-878,de biraz kavrar... Parmağı nasıl,anlatcaz?,Ha ha onu kavrar o
w,W-RG24D1B-2290-781,de babası ve annesinin aşkını,anlattığı,"""İğneli Şiir""inde Şiir""inde öpüşmelerine yer"
s,S-BEABXO-0165-373,"de anlatsana dayı, devamını da",anlatsana,"çalılıkların arasına düştünü, artistlik yaptını,"
s,S-BEABXB-0410-875,dağtacaz işte grubun bi konu,anlatıcaz,bi de şeyden klinikten yapıcaz
w,W-CH37C1A-1109-1841,davranışta) iletilmek duygu ve dünceyi,anlatmak,ta bir sanat kültürünü gerektirir.
w,W-ED02A3A-2028-794,"davranışların rolü, yeri ve önemi",anlatılarak,"başlanır. Hastaya endişe, kaygı, korku"
w,W-GA16B2A-0606-1019,davranamayacaksın; masal değilim ben; işte,anlattıkların,bitti; son bakışının da çizgisi
s,S-ACABPZ-0329-970,davet ediyorum. Bize güzel şeyler,anlatacak,sanırım. <Alkış> Evet sesim çok
w,W-PA16B4B-3311-611,"danışmanlar, Kiraz'ı öylesine ballandıra ballandıra",anlatmışlardı,"ki!... Abdullah, randevu verdikten sonra"
w,W-UA16B1A-3337-1521,"damlasının, ay pardon, kar tanesinin",anlattıklarından,"hiçbir şey anlamamışsın sen."" diye"
s,S-BEABXO-0342-1045,Dalman dünyaya geliyor. Aman Allah'ım.,Anlat.,"Eniştem bu, benim zaten başka"
s,S-ACABQq-0421-546,"dakikalık sürede, değil tarımın sorunlarını","anlatmak,",paragraflarını bile ifade etmek zordur
s,S-ACABQq-0422-929,dakika gibi kısa bir sürede,anlatamayacağım,"bu büyük şahsiyeti, sizlerin huzurunda,"
s,S-BEABXO-0342-576,daha yicem. <B>. <Gülme> Şimdi,anlatim,"da, siz de gülün. <Gülme>"
w,W-OA16B0A-0112-2152,daha mı iyi bir hikâye,anlatacaktı?,Belki de anlatacaktı. Bir aktris
s,S-ACABQq-0423-559,"Daha Danimarka'yı anlatmadım, daha Hollanda'yı","anlatmadım,",Fransa kapalı kutudur... Oralardan da
w,W-LC03C3A-0743-1087,daha da depresyon gelmedi. Sedat,Anlattıkların,bilimkurgu filmi gibi geliyor. Tamer
w,W-OH37C0A-0219-1809,daha birçok teori ve deney,anlatılabilir.,Ama hepsinin temeli aynı Hem
s,S-ADABAo-0033-564,da. Şimdi aslında Hazreti Hüseyin'i,anlatmadan,"evvel, İslam'ın nasıl ortaya çıktığını"
w,W-QA16B4A-0299-669,"da, neden nişanlından ayrıldın. Onu",anlat,"bana."" Bir an durakladım; konuya"
w,W-RI09C3A-0837-1147,"da, insanlara iyiyi, doğruyu, güzeli",anlatmak,olunca da... Sıla hasreti bile
s,S-ADABAo-0318-935,da şey o attan düşüşünü,anlatamam,ben çok üzülmüştüm abi ben
s,S-ADABAo-0366-828,da önemli olabileceği yavaş yavaş,anlatılmaya,başlanıyor. Bu bir karşı çıkış
s,S-BEABXc-0167-329,da öle. Ona da zor,anlattı.,<B> Yani her zaman şurda
w,W-JA16B3A-1721-1564,da yüzbaşı Deli Mehmet Beyi,anlatır,dururdu. Ne kadar çok dinlemişimdir
w,W-JI37C3A-0642-1155,"da yaşamıştı! Dostoyevski, Türgenyev bunu",anlatır.,Aynı filmi sanayileşme döneminde Türkiye
w,W-SI22E1B-2912-1393,"da söz nasıl tutulurmuş, gör.",Anlat,babam! Hani boya işi yapan
s,S-ADABI]-0127-579,"da sorucaktın. Of!, şimdi şöyle",anlatim,dedim ya şurdan alıcam yine
s,S-AAABOp-0011-999,"da onundur, çevresindekiler de onun.",Anlatabiliyor,muyum? <D 942> Her araba
w,W-OA16B4A-0777-1060,da ne? Çiseleyen yağmur altında,anlatılmaz,"bir düzenle, bir o yana"
s,S-ADABIi-0124-580,da nasıl bulunduğu mu şöle,anlatim,size isterseniz ben bugün tiyatroyu
s,S-BEABIs-0015-676,da işte emm olmadık olumsuzlukları,anlatıyor.,Yani tarihi de öğreniyor bu
w,W-NI22C4A-0366-18,da her şeyi olduğu gibi,anlatacaktım.,"İkinci yolu seçtin eminim. Evet,"
w,W-SH39C0A-0142-637,da daha çok dünya devrimlerini,anlatan,romanlardan seçilir. Seni Halk Adına
w,W-NE39C0A-0215-354,da bunları imrenerek seyredurması sanırım,anlatmak,istediklerimi daha net ifade etmeye
s,S-ADABPZ-0135-956,da ben size ayrı olarak,anlatacam.,Ama bazen bu eleştiri tipini
w,W-TG09C3A-0019-1532,da babamdır. Ama daha önce,anlattığım,"gibi, ben bu işte aşırıya"
s,S-BEABXO-0392-189,ciğerleri çıktı herhalde. Murat abi,anlattırma,"bak anlatırım zararlı çıkarsın. Yeter,"
w,W-OA16B4A-0061-124,"ciğer, rakı getirin ordan Muşmula'ya!",Anlat,"Muşmula, nedir derdin? gibisinden bir"
w,W-EI09C4A-0726-1353,CEZAEVİ BUNALIMI Dr. Neşati Üster,anlatıyor,İkinci Dünya Savaşı'nın ortalarında Nâzım'da
w,W-KA16B4A-0712-670,"ceplerini karıştırıyordu, sürekli bir şeyler",anlatıyordu.,"Sağ yanında, on yaşındaki büyük"
w,W-MI09C2A-0014-1615,cebiri başından sonuna kadar onlara,anlatmıştım.,Yaldızlı filan bir şahadetname almıştım.
w,W-CA16B3A-1003-2312,canım. Şimdi neden feministliği bıraktığımı,anlatayım.,Yalnız sabırla dinlemeni rica edeceğim.
s,S-BEABXg-0070-345,canlı adam arkadaşın bi tanesi,anlattı,bunu. Direk kendisi görmüş yani.
w,W-SI42E1B-2941-1376,"can kurtuldu!"" dedi ve hikâyeyi",anlattı.,"Padişah hikâyeden memnun oldu, ihtiyarı"
w,W-VG03A3A-2718-797,Camii'nin geçmişini ayrıntılı bir biçimde,anlatan,"bu makalede, mimarın dinsel duygularının"
w,W-VA14B1A-1606-225,Bıyık Bak sana bir hikaye,anlatayım.,İyi dinle. Hikayenin sonunda hala
s,S-AEABI^-0330-955,"bırakacam, ama aileme bunu nasıl",anlatacam,bunu bilemiyorum dedi. Benim tek
w,W-RD36C3A-0076-61,"büyütüyor. İnsanlık kavramını, hümanizmayı, Akdeniz'i",anlatmıyor...,"Onlara sanat kültürü aşılamıyor... İnsanın,"
w,W-EA16B2A-1145-392,"büyük duvara yaslanmış duruyorduk,"" diye",anlatmaya,"koyuldu. ""Küçücük beyinlerimizle idrak ettiğimiz"
s,S-AEAASO-0039-871,Büyük devlet. Çok büyük nimettir.,Anlatılacak,gibi bir nimet değil. Ancak
w,W-HG37C3A-0598-903,Büyük bir tutkuyu ve acıyı,anlatıyorlar.,Onulmaz bir acıyı. O anda
w,W-EA16B4A-1042-2044,büyük bir sosyologun ağabeyi olduğunu,"anlatırdı,",bilmeyenlere... Tek masa hepimize yetmez.
s,S-ADABAo-0388-744,"büyük bir kısmı şehirleri, ülkeleri",anlatırlar,"buna büldan coğrafyacılığı denilir, bir"
s,S-AEAA@O-0153-902,Büyüdüğü zaman ne olmak istediğini,anlatan,bi öykü yazmasını istemiş. Çocuk
w,W-SG37C0A-0189-371,bütünleşmek istemektedir. Sacher-Masoch kurbanın öyküsünü,anlatmaktadır.,Marquis de Sade'da doğa yasalarıyla
s,S-ADABPZ-0135-444,bütün konuşmalarımda onu amaçladım. Onu,anlatmaya,çalıştım. Ama sonra baktım ki
w,W-VD02A3A-2701-1634,Bütün bunlar çocuğa uygun yöntemlerle,anlatılabilmeli,ona doğru yöneltiler andırılmalıdır. Ancak
w,W-GE39C2A-1367-2414,büromda. Köylülerin de karşı olduğunu,anlatıyordu.,Ne yapılabilirdi? Partide konuyu açtığım
s,S-BEABXW-0058-415,"böyle. Gördüm konuştum monuştum da,",anlatmışlardı,biraz da hani öyle çok
s,S-ADABAo-0388-915,böyle yapmaz sadece iklime göre,anlatan,coğrafyacılar bu planı izlerler. Bunun
w,W-OC03A3A-1418-871,"böyle uzayıp gider. Kısacası, yazı,",anlattığı,"şeyin de, onu anlatanın da"
s,S-BEABXR-0010-769,böyle kapanır. Sonlanır arama. Anladın?,Anlatırım,sana. Şimdi orya koy. <Gülerek>
w,W-UA16B3A-1065-283,böyle bir karar aldıklarını ağlayarak,anlattı.,O âna kadar hiç tepki
s,S-ADABDp-0432-594,böyle bi sonucu? Biz hep,anlatıyoruz,"varislerinizde önce azalmayı görceksiniz, ondan"
s,S-BEABXO-0321-709,böyle arkadaşa anlatsana diyorum. Bi,anlatıyo,"arkadaşa falan, arkadaş gülcek gülemiyo,"
w,W-EI41C4A-1309-986,"bölümünü, İngiltere'deki yakınlarına İstanbul'daki hayatı",anlatan,mektuplar yazarak geçiriyordu. Dünya Edebiyat
w,W-TD39C2A-1753-1607,bölgesel milliyetçilik yapmakla eleştiriyor. Asıl,anlatmak,"istediği ise Ak Parti'nin, DTP"
s,S-BEABXc-0167-947,böle yavaş yavaş çalıştı ama,"anlatamadı,",böle Türk şey konuştu de
s,S-ACABQq-0423-612,"buyurun. Ben, size, kendi izlenimimi",anlatıyorum,"arkadaşım. Basında okudunuz, Sayın Başbakan"
s,S-ADABIi-0124-452,burjuvazinin yıkılışının gelişini kendi çağından,anlatmaya,başlamıştır. Döneminde anlaşılmamıştır ama yıkıldıktan
w,W-LA16B4A-0298-791,"Burhan. ""Bana bunu neden yaptın,",anlat.,Böyle bir cezayı hak etmek
w,W-EA16B1A-0856-1110,buraya geliyorlardı... Ağlama duvarı gibi,"anlatıyor,",anlatıyorlardı... (Yapraklarım bunun için mi
w,W-NG43C2A-1805-944,"burada?"" diye sordu. Her şeyi",anlattım.,"Çok kızdı, birçok hekimi başıma"
s,S-ADAA^o-0133-426,"Bununla birlikte semboller, her şeyi",anlatmaz,ya da anlatamazlar. Bir sembolün
w,W-FA16B3A-0986-1984,bunun neticelerini açık seçik tartışıp,anlatmamız,lazım oradakilere. Müstakil devlet olmaları
w,W-CH42A3A-0766-1910,Bunun evrensel sebeplerini uzun uzun,"anlatmak,",bu eserin çerçevesini ve hedefini
s,S-ACABQq-0421-259,"bunu yakalayacağımıza inanıyoruz. Tabiî, bu","anlattıklarım,","gerçekten, başarılması zor işler gibi"
w,W-SE13C2A-1487-346,"Bunu unutmayacağım. İyi, o zaman",anlatıyorum.,Boyutlar evrensel sistemin gerekli bölümlerindendir.
s,S-ADABLA-0266-215,bunu geçen yıl da biraz,anlattım,"di mi, hıı?, kaldı mı"
w,W-UC01A3A-0773-756,"Bunu enjekte ederim, daha önce",anlattığım,gibi karşısındaki kişilerin de kendisiyle
s,S-ADBBAo-0443-217,bunu bir trafik kazası olarak,anlattım,herkese. Öyle geçiştirdim. Peki neden
s,S-ACABTZ-0336-645,Bunu Batılı nükleer emm sanayiciler,anlatıyor,halka. Bizim sistemimiz de Çernobil
s,S-ACABQq-0421-964,bunların çok daha fazlasını bize,anlatacaktı.,"Gerçekten, ülkemiz, sağlık göstergeleri ve"
s,S-ADABIA-0265-285,bunlar hep işte o demin,anlattığım,baskılar. Ee bunların artık <D
s,S-ACABQq-0423-914,bundan ne kadar rahatsızlık duyduğunu,anlatan,bir ifade. Amerika'nın Sesi Radyosunda
w,W-KA16B2A-0056-1158,bunağa hiçbir suçum olmadığını ağlayarak,anlatmaya,"çalışmıştım. O zaman da, tıpkı"
w,W-LG22C3A-0892-370,Bunalıyorum. Çok bunalıyorum. Yani size,anlatamam,"nasıl bunaldığımı."" ""Tahmin edebiliyorum Dirayet"
w,W-EA16B4A-0489-212,buluştuk. Şöyle yürüdük biraz. O,anlattı.,Özgür nişanlanmayı iyice koymuş kafasına.
w,W-SI22C3A-0559-1188,buluyordum. Sonra hayat bana kendini,anlattı.,Onu tanıdım. Ondan öğrendiğim dersleri
w,W-PI09C3A-1078-232,bulunurdum. Mutfakta yaşananları ise hiç,anlatmayayım,daha iyi çünkü bu kitabın
s,S-ACABQq-0421-895,bulma olanağımız vardır. Bir anımı,"anlatarak,","sözlerimi bitirmek istiyorum. 1995 yılında,"
w,W-CE39E1B-2888-377,bugün mümkün değildir. Bütün bu,anlatılanları,"bir şemaya yerleştirecek olursak, sanırım"
s,S-ACABPZ-0329-833,bugün bir Stradivarius milyon dolarla,anlatılmaktadır.,Emm bir atölyede bir ustamız
w,W-SA14B1A-1587-20,"Bugün ayrılacakmış buradan. YUNUS Ah,",anlatamadın,değil mi kendini? DENİZ KIZI
w,W-DE39E1B-3023-910,"budur. Ancak, köleleşmiş ruhlara bunu",anlatabilmek,çok zordur. Diriliş için direnmeyi
w,W-OA16B3A-0737-464,bu. Yani perde duvar. Neler,anlatmıyor,Necip! Komşuları varmış. İşçiler bir
w,W-LA16B2A-0621-717,bu! Çünkü bir konuğa istenmediğini,anlatmak,için onu gereksiz yere yüceltmekten
s,S-ACABUZ-0035-807,Bu şiirleri bir tarihi süreci,anlatır.,Tevfik Fikret'in sadece yılmaz bir
w,W-OG24D1B-3361-682,Bu ülkede yaşamaktan kaynaklanan ve,anlatılması,"gereken şeyler var, sadece şikayet"
s,S-AEAA@O-0155-298,bu ödevde yedi sayfalık ödevde,anlattığı,"her şey yazılıymış bunda, hayal"
w,W-HI09C2A-0805-700,bu sözlerin film icabı olduğunu,anlatmamız,saatlerimizi alıyor... 16 yaşında cahil
s,S-ACABQq-0423-560,bu söylediğiniz yanlıştır!.. Daha Danimarka'yı,"anlatmadım,","daha Hollanda'yı anlatmadım, Fransa kapalı"
w,W-UG03A3A-2712-983,"bu sorunu çözemedim, kimseye de",anlatamadım.,Yoksa bu sanat fuarı bitebilirdi.
s,S-BEABXO-0345-705,bu olmalı... Yani işin inceliklerini,anlatıyo,öğrencinin dikkatini toplamak için. Harflerden
s,S-BEABXX-0411-1114,Bu nolcak önce bi onu,anlat.,Kapatim mi? Yok devam etsin.
w,W-JI37C3A-0091-1174,"Bu noktada kuşkularımızı, korkularımızı onlara",anlatalım.,"Karabasanlarımızı da onlarla paylaşalım ki,"
w,W-KA16B3A-0550-40,bu mektupların hiç tanımadığım hayatları,anlatacağını,"umuyordum. Sevgili Efendim, Bu şehir"
s,S-ADABAo-0332-899,bu lavabaliliği yaşayıp sonra bunu,anlatan,arkadaşların devri olduğu için şimdi
s,S-AEABTZ-0040-604,bu koşulda kurmaz. Nedenini de,anlatıyorum.,Hep tartışılan konu şu. Ya
w,W-MF10E1B-2864-2495,"bu kitabı, yazarı Leyden Capital'e",anlattı.,İşte global ekonomide geleceğin trendleri...
w,W-IA16B1A-2671-39,Bu kez o bir şey,anlatıyor.,Üçü birden gülüyor. Otobüsün içinde
w,W-FA16B2A-1037-1090,bu kadar soğukkanlı bir biçimde,anlatması,ne kadar şaşırtıcıydı... Tüylerinin ürperdiğini
w,W-FD36C4A-0341-1552,bu işin arkasında İngilizlerin olduğunu,anlatmışlardı.,Bir başka ilginç öykü Çukurova
w,W-LE30D1B-2082-774,bu insanların CIA Kürt'ü olmadıklarını,anlatmak,"için şu gözlemini aktarmıştı ""Alafranga"
w,W-LE30D1B-2082-1416,bu insanların CIA Kürt'ü olmadıklarını,anlatmak,"için şu gözlemini aktarmıştı ""Alafranga"
s,S-ADABPZ-0118-824,bu iki büyük vasfı hiç,anlatılmaz,oldu. Çocuklarımıza ve o geride
s,S-ACABQq-0422-829,Bu hususların Türk kamuoyuna iyi,"anlatılmasını,",AB meselesinin günlük yaşamımızda hepimizi
s,S-BEABXO-0342-643,bu hikaye <B> annem de,anlatıyor.,Diyor ki o zamanlar hafta
s,S-BEABXO-0117-791,Bu hastalıktan dolayı. Hmm hmm.,Anlatır,mısın <B> Emm yazılılarda çok
w,W-UA16B1A-1233-341,bu geveze de bunu herkese,anlatır',"demiş."" Yüzüne bakakaldığımı görünce, ""aslı"
w,W-NA16B4A-0054-1287,bu genç Türkiyeli kızın davasını,anlatabilmesinin,"tek yolu, 'eylem'dir. O da"
w,W-MG24D1B-2314-1162,bu gecenin kadir ve faziletinin,anlatılması,da yine onun kıymet ve
s,S-ADABPZ-0135-218,bu eleştirilere biraz karikatürize ederek,anlattım.,Bu akıl eleştirisi aslında doğru
s,S-ADAB^o-0132-1009,bu döneme kadar geçen süreci,anlatabilir,misiniz? Neler yaşadınız? Çok şanslı
w,W-RI22E1B-2911-1115,Bu duyuruda Kurtuluş Savaşı'ndaki kahramanlıkları,anlatan,bir marş yarışması düzenlendiği yazılmaktaydı.
w,W-MG37C3A-0024-2301,bu durumda onun kitaplarına başvuracaklarını,anlattı,"ödül töreninde, sonra da birkaç"
s,S-AEABUZ-0022-310,bu benim ilk okuduğum zaman,anlattığı,zaman Atilla abi bunu ya
s,S-AEABTZ-0040-458,bu benim <B> hocamın da,anlatmaya,"çalıştığı bi, ne kadar modernleşirsek,"
w,W-VI44F1D-4747-1466,bu arada zenimcim teşekkür ederim,anlattıkların,için ellerine sağlık bunu deneyeceğim
s,S-ADBBAo-0443-275,bu anlamda. Nilgün senin bize,anlattığın,"hikayede yerlere yattık. Hatta ""anlatsam"
w,W-SF10E1B-2870-293,Bu alana yönelik yeni planlarını,anlatıyor.,"Ancak, sanılanın aksine her başvuru"
s,S-ADBBAo-0443-984,Bu akşam hayatının tüm renklerini,"anlatacağız,",Beyazıt Öztürk geliyor... Derin iç
s,S-ADBBAo-0443-976,bu akşam başka bir pencereden,anlatacak.,Sayın Özcan Deniz geliyor. Birazdan
w,W-JI37C3A-0642-202,"Brian Magee, Einstein'ın bu çalışmasını","anlatırken,",bir gün böyle yeni bir
w,W-UA16B2A-0482-1769,boğazında düğümlenir. Sana sırt çevirir.,Anlatmak,istersin; ama anlatacağın şeyi bir
w,W-KE39E1B-3300-2181,bozmadan konuşarak her milletten insana,anlatan,"Cinuçen Tanrıkorur, aynı misyonu kalemin"
s,S-ADBBI^-0042-266,boyutunun çok önemli olduğunu Şaron'a,"anlattık,","""Olmaz bu. 21. yüzyılın eşiğinde"
w,W-LA16B4A-0289-575,boncuk vererek karşılığında altın aldığını,anlatan,İspanyol denizcinin sözleri haritanın Güney
s,S-BEABXg-0088-1021,bişe olmuş oluyo aile çevresinden.,Anlatabildim,mi? Anladım. He. Ondan şey
s,S-ADABPZ-0125-450,bizim gerçeğimiz. Bunu süslü laflarla,anlatmaya,hiç gerek yok. Hepiniz mezun
w,W-OH36C4A-0237-945,bizim bakkal bana moleküler biyolojiyi,anlatıyor.,"Aptallık millette değil, tepedekilerde."" Türkiye'ye"
s,S-ADBBI^-0042-479,"bizi bize tanıtması, Türkiye'yi Türkiye'ye",anlatması...,"Bütün sosyal gerçeklerimizle, tabiatımızla, yaşayan"
w,W-NE43C2A-1884-2345,biz zaten bütün derslerimizde öğrencilerimize,"anlatıyorduk,",konuşuyorduk. O gün de iyi
w,W-LD30D1B-2208-1435,"biz o düşmanın kötülüklerini, çocuklarımıza",anlatmayız.,"Oysa bütün milletlerin çocukları, hoşgörü"
w,W-QG03A1B-3264-914,Bitlisi'nin eserinden herhangi bir minyatürü,anlatmamıştır.,Öte yandan Şükri-i Bitlisi Selimnâme'
w,W-SI44F1D-5111-316,birleşik yazılınca hangi anlama geldiğini,anlatacaktır.,"Ben doğrusunun ""Sen de mi"
w,W-TA16B0A-0093-1883,birkaç gün önce gördüğü rüyayı,anlatırken,ağlamıştı. Kızının baştan ayağa her
s,S-BEABIs-0015-637,biriydi. Şu anlamda yakın tarihi,anlatıyordu.,Ha tabi çok detaylı yine
s,S-ADBBAo-0443-361,"birisini bulalım ki, onu çıplak",anlatsın,dedik. Programın başında erteleyelim demiştin
s,S-ADABAo-0366-470,birine ve köylülerle işte Türkçülük,anlatmaya,çalışır. Yani Türk olduğumuzu hepimizin
w,W-MA16B3A-0331-725,birileriyle onu konuşmak istiyorum. Onu,"anlatmak,","gülüşünden, gözlerinden, yürüyüşünden, ona dair"
s,S-BEABXs-0130-1010,biri anlatabilir belki uygulayamaz ama,anlatabilir.,Çünkü eğitimini alıyor. Hı hı
s,S-ADABPZ-0119-663,birer çift alan bilmem ne,anlatıyor.,İşte <B> bu vahiyi alıyor.
w,W-TI12F1D-4852-50,birde gerçek arkadaşlık vardır. Sırlarını,"anlattığın,","duygularını paylaştığın, dertleştiğin arkadaştır. Böyle"
s,S-ADABPZ-0112-202,birbirinin aynısı değil. Neden? Çünkü,anlattın,biraz önce. Beyindeki problem her
s,S-BEABXX-0411-983,biraz. <B> Şimdik burayı nası,anlatacağum.,Diceksin ki Mersin Çarşısı girişinde
s,S-ADBBAo-0443-633,biraz o günlere takılı kaldığını,anlatıyordu.,"İnsan hayatı böyle oluyor, insanın"
w,W-PI43C3A-1810-1845,biraz o günlere takılı kaldığını,anlatıyordu.,Yasemin Bozkurt İnsan hayatı böyle
w,W-SI22C2A-0760-1183,Biraz düşündükten sonra rüyamı anneme,anlatmaya,"başladım... ""Dağlık bir bölgedeyim. Ama"
w,W-TA16B0A-0093-1088,"biraz daha birlikte yürümeli, zamanın",anlattıklarını,biraz daha birlikte yorumlamalıyız... O
w,W-TA16B2A-0694-574,"biraz daha anlat; hadi..."" ""Daha",anlatayım,"mı? İnan bana, bende kendimi"
w,W-QG37E1B-2924-2263,"bir şikâyet evlerin tecrit köşesiydiniz,",anlatamam,olağanın dağlarında lorca papatyaları seviyor–seviyor
w,W-RA16B2A-1050-1033,"bir şey yok, ama bak",anlatıyorum,"işte. Kafam karıştı zaten, alışkın"
s,S-ADABIO-0437-1030,bir şey var mı? Yok,anlatabildim,umarım. Sizde yeni ürünleri beğeniyorsunuz
w,W-SA14B1A-4732-591,"bir şey var ki, bunun",anlatmam,"çok güç. Evet biraz yaşlı,"
s,S-BEABXs-0130-358,bir şey sor askerlik anısını,anlatsın.,Ordan bir sürü şey çıkar.
w,W-UI45F1D-4800-2454,bir şey olmalı. Tek kelimeyle,anlat,"deseniz, bireyin kutsanması derim. Batı'nın"
w,W-RD03A0A-0200-521,"bir şey olmadığı gibi, yazarın",anlattığı,alafranga çevreyle sınırlı da değildi.
s,S-BEABXn-0067-603,bir şey bu. Ben de,anlatıyorum.,Dedim içinde dedim gerçek meyve
w,W-RI42E1B-2940-820,bir çocuğum. Ben farklılığımı size,anlatayım,"ve tanışalım!.."" diyerek bana kendisini"
w,W-HE39C4A-1039-1502,bir çiftlik evi yapmayı planladıklarını,anlattığını,söylüyor! ANAP Bilecik Milletvekili Mehmet
w,W-RA16B1A-1496-1558,"bir Zen hikâyesini hatırlattı, uzman.",Anlat,"öyleyse. Birgün Zen ustasıyla çömezi,"
w,W-PD03A1A-3341-2146,Bir zamanlar gazeteciler Ferhan Şensoy,anlatmış,mıydı yoksa bir kitabında mı
w,W-MG24D1B-2285-1085,bir yetimhane çocuğunun dokunaklı öyküsünü,anlatıyor,ve New England'da günümüzden yarım
w,W-LG24D1B-2297-2186,"bir yerinde ""Bütün bunları size",anlatmam,için hiçbir neden yoktu. Bu
s,S-ACAAQq-0424-237,bir yarası; biraz önce size,anlattım.,"Bu, özellikle 1996 yılından itibaren"
s,S-ADABPZ-0135-654,bir yanlış kullanımıdır. Kant diyo,anlatıyor.,Eskiden böyle değildi ama daha
w,W-PI37E1B-3059-1108,Bir taraftan hastalıkların nasıl geçtiğini,"anlatıyor,",bir taraftan da yatakta debelenen
w,W-JI37C2A-1336-1576,bir süre içinde olup bittiğini,anlatmıştı,"yukarıda anlattığım, rüyada uçma üzerine"
s,S-ADABPZ-0135-800,bir sistem olarak betimler. Yine,anlatır.,Habitus pratik hayatın nesnel olarak
w,W-GD03C3A-0667-856,bir romandı Tutunamayanlar. Yazar neyi,anlatmak,"istiyordu bu romanıyla? Evet, neyi"
s,S-ADABIA-0265-883,bir rakam. Şöyle bir şey,"anlatayım,","benim atölyemde çalışan, uzun zamandır"
s,S-ADBBAo-0443-519,bir program yapıp senin hayatını,anlatmak,isterim. Olur neden olmasın. Peki
s,S-ACAAFZ-0048-806,bir profesör bunu sık sık,anlatır,"Amerikalılar 1844 senesinde, Çin'e ültimatom"
