"Register","Text","Left","-5;5","Right"
"s","S-BEABXg-0090-705","kaldın mı ammına koyım haber","ver","ya. Taa gece 11 buçukta"
"s","S-ADABLp-0061-487","kaldı. Onu da 2 dakkada","veririm.",""
"w","W-NA16B1A-0858-66","kalbinle çağırabilirsin çocuk,"" diye yanıt","verdi.","""Sevgini kullanırsan, beni bulursun. Çünkü"
"s","S-ADABPZ-0373-1820","Kalay, Dilara Gülsever'e mezuniyet belgelerini","vermek","üzere Yüksekokul Müdür Yardımcısı Doçent"
"s","S-BEABXA-0044-306","kalanlara sabır versin uzun ömür","versin.","Ama zor diyo baksana ölüp"
"w","W-SI42E1B-2941-1342","kalan L. K. ağlayarak polise","verdiği","ifadesinde, 13 yaşındayken zorla evlendirildiğini"
"w","W-UI44F1D-4755-680","kalamama, tüylenme, kilo fazlalığı, kilo","verememe)","kendimde görünce doktoruma sormuş ve"
"s","S-BEABXO-0086-830","kalacak yer ayarlıycaklar otobüs paramızı","verecekler.","Ich liebe dich. Öyle. İstersen"
"w","W-IE39E1B-2837-2268","Kahraman herhangi bir kutuplaşmaya meydan","vermemek","için, birliğimizin bütünlüğümüzün bozulmaması için"
"w","W-SE39C2A-1077-1549","kadının verdiği bilgiyi doğrulatmaya karar","verdi.","ARENA kendi haberlerini ısrarla izlemesiyle"
"w","W-EA16B4A-0353-221","kadının diye düşündü. Affedersiniz... Kulak","vermek","için durdu önünde, dinlemeye hazırdı."
"w","W-RG24D1B-2290-476","kadını olan Afife Jale'nin kendisine","verdiğimiz","ödül ne durumda dersiniz? 1902"
"w","W-SA14B1A-4732-1643","kadını bırakır, mahzunlaşır) Peki iş","verirler","mi bana? Piyasa kabul eder"
"w","W-OD02A2A-2052-230","kademeleri arasında nasıl bölüştürüleceğine karar","vermek.","Eğitimcilerle iktisatçıların uzun soluklu tartışmaları"
"w","W-OD30D1B-2199-1183","kadarki tavrımız devam eder"" karşılığını","verdi.","SP Genel Başkanı Recai Kutan"
"s","S-BEABXW-0005-1257","kadar. Hani Aliye'ye ailesi izin","vermez.","Kendisi niye gelmiyor. Oğlum yaz"
"w","W-OI42E1B-2937-1638","kadar, lif yönünden zengin besinler","verilmez.","Çok yağlı yiyecekler bağırsaktan geçişi"
"w","W-QD16C4A-0105-2496","kadar yükselmeliyim,"" dedi. ""Niçin?"" ""Bana","verilen","emeklerin hakkını ödemek için. Bakın"
"s","S-BEABXO-0007-2224","kadar yanmaya otuz faktör. İzin","vermiyo","mu? Vermiyo tabi. Kız ben"
"w","W-TI45F1D-4704-2210","kadar uzanmak gerekiyor. İmralı Mahkemesi'ne","verdiği","81 sayfalık savunmasında çocukluk yıllarını"
"s","S-AEABTZ-0040-513","kadar uluslar arası etkiye sebep","vermesinin","tek nedeni koruma kabının olmaması."
"s","S-ADABAo-0368-1295","kadar sevgiyi vermek. Hatta fazlasını","vermek.","Mümkün. Çünkü insan ya belki"
"w","W-KF10E3C-3370-718","kadar olan dönemde yüksek açıklar","vermiştir.","1988'den 1990 yılına kadar geçen"
"s","S-ADAB^Z-0370-2279","kadar okuduğunuz kadarıyla. Hemen arkadasımıza","verelim.","İsminiz? Biraz daha mikrofonu yakın"
"w","W-TD30D1B-2181-1510","kadar hapis cezasına çarptırılacak. Düzenlemeyle","verilen","görevleri, Telekomünikasyon İletişim Başkanlığı yerine"
"w","W-IA16B1A-0094-1605","kadar gençliğimi, hayatımı dişlilerin ağzına","verecekmişim","gibi. Zaman geçtikçe Matrakçı Nasuh'u,"
"w","W-RD03A3A-0435-1068","kadar geniş yer ve önem","verdi?","(Bugün bizim liselerimizde bütün bölümleri"
"s","S-ACABTZ-0336-980","kabulü nükleer endüstrinin en önem","verdiği","konu. Vaktiyle bunu pek emm"
"s","S-BEABX[-0163-732","kabul et. Çok güzel! Aynayı","vericen","mi? Çok güzel oldu bu"
"s","S-ADAASK-0036-997","kabul et"" diyor. ""Sana şunu","vereyim.""","Nedir o? ""Ya Muaz"" diyor,"
"w","W-UE39C3A-1162-2248","kabul ediliyor. Boğazlar'ın yönetimi, Türkiye'ye","verilmiyor!","Türk askerinin Boğazlar'da yerleştirilmesi de"
"w","W-KI37C4A-0267-68","kabul ederek, onun hakimiyetine son","verdi.","Umuyorum ki sen de aynı"
"s","S-AEABUZ-0022-1309","kablo geçirmek için polis şefine","vereceğimiz","rüşvet şu kadar. Bu olmuş"
"w","W-TE05A3A-1451-2245","kabiledir; buna önem ve değer","verdirmiş","olan kişi Cengiz Han'dır. Bunun"
"w","W-GC01A1B-3617-367","kabarıklığa Agger Nazi bölgesi adı","verilir.","Agger Nazi inspire ve ekspire"
"s","S-ACABQq-0422-1240","jeotermal enerjiye de gereken önemi","vereceğiz.","Hepinizi saygıyla selamlıyorum. Teşekkür ediyorum"
"s","S-ACABQq-0422-2462","jeotermal enerji kaynaklarımıza gereken önemi","vermemiz,","uluslararası enerji ticaretimize milyarlarca dolarlık"
"s","S-ADABPZ-0135-2260","Japon'un ben her seferinde çok","verdiğim","bir örnektir. Benim bir zaman"
"s","S-ADABII-0439-99","İşte şuydu maskeleri bize hazır","verdiler","siz yapın dediler sevgililer günü"
"s","S-BEABXn-0351-2043","İşte paraya dönderdiler. Kaçakçılığa izin","verdiler.","Uyuşturucu eroin pazarına falan... Kuzey"
"s","S-ADABCo-0364-829","İşte bekliyoruz. Bi kaç örnek","verseniz.","Neler var masada? Valla şimdi"
"s","S-AAABOp-0011-520","İşte <B> daha uygun. Hani","verilebildiği","için. Onun dışında <D 511>"
"w","W-FC35C2A-0346-471","İşleri Yüksek Kurulu'nun bir fetvasını","vererek","mevzuu bitirelim; ""Sigara içmenin gırtlak"
"w","W-RA16B2A-0629-1553","İşi kabul ediyorum, fakat bana","vereceğin","parçaların ekli olduğu makineleri de"
"w","W-NG24D1B-2304-2088","İş Sanat'ta bugün bir resital","verecek","olan piyanist Lars Vogt, 1990'da"
"s","S-BEABXE-0082-815","İçeydin. Para? Herif gelince parasını","verecek","diyeydin. Zaten canın sıkkın şimdi"
"w","W-KD02A1B-4473-2434","İzmir'in kurtarılmasından ""sonra"" gerçekleştirdiği tarih","verilmeksizin","söylenmektedir. Yaratılmak istenen izlenim, girişimin"
"s","S-BEABXF-0079-619","İzin vermiyorlar mı? <D 8>","Vermezler.","Senelik izin olsa neyse... Kedi"
"s","S-BEABXp-0156-132","İzin vermezler, terimsel <B> izin","vermezler","seni zorlar malzeme toplayamazsın yani"
"w","W-RA16B2A-0062-274","İyilikçi Hasan Paşa viyadüğü adı","verilmiştir.","Rahmetli Hasan Paşa'nın eşi viyadüşes"
"s","S-ADABAo-0318-1739","İtalyan sefaretinde. Evet. Size ödül","verilcekti","oraya hazırlamıştım. Evet, evet. Siz"
"w","W-SH43C4A-1885-941","İstanbul'daki tıp fakülteleri başörtüsüne izin","veriyorlardı.","Konya Selçuk Üniversitesi gibi birçok"
"w","W-JI41C3A-1509-1721","İstanbul'a gelmiş. Almanya'ya giden arkadaşlarının","verdiği","adları, adresleri bulmuş. Pazarlık üç"
"s","S-BEABXO-0128-2366","İstanbul Hilton'da kal o parayı","verirsin","falan böle manyak manyak şeyler."
"w","W-CD36C2A-0547-1393","İslâm'ı öğreten ilim adamları ders","vermekte","idiler. Ancak Burgiba onların verdiği"
"w","W-MD05A2A-0682-1489","İslamcıların iktidarı ele geçirmelerine cevaz","vermemektedir.","Ama bununla beraber hiç şüphe"
"w","W-TD39C0A-0273-1517","İslamcılar da bu saldırılara karşılık","vermeye","çalıştılar. Ülkü Ocakları'nın kapatılması üzerine"
"w","W-VE05A2A-2600-45","İslam yargılama usulüne göre; kadıların","verdikleri","kararlar, esasen kesin olarak verilirdi,"
"w","W-GD39C2A-0283-651","İslam alimlerinin böyle bir fetva","vermelerinin","doğru olup olmadığı münakaşasına girmiyorum."
"w","W-RE05A1B-4277-1122","İnönü’nün İnönü’nün bu bildirisi, muhalefete","verilen","güvenceler açısından çok önemlidir. İnönü,"
"s","S-BEABXO-0431-916","İnternet sitesinin tarihine göre karar","veremiyosun","sonuçta. Evet. Bizim açıklandı diye"
"w","W-UD36E1B-2863-1612","İnsan hakları ve özgürlükleri zemininde","verilen","her mücadelede olduğu gibi engellilerin"
"s","S-BEABXL-0123-1216","İngilizce öğretmenliği falan diye. Belgelerini","veriyorsun","imzanı atıp çıkıyorsun. Bi dosya"
"s","S-ACAAFZ-0048-1710","İngiliz istihbaratı ona fazla bilgi","vermez.","Verdiği az bilgide bile şunu"
"w","W-LE41C2A-1360-1264","İngiliz Cumhurbaşkanı satranç oynamaya karar","vermişler.","Mustafa Kemal, Cumhurbaşkanı'na, ""Oynayalım ama,"
"w","W-JA16B4A-1747-29","İnga. Yüzüne ciddi bir anlam","vermeye","çalışarak, kalkıp masaya geçiyor. Oturuyor"
"w","W-FG03A1B-3189-1334","İmar Planı gibi makro kararların","verildiği","fiziki planlama boyutlarında doğal ve"
"s","S-ADABAo-0033-1885","İmam Hüseyin Bu yolda sel","verdi","atalarımız Viran oldu nice yuvalarımız"
"w","W-SD18E1C-4169-524","İlgili Faaliyetler Avukatlık Kanununun Bakanlığımıza","verdiği","yetkilere dayanılarak yürütülen faaliyetler aşağıda"
"w","W-EC37C2A-0662-2323","İLETİŞİM VE ODAK İLETİŞİM Mesajı","veren","kişi ile alan kişi arasındaki"
"w","W-QI37E1B-3060-1985","İlerleyen günlerde Cuma Andoar adını","verdiği","büyük bir teke keşfeder. Andoar"
"s","S-BEABXO-0416-40","İkiye doğru oluyor. Belki de","vermeyebilirler","gece yolculuğunda ben hatırlamıyorum Metroyla"
"s","S-BEABXn-0350-935","İki şehit, üç şehit... Şehit","verildikten","sonra, şehit haberi verildikten sonra"
"w","W-MA16B3A-0331-322","İki gözü iki çeşme getirmiş","vermiş","Nilüfer'e. Benim aklıma gelen soruyu"
"s","S-BEABXc-0167-321","İi günler. <D 8> Şeyi","verir","misin? Bi dakka canım. <D"
"w","W-IE05A4A-1946-295","İhtiyar ""önce dereyi geçmeye karar","verdim,","sonra kendimi beni karşıya geçirecek"
"s","S-ADABAo-0388-486","İdrisi Avrupa hakkında fazla bilgi","vermiştir.","Hatta Ebul Fida coğrafyasının başında"
"w","W-FC35C2A-0346-2239","İdrak Edememek Sarhoş kimsede karar","verme","ve hüküm verme gücü zayıflamıştır."
"s","S-ADAB^Z-0370-1101","işverenin görüşüne göre üç defa","verir.","Mutlaka ve mutlaka başarmak zorundasınız."
"s","S-ADABIA-0109-881","işten çıktı. Burda cam sanayine","verdik.","Orda da birinin aklına uydu"
"w","W-UA16B4A-0320-1948","işte. Demek dalını kayısının gövdesine","vermiş,","sabahtan bunları planlıyordun ha? Vay"
"s","S-BEABXs-0130-1769","işte yürmi günlük işte parasını","verirsen","veririm. Tama dedi kız sonra"
"s","S-ADABPZ-0134-1675","işte Nominalistlerin'i yine emm örnek","verecek","olursak gerçeklik dünyasında tekler, tekiller"
"s","S-ACABTZ-0336-507","işte lobiler verecek. Veya <B>","verecek.","Bu aynı zamanda emm doğal"
"s","S-BEABXn-0350-1446","işte böyle şikayet edenlere koruma","verecez","diyo. Sonra bi kişi ondan"
"s","S-ADBBI^-0326-1345","işte böyle bir olaya karar","verdim","ve girdim. Hiç hayatım böyle"
"s","S-ACAAPZ-0034-289","işte bir devlet üniversitesi olmanın","verdiği","avantajların yanında da, kısıtlı avantajların"
"s","S-ADABCo-0249-2020","işte Baturina'nın inşaat şirketi <B>","verdiğini","idda ediyorlar yıllardan beri. Muhalifler"
"s","S-ADAASK-0036-692","işte Allah'ımız verdi de var.","Vermezse","olmaz. Yani biz, biz kazandık"
"s","S-ADABAo-0311-1251","işte 5 puan daha az","vermesi","çocuğun kaybetmesine neden oluyor. Dolayısıyla"
"s","S-AEABTZ-0040-1993","işleyecekmiş gibi ondan sonra karar","verilir.","Bu insan daha suç işlemeden"
"w","W-VF07A2A-1857-254","işletmenin performansı hakkında düzenli bilgi","verilir,","kendileri ile ilgili düzenlemelerde onlara"
"s","S-ADABPZ-0118-79","işleri bu kitapların satılmasına izin","veriyorsa","gayri resmi olarak dolaylı yoldan"
"w","W-VE39C4A-1180-1887","işler sarpa sarınca eylemlere ağırlık","vermiştir","ve bu hep sürüp gitmiştir."
"w","W-TD39C0A-0338-2469","işlemlerin, yargı organlarınca iptal kararı","verilmesine","değin yıllarca uygulanarak tüketilmesini, sonuçta"
"w","W-NE05A4A-1797-1712","işlemler; mükelleflerin beyannamelerinin alınması, tahakkukların","verilmesi","ve izlenmesi, mükelleflerin borç durumları"
"w","W-CG22C2A-0424-365","işlemekte, ilgili makamlara bulduklarını haber","verip","göstereceğine ve bunları esansçı yerine"
"s","S-ACABFZ-0049-2319","işlediği sevaplardan dolayı bazı kullarına","verdiği","bir mükafattır, yoksulluk da bazı"
"w","W-SD36E1B-2843-1765","işittiklerini insanlara bildirmekle yükümlüsün!"" Şam'da","verdiği","vaazdan sonra, sapkınları temizlemek ve"
"w","W-JE42C0A-0284-1864","işini bitirsin. Hz. Hamza'ya kardeşini","ver,","onu o öldürsün. Ali, kardeşi"
"w","W-UD36C3A-0891-176","işine gelmiyorsa yargının kapatmasına destek","verir.","AKP, AB'nin yararına çalışıyorsa, ""Onun"
"s","S-ADABPZ-0135-2179","işin etik olup olmadığına karar","verelim.","Buyrun. Hocam bir şey söyleyebilir"
"w","W-RG37E1B-3046-929","işidir. Parmakların arasında dili şekil","vereceği","bir madde gibi görmeyen şair"
"w","W-KE39C4A-0274-1660","işi var, artık kaç katını","veriyorsa","devlet, on hane köye dönüyor,"
"s","S-BEABXO-0450-190","işi olduğunda da kimseye hesap","vermek","zorunda diil, isterse ayda bir"
"s","S-ACAAQq-0419-707","işgal eden emperyalist güçlere karşı","verilecek","mücadele, milletle birlikte yapılacak topyekün"
"s","S-BEABXn-0351-1253","işaretlenmediğini doğru cevapların kendi adamlarına","vermediklerini.","O bakımdan doğru bak. Şey"
"w","W-UF25D1B-2765-594","işaret eden Özkentli, şu bilgileri","verdi","""Örneğin, Aile Koruma Şifresi ile"
"w","W-IE39E1B-2837-1564","işadamlarına nisan ve mayıs aylarında","vermiş","olduğu brifingin, sivil idarenin bıraktığı"
"s","S-BEABXO-0012-956","iş yapıyosun, onlara hesap falan","veriyosun","filan. Büyük bi proje. <D"
"s","S-AEAASO-0039-2192","iş ciddi Fransa kalkıyor İngiltere'ye","veriyor","bu, bu oyunu. O zaman"
"w","W-RE05A1B-4276-2212","içtüzük koyucu tarafından yapay olarak","verilen","bu ad, kod kanunlarla karışıklığa"
"w","W-QG37E1B-2924-2091","içsel bir sorun. Buna dışarıdan","verilebilecek","pek fazla cevap yok aslında."
"w","W-UE36E1B-3358-2330","içine girip dişlerini temizlemelerine izin","veriyorlar.","Benzer bir durum eski Roma"
"s","S-BEABXO-0013-2403","içine girebilirsin. 10 direk parası","verceksin.","10 direk, ucuz onlar ya,"
"s","S-BEABXO-0091-541","içine geziniyor. Şeye verdim Kazım'a","verdim","elbiseyi Kazım giysin diye. Ben"
"s","S-BEABXO-0091-1303","içine elbisenin içine geziniyor. Şeye","verdim","Kazım'a verdim elbiseyi Kazım giysin"
"w","W-KE05E1B-3299-503","içinde orduya anayasal bir rol","verilmiş.","İktidarı Gulkar adlı kendi partisiyle"
"w","W-OE05A1B-4185-2397","içinde ne kadar çok referans","verilmek","zorunda kalmıyorsa, politika geliştirmek bakımından"
"s","S-ADABPZ-0134-2221","içinde kendine yeniden çeki düzen","vermesi,","farkçı taleplere itibar etmesi, bu"
"s","S-ADABPZ-0134-1196","içinde görünüyorlar, ürün ve yalıtı","veriyorlar,","onun için kendi kendi kavram"
"s","S-ADABPZ-0134-2375","içinde geçeceği bir cümle örneği","vermeye","gerek duymadı ama biz derslerimizde"
"w","W-KA16B5A-0098-975","için. ""Canı isteyince kimseye haber","vermeden","çeker gider."" ""Üç gün önce"
"s","S-ACABQq-0423-2450","için, şimdi sizlere, huzurunuzda cevap","veriyorum.","Kamu İhale Kanununun 22'nci maddesinin"
"s","S-BEABXO-0122-2415","için, hiç sanki biz kızı","vermemiş","gibi. Çocuk ta sonra askere"
"w","W-CH03A1A-1515-2473","için, Cebrail şaşırarak Hz. Ali'ye","vermesi","gereken vahy'i, Hz. Muhammed'e (ss)"
"s","S-ACABPA-0434-1210","için şükranlarımızı sunuyorum. TÜSİAD çalışmalarına","verilen","bu desteği de hakikaten çok"
"s","S-ADAB^Z-0370-1169","için çalışıyorlar gerçekten, seviyorum üniversitemi.","Verilmeye","çalışılıyor evet sportif olarak ve"
"s","S-ACABQq-0423-996","için veya şahsen de bilgi","verilmediği","için. Bilmiyorum, Cumhuriyet Halk Partisi"
"s","S-ADABPZ-0374-1932","için verilmiştir. Sonunda büyük paralar","verilerek","İsveçe gönderildi yani Ruslardan korunmakiçin"
"s","S-ACABPA-0434-2434","için sözü Sayın İsmet Sezgin'e","vermek","istiyorum. Sayın Başkan, değerli arkadaşlarım,"
"w","W-GG22C2A-1216-1531","için sana Bana her şeyi","veriyorsun","demen için yeter bunlar İşte"
"s","S-BEABXO-0006-2494","için para vereceğine sana para","veriyorlar.","Gidip gelyon. Paranı alıp geliyon."
"s","S-ADABI\-0438-1271","için onu da göremedim. Karar","vermenizde","etkin oluyor mu bu promosyon"
"s","S-BEABXO-0450-2465","için Mustafa'ya Msn adresinin şifresini","vermiş.","Hıı? Ondan sonra orda da"
"w","W-OF10A2A-1785-1935","için hâlâ dış ticaret açığı","vermektedir.","İrlanda ise bazı ada ekonomileri"
"s","S-BEABXg-0070-1393","için hani göz yumar anahtarı","verir.","Zaten zarar vercek kişiler değiliz"
"w","W-VI45F1D-4061-2300","için en iyisini yaptığıma karar","versem","de, oğlum için çok kararsızdım."
"s","S-BEABXg-0088-168","için dönemine 500 milyon para","verdik.","Okumayanlar dışarıdan alanlar, devlet veriyo"
"w","W-LE09C3A-1183-571","için dua etmek bana huzur","veriyor,","çünkü böylece bencillik etmemiş oluyorum."
"w","W-VH03A3A-2991-75","için Diyanet İşleri Reisliği'ne malûmat","verir""","hükmüyle daha da belirginlik kazanmaktadır."
"w","W-FH03A1B-3104-1483","için de bu türden kararlar","vermek","zorunda kalıyorlar. Özellikle geçkin koma"
"w","W-LH13C1A-1559-1225","için davranabilir. Bize yaşama gücünü","veren","bu güzelliktir... Bütün bunların konuşulduğu"
"s","S-ADABPZ-0125-947","için biz size sokaktan bilgi","veriyoruz.","Şuan ki size verdiğimiz bilgiler"
"s","S-ADABIO-0437-1055","için baktım yani koku mu","veriyor","renk mi veriyor hani gizliyor"
"w","W-RA16B1A-1209-1016","için avların üçünü de sana","veriyorum.","Mevlâna'nın notu Akıllı kişi, tilkinin"
"w","W-EA16B4A-0489-1066","içime. Sensiz olamam artık. Karar","verdim,","seni annemle tanıştıracağım. Nişanlanmayı bile"
"w","W-ZI45E1C-5072-821","içimden, direne direne yazmaya karar","verdim.","Hatırlasanız Aralık ayı boyunca ""2012'nin"
"w","W-GE39C0A-0208-765","içim rahat değildi. Öğleden sonraydı.","Verdiği","adres, Kale Yolu, Ertan Apartmanıydı."
"w","W-LF10A2A-1858-1673","içi ekonomik politikaları geliştirmeye öncelik","verdiği","bir dönemde, Türkiye'nin ürettiği işlenmiş"
"s","S-ADBBAo-0443-44","içeri girdim. Çocuk anahtarı elime","verdi,","""Teyzeciğim al güle güle otur."
"w","W-AI41C3A-1438-114","iç, suya para verme!"" öğüdünü","verirdi.","Halil'in babası Celil hovarda adamdı."
"w","W-PG37C3A-0343-818","iç konuşma Berber Aynası öyküsünde","verilir.","Ayna karşısına geçen öykü kişisi,"
"s","S-ADABPZ-0374-369","iç içe girmişim kız alıp","vermişim","nedir niye kavga edim birbirimle?"
"w","W-RI22C2A-0404-1570","izleyip her defasında aynı tepkileri","vermelerini","bir türlü anlayamazlar. Hiperaktiflik de"
"w","W-MG24D1B-2285-1455","izleyen bestecilere sık sık yer","verilmelidir.","Öbür sanat kurumlarımızda olduğu gibi"
"w","W-UI11F1D-5152-1394","izlemem gerektiği konusunda bana fikir","verebileceğinizi","umuyorum. Kendinize iyi bakın. M."
"s","S-BEABXO-0056-872","izin aldı. <gülme> Babasından izin","veriyo","bak. Babası izin vermiyo musun?"
"w","W-NI22C2A-0169-563","iz bırakmış büyük isimlere yer","verildi.","Bazıları emekleriyle de, oyunculuklarıyla da"
"s","S-BEABX\-0065-631","iyisi ya. Amına koyim <B>.","Verme","verme vermedi dese napıcan? Bi"
"s","S-ACABUZ-0035-1755","iyidir. Ama çok iyi dil","verirdi.","Atatürk'ün mesela Çanakkale de bir"
"w","W-OI31D1B-2350-1734","iyi şekilde yapılacağı konusunda söz","verdi.","Canaydın, jübile tarihini yoğun maç"
"w","W-VI45F1D-4801-2419","iyi özümsemiş, daha özgür karar","verebilen,","daha büyük sosyal çeşitliliğe sahip"
"w","W-DI22C3A-0719-371","iyi olamaz. Buna da izin","vermemek","için, ellerinden geleni yapacaklar tabii"
"s","S-ADABPZ-0135-1375","istiyorum. Yani Sezar'ın hakkını Sezar'a","vermek","adına modernliğin de post modernliğin"
"s","S-BEABXO-0071-1615","istiyorum diye oraya şey onay","vermem","gerekiyormuş. Ee! ben vermedim. Rıza"
"s","S-BEABXW-0058-1414","istiyolar. Bizimkiler tamam dedi, biz","veririz.","Arkadaşı aradım, dedim bizimkiler ""ok"""
"s","S-ADAASK-0036-1854","isteyelim canım? İsteyen getirip geri","versin.","Ama bir akarı olacak, bir"
"s","S-BEABXO-0056-1181","istersen 4 gün... Para da","verdin.","Bakmana da para verdin? Kahveyi"
"s","S-AEABUZ-0021-2335","istemiş. Çünkü biz buraya ders","vermeye","gelmedik. Deneyimlerimizi paylaşmaya geldik. Sistemi"
"w","W-OI22C3A-0751-1897","istemiş, ama hiçbir ana evlâdını","vermemiş.","Bunun üzerine ""Ya çocuğunuz, ya"
"s","S-ADABII-0439-586","istemiyorum dedim. Ben ona tarih","vermiştim","ağustos da aradı beni yılbaşında"
"s","S-BEABXO-0346-399","istemiyorsan ver bana ver. Söyle!","Ver...","İyi gözlüğüm sende. Kapaaaak! Değiştirim"
"w","W-SA09C1A-0240-2287","istemiyordum. Ama büyükler çoktan karar","vermişti","bile. Onlar için çok uygun"
"s","S-BEABXO-0449-25","istemiyolarsa başlarından atmak bi tane","verirler.","Satarlar ya zaten. Çok güzel"
"w","W-TH09C1A-0834-924","istemek için oraya gitmeye karar","verdik","ama suyu kendi çabamızla geçmemiz"
"w","W-HE39E1B-2836-318","isteklerin çok azına olumlu cevap","verebiliyor.","Çünkü Diyarbakır gibi kendisi de,"
"s","S-BEABXR-0010-1314","istediğinin tercihiydi. Bana seksen lira","verseydiniz","ben kalırdım. İşte senin gözün"
"w","W-LC03C3A-0743-2265","istediği konuda değiştirip sadece stratejileri","vereceksin.","Gerisini o TOTE modelde halledecek."
"s","S-ACABQq-0421-2470","istedim; bu bağlamda huzurunuzdayım; ancak,","verilen","5 dakikalık sürede, değil tarımın"
"s","S-ACAAQq-0424-1452","istasyonumuz var ve Bitlis İline","verilen","tahlil sayısı 7. Yani, bir"
"s","S-BEABXO-0071-1379","ismini söylerdi soyadını söyledi öyle","verdik.","Vermiyceksiniz dedim kardeşim vermiyceksiniz dedim."
"w","W-QA16B2A-1435-111","ismine yapayım ve senin kendilerine","vermen","daha münasip olacak. Baki selamlar."
"s","S-ADABAo-0033-200","isminde Ömer bin Sad emir","veriyor","ki Harmene'ye Hüseyin biraz daha"
"w","W-PG24D1B-2301-1241","isimli bir yazısına da yer","verilmiş.","Victoria Çağı'nın bu önemli yazarından"
"w","W-SI22C4A-0170-1802","isimlerine ulaşmakta gecikmedim. Arkadaşlarımdan alıp","vermeyi","ihmal ettiğim ya da unuttuğum"
"s","S-ADAACo-0302-1896","isimleri geçen 6 asker ifade","vermek","için Beşiktaş'taki İstanbul Adliyesi'ne götürüldü."
"s","S-ADABAo-0433-911","isimle yazılmış nickler. Bunlara örnek","vericek","olursak, Sam. Sam sanırm Samantha'nın"
"s","S-ADABAo-0033-1883","isim olarak Ehli Beyt'in isimlerini","vermişler,","koymuşlar. Edebiyatlarına yansıtmışlar. Ve Ehli"
"w","W-SE39E1B-3036-919","ise, kâinatın bize emanet olarak","verilmiş","hassas bir hediye olduğunun farkında"
"w","W-IE39C2A-2619-2366","ise, eşinin tüm kararlarına destek","verir","ve onun en yakın yardımcısı"
"w","W-SF10E1B-2870-2320","ise tanıtım ve acentelere önem","vereceğiz.""","Almanya'nın 3. büyük sigorta grubu"
"w","W-OD30D1B-2199-1192","ise saat 07.00'de başlayacak oy","verme","işlemi, saat 16.00'da son bulacak."
"w","W-QF25D1@-2145-927","ise 905 milyon dolarlık teklif","verdi.","Projenin temelinin bu yılın ilk"
"w","W-QE30D1B-2107-953","IRNA, Savunma Bakanlığı kaynaklarına dayandırarak","verdiği","haberde, ""Kevser"" adı verilen füzenin,"
"w","W-TI44F1D-4761-955","inşallah.. yazılım mühendisliği kadrolarını bize","verirler","umarım.... Bu atamayı bekleyen arkadaşlar"
"s","S-ADAB^Z-0370-1445","inşallah yarıyılda olur. Evet kesinlikle","veriliyor.","Yani burası yeni bir üniversite"
"w","W-QD36C0A-0222-435","inşa edilmiş ve malzemeleri de","verilmişti.","Peşmergelerin silah, mermi, telsiz, erzak"
"s","S-ACAAQq-0419-1157","inşa edilmeye başlamıştır. Bunları örnek","vererek,","Türkmenistan'ın bağımsızlığının pekişmesi gibi bir"
"w","W-VI44F1D-4747-310","inş. bende 1-2 kiloda olsa","veririm","hepinize allah rahatlık versin yarın"
"w","W-UA16B1A-0913-568","insanın her an kendine kolaylıkla","verebileceğine","inandığım sıradan hesabının bile ne"
"w","W-DD36E1B-2846-1528","insanın hakları konusunda fazla taviz","vermeye","de yanaşmıyorlar. Bu da olacak"
"w","W-MH03A1B-3134-2430","insanı, hacca gitmek ve zekat","vermek","isteyecektir. Bu isteklerin yerine getirilmesi"
"w","W-OI37E1B-3058-1811","insanların, adaletten yoksun insanlara karşı","verdiği","bir tavırdır. Bizler sadece kendimiz"
"w","W-NE39C0A-0215-509","insanların da kendiliğinden belirivermesine sebebiyet","vermişti","ki, bu kuvvetlerin küçümsenemeyecek nicelikte"
"w","W-ND02A3A-1266-269","insanlardır. Ama ikinci dönem adını","verdiğimiz","1943-1964 yılları arasında AA belgelerinde"
"s","S-ADAB^Z-0370-2402","insanlara yönelik emm eğitimler de","veriyoruz.","Evet. Yani nasıl söylesem emm"
"s","S-ADAABo-0369-225","insanlara Körler Ülkesi ismini kim","vermiş","dersiniz? Anlatalım. Hikaye bu ya"
"s","S-ADABAo-0368-1458","insanlara insan olduğu için değer","vermeniz","ve bunu hayata yansıtmanız gerçekten"
"s","S-AEABTZ-0040-237","insanlar ve canlılarda alınmasına izin","verilen","doz ve kirletici sınır değerleri"
"w","W-QD37C2A-0506-1512","insanlar tanrılara Homa sunmaya son","verdiklerinde","dünyanın sonu gelecektir. (Bu korku"
"s","S-AEABTZ-0040-1682","insanlar olarak bi şekilde hizmet","vermek","için kurulmuşsunuz ve bir ücret"
"w","W-RB38E1B-2883-1781","insana, hem de hiç destek","vermeden","bırakıyorsunuz? Bu dünya bitince gidecek"
"s","S-ACABQq-0426-1455","insan sağlına yalnızca sigara zarar","vermez.","İnsan yaşamında, düşük kalorili besinden"
"s","S-AEABI^-0330-1989","insan idarecilik yapabilir. Bağımsız karar","verme","yeteneği olan, mevzuata hâkim, kanunları,"
"w","W-DA16B2A-1719-857","iner inmez, belki de, söz","verdiğiniz","saatte nikâh memurunun karşısında bulunmak,"
"w","W-MF10A2A-1862-912","indekslerin temel özelliklerine göre karar","vermektir.","Bilindiği gibi, Gini indeksi, Lorenz"
