"Register"	"Text"	"Left"	"-5;5"	"Right"
"w"	"W-TE37E1B-2905-845"	"istekse Yugoslavya'ya dönük saldırıda tereddüt"	"eden"	"müttefiklerin Miloşeviç'le bağlantı kurmasını engellemekti."
"s"	"S-ADABPZ-0112-406"	"isteklerini anlatamıyor. Emm Bunlar fark"	"edilince"	"kimi zaman erken fark ediliyor"
"s"	"S-BEABXA-0129-184"	"isteklendirdiniz mi? Evet, evet. Eşlik"	"ettiniz"	"mi? Tahrik ettiniz mi burda"
"w"	"W-DA16B1A-1507-1796"	"istediğinden, İslâmın beş şartından söz"	"ediyor."	"Muhammed Hira Dağındaki mağarasında yalnızken"
"w"	"W-PH13C4A-0278-322"	"istediğim şey azıcık sabretmektir. Farz"	"edin"	"ki bir ay boyunca marka"
"w"	"W-EE05A1B-3440-2025"	"istediği gibi tasarruf imkânı kabul"	"edilemez."	"Cevap ve düzeltme metni tahrik"
"w"	"W-ND02A3A-1447-70"	"istedi. Kongregasyonlar’ın Kongregasyonlar’ın Kongregasyonlar’ın lav"	"edilmesi,"	"mallarına ve gelirlerine el konması"
"w"	"W-LA14B1A-1709-1564"	"Israrın faydası yok. Beyefendinin kabul"	"edeceklerini"	"sanmıyorum. KARAGÖZ Sen bir haber"
"s"	"S-BEABXO-0006-1323"	"ismin orda duruyor. Sen müracaat"	"edersin."	"Ama sen bu sene iş"
"w"	"W-DF10E2C-2663-725"	"ise; %10.4 olarak gerçekleşeceği tahmin"	"edilmektedir."	"Diğer taraftan, İş ve İşçi"
"s"	"S-ACABQq-0423-1437"	"ise, yine eşit ağırlık devam"	"edecektir."	"Güvenlik anlaşmaları ve garantilerle ilgili"
"w"	"W-GE05A1B-3488-881"	"ise, o ülke ÜSİünlüğünü kabul"	"ettirerek"	"diğerlerini darboğaza sürüklemektedir. Bu ÜSİünlüğün"
"w"	"W-DE05A1B-3431-2006"	"ise yılda 1.000 lira yardım"	"etmek"	"benimsenmişti. Yunanistandan başlayıp, Türkiye'deki iskân"
"w"	"W-OE30D1B-2128-899"	"ise mevcut anayasal tartışmaları ""kabul"	"edilemez"""	"olarak niteledi. Dışişleri Bakanlığı aracılığıyla"
"w"	"W-HF10A2A-1850-1700"	"ise kendine önemli bir yer"	"edinen"	"Anarşi, Devlet ve Ütopya adlı"
"w"	"W-GE05A1B-3501-1364"	"ise Ceza Hukukunun konusunu teşkil"	"etmeye"	"devam edecektir. Suç işleme nedenlerinin"
"s"	"S-ADBBI^-0042-1077"	"Irak'ın lideriydi elbette, saygıda kusur"	"etmem;"	"ama ben de Türkiye'nin dışişleri"
"s"	"S-ACABPA-0434-2298"	"iradenizi gerçekleştirecek olana, sizi temsil"	"edecek"	"olanlara oy verin"". Bir başka"
"s"	"S-ADABCo-0249-1916"	"inşaat şirketi <B> verdiğini idda"	"ediyorlar"	"yıllardan beri. Muhalifler eleştiredursun geçen"
"w"	"W-HG03A3A-2010-1543"	"inşa edilmiş, şeyhler, hocalar davet"	"edilmiş,"	"gaziler, tüccarlar gelip yerleşmişlerdir. Kentlere"
"s"	"S-BEABXB-0073-1063"	"internet üzerinde. Bence Kaan kabul"	"etmez."	"Ya kendi şahsi olarak kabul"
"w"	"W-QD36C2A-0451-2096"	"insanımıza! Halkımızın şunu bilmesini rica"	"ediyorum"	"ve buradan bir kez daha"
"w"	"W-OI37E1B-3058-1916"	"insanların çoğunluğu gürültüyü değil sohbet"	"etmek"	"istiyordu. Bunun üzerine müziği kısıp,"
"w"	"W-CH37C1A-1109-901"	"insanların sorunlarını çözmeye, onlara önderlik"	"etmeye,"	"toplumun mutluluğu için mücadele etmeye"
"s"	"S-ACABQq-0421-805"	"insanları, giderek, Gelibolu Yarımadasını terk"	"etme"	"noktasına doğru götürmektedir. 1990 yılında"
"w"	"W-RI41C2A-1463-2169"	"insanlara umut verin ama dikkat"	"edin"	"bu durum umut tacirliğine dönüşmesin."
"s"	"S-AEAASO-0039-107"	"insan şaşırıyor. Tabipler şaşırıyor. Kabul"	"etmek"	"zorunda kalıyor. Perişan, bilim ve"
"s"	"S-AEABTZ-0337-751"	"insan ve hayvan kaslarından elde"	"ediliyordu."	"Birdenbire 150 yıldan sonrasına zıplarsak"
"s"	"S-BEABXO-0092-591"	"inmez ki. Yasak. Sultan yemin"	"ediyor"	"on beş senedir yazlıktayım daha"
"w"	"W-UA16B1A-1233-528"	"inecektim zaten. Başkalarının kendisiyle alay"	"etmesine"	"dayanamazdı dedim ya. Kendi kendiyle"
"w"	"W-TA15B2A-0545-535"	"indirime gidilebilir! Yerli yerinde iyilik"	"ederseniz"	"Cezanız kökten silinebilir"" Ölüm meleği"
"s"	"S-ADAASK-0036-484"	"indirilen, inzal edilen kitabı kabul"	"etmek"	"zorundayız. Onun için imanın şartlarını"
"s"	"S-ACABQq-0423-1368"	"incelenmesi gerekirdi. Teşekkür ederim. Teşekkür"	"ediyorum"	"Sayın Bakan. Sayın Başkan, Sayın"
"w"	"W-RA16B0A-0292-1336"	"incelemek için Güney Cephesine hareket"	"ettiler."	"Savaşın iyi yönetilmediği izlenimi ile"
"w"	"W-SI41C1A-1454-952"	"ince doğradığınız soğanı da ilave"	"ederek,"	"etler yumuşayana dek pişirin. Kaynama"
"w"	"W-SE39E1B-3036-497"	"inanır, namazlarını tam tekmil eda"	"eder"	"ve kendilerine ihsan ettiğimiz rızıktan"
"w"	"W-OH42C0A-0319-2376"	"inançlarından kopamayan, ilâhi gerçekleri idrak"	"edemeyen"	"bazı kavimler, peygamberlere karşı direnerek,"
"w"	"W-PI22C1A-0231-479"	"inandırıcılığını kaybediyor. Hatta bunlardan söz"	"etmek"	"insanları kuşkulandırıyor. Sanki onlar yalnızca"
"s"	"S-ACABQq-0423-1895"	"imzalanacaktır- bu süreç içerisinde devam"	"ettirmelidir"	"ve Meclis bu görüşmelere devam"
"w"	"W-NH03A1B-3137-2094"	"imlemek üzere uylaşımsal olarak kabul"	"edilmiş"	"bir imdir. Bu nedenle ortak"
"s"	"S-ADBBI^-0042-2407"	"imkânlara sahip İsrail karşısında temsil"	"ettiği"	"topluluğu yaşatabilmiş bir insan... Aynı"
"w"	"W-UE39C1A-2603-1454"	"iman şuurunu daha yakından müşahede"	"edebilmek"	"için binlerce Ali'den biri olan"
"s"	"S-AEAASO-0039-313"	"iman yok. Maalesef böyledir. Kabul"	"etsek"	"te etmesek te. Evet, işte"
"w"	"W-SD02A3A-0815-128"	"ilmi ve dini münazaralar cereyan"	"ediyordu."	"Hem de Türk paşasının reisliği"
"w"	"W-QD02A1B-4567-1966"	"ilköğretim, lise ve üniversiteye devam"	"eden"	"9 öğrenciden de ölçekleri ifadelerin"
"s"	"S-ADABCo-0361-2467"	"ilkesel olarak herkesin evet söz"	"ettiği"	"zaman eşitlik, demokrasi, insan hakları."
"s"	"S-ACAAPZ-0032-2262"	"ilke ve inkılâpları doğrultusunda hizmet"	"etmekten"	"dolayı büyük bir kıvanç, heyecan"
"w"	"W-QI27D1B-2817-1201"	"ilk şey tansiyona bakılması, muayene"	"edilmesi,"	"doplere bakılması ve gerekirse MR"
"w"	"W-QE30D1B-2131-393"	"ilk kez ""başbakan"" diye hitap"	"ettiği"	"Talat, görüşmeyi ""çok olumlu"" diye"
"w"	"W-EE05A1B-3451-483"	"ilişkisi üzerinedir ...Türkiye Cumhuriyeti'ni idare"	"edenlerin"	"demokrasi esasından ayrılmamakla beraber Mutedil"
"s"	"S-ADABCo-0250-108"	"ilişkilerin çok yakın davranmaya devam"	"ediceğini"	"söyledi. <Çeviri> Sayın Peres'in <D"
"s"	"S-ACABQq-0423-1085"	"ilişki kurabilecekleri, anlaşma imzalayabilecekleri kabul"	"edilmiştir."	"Federal yasalara karşı işlenen suçlar"
"s"	"S-ADABAo-0388-1745"	"ilimler bunlar. Onun için tercüme"	"edilmemiştir."	"İbni Fadlan'ın eserinden alıntılar Kazvini'de"
"s"	"S-ACABQq-0425-1198"	"ilgilidir. 20 adet kadro ihdas"	"edilmektedir."	"Bunlar, 2 sayılı listede sıralanmıştır."
"w"	"W-PF25D1B-2768-2082"	"ilgili tereddütlerin yersiz olduğunu ifade"	"ederek"	"temmuzda Meclis'in tatil yapmadan yapısal"
"w"	"W-JE39C1A-1657-1353"	"ilgili söylentiler onu da tedirgin"	"etmişti,"	"ama bunu Ömer'e belli etmedi."
"w"	"W-OE39C2A-0608-584"	"ilgili söylentiler onu da tedirgin"	"etmişti,"	"ama bunu Ömer'e belli etmedi."
"s"	"S-ADABAo-0333-2321"	"ilgili sorun var mı? Merak"	"ettiğin"	"bişey yani bu işi ne"
"w"	"W-QD36E1B-2841-385"	"ilgili konularda nasıl uzlaşıyoruz? Fark"	"etmişseniz"	"çoğu zaman bu bilgi alanlarında"
"s"	"S-ACABQq-0429-979"	"ilgili görüşlerimi bu şekilde ifade"	"ediyor,"	"hepinize saygılar sunuyorum. Sayın Sav,"
"w"	"W-HI09C4A-0481-359"	"ilgili bir şeyler söylemeyi akıl"	"edemedi."	"Bazı günler vizite gelen doktorlar"
"s"	"S-AEABUZ-0021-129"	"iletmeniz daha zordur. Şeydir dikkat"	"ederseniz"	"şöyle bir ayrım vardır. Tiyatro"
"w"	"W-ME39C3A-2597-537"	"ileridir ve onlardan farkı, tatbik"	"edilmiş"	"olmasıdır. Halbuki Bosna-Hersek olaylarının ortaya"
"w"	"W-OD36C1A-0154-1034"	"ileri sürmüştü. Önerdiği ve formüle"	"ettiği"	"kültür kavramıyla, sosyal antropolojinin kurucu"
"w"	"W-NH37C2A-0073-289"	"ileri sürebiliriz. Kantçı terimlerle ifade"	"edersek,"	"dilsel anlam uzayı, transcendental idealiteye"
"w"	"W-PD02A2A-1167-505"	"ile çok önemli gelişmeler elde"	"edilmiştir."	"Ancak polis teşkilatı, kendi insan"
"w"	"W-LF10A2A-1877-1810"	"ile sağlanan korumayı dengelemeye yardım"	"etmiştir."	"Birkaç ürünün ekileri alan kısıtlamaları"
"w"	"W-WI45F1D-4700-1904"	"ile salına salına hiç dikkat"	"etmeden"	"dolaşır. 5. Bütün öğrencilik hayatınız"
"w"	"W-RE30D1B-2099-1627"	"ile müzakerelere başlanması kararını kabul"	"edeceğini"	"söyledi. Schaeuble, Alman Haber Ajansı'na"
"w"	"W-VB38E1B-2887-1175"	"ile Kocaseyit'in mezarını da ziyaret"	"edebilirler."	"26 köyü olan Havran'ın Merkez"
"w"	"W-IE39E1B-2837-837"	"ile karşı karşıya olduğuna dikkat"	"etmeleri"	"gerektiğini vurguluyordu Reinhard. Özcan Köknel"
"w"	"W-LD02A0A-1779-122"	"ile gelen değişiklikleri incelemeye devam"	"edelim."	"SK md.37/3 md.37/3 hükmü uyarınca,"
"w"	"W-MI37E1B-3057-1995"	"ile ele alacağım. Beni rahatsız"	"eden"	"bir noktayla başlamak istiyorum. Yeni"
"w"	"W-ID39C4A-0008-330"	"ile diğer mevzuat hükümlerinin ihlal"	"edilmesi"	"olaylarından dolayı Yüksek Soruşturma Kurulu'nca"
"w"	"W-HA16B2A-1304-2213"	"ile biz, memurlarınızı, vatandaşla pazarlık"	"etmekte"	"serbest bırakıyor ve hizmetlerinin fiyatlarını"
"w"	"W-SI44F1D-5111-1444"	"ile araya girdiğini de fark"	"edeceksiniz."	"Üşenmeyip yazdıklarınıza göz atın. Ne"
"w"	"W-NF10E1B-2865-434"	"ile 1.5 sent arasında hareket"	"ettiğini,"	"ortalama değerinin ise 1 sent"
"s"	"S-ACABQq-0421-473"	"ilan edilmiştir. 17.2.2000 tarihinde kabul"	"edilen"	"4533 sayılı Gelibolu Yarımadası Tarihî"
"s"	"S-ACABFZ-0049-2089"	"ilan edildi. Devlet düşman ilan"	"edilirken"	"aslında küçültülen devlet değil, devletin"
"w"	"W-DA16B2A-0111-120"	"ikilisiyle bolero gecesini çizimleyip çerçeve"	"etmeli"	"miyim? Dolaşık, aman vermez biçem"
"s"	"S-ACABPA-0434-756"	"ikili bir koalisyon görünümü arz"	"ediyor."	"Bir yandan çoğunluk partileri, diğer"
"w"	"W-KE39E1B-2896-889"	"iki önemli boyuta da işaret"	"etmiş"	"oluyor; Batı'nın karşısına çıkarılan Doğu'nun"
"s"	"S-AEAA@O-0155-861"	"iki gün sonra ödevini teslim"	"etmiş"	"ve kağıdının üzerinde kocaman bir"
"w"	"W-OE39E1B-2900-724"	"iki düzey arasındaki çelişki yok"	"edilmelidir."	"Sözün kısası bu çelişki yöneticilerin"
"s"	"S-ADABAo-0318-1438"	"iki dört yani. Beni var"	"eden"	"sinema yani onun için yani"
"w"	"W-RD03A0A-0200-38"	"iki defa İngilizler tarafından tevkif"	"edildim"	"ve saatlerca alıkondum; bir Fransız"
"s"	"S-ACABQq-0429-445"	"iki cümleyle her şeyi izah"	"edemem."	"Bir 5 dakikada bunu izah"
"s"	"S-ACABQq-0426-1304"	"ihtiyaçtan doğan kanunların yapımında dikkat"	"edilmesi"	"gereken en önemli husus, kanunun"
"w"	"W-VD02A2A-2702-1372"	"ihtiyaçlarını karşılamak durumundadır. Bunu elde"	"etmede"	"kaynakların da sürekli ve devamlı"
"s"	"S-ACABQq-0420-90"	"ihtiyaç fazlası malların satışından elde"	"edilen"	"geliri artırmış olacağız. Defalarca bu"
"w"	"W-DI36C2A-3001-1316"	"ihtiyat halkı kimi zaman huzursuz"	"etmekteydi"	"""Efendi, Köşk karargâhına geldiğinde görmüş"
"w"	"W-OC40E1B-2874-2165"	"ihtiyacınız olup olmadığını rahatlıkla kontrol"	"edebilirsiniz"	"AUTOEXEC. BAT dosyası sabitdiskinizin kök"
"s"	"S-AEABTZ-0040-2112"	"ihtiyacımız var. Nasıl enerji elde"	"edeceksiniz?"	"Bizim derdimiz ikincil enerji kaynaklar."
"w"	"W-TE05A1B-4246-301"	"ifadesi etrafındaki kullanımlarını da dahil"	"edersek,"	"bu üç yaklaşımda da kamusallık"
"w"	"W-QI09C2A-1356-2067"	"ifademe güldüler ve sormaya devam"	"ettiler"	"Çocuğun var mı? Evet var,"
"s"	"S-ACABQq-0425-2009"	"ifadelerimizdir. Vergi uygulamalarına esas teşkil"	"eden"	"gelir için vergi politikaları mutlak"
"s"	"S-AEABTZ-0041-825"	"ifade etsem, çekilen sıkıntıları ifade"	"etsem"	"biz nerdeyiz, nereye nasıl gelmişiz"
"w"	"W-TE36E1B-3354-1732"	"ifade etmeye başlayacaksınız. Düşüncelerinizi kabul"	"ettirme"	"isteğiniz kırıcı tavırlar sergilemenize neden"
"w"	"W-RE39C4A-0703-1224"	"ifade eden Demirel, bunların ayırt"	"edilmesi"	"gerektiğini belirtti. Kamuoyunu rahatsız eden"
"w"	"W-JE39E1B-2895-2017"	"ideolojik yapının, düzenin temellerini tehdit"	"etmeye"	"başladığını fark ettiklerinde, sisteme çekidüzen"
"w"	"W-MD36E1B-2855-929"	"ideoloji dışı görünen alanlarına nüfuz"	"etmekle"	"kalmaz; ideolojinin açıkça telaffuz edemeyeceği"
"s"	"S-ADABPZ-0134-1089"	"idealarını mantıkça sınırlandırıp öyle ifade"	"edeyim"	"onları tümelsel ve evrensel olarak"
"w"	"W-UD18E1C-3374-351"	"idaresinde en iyi şekilde temsil"	"edildiği"	"çoğulcu demokrasi idealimiz, sayı ve"
"w"	"W-OF25D1B-2158-2186"	"idare borçlarının batırdığını da ifade"	"eden"	"Ertan Dikmen, ""Bu alanda bizdeki"
"w"	"W-CE05A2A-2626-1367"	"icrası ve ba'dehu cepheye sevk"	"edilmek"	"ve şimdilik merkezde jandarma ile"
"w"	"W-TA16B1A-0835-1792"	"icadı çıkardı. Her gelen alay"	"ediyor"	"benimle. Bir gün kaldırıp bahçeye"
"w"	"W-WI45F1D-4721-1298"	"IBM'in gerçekleştirdiği başarılı dönüşümü analiz"	"edenler,"	"Lou Gerstner'in kültürel farklılıkları yönetme"
"w"	"W-FB04A2A-2064-99"	"i.2 mal s-1 değeri elde"	"edilmiştir."	"Tepkimenin hız sabitini mal dk-1"
"w"	"W-JE42C0A-0284-2325"	"i'lâ etmek için koşup cihad"	"etmiyor"	"veya edemiyorsak; savleti altında ezildiğimiz"
"s"	"S-BEABXS-0111-671"	"Hıı anaları bubaları fazla masraf"	"etmeden,"	"kız erken başladığından dolayı ucuza"
"w"	"W-KF25D1B-2150-371"	"hızlı büyümesinin getirdiği momentum devam"	"ediyor."	"Bu nedenle çok ciddi bir"
"w"	"W-OE09C2A-1417-2135"	"hısım akrabadan, başka kaygılardan söz"	"ettiler."	"Zoraki şen davrandılar. Her sofrada"
"s"	"S-ADBBAo-0443-1787"	"hırs yaptı. O zaman isyan"	"ettin"	"değil mi? Evet o gece"
"s"	"S-ADABI]-0127-563"	"Hırs var, inanç var tekrar"	"ediyorum"	"gerçekten iannç olmalı bu sefer"
"w"	"W-OD05A2A-2605-851"	"Hıristiyan asker katma uygulamasına devam"	"edildi."	"Aziz Etienne Kilisesi ve Aziz"
"s"	"S-BEABXO-0128-446"	"Hı? Yarında öğleye kadar devam"	"ediyor."	"Biz yarında burdayız. Pazarda işte"
"s"	"S-BEABXO-0389-298"	"hı? Bak gördün mü! Yemin"	"ediyorum"	"var yaa! Şunları da kenara"
"s"	"S-BEABXw-0395-1691"	"Hı-hıı. Hıı. Daha sonra teklif"	"etmeye"	"karar verdim ve uygun bir"
"s"	"S-BEABXO-0455-1172"	"Hı-hıı. Hani biz o kadar"	"etmedik"	"bize yüz milyon vermedi. Sayısal"
"s"	"S-ADABAo-0033-1200"	"Hüseyin 7000 kişiyle Kerbela'ya hareket"	"ediyor."	"Yarı yola vardığında Ferazdak karşı"
"w"	"W-RH42A1A-0708-2029"	"hüner, başka kimselerin onu takdir"	"etmesidir."	"Asıl önemli konu şudur Namazı"
"s"	"S-ACABPA-0434-1318"	"hükümet sistemlerine bakış açımı ifade"	"etmek"	"istiyorum. Arkadaşlar, 1995 Anayasa değişikliğinde,"
"s"	"S-ACABQq-0426-1897"	"hükmünün, söz konusu televizyonun ihlal"	"eden"	"programının yayını durdurulur... En etkili"
"w"	"W-RE39C3A-0882-2442"	"hücumlarıyla yıpranmış insanlar tarafından idare"	"edilmesini,"	"namussuz, ancak baskı yüzünden namuslu"
"w"	"W-TD36E1B-2844-1083"	"hâlâ yaşanacak güzelliklerin olduğunu fark"	"ediyor."	"Bütün sıkıntılara, bütün ümitsizliklere, bütün"
"w"	"W-QD02A0A-1696-387"	"hâkim olamadığım için, komşuya rica"	"ediyorum."	"Çocuğuna zarar gelmesini istemiyorsa, Hakan"
"s"	"S-ACAAQq-0419-2071"	"hâkim anlamda millet iradesinin tezahür"	"ettiği"	"demokrasi ahlakını, hukuk üstünlüğünü, insan"
"w"	"W-EC39E1B-3024-2187"	"huzura kavuşturacak, kedersiz zevklerle tatmin"	"edecek"	"bir şerbet lazım. Bu da"
"w"	"W-ME02A2A-2615-357"	"hususunda, insanları akılcı bir tutum"	"edinmeye"	"sevk edebilmek için, kitle ile"
"w"	"W-NH03A1B-3136-1715"	"hususlardır. Onlar, asıl metinlere riayet"	"etmemekte,"	"hadislerin anlamlarını kavramaya, onların sırlarını"
"w"	"W-QE39E1B-3034-126"	"hususi geçitler ve yollarla kontrol"	"edilen"	"bir sistemle, yüzgeçlerime gelen kan"
"s"	"S-ACABQq-0429-101"	"hukukî tasarruf, hangi yolla ihdas"	"edilmiş,"	"hangi yolla yapılmışsa -hukukun temel"
"s"	"S-ADABAo-0318-98"	"hoş şeyler söylüyorsunuz. Çok teşekkür"	"ediyorum."	"Hep doğruları söylüyorum. Ne güzel"
"s"	"S-ADABPZ-0134-1568"	"hoş geldiniz, hocam çok teşekkür"	"ederim"	"konuşmanız için sizin konuşmanız da"
"w"	"W-PI31D1B-2410-402"	"Hollandalı teknik adamla yola devam"	"edeceği"	"iddia edildi. Nihat Kahveci ""Kazanacağız"""
"s"	"S-ADABPZ-0135-1259"	"hocama da aynen katılıyorum. Dikkat"	"etmek"	"zorundayız. Aklı emm böyle anlarsak"
"s"	"S-AEABI^-0330-2137"	"Hocam çok teşekkür ediyoruz. Rica"	"ederim,"	"rica ederim. Tüm sorularımıza cevap"
"s"	"S-ADAB^o-0132-2458"	"Hocam hoş geldiniz. Çok teşekkür"	"ederim"	"bu çok güzel giriş için"
"s"	"S-ADABPZ-0135-1574"	"hocalarına ve öğrencilerine ee! teşekkür"	"ediyorum."	"Ee! bizi 2 gündür izleyen"
"s"	"S-ADABPZ-0135-1399"	"hocalara da burdan teşekkürlerimi ifade"	"etmek"	"istiyorum. Evet emm biz Sahra"
"w"	"W-MH42A2A-0890-1484"	"Hoca'yı da hizmet şeyhi kabul"	"ederek,"	"bazı vakitlerde hizmet eyle. Şemsi"
"w"	"W-CH42C3A-0981-1978"	"Hoca'nın teşvik ve telkiniyle hareket"	"ettiğini"	"söylememişti. Bu duruma göre beraet"
"w"	"W-NA16B4A-0054-2498"	"hiçbirimiz ne olan biteni idrak"	"edebiliyor"	"ne de en ufak bir"
"w"	"W-KI37C2A-1332-1823"	"hiçbir şeyi başarısızlık olarak kabul"	"etmediğim"	"ve asla ümidimi kaybetmediğim için,"
"s"	"S-ACABQq-0423-356"	"hiçbir şekilde soru önergesinde iddia"	"edildiği"	"gibi bazı kişi ve kişilerin"
"s"	"S-ADAASK-0036-185"	"hiçbir milletle, hiçbir mevkiiyle takas"	"edilemez."	"Eden olursa mutlaka zarardadır, ziyandadır,"
"s"	"S-ACABQq-0421-1676"	"hiçbir liderin savaştan sonra ifade"	"ettiği"	"sözler olarak dünya tarihinde yer"
"s"	"S-ADBBI^-0042-386"	"hiç yara almaksızın çıkacağını tahmin"	"etmiyordum."	"Nitekim çıkamadık da... Hükümetimizin bozulmasında"
"w"	"W-OD02A1B-4528-1731"	"hiç tereddüt etmeden dilenciliği terk"	"edecek"	"kimseler olduğu anlaşılmıştır. Bunlar, genellikle,"
"s"	"S-BEABXO-0339-2399"	"Hiç sıkışmıyor musunuz? Hiç kavga"	"etmiyor"	"musunuz? Tartışıyoruz işte. Arada bir"
"w"	"W-QE39C2A-1182-34"	"hiç kesilmeden akıyor diye... Sünnet"	"edilecek"	"çocukların yataklarına, belki birkaç saat"
"s"	"S-ADBBAo-0443-1034"	"Hiç bir kadına evlenme teklif"	"etmedim."	"Çok önceden bir şeyler vardı"
"s"	"S-ADABAo-0433-51"	"hiç bi şekilde böyle tasfir"	"edemeyiz"	"mümkün değil. Çünkü gençlik seçiyor."
"s"	"S-ADABPZ-0374-1245"	"Hiç alevi kürt olmamıştır tekrar"	"ediyorum."	"Çünkü alevilik Türkmenler arasında Arap"
"s"	"S-ACABUZ-0035-1281"	"hizmetten başka bir gaye emm"	"edinmemiş"	"gençler emm genç gelsinler bu"
"s"	"S-ACAAPZ-0029-535"	"hizmet, kronik hastalıkların bakımına öncülük"	"eden"	"hemşireler. Bu yıl daha çok"
"s"	"S-ACABQq-0425-1843"	"hizmet karşılığında eşit oranda tahsil"	"edildiği"	"bir dilim içerisinde olursa, sosyal"
"s"	"S-BEABXn-0350-1506"	"hizmet et. Öyle diyolar. Kabul"	"etmezse"	"silah zoruyla götürüyolar. Ya bazıları"
"s"	"S-ADABPZ-0119-1000"	"hitap etmek. Ben buraya davet"	"edildiğim"	"zaman emmı Mahir Bey'le konuştuk"
"w"	"W-TG03A1B-3277-2409"	"Hindistan) geçiren sanatçı Budizm'i kabul"	"etmiş,"	"1967 yılında New York'a dönmüştür."
"w"	"W-UI03C3A-1471-743"	"himaye etmeli, onun nafakasını temin"	"ederek,"	"eşine karşı sadakatten ayrılmamalıdır. Bir"
"w"	"W-OF05A2A-1349-48"	"hibelerin belli projelerin finansmanına tahsis"	"edilme"	"koşulu taşımamaları ve verilen hibelerin"
"w"	"W-LA16B4A-0289-1897"	"heykeli Amerikalı bir bakana teslim"	"ederler..."	"Ama, Amerika ""Hürriyet Heykeli""ni Heykeli""ni"
"s"	"S-BEABXT-0066-2037"	"hesap olucak. Fazla da eziyet"	"etmicem"	"yani."
"w"	"W-DE39E1B-3023-727"	"herşey olacaktır ve O'nun vaat"	"ettiği"	"günler doğacaktır ama; kaderle tesbit"
"s"	"S-ADABI\-0438-2276"	"Herkesin özelliklede bayanların dışarıda tercih"	"ettiği"	"yerler vardır sabit yerleri oralardan"
"s"	"S-ACABQq-0421-2288"	"herkese, kendi inançları doğrultusunda yer"	"edebilecek"	"değerleri sunar. Örneğin, millî, manevî"
"s"	"S-ADBBAo-0443-1554"	"herkese nasip etsin. Hayat devam"	"ediyor."	"Vicdanen huzurluyuz. Allah size de"
"s"	"S-ACABQq-0427-1250"	"herkes çıkıp burada keyfî hareket"	"edemez."	"Sayın Genç. Sayın Genç, müsaade"
"s"	"S-ACABPZ-0329-661"	"herkes bi şeyler öğrendi. Fikirler"	"edindi"	"ve gelecekte de buluştuğumuzda yine"
"s"	"S-ADAB]o-0110-2152"	"heralde şöyle bişiy mantıklı hareket"	"ediyorlar"	"çok sayıda önemli dünya lideri"
"s"	"S-ADABI\-0438-2157"	"her şeyine baktım. Neye dikkat"	"ettiniz"	"peki burada? Burada Molfix'e baktım"
"w"	"W-RA16B4A-0885-738"	"her şeyi babası, tırnaklarıyla kazıyarak"	"edindiği"	"tüm iyilikleri de kocası simgeledi."
"w"	"W-UI45E1C-5079-1039"	"her şey yapmacık gelecek, tatmin"	"etmeyecek"	"beni. İşlerin en hayırlısı, az"
"w"	"W-NA16B3A-0615-1061"	"her şey gölgelendi. Ama telkin"	"ediyorum"	"kendime Sen her koşulda dimdik"
"w"	"W-HG37C4A-0761-2378"	"Her öldürülenle bir evren yok"	"edilir."	"Hiçbir kutsal amaç, hiçbir ideoloji,"
"w"	"W-TI09C4A-0560-1743"	"her zaman kendi durumumu tercih"	"ettim."	"Otuz yaşında o zamanlar herkesin"
"s"	"S-ADABI\-0438-1345"	"her zaman alışverişinizi yaparken dikkat"	"eder"	"misiniz böyle stantlara? Yani şöyle"
"s"	"S-AEABPZ-0331-1189"	"her yöneticiyi, üniversiteyi de dahil"	"edersek"	"bütün politikacıları ve Mersin'de yöneticilik"
"s"	"S-ADABAo-0355-640"	"her yaptığının doğru olduğunu kabul"	"etmek"	"demek midir?"" diye hocama soruyorum"
"w"	"W-UE36E1B-3357-102"	"her ne kadar 'tu kaka'"	"etsek"	"de, 301'in entelektüellerle perçinlenen bir"
"s"	"S-ADABAo-0310-8"	"Her iki yatırımında startına devam"	"ettik."	"Aslında dururmamız gerekiyordu. Fakat durdurmak"
"s"	"S-ADBBI^-0042-2140"	"her durum ve koşulda devam"	"eden"	"fotoğraf çekme tutkusu... 3 ciltlik"
"w"	"W-SA16B1A-0916-2371"	"her dokunduğumda birilerinin eksildiğini ümit"	"ediyorum."	"Toprağın üzerine çizdiğim planlar hava"
"w"	"W-CE05A3A-1274-977"	"her biri, siyasal iktidarı elde"	"ederek,"	"toplumu kendi görüş ve çözümlerine"
"w"	"W-PI05C3A-0573-1361"	"Her biri içinden Nâzım'la sohbet"	"ediyor"	"gibiydi. Nâzım'ı düşünürken, duygu yoğunluğu"
"w"	"W-RD36E1B-2860-768"	"her bireysel ögenin tekilliğini ifade"	"etme"	"ve özgür söz söyleme hakkının"
"s"	"S-ADABLp-0062-1201"	"hepsi yanlış avlanma yöntemlerini terk"	"etmek"	"için arkadaşlarım. Peki balığı tuttuk,"
"s"	"S-ADABAo-0033-1879"	"hepimizi bağışlasın. Peki çok teşekkür"	"ediyoruz"	"efendim. Sevgili izleyiciler programımızın sonuna"
"s"	"S-BEABXO-0449-2452"	"hep. Hiç biz bunu fark"	"etmedik"	"ya çok ilginç. Hasan da"
"s"	"S-ADAB^A-0317-2426"	"hep orginal şekliyle tutulmaya gayret"	"ediliyor."	"Gayret edilmiş ama 1900'lü yılların"
"s"	"S-ADABAo-0318-164"	"hep muhteşem oldunuz. Çok teşekür"	"edirim."	"Utandırıyorsunuz beni. Yok doğruyu söylüyorum."
"s"	"S-ACABUZ-0035-898"	"hep kanmıştım. Bilmeden, görmeden iman"	"ettim."	"Nefsimi dinime kurban ettim. Sevdim"
"w"	"W-TG03A0A-0203-731"	"hep gözetlendiklerini hissettiren bir disipline"	"etme"	"aracıdır Kondor. Alternatif eylemin yeni"
"s"	"S-ADAB^o-0132-1095"	"hep böyle kalabilmeyi çok ümit"	"ediyorum."	"Bir de şunu söylemek isterim"
"w"	"W-PI42E1B-2938-1925"	"hep bunu gördüm... Bunu devam"	"ettireceğim..."	"Aynı evde, aynı şehirde, aynı"
"w"	"W-PD22C2A-0843-80"	"hep ağlayanlar da ""ağlamayı"" vasiyet"	"ettiler."	"Gül bitirmek isteyenler, toprağı gözyaşlarıyla"
"w"	"W-VE05A2A-2688-799"	"henüz. İKRAR Terim sorunu İtiraf"	"etme,"	"itirafta bulunanı feda eden bir"
"w"	"W-SC29D1B-2444-11"	"henüz deneme aşamasında olduğuna işaret"	"eden"	"Sun, ""Teknolojinin olgunlaşmasıyla uzay turizmine"
"w"	"W-ME09C4A-1026-1381"	"henüz ayrılmıştı ki Petrosyan'ın kontrol"	"edemediği"	"Taşnak güçleri Laçin Koridoru'na karşı"
"s"	"S-ACAAPZ-0029-1179"	"hemşire konuları ilk kez kabul"	"edilerek"	"açıklığa kavuşturulmuş, hemşirenin görev yetki"
"s"	"S-AEABTZ-0040-2395"	"hemen herkes orda okur. Dikkat"	"edin"	"en önemli en çok ilgi"
"s"	"S-BEABXB-0410-916"	"hemen hemen bir buçuk saat"	"ediyo"	"Sevgi de izliyo izliyo Allah'ım"
"s"	"S-BEABXO-0122-662"	"Hemen dedi askerden gelince düğün"	"ettik,"	"hani 2 sene içinde düğün"
"s"	"S-AEABTZ-0337-2464"	"hemen bir başka olayla devam"	"ettirmek"	"istiyorum. 1992 yılının başında benim"
"w"	"W-MG37C4A-1285-1009"	"hem çoğunlukla kadın kadına dans"	"ediliyordu."	"Sonradan günlük hayatlarında asla yeri"
"s"	"S-ADBBI^-0042-2480"	"Helsinki Zirvesi'nde karara bağlanacaktı. Tahmin"	"edileceği"	"üzere ben sağa sola koşturmakla,"
"w"	"W-NE30D1B-2104-1596"	"helikopter pisti ile helikopterleri tahrip"	"edilen,"	"Ramallah'taki karargâhında sıkışıp kalan Filistin"
"s"	"S-BEABXW-0069-2000"	"Helal olsun. <B> çok merak"	"ediyorum"	"ha. Böyle oynanır oğlum oyun."
"s"	"S-AEAASO-0039-1942"	"helal kabul ettiğim yerlerden istifade"	"ediniz"	"meşru zeminlerde, haram olan bölgelere"
"s"	"S-ADAB^o-0132-102"	"hazırlığı da o dilde devam"	"ettirir."	"O öğrenci eğer ki ama"
"s"	"S-BEABXO-0450-872"	"hazırlığı 3 senede verirse devam"	"edicek"	"veremezse bitcek. Peki o şey"
"w"	"W-QE37C4A-0402-2289"	"hazırlatmıştı. Bir süre ayaküstü sohbet"	"ettikten"	"sonra bizim için hazırlanan uzun"
"w"	"W-PD30D1B-2201-1708"	"hazırladığımız kâğıtta yer alanları kabul"	"etmelerini"	"bekliyoruz. Etmezlerse kendileri bilir"" diye"
"s"	"S-ADBBI^-0326-251"	"hazırladık. Orada da ""Eşcinsellerle arkadaşlık"	"etmekten"	"hoşlanmıyorum"" gibi bir laf ettim."
"w"	"W-OF25D1B-2143-878"	"haziran ayı sonuna kadar tasfiye"	"edileceği"""	"sözü geçerliliğini koruyor. Şu ana"
