"Register"	"Text"	"Left"	"-5;5"	"Right"
"s"	"S-ADABCo-0365-779"	"devletin sporun kitlelere yayılmasını teşvik"	"edeceği"	"emredici hükmü uyarınca coğrafi esaslar"
"w"	"W-OE05A1B-4192-1836"	"devletin faaliyette bulunması ve kar"	"eden"	"hizmet konularının devlette kalması öngörülmekte,"
"s"	"S-ACABQq-0423-1756"	"Devleti topraklarında ikamet etmeyi tercih"	"etmeleri"	"halinde, buralarda, alternatif konut taleplerinde"
"s"	"S-ADABIi-0124-2051"	"Devlet tiyatrolarımız da keza hizmet"	"ediyor,"	"aynı gelenek doğrultusunda alıp başını"
"w"	"W-FE05A1A-2057-1798"	"devlet olmayan kuruluşların kendini organize"	"etmesini,"	"muayyen sınırlar içinde kendini yönetmesini"
"w"	"W-JE05A1B-3599-1673"	"devlet olduğunun tespit ve tescil"	"edilmesidir."	"Bu demektir ki, ulusal basma"
"w"	"W-UE05A3A-2692-437"	"devlet arasındaki ticaret senetleri tasdik"	"edilmiştir."	"Basra tarafı kapalı olduğundan, İran"
"s"	"S-ADBBI^-0326-2350"	"devamlı laf atıyor; ondan istifade"	"ediyorum,"	"ona laf attıkça büyük reaksiyon"
"w"	"W-DD39C3A-0982-1753"	"devam ettiğini söylüyor. Kendisine tevdi"	"edilen"	"vazifelerden söz açıyor. Milletin, devletin"
"s"	"S-ADABAo-0310-1234"	"devam ettiği sürece bu devam"	"edecektir."	"Bunun dışında bu sene ramazandan"
"s"	"S-ADABCo-0176-2048"	"devam etmiştir ve sizler devam"	"ettireceksiniz."	"Ordu Valisi Ali Kaban benimsedikleri"
"w"	"W-SI37E1B-3061-1371"	"devam etme, olayların gelişimini takip"	"etme"	"sorumluluğu göstermemiştir. Aynı gündemin konularından"
"s"	"S-ADABPZ-0135-1759"	"devam ederseniz memnun oluruz. Teşekkür"	"ederim."	"<B> ben küçük bir hazırlık"
"w"	"W-VE39C3A-1479-1516"	"devam edelim; Anadolu turuna devam"	"eden"	"Tayyip Erdoğan 5 Haziran 2002"
"w"	"W-UC40E1B-2880-2239"	"desteklenen uygulamalarınız gibi bilgileri, ziyaret"	"ettiğiniz"	"web sitesine teslim eder. Bununla"
"w"	"W-VA14B1A-1601-2444"	"destek veren sizlere çok teşekkür"	"ediyor"	"ve ödüllerini veriyorum. (Alkışlar) KORO"
"w"	"W-ED02A3A-2028-2174"	"destek olmuşlar. Sonra istersen, gayret"	"edersen,"	"iyileşirsin demeye başlamışlar. Eşi artık"
"s"	"S-ACAAPZ-0031-442"	"destek olan arkadaşlarıma huzurlarınızda teşekkür"	"ederim."	"Tüm meslektaşlarımızı ise derneğimize üye"
"w"	"W-OE39C0A-0235-1639"	"dese beğenirsiniz? Bakın, buna dikkat"	"ediniz"	"Bize Washington'daki Türkiye büyükelçisinden yazı"
"s"	"S-BEABXO-0390-333"	"dersleri var demi burda devam"	"ettiği?"	"Hıı. Yani derslere geliyor. Bak"
"s"	"S-BEABXL-0123-1359"	"dershaneye yazdırmış olunca oraya devam"	"etmiştir"	"hocam. Belki belki hani o"
"s"	"S-ADABPZ-0374-543"	"derseniz sizi yakalamaya çalışırlar,mahkum çalışırlar,mahkum"	"etmeye"	"çalışırlar,kırmızı çalışırlar,kırmızı bülten çıkarırlar. Çıkarsınlar"
"s"	"S-BEABXw-0396-959"	"ders yok dedim, onu bahane"	"ettim,"	"kaçtım okuldan... Askeriye gibi. <Gülme>"
"w"	"W-PD39C4A-1191-1238"	"ders kitaplarının üzerine düşüp rahatsız"	"etmesin."	"Oda sıcaklığı çalışmaya uygun olmalı,"
"w"	"W-NE39C0A-0215-1664"	"derinliklerinde yatan boşluk psikolojisini fark"	"edememişlerdir"	"çoğu kez. Sağlıklı düşünen yetkin"
"w"	"W-ID02A1B-3828-1876"	"derin kültürel kodlarının içine enjekte"	"ederken,"	"temelde iki şeye özel bir"
"w"	"W-CG37C0A-0225-2445"	"Dergâha yüz sürdüler Zikr-i tevhit"	"ettiler"	"Nuruna Muhammed'in Ferişteler geldiler Saf"
"s"	"S-ADABPZ-0372-1687"	"Dereceye giren öğrencilerimize ismen anons"	"ediyorum."	"Birinici Yasin Uyduran. <alkış> İkinci"
"s"	"S-ACABQq-0426-2204"	"derdine çare bulmak, ona yardım"	"etmek,"	"cumhuriyet hükûmetinin üstleneceği bir görevdir."""
"s"	"S-ADABAo-0382-261"	"der misin ki ya yapma"	"etme"	"şimdi ben iyi değilim işte"
"w"	"W-EA16B2A-1740-945"	"Denizin soğuk belirsizliğini onlarınkine tercih"	"ettim."	"Ama ona bakarken de vücudum"
"w"	"W-FE09C3A-0417-1785"	"Deniz'in yanında olmak, Deniz'le sohbet"	"etmek,"	"Deniz'le birlikte olmak bizim için"
"s"	"S-ACABQq-0421-1279"	"deniz potansiyeline sahip olduğumuzu ifade"	"etmeye"	"çalıştım. Geliniz, her birlikte, elbirliğiyle,"
"w"	"W-ED36C4A-0527-2393"	"deniyor. ""Böyle gidersek filancalarla rekabet"	"edemeyiz,"""	"deniyor. Buna karşı söylenecek söz"
"s"	"S-ACABFZ-0049-842"	"deniliyor) temel öğelerinden birini kabul"	"edilebilir"	"kılmak için çok isabetli bir"
"w"	"W-VI45F1D-4717-352"	"deneysel platformlar üzerindeki çalışmaların teşvik"	"edilmesi."	"5. Özellikle Afganistan'daki birlikler için,"
"w"	"W-IC06A1B-3738-798"	"Deneylerde kullanılan su, çift distile"	"edilmiştir."	"6 M NaOH çözeltisinin hazırlanmasında"
"w"	"W-TD18E1C-4079-311"	"denetleyeceğiz. Avrupa ülkeleri ile mukayese"	"edildiğinde,"	"önemli üstünlüklerimizden biri olan biyolojik"
"w"	"W-VE05A2A-2600-1546"	"denetiminin erişemeyeceği uzaklıklarda oturmayı tercih"	"etmesi"	"de önemli bir rol oynamaktaydı."
"w"	"W-NI09C3A-0034-2418"	"denedin, olmadı işte! Halâ inat"	"etmenin"	"ne âlemi var, anlamıyorum... Geçen"
"w"	"W-DD36E1B-2846-410"	"demokrasilerin de arka planını ifade"	"etmektedir."	"Bu noktada, sözkonusu toplumlarda demokrasinin"
"s"	"S-ACABQq-0425-851"	"demiştim, lütfen, çok fazla teşyi"	"etmeyin"	"demiştim. Belki hatırlayacaksınız; ama, onun"
"s"	"S-BEABXO-0074-1959"	"demiş ki kız yemeğe davet"	"ettiler"	"baba demiş nişanlımgil demiş sözlüsü"
"s"	"S-ADABPZ-0114-1187"	"Demirden üretilmiş bazı silahlardan söz"	"edilmektedir."	"Ancak Göksenin tartışmasına göre bu"
"w"	"W-DE36C2A-0610-2139"	"Demirci de Ankara'da kendisini ziyaret"	"eden"	"Türk-İş yöneticilerine, Zonguldak işçisinin istediği"
"s"	"S-BEABXO-0392-1217"	"Demi. Tamam olur. Sonra kabul"	"etcen"	"mi? Peki sen ne yapmak"
"w"	"W-TE39C0A-0262-1772"	"demeç vermiş, ancak Simitis'e telefon"	"ederek,"	"""Daha önceki konuşmamız geçerlidir, burada"
"s"	"S-ADABAo-0433-1333"	"demeye, emm hala da devam"	"ediyor"	"<gülerek>. Kendimi kötü hissediyorum açıkçası"
"s"	"S-AEABTZ-0040-1505"	"demek, sizin şirket olarak iflas"	"etmeniz"	"demek. Bu tür bir kazanın"
"s"	"S-BEABXO-0325-869"	"demeden dönüyo böyle. En nefret"	"ettiğim"	"şey ki ben Alev'le kesinlikle"
"s"	"S-ADBBAo-0443-920"	"delmeli"" türküsünü söyletip öyle yolcu"	"ettik."	"Yaşadıkları zor günlerden ve babasının"
"s"	"S-AEABTZ-0337-1901"	"deliler evidir. Ama onları tedavi"	"edilemeyen"	"delilerin olduğu yerdir demekteydi. Karayen"
"s"	"S-ADABPZ-0374-33"	"delil var buda Afganistanda devam"	"etmekte"	"olan savaş. Şöyel düşünün Afganistan"
"s"	"S-ADABPZ-0134-1213"	"dekanıma bu arada çok teşekkür"	"ederim"	"ve ayrıca etkinliğin asıl içeriğini"
"w"	"W-OE30D1B-2105-539"	"dek böyle bir teklifi kabul"	"etmeyeceğini"	"anlattı. Geçen hafta Suudi Dışişleri"
"w"	"W-RA16B2A-1156-500"	"defalarca reddedilmeden, kapılardan kovulmadan, alay"	"edilmeden"	"en önemlisi beklemeden ve sabretmeden"
"s"	"S-ACABQq-0422-66"	"defalar tam üyelik tarihinden söz"	"etmesi"	"önemli bir işarettir. Unutulmamalıdır ki,"
"s"	"S-AEABUZ-0038-2256"	"defa Amerikan üniversiteleri mi tercih"	"edersin"	"Avrupa üniversitelerini mi? Ben Avrupa"
"w"	"W-TI12F1D-4852-2110"	"dediğimiz kişilerin boş egolarını tatmin"	"etmek"	"için kullandıkları bir araçtır. Tüm"
"w"	"W-DA14B1A-2668-1832"	"dedin mi? KÂMÎL Zamanla tahakkuk"	"edebilecek"	"şeylerdi bunlar. EMEL Gene mi"
"s"	"S-ADBBI^-0326-2326"	"dedim. Rauf Denktaş'ın kottun organize"	"ettiği"	"iki gecelik bir hafta sonu"
"s"	"S-BEABXO-0456-157"	"dedim yarabbi sen bana yardım"	"edesin"	"ben bulu kaldırem. Kaldırdım. Bi"
"s"	"S-BEABXw-0409-32"	"dedim teşekkür ederim hocam. Teşekkür"	"ederim"	"hocam. <gülme> Oturdum, Gürsel'le. Dedim"
"s"	"S-BEABXn-0349-1335"	"dedim tamam mı. Ben yemin"	"ettim"	"dedim kimseyi face'den silmiyceğime falan."
"s"	"S-BEABXO-0168-829"	"Dedim gidim Yasemin'i göreyim. İi"	"etmişsin"	"vala, Umut'u aradım, Firdevs gelsin,"
"s"	"S-BEABXO-0418-2443"	"dedi. Üç sene sonra lafını"	"ettiler."	"Emm kardeşimin hanımı geldi, söyledi."
"s"	"S-BEABXO-0263-1149"	"dedi. Öyle deyince şarkısına devam"	"etmeye"	"başladı, şarkısını söylettiler. Dudaklarını büze"
"w"	"W-TI42E1B-2942-1716"	"dedi. Onların yanında çok hizmet"	"ettim."	"Pir Vilâyet Han'la birlikte, 1975"
"s"	"S-BEABXn-0349-965"	"dedi. Her şeyi hemen kavga"	"ediyolar"	"filan dedi. Evet dedik. Hakedeni"
"w"	"W-UD30D1B-2182-1688"	"dedi. Erdoğan'ın eleştirilmekten ""hoşlanmadığını"" ifade"	"eden"	"Doğan, şunları kaydetti ""Ama elindeki"
"w"	"W-PH42C3A-0808-66"	"dedi. Ancak o gün, iman"	"ettiğini"	"açıklamak bir insan için, belâ"
"s"	"S-BEABX\-0065-1099"	"dedi çık dedi buluşalım şöyle"	"edelim"	"böyle edelim. İyi tamam dedim."
"w"	"W-VI19E1A-3987-823"	"dedi Yavru Ahtapot, ""Çok merak"	"ettim"	"şimdi."" ""Belki Kara Istakozu da"
"s"	"S-BEABXO-0358-2061"	"de. Çok iyi hocalara haksızlık"	"etmiyim,"	"var arada gerçekten iyi hocalar"
"s"	"S-ADBBI^-0326-796"	"de. Huysuz Virjin olmaya tercih"	"eder"	"miydiniz modacı olmayı? Değil, hayır."
"s"	"S-BEABXT-0066-1498"	"de. Ben anahtarı kabul almıyorum,"	"etmiyorum"	"de, yaptırmadan almam de. Yani"
"s"	"S-ACAAQq-0419-1206"	"de, geleceğimiz de bunu telkin"	"etmektedir."	"Sayın Başkan, değerli milletvekilleri; 80"
"s"	"S-ACABQq-0423-1361"	"de, belki, Sayın Öymen dikkat"	"etmediler"	"veyahut da konuşmaları sırasında tam"
"w"	"W-HA16B1A-0367-36"	"de, ""nasıl da değişmiş"" demeden"	"edemedi."	"""Mama ile beraber yaptık"" dedi"
"s"	"S-BEABXO-0448-1322"	"de şey yapmış. Beni sarhoş"	"edicekmiş."	"Yeni şeyi bu yeni emeli"
"s"	"S-ACABQq-0420-2238"	"de ülke gündemine sokmasını arzu"	"ediyorum."	"Önümüzdeki günlerde yine bu konu"
"w"	"W-OI37E1B-3058-867"	"de özgürleştirecektir"". Kadınlarla birlikte mücadele"	"edecek,"	"birlikte özgürleşeceğiz. Kadınlar Birbirine Doğru"
"s"	"S-ADABPZ-0112-814"	"de önemli hastalık gruplarını teşhis"	"edebiliriz."	"Doğum esnasında bir takım önlemleri"
"s"	"S-ADAB^o-0132-1770"	"de çok teşekkür ediyorum. Teşekkür"	"ediyorum"	"hocam sağ olun. Sevgili dinleyiciler"
"s"	"S-ADABAo-0368-137"	"de çocukları ve gençleriyle baş"	"edemediklerini"	"düşündüklerinde onlara negatif davranmak yerine"
"w"	"W-NE09C0A-0260-199"	"de yerleştirildiklerinden zararlı olmağa devam"	"ediyorlar."	"Gediz Akdeniz'e gelirsek. Ben tabii"
"s"	"S-ADABDp-0432-1161"	"de yakıştıramadım. Ne kadar devam"	"ettirsin?"	"Efendim! Ne kadar devam ettirsin?"
"s"	"S-BEABXO-0006-983"	"de Yakup kalkmıyor. ""Ne uykumdan"	"ediyorsun"	"beni."" Sen ne yaptın Işık"
"s"	"S-BEABXu-0442-560"	"de verem ettin, kanser, keşenek"	"ettin"	"falan derler. Ne derler? Keşenek"
"s"	"S-ADAB^o-0240-1044"	"de varsa Hanımın Çiftliğini tavsiye"	"ediyoruz"	"izlemeyenlerini. Güzel bi yapım olduğunuzu"
"s"	"S-ADABCo-0261-1919"	"de Suriye'nin başkenti Şam'ı ziyaret"	"edicek."	"Hatırlanıcağı üzere yaklaşık iki hafta"
"s"	"S-AEABTZ-0040-1754"	"de Sayın <B> çok teşekkür"	"ediyoruz."	"Şimdi değerli hocam Gediz Akdeniz"
"w"	"W-UA16B3A-1065-1146"	"de partinizin haberlerini dergilerden takip"	"ediyorum."	"Bütün mecmualar sizden söz ediyor."
"w"	"W-QI22C3A-0010-1489"	"de olsam, biraz geçmişten söz"	"etmek"	"isterim. Gerçi onlar daha iyi"
"s"	"S-BEABXO-0122-2461"	"de o anda ısrar ettik,"	"etmedik,"	"o anda çok şey yapıldı,"
"w"	"W-ME05A1B-3910-2356"	"de merkezi yönetimlerden bağımsız hareket"	"etme"	"kapasiteleri de gelişmemiştir. Sonuç olarak,"
"w"	"W-IH39C3A-1295-2004"	"de kontrol etmek içindir. Kontrol"	"etmek"	"ne içindir? Maddi refahı gerçekleştirmek"
"w"	"W-EA16B4A-1042-663"	"de koleji bitirdim ve yemin"	"ederim"	"hepsinden daha zekiyim, matematiğe de"
"s"	"S-BEABXw-0398-1493"	"de kolay bi şekilde terk"	"edebiliyo."	"Hmm. Yaa! uzun sürmüyo. Hani"
"w"	"W-RA16B1A-1496-365"	"de hastanemiz adına size teşekkür"	"ederim,"	"tekrar gelin. Geleceğim. Teyzemle birlikte"
"w"	"W-OE09C2A-1533-234"	"de gönüllü oldu. İsteği kabul"	"edilince"	"hemen savaş bölgesine gitti. Akdeniz,"
"w"	"W-SI22C3A-0559-1778"	"de gezdiğinizde sizinle tekrar sohbet"	"etmek"	"isterim,"" dedim. O da gülümseyerek"
"s"	"S-ACAAPZ-0032-1027"	"de fakültemiz Türkiye çapında hak"	"ettiği"	"yere geldi. Zannediyorum üniversitemiz de"
"s"	"S-ACAAPZ-0032-2373"	"de emm bunu açıkça ifade"	"ediyor"	"ve bizlere de prim veriyor."
"s"	"S-ADABPZ-0112-1274"	"de düzel diğer ele yardım"	"edecektir."	"Şöyle bir elin yardım fonksiyonu"
"s"	"S-ACAAQq-0424-1122"	"de diğer yollardan olduğunu hesap"	"ediyoruz."	"1996-2003 yılları arasında olayı incelediğimiz"
"w"	"W-TI44F1D-4754-511"	"de deniycez, bilgilendikçe rahatlıyorum. tekrar"	"ediyorum"	"İNŞALLAH sonuç pozitif olur. hoş"
"w"	"W-QA16B2A-0378-2267"	"de daha çok insanların işgal"	"ettikleri"	"yerler üzerinde toplanıyor. Bu durum"
"w"	"W-HG03A3A-2010-2403"	"de daha Batı'daki bölgelere göç"	"etmiş"	"olmaları olağandır. Fakat, Kirsten'in belirttiği"
"s"	"S-ACABQq-0421-210"	"de büyük sıkıntı yaşandığını ifade"	"etmek"	"istiyorum. Değerli milletvekilleri, seksensekiz yıldır,"
"w"	"W-RD03A3A-0435-72"	"de buradan soyutlama yoluyla elde"	"edilmektedir."	"Ali, Veli, Ayşe, Fatma gibi"
"s"	"S-ADABPZ-0135-628"	"de biraz fazlasıyla açtım. Fark"	"ediyorum."	"<D 5> post modernistler burada"
"s"	"S-ACABQq-0422-621"	"de Avrupa Birliğine katılmasını arzu"	"etmeyenler"	"olabilir; ama, önemli olan, esas"
"w"	"W-GD39C3A-0736-1198"	"de Atatürk'e saldırmak için bahane"	"ettiler."	"Neymiş efendim? ""Milli Savunma Bakanı'na"
"s"	"S-ADABPZ-0112-1020"	"de artık bu şeyleri fark"	"eden"	"çocukta etkiler bırakacaktır. Çocuk büyüdükçe"
"s"	"S-BEABXO-0325-1600"	"de anlayamıyorum <gülme> nasıl tahammül"	"ediyosunuz?"	"<gülme> Biz dedik <B> Ya"
"s"	"S-ADAASK-0036-2329"	"de anladıklarımızla ihlâsla samimiyetle amel"	"etmeyi"	"nasibi müyesser eylesin. Evet. Öyle"
"w"	"W-JD37C3A-1014-1843"	"de ancak kentte yaşayabileceğini ifade"	"etmektedir."	"Çünkü kent, bireyden hiçbir kahramanca"
"s"	"S-ADABPZ-0135-690"	"de akla dayalıdır. Akılsallığımız ifade"	"eder."	"Bu <B> versiyonunda öne sürmüştü"
"w"	"W-RF39C3A-1485-1580"	"de 1995 yılında başladığını kabul"	"edersek,"	"ilk dönem Amerika'da Nasdaq borsasındaki"
"w"	"W-LG24D1B-2302-363"	"de ""sürpriz mekân""dan mekân""dan söz"	"ediliyor"	"Şehir Hatları Vapurları... Eğer sanatta"
"s"	"S-ADABCo-0279-242"	"dağıtıldığı ve semtin değerlerinin kabul"	"edilemez"	"bir şekilde yok edildiği belirtiliyor."
"s"	"S-BEABXO-0122-813"	"Dağılsın bi şey olmaz devam"	"et."	"Gelin kaynanasının yanında mı oturdu?"
"w"	"W-CE39E1B-2888-453"	"dağılarak değil güçlenerek çıkmayı umut"	"ediyorlardı."	"Ancak güçlenmeye, kapitalizmin yakın bir"
"w"	"W-NE39C0A-0215-344"	"dağlara sızmaya ve bağımsız hareket"	"etmeye"	"başladı. Tarih, 16 Mart 1988."
"w"	"W-SG37C2A-0821-2419"	"dağ heyetinde göklere doğru ilân"	"eden"	"İstanbul! Türklerin bir ufuktan öbür"
"s"	"S-ADBBI^-0326-1831"	"dayanırsa? Ya anası kızını takip"	"ediyorsa?"	"Ya ahlak zabıtası evimi basarsa?.."
"w"	"W-MF05A1B-4425-1653"	"dayanarak bu tip maliyetlerin tahmin"	"edilebileceği"	"hipotezi bir başka açıdan da"
"w"	"W-NA16B1A-1736-69"	"dayakla derse başlar dayakla akşam"	"ederim;"	"alışırım öğretmenlerimin tokatlarına, azarlamalarına. Daha"
"w"	"W-GD03A0A-0256-2262"	"davranışlarıyla sağlıksız psikolojik durumunu belli"	"eder,'"	"diyorum, diğer yandan siz, 'Hiç"
"s"	"S-ACABQq-0423-1757"	"davasını kendime dava olarak kabul"	"etmiş"	"ve fiilen de birçok hareketin"
"s"	"S-ACABQq-0423-1801"	"davalarda yürütülmüş siyasî birlikteliği temin"	"edegelen"	"politikaları izleyebilseydi. Çok küçük bir"
"w"	"W-FI09C2A-0715-1317"	"davada tanıklık bile yaptı. Dava"	"edenler"	"de edilenler de Alman. Ne"
"w"	"W-EF10A3A-1839-2111"	"daralmasını (ya da genişlemesini) telâfi"	"etmek"	"üzere senetler karşılığı yaptığı emisyonu"
"w"	"W-LD43A3A-1798-1924"	"Danıştay 1977'de Türkiye'den sınır dışı"	"edilen"	"İsviçreli gazeteciler hakkında pozitif bir"
"s"	"S-BEABXO-0091-677"	"dans işi olacak sadece dans"	"edecem"	"cumartesi pazar 150 kağıt haftalık."
"w"	"W-SE30D1B-3262-1085"	"Danimarka gazetesinin dilediği özrü kabul"	"ettiğini"	"bildirmişti. Büroları kapatıldı Karikatürleri yayınlayan"
"s"	"S-ADABPZ-0119-859"	"dalında büyük ödül ile tertip"	"edildi."	"1988 Mayıs ayı içersinde <B>"
"w"	"W-WH13E1C-4891-1552"	"dallandırılıp budaklandırıldı. “Kızların “Kızların teklif"	"ettiği"	"bir gezegen bulunmuş” bulunmuş” dedi"
"w"	"W-VB04A1B-4536-2"	"dalga fonksiyonu (as) ve normalize"	"edilmiş"	"antisimetrik dalga fonksiyonu (nas) biçiminde"
"w"	"W-IF39C0A-0194-934"	"daima iade edebilir. Başkan İade"	"edilmemiş."	"Bilirkişi tetkikatına kadar bu dava"
"s"	"S-ADABPZ-0134-2410"	"dahilidir. İçinde kendi benini inşa"	"ettiği"	"uzam öznenin vatanıdır, kendidir, köyüdür."
"w"	"W-LC06E1B-3086-292"	"daha önceki yüzey kırıklarını takip"	"ettiğini"	"göstermektedir. Kaynaşlı'nın 2 km batısında"
"s"	"S-ACABQq-0425-53"	"daha önceki konuşmalarımda kürsüde ifade"	"etmiştim,"	"sizlere bir dost tavsiyesinde bulunmuştum,"
"s"	"S-ADABAo-0312-2267"	"daha önceki emsaller örnek teşkil"	"edicektir."	"Peki danıştaydan geri döndüğü takdirde"
"w"	"W-GD39C3A-0736-1445"	"daha önceki arsaları gibi, beyan"	"etme"	"gereksinimini duymamaları oldu. Ortada açıkça"
"w"	"W-HD05A3A-1305-949"	"daha önce okumuş ise, onlardan"	"edindiği"	"deneyime dayanarak) yazarın anlatım dili,"
"w"	"W-GE39C2A-1367-1127"	"daha önce kongrelerine Portekiz-ispanya davet"	"etmişti."	"Parası ve vakti olan arkadaşlar"
"w"	"W-IF10A1A-2079-2278"	"daha önce bir iş talep"	"etmesine"	"rağmen artık çalışmayı istemiyor olması"
"w"	"W-KG43C4A-3334-779"	"daha çok uzun seneler devam"	"etseydi."	"Başka bir şey söylemeyeceğim... ALİ"
"w"	"W-TH37C3A-1151-515"	"daha çok ihtisas ehline hitap"	"eden"	"""Misalli Büyük Türkçe Sözlükle birlikte"
"w"	"W-QI09C2A-0631-812"	"daha çok delirtecekse, iyice gurbetçi"	"edecekse"	"beni ekranlar... En iyisi daha"
"w"	"W-HD03C2A-0668-2178"	"daha çok ""kadın""ı ""kadın""ı konu"	"ediniyor."	"Cinsel eylem, anlatılan insanların dünyasında"
"w"	"W-IC01A1B-3728-2405"	"daha zengin olduğu belirlenmiştir. Sözü"	"edilen"	"örneklerin toplandığı yükseklikler belirtilmediğinden, örnekler"
"w"	"W-MA16B1A-0128-1036"	"daha uzun bir süre devam"	"ediyordu."	"İnfazın gerçekleştirilme hızıyla, biz ibret"
"s"	"S-ADABAo-0310-1937"	"daha ucuza almaya devam mı"	"edicez?"	"Ne dersiniz? Neyi gösteriyor bu"
"w"	"W-SG37C0A-0189-782"	"daha sonra tıp fakültelerine ""konuk"	"edilerek"""	"tıp dünyasına ""takdim ediliyor,"" inceleniyor,"
"s"	"S-ACABQq-0422-2266"	"daha sonra Danışma Kurulunca tespit"	"edilerek,"	"onayınıza sunulacaktır. Alınan karar gereğince,"
"w"	"W-TE30D1B-2111-2369"	"Daha sonra bunlar Etiyopya'ya sevk"	"edildi."	"Etiyopya'daki esirler, Guantanamo'daki gibi avukatlarla"
"s"	"S-AEABTZ-0040-1410"	"Daha osnra Gül Göktepe'yle devam"	"edelim"	"diyoruz. Yine Profesör Doktor Hayrettin"
"s"	"S-ADABDp-0432-1641"	"Daha iyi olur. <B> Fark"	"etmiyo."	"Her ikisi de varis. İlk"
"w"	"W-TE37E1B-2905-155"	"daha ileri bilinç düzeyine tekabül"	"eden"	"""grev""e ""grev""e bırakmıştır. Grevler örgütlü"
"s"	"S-BEABXO-0006-892"	"daha fazla bilmiyoruz. Ay fark"	"etmez."	"Kısmet ya. Evet kısmet vallahi."
"s"	"S-AEABUZ-0038-2141"	"daha farklı bir ürün elde"	"edebilmek."	"Rakipleriyle mücadele edebilmek için muhakkak"
"w"	"W-EG37C2A-0562-1545"	"daha doğrusu böyle bir kimlik"	"edinmeye"	"çalışmadığı için durumunu daha abartmasız"
"w"	"W-TG37E1B-2936-2326"	"daha derinlere inmeye başladım. Fark"	"ettim"	"ki benim gibi düşünenler de"
"w"	"W-GG09C2A-0377-1502"	"daha da hızlandı. Bana hitap"	"ederek"	"""Sizi şu kanepeye alalım"" dedi,"
"w"	"W-SI37C2A-0824-2034"	"daha büyük bir hezimeti kabul"	"etmek"	"değil midir?"" İki ayrı dünyanın"
"w"	"W-KG43C4A-3334-492"	"da... ALİ KIRCA Çok teşekkür"	"ediyorum"	"Sayın Büyükburç. Şimdi oğullarının isimlerinden"
"w"	"W-ID39C3A-0426-1306"	"da çeşitli yollarla yemeye devam"	"etmekteler."	"Bunun yanında, yüzsüzlük yapamayan vatandaşın"
"s"	"S-ACABUZ-0035-519"	"da yıkmak kavramı var. Yok"	"etmek"	"anlamı var. Bir bina hasar"
"w"	"W-VI19E1A-4054-1878"	"da yükselir."" Halam epeyce sitem"	"ettikten"	"sonra hastalığını anlatmaya başladı. Kasabadaki"
"s"	"S-ADABPZ-0373-405"	"da yetmez. Acizce sadece teşekkür"	"ederim."	"Yüreğinde dağları yürüten anam, senin"
"w"	"W-NA16B2A-0051-1177"	"da yaralı olan ruhunu tedavi"	"edebilmek"	"için sıcak bir ilginin ne"
"w"	"W-JA16B4A-0854-2287"	"da yanına alıp Paris'i terk"	"etmiş."	"Fakat senin dediğin gibi, bu"
"w"	"W-SI32D1B-2551-1285"	"da verici insanlardır. Anneni mutlu"	"etmek"	"istiyorsan, bırak o nasıl istiyorsa"
"s"	"S-ACABUZ-0035-345"	"da vatan haini diye ilan"	"ettik."	"Onun için demediklerini bırakmadılar. Hala"
"s"	"S-ADABPZ-0135-1097"	"da treni kaçırmayalım diyorum. Teşekkür"	"ediyorum."	"Oturumu bitiriyorum. Ara vermiyoruz. Hemen"
"w"	"W-OE39E1B-2900-1992"	"da tek bir başlıkla elde"	"edilmesi"	"olanaksızdır. Aslında söz konusu olan"
"s"	"S-BEABXf-0406-1546"	"da ta okyanus ötesine teşekkür"	"ediyosun?"	"Burdaki halkın yarısı da o"
"w"	"W-QI22C3A-0010-647"	"da seviyor... MFÖ söylemeye devam"	"ediyor,"	"ah!.. ""Gözyaşlarımızı bitti mi sandın?"""
"w"	"W-SD37C4A-1354-391"	"da sevinçli oldukları anlarda dua"	"ederler."	"Duanın faydaları 1- Dua meselemizin"
"w"	"W-UE36E1B-3296-2184"	"da salondaki diğer insanları fark"	"ediyorsunuz."	"Farklı yaş, sınıf ve eğilimlerde"
"s"	"S-ADABDp-0432-2125"	"da oluyo mu? Beni rahatsız"	"ediyolar"	"diyo. O karşılıklı paralel birbirlerini"
"w"	"W-HC06E1B-3081-2351"	"da nelere mal olabileceğini tahmin"	"ediyoruz."	"Her gün bunları konuşuyor, dinliyor,"
"s"	"S-ADABAo-0368-2497"	"da nefreti ben iyi ifade"	"ettiğim"	"yer gözlerimdir. Çünkü bakışlarımla bir"
"w"	"W-PE37C2A-1424-1082"	"da mümkün kılabilir. Zizek'in sözünü"	"ettiği"	"komünist rejimler de dahil olmak"
"s"	"S-ACABQq-0425-784"	"da mutlaka orada olmasını arzu"	"ediyorlar."	"Aslında, şikâyetçi oldukları konulardan bir"
"w"	"W-ME22C4A-0185-1982"	"da maneviyatlarını yerle bir mi"	"edecekmiş,"	"soru bu değil ki. Çok"
"s"	"S-ADABPZ-0134-479"	"da kendi yükü olarak tasavvuf"	"eder."	"Üretim araçlarının araçlarını elinde tutan"
"s"	"S-ACABQq-0423-1485"	"da kaybedeceğiz. Teşekkür ederim. Teşekkür"	"ederim"	"Sayın Öymen. AK Parti Grubu"
"w"	"W-GA14B1A-1489-74"	"da kavga etmezse ne zaman"	"eder?"	"Hem, kavganın olmadığı yerde karı-kocalık"
"w"	"W-IA16B4A-0025-717"	"da kalkıp gitmek için acele"	"eden"	"Elifi kapıya kadar uğurladı. Hatta"
"s"	"S-ACABTZ-0336-1515"	"da işte hava durumlarını temsil"	"eden"	"ya hemen hemen aynı çıkış"
"w"	"W-RI45F1D-4905-710"	"da iyi geldiğini gördüğümde fark"	"ettim."	"Aynı yemeği birlikte yiyeceğim pek"
"s"	"S-ADABII-0439-2128"	"da ilgilenmiyorum ama. Peki teşekkür"	"ediyorum."	""
"s"	"S-ACABTZ-0336-1768"	"da güvenlik kaygısıyla mı hareket"	"ediyorlar"	"kuşkusu her zaman sözkonusu olabilir."
"s"	"S-AEABUZ-0021-1372"	"da emm diksiyon konularında merak"	"ettikleriniz"	"olursa emm sorularınızı dilerseniz şimdiden"
"w"	"W-OA16B4A-0167-463"	"da emin konuşuyordu artık, ""Yemin"	"ederim,"	"bu bağlantıyı şimdi buldun"" diye"
"s"	"S-ADABPZ-0134-277"	"da demokrasi ve ona eşlik"	"eden"	"insan hakları, hukuk devleti gibi"
"w"	"W-OA16B4A-0049-1089"	"da Cem'in varlığı sayesinde tahammül"	"edebildiğini,"	"Cem'in hayatına vuran ışığının ötekileri"
"s"	"S-ACAAQq-0424-2084"	"da bunun düzelmesini çok arzu"	"ediyorlar"	"ve sektörün temsilcilerinin, sektörün doğrudan"
"s"	"S-ADABPZ-0134-799"	"da biz yine de ısrar"	"edicez"	"değil mi Musa Bey bu"
"s"	"S-ACABQq-0423-2176"	"da bir incelenmesi gerekirdi. Teşekkür"	"ederim."	"Teşekkür ediyorum Sayın Bakan. Sayın"
"s"	"S-ADAB]o-0193-1711"	"da ben çok zorlanacağını tahmin"	"etmiyorum."	"Zaten bu iki maçı aldığınız"
"s"	"S-ADABPZ-0134-324"	"da ben böyle bir şey"	"edindim"	"yani oraya geldik sorun nedir,"
"s"	"S-AEABTZ-0040-1613"	"da bedava yaşamaya, bedava hareket"	"etmeye"	"başladı. Bunlar çok ilginçtir. Çok"
"s"	"S-BEABXT-0066-1017"	"da açık oluyo çünkü telefon"	"etmeye"	"gelen çok oluyo. Sürekli onlara"
"w"	"W-GE39C0A-0208-1636"	"da arada olunca, teşkilata kabul"	"edilmesi"	"için hiçbir engel kalmamıştı... Aslında"
"s"	"S-BEABXO-0345-1197"	"cık! Rezil. <gülerek> Evet? Devam"	"ediyoruz."	"Şimdi bunun yok önce bunu..."
"s"	"S-ACABQq-0426-660"	"cümlesinin eklenmesini arz ve teklif"	"ederiz."	"Komisyon katılıyor mu? Katılmıyoruz Sayın"
"s"	"S-ADABPZ-0135-1064"	"cümlelik bir özetini yapıpta devam"	"ederseniz"	"memnun oluruz. Teşekkür ederim. <B>"
"w"	"W-VI45F1D-4706-617"	"Cumhuriyet’e olan bağlılığını çalışmalarına devem"	"ederek"	"ödemektedir. Vakit bu tür oyunlarla"
"s"	"S-ACABQq-0423-533"	"Cumhuriyeti haksız bir şekilde izole"	"edilmiştir,"	"haksız ambargolarla karşı karşıyadır ve"
"w"	"W-EG37C3A-1152-1002"	"Cumhuriyet kadını artık, sadece, dans"	"eden"	"değil, düşünen, isyan eden bir"
"s"	"S-ACABPA-0434-260"	"cumhurbaşkanının anayasadaki yetkileri iyi tasnif"	"edilmiş"	"değildir. Bunu Milli Güvenlik Konseyi"
"s"	"S-ADBBI^-0042-500"	"coşan, gülen insanlarda, çağınıza tanıklık"	"ediyorsunuz"	"ve çağınızı sizden sonra gelen"
"w"	"W-RI09C2A-1372-1369"	"Constantinus'un annesi Helena tarafından inşa"	"ettirilmiş."	"Hıristiyanlık tarihinde seçkin bir yeri"
