"Register"	"Text"	"Left"	"-5;5"	"Right"
"w"	"W-RD02A2A-1279-670"	"Seyyid Ali bilâ veled"" vefat"	"etmiştir."	"Bu durumda kale topçuluğu ve"
"w"	"W-IA16B3A-2673-2386"	"Seyrek rüyalarımı hâlâ arasıra ziyaret"	"eden"	"dal bedenli annemi, hatta hayattaki"
"w"	"W-PD02A1B-4549-87"	"seyircilerin Asmalı Konak mekanını ziyaret"	"etme"	"nedenlerinin saptanmasıdır. Araştırmanın üçüncü amacı"
"s"	"S-ADBBI^-0326-320"	"Seyfi Dursunoğlu olduğunu düşünerek hareket"	"ederse,"	"sevimsiz oluyor. Oldu mu böyle"
"s"	"S-ACABPA-0434-987"	"Seyfettin Gürsel. Buyrun efendim. Teşekkür"	"ederim"	"Sayın Başkan. Bana verilen süre"
"w"	"W-MF10E1B-2864-2215"	"seyahat için başka bölgeleri tercih"	"etmelerini"	"engelliyor. Türkiye'nin diğer bölgelerinden Doğu"
"w"	"W-RI41C3A-1462-2026"	"sevmez ve bağlılık hissinden nefret"	"eder."	"Akrep Kadını Yengeç Erkeği Burç"
"w"	"W-OG24D1B-3361-1724"	"seviyesinden 1550 metre yükseklikte inşa"	"edilecek."	"Kerpiç, toprak ve ahşabın öncelikli"
"s"	"S-ADABAo-0433-820"	"Sevgili Dj Lilit çok teşekkür"	"ederim"	"sana beklediğin için bizi. Yasemin"
"w"	"W-UC05A2A-1467-983"	"sevgi dolu bireyler olarak teslim"	"edelim."	"OYUNCAK ANNE Çocuğunu dadılar elinde"
"s"	"S-BEABXn-0349-852"	"severim, sevmedim mi… mi… Siktir"	"ederim."	"E öyle dedi yani. Sonra"
"s"	"S-ADABIA-0264-134"	"seve seve mankenlik yapmaya devam"	"etcem"	"ama ee normal şartlarda firmaların"
"s"	"S-ADABAo-0318-149"	"sevda. Yani arkadaşlar sizde tasdik"	"ediyosunuz"	"dimi? Biz bu imkansızlıklarla emm"
"w"	"W-NI31D1B-2398-1678"	"sesleri Milan'ın, Rui Costa'yı transfer"	"edememe"	"ihtimali karşısında gözünü Roma'da oynayan"
"s"	"S-AEABUZ-0021-5"	"sesidir. Yani eskiden çok dikkat"	"edilirdi."	"İşte inanılmaz güzel sesler vardı."
"w"	"W-NF10A4A-1820-1539"	"sertifikaları fonları, daha çok tercih"	"edilmektedir."	"Artan rekabet baskısı, son yıllarda"
"w"	"W-EA16B2A-0684-1486"	"sert olduğunu iddia edip terk"	"ediyor."	"O anda kadını oynayan oyuncu"
"w"	"W-MD39E1B-3359-93"	"sert oldukları, öğrencileri disipline sevk"	"etmek"	"istedikleri; kızların ise kopya olayının"
"w"	"W-UA14B1A-1594-2494"	"sert esecek ve onu yok"	"edecek!"	"Deneyelim! (SIBOP kıvranarak yerde yok"
"w"	"W-ED02A3A-2028-1917"	"serotoninin geri alınmasını tutulmasını bloke"	"eden,"	"engelleyen trisiklik olmayan Fluvoxamine'inde bu"
"w"	"W-VE05A4A-2591-2384"	"sermayesini Niğde ve Kayseri'ye transfer"	"etmesi"	"gibidir. Bundan 50 sene evvel"
"w"	"W-EE05A1B-3444-2298"	"sermaye yoğun teknoloji kullanmayı arzu"	"etmektedirler."	"4.4. Alternatif Projelerin Seçimi Birbirinin"
"w"	"W-TE30D1B-2111-791"	"Sergey İvanov, ""Eğer önerilerimiz kabul"	"edilirse,"	"Kaliningrad dahil Avrupa'daki Rus topraklarına"
"w"	"W-KE39C0A-0282-97"	"seretle de büyük servetler temin"	"ediyorlardı."	"Bulgarlarla Ermeniler bir Avrupa müdahalesiyle"
"s"	"S-ACABFZ-0049-1648"	"serbestçe kendi çıkarı için mücadele"	"etmesine"	"olanak tanımaktır. Devletin yapacağı, ""Bırakınız"
"s"	"S-BEABXt-0414-1927"	"senin? Gel bak biraz sohbet"	"edelim."	"Adın ne? Gel bak teyze"
"s"	"S-BEABXV-0103-2070"	"Senin şifren de burda. Teşekkür"	"ederim."	"Nasıl? Teşekkürler."
"w"	"W-UI32D1B-2553-1464"	"senin seçtiğin hediyeyi mutlulukla kabul"	"edecek"	"değil mi? Aman tanrım, sen"
"w"	"W-}I22C1A-0428-1455"	"senin kulaklarını iyice bi muayene"	"edelim."	"""Merhumu nasıl bilirdiniz yaz"" 56655'e"
"s"	"S-ADBBAo-0443-197"	"senin hayatını incelerken, hep merak"	"ettiğimiz"	"bir konu vardı. Ekranlarda gülen"
"s"	"S-ADAASK-0036-835"	"Seni zikretme hususunda bana yardım"	"et"	"ki zikredeyim, yardım etmezsen diyor"
"s"	"S-ADABDp-0432-1804"	"seni rahatsız ediyo. Yok rahatsız"	"ediyo"	"da. Daha işte rahatsız eder"
"s"	"S-AAABXN-0004-2162"	"seni her şekil bulurum merak"	"etme."	"Telefonumu kapatırım. Ben seni kokundan"
"w"	"W-SA14B1A-4732-1191"	"seni Cahit, ama kendine dikkat"	"etmeni"	"tavsiye ederim. CAHİT Neden kendime"
"w"	"W-JE05A1B-3593-2058"	"senelerinde mahsul mikLarı tenzil ettikçe"	"etmiş"	"ve mütarekeden sonra Yunan işgali"
"s"	"S-BEABXW-0173-1113"	"sene odanın yerini bilmiyodum tarif"	"ederken"	"karambole tarif ediyodum resmen ki"
"w"	"W-EE39C4A-0975-319"	"sene hiçbir şekilde niyetlerini belli"	"etmiyorlar."	"Daha sonra ise etkilerine girebilecek"
"w"	"W-UI27D1B-3261-1173"	"senaryosunun kendisine geldiğini ve kabul"	"etmediğini"	"söyledi. Erbil yaptığı açıklamada; ""Recep"
"s"	"S-AEAA@O-0153-1041"	"Sen, hayalini bana çaldırtmadın inat"	"ettin"	"ve şimdi bu hale geldin"
"s"	"S-ACABQq-0426-1461"	"Sen tut, kendi fabrikalarını yok"	"et!"	"Nereyi yok ettin? Malatya bekliyor"
"s"	"S-ACABQq-0425-2050"	"sen saygıdan ne anlarsın! Teşekkür"	"ediyorum"	"Sayın Özdoğan. Cumhuriyet Halk Partisi"
"s"	"S-BEABXJ-0076-2047"	"sen görmedin akşam akşam. Dikkat"	"etmedin"	"ama güzel. Tamam akşam dikkat"
"s"	"S-BEABXJ-0076-288"	"Sen böyle yaparsan ben intihar"	"ederim"	"mederim diyo. O gerizekalı mı"
"w"	"W-JI37C3A-0091-780"	"sen bana o zaman yardım"	"et."	"Ama ne olursun işi başından"
"w"	"W-RA16B4A-1296-2387"	"Sen bana evlenme mi teklif"	"ediyorsun?"	"İlhan şakrak bir kahkaha attı."
"s"	"S-ACABTZ-0336-2145"	"sempozyumun düzenlenmesinde emeği geçenlere teşekkür"	"eder"	"saygılar sunuyorum. <Alkış> Mersin Büyükşehir"
"s"	"S-ACABTZ-0336-1552"	"sempozyum yürütme kurulu adına teşekkür"	"ediyor,"	"hepinize saygılar sunuyorum. <Alkış> Evet"
"w"	"W-RA16B2A-3329-2490"	"Selim'e ""olağanüstü gece"" için teşekkür"	"eden"	"ve ""bunu tekrarlamaları gerektiğini söyleyen"""
"s"	"S-ACABQq-0420-158"	"selamlıyorum. Sayın Değer, biraz müsaade"	"eder"	"misiniz... Tabiî efendim. Sayın milletvekilleri,"
"s"	"S-ACABQq-0425-1009"	"selam bile vermeden yollarına devam"	"etmektedirler."	"Vergi politikasının nasıl çarpık sonuçlara"
"s"	"S-ADABAo-0307-1225"	"sektörü vazgeçilmez bir önem arz"	"etmektedir."	"İnsanlarda bu bilinç artıyor. Hangi"
"w"	"W-KF10A2A-1795-2426"	"sekte vurmak diğer rakiplerce arzu"	"edilen"	"bir konu olabilir. İhracata yönelik"
"s"	"S-AEABUs-0037-118"	"sekreteri Marta'yı canlandırırken, Teodor'u tehdit"	"eden"	"kaçık yazar rolündeyse Cenap Oğuz"
"w"	"W-GI09C4A-1927-1714"	"Seine kıyısında keyifle yemeği tercih"	"ediyorum."""	"Türkiye'ye her gidip geldiğimde Üstün'le"
"w"	"W-PG03A1B-2525-1171"	"sefasını değil, halkın mutluluğunu amaç"	"edinecek"	"bir yönetim reformundan geçtiğini öngörmüştür."
"w"	"W-RI41C1A-1458-1728"	"Sebzeler suyunu salana dek sote"	"edin."	"İçine ılık suyla ezilmiş salça"
"s"	"S-ACABQq-0423-697"	"sebep verilmediğini de özellikle ifade"	"ediyorum"	"ve Sayın Milletvekilimizin ilgisi için"
"s"	"S-ACABQq-0426-632"	"sebebiyle bizi eleştirmesini değil, takdir"	"etmesini"	"ve tebrik etmesini beklerdik. Sadece"
"w"	"W-CH03A1B-3097-683"	"sebebi, Mekkelilerin ticaret için elde"	"ettikleri"	"gelirin pek çoğunu savaş hazırlıklarına"
"s"	"S-ACABQq-0426-1107"	"sağlıktan ziyade ceza üzerine inşa"	"edilen,"	"devletin vatandaşını suçlu durumuna düşürdüğü"
"w"	"W-SD18E1C-3376-1593"	"sağlık politikası oluşturulmalı ve koordine"	"edilmelidir."	"Sağlıklı yaşam için spor bilincinin"
"w"	"W-MF10A2A-1823-651"	"sağlar. Hizmet sektöründe KG'nden söz"	"edilebilmesi"	"için, müşterilerin isteklerinin tam olarak"
"w"	"W-NE05A4A-1797-1240"	"sağlanması ve varolan uygulamaları terk"	"etmek"	"yerine onların üstüne yenilerinin kurulması."
"s"	"S-ACABQq-0423-2315"	"sağlamaya odaklanmış faaliyetler olduğunu ifade"	"ediyor,"	"bu vesileyle, sayın milletvekilimize de"
"w"	"W-UI45F1D-4719-139"	"sağlam temelleri de olsa, tarif"	"etmeye"	"çalıştığım anlamı oluşturmadıkları takdirde yakın"
"w"	"W-LE39C3A-1348-1944"	"sağlam bir siyasi gelecek vaat"	"edebilirdi."	"Çiller bunu yapamadı. Daha doğrusu,"
"s"	"S-ACABTZ-0336-1589"	"sağladı diye düşünüyorum. Çok teşekkür"	"ediyorum"	"kendisine. Ben dikkat ediyorsanız hep"
"w"	"W-VA14B1A-1602-2333"	"sağacaksınız? Büyük Baba İyicene dikkat"	"edersen"	"öğrenirsin. Reyhan Keçi, sütü sağılırken"
"s"	"S-ADABDp-0430-289"	"Sağ eli bırakıyorum. Solla devam"	"ettim"	"ve bayan karşımda ve çıkıyorum"
"w"	"W-NI22C2A-0169-1942"	"saç tuvaletinde doğal görünüm tercih"	"edilmez,"	"saçların yapılmış olduğunun belli olması"
"w"	"W-UI27D1B-2467-2290"	"sayısının başlangıçta 80 olduğunun tahmin"	"edildiği,"	"sonra sayının iki katı olduğunun"
"w"	"W-SE39E1B-3036-1466"	"sayısını (yaklaşık 1,618034) 1,618034) elde"	"ederiz."	"Burada elde ettiğimiz f sayısına"
"s"	"S-ACABQq-0421-2445"	"sayın üyelerin isimlerini Heyetinize arz"	"ediyorum"	"AK Parti Grubu adına Çanakkale"
"s"	"S-ACABPA-0434-1646"	"Sayın Yıldırım Aktürk, buyrun. Teşekkür"	"ederim"	"Sayın Başkan, değerli arkadaşlar. Söylenecek"
"s"	"S-ACABTZ-0336-1220"	"Sayın Yüksel Özdemir'i buraya davet"	"ediyorum."	"<Alkış> Sayın büyükşehir belediye başkan"
"s"	"S-ACAAPZ-0032-1061"	"Sayın Süha Aydın'ı sahneye davet"	"ediyorum."	"<Alkış> <D 58> Bu <B>"
"s"	"S-ACABQq-0429-2338"	"sayın milletvekilleri. Bir dakikanızı rica"	"edeyim"	"efendim... Müsaade edin de mikrofonu"
"s"	"S-ACABQq-0420-1977"	"Sayın milletvekilleri, oylama sonucunu arz"	"ediyorum"	"Açık oylamaya 231 sayın milletvekili"
"s"	"S-ACABQq-0423-2317"	"Sayın milletvekilleri, lütfen, yerinizden müdahale"	"etmeyiniz."	"Sayın Bakanım, buyurun. O gün,"
"s"	"S-ACABQq-0428-89"	"Sayın milletvekilleri, daha önce arz"	"ettiğim"	"hususta, İçtüzüğümüzün 63'üncü maddesine göre"
"s"	"S-ACABQq-0423-1409"	"Sayın Milletvekilimizin ilgisi için teşekkür"	"ediyorum."	"Sayın Başkan, değerli milletvekilleri; gündemin"
"s"	"S-ACABQq-0425-1705"	"Sayın Koç. Sayın Başkan teşekkür"	"ediyorum."	"Değerli milletvekilleri, hepinizi, şahsım ve"
"s"	"S-ACABPA-0434-586"	"Sayın Kamalak süre konusunda ikaz"	"etmek"	"istiyorum. Ayrıca partinizin bir görüşü"
"s"	"S-AEABTZ-0041-1226"	"Sayın Güral Elektaş'ı kürsüye davet"	"ediyorum."	"Sayın dekan, değerli öğretim üyeleri,"
"s"	"S-ACAAPZ-0031-551"	"Sayın Fatih Çomu'yu kürsüye davet"	"ediyorum."	"<Alkış> Sayın valim, sayın rektörüm,"
"s"	"S-ADABPZ-0372-290"	"sayın Burcu Irmak'ı kürsüye davet"	"ediyorum."	"<alkış> <D 9> Sayın rektörüm,"
"s"	"S-ACABPA-0434-2442"	"Sayın Başkan'ın müsamahası için teşekkür"	"ederim."	"Sağolun efendim. ANAP milletvekili Sayın"
"s"	"S-ACABQq-0423-1940"	"Sayın Bakanın çok dürüstçe ifade"	"ettiği"	"olumsuz taraflarına hiç değinmeyen bir"
"s"	"S-ACABQq-0423-1459"	"Sayın Bakanım, lütfen, konuşmanıza devam"	"eder"	"misiniz. Saygıdeğer milletvekili arkadaşlarım... Ben,"
"s"	"S-ADABPZ-0125-2020"	"sayın bakanım teşekkürü de hak"	"ettiniz,"	"burdan size onu iletim. Ve"
"s"	"S-ACABPA-0434-1055"	"Sayın Ahmet İyimaya'yı kürsüye davet"	"ediyorum."	"Değerli Başkan, Saygıdeğer misafirler, sözlerime"
"s"	"S-ADABPZ-0113-140"	"Sayın <B> beyi kürsüye davet"	"ediyorum."	"<İngilizce Konuşma 600> ve programımızın"
"w"	"W-MD05A0A-0280-689"	"sayılı Köy Eğitmenleri Kanunu kabul"	"edilmiştir."	"Bununla birlikte köye öğretmen yetiştirmede"
"s"	"S-ADABCo-0212-562"	"sayılı kanun meclisimiz tarafından kabul"	"edilmiştir."	""
"w"	"W-FA16B4A-0005-2032"	"sayılmıştı. Yine de türlü huysuzluklar"	"ediyorum,"	"kurtuluş yolu arıyorum... Eh, dedim,"
"s"	"S-ACABPA-0434-1427"	"sayılarını oy tehdidi altında maksimize"	"etmeye"	"çalışan bir takım karar vericiler"
"w"	"W-LF10A2A-1877-2307"	"sayıda seçeneklerin içinden gelişigüzel tercih"	"edilmiş"	"değildir. Uluslararası gelişmeler, ülke kaynakları"
"s"	"S-BEABXu-0435-2289"	"saymaya bile yeltenmiyoruz. Kozlayıp kayıp"	"edeceğim"	"pek bir şey anlamadığım için"
"s"	"S-ACAAQq-0419-2339"	"saygın ve güçlü bir yer"	"edinebilmesinin"	"en etkin ve kalıcı yolu,"
"w"	"W-JE02A2A-1523-1962"	"sayesinde, araştırma yapmak isteyenler, bilgi"	"edinme,"	"danışma gibi amaçlarla da bu"
"s"	"S-ACABPA-0434-269"	"savunuyor değiliz. Samimi olarak ifade"	"ediyorum,"	"demokrasi bir fazilet rejimidir. Çoğunluğun"
"w"	"W-VG03A2A-2586-843"	"savaşta gösterdikleri maharet Türk hücum"	"ettiği"	"zaman şahsı, silâhı, hayvanı, hayvanının"
"w"	"W-RC01A4A-1168-770"	"satılan glikoz balları Şeker ihtiva"	"eden"	"rafine işlenmiş gıdalar Patates Beyaz"
"s"	"S-ACABQq-0420-2385"	"satılacak mal ve malzemelerden elde"	"edilecek"	"gelirin Katma Değer Vergisi ve"
"w"	"W-DF05A1B-4365-2342"	"satıcı arasında karşılıklı olarak kabul"	"edildiği"	"bir satış şeklidir. Bir tacir,"
"w"	"W-OG13C3A-0350-1541"	"sarıp sarmalayan, etkileyen büyüden söz"	"ettiler."	"Radyoda arka arkaya üç röportaj"
"w"	"W-KE13C2A-1474-1176"	"sarsılmaması gereken sağlam kişiliklerden söz"	"etmiyor,"	"edemiyor. Hiç kimsenin aklına, ""O"
"w"	"W-FI39C3A-2958-2229"	"sarmalından sonra Türkiye'de sürekli afaroz"	"edilen"	"solun artık aklını başına devşirmesi,"
"s"	"S-BEABXO-0415-1672"	"Sarma var da. Bişe sorucam."	"Et"	"koymuyorum ama güzel oluyor mu?"
"w"	"W-KI37E1B-3055-1758"	"sarhoş kalakaldığı o gece dans"	"etmeye"	"çağıran adamın elinden tutar. Tango"
"s"	"S-BEABXX-0411-823"	"sardım tavuk falan. Ben kırmızı"	"et"	"hiç bi şekilde yemiyorum zaten."
"w"	"W-UD36C3A-0891-21"	"saptırılan Atatürk Devrimlerinin tamamen tasfiye"	"edilmesi."	"2- Sosyal hukuk devleti ve"
"w"	"W-TI41C2A-1175-441"	"sanırım!"" gibi imalı bir laf"	"ettiğinde"	"bile hiç üzerine alınmazlar, yüzleri"
"s"	"S-ADBBAo-0443-573"	"sanırım izleyicilerimizde ekranlarının başında fark"	"etmişlerdir."	"Perihan'a küçük bir sürprizimiz daha"
"s"	"S-ADABIi-0124-956"	"sanıp bu kötü örnekleri devam"	"ettiriyorlar."	"Emm bir süreç alıyor birbirini"
"s"	"S-AEABTZ-0040-1690"	"santral özellikle Hollanda'yı falan dikkat"	"edin,"	"bu gelişmelere, inanılmaz önemli ve"
"s"	"S-ADABDp-0432-1535"	"sancısı çektim. Hakkaten kimseye tavsiye"	"etmiyorum."	"<gülerek> Müthiş bişe. Kalkalım. Spor"
"s"	"S-ACAAQq-0424-1449"	"sanayii alanında kullanılmak üzere ithal"	"edilen"	"petrol türevlerinin, benzin ya da"
"w"	"W-BF10A2A-1365-864"	"Sanayicimize buyrun AT ile rekabet"	"edin,"	"diyoruz. Biliyorsunuz Türkiye'de İktisadi Kalkınma"
"w"	"W-QD37C2A-0506-1064"	"Sanat Musikisi konserini mi tercih"	"ettiniz?"	"Buyrun, ne demiştiniz?!.. BENİM OĞLUM"
"s"	"S-ADAASK-0036-525"	"sana, seviyorum ya bir hediye"	"edeyim"	"diyor. Nedir o hediye edecek?"
"s"	"S-BEABXO-0056-2015"	"sana yakışmış. Lepitak? Dayı yemin"	"ederim"	"çok uğraşacan ha. Çok kılın"
"s"	"S-BEABX\-0065-1550"	"sana nereye harcıyon, napıyon, ne"	"ediyon?"	"Burda... Buraya gelince artık şeyde"
"w"	"W-PA16B4A-0089-353"	"sana dayı, ne istersin?"" ""Fark"	"etmez,"""	"dedi, Adem. ""Yemek istemem. Rakı"
"s"	"S-AEABTZ-0040-2375"	"samimi olarak cevap vermenizi rica"	"ediyorum."	"Teşekkürler. Buyrun. Merhabalar. Sevil Bulutlar."
"s"	"S-BEABXW-0173-1423"	"Sami'de koşturuyo ortalıkta yani belli"	"ediyo"	"kaçak olduğunu <gülme> diyorum Sami"
"w"	"W-TI27D1B-2466-574"	"Samantha da kilolu olmaktan nefret"	"ettiğini"	"ancak tatlıya karşı koyamadığını söylüyor."
"w"	"W-HG37C3A-0598-418"	"Salih Ecer ve arkadaşlarının organize"	"ettiği"	"ve Komet'in ceketini denize düşürdüğü"
"w"	"W-TI45F1D-4682-1278"	"saldırıvermeleri de şaşkınlık yaratmaya devam"	"ediyor."	"İnsan neden ölür Kaynağını hatırlayamadığım"
"w"	"W-RI22C3A-0520-1081"	"Sakın ola ki, bunu ihmal"	"etmeyin."	"Sevgili Koleksiyonu Yapmayın Tabii aşkta"
"s"	"S-ADABPZ-0135-1090"	"Sahra Hanım'a biz de teşekkür"	"ederiz."	"<B> zaman kalmadı farkındayım. Ve"
"w"	"W-PF10A2A-1867-1510"	"sahipleri ile bunlar adına hareket"	"edenler"	"tarafından doğrudan temsil yoluyla veya"
"s"	"S-ACABQq-0425-2496"	"sahipler, edecekler; ama, yakinen takip"	"etmek"	"gerekir ki, işte, bu çakıl"
"w"	"W-JF10A2A-1836-2248"	"sahip tüm kuruluşlarca da ihraç"	"edilmekte"	"ve bu kıymetlere de önemli"
"w"	"W-EE02A1B-3446-1646"	"sahillere sahip olmanın değerini takdir"	"eden"	"2. Kılıçarslan daha 1182 yılında"
"w"	"W-JE39E1B-3029-527"	"sahibi tarafından gönderilip gönderilmediğini teyid"	"ettirmeliyiz."	"Ayrıca şifremizin başkaları tarafından çözüldüğünü"
"w"	"W-HH42C2A-0709-226"	"sahabi Hazret-i Zübeyr'in (r.a.) azad"	"ettiği"	"kölelerden olan Eş'âb, komşularından birinin"
"s"	"S-ACABQq-0423-1294"	"safhada lehte gelişmeler kaydedildiği ifade"	"ediliyorsa."	"Şimdi ""büyük başarı sağlandı"" derken,"
"w"	"W-OE39C3A-1415-1505"	"sadece ve yalnız Rusya'yı tercih"	"etmektir..."	"Dikkat çekmek isterim Herhangi bir"
"w"	"W-SI37C3A-1235-610"	"sadece bu fonksiyon ile ifade"	"etmemelidir..."	"Tüm fonksiyonlar uyumlu ve birbiriyle"
"w"	"W-CG22C2A-0424-1555"	"sadece bir asistan olduğu tespit"	"edilmiştir."	"Heyetin diğer mensuplarının da Pensilvania"
"s"	"S-ACAAFZ-0048-1397"	"sadece 5-6 bin kişi kabul"	"edecekler."	"Öyle bir madde var ki"
"w"	"W-FG03A1B-3187-1045"	"sabuna dokunmamasına azami derecede dikkat"	"ediliyordu."""	"""Bir Konferans"" ve ""Köpek"" adlı"
"s"	"S-AEAASO-0039-1692"	"sabit. Fransa'da Sevgili Peygamber'imizi tahkir"	"eden"	"bir tiyatro oynatılıyor, film. Ulu"
"s"	"S-ADAASK-0036-1844"	"Sabikun Bil Hayrat'ın sınıfına dahil"	"et."	"Mümkün mü? E mümkün Allah"
"w"	"W-IE39C4A-1358-602"	"saatini 9 sanıp yetişmeyi ümit"	"etmişti,"	"dolmuşa binerken de 9.30 olmasını"
"s"	"S-BEABXO-0444-1499"	"saatim. Rüyamda çok kötü kavga"	"ettik"	"ama ayrıldık. Face'de bile ilişkisi"
"w"	"W-NH42C2A-1324-664"	"saat havada kanat sahlıyon Rahm"	"edin"	"didemdeyaşa durnalar Katarlanub hansı yerden"
"w"	"W-OF25D1B-2158-2198"	"Saa, televizyondan halka seslenerek istifa"	"ettiğini"	"açıkladı. Saa, üyesi olduğu Peronist"
"w"	"W-IE39C3A-1108-1157"	"Rıza Nur ise, Montagna'ya itiraz"	"ederken,"	"Türkiye'ye önerilen taslağın o örneği"
"w"	"W-TA16B0A-0136-31"	"rüzgârla kabaran dalgaların Marmara'yı altüst"	"ettiği"	"bir gece, yatsı namazından sonra"
"w"	"W-SB38E1B-2884-2473"	"rüzgar enerjisi potansiyeli olduğu tahmin"	"edilmektedir."	"Enerji Bakanlığı'nın tahmini ise 10"
"w"	"W-PA16B4A-1475-1029"	"rüyet ile malum ve müşahede"	"edilen"	"olarak görüyorum. O'nu, hakikati açısından,"
"w"	"W-QI43C4A-1428-2243"	"rüya gördüm, işinize yaracağını ümit"	"ederek"	"yazmaya karar verdim. Öncelikle Türk"
"s"	"S-BEABXO-0416-1391"	"röfle falan. Yok onlara yardım"	"ediyodum"	"kaş bıyık falan alıyodum. Ücret"
"s"	"S-ACABQq-0423-1175"	"Rum'un Türk tarafına geçeceğinden söz"	"ediliyor;"	"bu doğru değildir. Rumlar, sadece,"
"w"	"W-NI29D1B-2450-2114"	"ruh sağlığına olumlu katkısından söz"	"edebiliriz."	"Soru Çocuğumuzun tel takmaya ihtiyacı"
"w"	"W-VF10A3A-1814-507"	"RR PP,) kadar rant elde"	"ederken,"	"A grup toprakların sahiplerinin sağladıkları"
"s"	"S-AEABUZ-0022-1985"	"Rotariye, sen Masonsan ee <B>"	"ediyorum"	"<B> yirmi beşinci 1568'inci bilmem"
"w"	"W-PI22C1A-0231-756"	"Romalılar, Eski Yunan'ın tragedyalarını taklit"	"eden"	"oyunlar yazdılar ama çok da"
"w"	"W-OD05A2A-2605-1559"	"Roma İmparatoru Johannes 425'de idam"	"edildi."	"Batı Roma İmparatorluğu yine de"
"w"	"W-OH37C2A-0540-112"	"rivayetçinin, hadisciler tarafından yalancılıkla itham"	"edildiği"	"herkesçe bilinmektedir. Yani bu kişi,"
"w"	"W-UE36E1B-3356-1934"	"riskleri bir buçuk saatte yok"	"etmeyi"	"vaat ediyor. Türkiye'de yalnızca Op."
"s"	"S-ADABAo-0388-427"	"risalesini Rusça'ya ve Almanca'ya tercüme"	"ediyor."	"İşte modern araştırmacıların İbni Fazlan'la"
"s"	"S-ADABCo-0334-15"	"Rica ederim peki son Teşekkür"	"ederim"	"Son olarak emm şeyi soracam"
"s"	"S-ADABPZ-0374-2098"	"rezervleri Avrupayı bin yıl idare"	"edicek"	"nitelikte bin yıl bakın tek"
"w"	"W-QI41C3A-1457-89"	"restoranlar içerikten ziyade müşteriyi taciz"	"etme"	"yöntemiyle yüksek fiyat şarj edebiliyorlardı."
"w"	"W-EF05A1B-4371-251"	"resmi hesaplamaların vergi yükünü ifade"	"etmede"	"yetersiz kaldığını kaydeden Akalın, gerçek"
"w"	"W-PI22E1B-2909-403"	"Rengini değiştir, kamuflajını yap, fark"	"edilme."	"Tabii bu arada bukalemunlarla ilgili"
"s"	"S-ACAAPZ-0384-652"	"rektörümüz adına hepinizden alkış rica"	"ediyorum."	"<D 9> Ben özür diliyorum"
"s"	"S-ADABCo-0197-115"	"Reklamların ardından bunun detaylarıyla devam"	"ediyoruz."	"Teröristlerin teslim olmaları halinde etkin"
"w"	"W-SG03A1B-3276-58"	"reklamda hizmet kalitesinin genel kabul"	"edilen"	"boyutlarından bahsediliyor ise de ""kalite"
"w"	"W-UH42C2A-0412-2023"	"rekat sayısından itibaren namazını devam"	"ettirir."	"Örneğin, namazın üçüncü mü yoksa"
"w"	"W-SF10A2A-1865-1213"	"rekabetçi üstünlüğünün bulunduğu, buna karşılık"	"et"	"ve süt ürünlerinde AB'nin daha"
"w"	"W-MF10A1A-1824-822"	"Rekabet ve motivasyon için hizmet"	"etmeli."	"Misyon işe anlam kazandırmakta ve"
"w"	"W-SI27D1B-2807-2086"	"rehberlerin oluşturulması, mimari projenin elde"	"edilmesi,"	"detaylandırılması, uygulanması gibi profesyonel açıdan"
"w"	"W-IF18E1C-1660-2039"	"reform ve stabilizasyon çalışmalarını devam"	"ettiren"	"bu ülkelerde, süregelen üretim kaybı"
"s"	"S-ADABPZ-0373-250"	"Refik Uluçay'ı davet ediyorum. <alkış>"	"Edindiğim"	"bilgi ve beceriler doğrultusunda Edindiğim"
"w"	"W-RB04A3A-1997-920"	"reaksiyon gereğince antimon metali elde"	"edilmektedir."	"600 g antimon sülfür minerali"
"w"	"W-MD02A1B-4509-239"	"rasyonelin Batı ve moderniteyi temsil"	"etmesine"	"karşı, duygusalın Doğu ve gelenekte"
"s"	"S-AEAASO-0039-1221"	"Rasulallah en çok kime hürmet"	"edeceğim?"	"Kime hizmet edeceğim?"". ""Anana"" diyor."
"s"	"S-ADABCo-0279-1214"	"Raporda ek inşaatın ruhsatının iptal"	"edildiği"	"ancak inşaat alanındaki tarihi kalıntıların"
"w"	"W-LF10A2A-1853-1106"	"rakiplerinden ayırt edecek özellikleri ifade"	"eder."	"İlk beş rekabetçi öncelik tercihi"
"w"	"W-PE39C3A-1330-1183"	"rakipleri de aynı şekilde itham"	"edeceklerdi."	"Medya silah olunca bir de"
"w"	"W-LE02A1B-3687-356"	"rahiplerin bu dönemde ticaretle iştigal"	"ettiklerini"	"göstermektedir.. Asurlu tüccarlar Anadolu'da ticaretle"
"w"	"W-IA16B2A-0762-678"	"rahatlamıştı. O gece sabahı güç"	"ettiler."	"Bakalım yarın ne maceralar yaşayacaklardı?"
"s"	"S-ADABDp-0432-87"	"rahatladı, ayaklar ağrıyo. Sakın pes"	"etmeyin."	"Özellikle fıtıkta yüz gününüzü burda"
"s"	"S-ACABTZ-0336-992"	"radyoaktif atıklardan hiç onlardan söz"	"etmek"	"istemiyorum. Bir örnek verecem İstanbul'da"
"w"	"W-NE18E1C-0317-2309"	"radyasyon sızmasının kaçınılmaz olduğunu teyit"	"eden"	"Boğaziçi Üniversitesi Nükleer Mühendislik Anabilim"
"w"	"W-UH42E1B-2921-722"	"Rabbinin rahmetini dileyen kimse inkâr"	"eden"	"kimse gibi olur mu? Ey"
"s"	"S-AEAASO-0039-238"	"Rabbi, yaratılışımızdaki ana gayeyi idrak"	"ederek,"	"Yaradan'ımıza kul, Habibi'ne ümmet, sevdiklerine"
"w"	"W-LA16B2A-0009-1330"	"pırıltılar yansıdı gözlerinden. Dudaklarını terk"	"eden"	"ikaz da o kadar sert"
"s"	"S-BEABXO-0160-776"	"pırıl pırıl yeni alınmış halt"	"etmiş."	"<gülme> <B> Halt etmiş işte"
"w"	"W-UE30D1B-2135-2028"	"Putin'in gelecek hafta Özbekistan'ı ziyaret"	"etmesi"	"bekleniyor. Batı karşıtı cephede yer"
"w"	"W-FD36C0A-0198-1465"	"protokol bana söyleniyor. Kimler iştirak"	"etmiş?"	"SAVCI Bülent Öztürkmen, Ethem Külhan,"
"w"	"W-DC06E1B-3076-1017"	"projeyle bilgisayar kullanımını, teleskopları kontrol"	"eden"	"sistemlerde daha basit bir hale"
"s"	"S-AEABPZ-0331-2278"	"projesi 64 milyon Euro'ya iade"	"edildi."	"Mezitli'de yapacağımız da en az"
"s"	"S-ADABPZ-0115-2264"	"projeleri emm şey yapıyor kabul"	"etmiyorlar,"	"format biçimsel olarak etmiyorlar bunu."
"s"	"S-ADABAo-0308-59"	"proje. Şimdi arge yatırımlarına devam"	"ettiğiniz"	"bu krizde anladığım kadarıyla şuanda"
"s"	"S-ADBBI^-0042-1760"	"programını MHP'yle birlikte hazırladık, kabul"	"ettik"	"neticede... Evet, bazı noktalarda birbirimizi"
"s"	"S-ADBBAo-0443-362"	"Programın başında bir rakamdan söz"	"ettiniz."	"İsterseniz sonra konuşalım mı veya"
"s"	"S-ADABAo-0433-485"	"programımızın bitmesine artık. Sizlere veda"	"edicem,"	"bu yüzdendir ne yapmak istiyorum"
"w"	"W-EF05A1B-4375-398"	"programı olarak adlandırılan, uygulamada tercih"	"edilebilir."	"İstikrar programlarının amaçları tespit edilirken"
"w"	"W-VI44F1D-4747-922"	"programı gibi. Hem Sağlıklı Teşekkür"	"ederim"	"""Zenim"" ""Yengeçburcu"" azıcık dondurmadan birşey"
"w"	"W-MF10A2A-1789-831"	"programları öğrenciler tarafından fazla tercih"	"edilmemektedir."	"Son 10 yılda açıköğretime yerleştirilen"
"s"	"S-ADABPZ-0134-1941"	"Profesör Sahra Çelik'i kürsüye davet"	"ediyorum."	"<Alkış> Sayın rektörüm, sayın rektör"
"w"	"W-TI09C4A-0560-2353"	"profesör olabileceğimi söyler ve ümit"	"ederdi."	"O zamanlar tek insan hegemonyasında"
"s"	"S-ADABPZ-0372-1112"	"profesör Doktor Şahan Saygı'yı davet"	"ediyorum."	"<alkış> <D 21> <alkış> Diğer"
"s"	"S-ADABPZ-0372-2196"	"profesör Doktor Gürol Emektaş'ı davet"	"ediyorum."	"<alkış> <D 16> <alkış> <D"
"s"	"S-ADABPZ-0356-1923"	"Profesör Doktor Güliz İkizoğlu'na teşekkür"	"ediyoruz."	"Son olarak sempozyumumuzun ulusal başkanlarından"
"w"	"W-TE39C4A-0264-531"	"Prodi'ye, Elkatmış'ın cezaevindeki DEP'lileri ziyaret"	"ettiğini"	"anlattı. Erdoğan, Elkatmış'ın, DEP'lilerin DGM'deki"
"w"	"W-PE05A1B-4234-1068"	"primer enerjinin atılan kısmım minimize"	"ediyor."	"Günümüz enerji kaynakları iki gruba"
"w"	"W-QE37C2A-0851-530"	"poza girmeyi de kesinlikle ihmal"	"etmeyiz"	"Bu kuaförlük zor meslek. Ellerin"
"s"	"S-ADABPZ-0135-2272"	"post modernizm yaratılmış ve teşvik"	"edilmiş"	"bir akıl olarakta görülmedir. En"
