"Register"	"Text"	"Left"	"-5;5"	"Right"
"w"	"W-QG36C4A-0452-1467"	"değerlendirmesiyle duyan, eleştiren, sorgulayan dolayısıyla"	"gelişen"	"bir toplum/ulus toplum/ulus olabiliriz, evrensel"
"w"	"W-ME39C4A-1283-1979"	"değerlendirmenin Direniş Komiteleri fikrinin kendi"	"gelişme"	"koşullarının gerçekliğine uygunluk göstermediği ortada"
"w"	"W-EE39C4A-0975-2346"	"değerlendirmeleri farklıydı. Başlangıçta ""türbanla ilgili"	"gelişmeleri"	"uzaktan seyretmeyi"" yeğleyen İnönü, artık"
"w"	"W-MF10A2A-1862-1331"	"değerlendirilmesiyle zaman içinde nasıl bir"	"gelişme"	"olduğu izlenmeye çalışılmıştır. Türkiye'de göreli"
"w"	"W-LF10A0A-1777-1471"	"değerlendirilmesi ve güncel gelişmeler çerçevesinde"	"geliştirilmesi"	"çalışmalarına yardımcı olabileceği düşüncesi ile"
"w"	"W-IC06A2A-1963-118"	"değerine genellikle olgunlaşma döneminde ulaşmaktadır."	"Gelişmenin"	"ilk dönemlerinde kök derinliğine bağlı"
"w"	"W-VE05A4A-2591-251"	"değer kazanması çok olumlu bir"	"gelişmedir,"	"bu değer kazanma sayesinde dengeler"
"w"	"W-SE05A1B-4198-1747"	"Devrim”den Devrim”den Devrim”den hareketle bu"	"gelişme"	"somutlaştırılabilir. Ukrayna’daki Ukrayna’daki Ukrayna’daki son"
"s"	"S-ADABPZ-0134-370"	"devrimi, sanayi kentlerin çevresindeki integralın"	"gelişmesine"	"bu da yeni pazarların oluşturulmasına"
"w"	"W-CE39E1B-2888-1948"	"devrim proletaryanın sınıf içi eşitsiz"	"gelişmesini"	"ne denli körüklediyse, mülk sahibi"
"w"	"W-KC06A3A-2007-595"	"DEVRELERİ İLE SU İLİŞKİSİ Mısırın"	"gelişme"	"devreleri denince toprak altı yani"
"w"	"W-JE39E1B-2838-2098"	"devletlerin çatırdamaları, yıkılmaları ve bu"	"gelişmelerin"	"akıttığı gözyaşları gösterilebilir. O ülkelere"
"s"	"S-ADABPZ-0113-297"	"devleti çağdaş devlet olmalıydı yani"	"gelişmiş"	"ülkeler sanayileşmiş ülkeler ve kalkınmış"
"s"	"S-ADAABo-0367-117"	"devlet artık servet biriktirir. Bayındırlığı"	"geliştirir,"	"uyruklarına makamlar, mevkiler dağıtır. İşte"
"w"	"W-VF05A1B-4637-2222"	"Devanadhen (2008) ve Gökçe (2002)"	"gelişmekte"	"olan piyasalarda fiyat-hacim nedenselliği üzerine"
"s"	"S-ADABPZ-0135-15"	"devam ettirilmesi ve emperyalist <B>"	"geliştirmeyi"	"katliamlarına kadar uzanan ve kurbanlar"
"w"	"W-SB29D1B-2803-117"	"devam etti. BBC ile ortaklaşa"	"geliştirdikleri"	"proje ile televizyon yayıncılığının yeni"
"w"	"W-KF10A3A-1767-96"	"devam etmektedir. Uzun yıllardır Batılı"	"gelişmiş"	"ülkelerden aldığımız resmi kalkınma yardımları"
"w"	"W-IF18E1C-4145-2212"	"devam etmektedir. Diğer taraftan teknolojik"	"gelişme"	"ve küreselleşmenin yarattığı potansiyellerin de"
"w"	"W-TF25D1B-2148-316"	"devam ediyor. Bu konuda, birtakım"	"gelişmelere"	"ilişkin değerlendirmeyi gerektirecek bir durum"
"w"	"W-SD30D1B-2192-1501"	"devam eden siyasi mücadele, kentte"	"gelişen"	"""tombala"" krizi ile yeni bir"
"w"	"W-GD39C2A-0283-170"	"desteğini getiriyor. Liberal Ahrarlar, SSCB'deki"	"gelişmelere"	"bakarak sosyalizmin, ideolojinin ölümünü bayram"
"w"	"W-PF10A2A-1849-644"	"destekli ortam. Teknoloji Parkı Endüstriyel"	"gelişme"	"amacı ile teknoloji tabanlı imalatçılara"
"w"	"W-TD09C4A-0211-1667"	"destek bulma hem politik ilişkiler"	"geliştirme"	"imkanı verdi bu aktörlere. Eşzamanlı"
"s"	"S-BEABXO-0345-78"	"Ders materyali geliştirme. Ders materyali"	"geliştirme"	"aşamaları nelerdir? Nelerdir yazmicaz da..."
"s"	"S-ADABPZ-0134-409"	"ders almakta zamanla çıkarılmıştır, zihinsel"	"gelişmemizi,"	"doğru düşünme sanatını elimizden almaları"
"w"	"W-VE09C3A-1051-221"	"dermatopatolojiydi. Her şey gönlüme göre"	"gelişiyordu."	"Kısa sürede evimize peşin para"
"w"	"W-ID02A1B-3827-1577"	"derinlikli bir Halit Ziya değerlendirmesi"	"geliştirebilirdi"	"Ahmet Hamdi. Ama yaptığı, Bovarizm"
"w"	"W-GG03A1B-3198-1569"	"derecede sanatçıların şöhretini ve stilistik"	"gelişmenin"	"genel yönünü' belirledikleri anlamına gelmektedir."
"w"	"W-GH03A1B-3107-557"	"der. Ne var ki, toplumun"	"gelişme"	"tarihi, bir noktada, doğanın gelişme"
"s"	"S-ACABQq-0425-448"	"denklemleri oturtabilecek ekonomik ve malî"	"gelişmeleri"	"ortaya koymak için çalışmalar yapıyoruz."
"w"	"W-PD43C2A-0656-125"	"denir oldu. Nasıl karşılıyorsunuz bu"	"gelişmeyi?"	"Gürgür Küresel değişmeler kavramları da"
"w"	"W-EE39C2A-0641-1405"	"dengesini yakalama fırsatı buldular. Bu"	"gelişme"	"Türk Silahlı Kuvvetlerinde yalnız kavramsal"
"s"	"S-AEABTZ-0040-394"	"denetleme mekanizmasının gelişmesi gerekiyor. Neden"	"gelişmesi"	"gerekiyor? Nükleer rönesansla ilgili de"
"w"	"W-GD37A3A-0252-2476"	"Denetleme kendiliğindenliği (spontaneity), doğal olarak"	"gelişen"	"ve ifade edilen duyguları öldürür."
"w"	"W-EF05A1B-4377-1512"	"Denetim Sistemi A. Bağımsız Denetimin"	"Gelişmesi"	"1. Sayıştay Ülkemizde muhasebe denetiminin"
"w"	"W-SG03A0A-1701-748"	"denenmiş olmasına rağmen bu formları"	"geliştirmek"	"ona nasip olmuştur. Bu sebepten"
"w"	"W-VE39C2A-2700-1743"	"denedi. Türkiye'nin ekonomik yapısını dünyada"	"gelişmelere"	"paralel hale getirmek için ekonomik"
"s"	"S-ADABAo-0366-256"	"demokratik kültürlerini yani demokrasi bilinçlerini"	"geliştirdi."	"Halkların ve bireyin de yurttaş"
"w"	"W-MD02A1B-4502-2412"	"demokrasinin oturması ve sivil toplumun"	"gelişmesiyle"	"devletin ağırlığı hafifletilerek belli çıkış"
"w"	"W-GE05A2A-1075-1749"	"demokrasi yolunda ilerleyişleri ve demokrasiyi"	"geliştirme"	"yolundaki tarihsel görevleri açısından büyük"
"w"	"W-PD02A2A-2046-1922"	"demokrasi ve insan hakları eğitiminin"	"gelişmeye"	"açık yanı ele alınmıştır. Okul"
"w"	"W-GF10A4A-1841-2146"	"Demiryolu yapımında 1855-1925 döneminde görülen"	"gelişme,"	"buna karşı 1925 -1983 döneminde"
"w"	"W-MI22C3A-0669-2099"	"Demirel'e sordu ""Efendim, acaba bir"	"gelişme"	"var mı?"" Aklı Beyaz Balina'da"
"s"	"S-AEABUZ-0038-313"	"delikli kartlara, kasetlere, cd'lere ve"	"gelişmiş"	"bilgisayarlara kaydederek biriktirmeye başladı. Tabi"
"w"	"W-HC06E1B-3081-244"	"dek ertelemiştir. 20. yüzyılın başlarında"	"geliştirilen"	"ve ikinci yarısında yaygın olarak"
"w"	"W-QD30D1B-2202-220"	"dediğini ileri sürdü. Toplumun bu"	"gelişmelere"	"tepki göstermesi, reflekslerinin çalışması gerektiğini"
"s"	"S-BEABXO-0450-259"	"dedim hani otur İngilizce'ni baya"	"geliştir"	"dedim. Almanca, İngilizce. Hıı, annemle"
"s"	"S-ADABPZ-0125-201"	"Dedik ki okul sanayi işbirliğini"	"geliştirelim."	"Gelin beraber yapalım bu işi"
"s"	"S-BEABXO-0345-142"	"de... Emm... Sonuçların değerlendirilmesi ve"	"geliştirilmesi."	"Ama ne sonucu? Uygulama sonucu."
"w"	"W-JI37C3A-0642-2383"	"de... Ama biyolojik ve sosyal"	"gelişmenizin"	"bir aşamasından itibaren, artık sizin"
"s"	"S-ACABFZ-0049-434"	"de, pozitif bilimlerdeki göz kamaştırıcı"	"gelişmelerin"	"parçalarından biri olarak gördükleri darwinizmden"
"s"	"S-AEABUZ-0038-378"	"de üniversitelerin bir ülkenin sosyo-ekonomik"	"gelişmesinde"	"ne kadar, özerkliğini, ne kadar"
"w"	"W-SI27D1B-2465-550"	"de önemine dikkat çeken doktorlar,"	"gelişmekte"	"olan ülkelerde doğum kusurları ile"
"w"	"W-TF25D1B-2169-2341"	"de yavaşlayabilir."" dedi. AB üyeliğinde"	"gelişme"	"beklenmemesi gerektiğini kaydeden Yalçıntaş, ekonomi"
"w"	"W-JF10A2A-1879-2375"	"de yararlıdır. Bu işbirliği olumlu"	"geliştiği"	"takdirde bir süre sonra bu"
"w"	"W-OD36C1A-0154-2132"	"de yakından izlemişlerdi... 1770'lerde Batı'nın"	"geliştirdiği"	"ilk anatomi atlasını alıp iki"
"w"	"W-LE39C3A-0454-2423"	"de var. Türkiye'nin reel ekonomik"	"gelişmeleri,"	"bundan sonraki dönemde, Türkiye-Almanya ilişkilerini"
"w"	"W-SC18F0A-1784-1413"	"de tüm sistemi kapsayacak biçimde"	"geliştirilmesi"	"gerekmektedir. Bu konudaki öneriler; Erken"
"s"	"S-BEABXO-0343-115"	"de seyreder, öğrenir, ben onu"	"geliştiririm"	"gene, annen nasıl olsa gelip"
"w"	"W-OF10E1B-3063-1280"	"de sektör için sağlıklı bir"	"gelişme"	"olacak. Kurumsal İnternet kullanımının artışı"
"w"	"W-VE39E1B-2907-2483"	"de mümkün. Yakın dönem kimi"	"gelişmelerin"	"betimleyici olduğu inancındayız. Bir MHP"
"w"	"W-KF05A1B-4438-1125"	"de makul seviyelere çekilebilecektir. Bu"	"gelişmeler"	"sonucunda ise. hem peşin alım"
"s"	"S-ADBBI^-0042-44"	"de kendimizin yararına olan sentezleri"	"geliştirmektir;"	"dünya ve bölge dengelerinde, Türkiye'nin"
"w"	"W-FE39C0A-0250-1780"	"de iki yıldır Türkiye Devletinde"	"gelişen"	"yeni değişimler konusundaki bilgisizliği ve"
"w"	"W-JI09C3A-1441-10"	"de el uzatmasıyla, köyün hızla"	"gelişmesinin"	"hikâyesi bu. Heyecan veriyor. Ama,"
"w"	"W-UC29D1B-2445-79"	"de dünyadaki örneklerinden daha da"	"gelişmiş"	"olacağını söyledi. Saranlı, şunları kaydetti"
"w"	"W-FF10A2A-3019-378"	"de dünya pazarlarında yaşanan olumlu"	"gelişmelerin"	"etkisi olmuştur. 80'li yılların başında"
"s"	"S-ACABTZ-0336-84"	"de dahil daha fazla araştırma"	"geliştirme"	"gereken bir sektör yok. Diğer"
"s"	"S-ACAAPZ-0328-73"	"de daha sağlıklı yaşam stilleri"	"geliştirmede"	"rol modeli olur. Eğitici olur"
"s"	"S-AEABUZ-0038-309"	"de bundan zarar görüyor. Bugün"	"gelişmiş"	"sosyo-ekonomik olarak gelişmiş ülkelere zenginlik"
"w"	"W-HE05A1B-3519-2420"	"de bu kavramı esas alarak"	"gelişmelidir."	"Devlet ""süreklilik, güven ve ciddiyetin"
"w"	"W-UD02A1A-2058-995"	"de biyoteknolojinin öncelikli alan olarak"	"geliştirilmesini"	"vurgulayanlar ile hem de tam"
"s"	"S-AEABTZ-0040-603"	"de alınıyor. Gittikçe emniyeti de"	"gelişiyor."	"Yakıt konusunda bunun önüne geçmek"
"w"	"W-MF10A2A-1862-1452"	"dayanıyordu. Simon Kuznets'e göre ekonomik"	"gelişme"	"sürecinde kişi başına gelir ile"
"w"	"W-SI37C3A-1235-2444"	"dayanır. Kişiliğimizin ilk dört fonksiyonunu"	"geliştirirken"	"ve özellikle de sezginin açılmasında"
"w"	"W-CD02A1B-3398-1473"	"dayanıksızlığını doğal karşılamak gerekir. Demokrasi,"	"gelişmiş"	"ülkelerde, doğal koşullarda, neredeyse kendiliğinden"
"w"	"W-UD36C3A-0891-1744"	"dayanmamaktadır. Tamamen tersine ekonomideki olumsuz"	"gelişmeler"	"sonucu olmuştur. ""Bu çelişki Türkiye'de"
"w"	"W-LA16B4A-0149-1836"	"dayanarak onunla ilgili büyük duygular"	"geliştirip"	"sonra da yıkıcı hayal kırıklıkları"
"s"	"S-ACAAPZ-0328-45"	"dayalı tahsisinde, sağlıklı çevre uygulamalarını"	"geliştirmekte"	"okul ve işyerlerini etkilemek, aile"
"w"	"W-QE18E1C-1658-2456"	"davet etmiştir. İnsan Hakları konusundaki"	"gelişmeleri"	"izleyen Meclis İ̇nsan Hakları Komisyonu,"
"w"	"W-HD02A1B-3812-838"	"Danışmanın yardımıyla gizil kalmış parçalar"	"geliştirilerek"	"bastırılmış duygular kırılmaya çalışılır. Rüyaların"
"w"	"W-FE09C2A-0419-1239"	"damar tıkanıklığı, sonra da felçle"	"gelişen"	"rahatsızlığı, ""oralarda çareler tükenmez"" umuduyla"
"w"	"W-MD39E1B-3359-1963"	"daima daha güçlü, gayretli ve"	"gelişme"	"sağlayan kişiler olarak görev yapabilmeleri"
"w"	"W-SD18E1C-4173-62"	"dahil), karşılaştıkları güçlükler ve yeni"	"gelişmeler,"	"6. Türkçe konuşan Orta Asya"
"w"	"W-SI37E1B-3061-1875"	"dahi, farklı ırklara karşı düşmanlık"	"geliştirebilmesi"	"bunun kanıtıdır, kan dini benimsemiş"
"w"	"W-SD36E1B-2843-2376"	"daha özgüvenle gidiyordu kadın ve"	"geliştirdiği"	"tek organize atakta, kanatları iyi"
"w"	"W-RE39C4A-1386-1235"	"daha çok geriliyordu. Moral bozan"	"gelişmelere,"	"Irak işgalinde İngiliz ordusunun beşte"
"w"	"W-OB29D1B-2439-728"	"daha çağdaş fiziki mekânlara kavuşturma,"	"gelişmiş"	"ülke üniversitelerinin sahip olduğu teknolojilerle"
"w"	"W-RD02A3A-1385-1387"	"daha sık rastlanmaktadır. Bütün bu"	"gelişmeler"	"Türkiye'de, siyaset ve bilim sahalarında"
"w"	"W-SD36E1B-2843-1290"	"daha sıcak, dolayısıyla daha yakıcı"	"gelişmelerin"	"yaşandığı bir durumla da karşı"
"s"	"S-ACABQq-0423-57"	"daha sonra da yasal tedbirler"	"geliştirmek"	"üzere çalışmalar yaptırdık ve yaptırmaya"
"w"	"W-FD36C4A-0341-254"	"daha iyiye ve doğruya doğru"	"gelişmesinin"	"doğal ve toplumsal evrimin bir"
"w"	"W-JC06E1B-3084-1267"	"daha iyi anlaşılması fizikoterapi tekniklerinin"	"gelişmesine"	"de yardımcı olabilir. Yıldızların Doğduğu"
"w"	"W-MD39E1B-3360-1565"	"daha iyi anlaşılabilmesi için, Turizm"	"Geliştirme"	"Vakfı'nca 1994 yılında yapılan aynı"
"w"	"W-IF18E1C-1660-1890"	"daha istikrarlı bir yapıya kavuşmuştur."	"Gelişmekte"	"olan Asya ülkelerine giren sermayenin"
"w"	"W-JI37C2A-0476-185"	"daha geniştir. Dostluk kurma, sevgiyi"	"geliştirme,"	"dertleşme, sosyalleşme kişide cinsel kıpırdanmalarla"
"w"	"W-OI41C4A-1312-1696"	"daha fazla başarı gösterir. Kafası"	"gelişince"	"planlı ve metodlu hareket eder."
"w"	"W-DF05A1B-4365-492"	"daha eklenmiştir. Ortadoğu'da hızlı bir"	"gelişme"	"seyri gösteren İslâm bankacılığına, İslâm"
"s"	"S-ACAAQq-0419-152"	"daha da artabilecektir. Ülkemizde, kooperatifçiliğin"	"geliştirilmesi"	"amacıyla, eğitim eksikliğinin giderilmesi için,"
"w"	"W-GF10A1A-1842-695"	"daha canlı, daha kapsamlı biçimde"	"gelişmesi"	"için yeterli saymak mümkün değildir."
"w"	"W-QF10A3A-1816-1900"	"da üretim maliyetini artırır ve"	"gelişmiş"	"ülkelerin ihraç mallarının (çoğunlukla sanayi"
"w"	"W-QE39C3A-1759-1354"	"da yirmi yılda, ortaya çıkan"	"gelişmeler,"	"birçok kişinin kavrayamayacağı kadar hızlı."
"w"	"W-ED36C2A-0413-1209"	"da yayıldığını söylemek mümkündür. Bu"	"gelişmenin"	"bizi bu tartışmanın çerçevesinde ilgilendiren"
"s"	"S-ACABTZ-0336-531"	"da vardı. Emme herhangi bir"	"gelişme"	"olmadı. Başka bir ilke kurulmadan"
"s"	"S-ADAABo-0367-619"	"da uygarlıklar da doğar, büyür,"	"gelişir,"	"yaşlanır ve ölürler diyor. Her"
"w"	"W-CF07A3A-1843-733"	"da unutmamak gerekir. f. Aslında,"	"gelişmiş"	"ülkelere göre düşünülürse, bütün bu"
"w"	"W-UI37C1A-0912-278"	"da nasibini alıyor kaçınılmaz olarak."	"Gelişme"	"dedikleri bu olgu elini değdirdiğini"
"w"	"W-VE05A1A-2594-1355"	"da mesafeliydim. Tabii, sonra süreç"	"gelişmeye"	"başlayınca ve cinayetin ayrıntıları ortaya"
"w"	"W-KI37E1B-3055-1051"	"da faydası olabilir (ama bu"	"gelişmeyi"	"önler, gelişmiş plağın, yani sarılıkların"
"w"	"W-CE05A3A-1274-1745"	"da bölgesel gelişme, ya da"	"gelişmenin"	"mekan boyutudur. 1980'li yıllarda Türkiye"
"s"	"S-ADABPZ-0134-267"	"da bir ben felsefesi olarak"	"geliştiği"	"söylenebilir. Burada ben kimlik kavramının"
"w"	"W-JE39E1B-2838-494"	"da bilişim dünyası ile ilgili"	"gelişmeleri"	"izleme, öğrenme imkanları sunan etkinlikler,"
"w"	"W-QI41C3A-1457-688"	"da anlaşılabilir zira restoran kültürünün"	"gelişmesi"	"büyük ölçüde gelir artışı ile"
"s"	"S-BEABXn-0352-261"	"da amaçları bu oldu. Teknolojileri"	"geliştikçe"	"falan... İlk şey diye biliyom"
"w"	"W-UB38E1B-2886-1092"	"da 150 civarında olduğu düşünülürse"	"gelişmiş"	"ülkelerin ciddi bir enerji kaygısı"
"w"	"W-NF10E1B-2865-1669"	"D&R mağazaları da, online perakendecilikteki"	"gelişmelere"	"paralel olarak fiziki satışlarını internete"
"s"	"S-AEABUZ-0021-107"	"cümleye takılarak bişi sölicem. Kendinizi"	"geliştirirsiniz"	"önünüzde uzun yıllar var. Geliştiremedim"
"w"	"W-KE30D1B-2081-34"	"cumhuriyet ve bölgelerde de benzeri"	"gelişmeler"	"bekleniyor. Faşistler aktifleşiyor Gerginlik içindeki"
"w"	"W-OD30D1B-2226-2169"	"Cumhurbaşkanı A. Necdet Sezer Türkiye'nin"	"gelişme"	"sürecini kesintiye uğratan ekonomik krizlerin"
"w"	"W-SI27D1B-2807-2470"	"coğrafyada demokratik bir tartışma kültürünün"	"gelişmediği"	"bir gerçek. Ancak bu gerçeğin"
"s"	"S-ADABAo-0388-415"	"coğrafyacılarında haritacılık coğrafya edebiyatı kadar"	"gelişmemiştir."	"Yine de o zamana iyi"
"w"	"W-GA16B1A-1929-1293"	"Coco. ""Hımm!"" dedi. ""Nedense fazla"	"gelişmiş,"	"çok da komik bir burnu"
"w"	"W-NE39C3A-0779-1570"	"CNN televizyonu, Türkiye'deki muhabirine bağlanarak"	"gelişmeleri"	"aktardı. İngiliz yayın kurumu BBC,"
"w"	"W-KC01A1B-3769-1236"	"cinsiyete göre değişmesi bitkinin vegetatif"	"gelişmesine"	"paralel olarak oluşan biyosentez mekanizması"
"s"	"S-ACABQq-0426-642"	"cinayet aydınlanmadan o coğrafyada özgürlüklerin"	"gelişeceğine"	"inanmıyoruz ama şunu da biliyoruz"
"w"	"W-UD39C1A-2648-1946"	"cihazlara sahip, buna karşılık az"	"gelişmiş"	"kafaların hâkim olduğu ortamlarda; âletlerin"
"w"	"W-RF25D1B-2770-1587"	"ciddi bir artış oldu. Bu"	"gelişmelerde"	"en büyük teşvik edici unsur"
"w"	"W-LE05A1B-3677-927"	"Chester Projesi'nin geleceği açısından önemli"	"gelişmelere"	"sahne oluyordu. Eylül ortalarında Ankara'ya"
"w"	"W-NE05A1B-3933-508"	"Charnes, Cooper ve Rhodes tarafından"	"geliştirilen"	"ve ölçeğe göre sabit getiri"
"w"	"W-SI22C2A-0760-268"	"cevap vermiyor. Aile tüm bu"	"gelişmeler"	"karşısında tam anlamıyla büyük bir"
"w"	"W-GH02A2A-0496-2021"	"cetvelleri gibi, bir ölçme aracı"	"geliştirip"	"anket metodunu kullanmak, hem zaman,"
"w"	"W-TC40E1B-2879-1359"	"Cep telefonları gün be gün"	"gelişiyor;"	"özellikle de akıllı telefonlar bu"
"w"	"W-TE05A3A-1451-717"	"Cengiz Han'ın, başlangıçta henüz zorlukla"	"gelişmekte"	"olduğu kuvvetini toz duman edebilirdi."
"s"	"S-ADABAo-0307-467"	"bıraktı. Sanayi üretimi, imalat sanayindeki"	"gelişmeler"	"tüm dünyada olumlu haberler getiriyor."
"s"	"S-ADABAo-0310-537"	"büyüme yatırımlara yani bu konudaki"	"gelişme?"	"Valla. Ne zaman bir toparlanma"
"w"	"W-OF05A1B-4464-1208"	"Büyüme Modellerine göre, Türkiye gibi"	"gelişmekte"	"olan ülkeler yeni bilgi ve"
"w"	"W-RG03A3A-1546-77"	"Büyükşehir Belediyesi'ne bağlanması olumlu bir"	"gelişmedir."	"Ankara özelinde, özellikle Çubuk ve"
"w"	"W-IF10A2A-1880-1510"	"büyüklüğü sayesinde oluşan avantajları yansıtan"	"gelişmeler"	"gösteriyordu. Elbette klasik karşılaştırmalı avantajların"
"w"	"W-GF10A4A-1841-1713"	"büyük önemi vardır. Batı, ulaştırmada"	"gelişirken"	"ekonomik zihniyet zaten gelişmişti. Oysa;"
"w"	"W-VG03A3A-2717-1261"	"büyük ölçüde uygulandı. İlköğretimde yeterince"	"gelişme"	"olmamasına rağmen, rüşdiye, idadi ve"
"w"	"W-GE39C2A-0026-1426"	"büyük ölçüde gerçekleşiyor. Kahn, bu"	"gelişmelerin"	"altyapısını oluşturan yeni teknolojiye de"
"s"	"S-AEABUZ-0038-510"	"büyük ölçüde Amerika'dan. Ve dolayısıyla"	"gelişmekte"	"olan ülkeler de ister istemez"
"w"	"W-ID39C2A-0756-449"	"Büyük umutlarla emek verdiğiniz, Türkiye'de"	"gelişip"	"serpildiğini gördüğünüz idealin, 90'ların başında"
"w"	"W-IE39C0A-1693-20"	"büyük rol oynuyordu. Yetkili makamlar"	"gelişen"	"teknolojiden de istihbarat alanında yararlanıldığını"
"s"	"S-ACAAQq-0419-585"	"Büyük Millet Meclisi, milletimizin ilerleme,"	"gelişme,"	"demokratikleşerek çağdaşlaşma azminin simgesidir. Bu"
"w"	"W-RF10E1B-2869-936"	"büyük kayıp"" diyor. Kitle turizminin"	"gelişmesinin,"	"deniz turizmini gerilettiğini söylüyor. Ege"
"w"	"W-NC06A4A-1973-2228"	"büyük bir alanının tahribatına ve"	"gelişmeye"	"(kalkınmaya) büyük bir engel olabilmektedir."
"w"	"W-LD02A1A-0605-332"	"büyük avantaj doğacaktır Başka ekonomilerin"	"geliştirdikleri"	"teknolojilere gelişim süreci içinde erişebilecek"
"w"	"W-QF10A1A-1883-1019"	"büyüdüğü görülmüştür. Ayrıca bu sektör,"	"gelişmekte"	"olan ülkelerin yurtiçi üretim ve"
"w"	"W-QD37C2A-0506-686"	"bütünüyle farklı, yeni bir bilinç"	"geliştirmektir."	"Ancak bu yolla yeni bir"
"w"	"W-PE06A1B-4255-1128"	"bütünü olarak göstermeye başlamıştır. Bu"	"gelişmeyi"	"belirleyen en önemli faktör de"
"w"	"W-IF18E1C-4145-1930"	"bütünlüğü sağlayacak yönde gerekli organizasyonların"	"geliştirilmesine"	"ihtiyaç duyulmaktadır. Mevcut nüfus kayıt"
"w"	"W-KD02A3A-0567-1995"	"bütünleştirici konumunun da aynı doğrultudaki"	"gelişmelere"	"büyük katkıda bulunacağı inancındadır. CHP"
"w"	"W-SD18E1C-4173-1940"	"bütün unsurlarıyla bilinmesi, kimliğinin korunarak"	"geliştirilmesi"	"ile halk kültürü etkileşiminde rol"
"s"	"S-ACABQq-0422-583"	"bütün safhalarına taşımış, böylece, sürekli"	"gelişme,"	"büyüme, sürdürülebilir olma kavramlarının temelini"
"w"	"W-LD02A1B-4487-655"	"bütün roman boyunca mikro hikayelerle"	"geliştirilmeye"	"çalışılır. Böylece romanın kendisi, içinde"
"w"	"W-FD36C4A-0341-163"	"bütün dünyaya yayılan ve yeni"	"gelişen"	"kapitalist sınıfın siyasal bakımdan da"
"s"	"S-ACABTZ-0336-621"	"bütün Dünya nükleer olsun projeleri"	"gelişince"	"emm MIT'de bir fosilin bir"
"s"	"S-ACABQq-0421-114"	"Bütün bu çalışmalarımızı yürütürken ve"	"geliştirirken,"	"hem konuyla ilgili olan sivil"
"s"	"S-ACABQq-0420-137"	"bütçesinde toplanmakta ve savunma sanayiinin"	"geliştirilmesinde,"	"araştırma ve geliştirme hizmetleri ve"
"w"	"W-MD39C4A-0769-69"	"bütçeli daire haline getiren talihsiz"	"gelişmeyi"	"(mahalli idare esprisi açısından) düzeltmek"
"w"	"W-PE05A1B-4234-1842"	"Böylece, çevre koruma ve ekonomik"	"gelişme,"	"bahsettiğimiz amir şartların çerçevesinde elbette"
"w"	"W-TG37E1B-3067-2499"	"böylece kendine özgü bir üslup"	"geliştirmenin"	"eşiğine yaklaşır fotoğrafçı. Özgürleşmenin yolu"
"s"	"S-ACABTZ-0336-241"	"böyle sivil bir nükleer teknoloji"	"geliştirdiği"	"takdirde benzer olaylarla karşılaşabilir mi?"
"w"	"W-OI22C1A-0665-1226"	"böyle olunca hiçbir sorumluluk duygusu"	"gelişmemiş,"	"bir de askere gidip orada"
"w"	"W-TF10E1B-2871-2404"	"bölümüyle birleştirdik. Goldaş, sektörde araştırma"	"geliştirmeye"	"yatırım yapan şirketlerin başında geliyor."
"w"	"W-SG03A1B-3273-302"	"bölümünde Kıyı ve İç bölümlerde"	"gelişen"	"tarihi olaylar hem yoğun hem"
"w"	"W-EF10A3A-1839-2474"	"bölümü en doğal bir biçimde"	"gelişmiş"	"olacaktır. Şimdi böyle çok taraflı"
"w"	"W-CD02A1B-3407-1542"	"bölümü de, bu anlayışın nasıl"	"geliştiğini"	"belirlemek amacıyla çocuklarla yürütülmüştür. Ancak,"
"w"	"W-MI29D1B-2449-1268"	"bölümü Aristo'nun şakanın olumsuzluklar karşısında"	"geliştirilen"	"bir tepki olduğu görüşünden yola"
"w"	"W-IG03A3A-2015-2348"	"bölüm eklemesiyle 8. yüzyıla dek"	"gelişmesini"	"sürdürmüştür. 8.-12. 8.-12. yüzyıllar arasında"
"w"	"W-KF10A2A-1795-1258"	"bölgesinde deniz yaşamının korunması ve"	"geliştirilmesi"	"için bölgesel işbirliğine gitmenin gerekli"
"w"	"W-ID02A1B-3820-211"	"Bölgesi için Bazı Güncel ve"	"Geliştirilen"	"Tahmini Nüfus Çizelge l'de dünyanın"
"s"	"S-ADABCo-0241-224"	"burda öğrendim ve yeteneklerimi burda"	"geliştirdim."	"Şimdi büyüdükten sonra burya gelip"
"s"	"S-ADABCo-0223-445"	"buradaki Türkiye için yapılan emm"	"gelişmeleri"	"ve yapılan çalışmaları bizim zamanımızda"
"w"	"W-NI22C4A-0366-2392"	"burada bunlar oluyorsa, daha az"	"gelişmiş"	"yerlerde neler oluyordur. Ali Bey"
"w"	"W-ME39C3A-0581-499"	"Bunun üzerine Grivas Ada'dan ayrıldı."	"Gelişmeleri"	"yetersiz bulan Türkiye durumunu değiştirmedi."
"w"	"W-NF25D1B-2142-926"	"bunun zorunlu hale gelebileceğini kaydediyorlar."	"Gelişmekte"	"olan borsalar kaybetti Gelişmekte olan"
"w"	"W-PF10E1B-3064-2453"	"bunun gereklerini eksiksiz yerine getiren"	"gelişmiş"	"özellikleri nedeniyle Symantec Client Security'yi"
"w"	"W-GH36C3A-0361-1846"	"bunun bilincindedirler. Ayrıca İslam dünyasındaki"	"gelişmeler"	"ABD'nin de pek hoşuna gitmemektedir."
"w"	"W-LD18E1C-4153-554"	"bunu belgelendirecek bir ulusal sistem"	"geliştirilmelidir."	"32. Meslek tanımları ve standartları"
"w"	"W-TD02A2A-1912-1456"	"bunu adlandırmak için bir kavram"	"geliştirilmiştir."	"2. Yaklaşık olarak endüstri devrimiyle"
"w"	"W-SF10A2A-1854-1070"	"bunların %58'i bu teknolojilerin firmada"	"geliştirildiğine"	"işaret etmiştir. Şirket içinde en"
"s"	"S-AEABPZ-0331-381"	"bunları niye anlatıyorum? Bunları Mersin'in"	"gelişmesi"	"açıcından anlatmaya çalışıyorum ama Mersin'de"
"w"	"W-FE03A2A-1782-941"	"bunlardan tanımadığı kimselere yöneltecek biçimde"	"geliştirmesini"	"söyleyecektir. ""Bir kez bu noktaya"
"w"	"W-QC40E1B-2876-532"	"bunlara ek olarak, Windows XP'nin"	"gelişmiş"	"kullanıcı hesapları özellikleri sayesinde çok"
"w"	"W-CE05A3A-1274-2319"	"bunlar. Birinci olarak Türkiye'de demokrasinin"	"gelişmesiyle,"	"sendikacılık ve işçi hakları arasında"
"w"	"W-JI41C3A-1509-1674"	"Bunlar çok uluslu tekelleri çılkdırtan"	"gelişmeler."	"Oysa onların formülüne göre, bir"
"s"	"S-ACABTZ-0336-143"	"bundan sonra da çevresel politikaların"	"geliştirilmesi"	"gerekiyor. Emme politikalarda genel olarak"
"s"	"S-ADABIi-0124-295"	"bundan büyük, bundan ilerliyo, ondan"	"gelişmiş"	"oluyo çünkü köye bile kültür"
"s"	"S-BEABXO-0345-101"	"Bunda da geliştiriyosun bunda da"	"geliştiriyosun."	"Tasarlarken de hazırlarken de. Hmm."
"w"	"W-JE04A3A-1580-787"	"buna uyulması kontrol altına alınmıştır."	"Gelişmiş"	"ülkelerde bu sorunun çözümü için"
"w"	"W-DC06E1B-3076-2193"	"buluşlar yapılıyor, eskileri daha da"	"geliştiriliyor."	"Düşünüyorum. Acaba yaşamı kolaylaştıran, insanların"
"w"	"W-NE05A1B-3929-1073"	"buluşlar ve bunların uygulanmasıdır. Anılan"	"gelişmeler,"	"dünya çapında ulaştırma ve haberleşme"
"w"	"W-FE05A2A-1057-1769"	"bulunuyor. Bilim ve teknoloji alanındaki"	"gelişmelerin"	"yeni ve ileri bir toplumsal"
"w"	"W-ID02A2A-0640-1360"	"bulunuyor. Aslında, içler acısı bir"	"gelişmeler"	"dizisini, B. Olgaç, mizahi bir"
"w"	"W-FE05A1B-3481-454"	"bulunmaktadır. Fransa ve italya'daki bazı"	"gelişmiş"	"bölgeler dışında, tarım, Akdeniz Bölgesi'nin"
"w"	"W-PD10A1A-2076-588"	"bulunmadığına işaret etmektedir. Devlet eliyle"	"geliştirilen"	"bir dizi kurumsal, siyasi ve"
