"Register"	"Text"	"Left"	"-5;5"	"Right"
"w"	"W-ME43C2A-3340-45"	"kalıcıdır. Aramızda her seviyede diyalog"	"geliştirmek"	"istiyoruz. Türkiye'den destek ve anlayış"
"w"	"W-OH36C4A-0237-2161"	"kalmaz Elli senedir ülkemizde bazı"	"gelişmeler"	"var. Dünyada rolümüz çok büyük"
"s"	"S-ADABPZ-0125-516"	"kalmamış. Hepsi önceden bitiyor. Hâlbuki"	"gelişmek"	"gelişmiş olan ülkeler girişimcisin elinden"
"w"	"W-RF10E1B-2869-2394"	"kalmadan teşhis edip onarabilmem ve"	"gelişmem"	"gerekir. Bunun için de şirketin"
"w"	"W-TF10A3A-1901-23"	"kalkınma ve büyüme sorununa yönelik"	"geliştirdikleri"	"politikalarda finansal istikrarın korunmasını önemli"
"s"	"S-ADABCo-0292-383"	"kalitesi okuma> Bugünün başka bir"	"gelişmesi"	"adli bir vakka. Son Kırkpınar"
"w"	"W-OD18E1C-4159-721"	"Kaldırılması Sonrası Sosyal ve Ekonomik"	"Gelişmenin"	"Sağlanması İçin Bir Model Önerisi"
"s"	"S-AEABUZ-0038-605"	"kaldırdıktan sonra Avrupa bi anda"	"gelişiyor."	"Doğru. Artı şunu söyleyeyim Avrupa"
"w"	"W-MB04A1B-4130-2000"	"kalacağı tehlikeli sonuçlardan korumak için"	"gelişmiş"	"olan bir mekanizmadır. Parker ve"
"w"	"W-OE05A1B-4185-2175"	"kalacaktır. Herhangi bir sorun karşısında"	"geliştirilen"	"bir politikanın formülasyonunda genellikle birbiriyle"
"w"	"W-UI22C4A-0820-846"	"kafes içinde geçtiğine yanmalı. Bugün,"	"gelişen"	"şehirleşmeye uygun ""manzarası, mimarisi ve"
"s"	"S-ADABPZ-0125-24"	"kafasındaki bir düşünceyle başlayıp, bunu"	"geliştirmeye"	"çalışan ancak ilerleyen süreç içerisinde"
"w"	"W-PD10A1A-2076-646"	"Kadınlar yürüttüğü ekonomik faaliyetler diğer"	"gelişmekte"	"olan ülkelerdeki duruma uygun düşmemektedir."
"w"	"W-ID05A3A-0582-2198"	"kadın söylemi geliştirmeye yönelmişlerdir. Partilerce"	"geliştirilen"	"kadın söylemi, söylemin içerdiği kadın"
"s"	"S-AEABUZ-0021-596"	"kadar çok kısa sürede yapabiliyorsunuz."	"Gelişiyor."	"Emm... Öle bi hale geliyosunuz"
"w"	"W-EE39E1B-2890-2205"	"kadar tüm araçları kullanma yeteneğini"	"geliştirmek"	"anlamında kapitalizmin sağlam kalesi batıya"
"s"	"S-AEABTZ-0040-602"	"kadar Rönesans oluyor. Nükleer teknoloji"	"gelişiyor."	"Bu kazalar Çernobil'den sonra hala"
"w"	"W-PD03A0A-1674-1748"	"kadar parlaktı. Diğerlerinden anlaşılmaz ölçüde"	"gelişmiştiler."	"Bunun nedeni neydi? Taptıkları ana"
"s"	"S-AEAB^o-0018-414"	"kadar o çocuktur, ruhsal yapısı"	"gelişmemiştir."	"Bedensel yapısı gelişmemiştir. Akli melekeleri"
"w"	"W-HI22C4A-0860-1183"	"kadar makyaj malzemesi, Avrupa'nın en"	"gelişmiş"	"estetik cerrahisi bilebeni kurtaramaz... Yarım"
"w"	"W-TB04A4A-1897-1427"	"kadar esneklik sağlasa da, modelin"	"geliştirilmesi"	"gereken 3 nokta bulunmaktadır. Bunlardan"
"s"	"S-AEABTZ-0040-568"	"kadar doğru? Iı böyle bir"	"gelişme"	"var mı? Mehmet Bey teşekkür"
"s"	"S-AEABUZ-0038-340"	"kadar buluş ve o kadar"	"gelişmeyi"	"patent için mi yaptı? Bi"
"s"	"S-ADABAo-0366-610"	"kadar bu olabildiği kadar olup"	"gelişiyor."	"Tabi burada tartışılan şey az"
"w"	"W-QF25D1B-2760-1702"	"kadar bu hafta muhtemel olumlu"	"gelişmelerle,"	"piyasaların olumlu olacağı beklentisi hakimse"
"w"	"W-GF10A1A-1842-784"	"kadar bir teamül şeklinde sanayiin"	"geliştiği"	"bölgelerin de dışına çıkmak zorundadır."
"s"	"S-ADABPZ-0135-87"	"kabuller ağır basan bir sav"	"geliştirme."	"Yeniçağa geldiğimizde bence hani paradigmatik"
"w"	"W-QE18E1C-1658-2082"	"kabul edilen son uyum paketlerinin"	"geliştirilmesi"	"amacıyla önemli katkı sağlanacaktır. Ayrıca,"
"w"	"W-OG24D1B-2300-2437"	"kabarmasından ziyade burun havalanması şeklinde"	"geliştiğinden"	"çoğu zaman yaptıkları müziğin sağlamlığını"
"w"	"W-VG03A3A-2717-987"	"kaba bir yaklaşım, modernitenin merkezlerinde"	"gelişen"	"yeni anlayışların belli bir gecikmeyle"
"w"	"W-QF10E1B-2868-2324"	"Jeans'in bayilik stratejisi mevcut noktaları"	"geliştirmek"	"yönünde. Yine de markaya olan"
"w"	"W-IE05A2A-1910-438"	"Japonya'nın yükselmesi. Almanya'nın birleşmesi ve"	"gelişen"	"bir AB içinde yerini sağlamlaştırması."
"w"	"W-CG09C5A-0218-183"	"İşte bunların karaçalmasıyla olay böylece"	"gelişiyor."	"Ya baskılar..? AHMED ARİF Şimdi"
"w"	"W-OE05A1B-4183-2103"	"İşletmelerinde Eğitim Havacılığın dinamizmi, teknolojik"	"gelişmelerin"	"hızla yansıması, bilgi çağının ağırlığı,"
"w"	"W-QE30D1B-2087-1383"	"İşadamları, özellikle ABD ile ticareti"	"geliştirmek"	"için kurulacak nitelikli sanayi bölgelerine,"
"w"	"W-VF07A2A-1857-1543"	"İş dünyası çevre dostu teknolojilerin"	"gelişmesini"	"ve yaygınlaşmasını desteklemeli, Çeşitli forumları"
"w"	"W-PE39C4A-0243-1043"	"İçlerinde elemanları olanlar uyarılarak taktik"	"geliştirmeye"	"başladılar'. 28 Şubat kararlarından sonra"
"w"	"W-OF10A2A-1787-945"	"İsveç'te 25.000; Yunanistan'da 5.000 dolayındaydı."	"Gelişmiş"	"ülkelerde ARGE'ye GSYİH'den ayrılan kaynaklar"
"w"	"W-GE39C3A-0410-474"	"İslama dayalı bir devlet anlayışı"	"geliştirilmeye"	"çalışılıyor; Kuran-ı Kerim'deki emirlerin yerine"
"s"	"S-ACABTZ-0336-597"	"İran'ın nükleer çalışmaları şöyle emm"	"gelişiyor."	"Emm tabi emm Amerika Birleşik"
"s"	"S-ACABTZ-0336-110"	"İran'da emm nükleer teknolojisini İran"	"geliştirirken"	"üzerinde çok büyük bir baskılar"
"w"	"W-LE30D1B-2082-2442"	"İran gibi devletler için füze"	"geliştirmenin"	"komşuları sindirme ve halkının gözünü"
"w"	"W-QF10E1B-3065-1514"	"İnternet perakendecisi ile sağlam ilişkiler"	"geliştiriyorum."	"Şu anda çevrimiçi seyahat bilgileri"
"s"	"S-AEABTZ-0337-419"	"İnsanların tüm hayatıyla ilgili bilimsel"	"gelişmelerle"	"de sanatla da ilişkili olarak"
"w"	"W-CC06E1B-3075-690"	"İlk prototip başarısızlıkla sonuçlanmakla birlikte,"	"gelişen"	"teknolojinin katkısı ile deniz suyundan"
"w"	"W-PD02A2A-2046-2119"	"İlişkin Bulgular Okulda yaşamın niteliklerinin"	"geliştirilmesinde"	"belirleyici olan okul yönetimleri, tüm"
"w"	"W-OE05A1B-4190-1316"	"İktisat literatüründe işlem maliyetleri yaklaşımı,"	"gelişmeleri"	"geniş anlamda (g.a.) dikey birleşmeler"
"s"	"S-ACABPA-0434-431"	"İktidar kadar muhalefetteki uzlaşmazlıkların da"	"gelişmelerin"	"önünü tıkayıcı etkisi olabildiği görülmüştür."
"w"	"W-SE39E1B-2904-2068"	"işçi sınıfının iradi/siyasal iradi/siyasal olarak"	"geliştirdiği"	"bir tutumun sonucunda konmuş ağırlıklardan"
"s"	"S-ADAB^Z-0370-223"	"işverenlerin beklentisi bana göre kendini"	"geliştirebilen"	"yeniliklere açık olan ve bi"
"w"	"W-OD03A3A-1647-8"	"işte bu yansımadan benlik kavramı"	"gelişir."	"Diğer insanların bize olan tavır"
"w"	"W-GD37A3A-0252-1881"	"işleyişe sahipse, o aile çocukların"	"gelişmesi"	"için sağlıklı bir sosyal ortam"
"w"	"W-CC06E1B-3075-1633"	"işleyebilecek. DVI kartlarını sürekli olarak"	"geliştirmekte,"	"çok pahalı olan bu teknoloji"
"w"	"W-EB04A2A-1894-737"	"işlevidir. Matematiğin gelişmesinin özellikleri toplumun"	"gelişmesinin"	"özellikleriyle belirlenir. EKLER Bu yazı"
"w"	"W-DF05A3A-2981-1319"	"işletmenin aleyhine bir durum veya"	"gelişme"	"mevcut olmadıkça bu oranın yüksekliğinin"
"w"	"W-RG24D1B-2290-818"	"işletiyor. Avrupa'nın, bu tehdit karşısında"	"geliştirdiği"	"ulusal ve yerel değerlerin korunmasına"
"w"	"W-TC29D1B-2793-1712"	"işletim sistemi kullanılan ürün, program"	"geliştirme"	"konusunda birçok seçeneğe sahip. Kablosuz"
"w"	"W-MF10A2A-1823-1488"	"işlemlerinden alınacak masraflar için standartlar"	"geliştirilmelidir."	"Provizyon ücreti tam alınacak, hiç"
"w"	"W-VF10A2A-1859-1308"	"işgücü piyasasına girişini sağlayacak programların"	"geliştirilmesi"	"gerekmektedir. İşgücü verimliliğinin artırılması ekonomik"
"w"	"W-TE30D1B-2101-1525"	"işbirliğinin ikili ve bölgesel düzeyde"	"gelişmekte"	"olduğu bir zamanda gerçekleştiğine"" işaret"
"s"	"S-ADABCo-0174-159"	"işbirliği kültürü böyle olaylar olmadan"	"geliştirilmelidir."	"Raporda bölgeyle ilgili risk haritalarının"
"w"	"W-SC05A2A-2050-1954"	"işbirliği imkânları. Ulusal ve uluslararası"	"gelişmelerin"	"eğitim konularına duyulan ilgiyi artırmasının"
"w"	"W-OA16B3A-0415-1502"	"işaret ışıklarıyla, telâşlı bir haberleşmeyi"	"geliştiriyorlar."	"Kalender, Üsküdar'ı bu minval üzere"
"w"	"W-SD02A0A-0266-1690"	"işaret eder. Bu kopuş, teknolojinin"	"gelişmesi"	"ve doğayla kurulan ilişkinin bir"
"w"	"W-VI07A2A-2638-496"	"iş yönetimine ilişkin temel ve"	"gelişmiş"	"beceriler vardır. Bu özellikler planlama"
"w"	"W-PD10A1A-2076-1002"	"iş verme yaygınlaşmıştır. Böylece özellikle"	"gelişmekte"	"olan ülkelerde düzenli ve güvenli"
"w"	"W-UH32D1B-2573-1762"	"iş giderek ciddileşiyor. Belli ki,"	"gelişen"	"dinleme teknikleriyle artık medya patronları,"
"w"	"W-TF05A1B-4640-1677"	"iş dünyasında yaşanan gelişmeler, bu"	"gelişmelere"	"uyumun sağlanması ve işletmenin rekabetçi"
"w"	"W-TC29D1B-2800-2241"	"iş deneyimlerini ve verimliliklerini artıracak"	"gelişmiş"	"teknolojileri kullanmayı amaçlıyor. Nokia'dan yapılan"
"s"	"S-ADBBI^-0042-315"	"içine soktukları röntgen aletinin daha"	"gelişmiş"	"bir modeliyle tetkik yaptılar. Doktorun"
"w"	"W-UB29D1B-2443-973"	"içinden Otomotiv Sektörü için Teknisyen"	"Geliştirme"	"Programı'na 205.643 Avro gibi yüksek"
"w"	"W-VI39C3A-0869-912"	"içinde yapılır. Tabii referandumdan sonra"	"gelişecek"	"güçler dengesi içinde, bunu yapmaya"
"s"	"S-ACAAQq-0419-323"	"içinde iki devletin arasındaki ilişkiler"	"gelişmiş,"	"bu seviyelere ulaşmıştır. Bu dünyada"
"w"	"W-JE05A1B-3596-2386"	"içinde gerek gelişmiş ve az"	"gelişmiş"	"ülkeler arasındaki ilişkilerde gerek aynı"
"w"	"W-HC06E1B-3081-227"	"içinde bu yatırımların büyük bölümünün"	"gelişmiş"	"ülke pazarlarına yönelmiş olduğu belirtiliyor."
"w"	"W-QA16B2A-3350-113"	"için. Sanat, edebiyat ve hukuk"	"gelişiyor."	"Yasalar, dualar, tıbbın başlangıcı sayılan"
"s"	"S-ADABCo-0227-542"	"için şu anda herhangi bir"	"gelişme"	"söz konusu diil. Çok çelişkili"
"w"	"W-MF10A2A-1786-1229"	"için özel programlar ve teşvikler"	"geliştirip,"	"uygulamaktadır. BTye yönelik yasal düzenlemeler"
"w"	"W-RD03A4A-0831-1013"	"için çalışan ve çok hızlı"	"gelişen"	"bir dilbilim dalıdır. Kur'an-ı Kerim'in"
"w"	"W-PC06A2A-1179-2186"	"için TTS (Tele Type-Setter) makineleri"	"geliştirilmiştir."	"TTS makineleri bir yazı makinesi"
"w"	"W-EE05A2A-2966-1752"	"için toprağa bağımlılık, lonca düzeyinin"	"gelişmesiyle"	"oldu. Ticaret devrimi diye de"
"w"	"W-MF10A2A-1823-2042"	"için sorumlulukları belirlemelidir. Hizmet kalitesini"	"geliştirme"	"ve analizi aşağıdaki konulan kapsamalıdır"
"w"	"W-IF18E1C-4145-2339"	"için sektörler arasında işbirliği programı"	"geliştirilecektir."	"Gıda üretim politikaları beslenme sorunlarını"
"s"	"S-ADABAo-0388-273"	"için Osmanlılarda iki türlü coğrafya"	"gelişmiştir"	"biri konuştuğumuz türde coğrafya bir"
"w"	"W-MG37C3A-0024-1985"	"için külçe gibi bir yargı"	"geliştirmiş"	"""Ondokuzuncu yüzyılın en önemli mimarı"""
"w"	"W-TE05A2A-1399-2484"	"için kurdukları Şanghay İşbirliği Örgütü'nü"	"geliştirmişlerdir."	"Şanghay İşbirliği Örgütü, Şanghay'da 15"
"w"	"W-JE05A1B-3579-1694"	"için kimi araçların ve standartların"	"geliştirilmesi,"	"yönetim birimleri arasında rekabet duygusunun"
"w"	"W-TC18F1D-1663-2391"	"için İlköğretmen Okullarının ders programlarının"	"geliştirileceği"	"belirtilmiştir. Buna ek olarak, Kadın"
"w"	"W-FC05A1A-2062-1228"	"için gerekli uyum ve kapasitelerinin"	"gelişmesidir."	"Eğitim sisteminin ikinci işlevi, öğrencileri"
"s"	"S-ADABPZ-0373-211"	"için Ebelik ilim ve sanatını"	"geliştireceğime"	"Ebelik ilim ve sanatını geliştireceğime"
"s"	"S-AEABTZ-0040-149"	"için destek verelim, nükleer teknolojinin"	"geliştirilmesi"	"için destek verelim. Sivil toplum"
"w"	"W-KC01A1B-3759-2035"	"için bisbenzimidazole DNA boyama yöntemi"	"geliştirilmiştir."	"Bu, hücreye tutunma özelliğinde olan"
"w"	"W-OG24D1B-3361-2083"	"için birtakım ayakta kalma stratejileri"	"geliştirmek"	"zorundasınız ve sanırım bu rol"
"w"	"W-DF05A1B-4368-99"	"için bir başlangıç teşkil eder."	"Gelişmekte"	"olan ülkelerdeki serbest bölgelerde emek"
"w"	"W-GF10A4A-1841-839"	"için bazı fedakarlıklarda bulunmalıdırlar Az"	"gelişmiş"	"ülkelerin birikmiş olan borçlarının ödenmesinde"
"w"	"W-PD03A1A-3347-19"	"için ayırıyorlar. Almanya'da da benzer"	"gelişmeler"	"yaşanıyor. Markanın kurumsallaşmasını sağlamak, yeni"
"w"	"W-UF10A2A-1872-89"	"için ""Marjinal Endüstri-içi Ticaret Katsayısı"""	"geliştirilmiştir."	"Marjinal Endüstri-içi Ticaret katsayısı (MIIT)"
"s"	"S-ACABTZ-0336-337"	"içersinde bu 4, 1'lik global"	"gelişmeyi"	"%5'in altına çekersek %0,5'in %0,5'in"
"w"	"W-NF10A2A-1827-1050"	"içerisinde çalışarak ileriye dönük stratejiler"	"geliştirmek"	"ve topluma perspektif sağlayan politika"
"s"	"S-ADABPZ-0125-134"	"içerisinde sonuçlandırdılar. Bu arada ihracatın"	"geliştirilmesine"	"ve ihracatla ilgili emm istihdam"
"w"	"W-FE04A1B-3462-2107"	"içerisinde ortaya çıkan buluş ve"	"gelişmelerin"	"ışığı altında yeni kaynaklara yönelmek"
"w"	"W-PD03A1A-3346-2459"	"içerisinde her ne kadar teknolojik"	"gelişmeler"	"(İnternet, uydular vb) radyonun küresel"
"w"	"W-KE39E1B-2839-2439"	"izleyen IMF uzmanları en küçük"	"gelişmeyi"	"bile dikkatle inceliyorlar. En önemlisi"
"w"	"W-MG09C3A-0355-2409"	"iyiye, güzele ulaşmak duygusu... Sanatçıyı"	"geliştiren"	"bir yan... Hep daha iyisini"
"w"	"W-NF10A2A-1827-432"	"iyimser yorumların etkisinde kalmıştır. Olumsuz"	"gelişme,"	"yılın ikinci yarısından itibaren ülkenin"
"w"	"W-QD02A1B-4570-2302"	"iyileştirici etkileri gibi. Türkiye gibi"	"gelişmekte"	"olan ülkelere bakıldığında; tarım verimliliğinde"
"w"	"W-KC06A2A-2001-539"	"iyice gübrelenmiş, işlenmiş topraklara yapılırsa"	"gelişme"	"çok daha iyi olacaktır. İyi"
"w"	"W-SB04A2A-1269-1218"	"iyi uyum sağlamışlardır ve iyi"	"gelişmiş"	"iletim, destek dokuları ile de"
"w"	"W-RA16B4A-1074-291"	"iyi para kazandı. Şöhretlerle ahbaplığı"	"geliştiren"	"Nur, onlarla oturup saatlerce dedikodu"
"w"	"W-SC18F0A-1784-1889"	"iyi konumda olduğuna göre, insani"	"gelişme"	"açığı büyük ölçüde eğitim ve"
"w"	"W-SC03A2A-1306-1675"	"iyi de, niçin ailece, toplumca"	"gelişmiyoruz?"	"Ben şahsen, kişisel gelişim yerine,"
"w"	"W-VI45E1C-5080-1561"	"iyi de olsa, kelime haznenizin"	"gelişmesi"	"için verdiğiniz tüm önerilere katılıyorum."
"w"	"W-UE05A1B-4259-726"	"IV. SONUÇ YERİNE Günümüzde az"	"gelişmiş"	"olan ülkelerin hemen hepsi ciddi"
"w"	"W-OD02A2A-1413-1538"	"itirazlarla karşılaşmıştır. Yirminci yüzyılda sosyolojinin"	"gelişmesinde"	"en etkili kişilerden biri olan"
"w"	"W-QC01A4A-1081-628"	"itimat üzerine kurulmuş bir ilişki"	"geliştirmektir."	"Şayet anne ve baba, çocuğuna"
"w"	"W-HC06A2A-2006-1678"	"itibaren yukarı ve kenarlara doğru"	"gelişen"	"etli kısım, bu etli kısmı"
"w"	"W-DE05A3A-2974-2234"	"itibaren ortaya çıkmakla beraber, asıl"	"gelişmesi"	"Gorbaçov iktidarından sonra, 1986 yılından"
"s"	"S-ADAB^Z-0370-100"	"itibaren de biz bu işi"	"geliştirme"	"çabası içinde emm gördük. Her"
"w"	"W-PG37C3A-1420-516"	"istiyorum. Denemelerin bir düşünce sistematiği"	"geliştirdiği"	"doğrudur. Daha önce de belirttim."
"w"	"W-DF07E2C-2662-990"	"istikrarlı bir gelişme gösteren değişkenlerdir."	"Gelişmiş"	"batılı ekonomilerde en önemli otomatik"
"w"	"W-UF10A2A-1882-255"	"istihdam (emek) arzı ve teknolojik"	"gelişme."	"Burada önem taşıyan husus, üretim"
"w"	"W-VF10A1A-1889-2231"	"isterseniz, web tasarım ve uygulama"	"geliştirme"	"hizmeti veren profesyonel bir kuruluşla"
"w"	"W-PE05A1B-4248-427"	"istendiği bu çalışmada, Türkiye'nin en"	"gelişmiş"	"bölgesi olan MB ile en"
"s"	"S-ACABPA-0434-300"	"ise savaşa girmediğimiz halde az"	"gelişmiş,"	"geri kalmış bir ülkeyiz. Sebep"
"w"	"W-EC06E1B-3077-917"	"ise lazer tarama yöntemi geliştirilmiştir."	"Geliştirilen"	"bu metot, tekrar edilebilir, hasta"
"w"	"W-VF10A2A-1890-2137"	"iradesi dışında karar alma mekanizmaları"	"geliştirme,"	"yerelleşme, merkezi devleti küçültme gibi"
"w"	"W-UD02A1A-2058-1045"	"inşa eder ve hidrolik teknolojisini"	"geliştirirler."	"Barınmaya ve korunmaya ihtiyaç duydukları"
"w"	"W-UC01A2A-1280-1144"	"intoksikasyonu özellikle hipokalemik durumlarda kolaylıkla"	"gelişebileceğinden"	"diüretik kullanılan hastalarda dikkatli olunmalıdır."
"w"	"W-SC35C2A-1388-306"	"insanın bu virüse karşı bağışıklık"	"geliştirmiş"	"olması ile ilgilidir. Kümes hayvanları"
"w"	"W-OD03A4A-0253-377"	"insanın ancak maske, sosyal yüz"	"geliştirmesine"	"izin verir; can ancak değerler"
"w"	"W-OI41C4A-1312-1437"	"insanı eğitimsiz ise genel kültürünü"	"geliştirir."	"Temel fikirler, güncel konular, yeni"
"w"	"W-SE39C0A-0220-1058"	"insanlarımızdır. Sınırlarımızın içinde kontrol edemeyeceğimiz"	"gelişmelere"	"ve müdahalelere müsaade etmememiz lazım."
"w"	"W-SA16B0A-0132-1818"	"insanları olan Çinliler'i."" Mizah duygusu"	"gelişmemiş"	"bazı insanlar ertesi gün çığlığı"
"w"	"W-SD18E1C-3376-1720"	"insanlarla bir arada yaşama kültürü"	"geliştirilmelidir."	"Yüzleşmediğimiz bir tarihin, önyargıların, düşmanlıkların"
"w"	"W-AD19A1A-2078-1187"	"insanlar vardır ki, herkül gibi"	"gelişmiş"	"bir vücut yapısına sahip olmalarına,"
"s"	"S-ADAB^Z-0370-213"	"insan zaten ilk önce kendini"	"geliştirebilmeli"	"ama bunun için bir ortam"
"w"	"W-DE39C4A-0693-527"	"insan haklarından sayan"" ulusal politikalar"	"geliştirebildi"	"mi? Ya da ekonomik kalkınmasını"
"w"	"W-UD03A3A-3310-2063"	"insan dili olan, dili üretip"	"geliştiren,"	"hayatına katan, hayatı dil üzerinden"
"w"	"W-PE05A1B-4233-1111"	"inisiyatiflerin önünün açıldığı söylenebilir. Bu"	"gelişmeyi"	"takiben 5+5 Grubunun dışında kalmış"
"w"	"W-GA16B3A-0789-262"	"indirgemek/açıklamak yanılgısına götürmemeli. Birbirinin içinden"	"gelişen,"	"bazen neden ve bazen sonuç"
"s"	"S-AEABPZ-0331-221"	"indirebilir. Sağlık ve yaşam koşulları"	"geliştirebilir."	"Yasal düzenleme ve desteklerle atık"
"w"	"W-OB04A1B-4220-1879"	"incelenmiştir. İncelenen üretim sürecine ilişkin"	"geliştirilen"	"matematiksel model, özel nedeni~ aı"
"w"	"W-UF10A2A-1872-2308"	"incelenmiştir. Beşinci bölümde, mikro bazda"	"gelişmeler"	"ele alınmış ve sektörel gelişmeler"
"w"	"W-LF18E1C-4154-696"	"incelenmesine ve bunların diğer bir"	"gelişmekte"	"olan ülke grubu olan Latin"
"w"	"W-ID03A1A-1517-49"	"incelenmesi sırasında kullanılabilecek bir biçimsel"	"gelişme"	"çizgisini belirginleştiriyor Anlatının başından merkez"
"w"	"W-GC01A1B-3642-1733"	"incelenerek sonuçlarının değerlendirilmesi amaçlanmıştır. Yeni"	"Geliştirilen"	"Benzodiazepin Türevlerinin Etkileri ve Sentezleri"
"s"	"S-ACABPA-0434-423"	"incelememiz lazım. Türk siyasi hayatının"	"gelişmelerine"	"baktıkça bu sorular akla geliyor"
"s"	"S-ACABQq-0422-165"	"inceleme sürecinin güçlendirilmesi, gümrük birliğinin"	"geliştirilip"	"derinleştirilmesi, Türkiye'ye verilen katılım öncesi"
"w"	"W-VA16B3A-2629-1017"	"ince davranışlar içinde olağan tepkiler"	"geliştirdikleri"	"için öyle ters gözükmezdi. Kimseyi"
"w"	"W-KE39E1B-3030-880"	"inanmak zorunda kaldılar, Japon sanayiinin"	"gelişmesinde"	"beşeri faktörlerin temel rolünü 80'li"
"s"	"S-ADABPZ-0135-250"	"imkanını dışlayan bir bilgi anlayışı"	"geliştirdi."	"Yani çeşitli görüşler var. Yani"
"w"	"W-PC06A2A-1179-1840"	"imkan verirler. Elektronik alanda hızlı"	"gelişmeler,"	"elektronik bilgi işlem makineleri, bilgisayar"
"w"	"W-GF10A3A-1899-2024"	"imalat sanayi yatırımları ile ihracattaki"	"gelişmeler"	"aynı yönde olmamıştır. Oysa 1990'lı"
"w"	"W-PD03A1A-3341-1485"	"Ilısu barajı, Kürt ayrılıkçı hareketinin"	"geliştiği"	"bölgeleri de su altında bırakacak."
"w"	"W-GD02A1B-3782-531"	"ilkokulların sekiz yıla çıkarılması, program"	"geliştirmede,"	"ölçme ve değerlendirmede yenilikçi yaklaşımların"
"w"	"W-ND02A1B-4518-394"	"ilkellik olarak görmesi çok kolayanlaşılabilir."	"Gelişmekte"	"olan zavallı bir ülke üzerine"
"w"	"W-VG03A3A-2717-502"	"ilk kuruluş sönümlenirken ilginç bir"	"gelişme"	"1911 yılında Galata'da Eski Banka"
"w"	"W-EC37C2A-0662-637"	"ilişkinin olumlu veya olumsuz yönde"	"gelişmesini"	"belirlemek açısından büyük önem taşır."
"w"	"W-JD02A1B-3850-483"	"ilişkilerini açıklamada üç anahtar gösterge"	"geliştirmiştir."	"Bunlar Eğitim Düzeyine Göre İşgücüne"
"w"	"W-NI22C2A-0698-1654"	"ilinde, yeni organize sanayi bölgeleri"	"geliştirilmelidir."	"Trabzon, geçmişi itibariyle uluslararası ticarete"
"w"	"W-UE36E1B-3357-2355"	"ilgili sayısız doküman ve teorileri"	"geliştirmesinin"	"de göstergesi. 9 Ekim 1967"
"w"	"W-SD18E1C-4169-2152"	"ilgili program ve projeleri hazırlamak,"	"geliştirmek,"	"uygulamak, bu kurumları sevk ve"
"s"	"S-ADABPZ-0357-233"	"ilgili bilim adamlarından aitlik duygusunu"	"geliştirdikleri"	"gibi o alanda böyle bir"
"s"	"S-ACABQq-0423-483"	"ilgili bahsedilen konularda, ileride birtakım"	"gelişmeler"	"olursa bunun başka sonuçları doğuracağı,"
"s"	"S-ACABTZ-0336-440"	"ilgilediği için elektrik enerjisinin global"	"gelişmeleri"	"şöyle şu anda 2004 yılındaki"
"w"	"W-GD02A3A-1059-2104"	"iletişim akımının biçimi ve yönünü,"	"gelişmekte"	"olan ülkeler uluslararası kuruluşların gündemine"
"w"	"W-FC06E1B-3078-511"	"iletim protokollerini gerçekleştiren bir yazılım"	"geliştirdi."	"Bu sistem BBN'deki yerel posta"
"w"	"W-IH39C3A-1295-567"	"ilerlemeleri inceleyerek, insan zekasıyla yetilerinin"	"gelişmesini"	"çözerek, umutlarımızın karşısına tabiatın asla"
"w"	"W-RF10E1B-2869-1257"	"ilerlemelere bakarak rating güncelleriz. Dolayısıyla,"	"gelişmekte"	"olan bir ülkeye baktığımızda, ""aferin"
"w"	"W-QI27D1B-2817-944"	"ileride robot kol ve bacakların"	"geliştirilmesinde"	"kullanacak. Şirket, Amerikan Gıda ve"
"w"	"W-LF05A1B-4454-1348"	"ileri sürülmektedir Birincisine göre, ekonomik"	"gelişmenin"	"yavaş olması, ekonomideki dönemsel düşüşler"
"w"	"W-KE05A4A-2596-1480"	"ileri sürmüşlerdir. Bu yüzden, Batı'da"	"gelişen"	"toplum yapısından soyutlanmış ve bireysel"
"w"	"W-FE09C3A-0417-1438"	"ileri sürenleri açmaza sokan bir"	"gelişme"	"yaşanır. 31 Mayıs 1968 Cuma"
"w"	"W-RB38E1B-2883-1704"	"ile şehrin planı, ileride de"	"gelişme"	"potansiyeline sahip bir nitelikte. Fakat"
"w"	"W-PD02A2A-1167-755"	"ile yayımlanmış, geçen zaman içindeki"	"gelişmelere"	"ve değişikliklere göre yeniden gözden"
"w"	"W-PG03A1B-2529-1637"	"ile ortaya çıkan değişimlerin ve"	"gelişmelerin"	"sanatsal faaliyetlere yansıması tartışılacaktır. 1071"
"w"	"W-SF10A2A-1865-1613"	"ile mücadele için çeşitli platformlarda"	"geliştirilmiş"	"olan önerilere rağmen, kayıtdışı ile"
"w"	"W-RF10E1B-3066-2221"	"ile işbirliğini alanlarını yeni projelerle"	"geliştirerek;"	"sektöründe BT alt yapısı konusundaki"
"w"	"W-TF10A1A-1830-460"	"ile ilgili önemli bir takım"	"gelişmeler"	"vurgulanmış olsa da, Kopenhag siyasi"
"w"	"W-PF10A2A-1849-1094"	"ile hareket eden şirket, kuruluşunda"	"geliştirdiği"	"""organizasyon rutinleri"" ile iş görme"
"w"	"W-LF10A2A-1858-2049"	"ile ekonomik ve kültürel ilişkileri"	"geliştirmek"	"için gerçekleştirdikleri çabalar daha fazla"
"w"	"W-MD39E1B-2928-747"	"ile birlikte çocukların öğrenme ve"	"gelişmelerine"	"yardımcı olacak elverişli bir öğrenme"
"w"	"W-OC06A1B-3907-1024"	"ile Bergama sulamalarında devir sonrası"	"gelişmelerin"	"belirlenmesi amacıyla a) Fiziksel, b)"
"w"	"W-VB04A1B-4527-156"	"ile bağdaştırıldığında, cypermethrine karşı direncin"	"gelişmiş"	"olabileceği fikrini güçlendirmektedir. Bu nedenle"
"w"	"W-JG03A3A-2013-757"	"ilave teşvikler yaparak, sanatın unsurlarının"	"geliştirilmesi"	"fikri savunuluyordu. Birliğin amacı basitti;"
"w"	"W-PE09C3A-1423-2471"	"ilan etti. Ne var ki,"	"gelişmeler"	"barışı getirmedi ve durum da"
"w"	"W-KE03A1B-3639-1731"	"iktisadı etkileyen temel modemist metot"	"geliştirme"	"hareketleri kabul edilen mantıksal pozitivizm,"
"w"	"W-IF10A2A-1878-1629"	"iktisadi politika hataları ve sonrasındaki"	"gelişmelere"	"de yer verilmektedir. Çalışmada altı"
"w"	"W-KF18E1C-4151-407"	"ikinci yarısından itibaren, likiditeyle ilgili"	"gelişmeler"	"yanında, enflasyon bekleyişlerindeki yükselme, kamu"
"w"	"W-EE02A1B-3443-1508"	"ikinci sırada bulunuyordu. Anlamlı bir"	"gelişme"	"de yüzyılın ortalarında üyelerden yalnızca"
"w"	"W-II13C2A-1288-2336"	"iki ülkenin baskı kurması biçiminde"	"gelişince"	"bu tasarım kadük oldu. Fidel'in"
"w"	"W-DG03A0A-1667-2023"	"iki tarafa doğru kanatvari açıldığı"	"gelişmiş"	"kufi yazılılar görülmektedir. Bu halı"
"w"	"W-IE05A4A-1946-2138"	"iki tane önemli yapı süreci"	"gelişmiştir."	"Birisi gecekondu, diğeri yapsatçılıktır. Yapsatçılık,"
"w"	"W-FB04A2A-1577-1884"	"iki farklı tiptedirler. Trake Trakeler"	"gelişmiş"	"bitkilerde bulunmaktadır. İki ucu açık"
"w"	"W-SF10A2A-1865-793"	"ikamesi, verimlilik artışı ve teknolojik"	"gelişmelere"	"atıfta bulunulmaktadır. Sermaye maliyetinin küresel"
"w"	"W-RI32D1B-2729-2305"	"ihtiyaçlarınızı gösterebilir. Aynı zamanda yeni"	"gelişmelere"	"açık olduğunuz anlamına gelir. Kutsal"
"w"	"W-ND02A1B-4511-426"	"ihracatını azaltır. B. Hizmetler Ticaretinde"	"Gelişmeler"	"Bilindiği gibi, ticari hizmetlerin rekabete"
