"Register"	"Text"	"Left"	"-5;5"	"Right"
"w"	"W-OB04A3A-1566-940"	"taraftaki yumurtalık ve yumurta kanalı"	"gelişmiştir,"	"sağ taraftaki körelmiştir. Üreme daima"
"s"	"S-AEABUZ-0038-312"	"tarafta bilimsel devrim sonucunda teknoloji"	"gelişmiş"	"ve savaşlarda uygulanıyor. Osmanlı da"
"w"	"W-HB04A1A-1537-1786"	"tanınmamalı daha çok tarımsal sanayileşmenin"	"gelişmesine"	"öncelik verilmelidir. Her geçen gün"
"w"	"W-PF10E1B-3064-1494"	"tanındı. E-Çimento Projesi'nde Oytek tarafından"	"geliştirilen"	"ve uygulama altyapısı Microsoft İnternet"
"w"	"W-GA16B2A-0460-505"	"tanımadıkları bir dostluk ve arkadaşlığın"	"gelişmekte"	"olduğunu sezinliyordu. Özellikle Yadoha'nın zihinsel"
"w"	"W-NF10A2A-1847-1435"	"tanıma prensibini belirlemek, Avrupa Standartlarının"	"gelişmesini"	"teşvik etmek, bu standartların bulunmadığı"
"w"	"W-LE05A1B-3671-1553"	"Tanzimat ile başlayıp meşrutiyet ile"	"gelişen"	"insan hakları kavramının etkilerinin yasalara"
"w"	"W-PE30D1B-2086-689"	"tanklarla giren ABD ordusu, başkentteki"	"gelişmeleri"	"tüm dünyaya duyuran gazetecilere saldırdı."
"w"	"W-QF05A1B-4670-1973"	"tamamlamakta ve birlikte kullanılmaktadırlar. Satış"	"geliştirme"	"kullanılırken ürünün kalitesine uygun yapılmalıdır."
"w"	"W-IE39C4A-0513-672"	"tamamen farklı bir tarihsel çizgide"	"gelişmiş"	"bir formasyon olması, onunla farklı"
"s"	"S-BEABXO-0345-80"	"Tamam. Neymiş o? Ders materyali"	"geliştirme."	"Son sayfada. Neymiş o? Ders"
"w"	"W-SC18F0A-1784-2396"	"tam uyumlu kalite değerlendirme ve"	"geliştirme"	"sistemlerinin kurulmasıdır. Bu kapsamda, YÖK"
"w"	"W-FE05A2A-2622-1212"	"Talatları haklı çıkaracak şekilde hızla"	"gelişmekteydi."	"Gizli antlaşmanın daha ikinci günü,"
"w"	"W-VE30D1B-2136-692"	"takip edildiğini belirtti. Davutoğlu, Afganistan'daki"	"gelişmelerin"	"Pakistan'ın güvenliğini etkilediğini kaydederek, ""Türkiye,"
"w"	"W-RD02A3A-1385-1321"	"takip eden yüzyıllarda Birleşik Devletler'in"	"gelişmesine"	"temel teşkil etti ve bu"
"w"	"W-NE43C2A-1884-1844"	"takdirine mi bırakacağız? ECEVİT Son"	"gelişmelerden"	"sonra bütün dünyada ekonomi sarsılıyor."
"w"	"W-PE06A1B-4255-1686"	"tahrip edilmesidir. Geçmişte uygulanan yanlış"	"gelişme"	"ve kalkınma politikaları, dünyanın çevresel"
"w"	"W-SD19A3A-3327-1619"	"tahmin edebilir ve kuruma güvenir."	"Gelişmiş"	"ülkelerdeki halka açık bilgi yoğunluğu"
"w"	"W-DD02A3A-2704-1801"	"tahlil ettiğimizde, öncelikle onların Batı'da"	"gelişen"	"yeni teknikleri fazla zaman fasılası"
"w"	"W-GD02A1B-3724-21"	"tabloyu tersine döndürecek ümit verici"	"gelişmeler"	"bulunmaktadır. Bir kere çağa yapılan"
"w"	"W-RD03A2A-1380-307"	"Tabii hükümdarın ülkesi ve gücü"	"geliştikçe"	"bu unvanlara yenileri eklenmiş, yahut"
"w"	"W-VI31D1B-2434-1336"	"tabelasını değiştirmeyi başardı. Sağ kanattan"	"gelişen"	"atakta Gökhan ortaladı, Güiza topu"
"w"	"W-QF05A1B-4673-1034"	"taahhüt etmişlerdir.21 Bu ve benzeri"	"gelişmeler"	"kalkınmaya, devlete ve onun rolüne"
"w"	"W-MD39E1B-3360-1849"	"sırayı teşkil ederken, spor alanında"	"gelişmiş"	"ülkeler bu politikalarını büyük ölçüde"
"w"	"W-MC06A1A-1952-1292"	"sırasında kök gübresi olarak köklerin"	"gelişmesi"	"için kullanılır etkileri en az"
"w"	"W-FC01A2A-1511-1429"	"sırasında hızlı bir şekilde anemi"	"gelişmesi"	"dört nedenle olabilir. 1. Hasta"
"w"	"W-VE39C4A-1180-1154"	"sırada APO'nun bulunmadığı bölgelerde habersiz"	"gelişebilecek"	"muhalefeti ezmek ve Apo'nun emrettiği"
"w"	"W-JE02A2A-1523-1450"	"sıra, uçak, roket tasarım ve"	"geliştirmede"	"çok iyi yetişmiş personelin gerektiği"
"w"	"W-SF10A1D-2031-1156"	"sıra, Türkiye'de sivil toplum anlayışının"	"gelişmemiş"	"olması gösterilmiştir. Bu konuda İstanbul'dan"
"w"	"W-TF10A2A-1881-821"	"sınırlı kalmış dar kapsamlı uluslararası"	"gelişmeleri"	"ile zamanını doldurmuş ve eskimiş"
"w"	"W-CD02A1B-3508-82"	"sınırlı kalmamıştır. Bir kimse tarafından"	"geliştirilen"	"ya da kendiliğinden ortaya çıkan"
"w"	"W-NF10A2A-1664-1311"	"sınırlandırabilecektir. Bu nedenlerle ve uluslararası"	"gelişmelerle"	"paralellik sağlanması amacıyla alım sürecinde"
"w"	"W-GD02A1B-3782-2192"	"sınıfa geçişteki bu düşmeler veya"	"gelişme"	"kaydedilmemesi halleri ilginç bir bulgu"
"w"	"W-MD39E1B-2928-1620"	"sınıfa gelindiğinde ise zekası çok"	"gelişmemiş"	"sıradan bir hayvan olan yılan"
"w"	"W-UB04A4A-1998-1557"	"sıcaklık metamorfizması Dalma-batma zonu çukurluğunda"	"gelişir."	"Rijit haldeki levha çarpışmasının ilk"
"w"	"W-EE39C4A-0975-975"	"sıcak bakılmamaktadır. Ancak, ""olumsuz"" bir"	"gelişme"	"durumunda, ABD, Suudi Arabistan'daki yönetimin"
"w"	"W-JF05A1B-4398-2440"	"süreçte olduğu gibi iki boyutta"	"gelişme"	"göstermiştir. Bunlardan birincisi ülke ekonomisinde"
"s"	"S-ACAAPZ-0032-379"	"süresince üniversitemize yeni birimlerin kurulmasında,"	"gelişmesinde"	"bana destek veren değerli öğretim"
"s"	"S-ACABTZ-0336-131"	"sürekli ve temiz enerji kaynaklarının"	"geliştirilmesine"	"önem verildiği dünyamızda teknik ve"
"w"	"W-PF05A1B-4681-1322"	"sürekli katkıda bulunur, iş arkadaşlarının"	"gelişmesini"	"sağlar ve daha da önemlisi"
"w"	"W-IF05A3A-1268-856"	"sürekli el altında bulunan planlar"	"geliştirir."	"Çoğu zaman bunların kullanımı birlikte"
"w"	"W-NE41C3A-1031-1668"	"sürekli bir uğraşı durumundaydı. Karayollarının"	"gelişmesiyle"	"birlikte il sınırında karşılama bir"
"w"	"W-MF10A2A-1823-761"	"sürekli bir biçimde sürdürülür. TK'nin"	"gelişmesine"	"önemli katkısı olan bilim adamlarının"
"w"	"W-RI09C2A-0538-593"	"süreciyle birlikte otomotiv endüstrisi hızla"	"gelişmeye"	"başladı. Artan motorlu araç sayısının"
"w"	"W-HE02A3A-0644-1559"	"sürecinin ortaya çıkışıdır. Yani teknolojik"	"gelişme"	"Marksist kuramın toplumsal değişim ile"
"w"	"W-LD02A1B-4483-767"	"sürecini tanımlamak veya açıklamak üzere"	"geliştirilmiş"	"bu kuramlar içinde; eleştirel araştırmalarla"
"w"	"W-JE39E1B-2838-1142"	"sürece bizim de Ermenistan'la ilişkilerimiz"	"gelişecektir."	"Bu noktaya gelinmesi için sorunların"
"w"	"W-MF25D1B-2156-578"	"sürdüğü belirtildi. Telefonlar tarihe karışıyor"	"Gelişen"	"teknolojinin günlük hayatta kullandığımız cihazlara"
"s"	"S-ACAAQq-0419-363"	"sürdürmesi, sürdürmesi için de, demokratik"	"gelişmesini"	"tamamlaması gerekmektedir. Zira, bilinmektedir ki,"
"w"	"W-VD02A3A-2701-2113"	"süratle devam etmekte olan zihni"	"gelişmeler"	"birbirini takip eder. Onun utanma"
"w"	"W-LE05A1B-3677-1551"	"Sükan Yavuz* ÖZET XIX. yüzyılda"	"gelişen"	"küresel rekabetin patlamaya dönüşmesi sonrasında"
"w"	"W-OB29D1B-2439-371"	"söz konusu. Genetik mühendisliğini savunanlar"	"gelişmekte"	"olan ülkelerin bu yöntemden büyük"
"s"	"S-AEABUZ-0021-54"	"söz konusu olmamalı. Uzun yıllar"	"geliştirmek"	"için <B> Evet iste. Yeter"
"w"	"W-QG37E1B-2933-308"	"söz konusu değildir. Tüm bu"	"gelişmeler,"	"iktidarın AB'ye şirin görünme çabaları"
"s"	"S-AEABTZ-0040-570"	"söylüyor. Ve tam tersi bi"	"gelişme"	"var. Hani biz hiç rönesanstan"
"s"	"S-ACABPA-0434-393"	"söyleyebilirsiniz. Toplantının biraz o yönde"	"gelişmesi"	"lazım. Teşekkür ederim, ben buraya"
"w"	"W-LE05A1B-3691-245"	"söyleniyordu. İnönü ise. olası bu"	"gelişmeleri"	"kafasında tartıyor; sonuçta bu saldırıların"
"w"	"W-VE05A1B-4307-25"	"söylenemez. Yerel demokrasinin yeterince yaygınlaşamamasında,"	"gelişmiş"	"demokrasilerdeki zaman zaman kendini gösteren"
"w"	"W-RD02A1B-4582-1369"	"söylenemez. Bu durumun, özellikle gelişmemiş/gelişmekte"	"gelişmemiş/gelişmekte"	"olan ülkelerde iş etiği ve"
"w"	"W-VC06A1B-4115-1939"	"söylenebilir. Ancak bu kıyaslamayı yaparken"	"gelişmekte"	"olan ülkelerde eğitimde karşılaşılan ve"
"s"	"S-ADAABo-0367-519"	"söylemiştir. Bu çok önemli bir"	"gelişmedir."	"Tarihin, toplumun din dışı öğelerle"
"s"	"S-ADBBI^-0042-234"	"söylemeye yönelik yeni bir politika"	"geliştirdik."	"Böylece iki sene içinde Türkiye"
"s"	"S-ADBBAo-0443-392"	"söylemedin mi? Söyledim ama olayın"	"gelişmesi"	"başkaydı, farklı yansıttılar. Biz beraber"
"s"	"S-ACABQq-0422-578"	"söyledim- ama, sanki böyle bir"	"gelişme"	"olacak, 2003 yılı sonunda değerlendirme"
"w"	"W-OI22C2A-0414-1152"	"sömürücülerin saldırısına uğramaya başlar. Teknolojik"	"gelişmeyle"	"bu sömürü saldırısı gittikçe keskinleşir."
"w"	"W-KE09C4A-0992-58"	"sömürgecilerine karşı çok etkili serhıldanlar"	"geliştirmiş"	"ve bunda da başarılı olmuşlar."
"w"	"W-GE39C2A-1062-710"	"suçlanan çocuklarda sonradan nevrotik davranışlar"	"gelişebileceği"	"akılda tutulmalıdır. Bu gerçekler, aslında"
"w"	"W-HE39E1B-2836-1352"	"suyundandır"" gibi ilginç bir teori"	"geliştiriyor."	"Felaket, Senirkent İçin Şans Mı?"
"w"	"W-TC01A4A-1403-946"	"suretiyle dostlarımıza konuşmalar yapmak dilimizi"	"geliştirmenin"	"en etkili yolları arasında yer"
"w"	"W-PC40E1B-2875-964"	"subwoofer'i temsil ediyor. Bu standardın"	"geliştirilmiş"	"versiyonları DD 6.1 hatta DD"
"w"	"W-SG43C2A-1808-1057"	"subayı. O yüzden iletişim teknolojisindeki"	"gelişmeleri"	"ben çok erken öğrenirdim hep."
"w"	"W-UI09C2A-1758-1896"	"su yürütür gibi sağcı güçleri"	"geliştirmeye"	"çalıştıklarını biliyorduk. Kendi çocuklarının solcularla"
"w"	"W-KC06A2A-1089-412"	"su talebinin karşılanmasında önemli bir"	"gelişme"	"olmuştur. 3.2. SU TALEBİNİ KARŞILAMAYA"
"s"	"S-AEABPZ-0331-146"	"su idarelerinin müstakil kurumlar olarak"	"geliştirilmesi"	"gerekiyor. Evet, kanalizasyona bağlı nüfusumuz"
"w"	"W-SI21F1D-4703-867"	"stresör hayat olaylarının baş ağrılarının"	"gelişmesinde"	"önemini teyit eden güvenilir çalışmalar"
"s"	"S-AEABPZ-0331-132"	"stratejimiz çevresel değerlerin korunmasına ve"	"geliştirilmesine"	"yönelik yönetim biçiminin oluşturulması. Ve"
"w"	"W-MF10E1B-2864-1081"	"stratejiler geliştirmek mümkün olamaz. Strateji"	"geliştirirken"	"tüketicinin varlığını kabul ediyoruz. Özelliklerini"
"w"	"W-MD39E1B-3359-820"	"stratejik önem kazanmaktadır. Bu açıdan"	"gelişmiş"	"ülkeler düzeyine çıkmayı hedefleyen gelişmekte"
"w"	"W-QC06A1B-3984-480"	"Stratejik Çevresel Etki Değerlendirmesi (SÇD)"	"geliştirilmiştir."	"Sürdürülebilir kalkınmanın uygulamaya dönük bir"
"s"	"S-AEABPZ-0331-133"	"strateji çevresel değerlerin korunmasına ve"	"geliştirilmesine"	"yönelik tutum ve davranışlarla bilinç"
"w"	"W-PC06A2A-1179-475"	"standartlarındaki ve kullanılan bilgisayar sistemlerindeki"	"gelişme"	"aynı ses ve görüntü kalitesinin"
"s"	"S-ACAAPZ-0384-374"	"Standartlar Enstitü bu ülke sanayisinin"	"gelişmesine"	"katkı sağlamış ve üzerine aldığı"
"w"	"W-FC06A2A-2004-1850"	"stabilitenin azalması) nedeniyle, alternatif yöntemler"	"geliştirilmiştir."	"Uygulanan yöntemler; a) Kremaya kültür"
"w"	"W-DE05A3A-2974-1252"	"Sovyet Rusya'daki milliyetçilik ve demokratikleşme"	"gelişmeleri,"	"Sovyet Bloku'nun dışında bulunan iki"
"w"	"W-HE02A3A-0644-2379"	"sosyo-ekonomik düzeni tanımlamak için ""bilişimsel"	"gelişme"	"modu"" (informational mode of development)"
"w"	"W-SH03A3A-1390-1684"	"sosyal gelişmenin yönü ve derecesi"	"gelişmiş"	"ülkelerin tutumlarıyla doğrudan ilişkilidir. Nitekim"
"w"	"W-MD39E1B-3360-222"	"Sosyal Bilgiler dersinin demokratik tutum"	"geliştirmedeki"	"rolü ile ilgili mevcut durumu"
"w"	"W-QE18E1C-1658-2328"	"sorununun ve bölgenin sosyo-ekonomik açıdan"	"geliştirilmesi"	"sorunlarının kapsamlı biçimde çözülmesi ve"
"w"	"W-UD30D1B-2206-319"	"sorunun, reform adımlarını ve olumlu"	"gelişmeleri"	"gölgelemesinden yakınarak değişiklikten yana olduğunu"
"s"	"S-ACABQq-0421-361"	"sorunlarının araştırılarak, ekonomik ve sosyal"	"gelişmesini"	"sağlamak için alınması gereken önlemlerin"
"s"	"S-ACABQq-0421-362"	"sorunlarının araştırılarak, ekonomik ve sosyal"	"gelişmesini"	"sağlamak için alınması gereken önlemlerin"
"w"	"W-TF10A2A-1903-1659"	"sorunların artmasına neden olabilecektir. Az"	"gelişmiş"	"ülkelerin hali hazırda büyük bir"
"w"	"W-MF10A2A-1786-1914"	"sorunları ve ticarileşme sorunları Teknoloji"	"geliştirme"	"merkezlerinin iyileştirilmesi ve yaygınlaştırılması çalışmalarına"
"w"	"W-QC37C4A-0084-2464"	"sorumluluğunda olduğunu düşünüyoruz ve değişmeye/gelişmeye"	"değişmeye/gelişmeye"	"kişisel katkıda bulunamıyoruz. Toparlama İnsan,"
"w"	"W-VF07A2A-1857-1490"	"Sorumluluk Vasıtalarının ABC'si"" Avrupa Parlementosu'nun,"	"""Gelişmekte"	"Olan Ülkelerde Faaliyette Bulunan Firmalar"
"w"	"W-MD39E1B-3359-2050"	"sorumluluk alacağı bir sistem hedeflemektedir."	"Gelişmiş"	"birçok ülkede, teknisyen seviyesine kadar"
"w"	"W-HC01A3A-1275-274"	"sorumludur. Duyarlı viruslarda asiklovire rezistans"	"gelişebilir;"	"ayrıca vücutta belirli yerlerdeki (örneğin"
"w"	"W-HE39E1B-3027-2477"	"sorular şeklinde organize edilmişti. Günümüzde"	"geliştirilen"	"yazılı ve sözlü testlerle belirli"
"s"	"S-ADABPZ-0134-628"	"sormak istiyorum emm değişen ve"	"gelişen"	"dünya ile birlikte modernizm işte"
"w"	"W-QD02A3A-0653-1779"	"sorgulanmaya başlayacaktır. Bu çok önemli"	"gelişmeler"	"karşısında bireyin konumu ne olacaktır?"
"w"	"W-TC29D1B-2793-2353"	"sorgulama yapılabilmesine olanak sağlayacak yazılımlar"	"geliştirilmesi"	"talep ediliyordu. Bilişim Güvenliği Başkanlığı"
"w"	"W-OE05A2A-1794-982"	"sonuçlarıyla ilintili olarak bir duyarlılık"	"geliştireceklerdir."	"Kamu Yönetiminin Hesap Verebilirliği Temel"
"s"	"S-ACABQq-0423-482"	"sonuçları doğuracağı, çok daha başka"	"gelişmeler"	"karşısında çok daha başka sonuçlarla"
"w"	"W-FD05A4A-2607-1753"	"sonuçlanıyorsa, aynı iktisadi nedenlerle kapitalist"	"gelişmede"	"her ileri adım, dünya değişim"
"s"	"S-BEABXO-0345-141"	"sonuç çıkıyosa sonuçların değerlendirilmesi ve"	"geliştirilmesi."	"Tamam sonuçların değerlendirilmesi ve geliştirilmesi."
"w"	"W-SE02A2A-1165-2048"	"sonundan itibaren İran resmindeki bu"	"gelişme"	"Azerbaycan havalisini de etkilemiştir. İran"
"w"	"W-TC06A1A-0259-321"	"sonunda, içinde Turing makineleri kuramını"	"geliştirdiği"	"ve durma probleminin çözülemezliğini kanıtladığı"
"w"	"W-QE37C2A-0851-1792"	"sonunda tüm yağlar tekrar büyüyüp"	"gelişmeye"	"bırakılır. Bir oburluk var. Her"
"w"	"W-ME39C4A-1283-1554"	"sonunda kaybettiği itibarını, o dönemde"	"gelişmeye"	"başlayan Kürt hareketine (ve ""Apo"
"w"	"W-LC06A1B-3797-534"	"sonucunda baskın olarak akarsu çökelleri"	"gelişmiştir."	"Bu çalışmanın sonucunda, çalışma bölgesinde"
"w"	"W-LE05A1B-3702-1126"	"sonucu olarak ortaya çıkan bu"	"gelişmeler"	"yeni işletmecilik anlayışının doğmasına neden"
"w"	"W-PH03A1B-2395-1116"	"sonucu olarak ortaya çıkan bir"	"gelişmedir."	"Felsefe tarihinde ""çözümlemeci (analitik) felsefe"""
"w"	"W-RE09C2A-1384-579"	"sonrasında iç ve dış politik"	"gelişmelere"	"müdahale etme meşruiyetinin olup olamayacağıdır."
"w"	"W-IF10A1A-2079-1146"	"sonra, karma sistemde karar kılınmıştır."	"Geliştirilen"	"sisteme göre, bütün federe devletlerdeki"
"s"	"S-AEABUZ-0038-511"	"sonra çok çok solladı. Bugün"	"gelişmekte"	"olan ülkeler Amerikan üniversitelerini kendilerine"
"w"	"W-UC01A2A-1338-704"	"sonra intramural fibrozis oluşumu ile"	"gelişir."	"Darlıklar mide özofagus bileşkesinde başlar"
"w"	"W-PB04A1A-2063-1655"	"sonra HbF kaybolur, HbA tipi"	"gelişir."	"Yaklaşık 4 ayda Hb'nin %90"
"w"	"W-VH03A2A-2026-1238"	"Sonra Bilim Rönesansta bilimdeki büyük"	"gelişmelerin"	"ilk sonuçları astronomide görülür. Bu"
"w"	"W-LE36C4A-0463-298"	"sonları olabilirdi. Bu tür olumsuz"	"gelişmelerin"	"önüne ancak diyaneti savunan Alevilerle,"
"w"	"W-DH03A1B-3100-1719"	"Son zamanlarda yapılan Kur'ân tercemelerinde"	"gelişmeler"	"ve düzelmeler olduğunu da itiraf"
"w"	"W-VI45F1D-4720-1205"	"Son yıllarda dünyada önemli bazı"	"gelişmeler"	"oldu. Birincisi dünyayı çok hoyrat"
"w"	"W-MF10E1B-2864-2431"	"son derece önemli gelişmelerdi. 1980'lerde"	"geliştirilmeye"	"başlanan pek çok kavram bugünün"
"w"	"W-OE05A2A-1414-1537"	"son birkaç yıldır işsizliğin hızla"	"gelişmesinden,"	"yeni dünya düzeni stratejisine bağlı"
"w"	"W-QI27D1B-2452-1110"	"son başvurmaktır. Çünkü omurga halen"	"gelişmesini"	"sürdürmektedir. Omurga eğriliği birçok durumda"
"w"	"W-MD39E1B-3359-2413"	"somutlaştırılması için örnek bir model"	"geliştirilmelidir."	"Bu atmosferik hareketlerin az veya"
"w"	"W-QI09C3A-1480-2065"	"sokulması olarak değil, bilim zihniyetinin"	"geliştirilmesi"	"olarak anlamalıyız; çünkü resmi pozitivizm,"
"w"	"W-UE02A4A-0908-2304"	"sohbet ediyor, önerdiği yerlere gidiyor."	"Gelişmiş"	"ülkelerin bulup, geliştirdiği cep telefonu"
"w"	"W-JF05A1B-4413-799"	"SİSTEMLERİNDE ÇAĞDAŞ YAKLAŞIMLAR VE YENİ"	"GELİŞMELER"	"Nurhan PAPATYA Özet Üretim/bilişim Üretim/bilişim"
"s"	"S-ACABQq-0421-321"	"siz seçememektesiniz. Oysa, dünyanın bütün"	"gelişmiş"	"ülkelerinde hastaların bu hakkı vardır."
"s"	"S-AEABTZ-0040-305"	"siz depolayamıyorsunuz. O teknoloji henüz"	"gelişmiş"	"değil. Sonuçta o zaman sürekli"
"w"	"W-SF05A1B-4665-1969"	"siyasi, sosyal ilişkilerin yaygınlaşması ve"	"gelişmesi,"	"ideolojik ayrımlara dayalı kutuplaşmaların çözülmesi,"
"w"	"W-SA16B4A-0269-1797"	"siyasi gelişme ve bu siyasi"	"gelişmeyi"	"daha da hızlandıracak gerilla savaşı"
"w"	"W-VF07A2A-1857-1291"	"siyaset düşünürlerinin ve iktisat kuramcılarının"	"geliştirdikleri"	"modeller ve ideolojiler ile pekişmiş"
"w"	"W-VD02A3A-1540-1163"	"Siyasal, ekonomik ve uluslararası ilişkilerdeki"	"gelişmeleri"	"göz önünde bulunduran ve uluslararası"
"w"	"W-GD02A1B-3782-9"	"siyasal koşullar ve o ülkenin"	"gelişmesi"	"için gerekli olan öncelikler öğrencilerin"
"w"	"W-JE05A2A-2610-2053"	"siyasal düzeyde, demokratik bir yöntem"	"geliştirilememiş"	"bu yüzden partisel bir olgunluğa"
"s"	"S-AEABPZ-0331-624"	"sistemleriyle kesintisiz internet hizmeti verilmekte,"	"gelişen"	"iletişim teknolojilerini eğitim-öğretim süreçlerinde kullanma"
"w"	"W-JB04A1B-4051-807"	"sistemlerin analizini kullanmak suretiyle geliştirilmiştir."	"Geliştirilen"	"modeller, sulama, gübreleme, zararlılarla mücadele"
"w"	"W-PF10E1B-3064-1918"	"Sistemleri, Müşteri Destek Hizmetleri, Yazılım"	"Geliştirme),"	"Ağ ve Telekomünikasyon hizmetleri yelpazesinde"
"w"	"W-UE05A1B-4274-1314"	"sistemle daha az bütünleşmiş az"	"gelişmiş"	"ülkelerde ise, sabit kurlarda bankacılık"
"w"	"W-OC03A3A-1418-1773"	"sisteminin ve insan anlayışının nasıl"	"geliştiğini"	"bazen kronolojik bazen de tematik"
"w"	"W-LF10A1A-1825-1124"	"sisteminin sürdürülebilmesi için ağır borçlu"	"gelişmekte"	"olan ülkelerin denetim altına alınması"
"s"	"S-ACABPA-0434-268"	"sistemin uygulamada parlamenter sistem yönünde"	"geliştiği"	"gibi. Şimdi Türkiye açısından bir"
"w"	"W-GC06E1B-3080-811"	"sistematik bilgiler topluluğunu ifade eder;"	"gelişmesinde"	"süreklilik, gelenek, çok önemli ve"
"w"	"W-GF10A1A-1842-727"	"sistem sürekli küçülme eğilimine girmiştir."	"Gelişmeleri,"	"bankacılık sistemi açısından analiz ettiğimizde"
"s"	"S-ACABQq-0425-21"	"sistem geliştirmek demektir. Bu sistemi"	"geliştirmeyen"	"hükümetler AKP gibi kaçak dövüşürler."
"w"	"W-NF10A2A-1648-1563"	"sipariş verenlere postalarlar. Bu işi"	"geliştirerek"	"amazon. com’u, com’u, com’u, bugünkü"
"w"	"W-TC01A4A-1403-2055"	"sinaptik bağların oluşmasına katkı sağlar."	"Gelişme"	"mevcut durumdan daha iyi bir"
"w"	"W-QF07A2A-1871-895"	"sigortalanmaya başlaması dikkate değer bir"	"gelişme"	"olarak görülmektedir. Bireysel Emeklilik Sistemi"
"w"	"W-KC06A2A-2001-1000"	"SICAKLIK Sıcaklık Freesia'nın çiçeklenmesi ve"	"gelişmesi"	"üzerinde en etkili faktördür. Sıcaklık"
"w"	"W-NE05A4A-1797-2388"	"siber uzayda sosyalleşeceğimiz düşlenmiştir. Ama"	"gelişmeler,"	"ekonomik faaliyetin artan mobilitesinin beklendiği"
"w"	"W-IE05A1B-3542-1120"	"si anlı uyuşmazlıklara ve gelecekteki"	"gelişmelere"	"uyum sağlayamadığı, bu nedenle sözleşmenin"
"w"	"W-FD02A4A-0645-1357"	"SHP'nin ""yenileşme"" yolunda atacağı adımlar,"	"geliştireceği"	"modeller yalnız bu partiyi değil,"
"w"	"W-VF05A1B-4639-1082"	"Shin ve Smith (2001) tarafından"	"geliştirilen"	"ARDL sınır testi aracılığıyla incelemektedir."
"w"	"W-UD03A3A-3310-604"	"seyir göstermektedir. Korpus kallosumları kötü"	"gelişmiş"	"ya da sol yarıküreleri hasarlı"
"s"	"S-ACABQq-0423-18"	"sevk ve idaresi için tedbirler"	"geliştirmeyi"	"de ihmal etmiyoruz. Vatandaş odaklı"
"w"	"W-TI31D1B-2420-2227"	"seviyorum"" dedi. Kendisini her yönden"	"geliştirmesi"	"gerektiğini söyleyen yıldız oyuncu, ""Her"
"s"	"S-ADABLp-0061-474"	"seviyesinin yükselmesi. Başka. Sağlık alanındaki"	"gelişmeler."	"Noldu? Doğum oranı azaldı, bebek"
"w"	"W-SD05A1A-0747-1115"	"seviyesine uygun olarak uygulayan ve"	"geliştiren,"	"kitap okumayla ilgili tez yaptıran,"
"s"	"S-ACABQq-0421-320"	"seviyede ""aile doktorluğu"" denen ve"	"gelişmiş"	"ülkelerin hemen hemen hepsinde değişik"
"w"	"W-NG03A1B-3245-1944"	"sevgili. Romanda, olayların başlaması ve"	"gelişmesindeki"	"en önemli kişi. Kaymakam 30"
"s"	"S-ADABCo-0195-421"	"Sevgili seyirciler gündemin odağındaki sıcak"	"gelişmelerle"	"devam ediyoruz. Ve Ankara'da DTP"
"w"	"W-GE39C2A-1062-1725"	"seslerle, değişik tonlarla, değişik müziklerle"	"geliştirilmelidir."	"Küçük bebek tiz seslerden rahatsız"
"w"	"W-EA16B2A-1740-1117"	"sesle konuşmaya başladım ""O senin"	"gelişme"	"dediğin şey, bütün çevreyi bozdu,"
"w"	"W-QF10E1B-3065-353"	"servisleri ve eğlence içeriklerini içeren"	"gelişmeleri"	"yakından takip eden tüketici grubu"
"w"	"W-MD02A1B-4506-263"	"servisler tarafından gençlere kişilerarası ilişkileri"	"geliştirme"	"eğitimi verilmesi sağlanmalıdır. Transaksiyonel Analiz"
"w"	"W-RE05A1B-4278-749"	"sermektedir. BM raporuna göre, az"	"gelişmiş"	"ülkelerdeki ortalama gelirin ve yaşam"
"w"	"W-UD18E1C-3374-477"	"sermaye hareketlerinin artması ülke ekonomilerinin"	"gelişme"	"potansiyellerini güçlendirmektedir. Bütün kurum ve"
"s"	"S-ADBBI^-0042-240"	"sergimde, hani üzerinde ""oynamadığım"" fotoğraflarla"	"geliştirdiğim"	"""Mevsimler"" çalışmasının ikinci yahut üçüncü"
"w"	"W-KF10A2A-1795-2373"	"sera gazı rezervuarlarının korunması ve"	"geliştirilmesi"	"ve iklim değişikliğine etki yapan"
"w"	"W-EA16B4A-1042-1799"	"seninle konuşacak mı? Yeni bir"	"gelişme"	"olur olmaz bana bildir. Ablan"
"w"	"W-IF10A2A-1880-180"	"senelik ortalama %35 artıştır. Turizm"	"gelişmekte"	"olan ülkeler için istihdam ve"
"w"	"W-OF05A1B-4460-698"	"sendikal eğitim çalışmalarının yeniden düzenlenerek"	"geliştirilmesidir."	"Sendikalar, eğitime daha çok eğilmeli,"
"w"	"W-HE39E1B-2836-2482"	"senaryolarının gündeme gelmesi beklenen bir"	"gelişmeydi."	"Taht varisleri arasında, ilk bakışta"
"w"	"W-OE39C2A-0143-791"	"Sekülerleşme ve sonrasında da kapitalizm"	"geliştikçe"	"bu ayrıcalık yerini ""Rekabet"" kavramına"
"w"	"W-QF25D1@-2145-1758"	"sektöründe piyasaların serbestleştirilmesine yönelik önemli"	"gelişmeler"	"kaydedildiğini anlatan Vorkink, ancak yapılması"
"w"	"W-UF10A2A-1866-1710"	"Sektörlerin Mevcut Durum ve Gerçekleştirdikleri"	"Gelişme"	"Bakımından Karşılaştırılması Çalışmanın temel değişkenleri"
"w"	"W-CF05A1B-4357-109"	"sebeple de açıklanamaz.' Gelişmiş ve"	"gelişmekte"	"olan ülkelerde enflasyan genelde farklı"
"w"	"W-RC40E1B-2877-1436"	"sebep olan konsollar, her dakika"	"gelişen"	"PC'lerin iyice gölgesinde kaldı artık."
"w"	"W-ID03A2A-0525-2338"	"sebebi zannediyorum bu değer yargılarının"	"geliştirilmesi"	"yerine tahribe yönelmiş ve bunu"
"w"	"W-UC29D1B-2445-455"	"SDK'yı kullanabilir, Singularity'yi dilediğiniz gibi"	"geliştirebilirsiniz"	"ama satamaz ya da ticari"
"s"	"S-AEABPZ-0331-168"	"sağlığına zarar veren üretime karşı"	"geliştirilen"	"yaptırımlardır. Yoksa standart ürünlere ve"
"w"	"W-VI05A1A-2640-2039"	"sağlığı. Çocuğumuzun sürekli değişen ve"	"gelişen"	"bir yapısı vardır. Bu yapıyı"
"s"	"S-ADABLp-0061-475"	"sağlık hizmetlerindeki gelişmeler. Sağlık hizmetlerinde"	"gelişmeler"	"noldu? Ortalama yaşam süresini uzattı."
"s"	"S-ACABQq-0421-322"	"sağlık hizmeti açısından Avrupa ülkeleriyle,"	"gelişmiş"	"ülkelerle kıyasladığımızda son derecede geri"
"w"	"W-TC18F1D-1663-84"	"sağlayıp, fakültelerle okullar arasındaki işbirliğinin"	"gelişmesine"	"yardımcı olmak. Komitenin görevleri ise"
"w"	"W-PF10E1B-3064-369"	"sağlayacak, teknoloji veya yazılımın üretileceği,"	"geliştirileceği,"	"teknolojik bir buluşu ticari bir"
"w"	"W-SF10A2A-1861-1961"	"sağlayabilmesi açısından olumlu yönde bir"	"gelişme"	"olacaktır. Üçüncü ve son senaryoda,"
"s"	"S-ACABPA-0434-147"	"sağlanması, gerek parti içi demokrasinin"	"geliştirilmesi"	"ve gerekse partilerin siyaset yaparken"
"w"	"W-VE05A2A-2710-2254"	"sağlanacak yardımların İşletmenin genel performansını"	"geliştirmesi,"	"Antlaşma'nın EK-1 bölümündeki ürünler ile"
"s"	"S-ADBBI^-0042-46"	"sağa sola koşturmakla, telefonlarla, siyaset"	"geliştirmekle"	"uğraşıyordum. Çok zorlu günlerdi, dolu"
"w"	"W-FD02A4A-0645-618"	"sağ partiler tarafından ""işlenmesi"" ve"	"geliştirilmesi,"	"bunun halka sunulan çeşitli ödünlerle"
"w"	"W-IF05A3A-1268-164"	"sayısını artıracak buluş fırtınası yollarını"	"geliştirmek"	"için işgörenlerin oluşturdukları küçük grupların"
