"Register"	"Text"	"Left"	"-5;5"	"Right"
"w"	"W-QD02A1B-4560-2157"	"“gelişmiş”, “gelişmiş”, “gelişmiş”, “az “az"	"gelişmiş”"	"gelişmiş” ve “gelişmemiş” “gelişmemiş” “gelişmemiş”"
"w"	"W-UE39E1B-2906-1910"	"şu, her birisi diğerinden önemli"	"gelişmelerin"	"bileşkesi olarak şekillenmiş tarihsel bir"
"s"	"S-BEABXO-0002-536"	"şu eti kesyim. Anne Özgür'ün"	"gelişme"	"çağıyla benim gelişme çağım aynı"
"w"	"W-SI11F1D-5260-1984"	"şu aralar her şey güzel"	"gelişiyor."	"2 haftadır çok iyiyiz. Öncelikli"
"w"	"W-MI31D1B-2339-934"	"şu anda oluşmuş ciddi bir"	"gelişme"	"yok. Öncelikle koşulları görmek lazım."
"w"	"W-NF10E1B-3062-1298"	"şirketlere, Türkiye'nin en yaygın omurgasını,"	"gelişmiş"	"teknolojisini, yılların tecrübesiyle oluşmuş bilgi"
"w"	"W-IE05A2A-1016-842"	"şirkete; petrolü araştırma, eğer keşfedilirse,"	"geliştirme"	"ve pazarlama hakkı da verilmiştir."
"w"	"W-JE39E1B-2895-2422"	"şimdiden hazırlıklı olmalıdır. Her üç"	"gelişme"	"de şu andaki siyasal atmosferi"
"s"	"S-ADAB^Z-0370-608"	"şimdi peki bu hayal nasıl"	"gelişiyor?"	"Bunu da merak ediyor şimdi"
"w"	"W-ED36C2A-0413-1014"	"şeytanı temsil etmektedir. Cennet ise"	"gelişmiş"	"dünyadır. Böylesine dinsel söylemlerin toplumsal"
"w"	"W-IC06E1B-3083-191"	"şeyleri yeniden keşfetmeye çalışmazlar, onları"	"geliştirmeye"	"uğraşırlar. Doğu'nun gelenekleriyle Batı'nın yenilikleri"
"s"	"S-BEABXw-0391-71"	"şeylerde görmüyor değiliz. Gittim kendimi"	"geliştirmedim"	"hiçbişi yapmadım ne olacak. Boşuna"
"s"	"S-BEABXw-0409-227"	"şeyi, Gürsel'le böyle şeyi sohbetimi"	"geliştirdim"	"aslında. Hmm. Gerçi çok konuşmuyodu"
"s"	"S-ADABPZ-0357-591"	"şeyi bilmediğimi öğretti. Onun sayesinde,"	"gelişme"	"ihtiyacını daha fazla duydum. Bu"
"s"	"S-AAAAFZ-0383-636"	"şey eklendi. Bu sefer de"	"gelişen"	"ülkelerde başta Çin ve Hindistan"
"s"	"S-ADABAo-0433-316"	"şey batıya bizler onların böyle"	"gelişmiş"	"teknolojisini örnek alarak ya da"
"w"	"W-OB04A1B-4229-602"	"şeklinde olabilir. Ancak, genelde spontan"	"gelişen"	"beslenme yetersizlikleri birçok besin maddesinin"
"s"	"S-ADABPZ-0372-188"	"şekillenmesinde, sizlerin meslek alanındaki bilgilerinizi"	"geliştirerek,"	"insan ve vatan sevgisiyle dolu"
"w"	"W-NG03A2A-2588-376"	"şekilde ortak bir mekan etrafında"	"geliştirilmesini"	"zaruri kıldı. Yağmura, güneşe ve"
"s"	"S-ADABPZ-0125-508"	"şekilde o ülkelere para kazanarak"	"gelişmekte"	"olan ülkeleri dengelersiniz. Ama gelişmiş"
"w"	"W-NF10A2A-1827-626"	"şekilde döviz toplamaya başladı. Bu"	"gelişme"	"yabancı tasarrufçuların da kaçışını hızlandırdı."
"w"	"W-DD02A1A-2690-418"	"şekilde Doğuluların böyle bir düşünceyi"	"geliştirecek"	"yeteneğe sahip olmadıklarını düşündükleri için"
"w"	"W-GG37C1A-0444-442"	"şekilde değerlendirilmiştir. Ulusal sinema konusunda"	"geliştirilen"	"düşüncelerin bir başka boyutu da"
"s"	"S-AEABTZ-0040-615"	"şekilde bilimsel düşüncelerle, bu moderniteyle"	"gelişirken,"	"bi şekilde makineleşirken iki türlü"
"w"	"W-JE02A2A-1523-2096"	"şehir içi ulaşımda raylı sistemlerin"	"geliştirilmesi,"	"IV. Uzay ve Havacılık Sanayileriyle,"
"w"	"W-DE39E1B-3023-1072"	"şartı bir ülkenin araştırma ve"	"geliştirme"	"harcamalarının gayrisafi milli hasılanın yüzde"
"w"	"W-QE37C2A-0186-2041"	"şarkıdan alıntıydı. Argo literatürü hayli"	"gelişmiş"	"olan Türkiye'de, bu kelimenin ne"
"s"	"S-ADABPZ-0372-30"	"şanslılar da aynı zamanda. Araştırmasını,"	"geliştirmesini"	"ve bu geliştirdiklerini öğrencilerine aktarmasını"
"w"	"W-GC06E1B-3080-30"	"ışık yardımıyla bilgi aktaran sistemler"	"geliştirilmiştir."	"Ancak yine de yükseltici devreler"
"w"	"W-JC05A2A-1769-528"	"üç özelliğinden söz etmek mümkündür."	"Geliştirme"	"çalışmaları yerel yönetim kuruluşlarının güncel"
"w"	"W-TF10E1B-2871-997"	"üç yılda iki yeni model"	"geliştirildi."	"Norman Bodek'ten Kaikaku'nun 10 İlkesi"
"w"	"W-OE05A1B-4190-671"	"üzerine çalışan iktisatçılar, 19. yüzyılda"	"geliştirilen"	"tekniklerle ortaya çıkarılan değişimlerdeki artışlara"
"w"	"W-PI42E1B-2938-233"	"üzerine almış olurlar. Eğer biyolojik"	"gelişmeler"	"gecikirse, müçtehitlerin çoğunluğuna göre, on"
"w"	"W-PH03A1B-2395-559"	"üzerinde çeşitli dönemlerde çeşitli doğrultularda"	"gelişen"	"bir akım olarak değerlendirilmektedir. Akımı"
"w"	"W-KC06A2A-1089-507"	"üzerinde gerçekleştirilmeye çalışılan ""Narmada Vadisi"	"Geliştirme"	"Programı"" ülkenin esas olarak tarımsal"
"w"	"W-TC06A1B-4095-1100"	"üzerinde durulmaktadır. Belge yönetimi programları"	"geliştirme"	"sürecinde yasal düzenlemelerde yer alan"
"w"	"W-ME39C4A-1283-1084"	"üzere) geliştirilen formülasyonun 1970'ler Türkiyesi'nde"	"gelişen"	"faşist saldırıların yarattığı koşullara göre"
"w"	"W-NF10A2A-1821-1965"	"üzere malların, hizmetlerin ve fikirlerin"	"geliştirilmesi,"	"fiyatlandırılması, tutundurulması ve dağıtılmasına ilişkin"
"w"	"W-QE30D1B-2107-453"	"üyelerle eski üyelerin uyumu, ekonomik"	"gelişme,"	"terörle mücadelede işbirliğiyle de uğraşacak."
"w"	"W-SC18F0A-1784-1206"	"üyelerinin akademik yaşamı boyunca kendisini"	"geliştirme"	"kanallarını açık tutmak olarak sıralanabilir."
"w"	"W-FD39C4A-0281-375"	"üstünlüğüne dayalı bir demokrasi içinde"	"gelişmeydi."	"Böyle bir sistem, ancak halkla"
"s"	"S-ADABAo-0366-247"	"üstelik de bu kent soyluları"	"geliştirdiği"	"için burjuvaziyi geliştirdiği için... Evet."
"w"	"W-NG03A2A-2588-1766"	"üst düzeyde bilinç ve yetenekle"	"geliştirilmiş"	"mimari, yüksek bir kültür ürünü"
"w"	"W-TG03A1B-3282-1172"	"üretmese de, başlangıçta Op Sanat'm"	"gelişmesini"	"sağlayan bilim adamlarının 2000'li yıllardaki"
"w"	"W-SF10C1A-0301-201"	"üretmenizi sağlayabilecek yeni üretim metodları"	"geliştirmek,"	"hiç kimsenin akıl edemediği ama"
"w"	"W-FD05A4A-2607-1312"	"üretiminde uzmanlaşmasıdır. Bu tek yanlı"	"gelişmeden"	"söz edilirken bağımlı ülke ekonomilerindeki"
"s"	"S-AEABUZ-0038-644"	"üretimi de ancak özgürlük ortamında"	"gelişebiliyor."	"Baskının olduğu toplumlarda insanların konuşamadığı,"
"w"	"W-JF10A2A-1836-1496"	"üretim yapısına girmiştir. Tabii bu"	"gelişmede"	"toplumda yaşayan konut sorunu, imar,"
"w"	"W-FF05A1B-4379-124"	"üretim ve pazarlamada verimli kombinasyonlar"	"geliştirerek"	"yeni davranış formlarının oluşturulması ve"
"w"	"W-RB38E1B-2883-2007"	"üretim teknolojilerinde yapılacak iyileştirme ve"	"geliştirme"	"ile kıt kaynaklarımızın kullanım ömrünü"
"w"	"W-DE05A2A-2975-1180"	"üretim süreçleri, özünde, sermayenin gereksinimleri"	"gelişme"	"yörüngesiyle bağlantılıdır. Ne var sermaye"
"w"	"W-VE05A1B-4307-148"	"üretim sağlayarak kentsel ve bölgesel"	"gelişmeye"	"katkıda bulunabileceklerdir. Bununla birlikte azgelişmiş"
"w"	"W-NF10A2A-1821-571"	"üretim noktasının yeniden değiştirilmesi ve"	"gelişmiş"	"ülke pazarlarından, gelir düzeyi düşük"
"s"	"S-AAAAFZ-0383-331"	"üretilmesi meselesiydi. Bio yakıt üretimi"	"gelişmiş"	"ülkelere özgü bir durum. Onlar"
"w"	"W-UE05A1B-4291-2033"	"üretilerek verilerin depolanması ve kullanılması"	"gelişir."	"• Tekno-lojistik proje danışmanlığı ilk"
"w"	"W-UD02A1A-2058-1220"	"üretildiği alanlarda bir yıl sonra"	"gelişebilecek"	"kendi gelen bitkiler, ekilen diğer"
"w"	"W-KI09C2A-1544-1020"	"üniversitemizde gerçekleştirdiğimiz inşaat ve fiziki"	"geliştirme"	"çalışmalarının ayrıntılarını size ayrıca sunacağız."
"s"	"S-AEABUZ-0038-406"	"Üniversitelilik ruhu budur. Çünkü bu"	"gelişmenin"	"şeyidir, gelişmenin motorudur. Yeni bilgi"
"w"	"W-TC06A1B-4095-1594"	"üniversitelerine yönelik belge yönetim programları"	"geliştirilmesi"	"noktasında önemli bir aşama gerçekleştirilebilecektir."
"w"	"W-TC18F1D-1663-1054"	"üniversitelerinde yetiştirilmelidir. Öğretmen yetiştiren fakülteler,"	"gelişmiş"	"çevrelerde açılmalıdır. İlköğretim öğretmenleri (sınıf"
"w"	"W-IF18E1C-4145-1240"	"üniversitelerin işbirliğiyle politika ve programlar"	"geliştirilecektir."	"Sağlık, eğitim, bilim-araştırma, turizm ve"
"w"	"W-MD39E1B-3359-225"	"üniversitelerde sosyal ve kültürel faaliyetleri"	"geliştirmek"	"gerekmektedir. Spor, sinema, tiyatro, müzik,"
"w"	"W-SF10A2A-1854-2059"	"Üniversite Yeni ürün ve yöntemler"	"geliştirsin;"	"Akredite edilmiş analiz laboratuarları (akredite"
"s"	"S-ADABAo-0312-286"	"üniversite ve sosyal iletişim becerisi"	"gelişmiş"	"bir. Hı-hıı. Genç konusunda mutabakata"
"s"	"S-ADAB^Z-0370-212"	"üniversite olanaklarından yararlanıp mı kendimi"	"geliştireceğim"	"bir ortam bulamadım. Her şekilde"
"s"	"S-ACABFZ-0049-301"	"ülkeye ­özellikle de gemilere binip,"	"gelişmiş"	"ülkelere- sokulmaya çalıştıkları vakit; kimse"
"w"	"W-LF10A2A-1874-2264"	"ülkesinde bu konuda önemli bir"	"gelişme"	"göze çarpmamaktadır. Bu aşamada işgücü"
"s"	"S-ACAAPZ-0384-187"	"ülkenin yan sanayisini üniversitesiyle birlikte"	"geliştirerek"	"ülkeye katkı sağlayacak sanayiye ihtiyacımız"
"w"	"W-LD43A3A-1798-61"	"ülkenin direnciyle karşılaştı. Bu ülkeler"	"gelişmiş"	"ve bu yolla çok para"
"w"	"W-HE05A1B-3511-1184"	"ülkemizin sosyal ve ekonomik anlamda"	"gelişen"	"ve işçilerin (emeğiyle geçinenlerin) yoğun"
"s"	"S-ADABPZ-0357-138"	"ülkemize uygun şekilde hazırlanması ve"	"geliştirilmesinde,"	"uygulanmasında daha ileriye gideceğimiz ülkemizde"
"w"	"W-HE39E1B-2836-1883"	"ülkemizde ve bütün bölgede yaşanan"	"gelişmeleri"	"de dikkatlice analiz ettiğimizde idamların"
"w"	"W-FH03A1B-3104-1068"	"ülkemizde nasıl düzenlenebileceği konusunda öneriler"	"geliştirilmeye"	"çalışılacaktır. Gönüllü ölüme ilişkin olarak"
"w"	"W-TD18E1C-4079-2252"	"Ülkemizde 1980'li yılların ortalarından itibaren"	"gelişmeye"	"başlayan banka kartı ve kredi"
"w"	"W-IF18E1C-4145-2126"	"ülkelerle sosyal ve kültürel ilişkilerin"	"geliştirilmesi"	"esas olacaktır. Yurt dışındaki tarihi"
"w"	"W-JF10A2A-1775-1636"	"ülkelerinde, AB'de, Türkiye'de ve birçok"	"gelişmekte"	"olan ülkede işsizlik oranı, en"
"w"	"W-CG37C0A-0225-1286"	"ülkelerinde halkın edebiyat dilinin kurulup"	"gelişmesinde"	"de en önemli işi Sufiler"
"w"	"W-FE05A2A-1057-1449"	"ülkelerin sanayileşme sürecinde asıl olumsuz"	"gelişme"	"1980 sonrası imalat sanayi alanında"
"s"	"S-AEABUZ-0038-417"	"ülkelerin gelişmişliklerinin temelinde teknolojilerinin gelişip,"	"gelişmemesi"	"önemlidir. Teknoloji dediğimiz şey nedir?"
"s"	"S-ACABQq-0422-60"	"ülkelerin dostluk grupları arasında da"	"geliştirmek"	"zorundayız. Dolayısıyla, sadece hükümetlerden hükümetlere"
"w"	"W-OF10E1B-3063-939"	"ülkeleri küresel toplulukla bütünleştirmek ve"	"gelişmekte"	"olan ülkelerde elektronik ortamda yatırımların"
"w"	"W-ME39C4A-1283-886"	"ülkeleri de kapsayarak devam eden"	"gelişmeler"	"sosyalizm mücadelesi açısından çok derin"
"s"	"S-ADABPZ-0125-631"	"ülkelerdi. Amerika çökmüştü, Avrupa çökmüştü,"	"gelişen"	"gelişmekte olan ülkeler krizdeyse ve"
"w"	"W-ME05A1B-3910-297"	"ülkelerde politik yerelleşmenin daha çabuk"	"geliştiği"	"sonucuna varmışlardır. Bu ülkelerde yüksek"
"w"	"W-RI27D1B-2469-1465"	"ülkelerde genellikle alt sosyo-ekonomik kesimlerde,"	"gelişmekte"	"olan ülkelerde ise üst kesimlerde"
"w"	"W-PD02A1B-4549-2011"	"ülkeler için de geçerli olan;"	"gelişmiş"	"ülkelere özellikle de Amerika’daki Amerika’daki"
"s"	"S-ADABPZ-0125-630"	"ülkeler demek ki. Şimdi o"	"gelişen"	"pazarda biz Çin'e ne satıcaz,"
"s"	"S-ACABQq-0423-17"	"ülkede ""bölge eğitim hastaneleri"" kavramını"	"geliştirmeyi"	"düşünüyoruz. Örnek vermek gerekirse, Samsun'da,"
"w"	"W-VC01A1A-2709-487"	"ülke, bu uygulamanın tanıtım ve"	"geliştirilmiş"	"yaptırım prosedürlerini içeren bir önlemler"
"w"	"W-TD18E1C-4079-2235"	"ülke sathında yaygınlaştırarak rekabet gücümüzü"	"geliştirmek"	"ve sosyal refahı artırarak tabana"
"w"	"W-LE05A1B-3680-1134"	"ülke içinde yaşanabilecek milliyetçilik yönündeki"	"gelişmeleri"	"tam anlamıyla kestirmek mümkün değil."
"w"	"W-MF10A2A-1862-2016"	"ücretlerinde düşüş de muhtemel bir"	"gelişmedir."	"Böyle bir durumda işsizlik artışının"
"s"	"S-AEABI^-0330-191"	"Öğretmenlikten yetişmedir. Kendisini geliştiren, alanında"	"geliştiren"	"insanlar müdür olur. Ancak günümüz"
"w"	"W-ND39E1B-3298-398"	"öğretmen ve eğitmenlerinin beceri düzeylerini"	"geliştirmek"	"için müfredat, eğitim materyali ve"
"w"	"W-PD02A2A-2046-583"	"öğretmen kesiminin okulda demokratik yaşamın"	"geliştirilmesi"	"açısından güçlendirilmesi gereği ortaya çıkmaktadır."
"s"	"S-ACAAQq-0419-495"	"öğretmen açığının kapatılması konusunda önemli"	"gelişmeler"	"sağlanmıştır. Bu bağlamda çıkarılan bir"
"s"	"S-ADABPZ-0112-185"	"öğretmek emm kollarını geliştirerek, kollarını"	"geliştirerek"	"kullanmasını öğretmek aynı şekilde bacak"
"w"	"W-PD05A2A-2042-2123"	"öğretim çağındaki orta öğretim sistemini"	"geliştirdiniz,"	"bunların hepsini orta öğretim mezunu"
"w"	"W-UD02A1B-4615-1195"	"Öğrenme Konsorsiyumu), öğrenim teknolojileri standartları"	"geliştiren"	"ve bir Avrupa Kurulu olan"
"w"	"W-ND39E1B-3298-766"	"öğrenirler. Logo birçok mantıksal beceriyi"	"geliştirir,"	"hata yaptığımızda bizi uygun dönütler"
"w"	"W-MD39E1B-3360-1059"	"öğrenildiği, buna bağlı olarak kişiliğin"	"geliştiği"	"ve toplumsal değerlerin özümsendiği çok"
"w"	"W-TF10A2A-1903-13"	"öğrenen, eğitimli, ülkedeki ve dünyadaki"	"gelişmelerden"	"haberdar"" bireylerden oluşturacaktır. İnsanlar her"
"w"	"W-MI31D1B-2427-1315"	"öğreneceğini, hem de antrenörlük bilgilerini"	"geliştireceğini"	"söyledi. Büyük hedefleri olduğunu söyleyen"
"w"	"W-VI13F1D-4853-1486"	"öğrenebilmek. Norveç'de su ürünleri çok"	"gelişmiştir."	"Hatta tıptan bile yüksek düzeyde"
"w"	"W-RA16B2A-3329-1938"	"öğrendikten sonra herhalde bu şifreleri"	"geliştirmişlerdi."	"""Dağdakilerden"" bahsederken ""terörist"" diyenlerin devleti"
"w"	"W-UC05A2A-1467-1157"	"özgürlüğü veriyorsa çocuk sağlıklı biçimde"	"gelişir."	"Aileyi ilgilendiren kararlar alınırken çocuğun"
"w"	"W-ED02A3A-3011-1711"	"Özgürlüğü vb. kavram ve duyguların"	"gelişeceği"	"umulmuştur. Temeli özgürlük fikri olan"
"w"	"W-MF05A1B-4434-2491"	"özgürlüklerini ölçüt olarak kullanması, az"	"gelişmiş"	"ülkeleri bu değerleri ülkelerine taşımaya,"
"w"	"W-VG37E1B-3069-2322"	"özgür toplum istekleri başlamıştır. Bu"	"gelişmelerle"	"birlikte sosyal yapıdaki değişiklik sadece"
"w"	"W-TC01A4A-1403-780"	"özgü kavramlardan meydana gelmektedir. Beynimizi"	"geliştirmede"	"yararlanabileceğimiz bir başka imkanımızı ""eleştirel"
"w"	"W-TD02A2A-1912-774"	"özgü amaçlar, görevler ve sorunlar"	"geliştirirler."	"Söz konusu birimler, örgütün genel"
"w"	"W-ND39E1B-3298-339"	"özetlerken eğitim politikasının ne yönde"	"gelişeceğini"	"de belirlemiştir. Eğitime, milli eğitime"
"w"	"W-FF10A1A-1828-1271"	"özerkliği sorunu da, ülkedeki ekonomik"	"gelişmeyle"	"yakın bağlantısı bulunan bir konu"
"w"	"W-HC06A2A-2006-366"	"özelliğini düzeltir. Bitkilerin daha iyi"	"gelişmesini"	"sağlar. Az da olsa onların"
"w"	"W-HD02A1B-3816-450"	"özelliği taşıyan turistik bölgelerimizdeki kasabalarla,"	"gelişmemiş"	"yörelerimizdeki köy görünümünde olan kasabaların"
"s"	"S-AEABPZ-0331-130"	"özelliklerinin korunmasını ve daha da"	"geliştirilmesini"	"güvenceye alacak biçimde yükseltilmesi için"
"w"	"W-MF10A2A-1786-380"	"özellikle teknoloji transferi konusunda potansiyel"	"gelişmeleri"	"yavaşlatmaktadır. 4. TÜRKİYE'DEKİ GELİŞMELER BT'nin"
"w"	"W-LE39C3A-0454-2166"	"özellikle sanayileşmiş ülkelerden daha az"	"gelişmiş"	"ülkelere yönelik sermaye ve para"
"w"	"W-UD02A1A-2058-1008"	"özellikle kırsal alanda, tohum alanındaki"	"gelişmelerden"	"hiç de uzak olmadıkları dikkat"
"w"	"W-KE06A1B-3618-556"	"Özellikle bilgisayar ve iletişim teknolojilerindeki"	"gelişmeler"	"çeşitli düşünürlerce, insanlık tarihinde yeni"
"w"	"W-MF10A1A-1824-1012"	"özel sektör işletmelerinin yeteri kadar"	"geliştiği"	"söylenemez. Nuri Demirağ gibi ticaretten"
"w"	"W-RC01A2A-1353-199"	"Özbağışıklık denetlenmiş beyaz dişi hücrelerinin"	"gelişmesine"	"bağlı olabilir. Ya da saldırgan"
"w"	"W-LC06E1B-3086-2380"	"Öte yandan, fareler de bile"	"gelişmeyi"	"harekete geçiren etkenler tam olarak"
"w"	"W-KF10A3A-1767-1337"	"öte yandan da bu bölgelerdeki"	"gelişmeleri"	"yönlendirmeye çalışmaktadır. Bu ülke ile"
"w"	"W-TF10E1B-2871-701"	"Örneğin, imalattan kalite bölümüne, ürün"	"geliştirmeden"	"imalata, pazarlamadan satışa gibi... Bunun"
"w"	"W-TE05A1B-4244-906"	"örnek teşkil etmiştir. Sanayinin ikinci"	"gelişme"	"yönü ise tekstil alanında olmuştur."
"w"	"W-PG03A1B-2525-2054"	"örnek bireyin, yönetici sınıf tarafından"	"geliştirilmesi"	"gereğini savunmuştur. Bu anlamda yöneticinin"
"w"	"W-SI45F1D-4715-2435"	"örgütün başında kalan grup, yaşanan"	"gelişmeleri"	"bir beka sorunu olarak görmeye"
"w"	"W-QF05A1B-4671-1029"	"Örgütsel Bilgi Yaratma, Yeni Ürün"	"Geliştirme,"	"Araştırma ve Geliştirme Giriş Küreselleşmeyle"
"w"	"W-QF05A1B-4671-1699"	"örgütsel bilgi yaratma süreci çerçevesinde"	"geliştirdikleri"	"yeni ürün geliştirme modeli detaylı"
"w"	"W-PE39C0A-0249-503"	"öp"" diyerek yeni rejimi tanıdı."	"""Gelişmeleri"	"el altından tahrik etmek daha"
"w"	"W-UE36E1B-3357-446"	"önleyecek bir formülü öne çıkarıp"	"geliştirip,"	"bunu bir fırsat olarak algılamayıp"
"w"	"W-SB29D1B-2797-2018"	"önlenmesi ve tedavisi için yaklaşımlar"	"geliştirmek"	"mümkün olacaktır. Bu noktada plasentanın"
"w"	"W-NC06A1B-3888-2485"	"önlemektir. Meyve içinde uygun koşullarda"	"gelişmeye"	"hazır bir embriyo bulunur. Bunun,"
"w"	"W-EF10A3A-1840-2056"	"önerilerde bulunabilecek durumda olmak ve"	"gelişmeleri"	"takip etmektir. Öyle anlaşılıyor ki,"
"s"	"S-ACABTZ-0336-144"	"önemli. Daha sonra çeşitli standartların"	"geliştirilmesi,"	"atıkların denetim altına alınması ve"
"w"	"W-KF18E1C-4151-731"	"önemli ölçüde yavaşladığı görülmektedir. Bu"	"gelişmenin"	"en önemli nedeni, önceki bölümlerde"
"w"	"W-ID03A2A-0525-276"	"önemli sebeplerden bir tanesi araştırma"	"geliştirme"	"faaliyetlerine yoğun yatırım, yurt içi"
"w"	"W-PD03A1A-3346-1460"	"önemli olduğunu unutmayın. Kendi üslubunuzu"	"geliştirin."	"Haber çok gereklidir. Haber vermeyen"
"w"	"W-LF10A2A-1877-1926"	"önemli olan üç tanesi, teknolojik"	"gelişme,"	"üretim kaynakların geliştirilmesi ve fiyat"
"s"	"S-AAAAFZ-0383-330"	"önemli miktarda stratejik kültür bitkisi"	"gelişmiş"	"ülkelerde bioyakıt olarak <D 3>"
"w"	"W-FD02A2A-1166-1534"	"önemli etkisi ihracatçı sermaye şirketlerinin"	"gelişmesine"	"önayak olmasıdır. 1985 sonrasında vergi"
"w"	"W-JE05A2A-2610-1933"	"önemli bir hale getiriyordu. Proje"	"geliştirmek"	"fildişi kulelerde, içine kapanarak gerçekleştirilen"
"w"	"W-UD36E1B-2863-2282"	"önemli bir aktörüydü. Bu dönemde"	"gelişen"	"sakat hareketi; sakatlıkla ilgili sağlık"
"w"	"W-SD18E1C-4173-397"	"Önemli bilimsel araştırmalar, buluşlar, teknik"	"gelişmeler"	"ile bilime katkıda bulunmuş yerli"
"w"	"W-VE05A1B-4312-1264"	"önemini, Yunanistan sınırları içindeki alanın"	"gelişmek"	"için yeterli olduğunu anlatan mesajlar"
"w"	"W-SD05A1A-0747-893"	"önemine inandırılmalıdır. 2. Sınıf kitaplıkları"	"geliştirilerek"	"kitapla iç içe olmaları sağlanmalıdır."
"s"	"S-ADABAo-0366-332"	"önem verme sadece Avrupa'da olup"	"gelişmiş"	"bir mantık değil diye düşünmek"
"w"	"W-ED02A3A-3011-52"	"önem verileceğini ve Teknik Öğretimin"	"geliştirileceğim"	"rahatlıkla söyleyebilmiştir. Nitekim, 1946'ya kadar,"
"s"	"S-ACABQq-0423-422"	"önem veren, sorun çözücü, çağın"	"gelişmelerini"	"takip eden ve uyum gösteren,"
"w"	"W-QF10E1B-2868-763"	"önceden açılmış mağazaların yenilenmesi ve"	"geliştirilmesi"	"için yapıyoruz. Bu yılın sonuna"
"w"	"W-HB04A1A-1537-2111"	"önce toprağa karıştırılacak şekilde bir"	"gelişme"	"göstermelidir. Aynı şekilde kışlık ekimden"
"s"	"S-ADAA^o-0133-629"	"önce gökyüzüne uzanan ve sürekli"	"gelişen"	"yapısıyla yaşamın sembolüdür. Yapraklarının her"
"w"	"W-DD02A4A-1908-2025"	"önce gelen kamu bilinci, bireyliğin"	"gelişmesini"	"engellemiştir. Fakat, bu kamu bilinci,"
"w"	"W-UE36E1B-3356-2424"	"önce aritmetiğin, sonra matematiğin üzerinde"	"gelişeceği"	"tabanı da meydana getirmiştir. Bir'in"
"w"	"W-SC40E1B-2878-258"	"ömrü daha uzun dizüstü modelleri"	"geliştirilebilecek."	"Mevcut teknolojinin geniş kitleler için"
"w"	"W-IE02A1B-3546-400"	"ölümlerinin yüksek olduğu daha az"	"gelişmiş"	"ülkelerde ise 105-106 erkek bebek"
"w"	"W-DD02A1B-3536-900"	"ölçüt olarak kullanılan araç Kandiyoti'nin"	"geliştirdiği"	"Cinsiyet Rolleri ile İlgili Kalıp"
"w"	"W-DE05A3A-2689-2102"	"ölçüde düşürebilecek olan talihsiz bir"	"gelişmedir."	"c. Anayasa'da Siyasal Haklar (Geniş"
"w"	"W-JF05A1B-4398-1254"	"ölçüde aşılamamış olması ve özellikle"	"gelişmekte"	"olan ülkelerin aşırı finansal kaynak"
"w"	"W-IC05A2A-2044-1237"	"ölçmeye çalıştı. Gesell, 1960'lı yıllarda,"	"gelişmesinin"	"her aşamasında çocuğun ayrı (farklı)"
"s"	"S-ACAAQq-0419-197"	"ölçeğinde düşünen, dünya ölçeğinde kendini"	"geliştiren,"	"yeteneğine göre seçebilen, dünyayla rekabet"
"w"	"W-GH02A2A-0496-873"	"ölçeklerine benzer bir anket formu"	"geliştirmek"	"ve konuyu bu yolla detaylı"
"w"	"W-GD02A1B-3782-850"	"ölçekleridir. Testlerin ve tutum ölçeklerinin"	"geliştirilmesi"	"çalışmaları 1990-1991 öğretim yılında Ankara"
"w"	"W-PF10A2A-1849-326"	"ölçek ve kapsam ekonomisi olanaklarını"	"geliştiren,"	"riskin ve Ar-Ge maliyetlerinin paylaşımını"
"w"	"W-VI27D1B-2468-2357"	"öldü Çalışmalarıyla tıbbi görüntüleme cihazlarının"	"geliştirilmesine"	"önemli katkıda bulunan, dünyanın önde"
"w"	"W-IF18E1C-4145-832"	"Çıraklık, Mesleki ve Teknik Eğitimi"	"Geliştirme"	"ve Yaygınlaştırma Fonu kaynaklarını etkin"
"s"	"S-ADABPZ-0135-222"	"çıkıyor. Kendini tamamen özgürleştirme adına"	"geliştirebilir"	"emm işte güzel şeyleri yapabilir."
"s"	"S-ADABAo-0366-269"	"çıktı. Şunu söyleyebiliriz. Yine Batı'da"	"geliştiği"	"gibi tabi bu kültürel etkileşim"
"s"	"S-ADABPZ-0125-228"	"çıktı çalıştılar. Birlikte ortak aklı"	"geliştirdiler."	"Girişimcisi karar alıcısıyla birlikte kendi"
"w"	"W-FC06A3A-1058-1681"	"çıkarılmıştır. XX. yüzyılın son çeyreğinde"	"gelişen"	"çevre düşüncesi, çevre hakkı vb."
"w"	"W-OI22E1B-2908-669"	"çıkarsak? Bunlardan haberdar eden sistemler"	"geliştirmeyi"	"unutmayalım. Biz süper güç değiliz"
"w"	"W-UD03A3A-3310-1190"	"çıkarmayı, taklitlerle öğrenir ve bunları"	"geliştirir."	"Toplum, çocuğun başlangıçta sahip olduğu"
"w"	"W-GF10A1A-1842-1219"	"çıkarlarıyla Türkiye'nin çıkarları ters yönde"	"gelişmeğe"	"başladı. Çok elem verici, çok"
"w"	"W-ID02A2A-0640-1444"	"çıkarlarında değişikliklere tanık olmuştur. Bu"	"gelişmeler"	"Cumhuriyet dönemini de etkilemiştir. Cumhuriyet"
"s"	"S-ADABPZ-0125-290"	"çıkar alanlarından bahsediyorum. Bunların hiçbirisi"	"gelişmiş"	"ülkelerde ne yazık ki küreselleşme"
"s"	"S-ADAB]o-0193-447"	"çıkan sporcuları konuşacağız. Öncelikle sıcak"	"gelişmeleri"	"takip etmek adına Galatasaray-Olimpiyakos maçıyla"
"s"	"S-BEABXw-0391-10"	"çıkamazsın. O Japonlar bi alet"	"geliştirmişler"	"işte en güçlü sesleri hani"
"w"	"W-TE05A1B-4226-1809"	"çıkabilecek çeşitli karanlık ve istenmeyen"	"gelişmeler"	"olarak saptanmıştır. Görüldüğü üzere, Batı,"
"s"	"S-AEABUZ-0038-396"	"Çünkü yeni bilgi üretmek insanların"	"gelişmesi"	"için, çok çok önemlidir. Eğitim-öğretim"
"s"	"S-ADABPZ-0125-294"	"Çünkü fakirleşen ülkeler bu sefer"	"gelişmiş"	"ülkelerdi. Amerika çökmüştü, Avrupa çökmüştü,"
"w"	"W-OF10E1B-3063-1375"	"çözümler İşletmelerin ihtiyacına bağlı olarak"	"geliştirilecek"	"özel çözümler Mevcut bilgisayar altyapısını"
"w"	"W-DD02A1B-3533-1970"	"çözüme kavuşturulur; d. halkın insiyatifi"	"geliştirilir;"	"e. programlar halk tarafından kendi"
"w"	"W-FA16B2A-1369-1866"	"çöpe atılırlar. Gelişen olaylar ve"	"gelişemeyenler"	"Zühre'nin moralini sürekli bozar, epey"
"w"	"W-TE39C4A-0359-1568"	"Çölaşan yazısında istifa sinyali verdi."	"Gelişme"	"üzerine apar topar Ankara'ya giden"
"w"	"W-LD39E1B-2927-2095"	"çöküşü karşısında şaşkın haldedir. Anadolu'da"	"gelişen"	"ulusal direniş hareketi ise ülkenin"
"w"	"W-VE05A1B-4308-1021"	"çoğu ülke için öncelikli ekonomik"	"gelişme"	"alanlarından birini oluşturmaktadır. Öte yandan"
"w"	"W-IE05A2A-2048-309"	"çoğu hukuk sistemlerinde dikkat çeken"	"gelişme,"	"bazı istisnalar dışında sınırsız hukuk"
"s"	"S-AEABUZ-0038-311"	"çok önemli. Dünya'daki sosyo-ekonomik olarak"	"gelişmiş"	"üniversiteli ülkelere baktığımız zaman bunların"
"s"	"S-AEABPZ-0331-205"	"çok önemli bir projeydi. Turizmi"	"geliştirecek"	"Mersin'i turizm konusunda çok iyi"
"w"	"W-TE36E1B-3355-91"	"çok çocuklarımızı etkiliyor. Çünkü, yetişkinler"	"gelişmiş"	"bağışıklık sistemleri sayesinde bazı zararlı"
"w"	"W-LC06E1B-3086-1299"	"çok yeni olduğunun bir göstergesidir."	"Gelişmeyi"	"sürdürüyoruz. Bununla birlikte sorulması gereken"
