"Register"	"Text"	"Left"	"-5;5"	"Right"
"s"	"S-BEABXO-0444-1361"	"Sarışın ya, sarışın ya... <gülme>"	"Bakar"	"tabi bakar. Nedir bu sarışın"
"w"	"W-MA16B2A-0017-1440"	"Sarışın bir kanaryaya benziyordu. Saate"	"baktı."	"Garsonlar, ""Dokuz,"" dediler. Kalktı, kapıya"
"w"	"W-DA16B1A-1507-1405"	"sarsıp geçen şu tren gibi."	"Baktım"	"bir güzel aydınlıkta, yağmur sonrasındaki"
"w"	"W-TA16B4A-0910-1751"	"sarkıtmış oturuyorsunuz. Annenle baban birbirlerine"	"bakmadan"	"konuşuyorlar. Sen de bunu yapmaya"
"s"	"S-ADBBAo-0443-482"	"sapa gelmez bir şeyler yaşamadım."	"Bakalım"	"daha programın sonuna gelmedik belli"
"w"	"W-YI45F1C-5071-2128"	"sanırım. Saç ve makyaj stillerine"	"bakacak"	"olursak Latin hanımların hepsinin ne"
"w"	"W-MG24D1B-2314-1350"	"sanırsınız. Oysa biraz daha dikkatlice"	"bakarsanız,"	"aynadaki görüntünüzün size benzediği halde"
"s"	"S-AEABTZ-0040-2029"	"santral yapmalı mı, yapmamalı mı?"	"bakın"	"bu tercih hem ekonomik hem"
"s"	"S-AEABTZ-0040-1527"	"santral emm macerasının geçmişine bir"	"bakalım."	"76 yılında Akkuyu için yer"
"s"	"S-BEABXO-0007-2249"	"sanki öyle. Ben tek iyi"	"bakmadım."	"Şey benim benim benim derdim"
"s"	"S-BEABXO-0444-2132"	"sanki dimi bi ara. Hani"	"bakmayınca"	"artık. Bi baksanız gerçekten tanıdığınızı"
"w"	"W-OE09C2A-0411-2425"	"sandalyenin üstüne çıkıyorum, hepsine tepeden"	"bakıyorum."	"Yukarıdan bakınca her şeyi daha"
"w"	"W-HA16B4A-0979-1076"	"sandalyede oturan bir genç kadına"	"baktı-"	"kardeşimizin sallantılı küpelerinin bir benzerini"
"s"	"S-AEABUZ-0038-1965"	"sanayiyi başlatırlarken, sanayi toplumunu, şimdi"	"bakıyorsun"	"bilgisayarlar fabrikanın yerini yavaş yavaş"
"s"	"S-ADABLp-0061-29"	"Sanayi dersin, liman dersin. Yani"	"bakın"	"şunu söylemek istiyorum. Diğerlerini bitirim"
"w"	"W-PI09C2A-1320-2259"	"sana sabun büyüsü yapacağım, bak"	"bakalım"	"başına neler gelecek?"" diyor. Sonra"
"s"	"S-BEABXt-0414-1507"	"sana ne gösterecem? Bak ayıcık"	"bak."	"Aa! bak teyzenin oyuncağı bak."
"s"	"S-BEABXO-0080-1053"	"sana hemen buluyorum. Tamam bak"	"bakalım."	"<D 15> <B> almış lan"
"w"	"W-KA16B2A-0623-957"	"sana göre değil bu iş,"	"bak"	"benim halimi görüyorsun."" ""Yok, beni"
"s"	"S-BEABXO-0344-93"	"sana diğcektik aslında gir bi"	"bak"	"diye. Ama sonra göremezsin diye"
"s"	"S-BEABXO-0086-157"	"sana bakıyım yeter. Tamam dostum"	"bak."	"<B> Senin o güzel yüzünü"
"s"	"S-BEABXQ-0009-1431"	"sana baksam? <Gülme> Nolurdu? Beraber"	"bakışsak."	"Aliye bugün evi silip süpüryoruz"
"w"	"W-UA16B4A-0695-1095"	"sana bakmaya başlarlar. Sen de"	"bakarsın."	"Sonra bir punduna getirip tanışmak"
"s"	"S-BEABXn-0349-374"	"Samet sıra sana geldi. Anlat"	"bakıyım."	"İşte bende de bi. Sen"
"w"	"W-PI42E1B-2938-919"	"salât eyle!"" Ve ben, sana"	"bakıyorum,"	"""Vallâhi seni görmek, dünya ve"
"w"	"W-JA16B4A-1747-178"	"sallıyor Çıt. ""Kalmayacağım, şöyle bir"	"baktım!"""	"İhtiyar, Çıt'ın kaslı omuzlarına, gençlik"
"s"	"S-BEABXO-0348-930"	"salladım havaya uçtu ketçap! <gülerek>"	"Bak,"	"oraya düşmüş. Çok fazla girinti"
"s"	"S-BEABXu-0435-2389"	"salak bi kızım. Şu ele"	"bak"	"ele. Abarii! Ya çok iyi"
"s"	"S-BEABXl-0008-2082"	"Sakız. Yara bandı. <Gülme> Sakız."	"Bağarmadan"	"oğlum bağarmadan. Yok lazım değil"
"w"	"W-OI37C2A-0339-1103"	"saklandığı bölüm ve ayrıca, batıya"	"bakan"	"terasın yanında, Sultan İbrahim'in yaptırdığı"
"s"	"S-BEABXO-0449-1421"	"Sakin. Ama Yasemin şunun kafasına"	"bak."	"Bakma onlara şimdi bakma. Hayır,"
"w"	"W-EA16B2A-0448-1650"	"sakat kız, gözleri yumulu. Ona"	"bakarken"	"çobanın da gözleri kapanır gibi"
"s"	"S-BEABXO-0347-761"	"sahnesi, yok... Dört tane zaten."	"Bak"	"burayı Eylül hiç şey yapmıyorum."
"s"	"S-ADABAo-0318-1974"	"sahnesi hazırlıyorlar falan bi de"	"baktım"	"ki ben kenarda oturuyorum. Siz"
"w"	"W-SI45F2D-4906-1750"	"sahnelerde kendimi röntgenci gibi hissediyorum,"	"bakmamam"	"gereken mahrem bir şeye tanık"
"s"	"S-BEABXg-0070-679"	"sahiplerine benzermiş. Evet biliyodum. Şimdi"	"bak"	"bakalım o ilerde köpeğini gezdiren"
"s"	"S-ACABFZ-0049-1040"	"sahip olmadığı görülmüştür. Mazlum milletlere"	"baktığımız"	"zaman ise onların gerçekten de"
"s"	"S-ADAB^Z-0370-948"	"sahibi olmamızı mı sağlıcaz ona"	"bakalım."	"Önde bir arkadaşımız vardı aslında"
"w"	"W-PE39C0A-0249-112"	"saf tutanların (dinine, fikrine milliyetine"	"bakmaksızın)"	"birlik olma zamanı... Tarihi bir"
"s"	"S-BEABXc-0167-732"	"Sadece, ben galiba ben otobüse"	"bak"	"ha! Ben sadece böle kaldı."
"w"	"W-VI13F1D-4853-2308"	"sadece vahşi bir hayvan gözüyle"	"bakılmasına"	"rağmen köpek balıkları farklı özelliklere"
"w"	"W-CE37C3A-0633-157"	"sadece kitlelere ""sen kendi işine"	"bak,"	"bunlardan sana hayır gelmez"" diyenlerin"
"w"	"W-RI22C2A-0404-94"	"sadece görsel olarak karşısındaki erkeğe"	"bakmaz,"	"öyle olsaydı, vücut geliştirme yarışmaları"
"w"	"W-JI22C3A-0861-1695"	"sadece boş boş bakmakla yetinmiyorum..."	"Bakarken"	"gözlerimi de kısıyorum... Odama gelen"
"w"	"W-PI09C2A-1187-365"	"sabırsızlıkla reklamları beklerken bir de"	"baktım"	"ki Osman'la Show TV ekranlarındayız."
"s"	"S-BEABXO-0091-1873"	"sabah oldu işte haberlere bakarken"	"baktım"	"2-2 kalmış. Son dakkada yediler"
"s"	"S-BEABXO-0012-2211"	"sabah akşam yakalım. Anne dedi"	"bak,"	"bir ayda bitti. <B> Bi"
"w"	"W-SE20C0A-0238-343"	"saatlerim oluyor. Sonra bir de"	"bakıyorum"	"içimdeki o girift dünyanın, o"
"w"	"W-TE09C2A-1267-1584"	"saat sekiz-dokuz arası gelip işarete"	"bakacağız"	"ve her şey yolunda anlamında"
"s"	"S-BEABXw-0398-997"	"saat orda durduk. Kitaplara falan"	"baktık."	"Sohbet ettik. Daha sonra şeker"
"s"	"S-BEABXO-0345-13"	"Saat on iki oldu kalktım"	"baktım"	"yok. Mesaj çektim iki üç"
"w"	"W-HG37C3A-0598-176"	"S.R. Affedersin sör. Şu telefona"	"bakayım."	"(Telefon konuşması) A.G. Ha, neyse"
"s"	"S-BEABXO-0379-933"	"S diyo babana söyle kusura"	"bakmasın"""	"diyo ""konuşamadım ben"" diyo ""şaşırdım"
"w"	"W-RA16B0A-0151-2417"	"rüzgârda uçuşuyordu. İri gözleriyle etrafa"	"bakıyor,"	"beni görmüyordu. Sonradan kazağının bol"
"s"	"S-AEABUZ-0022-1844"	"röportajla sayılamaz çünkü sadece oturduk."	"Bak"	"dedi ben artık erkek diğilim."
"w"	"W-ID36C2A-0018-897"	"Ruşen, Kırat'ın dizginini çekip geriye"	"baktı"	"ki, bir sürü kara atlı"
"w"	"W-UA14B1A-1596-930"	"ruhunda gezginlik var... KEVIN Bak"	"bak"	"Bethy Bayan Angel siz de"
"w"	"W-RA14B3A-0553-381"	"Ruhlar mı? (GÜLEREK) Yok canım,"	"bakın"	"kapattım. Konuşan, cebimdeki radyomdu. ""Radyoyu"
"s"	"S-ACAAPZ-0328-2008"	"rollere sahiptir hemşireler. Kamusal düzeyde"	"baktığımızdaysa,"	"sigara ve alkol gibi vergilerle"
"s"	"S-AEABI^-0330-2109"	"riyakat denen olaya hiç kimse"	"bakmıyor."	"Riyakati olan insan idarecilik yapabilir."
"w"	"W-RA16B0A-0292-2066"	"rica ediyorum."" Nazır bıkkınlıkla, ""Söyle"	"bakalım"""	"dedi. ""Balkan Savaşı'nda teğmendim, Çanakkale'de"
"s"	"S-ACABQq-0426-1306"	"rica ediyorum. Yanlış söylüyor Sayın"	"Bakan."	"O zaman kadroya geçecek. Peki,"
"s"	"S-BEABXu-0435-2354"	"rezil etmesin dedim ben. Haydi"	"bakalım"	"gece on ikiden sonraki muhabbetlere"
"w"	"W-KA16B2A-0798-2257"	"Resimli olmayınca akılda kalmıyor da..."	"Bak"	"bak işçiler 1 Mayıs günü"
"s"	"S-ADABPZ-0119-1757"	"renkten olduğunu bulana kadar siz"	"bakıyorsunuz"	"ışık beyaz. <B> 7 tane"
"s"	"S-BEABXO-0056-588"	"renk? Ne renk mi? Hiç"	"bakmadım."	"Bergüzar Korel'inki pembeymiş. Pembe mi?"
"w"	"W-PA16B4A-0877-452"	"renk yok."" Kalktı, uzaklaşıp yeniden"	"baktı,"	"gülümsedi. ""Götüreyim de resim görsünler."""
"w"	"W-PA14B1A-4731-820"	"Rengarenk olsa Maviş Ne beyaza"	"bakılsa"	"Ne siyah horlansa Ne insanlar"
"w"	"W-NF05A1B-4446-1864"	"rekabeti olumsuz etkilemiştir. Genel olarak"	"bakıldığında"	"sektörde büyük bir kriz yaşanmaktadır."
"w"	"W-FD39C4A-0281-1094"	"rekabet anlayışı gelişirse demokrasi gelişiyor."	"Bakın,"	"Batı'da serbest piyasa olmayan demokrasi"
"s"	"S-ACABTZ-0336-2298"	"reaktörlerini kurduğu zaman öteki tarafa"	"baktılar."	"10 sene içersinde hepsi nükleer"
"s"	"S-ADABPZ-0112-2186"	"reaksiyonu ve o sese sıcak"	"bakması."	"Şimdi işitme kaybı olan bebek"
"w"	"W-MG24D1B-2285-1689"	"rastgeliyorlar, ona sesleniyorlar. ""E dur"	"bakalım"	"Tilki Baba!"" Tilki dineliyor. ""Bu"
"w"	"W-SI45F2D-4906-1544"	"Rapor tutun en azından, diye."	"Baktı"	"boş boş yüzüme ve ikna"
"s"	"S-ADABAo-0388-1264"	"Ramazan Bey'e her zaman imrenerek"	"bakardık."	"Her zaman meşgul ve dilleri"
"w"	"W-LA16B2A-0436-1320"	"rahmetli. Geçten geç açtı düşüncesini"	"'Bak"	"Zadik usta,' dedi, 'bilirsin bizler"
"w"	"W-GA16B3A-0794-1058"	"rahat koltuğun koluna önce çaydanlığa"	"baktım"	"sonra kızarmış ekmeğe, peynire ve"
"w"	"W-NA16B3A-0050-1916"	"Ragıp Beyin yüzüne üfleyerek ""Önüne"	"baksana"	"birader,"" deyince, sadece bu cümle"
"s"	"S-AEABTZ-0040-1233"	"radyasyon başka şey iyonlaştırıcı radyasyon"	"bak"	"X ışını elektro manyetik radyasyon"
"s"	"S-BEABXO-0122-2494"	"Rabia gibi değilsin demiş. Rabia"	"bak"	"oturaklı, akıllı hani annesi babasının"
"w"	"W-OF39C2A-1412-530"	"puan ile ödüllendirmektedir. Buraya kadar"	"bakıldığında,"	"herhangi bir sorun görülmemektedir. Ancak,"
"s"	"S-BEABXT-0066-1031"	"puan değil. Bu sen şimdi"	"bakıyorum"	"çocuk sınavdan çıktı böyle biraz"
"w"	"W-DA16B3A-1040-807"	"Pssst... Mösyö Bişo... Bi dakka"	"bakar"	"mısınız? Cidden İngiltere'yle savaşıcekseniz, size"
"w"	"W-SG03A0A-0168-435"	"psikoza ve onun dilsel belirlenimlerine"	"bakmak"	"zorundadır. 7. Psikanaliz Açısından Artaud'nun"
"w"	"W-UI39C4A-2639-2317"	"provokasyonun arkasındaki güçler olarak görülmektedir."	"""...Bakanlar"	"Anadolu'da sıkışan PKK'nın şehirlerde Alevi-Sünni"
"w"	"W-RI09C2A-0538-2476"	"provasını yapıyor, aynadan birbirimizle konuşuyoruz."	"""Bak"	"Simo"" dedim, ""smokin sıradan elbiseye"
"w"	"W-ZI45F1D-4824-1344"	"protesto eden Fenerlileri kınama gerekçesiydi."	"Bakın"	"şimdi, Dilmen'in sözleri ""3 Temmuz"
"s"	"S-ADABAo-0433-392"	"programın sonuna gelmişiz. Bu arada"	"bakalım,"	"benden sonra Lilit var ve"
"s"	"S-ACABQq-0425-2391"	"profilimize, vergi fotoğrafımıza, vergi çerçevemize"	"baktığımızda"	"karşımıza bu garip tablo çıkıyor."
"w"	"W-MG03A4A-0068-1621"	"profesörlerin önünde dururken bir de"	"bakıyorum"	"on yaşındayım. Ayaklarımda yılan derisi"
"s"	"S-ADABDp-0430-521"	"poziyona gelelim. <D 7> Şimdi"	"bak."	"<B> Önce sağına doğru. Arkadaşlar"
"w"	"W-HE39E1B-2836-2292"	"posun yerinde, sporu da seviyorsun."	"Bak,"	"sana anlattım. Profesyonel hakemlik gelecek,"
"w"	"W-RA16B4A-1296-63"	"poposuna bir şaplak atarak Hadi"	"bakalım"	"çabuk yatağı yap ve beni"
"w"	"W-JI09C0A-0275-298"	"polislere yalvaran da... Fakat işe"	"bakın"	"ki yalnız kaldığı nezarette mastürbasyon"
"w"	"W-CE09C3A-1055-854"	"polisi kadın Özkök'ün İsveç pasaportuna"	"bakmayacak,"	"ama benim Türk pasaportumla, onun"
"w"	"W-OA16B4A-0049-1941"	"Polis, saçlarını karıştırdı, önündeki kâğıtlara"	"baktı,"	"ne yapacağına karar vermeye çalıştıktan"
"s"	"S-BEABXO-0104-1498"	"polis olucam hatta... başkomiser Oo!"	"bak"	"başkomiser olucakmış Görkem. Sen ne"
"s"	"S-BEABXO-0344-189"	"podcasti araştırın not alın biraz"	"bakalım"	"neymiş ne değilmiş hoca araştırın"
"s"	"S-BEABXO-0344-2181"	"podcast'e baktın mı google'dan? Bak"	"bak"	"bi de iş yapar gibi"
"w"	"W-HF10A2A-1819-1162"	"PLÂNLAMA ile olanaklıdır. Bugünkü sonuca"	"baktığımızda,"	"K.Ö.Y.'lerin K.Ö.Y.'lerin ya da Bölgenin"
"w"	"W-CD02A1B-3499-158"	"Please. Çeviri metin Charles Kapıya"	"bakayım"	"mı? Jill (GD) Bakar mısın"
"s"	"S-AEABUZ-0022-1759"	"Play station <B> raıyn. Hepsini"	"bakın"	"birbirine eşit gidiyor. Emm... Çal"
"w"	"W-LH09C2A-0276-1193"	"planör"" dememle iyice sapıttı. ""Bak"	"bak,"	"hayvana bak, motorsuz uçak olur"
"w"	"W-SI45F2D-4906-1104"	"pişirmek ya da yoğurması elime"	"bakan"	"bir ekmek mayalamaktan başka bir"
"s"	"S-ADBBAo-0443-977"	"pişirdi herhalde. Birçok üretken insana"	"bakıyorum"	"geçmişleri çok büyük sıkıntılarla geçmiş."
"w"	"W-SG03C4A-3372-1681"	"pisi pisi... ANLATAN Bir de"	"baktım"	"bizim kül kedisi. (Kedi soldan"
"w"	"W-OG24D1B-2300-1417"	"Piper Perabo'ya şimdiden yıldız gözüyle"	"bakılıyor."	"Perabo, ""White Boys"", ""The Adventures"
"w"	"W-CI37C3A-0469-1856"	"peşimden geliyorsunuz?"" Adam kızın yüzüne"	"bakıp"	"diyor ki ""Öyle ya! Şimdi"
"s"	"S-BEABXO-0012-956"	"peynir yok ortada. <B> Haa,"	"bak"	"beyaz peynir yokmuş. Tabi, beyaz"
"w"	"W-SE39C3A-0543-1319"	"peydahladım bunu, bu bir garip"	"bakıyor."	"Yoğusam şeytan aleykümselam bu bedende"
"s"	"S-ACAAQq-0424-1155"	"petrol arzı olarak da rakama"	"bakarsak,"	"34 400 000 tonluk bir"
"s"	"S-BEABXW-0069-840"	"Perim bi tane. Hadi ya."	"Bak"	"senin için 2'lileri de per"
"w"	"W-OA16B3A-0737-2023"	"Perihan ne güzel, iyi iyi"	"bakıyor"	"yine. ""Su?"" ""Su yok. Suyumuz"
"w"	"W-DA16B4A-3349-2232"	"perdeleri büsbütün açtım ve bahçeye"	"baktım."	"Oradalar. Ablalarım. Ağacın altında oturuyorlar."
"s"	"S-ADBBAo-0443-988"	"perde arkasını da aktardı. Bir"	"bakıyor"	"babasının ölüm gecesinde özel bir"
"s"	"S-BEABXO-0378-924"	"pembeyi vereyim Emine diksin. Ver"	"bakalım."	"Azır şimdi gitmiyi fabrikaya. Şimdi"
"s"	"S-ADABLp-0062-46"	"Peki. İkisi arasındaki farklara bakalım."	"Bak"	"bu da büyükbaş di mi?"
"s"	"S-ADABLp-0061-1448"	"Peki, mükerrer birden fazla sayım"	"bak."	"Aynı adam 5-6 kere sayılabiliyodu."
"s"	"S-BEABXO-0093-1029"	"Peki saçlarımız nası uzar Nehir?"	"Bak,"	"bak… bak… Saçlarımız kök kısımlarından"
"w"	"W-CA16B4A-0988-2206"	"Peki ne olacak şimdi. Kusura"	"bakmayın"	"fakat eğer kağıtları bana getirmezseniz"
"w"	"W-TE09C2A-1267-1027"	"peki dedim tanımamazlığa gelip, hüviyetinize"	"bakar"	"kim olduğunuzu anlarız. Maksimov'u araçlarımızdan"
"s"	"S-BEABXO-0093-815"	"Peki burada başka ne var"	"bakalım"	"mı? Burda ne yazıyor okuyun."
"w"	"W-VI44F1D-5120-470"	"Pek birşey anlayamadığımdan mutfağa gidip"	"baktım."	"Koca bir karpuz diliminin içi"
"w"	"W-II36C3A-0596-240"	"pek bir eski moda... Dünyaya"	"bak,"	"oku ve düşün... Dar gelmiyor"
"w"	"W-HG41C1A-1181-1516"	"pazarlıyorlar. Kahramanlarımızı satıyorlar, beyinlerindeki kurşunlara"	"bakmadan..."	"Nazımı, Ernesto'yu, bizi tanımıyorlar. Sabrımızı"
"w"	"W-EA16B2A-0744-438"	"paylaşmak istemiyordu. ""Nerelerden dolaşarak geldiniz"	"bakayım?"""	"dedi Derya alaylı alaylı. Bahar"
"s"	"S-ADABAo-0355-1890"	"patladı, ya 18. yüzyıldan beri"	"bakılmıyo."	"18. Asırdan beri? Asırdan beri"
"s"	"S-BEABXO-0136-846"	"pastası mı? Evet. Hadi. Hadi"	"bakalım."	"Hadi bakalım. Hmm. Kesiyoruz pastamızı."
"w"	"W-QF25D1B-2161-330"	"pas geçtik, ama yeni gelişmelere"	"bakacağız."""	"Vergi barışına da erteleme istendi"
"w"	"W-CA16B3A-1282-2210"	"parçalarından hiçbir iz kalmayan kayalara"	"bakarken,"	"görüntünün ne güzel olduğunu söyleyip"
"s"	"S-ACABQq-0425-696"	"Partisinden sizin partinize geçenler Sayın"	"Bakan?!."	"Onlar konuşmuyorlar. Sizin icraatınız yok."
"w"	"W-ME39E1B-2898-1906"	"Partisi'nin siyasi açılımlarına bu gözle"	"bakmak"	"gerekir. Bizim açılımlarımızın üç temel"
"w"	"W-QA16B2A-1314-317"	"parmaklarıyla cevap verecek ""Nasıl, göster"	"bakayım?"""	"""Bak avucumun içinde, görüyor musun?"""
"w"	"W-KA16B4A-0147-746"	"parlayan bir yıldıza çevirmişti. Dikkatle"	"bakıldığında"	"göz çeperlerinde oluşan yaşların damla"
"w"	"W-HE39E1B-2836-1408"	"parlak değil ve siz dönüp"	"bakmak"	"istemiyorsunuz. Ve siz başarılı bir"
"s"	"S-ADABAo-0333-467"	"paravanı? Ama Nuri bayılmıştır. Nuri"	"bak"	"şimdi görüyon olayları şurda sevdiğin"
"w"	"W-RA16B4A-1074-1041"	"paraları kalmamıştı. Kendine, oğluna nasıl"	"bakacaktı?"	"Evdekiler ne olurdu? Zeynep günler,"
"s"	"S-BEABXO-0089-33"	"para veriyon diyon sen kendine"	"bak."	"Hem zarar. Her gün almıorum"
"w"	"W-OI22C3A-0691-1726"	"Papandreu'ya gösterilen ilgiye ve sevgiye"	"bakıp"	"her şeyin yarın sabah düzeleceğini"
"w"	"W-JA16B3A-0999-939"	"paketini çıkardı, bir sigara çekti,"	"baktı"	"tütünü akmış, kıvırıp attı. Her"
"s"	"S-BEABXO-0381-440"	"pa nerde bu kızanlar? Bakıyız"	"bakıyız"	"yok. Ama nasıl koca çukur"""
"w"	"W-JA16B4A-1747-1445"	"oğlum?"" Kalkıveriyor ayağa Maç. Çevresine"	"bakıyor,"	"kalabalıktan medet umarcasına. Ergenleşmemiş bir"
"s"	"S-BEABXs-0130-1412"	"oğlum o zaman. <gülme> Espriye"	"bak"	"ya. Lan oğlum git ya."
"s"	"S-BEABXW-0069-1886"	"Oğlum bunu önce diceksin ki"	"bak"	"Leyla al. İçinden bi hisse"
"w"	"W-RA16B2A-0629-1442"	"oğlu odasının kapısını açmış kendisine"	"bakıyordu."	"Pikabın sesi yüksek sayılırdı, bağırırsa"
"s"	"S-BEABXO-0093-2130"	"oyn… oyn… Aa! Nehir. Nehircim"	"bak"	"burada... Gargiu okuyorum. Japonya'yı tanıtıyorlar."
"w"	"W-TA16B3A-0450-1853"	"oynayan Okan'a söylenip duruyordu. Şuna"	"bak"	"şuna... Şu adamdaki tip bende"
"s"	"S-BEABXO-0093-1549"	"oynayalım Aa! Nehir, Nehir, Nehir"	"bak"	"sana burda ne gösterecem bitanem."
"s"	"S-BEABXO-0084-2150"	"oynayacam sen ne anlarsın iddaadan."	"Bakıyım"	"hangi maçlar? Bakıyım vallaha emm..."
"s"	"S-BEABXO-0149-1198"	"oynadı çıktı o masalara. Bak"	"bak"	"bak e mara içtin de"
"w"	"W-TI41C2A-1175-184"	"oturuyordum, kafamı kaldırıp sağa sola"	"baktım,"	"en azından birkaç kişi daha"
"s"	"S-BEABXO-0339-413"	"oturuyor? Tarık... Müşteri geldiğinde hiç"	"bakmıyor"	"bile. Kendi kafasına göre oturuyor."
"w"	"W-IA16B4A-0025-449"	"oturur, hem boş boş çevresine"	"bakar,"	"hem de hafifçe sallanır halde"
"s"	"S-BEABXO-0322-2359"	"oturmuş, şimdi böyle seni görünce"	"bakmıyo"	"bile yani o derece Şimdi"
"w"	"W-QA16B4A-0155-2310"	"oturmuş, gözlerini yola dikmiş öylece"	"bakarken"	"buldu. ""Bir derdin var senin"
"w"	"W-MA16B4A-0772-2040"	"Oturduğu kasa cızırtılar çıkarıyordu. Muhtara"	"baktı"	"""Geçen günkü olayı soracaksın, biliyorum."
"w"	"W-EA16B1A-0856-888"	"otur, canım... Bir çay iç..."	"Bak"	"ne güzel çocuk hırkaları geldi..."""
"w"	"W-VE09C3A-1051-2240"	"otobüs durağına yürüdüm. Bir de"	"baktım"	"cebimde para kalmamış."" ""Nasıl kalmamış?"""
"s"	"S-ADBBAo-0443-97"	"otelin önünden geçerken abime seslenerek"	"""Bak"	"Rıfat bizi ayıramadın"" demişler. Abim"
"w"	"W-HI13C2A-1939-508"	"Oteli'nin terasındayım. Boş gözlerle çevreme"	"bakıyorum."	"Nairobi Üniversitesi tam karşımda. Bir"
"w"	"W-MI22C3A-0508-2119"	"Osmanlıca-Türkçe Ansiklopedik Lügat adlı yapıtına"	"bakarken,"	"gökkuşağının Arapçada bir adı daha"
"w"	"W-}I22C1A-0428-589"	"ortaya çıktı ya siz ona"	"bakın"""	"diye cevap veren kurul başkanı"
"s"	"S-ADABPZ-0134-183"	"ortaya çıkartmak, sonra onun içine"	"bakmak"	"yapılmadığı dediğim budur. <B> Yani"
"w"	"W-VI19E1A-3989-694"	"Ortaya iki adam çıktı. Babam"	"Bak"	"Refik, dedi. Bunlar pehlivanlar. Pehlivanların"
"s"	"S-BEABXD-0446-231"	"ortasında. Evet yanlış yere yapmışlar"	"bak"	"burda...<B> burda...<B> Bu ne ya"
"w"	"W-HF10A2A-1876-566"	"ortalaması %29.2'dir. Vergi türleri itibariyle"	"bakıldığında"	"ise, 1980 sonrasında yapılan düzenlemelerde"
"s"	"S-BEABXW-0069-1275"	"ortadan çekiyo ben bakıyom o"	"bakıyo"	"millet bi koptu ondan sonra."
"w"	"W-IE39C0A-0193-2286"	"ortada görülen örgütlerin komünistlik iddialarına"	"bakarak,"	"marifeti solcuların karıştırdıklarını söylemeleri tam"
"s"	"S-ADBBAo-0443-2291"	"orta yaşlı bir adam. Dönüp"	"bakmışsın"	"adama ve adamı tanımamışsın. Adam"
"s"	"S-BEABXO-0094-1168"	"Ormana gitmiştik ya... Orda mı"	"bakıyoruz?"	"Nasıl? Havuzun içinde balık yok"
"s"	"S-BEABXO-0068-1707"	"orlarda ottum. Oğlum ne <B>"	"bak"	"öyle alıştı şimdi oğlum. Olsun"
"w"	"W-WI45F1D-4709-1714"	"orkestra şefine ""Huuop şefim!!! Bi"	"bakcan"	"mı? Ya benim kemanın telleri"
"s"	"S-AAAAFZ-0383-73"	"organizma düzeyinde incelendi. Şimdi aslında"	"bakarsanız"	"emm bitki biyolojisinin gelişim <D"
"w"	"W-MB04A3A-1260-1679"	"Ordu arasındaki dağların, çoğunlukla Karadeniz'e"	"bakan"	"yüzeylerinde, 900-1650 m yüksekliklerindedir. Ülkemizde,"
"s"	"S-ADABI^-0162-1729"	"order karşılığı kullanıyorum bunu ona"	"bakmadan"	"çok da fazla kuramsal olarak"
"s"	"S-BEABXw-0395-2188"	"orda. Oturuyoruz, yani bakışıyoruz mesela."	"Bakıyor,"	"çok iyi bakıyor böyle, gülümseyerek"
"w"	"W-LA14B1A-1623-1454"	"orda yaşa... Ne aptallık. Oysa"	"bakın"	"bana. Evim her zaman yanımda,"
"w"	"W-SA16B2A-0836-2440"	"orda ve o şekilde belirir."	"Bak,"	"her şey kendi mülkü olduğu"
"s"	"S-ADABLp-0061-913"	"orda oluşunu engelledi. Yer şekilleri."	"Bakın"	"yer şekilleri de etkiliyor. Arkadaşlarım"
"s"	"S-BEABXO-0455-518"	"Orda iki şeyin arasında durmuş"	"bak"	"görüyorsun iki tane. Verme lan"
"s"	"S-BEABXO-0325-314"	"orda duvara konuşmuşsun Yüzümüze bile"	"bakmadılar."	"Cık cık! Ayıp ya ayıp"
"s"	"S-BEABXs-0130-2241"	"orda askerler emm <B> giyiyorlar."	"Baktı"	"anladı tabi biz yeni askeriz"
"w"	"W-QE39C2A-1182-973"	"oraya misafir gelenler hep birlikte"	"baktılar"	"bana. Ve onların bakışında şu"
"w"	"W-NI09C3A-1445-2173"	"Oraya gidip geliyor. Akşamları sofrada"	"bakıyorum,"	"parmaklarında böyle lekeler var. ""Neden"
"s"	"S-BEABXO-0093-678"	"orası? Yengeçlerin... Yengeçlerin evi dimi,"	"bak"	"burada ne yazıyor. Ama o"
"s"	"S-BEABXO-0358-116"	"orası öyle, doğrudur. Bilmem ki!"	"Bakalım"	"artık. Kim bu, Bülent Arınç"
"w"	"W-KF18E1C-4151-440"	"oranında artmıştır. ABD doları bazında"	"bakılırsa"	"iç yükümlülüklerin yüzde 11.8 oranında"
"w"	"W-TF32D1B-2747-213"	"oranlarının değiştirilmesi için yasa gerekmiyor."	"Bakanlar"	"Kurulu'nun, oranları yüzde 1'e kadar"
"s"	"S-ACABQq-0423-1861"	"Oral, lütfen, müdahale etmeyiniz. Kardeşim,"	"bak"	"şimdi. O zaman, Rum kesiminin"
"w"	"W-TE30D1B-2134-707"	"operasyonlarına katılamayacağı"" şeklindeki kararı hatırlattı."	"Bakan"	"Gül, ""Alınmış kararlara uyulmasını bekliyoruz,"
"s"	"S-BEABXO-0379-596"	"op! Bi geliyo şey torunu"	"bakmış"	"ilaçlara. ""Dede"" demiş ""bunları kullandın"
"w"	"W-UA16B4A-1185-1493"	"Onun üzerine kapıyı yavaşça açtım,"	"baktım,"	"Ceren bilgisayarının başında, kıkırdıyor. ""Ceren,"
"s"	"S-BEABXO-0345-1679"	"Onun rengine göre de... Hah!"	"Bak"	"şu turuncu üstüne sarı daha"
"w"	"W-CI22C3A-1079-522"	"onun güzelliğinin savurganlığını yapmıyor... Aynaya"	"bakmaya"	"ödüm koparak, uyumaya çalışıyorum. TICINO"
"s"	"S-BEABXD-0446-78"	"onun dikkatini bi araya gelelim"	"bak"	"nasıl dağıtcam. Bence de dağalsın."
"w"	"W-OA16B3A-0043-2395"	"Onun bu oldubittisi canımı sıkmıştı."	"""Bakın"""	"dedim, ""pasta yiyecek halim yok."
"s"	"S-ADBBAo-0443-1411"	"onu? Onun adının Beyaz olduğuna"	"bakmayın."	"Hayatında griler, siyahlar ve beyazlar"
"s"	"S-BEABXy-0146-355"	"onu. İşte hocam yani şeye"	"bakcak"	"ya. Hatırlıyo musun rafta duran"
"w"	"W-RA16B2A-0675-429"	"onu. Buna rağmen şekeri severim"	"bakın."	"Zira onun ile köy bakkallarında"
"s"	"S-BEABXW-0069-1943"	"onu. <D 20> Dövecek seni"	"bak."	"Biterse öpecek bitmezse dövecek galiba."
"s"	"S-ADABAo-0433-832"	"onu çalıyım, emm, şöyle bi"	"bakalım"	"sevgili Eris yazmış. Zaten Türkçeyi"
"w"	"W-HA16B4A-1363-1557"	"onu ulu orta birbirlerine gösteriyorlar"	"""Bak"	"işte bir Türk"" diyorlar... Yahut"
"s"	"S-BEABXB-0073-2467"	"onu iki gün yaşıyacağımızı düşün."	"Bak"	"ben atanıyım seneye otellere gideriz"
"s"	"S-BEABXX-0411-1681"	"Onu görmedim. Ona da akşam"	"bakayım."	"Ama kaldır... ama onu ben"
"s"	"S-BEABXO-0344-1345"	"onu da. Ver. <gülerek> Şuna"	"bak"	"bi de bana bak diyo."
"s"	"S-BEABXO-0140-2230"	"onu bilmiyorum nasıl oluyo göster"	"bakalım"	"bi. Şunu şöyle yapıcaksın mayayı."
"s"	"S-BEABX{-0085-1420"	"onu biliyorum. Biz kız arkadaşımızı"	"bak"	"bundan bir ay önce kız"
"w"	"W-TE36E1B-3354-1559"	"Onların idolleri ne yaparsa, bir"	"bakıyorsunuz"	"önce gençler, ardından tüm dünya"
"w"	"W-TA16B1A-0835-2459"	"onları, dere suskun... Kızlar birbirlerine"	"bakarak"	"kıkırdamıyorlar. Vahide Hanım, yılların kurt"
"s"	"S-BEABXO-0074-896"	"onları getir buraya getir hadi"	"bak."	"Düğme de var burada bal"
"s"	"S-BEABXO-0449-2375"	"onlara şimdi bakma. Hayır, şimdi"	"bakmamalısın."	"Bu şey emm... Ne dicektim."
"s"	"S-BEABXw-0399-877"	"onlara yediririm sürprizi. <gülme> Olum"	"bak"	"Manga gelecek söyleyim. Hadise gelecek"
"s"	"S-BEABXW-0059-2014"	"Onlar size yüz veriyor mu"	"bakalım."	"Veriyo lan. Sağlam, sağlamlar haa."
"w"	"W-VI44F1D-4742-1152"	"ondan anca şimdi yazabiliyorum kusura"	"bakmayın"	"Gitmesin Gülben Ablam ah betülüm"
"s"	"S-BEABXO-0413-84"	"Onda herhangi bi hareketlilik yok."	"Bak"	"burada da bi şeyin üstüne"
"w"	"W-NE22C2A-0113-1961"	"onca yıllık çizgilerinize bir Eskimo'ya"	"bakar"	"gibi bakabiliyor musunuz? Veya evinizde,"
"s"	"S-ADABCo-0208-744"	"onbir gazeteciyle bir araya geldi."	"Bakan"	"Atalay konuşmaktan çok gazetecileri dinlemeyi"
"s"	"S-BEABXs-0130-82"	"ona sıktım diyor. Sonra şeylere"	"bakıyorlarmış"	"kovanlara bakıyorlarmış. İşte kaç tane"
"s"	"S-BEABXp-0156-522"	"Ona slang slang classification diye"	"bak."	"Yani biz de konuşmuştuk da"
"s"	"S-BEABXp-0156-113"	"ona mı bakıyım; türler arasında"	"bakabilirsin."	"İşte adam öyle bakıyo ya"
"s"	"S-BEABXX-0411-1311"	"ona hiç hiç de sevmedim."	"Bak"	"bu film daha güzel o"
"w"	"W-UA16B2A-1206-606"	"ona hiç alıcı gözle bakmamıştım."	"Bakınca"	"beğenmedim. O ne öyle odun"
"w"	"W-LE09C3A-1183-2211"	"ona hayranlıkla karışık tuhaf duygularla"	"bakmalarına"	"neden olan vecize şöyle diyordu"
