"Register"	"Text"	"Left"	"-5;5"	"Right"
"w"	"W-MA16B2A-0795-132"	"içinizde bir sanatçı yatıyor."" ""Hanfendi"	"bakın,"	"o ödül bana bir sanat"
"w"	"W-NA16B4A-1437-1266"	"içini sardı. Bir süre tavana"	"bakakaldı,"	"içi bira kokuyordu. Akşam sigarasının"
"w"	"W-RA16B0A-0151-1331"	"içine alan her acıyı dışlayarak"	"bakmak"	"aynaya. Tornavidalar oysun gerekirse gözümü,"
"w"	"W-HA14B1A-1699-649"	"içinden bir yüzük çıkarır, boncuk)"	"Bak"	"onun anısı. 2. İşçi alır,"
"w"	"W-KE05A1B-3625-2166"	"içindeki payı olduğu bu ortalamalara"	"bakılarak"	"bclirlcncbilmcktcdir. Benzer şekilde, her yapısal"
"w"	"W-HE39E1B-2836-1427"	"içinde çalışmaya başlar. Minya türlere"	"bakarak"	"yaptığı yeni aletleri koro çalışmalarında"
"w"	"W-DA14B1A-2668-1648"	"içinde sararıp solacaksın. Sevgilim bana"	"bak"	"ben ihtiyar ve soluk kocayı"
"s"	"S-BEABXw-0057-1668"	"içinde heralde. Çiçek, Çiçek! Efendim?"	"Baksana"	"bi. Hıı? Gelirler ya. Nereye"
"w"	"W-IA15B3A-0555-1746"	"içinde gülüyor. Fotoğrafa uzun uzun"	"bakıp"	"içini çektiği özlem krizlerinde kadın"
"w"	"W-TA16B0A-0093-1194"	"içinde belli belirsiz kıpırdayan denize"	"baktı."	"Bir arabaya biniyor Aycan. Dingin"
"w"	"W-DA16B2A-0863-1827"	"için. O hep benim sözüme"	"bakıyormuş,"	"geceleri ıssız yerlere bile çıkmış,"
"w"	"W-OA16B3A-0033-264"	"için. Dua eder gibi Handan'a"	"bakıyor"	"Behiye. Banyodan yen çıkmış Handan"
"s"	"S-BEABXO-0380-2122"	"için. Değil değil. Ee! em"	"bak"	"daa parladı bu. Bu bitti"
"w"	"W-LD02A1B-4494-2022"	"için, yaptıkları suçlara kadılar da"	"bakmaya"	"yetkili değildi. Av Görevlilerinin Kazançları"
"w"	"W-NA16B3A-0615-1311"	"için! Seninle sorunsuz yaşayabilmek için"	"bak"	"her şeyi şimdiden ayarladım."" Bu"
"s"	"S-AEABPZ-0331-477"	"için önemli. Bu tablonun tamamına"	"baktığımız"	"zaman Türkiye'nin Avrupa Birliği'ne uyumda"
"w"	"W-HA14B1A-1699-745"	"için çıkar. 2. İşçi uyanmıştır,"	"bakınır,"	"1. İşçinin gece çekip gittiğini"
"s"	"S-BEABXg-0088-1746"	"için yüksek maaş veriyo polislere."	"Baksana"	"astsubayları mesela polis yapıyorlar. Yani."
"s"	"S-ADABI\-0438-553"	"için vardı deterjanım. Buraya da"	"baktınız"	"ama. Evet baktım fiyatlara baktım"
"w"	"W-UI44F1D-4755-1016"	"için ultrasonda bakıldı ama buna"	"bakarak"	"bişey söyleyemem dedi dr hormon"
"w"	"W-JA16B4A-0875-1571"	"için soldu. Yüzünden geçen gölgeye"	"bakarak,"	"şakağındaki o noktanın kaşınmadığını, hareketinin"
"s"	"S-ADABI\-0438-792"	"için sevmiyorum. Yani can bebe"	"baktım"	"17.29 ve ıslak mendil hediyeli"
"w"	"W-CD09C2A-0207-310"	"için Sarı Avni'nin, döviz işlerine"	"bakan"	"ortağı Yaşar Kısacık ile birlikte"
"s"	"S-ADABIO-0437-88"	"için mi? Evet. Hiç düşünmedim"	"bak"	"onu hani çamaşır sulu şeyi"
"s"	"S-ACABTZ-0336-1766"	"için emm ipuçlarını geriye dönüp"	"baktığımızda"	"görebilecez. O açıdan bu sunum"
"s"	"S-ADABI\-0438-25"	"için dikkat etmedim. Şöyle bir"	"bakın"	"isterseniz metaryallere promosyona reyonlara şöyle"
"w"	"W-HA16B1A-1341-2407"	"için de? Ah mahcup çocuk!"""	"Bakarak"	"üzülmek Beyazı tartışabilmek Susuz mezesiz"
"s"	"S-AEABUZ-0038-502"	"için de ormanları kesiyorlar. Ormanlar"	"bakıyor"	"ki bu gidişle bitecek. O"
"w"	"W-LI22C4A-0783-2297"	"için dans sırasında herkes seyircilere"	"bakarken"	"diğerlerinin ayaklarına bakan adam. Hemen"
"s"	"S-BEABXz-0387-1518"	"için böyle bir sıcaklık var."	"Bak!"	"Evet. <gülme> Bak ben... Bak"
"w"	"W-TE36E1B-3295-1690"	"için Barzani ailesinin tarihine de"	"bakmak"	"gerekiyor. Tanınmış bir Kürt Nakşibendi"
"w"	"W-FA14B1A-1502-2393"	"içime sığmıyor... Şunu bir öğrenebilsem..."	"Bakalım,"	"Otacıbaşı bu giz'i çözebilecek mi?"
"w"	"W-SA16B0A-0132-1456"	"içi de kovuk olmalı!"" Beraberce"	"baktılar."	"Ağacın kovuğunun içine girdiler. Jocelyn,"
"w"	"W-MA16B1A-0128-2161"	"içeriye son bir kez daha"	"bakar"	"ve masanın üzerindeki birkaç yasak"
"w"	"W-IB04A3A-1904-821"	"içeriksiz, formel bir oyun gözüyle"	"bakmak"	"pek çok matematikçinin içine sindiremediği"
"w"	"W-GA16B2A-1924-1929"	"içeri"". Yes piliz bitte. Tut"	"bak"	"ayn, sıvay, dray oo olmadı"
"s"	"S-BEABXO-0104-2451"	"içerden bi tane kiyaat al."	"Bak"	"dur şimdi bi defter... Allaah"
"w"	"W-JI09C4A-1294-1218"	"iç. Gündüz başlama. Ayık ol,"	"bak"	"onlar senin ayağına kapanacak... Bostancı"
"w"	"W-VI19E1A-4019-1646"	"izlemiyor, yan sahada voleybol oynayanlara"	"bakıyordu"	"sık sık. Anlaşılan görevini yeterince"
"w"	"W-ZI45E1C-5072-1580"	"izlemez sıcak sıcak yazmayı planlıyorum."	"Bak"	"her yazının altına ""Pelin Gossip"
"s"	"S-ADABAo-0310-1004"	"izlemeye devam edicez. Ayso gıdaya"	"baktığımızda"	"kriz döneminde emm aslında krizden"
"s"	"S-ADABAo-0307-1211"	"izlediğimizde ağırlıklı olarak mali sektöre"	"bakıyoruz."	"Bizim emm İstanbul kıymetler borsası"
"s"	"S-BEABXO-0071-729"	"iyiyim dedi, sandalyeyi atıverdi kalktı."	"Bak"	"dedim görüyon hani kıprayamıyodun dedim."
"s"	"S-ADABAo-0382-58"	"iyiydim. Emm fakat bu dönem"	"baktığımızda"	"AB grubu emm daha ilgi"
"w"	"W-TI22E1B-2913-738"	"iyiydi, Abdullah'ın dünyasında. Onun hayata"	"baktığı"	"pencere nisan ayı gibiydi, gök"
"s"	"S-BEABXs-0130-1166"	"iyilikten dolayı çok kazık yedikte"	"bakalım"	"daha nereye kadar ben aslında"
"w"	"W-EA16B4A-0688-1328"	"iyilikse tabii! Mustafa ifadesiz bakışlarla"	"baktı"	"Aslıya. Göz gezdirdi şöyle bir"
"s"	"S-BEABXO-0440-117"	"iyice. Alex'i biraz sağa kaydır."	"Bak"	"onu şuraya al. Alex'i şuraya"
"w"	"W-SA16B2A-0738-728"	"iyice kuşkulanmıştı. Tam arkasına dönüp"	"bakacaktı"	"ki, o da merdaneyle tanıştı."
"s"	"S-BEABXO-0007-1728"	"iyi? Hayır. Ben diyorum ki"	"bak"	"biz burdan taksiye bindik özellikle"
"s"	"S-BEABXO-0149-984"	"iyi. Ama iphone'a benziyo. Telefona"	"bak."	"O da Seydamet'i babasından fazla"
"s"	"S-ADABCo-0242-816"	"iyi oynamış mı? Açın bi"	"bakın"""	"diyo. Eğitimle ilgili de çok"
"w"	"W-PI41C1A-1421-2004"	"iyi olacak gibi. Kendine iyi"	"bak..."""	"Banka kuyruğunda tanıştığım ve bir"
"s"	"S-BEABXT-0066-1937"	"iyi bir yer olur. Ama"	"bakıyosun"	"ne olabilir, ne olabilir? İşte"
"w"	"W-UA16B3A-0716-2247"	"iterek kafasını uzatıp asansör kuyusuna"	"baktı."	"Çavuş iki metre derinliğindeki kuyudan"
"s"	"S-ADABIA-0265-1627"	"istiyosunuz? bi anlamı olsun, çünkü"	"baktığınızda"	"ucu bi sürü yere gidiyo"
"s"	"S-ADABLp-0061-593"	"istiyorum. Diğerlerini bitirim ondan sonra."	"Bakın"	"tekrar ediyorum bunlar beşeri. Bazen"
"w"	"W-SI44F1D-5115-2466"	"istiyorum, nisbeten kolay bir tarif."	"bakmayın"	"öyle uzun göründüğüne etli, olgun"
"w"	"W-QA16B1A-1731-675"	"istiyorsan, yemek bitince spor salonuna"	"bakar"	"mısın? Ayakkabılarımı oraya bırakmışlar mı?"""
"s"	"S-AEABUZ-0038-1489"	"istiyorsan bi problemle mi karşılaştın?"	"Bakacaksın"	"daha geçmişte bu olmuş mu"
"s"	"S-ADABCo-0315-1983"	"istiyor ben doğum yaptım, çocuğuma"	"bakmak"	"için işe gidemedim. Parasız kaldım"
"w"	"W-QA16B3A-0829-1159"	"isterseniz onunla görüşün dedi. Numaraya"	"baktım"	"bu bizim kasabaya ait bir"
"s"	"S-BEABXO-0379-1576"	"isterse tutsun. Nası isterse öyle"	"baksın"	"gidicem artık dayanamıyum. Boğazım kuruyu."
"s"	"S-ADABAo-0368-831"	"isteriz. Yani şu an ben"	"baktığım"	"zaman keşke o insanlarla da"
"s"	"S-AEABTZ-0040-1092"	"isterim. Bi kere meseleye ordan"	"bakıcaksın."	"Ama bu dengeyi neyle kuracağıma"
"w"	"W-DA16B4A-0088-1214"	"istemenin ve istememenin ikiye bölünmüşlüğüyle"	"bakıyordum"	"ona. Onu şaşırtıp umutsuzluğa düşürüyordum."
"w"	"W-UE39C4A-0903-118"	"istemedi ve ""ben hiçbir haritaya"	"bakmayacağım"""	"dedi. Yani Türkiye o haritayı"
"w"	"W-JA16B2A-0873-149"	"istediğimi anlayacaksınız. Geçmişe ve geleceğe"	"bakınca"	"bütün bu farklı topluluklar farklı"
"s"	"S-AEAB]o-0017-1791"	"istedim. Ahmet <B> dedi ki"	"bakarız"	"düşünürüz dedi. Emm düşündü taşındı"
"w"	"W-LA16B2A-0009-812"	"istedi... Formum bozulmasın diye... Ağabeyisine"	"baktı."	"Onun müdahalesini anında önlemek için"
"w"	"W-LA16B4A-0148-1881"	"istedi. İçeri gitti. Aicha'nın durumuna"	"bakmak"	"için. Bir kaç dakika orada"
"w"	"W-EA16B2A-0684-1994"	"isimde bir sevgilisi vardı."" Yatağa"	"bakıyorum."	"İki kişilik. Çarşafları elliyorum. Vakitlice"
"s"	"S-ACABFZ-0049-1865"	"isim bulmak lazım. Bu açıdan"	"bakıldığında"	"""küreselleşme"" çok isabetle seçilmiş bir"
"w"	"W-ZI45E1C-5072-2209"	"ishal olmuş gibi ılık ılık"	"bakmazsan"	"da sevinirim Ritoş. Sarah Jessica"
"w"	"W-RI09C3A-0837-31"	"ise sadece ışıldayan gözlerle ona"	"bakıyordu,"	"tatlı bir tebessümle Ali'ye ""Her"
"w"	"W-NF25D1B-2157-292"	"ise kesinlikle vazgeçildiğini söyleyebilirim. Ancak"	"Bakan"	"Keçeciler'in dediği gibi öngörülen değil"
"w"	"W-FH03A1B-2384-1804"	"ise de, muhsan olup olmamasına"	"bakılmaksızın"	"zina eden erkeğe ve kadına,"
"w"	"W-SG37E1B-2926-1857"	"ipin hızına yetişmek için. Saatine"	"baktı."	"07.48. İp daha bir gerginleşti."
"s"	"S-BEABXO-0056-232"	"inşallah. Belki Pınar hamiledir. İnşallah!"	"Bak"	"benim falıma anne. <B> Anne"
"w"	"W-VA16B1A-1245-968"	"inşaatını görmeye gelmiş. Bir de"	"bakmış"	"ki inşaat önceki yavaşlıkta sürüyor."
"s"	"S-BEABXO-0075-1862"	"internetten adam benim baktığım şeylere"	"bakıyo"	"yani ben direk ağzından duymak"
"w"	"W-KA16B1A-1730-2321"	"internet bağlantısı için hazır. Fiyatına"	"baktım."	"Küçük bir sorunla karşı karşıyayım."
"s"	"S-ADABPZ-0134-2414"	"insanın varlığıyla ilgili. Biraz geriye"	"baktığınızda"	"aa bizim emm Aristo'dan beri"
"w"	"W-TE39E1B-3037-1039"	"insanın dünya hayatına dâima ümitle"	"bakabilmesi,"	"âhireti için ise havf ve"
"w"	"W-ME05A3A-0764-772"	"insanı yarım anlıyoruz biz. Maddesine"	"bakıyor,"	"manasını inkar ediyoruz veya manasına"
"w"	"W-JH37C2A-0654-1239"	"insanların, okullarını bitirdiklerinde geleceğe güvenle"	"bakamayan"	"gençlerin çokluğudur. Türkiye'de de bu"
"w"	"W-TI31D1B-2333-2495"	"insanların olaylara bakış açısıyla, yukarıdan"	"bakanların"	"bakış açısı aynı değil. Türk"
"w"	"W-KA16B4A-0886-1323"	"insanların baktığı her noktadan, insanlara"	"bakar"	"yani... Ahırlarda dolaşan yarı uykulu"
"s"	"S-ACABUZ-0035-1048"	"insanlara emm dini çerçeve içinden"	"bakmaya"	"alışmışlar. Tevfik Fikret ee beklide"
"s"	"S-BEABXs-0130-1711"	"insanlar. Genelde o konuşan adama"	"bakıyorlar."	"Yani şey yapmıyorlar. Şey yapıyor"
"s"	"S-BEABXw-0395-561"	"insanlar ne kadar beni, böyle"	"bakarsa..."	"Evet. Onun hoşuna gidiyor çünkü."
"s"	"S-ADABPZ-0374-2313"	"insanlar içindir yazar birinci cümlesi"	"bakın"	"Müslümanlar için değil, Türkler için"
"w"	"W-ME05A3A-0764-2419"	"insana bütün değerlerin yaratıcısı gözüyle"	"bakabilen"	"bir anlayıştır. Yani insanı kendisini"
"s"	"S-AAAAFZ-0383-1625"	"insan. Dediler ki o genlere"	"bakalım,"	"karşılaştıralım, ne iş yapıyor bu"
"s"	"S-ADBBI^-0042-728"	"insan çok üzülüyor diye... Fakat"	"bakan"	"olunca köpek aşkım depreşti. Dışişleri"
"w"	"W-VD02A1B-4625-1061"	"insan vardır ki, birisinin boyuna"	"bakıp"	"Asya’lı Asya’lı Asya’lı veya Afrika’lı"
"w"	"W-FH09C1A-0807-96"	"insan olsaydı, belki yeniden aynaya"	"bakarken;"	"karşısındaki hayaline gülümseyerek dudak bükebilirdi."
"s"	"S-BEABXO-0092-870"	"insan geliyor. Bir iki saat"	"baktığı"	"zaman o daha çok değere"
"w"	"W-HG37C3A-0598-45"	"insan figürleri ona doğru eğilip"	"bakıyorlar..."""	"""Odradek bu..."" diyorum, o çocukla"
"w"	"W-JA16B2A-0759-662"	"inerken bir hışırtıyla geriye dönüp"	"baktığımda"	"Viyana Lisesi'nin tavanarasına yakın pencerelerden"
"s"	"S-ADABAo-0308-1182"	"indirimiyle olucak mı olmıcak mı"	"bakıcaz"	"bunu takip edicez ama otomobil"
"w"	"W-UC29D1B-2436-1225"	"indirilmesi için çalışma yapıldığını açıkladı."	"Bakan"	"Yıldırım, internet erişimi üzerindeki vergilere"
"w"	"W-OH32D1B-2567-1710"	"inatla bütün fotoğraflara tek tek"	"bakıyorum."	"Devrim İçin Hareket Tiyatrosu'nun bu"
"s"	"S-BEABXO-0056-1722"	"inanyorum bak. Git Yılmaz'ın evine"	"bak."	"Hakan lan kız! Korktum. Korkma"
"s"	"S-BEABXO-0002-1664"	"imzalatmaya getirmiştim. Nilay inceliyordu. ""Bakın"	"bakın"	"ne yazmış"" dedi. Öğretmen... Anne"
"w"	"W-MG37C3A-0006-122"	"imgesi olarak belirir. Ayrıca, yakından"	"bakılacak"	"olursa, gençlik ve bilgi de"
"w"	"W-SI22E1B-2912-954"	"ilkbahar sabahında Açmışsın gözlerini Etrafa"	"bakıyorsun"	"Bir hayat bekliyor seni Her"
"s"	"S-ADAB^Z-0370-1620"	"ilk önce emm üniversite açısından"	"bakarız."	"Bu üniversite yönünden bakıyorum ben"
"w"	"W-KF10A2A-1795-1936"	"ilk kez 1971 yılında yapılan"	"Bakanlar"	"Konseyi toplantısında çevre konularını gündemine"
"s"	"S-ADABAo-0308-1972"	"ilk iki teşvik dönemindeki trendlere"	"bakarsanız"	"emm ilk teşvik konduğunda 15"
"w"	"W-VI44F1D-4747-779"	"ilk esnada midem küçülsün die.."	"bakalım"	"ben kaç kilo werebilcem. Bu"
"w"	"W-HA16B4A-0310-2013"	"ilk durduğum yerde durup aşağı"	"baktım."	"Adam görünmüyordu. Toprak yol bomboş,"
"s"	"S-ADABAo-0307-1239"	"ilk 6 ay sonu verilerine"	"baktığımız"	"zaman tüfenin yarısı kadar sigorta"
"w"	"W-UA16B3A-1132-1841"	"iliştiği Yazar sürekli olarak önüne"	"bakıyor,"	"masada bulduğu bir böceği inceler"
"w"	"W-GE05A2A-1075-261"	"ilişkinin bulunduğunu göstermiştir. Bu çerçevede"	"bakıldığında,"	"emek yoğun üretime ve görece"
"w"	"W-MD02A3A-3320-2474"	"ilişkileri bağlamında yer aldıkları habere"	"bakıldığında,"	"Türkiye gazetesinin %8'lik bir oranla"
"w"	"W-JD02A1B-3832-1658"	"ilgisini anlayabilmek için aşağıdaki şemalara"	"bakalım"	"(10a) ve (10b) arasındaki ilk"
"w"	"W-NE43C2A-1884-2235"	"ilginç geliyor. Tarihi gelişmesi içinde"	"baktığımızda"	"Müslüman fundamentalizmine, zaten kendi modern"
"s"	"S-BEABXp-0156-447"	"ilgili o sosyodilbilim kitaplarına yine"	"bakıp"	"nasıl olmuş... Evet. Yine neler"
"s"	"S-ADABAo-0433-1221"	"ilgili konuşalım, Eris yazmış şimdi"	"bak"	"ne diyor türk dil kurumunda"
"w"	"W-RI37C3A-0718-234"	"ilgili kendinizle konuşun. Gözlerinizin içine"	"bakın"	"ve konuşun. Uyandığınız andan itibaren"
"w"	"W-LF10A3A-1826-776"	"ilgili ihtiyaçlarına yardımcı olmak ve"	"Bakanlar"	"Kurulu veya yetki vereceği kurullarca"
"s"	"S-ACABQq-0425-350"	"iletilir, tutanaktan takip eder Sayın"	"Bakan."	"Şöyle söylemiştim Eğer malî politikalarında"
"s"	"S-ADBBI^-0326-223"	"ilerlerler ben hemen arkalarından söylerim,"	"""Bak"	"şimdi bunlar flört ediyor ya,"
"w"	"W-PE05A2A-1426-902"	"ile ülkelerin gelecekteki enerji politikalarına"	"bakıldığında,"	"dünyanın Ortadoğu, Rusya ile Orta"
"w"	"W-FG03A3A-2019-2352"	"ile türbesidir. Çinilerin hakim rengine"	"bakarak"	"bunlara Yeşil Camii ve Yeşil"
"w"	"W-ED02A3A-0594-1362"	"ile temas kuruldu. Fakat, Sayın"	"Bakan"	"ertesi gün yurt dışına hareket"
"w"	"W-OF05A2A-1349-377"	"ile tamamını geçmeyen borçlanmalar için"	"Bakanlar"	"Kurulu kararı ve Cumhurbaşkanı'nın onayı"
"w"	"W-UD02A2A-2649-2234"	"ile ilgili gözlemlere ve tespitlere"	"bakıldığında"	"Osmanlı ailesinde; çok kadınla evliliğin"
"w"	"W-KB04A3A-1259-2077"	"ile ilgili araştırmalara bir bakın"	"bakalım;"	"kaç bilim adamımız, sözgelimi Osmanlı"
"s"	"S-ACABQq-0423-2246"	"ile hükümeti karşı karşıya. Efendim,"	"bakınız,"	"birleşim devam ediyor. Hangi konuda"
"w"	"W-SD18E1C-4169-2254"	"ile birlikte toplam 5093 dosyaya"	"bakılmış"	"bunlardan 3609 dosya 2006 yılında"
"s"	"S-ADABLp-0061-1100"	"il Tunceli. Başka olay Türkiye'de,"	"bakın,"	"kent nüfusu 10.000'den fazla olan"
"w"	"W-QD36C3A-0075-756"	"il teşkilatından gerekli yardım alınmalıdır."	"Bakan,"	"ziyaret edeceği yere gelince arabadan"
"w"	"W-UA16B2A-1206-1622"	"ikramı, diye ısrar ettim. Getir"	"bakalım,"	"dedi. Bizim evde biri, bir"
"s"	"S-AEABTZ-0041-920"	"ikinci dönem geldiklerinde bir de"	"baktılar"	"ki, kendilerini ""ket"" diye okudukları"
"s"	"S-BAABXj-0001-2308"	"ikide işte üçe geçecek. Hocam"	"bakar"	"mısınız ya? <D 3> Ben"
"s"	"S-BEABXO-0389-1558"	"iki üç dört çiftim var."	"Bakayım"	"bir alternatif sunalım <B>. Alternatifin"
"w"	"W-TE09C2A-1267-1542"	"iki yanında bekleyen inzibat erlerine"	"bakıyordu."	"Hâkim Binbaşı Savaşkan diğer üyelerle"
"w"	"W-KD03A0A-0261-1288"	"iki tokat atıp ""Hadi bas"	"bakalım"	"buralardan"" derdim. Bu genç kadına"
"s"	"S-BEABXO-0006-2448"	"iki kere falan da. Bi"	"baktım"	"Kenan geldi ben banyoya giryorum."
"w"	"W-SH32D1B-2514-2492"	"iki hafta kala sergilenen telâşa"	"bakıp"	"""Abartmayalım"" diyen benim. TMSF'den ""Batan"
"w"	"W-VD05A2A-2602-180"	"ihtyiyacının ne olduğunu teşhis ederken"	"bakması"	"gereken en temel gösterge müşterinin"
"s"	"S-AEABUZ-0021-1101"	"ihtiyaçlarınızı karşılarsanız, bencil olun demiyorum"	"bakın"	"bakın o yanlış... <B> Bakın..."
"w"	"W-QF25D1B-2166-2272"	"ihracat artışı gibi göstergeler açısından"	"baktığımızda"	"ekonomik performansta bardağın yarısının dolu,"
"w"	"W-FA16B2A-0872-2007"	"ihmal etmiyordu. Doşo bile ona"	"bakmıyordu."	"İşyerinde her gün alınan gazeteleri,"
"w"	"W-FE39E1B-3025-471"	"ifade eder. Ülkemizdeki trafik nizamına"	"bakarak,"	"insanların birbirlerine karşı nasıl bir"
"w"	"W-GD39C2A-0283-872"	"iddiaları da müthiş. Bu açıdan"	"bakıldığında"	"şeriatçılık, iyi bir ""meslek"" olarak"
"w"	"W-LI35C4A-0464-1949"	"idare etme yolunu seçmişti. Koskoca"	"bakan,"	"bugünün başkan yardımcısı genel başkanı"
"w"	"W-TD30D1B-2231-1530"	"ibretle görmüştür ve kabullenememiştir."" dedi."	"Bakan"	"Çelik, Gül'ün ""hırsıyla hareket eden"
"w"	"W-YI45F1C-5071-287"	"ibne vampir olarak görüyorum bilmem."	"Bak"	"üzüldüm şimdi arkasından konuştuğum için."
"s"	"S-BEABXO-0441-1859"	"hııı atmış. Gel bakim yavrum."	"Bak."	"Gel Yeter. Anahtarlığın güzelliğine bak."
"s"	"S-BEABXO-0104-879"	"Hıı... bayrağın üstünde ne var?"	"Bak"	"bu bayramın bu bayramın süsü."
"s"	"S-BEABXO-0007-288"	"Hıı. Çevrendeki kölelere. <Gülerek> git"	"bakalım"	"bi elin ekmek tutsun. <D"
"s"	"S-BEABX\-0065-2118"	"Hıı. Hadi hayırlısı. Hayırlısı. İnşallah"	"bakam."	"İnşallah. Tuana naptı? Büyüdü mü?"
"s"	"S-BEABXO-0416-301"	"Hıı. Dört yüz üç aldılar."	"Bak"	"büyütmüşler. Mercedes dört yüz üç."
"s"	"S-BEABXO-0093-1899"	"Hıı. Bu kadar mı? Hayır."	"Bak."	"A, Ç, Ç, Ş mina"
"s"	"S-BEABXw-0408-2058"	"Hıı, ne konuşuyoduk? Seneye… Seneye…"	"Bak"	"önümüzdeki seneye şey yap sen"
"s"	"S-BEABXu-0435-322"	"Hıı sayılarını hatırlamıyorum ki. Sen"	"bak"	"yorumunu ona yaptırırsın sayıların şeyleri"
"s"	"S-BEABXO-0416-859"	"Hıı kolları hep kaşınmıştı. Bende"	"baktım"	"sağa sola göremedim, biraz oturdum"
"s"	"S-BEABXu-0442-905"	"Hıı evet <gülme> Bi de..."	"Baktı"	"öyle konuşacaktı niye ki kayıtta"
"s"	"S-BEABXn-0349-358"	"hızlı hızlı. Yoldakiler de bize"	"bakıyo."	"Elli kişi gidiyoz çünkü. Gittik."
"w"	"W-LA16B2A-0436-2341"	"Hızla geri döndü. Dılo beye"	"baktı."	"Tökezlendi, düzeldi, tekrar koştu. Öbür"
"w"	"W-QA14B1A-1631-1590"	"hırsız çetesini siz yönetiyorsunuz. Haydi"	"bakalım,"	"siz de yürüyün. Buna suçüstü"
"s"	"S-BEABXO-0104-638"	"Hıh? İrem de bekliyo. Emm..."	"Bak"	"orda kırmızı işte. Bak şurda"
"s"	"S-BEABXO-0136-1013"	"hı? Burda da var masa"	"bak."	"İster misin dışarı gitmek; yoksa"
"s"	"S-BEABXO-0140-1349"	"Hı-hıı. Hmm, peki hadi yap"	"bakalım"	"ben onu bilmiyorum nasıl oluyo"
"s"	"S-BEABXO-0455-2151"	"Hı-hıı. Gördüm Devenin üstündeki kuşuna"	"bak"	"allah aşkına. Yerin çok güzel."
"s"	"S-BEABXO-0448-2346"	"Hı-hıı. <D 5> Yılbaşı programlarına"	"bakıyorum."	"Ha karar verdiniz mi yılbaşında"
"s"	"S-BEABXO-0440-163"	"hı Apya, Apya demişti arkadaşım"	"baktı."	"Tamam ben bana Apya diyorsan"
"w"	"W-RD39C4A-2646-399"	"Hüseyin, ne kız bee? Sana"	"bakıyo"	"oğlum, asıl şuna. Yok, abi"
"w"	"W-DA16B4A-1493-629"	"hürriyetler, adaletler, müsavat, uhuvvet, halamıza"	"bakılırsa,"	"içi boş, kof sözlerdi ve"
"w"	"W-EE09C3A-3304-2436"	"Hükümeti var. Çalışma Bakanlığı MSP'de."	"Bakanın"	"bir müşaviri var. Son derece"
"s"	"S-ACABQq-0423-1277"	"hükümeti karşı karşıya gösterme. Şimdi,"	"bakınız,"	"Sayın Öymen'in bu ifadelerinin yanlış"
"s"	"S-ACABQq-0423-1860"	"hükümeti karşı karşıya gösterme. Şimdi,"	"bakınız,"	"Sayın Öymen'in bu ifadelerinin yanlış"
"w"	"W-NA16B4A-0040-1281"	"Hüdai. Şimdi bizi dinleyenler duysunlar"	"bakalım,"	"sen sayemde köşe mi döndün,"
"w"	"W-KA16B4A-0100-71"	"hâlâ aptalı oynamayı sürdüren Yıldırım,"	"""Bakın,"	"ne demek istediğinizi anlayamıyorum"" diye"
"w"	"W-TD36E1B-2844-1563"	"hâlin nice olurdu?"" demiyorlar mı?"	"Bakın"	"Irak Müzesi ve ülkenin tüm"
"s"	"S-ADAASK-0036-1713"	"Huzuruma gelip hesap vereceksiniz diyor"	"bak"	"her şeyinizden de haberim var,"
"w"	"W-KE05E1B-3299-1833"	"Humeyni'den korktular kaçtılar. Ondan sonra"	"baktılar"	"ki, Humeyni politik bir mevzudur."
"w"	"W-UD39C2A-2647-1140"	"hukukunda ""sedd-i zerayi"" prensibi açısından"	"baktığınızda;"	"insana haram olduğu gibi insanı"
"w"	"W-SE36E1B-3352-980"	"hukuksuzluğa yönelik tüm uygulamalara olumlu"	"bakan"	"toplumsal refleksin farkında olan başarılı"
"w"	"W-MH42E1B-2916-630"	"Hudri der ki Rasulullah'ın yüzüne"	"baktım."	"Her iki şakağında gümüş para"
"w"	"W-OA15B1A-1746-1066"	"Hoşça kal... İNCİNEN GURUR Pencereden"	"baktığımda"	"görüyorum Senin yüzün, incir yaprağında."
"s"	"S-AEABUZ-0022-2479"	"hoşnut olmadığını belirtmişken diyor. Cürete"	"bak."	"Bana bak diyor çelik sanayini"
"w"	"W-QA16B2A-1435-385"	"hoyrat rüzgârla birkaç kere çarpacak."	"""Bak"	"görüyor musun işte yaptığının neticesini?"
"s"	"S-ADABDp-0187-498"	"Hocam, en çok yapan benim."	"Bak,"	"Allattin konuşmasını bitirmeden sen başladın."
"s"	"S-BEABXp-0156-2321"	"hocam bi de emm deyimlere"	"bakabilirim"	"dedim işte baş body... Body"
"w"	"W-VI44F1D-4765-578"	"hocalar yer alabiliyor. Bu açıdan"	"bakınca"	"kürsü kürsü sorgulamak daha doğru"
"s"	"S-BEABXO-0454-2287"	"hoca geldi bi-iki kez yanıma"	"bakıyo"	"biliyon mu az buçuk huyunu"
"s"	"S-BEABXO-0093-1602"	"hmm. Kıskaçları iki. Kıskaçları iki."	"Bak"	"deniz kabukları! Deniz kabukları aman"
"s"	"S-BEABXO-0386-2083"	"Hmm. Ben bir tane tadına"	"bakarım."	"<B> Al al al anneciğim"
"s"	"S-AEABTZ-0337-315"	"hiçbir şeyim olmasa gidip çiçek"	"bakıyorum."	"Durmuyorum uyandıktan sonra. Baygınlıktan düşüp"
"w"	"W-JA16B3A-0774-1805"	"Hiçbir şey söylememişti annesine, öylece"	"bakmıştı"	"yüzüne. ""Eh bu gece artık"
"w"	"W-PG37E1B-2923-192"	"hiçbir şey kalmayacak. Şimdi bana"	"bakmanı"	"istiyorum; biliyorsun ya, maviyle beyazı"
"w"	"W-PI41C1A-1421-1201"	"hiçbir şey almadan uzun uzun"	"bakan"	"kadının arkasından) Abi sonra ağlamaya"
"s"	"S-BEABXc-0167-15"	"Hiçbi şi demiorum o zaman."	"Bak"	"seni gidi seni! <gülme> Bakarım"
"w"	"W-PA16B1A-1219-360"	"hiç! Gözlerini açıp kocaman kocaman"	"baktığı"	"zaman, çekinirdik hepimiz. Tatlı bir"
"w"	"W-JA14B1A-1622-1183"	"Hiç şekeri yoktu içemedim, kusura"	"bakmayın."	"CEVRİYE Kendisi sade içtiği için"
"w"	"W-OI22C3A-0691-893"	"hiç çalmayacak bir cep telefonuna"	"bakarak"	"sıkılıyorlardı. 12 milyonluk İstanbul'da yapayalnızdılar."
"s"	"S-ADABAo-0433-1030"	"hiç takılmadığım kelimeye takılıyorum. Söyle"	"bakıyım?"	"Hangisi o kelime? Program? Hayır."
"s"	"S-BEABXO-0449-244"	"hiç sallamıyosun? Yani ona da"	"bakıyosun"	"sonuçta o da senin köpeğin"
"s"	"S-AEABUZ-0038-391"	"hiç kimse kimsenin düşüncesini tarihe"	"bakarsak"	"zorla, baskıyla şey yapamıyor, baskı"
"w"	"W-SE09C1A-0534-1421"	"hiç istemiyordum. Gözlerim kapıya korkuyla"	"bakıyordu."	"Babam kapıdan görüldü ve Tevfik"
"s"	"S-ACABQq-0425-1589"	"hiç girmeyin; çünkü, bu konuda,"	"bakın,"	"Cumhuriyet Halk Partisine, hiçbir şekilde,"
"s"	"S-ADABI\-0438-1337"	"hiç bakmadınız? Yok bakmadım. Oraya"	"bakmama"	"sebebi nedir? İhtiyacım yok çünkü"
"s"	"S-ADABI\-0438-1796"	"hiç bakmadım. Sol tarafa hiç"	"bakmadınız?"	"Yok. Sağ tarafa baktınız. Orda"
"s"	"S-BEABXO-0084-1373"	"Hizmetçin miyim? Evet. Biliyosun senin"	"bakacağını"	"şimdi. Bakamam kusura bakma. Çok"
"s"	"S-BEABXL-0338-1485"	"Hizmetleri Meslek Yüksek Okulu. Burada,"	"bak"	"şimdi hani göstermiştim ya hani"
"s"	"S-ADABPZ-0374-432"	"hissetmemeniz görmemeniz mümkün değil. Çünkü"	"bakın"	"protokol imzalıyorsunuz diyorsunuzki tarihçiler komisyonu"
"w"	"W-QA16B4A-0299-1773"	"hissedebiliyordum, sanki öfke erimişti. Haydi"	"bakalım"	"Esin Hanım, dedim içimden, sen"
"w"	"W-NA16B2A-1242-2056"	"Hisar Hoca beni tebrik etmiş,"	"""Bak,"	"evlat,"" demişti. ""Demek ki, oluyormuş."
"s"	"S-ADABPZ-0119-348"	"hipotez kodlanmıştır. Şimdi anaerkil toplumda"	"baktığınız"	"zaman anne öğretisi çok önemli."
"w"	"W-NA16B2A-0051-185"	"Hikmet Bey, çıkınca neler yapacaksınız"	"bakalım?"	"Herhalde İstanbul'a döneceğim. Sör Clementine'in"
"w"	"W-RA16B2A-0406-906"	"hikaye olarak, ölmesine kesin gözüyle"	"bakılan,"	"ileri derecedeki kanser hastalarını nasıl"
"w"	"W-MA16B2A-0874-58"	"heyecanlar yaratan yarım yamalak, gizli"	"bakışmalar."	"Yasaklara karşı çıkma güdüsünü depreştiren"
"s"	"S-BEABXE-0082-1971"	"Heye. Duygu da öyle diyor"	"bak."	"Gir diyor çalış diyor özel"
"s"	"S-ACABQq-0425-351"	"herkesin mensup olduğu gelir düzeyine"	"bakılmaksızın,"	"aynı hizmeti alırken aynı oranda"
"w"	"W-MA16B4A-0772-55"	"herkes şaşkın, herkes korkuyla İbrahim'e"	"bakıyordu,"	"İbrahim kesik kesik herşeyi bize"
