"Register"	"Text"	"Left"	"-5;5"	"Right"
"w"	"W-SD02A1B-4598-649"	"“transit “transit turizmi”, turizmi”, önemini"	"korumaktadır."	"Hava ve deniz limanları ile"
"w"	"W-SE05A1B-4182-195"	"“eğer özne dış dünyaya karşı"	"korunma"	"adına güvenliğini tercih ediyorsa, özgürlüğünden"
"w"	"W-SE05A1B-4201-2335"	"“Bu Direktifte öngörülen veri tabanı"	"koruması,"	"veri tabanlarının içeriğine teşmil edilemez"
"w"	"W-KE39E1B-2839-130"	"şöyle açıklıyor ""Suçlular, her zaman"	"korumaya"	"çalıştığımız nefsimize ve mülkiyetimize karşı"
"w"	"W-JE39A3A-2945-454"	"şu öneriler, altmış yıldır geçerliliğini"	"korumaktadır"	"1. Halkı anlamak için kişisel"
"w"	"W-SC35C2A-1388-1303"	"şirket, zor durumda kaldığında, ayrıcalıklarını"	"koruyabilmek"	"için Tamiflu üretmeye karar veren"
"w"	"W-GE05A2A-1075-1736"	"Şimdilik, demokrasinin sınırlarının genişletilmesi veya"	"korunması"	"yönünde işçi hareketinin belirgin ve"
"s"	"S-BEABXO-0379-89"	"şimdi izliyoz ya ani ""melekler"	"korusun""da"	"korusun""da arcı marcı. Kim ne"
"w"	"W-EG37C3A-1152-497"	"şiir koyabilirsiniz, tereddüt payını da"	"koruyarak."	"Türkiye'de var olmayan bir şairi,"
"w"	"W-TE39E1B-3037-2143"	"şeylerden sakınan kimsenin dinini, ırzını"	"koruyabileceğini,"	"şübühâta düşen kimsenin ise, harama"
"w"	"W-NH13C2A-3330-2252"	"şeyler geleceğinden tedirgin olup onları"	"korumaya"	"çalışmıyor muyduk? Bir insana bağlanmak"
"s"	"S-BEABXW-0058-69"	"şeye türbülansa mürbülansa girer Allah"	"korusun."	"İyi sağ salim gelmişin. 12"
"w"	"W-SA14B1A-1586-1333"	"şeyden korkmana gerek yok, ben"	"korurum"	"seni. Sincap Teşekkür ederim. Tilki"
"s"	"S-ADABAo-0355-105"	"şey yaparlar müzeyi, dernekler çalışırlar,"	"korur"	"gardiyan olarak çalışır öle yani"
"w"	"W-JH37C2A-0654-309"	"şey olamaz. Sorun, Ulusal Kimliğimizin"	"Korunmasıdır!"	"Prof. İlhan Arsel, beşinci kez"
"w"	"W-PE39C4A-0183-624"	"şey değildir. Ülke çıkarları böyle"	"korunmaz,"	"ama ancak böyle satılır. Erdoğan,"
"w"	"W-KA16B1A-0700-1702"	"şey değil. Şöhretimi ve ismimi"	"korumak"	"zorundayım. Buradaki tiyatroda rolüm bu"
"w"	"W-FD05A4A-2607-1380"	"şerefle eşdeğer görülen ulusal paranın"	"korunması"	"da, dün vatana ihanetle eşanlamlı"
"w"	"W-ME09C4A-1026-55"	"şeref masasına yöneldiyse de yaklaşmasıyla"	"korumalar"	"tarafından ""get get"" diye geri"
"w"	"W-PE30D1B-2118-1579"	"şemsiye Bir Amerikan şirketi, yağmurdan"	"korumakla"	"kalmayan, ne zaman yağmur yağacağını"
"w"	"W-IE39E1B-2837-819"	"şekline almıştır. Tabiatıyla onun özünü"	"koruması"	"mümkün değildi. Tahrif edildiğinden bağrında"
"w"	"W-PF10A2A-1851-781"	"şekilde uygulanması sektörün rekabet düzeyinin"	"korunması"	"açısından önem arz etmektedir. Bir"
"w"	"W-ME39C5A-0196-342"	"şekilde uyardı. Türkiye Öcalan'ın Şam'da"	"korunmasını"	"ve buradan terör olaylarını yönetmesini"
"w"	"W-RB38E1B-2883-577"	"şaşırtıyor insanı. Fakat yaklaşınca, bu"	"korunmanın"	"bir şans olmadığı kolayca anlaşılıyor."
"s"	"S-BEABXO-0056-75"	"şaşıracaksın nasıl böyle değiştiğine. Allah"	"korusun!"	"Allah korusun. Bak. Allah şaşırtmasın."
"w"	"W-CE05A1B-3406-273"	"şart esas itibariyle çalışanların ve"	"korunmaya"	"muhtaç diğer bireylerin sosyal haklarını"
"w"	"W-UB38E1B-2886-205"	"şarbon gibi etkinliğini uzun süre"	"koruyabilen"	"kimi ajanlar için bu tedbirler"
"w"	"W-LC35C4A-0471-909"	"ışığa karşı gözü gereği gibi"	"koruyamazlar;"	"buna karşılık uzun kirpikler, fizik"
"w"	"W-RI22E1B-2911-1159"	"ışıktan ve yabancı maddelerle kirlenmekten"	"korunmuş"	"olur. Üstelik hiç çaba sarf"
"w"	"W-GE39C0A-0208-516"	"ıstırap verdiğini belirtiyor, yakınıyorlardı... Müsteşar"	"Korur,"	"öğrendiklerini satır satır Başbakan Menderes'e"
"s"	"S-BEABXO-0093-9"	"ıslanıyoruz. Islan... Tamam bizi ıslanmaktan"	"koruyorlar"	"başka? Üşüyoruz dimi? Üşümekten koruyorlar,"
"w"	"W-PB04A1A-1545-1572"	"ıslahından önemlisi mevcut su kaynaklarının"	"korunması"	"olmasına rağmen artan nüfus ve"
"s"	"S-BEABXO-0093-7"	"Üşüyoruz dimi? Üşümekten koruyorlar, soğuktan"	"koruyorlar."	"Evet. Peki. Gel. Evet. Peki"
"w"	"W-TE36E1B-3353-1594"	"üç yıldır Emniyet alabildiğine bizi"	"korumaya"	"çalışıyor. Ama ellerinde hiçbir yetki"
"w"	"W-KG03A1B-2415-1578"	"üzerine gelebilecek toz ve böceklerden"	"korumak"	"için örtülen örtünün ekmeğe değmesini"
"w"	"W-UH03A1B-3160-538"	"üzerinde bu kurum hep varlığını"	"korumuştur."	"Anadolu’da Anadolu’da Anadolu’da ahiliğin ortaya"
"s"	"S-ACABPA-0434-158"	"üyesi. Demek ki farklılıklar, yerellikler"	"korunarak,"	"bütünleşmeye doğru gelişme sağlanabiliyor. Türkiye"
"w"	"W-CA02A1B-3403-1715"	"üstün tutulmasıdır. Genel olarak sağlığın"	"korunması"	"esastır. Genellikle tıbbi müdahalenin geçerliliği"
"s"	"S-ADABAo-0388-224"	"üstün taraflarını ortaya koyarak onları"	"korumak istiyor."	"korumak istiyor. Burada Türkler'in iyi birer"
"w"	"W-SD18E1C-3378-984"	"ürünü olan sosyal güvenlik kurumlarının"	"korunması,"	"bu kurumlara katılımın yaygınlaştırılması, verilen"
"w"	"W-PF10A2A-1867-814"	"ürünlerine ilişkin mevzuat çerçevesinde veri"	"korunmasının"	"sağlandığı ve 2001 yılında TRIPS"
"w"	"W-SH03A1B-3152-1265"	"ürettiği, kendine akraba olan ve"	"koruduğu"	"şeye teslim olmaktadır. Dahası bu"
"w"	"W-CE05A3A-1274-423"	"üretkenlik enerjisi tahribedilmeden, emeğin hakkının"	"korunması"	"ve adil bir dağılımın sağlanmışıdır."
"w"	"W-HE39E1B-2836-914"	"üretimi arabaların özellikleri sadece çevreyi"	"korumakla"	"sınırlı değil. Dört kapılı ideal"
"w"	"W-MB04A3A-1261-496"	"üretim ilişkilerinin niteliği, ormanların, varlığının"	"korunması"	"ve verimli olarak işletilmesi, öncelikle"
"w"	"W-KE39E1B-2839-2050"	"üreticisi oluyorlar. Batmaz değil, ""Allah"	"korusun"""	"deyin İnanın Titanic'i yazmayı hiç"
"w"	"W-TD30D1B-2181-459"	"ÜRETEN EKONOMİ Türkiye'nin mali istikrarını"	"korumak,"	"güçlendirmek ve temellendirme ilkelerinden ödün"
"w"	"W-TI45F1D-4696-1940"	"üniversite laboratuvarlarında devlet sırrı gibi"	"korunuyor"	"halde. Söz konusu süre içinde"
"w"	"W-IE39C3A-1108-968"	"üniter hukuk ve devlet düzenini"	"korumak,"	"hem de aynı zamanda bireyin"
"s"	"S-ADABAo-0433-212"	"ülkeyi bir araya getiren değerleri"	"korumak"	"kollamak. Yani aslında hani Kurtuluş"
"w"	"W-ME39C5A-0196-471"	"ülkesinin topraklarını değil ama, iktidarını"	"korumak"	"için kullanmak zorunda bulunan Devlet"
"w"	"W-EE05A3A-2686-1901"	"ülkenin belli sınırlarını ve bölgelerini"	"korumaktan"	"kaçınamamasıdır."" İkincisi, milli güvenliğin, ulusun"
"w"	"W-GE05A2A-1075-768"	"ülkemizde işçi hareketinin, henüz, demokrasinin"	"korunması"	"ve gerçeklik kazanması açısından, Batı'da"
"w"	"W-NE30D1B-2104-585"	"ülkelerindeki Amerikan üs ve askerlerinin"	"korunacağı,"	"Washington'ın Balkanlar'dan asker çekmesi halinde"
"w"	"W-FD36E1B-2848-127"	"ülkelerin kültürel ve ideolojik ""tehditlerinden"""	"korunulması"	"tasarlanmıştı. Ki bu da, ASSC'deki"
"w"	"W-FF05A3A-2956-377"	"ülkelerin GELİŞMİŞ, SANAYİLEŞMİŞ ülkelere karşı"	"korunması"	"tartışılıyordu. Günümüzde ise korumacılık daha"
"w"	"W-ME05A1B-3920-476"	"ülkelerdekinden fazla olacaktır. Böylece, bu"	"korumanın"	"ülke ekonomisine yüklediği fazladan bir"
"w"	"W-PD05A3A-1094-1110"	"ülke üzerinde yerleşmiş olan insanların"	"korunmasını"	"ve devamını sağlar. Devlet bu"
"w"	"W-PD18E1C-4164-512"	"ülke bütünlüğü ile Devletin bağımsızlığının"	"korunması"	"gereğini benimsemelerine, gençlerde vatan, millet"
"w"	"W-EE09C3A-0597-403"	"öğretisindedir. Bununla birlikte, masonluğun geleneklerini"	"koruyan"	"merkezler kadınların mason localarına alınmasına"
"w"	"W-[I12F1D-4844-1341"	"öğretin ki onlarda doğayı nasıl"	"koruyacağını,"	"nasıl sahip çıkacağını öğrensin. Sizler"
"w"	"W-LD02A0A-1700-1498"	"öğretimde eğitim aracı olarak geçerliliğim"	"koruyor."	"Eğitim sistemimiz genç insanın ihtiyaçlarına"
"w"	"W-GD39C2A-0283-1566"	"öğelerinden biri olan laiklik ilkesini"	"koruyup"	"şeriatçı akımların önlenmesi amacıyla konulmuştur."
"w"	"W-SH42C4A-0495-1563"	"öğelerden biridir. Töre ve geleneklerini"	"korumayan"	"milletler, kısa zamanda tarih sahnesinde"
"w"	"W-TE39C4A-1397-413"	"özü budur; gazeteciyi işverene karşı"	"koruyan"	"hükümler içeriyor. Ancak, Babahan, yukarıda"
"w"	"W-SE20C0A-0238-2172"	"özgürlüğü kısıtlar. Ama bireysel özgürlüklerin"	"korunduğu"	"görev ve sorumlulukların zinciri altında"
"w"	"W-LA16B4A-0289-1098"	"özgürlüğü her ne kadar devlet"	"koruması"	"altında olsa da, toplama kampları"
"w"	"W-LD02A1A-0605-1360"	"özgürlükçü ortamlarda nasıl korunacağıdır ve"	"korumanın"	"gerçekleşmesi gereken asıl çerçeve üniversitenin"
"w"	"W-LD02A2A-1477-823"	"özgürlüklere yer veriyordu. Ancak, bunların"	"korunmasına"	"ilişkin düzenlemeler yine yoktu. Ayrıca,"
"w"	"W-QE30D1B-2107-1166"	"özgür uluslar topluluğunun ortak değerlerini"	"korumak"	"amacıyla yakın işbirliği yaptıklarını belirterek,"
"w"	"W-UC06A1B-4104-640"	"özelliği, ters polarite, kısa devre"	"korumalı"	"ve güçlendirilmiş gibi teknik özellikleri"
"w"	"W-SI22E1B-2912-941"	"Özellikle küçük, yaramaz canavarlardan itinayla"	"korunacak."	"Sağlam bir dostluğumuz var şimdi."
"w"	"W-NA16B4A-0040-1880"	"özel koruma veririm."" ""Koruma kimi"	"koruyabilmiş"	"ki? Amerikan Başkanı'nı bile koruyamadı."
"w"	"W-DD02A1B-3533-889"	"özel gerekseme kümelerinin b arındırılmaları,"	"korunmaları,"	"gözetilmeleri, esenlendirilmeleri, belde yaşamının onlara"
"w"	"W-TE36E1B-3295-337"	"Özel fotoğraflarla buyrun İsrailli yakın"	"korumaların"	"okuluna İsrail Başbakanı Ehud Olmert'in"
"w"	"W-JD03A3A-0897-774"	"özdeş olmadığı düşüncesi hâlâ varlığını"	"koruyordu."	"Gerçek yaşamda kadınlar kamusal rollerini"
"w"	"W-SA16B2A-0502-2414"	"öylesine bir inatla ve güçle"	"koruyor"	"ki zaman zaman buna çok"
"s"	"S-BEABXW-0058-238"	"öyle çok ayrıntılı konuşmamıştık. Allah"	"korudu"	"yani var ya yoksa. Ben"
"s"	"S-ADABPZ-0134-45"	"öyle bu aşkınlığı başka türlü"	"koruyamazsın."	"Demokrasiyi nasıl yöneltiyorsunuz? Efendim? Demokrasiyi"
"w"	"W-TI41C2A-1343-385"	"Öte yandan Satürn gerçekçilik anlayışınızı"	"koruyamadığınız"	"takdirde nasıl hayal kırıklığı yaşayabileceğinizi"
"w"	"W-KB04A2A-1573-1224"	"örneklerin çok iyi bir şekilde"	"korunması"	"gerekir. II. Dünya Savaşında B."
"w"	"W-SA16B4A-0047-1525"	"örgütü böyle bir zamanda birliğini"	"koruyamazsa,"	"ülkesi için nasıl çalışabilir' dedi."
"w"	"W-NE05A1B-3929-2029"	"örgütlerinin kuşatmasına karşı ancak polis"	"koruması"	"altında yapabilmiş oluşu, son derece"
"w"	"W-UD39C2A-2647-1654"	"önünde bulundurunca, her türlü kötülükleri"	"korunmuş"	"akıl, bu tür müstehcenlikten uzak"
"w"	"W-VI41C3A-1460-2148"	"önleyecek bir şey var mı?"	"Korunmadan"	"seks yaptıktan sonra oluşabilecek bir"
"w"	"W-UE36E1B-3296-1526"	"önler. Ancak gündelik yaşamda sınırları"	"koruyabilmek"	"çok daha zordur. Yabancılarla her"
"s"	"S-ADABLp-0062-108"	"önlenmesi. 8. Var olan meraların"	"korunup"	"iyileştirilmesi. Bakın meraları azaltmıcam arttırmıcam"
"w"	"W-OE07A0A-2038-2431"	"önlenmesi, sosyal adaletin sağlanması, çevrenin"	"korunması"	"gibi politikaları hangi araç ve"
"w"	"W-NF10A4A-1820-1537"	"önlenerek sosyal dayanışma ve istikrarın"	"korunmasına"	"katkı sağlanmış olur. Bütün bu"
"w"	"W-OE05A1B-4181-478"	"önlemleri karar bağlamadan önce, barışın"	"korunması"	"ya da yeniden sağlanması için"
"w"	"W-KG03A4A-2011-1734"	"önlemek... İşte o zaman işaret"	"""korunamaz"	"ki, öldürebilirsiniz."" SANAT YAPITI VE"
"w"	"W-NE05A1B-3958-752"	"önlemek, öte yandan basın özgürlüğünü"	"korumak"	"hususudur. Nitekim, süreli (dönemsel) yayınlarda"
"w"	"W-PD02A2A-1167-2421"	"önlemek, kamu düzen ve güvenini"	"korumak"	"için gereken tedbirleri alır, bu"
"w"	"W-FE02A1B-3463-1128"	"Önemli olan çevrenin sorun olmadan"	"korunması,"	"geliştirilmesi düşüncesidir. Bu nedenle sorunun"
"w"	"W-SB38E1B-2884-1813"	"önemi bakımından Tekke meşesi iyi"	"korunmuş"	"ve dev görünüme ulaşmış bir"
"w"	"W-PD18E1C-4164-607"	"önem, çocukların ihmal ve istismardan"	"korunma"	"yolları ile bu konularda yardım"
"w"	"W-RC01A3A-0696-168"	"önem verdikleri hastalarını bilgilendirmek ve"	"korumak"	"kaygısıyla gecelerini gündüzlerine katıp çalışıyorlarmış!"
"w"	"W-EC39E1B-3024-485"	"önem arzeder. Madenlerin bugüne kadar"	"korunarak"	"gelebilmeleri; onların çevre şartlarının jeolojik"
"w"	"W-LE30D1B-2082-854"	"öne sürüldü. Saldırıda, Ramazan'ın 2"	"korumasının"	"öldürüldüğü, 3 kişinin de yaralandığı"
"w"	"W-KD03A0A-0261-1133"	"öncelikle sadakat beklenmesi, kadının sürekli"	"korunmaya"	"muhtaç birisi olarak gören toplumsal"
"w"	"W-TG37E1B-3067-800"	"önce ışığa çıkartılmalı, sahiplenilmeli ve"	"korunmalı."	"Aizonai önemli bir tarihe ve"
"w"	"W-SE36E1B-3294-1939"	"önce Soner'e söyledim. Alaçatı rüzgârını"	"korumaya"	"çalışıyor Sörf merkezinde villa kavgası"
"w"	"W-GD02A3A-0556-784"	"önce kendi gücümüze dayanarak varlığımızı"	"koruyup"	"ulus ve ülkenin gerçek mutluluk"
"w"	"W-HE39E1B-2893-1213"	"önce geleneksel solda devrimci kimliğin"	"korunmasına"	"yönelik önemli çıkışlar olarak değerlendirdiğimiz"
"w"	"W-JD02A1B-3835-428"	"önce bireysel bilinçlerdeki özgün yeteneklerin"	"korunma"	"ve geliştirilmesi, onlara iyi alışkanlıkların"
"w"	"W-RE39C3A-0690-1236"	"ön almada zorlanacaklar, mevcut statülerini"	"korumada"	"çok ter dökeceklerdir... Çünkü karşılarında"
"w"	"W-RD36C3A-0076-926"	"ölüp giden Birinci Cumhuriyet modelini"	"korumaya"	"çalışıyor. Askeri anlayışın ve ona"
"w"	"W-PA16B4A-1475-957"	"Ölünceye değin dinini ve bedenini"	"korusun."""	"Selman'ın rengi solgundu. Bedeni iyice"
"w"	"W-GD05A2A-0427-1787"	"ölümünden sonraki elli yıl) için"	"korunurlar."	"Bundan sonra toplumun ortak kültür"
"w"	"W-CE04A1B-3404-1889"	"ÖLÇÜT SAPTAMA YOLLARI GİRİŞ Çevrenin"	"korunması,"	"uluslararası topluluğun önemli bir hedefi"
"w"	"W-JI37C3A-0091-666"	"ölçüde özgür bırakarak gerçekleştirebiliriz. Onu"	"koruyorum"	"diye dizimizin dibinden ayırmazsak, bu,"
"w"	"W-DD36E1B-2846-1966"	"ölçeğindeki ittifakların, genel dünya dengelerini"	"korumanın"	"birincil faktör olduğu ""geçmiş""te ""geçmiş""te"
"w"	"W-SI22E1B-2912-709"	"öldürmeyin zavallıları Aslan gitmek üzere"	"Korunmaya"	"alındı bile Süt içeriz inekten"
"w"	"W-OA16B2A-0800-1441"	"ödüllendirdi. Kendime, şehrin ruhsal dengesinin"	"korunmasında"	"önemli yer tutan bir karı"
"w"	"W-JF05A1B-4395-1026"	"ödemelerin Düzenlenmesi ve Çek Hamillerinin"	"Korunması"	"Hakkında Kanun hükümlerinin uygulanabilmesi için"
"w"	"W-OG24D1B-3361-2201"	"çıkıyor. Kitapta ""Keşke bu mozayik"	"korunup,"	"bir kültür zenginliği olarak varlığını"
"w"	"W-FD36C4A-0341-1308"	"çıktığı takdirde Amerika tarafsızlık siyasetini"	"koruyabilecek"	"mi? Olanak yok dedi. Olanak"
"w"	"W-VE39C2A-2700-735"	"çıkarıyor Anayasa Mahkemesi. Neden? Siyasetin"	"koruyamadığı"	"bir alanı yargı korumuştur. Siyaset"
"w"	"W-OH03A1B-2392-397"	"çıkarır, Bu devir hareketi hızım"	"koruduğu"	"sü­rece maddenin biçimi aym kalır."
"w"	"W-GF02A3A-0400-160"	"çıkarını aşağı yukarı eşit biçimde"	"koruyan,"	"büyük ölçüde Çevre için yeni"
"w"	"W-KF07A2A-1860-2408"	"çıkarılmış olsa da, sorun varlığını"	"korumaktadır."	"Elektrik üretimi bir mal üretimi"
"w"	"W-UE39C3A-1162-1019"	"çıkarlarını Lozan konferansında gereği şekilde"	"koruyamayacakları"	"tabii idi... Seha Meray ve"
"w"	"W-VI44F1D-4747-2476"	"çıkar kalp hastası olurlar Allah"	"korusun"	"o şekil dua etmeyin onları"
"w"	"W-VC40E1B-2881-1856"	"çünkü işletim sistemi için donanım"	"koruması"	"bir seçenek. Bunun için geliştiriciler"
"w"	"W-IC01C4A-0663-1866"	"çözüm bunları evinize hiç sokmamaktır."	"Korunma"	"döneminde aldığımız gıdalardaki vitamin ve"
"w"	"W-TA16B2A-0325-1641"	"çöküntüsü ile iç havza niteliğini"	"korumakla"	"beraber Akdeniz belirtileri de gösteren"
"w"	"W-QD36C0A-0222-297"	"çukurlarda güya kendini koruyor, aslında"	"koruyamıyor,"	"aksine ölüyor ve karşı tarafa"
"w"	"W-OF39C2A-1412-1412"	"çoğunda ana fikrin ""Mevcut müşterileri"	"korumak"	"yerine yeni müşteri kazanmak"" olduğu"
"w"	"W-JI37C3A-0091-3"	"çoğu kez bu baskıyla onu"	"koruyayım"	"derken, kişiliğini eziyoruz. Bu da"
"w"	"W-MA16B3A-0457-180"	"çoğu civan üyenin, insanlık onurunu"	"koruduğuna"	"inanılırdı. Çoğu dişin başlarındaki Başlığa"
"w"	"W-MA16B2A-0874-1513"	"çok şükür... Allah insanı müptezellikten"	"korusun"	"kızım... Müptezel... Annemin dudakları tiksintiyle"
"s"	"S-AAAAFZ-0383-141"	"çok önemlidir hücrelerdeki iyon dengesinin"	"korunması"	"için, membran potansiyelinin sağlanması için."
"w"	"W-MF05A1B-4436-1095"	"çok çeşitli döviz kullanarak da"	"korunabilmektedir."	"Döviz kurlarındaki değişmelerin olumsuz etkilerinden"
"w"	"W-RI22C0A-0279-2432"	"çok zor olmayışından. Doğa insanı"	"koruyup"	"kolluyor bir kere. Yiyecek bulmak"
"w"	"W-SI42E1B-2941-166"	"çok zarar gören ve ihtimamla"	"korunması"	"gereken, toplumun temeli sayılan bir"
"w"	"W-LD43A3A-1798-1007"	"çok komplike oldu. Doğal hayatı"	"korumak"	"ise en yenisi, kim kime"
"w"	"W-JE39E1B-2838-1193"	"çok iyi bilmektedir. Alışılmış nizamın"	"korunması"	"iktidarının devamı için şarttır; o"
"w"	"W-NA16B3A-0615-1274"	"çocuğu değiller, bakın okuldan kaçmışlar."	"Koruduğunuza"	"değmez!"" dedi. Hiç cevap vermedim."
"w"	"W-KA16B2A-0391-2389"	"Çocukların çizgiler arasında sıçrarken, kafalarını"	"korumak"	"ister gibi ellerini başları üzerine"
"w"	"W-JE39E1B-3029-1896"	"çocukların eğitimi ve yetiştirilmesi ve"	"korunması"	"konusunda orijinal araştırmaları ve tavsiyeleri"
"s"	"S-ADBBAo-0443-182"	"çocukların bakımını, hem de namusunuzu"	"korumanın"	"mücadelesini vermişsiniz. Hatta bazen evde"
"w"	"W-SA16B2A-1490-449"	"çocukları dinlerken ki yüz ifadesini"	"koruyarak"	"odanın içinde bir kaç tur"
"w"	"W-DE05A3A-2976-225"	"Çobanoğulları ailesinin Kastamonu'daki eski durumunu"	"korumuş"	"olmasıdır. Muzaffereddin Yavlak Arslan 1280-1291"
"w"	"W-TI42E1B-2942-221"	"çiğnemedikçe- kanlarını ve mallarını senden"	"korumuş"	"olurlar. Asıl hesapları(nı hesapları(nı görmek"
"w"	"W-SI22E1B-2912-1893"	"çiftlikler zaten benim mülkümdür, Onları"	"korumamak"	"tüm halkıma zulümdür. Hem size"
"w"	"W-OH42C0A-0319-1345"	"çeşitli hastalıklardan, belâ ve kazalardan"	"korunacaklarına"	"inanırlar. Hâlâ bazı nesneleri ""uğur"
"w"	"W-FE05A1A-2057-8"	"çeşitli eğilimler saptanabilir. Azınlıkların doğrudan"	"korunması"	"için genel bir azınlık düzenlenmesinin"
"w"	"W-NE30D1B-2084-2018"	"çeşitli bölgelerinde bulunan ABD askerlerinin"	"korunmasının"	"sağlanması açısından, Pentagon için halen"
"w"	"W-TA16B1A-1203-1040"	"çevredeki insanları sevdiğini ve onları"	"koruduğunu"	"sembolize eder. Bugün kullanılan uluslar"
"w"	"W-SB38E1B-2884-1854"	"çevre streslerine karşı bitki kökünün"	"korunmasına"	"yardım etmektedir. Mikoriza mantarları toprak"
"w"	"W-FC06A3A-1058-1929"	"çevre olarak tamamlanmaktadır. Tarihsel çevrenin"	"korunması"	"ise oldukça eskidir. Örneğin, Türkiye'de"
"w"	"W-SD02A2B-4594-1010"	"çevre değerlerinin turizm amaçlı kullanılması,"	"korunması"	"ve gelecek kuşaklara aktarılmasında etkin"
"w"	"W-UC29D1B-2445-2072"	"çevirdiğinizde harita yönünü otomatik olarak"	"koruyor."	"A-GPS ise, GSM şebekesinin yardımıyla"
"w"	"W-TD18E1C-4079-1434"	"çerçevesinde, su kaynaklarını kirlenmeye karşı"	"korumak"	"için, tüm sanayi ve belediyelere"
"w"	"W-DD02A1B-3548-922"	"çerçevesinde ele alınmıştır. Deneklerin tümünün"	"korunmaya"	"muhtaç çocuk sorununu yaşadığı bilinmektedir."
"w"	"W-ED02A3A-0594-1023"	"çerçevesinde Bakanlık adına da umudumu"	"korumak"	"istiyorum. Bu arada, resmi politika"
"w"	"W-MH03A1B-3134-2178"	"çerçevede hayatiyetini sürdürebilmesi, şahsiyetini oluşturup"	"koruyabilmesi,"	"toplumsal çerçevede de kültür ve"
"w"	"W-WI45F1D-4721-2280"	"çelişkili de gelse; hissedarların çıkarlarını"	"korumanın"	"en iyi yolu, müşterilerin çıkarlarına"
"w"	"W-FG03A1B-3189-1693"	"çelişik beklentileri olan bireylerden oluşur."	"Korumaya"	"karşı olanlar veya korumacı görünenler"
"w"	"W-TD09C4A-0211-74"	"çekinerek, oraya buraya sığınarak, sinerek,"	"korunarak"	"yapılmaz. O günkü konuşmanın son"
"s"	"S-ADABPZ-0134-119"	"çağda öznenin kendi özerklik alanlarının"	"korunmasının"	"koşulları da ortadan kalkmıştır. Özne"
"s"	"S-ADAB^o-0132-112"	"çağ yerleşimi, Anadolu'nun en iyi"	"korunmuş"	"metropolü, küçük antik tiyatrosu ve"
"w"	"W-KA16B2A-0391-1497"	"çatlaksız olarak taşıyamadığını gülümsemenin altında"	"korumaya"	"çalışarak bekliyorum. Bakışlarım Şadan'dan, giriş"
"w"	"W-MA16B3A-0655-1447"	"çalışıyordu... Bu bir saldırı olabilirdi,"	"korunmalıydı,"	"gözlerini yumdu zihninden uzaklardaki ışığı"
"w"	"W-IE05A2A-1910-567"	"çalışırken, öte yandan NATO'nun gücünün"	"korunması"	"için çaba harcayacaktır. Yeni Tehditler"
"w"	"W-TC40E1B-2879-227"	"çalıştırır. Ancak bellekler, içindeki verilerin"	"korunabilmesi"	"için sabit disklerden faklı olarak"
"w"	"W-VF07A2A-1857-1233"	"Çalışmaya göre, gerek kamu görevlilerini"	"koruyan"	"mevzuat, gerekse de idari yapılanmanın"
"s"	"S-ADABCo-0222-181"	"çalışmalarına atıfta bulunarak ""Milli birliğimizi"	"korumanın"	"gereklerini unutmamız lazım"" dedi. <ses"
"w"	"W-MF10A4A-1822-315"	"çalışmaları destekleyen ve olumsuz etkilerden"	"koruyan"	"dernek ve kuruluşlar. Ahlak ilkesi"
"w"	"W-SD18E1C-4169-2403"	"çalışmalarda bireyin hak ve özgürlüklerinin"	"korunması"	"ile toplum düzeni ve güvenliğinin"
"w"	"W-MH03A1B-3134-285"	"çalışma konuşunda da insanın değerini"	"koruyan"	"ve gözeten bir yaklaşım içindedir."
"w"	"W-QD02A3A-1429-1731"	"Çalışma hakkı çalışanın insanlık onurunu"	"korur"	"ve onu yaşayabilmek için başkalarının"
"w"	"W-LD43A3A-1798-1076"	"çalışanlar var. Ben tarihi çevre"	"korumakla"	"ilgili bir kişiyim. Arkadaşımız Şöhret"
"w"	"W-GA02A1B-3787-387"	"çalışan grup üyeleri, benimsenebilir kimliklerini"	"korumak"	"için farklı iki çıkara daha"
"w"	"W-OE09C2A-0411-531"	"çakacak gibi görünüyordu. Kendimi nasıl"	"korumam"	"gerektiğini düşündüm. Gardımı aldım, beklemeye"
"w"	"W-RA16B2A-1246-1091"	"çadırını bir köpek rahatlıkla bekleyip"	"koruyabilirdi."	"Bir de niye beyaz ve"
"w"	"W-KF25D1B-2150-137"	"çadır sayesinde binanın bütün karakterinin"	"korunacak"	"olması. Cam çadır, yanlardaki kaidelere"
"w"	"W-FE02A1B-3463-1252"	"çabalara karşın yüksek bir değeri"	"koruması,"	"nüfusun artması sonucu yerleşim alanlarının"
"w"	"W-TF10A2A-1902-1860"	"çabaladıkları ya da gelir düzeylerini"	"koruyabilmek"	"için daha fazla parasal geliri"
"s"	"S-ACABQq-0423-138"	"zorunlu şartlarından biri, kamu düzeninin"	"korunması,"	"bireylerin can ve mal güvenliğinin"
"w"	"W-KE18E1C-4150-1176"	"zorunlu olarak alınmak zorundadır. Ortakların"	"korunması"	"Şirketler kanununa göre, kim hisse"
"w"	"W-KE09C4A-0992-872"	"zorluklardı. Biz havada T.C. uçaklarından"	"korunurken,"	"yerde de PDK'lilerden kendimizi sakınıyorduk."
"w"	"W-GD39C3A-0736-565"	"zor koşullar altında ülke sınırlarını"	"korumanın"	"çabası içinde. Birkaç hafta önce"
"s"	"S-ADBBAo-0443-150"	"zor barıştırırım. Kadriye Hanım siz"	"korunmadan"	"çok çocuk yapmışsınız. Sabri Bey"
"w"	"W-UA16B2A-1248-1532"	"Zeynep, ""Yapmam, anneciğim,"" dedi. ""Allah"	"korusun."	"Bir de yangın çıkarsa ne"
"w"	"W-UA16B1A-3337-1232"	"Zeynep'in yumuşak, küçük ellerini soğuktan"	"korudukları"	"için, ne kadar mutlu olurlardı"
"w"	"W-LI22C4A-0741-9"	"zenginleşen yöntemler kullanıyorlar ama, temelde"	"korudukları,"	"sürekli gözettikleri iki ana davranış"
"w"	"W-HD02A2A-0765-619"	"zenginleşememiş ve hatta eski düzenlerini"	"koruyamayacak"	"hale gelmiş olan komşularını kendi"
"w"	"W-KA16B4A-0470-450"	"zaçlı, gök gözlü biriy zeni"	"goruycek!"""	"Ohh!.. San saçlı, mavi gözlü,"
"w"	"W-SI37E1B-3061-539"	"zayıflatır, tanımı tamamlanmadığı ölçüde gücünü"	"koruyan"	"bu kavram bireye dair hep"
"w"	"W-SH43C4A-1885-824"	"Zaten kul hakkı ve fıtratı"	"korumak"	"da İslami ilkelerdir. Sizce Türkiye,"
"w"	"W-IE39C2A-2619-1375"	"Zaten hem silah vermeleri ve"	"korumaları,"	"hem de öldürmeleri beklenemezdi. Gazete"
"w"	"W-JI22C2A-0797-2028"	"Zaten Allah'ın beni her zaman"	"koruduğu"	"ve sevdiğine inanmışımdır. Bu gözü"
"w"	"W-IF18E1C-4145-384"	"zararının tazmin edilmesi, çevresel tehlikelerden"	"korunması"	"ve tüketicilerin kendi kendilerini korumak"
"w"	"W-SD18E1C-4173-2352"	"Zararlılarla mücadelede fayda zarar dengesinin"	"korunması,"	"tarım ilaçlarının yanlış kullanımının çevreye"
"w"	"W-FE39E1B-3025-868"	"zannettiği şekilde onun iç güdüleriyle,"	"korunma"	"insiyakıyla ve üreme sevk-i tabiisiyle"
"w"	"W-KB04A3A-1259-2382"	"zamanları ve güçleri kalırsa ormanları"	"korumaya"	"çalışıyor. Yetkileri ve de araç-gereç"
"w"	"W-SI19E1A-4010-932"	"Zamanla, doğayı korumanın insanı da"	"korumak"	"olduğu bilincine ulaşır. Unutmayalım Hızla"
