"Register"	"Text"	"Left"	"-5;5"	"Right"
"w"	"W-SG37C4A-1392-948"	"diye yola çıktıklarında, karılarının namusunu"	"korumak"	"için demirden bekaret kemerleri takıp"
"w"	"W-OB29D1B-2439-767"	"diye sorabilirsiniz. Kulak kiri, kulağı"	"korumakla"	"görevli normal bir salgı olarak"
"w"	"W-LA16B4A-0173-499"	"diye düşünürken telefon çaldı. Tanrı'nın"	"korumasını"	"istediğim adamdı telefondaki. ""Şimdi gördün"
"w"	"W-EG37C2A-0562-2111"	"Dirliği'nin anlatıcısı romanın sonuna kadar"	"korur"	"bu ikili kimliğini. Sanki bu"
"w"	"W-SE05A1B-4201-812"	"Direktifte sui generis adı verilen"	"korumaya"	"tabi “orijinal “orijinal nitelikte olmayan”"
"w"	"W-UE36E1B-3358-2292"	"dinin devletten, devletin de dinden"	"korunmasına"	"yöneliktir. Bu tip seküler bir"
"w"	"W-LE09C2A-0896-94"	"dini inancın ya da cinsel"	"korunma"	"ihtiyacının gereği olmaktan çok (ya"
"w"	"W-KH03A1B-3127-359"	"din müntesiplerinin kendi dini inançlannı"	"korumak,"	"ama aym zamanda insanlann birbirine"
"w"	"W-TD03A1A-1516-2195"	"din hürriyetini, saygı duyulması ve"	"korunması"	"gereken temel bir kutsal değer"
"w"	"W-ED02A1B-3648-1720"	"din hürriyetini tekeffül eder (üstlenip"	"korur)"";"	"""Lâik hükümet tabirinden dinsizlik mânâsı"
"w"	"W-OE39C3A-2604-1770"	"dilinizi, dininizi, geleneklerinizi olduğu gibi"	"korumakta"	"özgürsünüz. Ayrıca Osmanlı'nın bütün haklarından"
"w"	"W-OH36C4A-0237-730"	"Dilini yabancı dillerin boyunduruğundan kurtarmak,"	"korumak"	"yolundan da biraz olsun Atatürk'ün"
"w"	"W-IE39E1B-2837-1226"	"Dil ve dilde milli benliğin"	"korunması"	"açısından STAR, SHOW, Eyçbiybiy vb."
"w"	"W-TE13C2A-1322-1832"	"dil hem ""destanı"" hem doğayı"	"korumak"	"için var. Bu dil hem"
"w"	"W-QI22C3A-0841-2045"	"dikti. Şimdi o Allah'ın bu"	"koruması"	"karşısında nasıl içten ve derin"
"w"	"W-UE30D0B-2102-191"	"dikkate alınmadığını kaydeden ITC, Türkmenlerin"	"korunması"	"için Irak ordusu içinde Türkmen"
"w"	"W-OD02A1B-4535-2365"	"dikkate alındığında, ülkeyi bölgedeki çıkarlarını"	"korumak"	"için alternatif savunma ittifakları yapmaya"
"s"	"S-ADABCo-0279-129"	"dikkat çeken UNESCO bu binaların"	"korunması"	"için hükümeti uyarıyor. UNESCO raporunda"
"w"	"W-PD18E1C-4164-878"	"dikkat etmesi, kaza ve tehlikelerden"	"korunabilmesi"	"yolunda bilgi kazanmasına, 7. Çocuğun"
"w"	"W-DE39C4A-0693-1531"	"dikiyoruz... ""Ormanı bekçi değil, sevgi"	"korur"""	"diye büyük panolar asıyoruz... Ormanlarımızı"
"w"	"W-TA16B2A-0325-1254"	"dikenli tellerle, sınırlarla, silahlı askerlerle"	"koruduğu"	"toprak parçalarından hiçbirine ait değil"
"w"	"W-HD09C2A-0440-331"	"dik tutacak, Misak-ı Milli sınırlarını"	"koruyacak"	"insanlardı. O zaman anladım ki,"
"w"	"W-VI44F1D-4747-1092"	"diet ben yaptım. Beni Allah"	"korudu"	"herkes benim kadar şanslı değildi."
"w"	"W-VA16B3A-1088-286"	"Diana'nın cevabını bekledi. Onun sessizliğini"	"koruması"	"üzerine, ""Biliyordum,"" dedi. ""Bu cevabı"
"w"	"W-JC06A3A-1958-2380"	"değiştirdiğinde sıra ve sütun koşulları"	"korunabilir."	"Örneğimizde x13=3, x14=7 ve x34=7'dir."
"w"	"W-NG43C2A-1805-2176"	"değişti ki. Bin yıllardır özelliğini"	"korumuş"	"olan doğa bile eski doğa"
"w"	"W-KF05A1B-4429-1993"	"değişmekle birlikte, küçük grup niteliğinin"	"korunması"	"amacıyla on ikiyi geçmemesine özen"
"w"	"W-KD36E1B-2853-894"	"değişmeden 16. yüzyılın ""eşitlikçi"" yapısını"	"korumuş,"	"bu yüzden ülkede topraksız köylü"
"w"	"W-KF25D1B-2139-212"	"değişiklik oluşmayacağını belirttiler. Yatırım önceliğini"	"koruyor"	"GB öncesi ve sonrasında yatırım"
"w"	"W-CC06E1B-3075-368"	"değişik gözlem şartlarında, kendi şeklini"	"koruyan"	"aynaları düzenleyip geliştirdiler. Bu aynalar,"
"w"	"W-RE30D1B-2099-548"	"değinilen haberde, Solana'nın ise iyimserliğini"	"koruyarak,"	"""Uzlaşma sağlanacak"" dediği belirtildi. La"
"w"	"W-IF18E1C-4145-2460"	"değildir. Yazılımla ilgili gerekli yasal"	"korumanın"	"ve sektöre özgü teşvikin temini"
"w"	"W-FE05A1A-2057-1004"	"değildir. Devletin ülkesinde yaşıyan azınlıkların"	"korunmasından"	"söz edilmektedir. Bu durum Medeni"
"w"	"W-GD02A1B-3768-1087"	"değil, üzerinde kaydedilmiş bulunan programın"	"korunmasını"	"talep etmektedir. Diğer taraftan, kanuna"
"w"	"W-NE39C0A-0215-1293"	"değil, toplumdaki tüm grupların çıkarlarını"	"korumanın"	"ve demokratik sosyal hukuk devleti"
"w"	"W-KE05A2A-2053-2423"	"değil, insanın kişi olarak onurunu"	"korumaktı."	"Kuvvetler ayrılığına ve birliğine dayanan"
"w"	"W-IH42A2A-1345-2384"	"değil, Duseldorf'a uçacağım"" diyememiş, böreği"	"korumaya"	"alıp Almanya'ya uçmuş. Oradan İstanbul"
"w"	"W-IF39C0A-0194-1211"	"Değil mi? Sanık Ahmet Salih"	"Korur"	"Tabii abone bedeli olamaz. Belki"
"w"	"W-RB29D1B-2442-36"	"değeri kazandıran özgün malzemelerin korunması,"	"korumada"	"temel yaklaşımdır ve farklı disiplinlerdeki"
"w"	"W-LC10A1A-2070-2320"	"değeri için toplanırsa aynı ilişki"	"korunmuş"	"olur. Bu durumda eşitlik aşağıdaki"
"s"	"S-ADAB^A-0317-198"	"değer veriyoruz. Ve eski eserleri"	"korumak"	"için bütün varlığımızla çalışyoruz. Bizim"
"w"	"W-RG37C1A-0844-723"	"Değer verene, elbette değer verilecekti."	"Korumaya"	"çalışan, korunacaktı. Seven, sevilecek; muhabbet"
"w"	"W-MI22C3A-0508-1818"	"değer ve kurallarla ve yasalarla"	"korunur."	"Akıllı insan, bireysel özgürlüklerinin sınırları"
"w"	"W-LC06A3A-1960-798"	"değer almıştır. Bunun nedeni, katodik"	"korumanın"	"anot yatağından zemin içine yayılan"
"w"	"W-TD18E1C-4079-1932"	"devletimizin bekasını ve üniter yapımızın"	"korunmasını"	"en büyük öncelik olarak görmektedir."
"w"	"W-IE05A1B-3565-231"	"devletidir. Sosyal hukuk devleti güçsüzleri"	"koruyarak"	"gerçek eşitliği, yani sosyal adaleti"
"w"	"W-TD30D1B-2193-76"	"devleti, cumhuriyetin kurucu ilkeleri olarak"	"korunacak."	"AKP'nin benimsediği ve mutlaka korunması"
"w"	"W-VI39C3A-0869-874"	"devleti hem de devleti yönetenleri"	"korumak"	"için kulaklarını açık tutuyorlardı. Pek"
"w"	"W-UD02A2A-1404-268"	"devlete karşı özerk var oluşunu"	"korumak"	"liberalizmin vazgeçilmezidir. Ama liberalizm aynı"
"w"	"W-LE05A1B-3671-2229"	"Devlet, İslam, din ve hukukunu"	"korur"	"yada uygularsa onun meşru olabileceğini"
"s"	"S-ACABFZ-0049-55"	"devlet, iktisaden zayıf durumda olanları"	"koruyacağım,"	"sosyal adaleti sağlayacağım, ekonomiye canlılık"
"w"	"W-SE39C3A-0205-934"	"devlet seçkinlerini etkileyerek milli kültürü"	"korumak"	"ve yüceltmekti. Atatürkçülüğü solun hegemonyasından"
"w"	"W-UG37C3A-0733-50"	"devlet politikası olarak destek gördü,"	"korundu"	"ve gözetildi. Bunun da çeşitli"
"s"	"S-ACABPA-0434-2"	"devlet kurumlarını, ülkenin dış itibarını"	"koruyup"	"gözetme görevlerini etkinlikle yerine getirmesine"
"w"	"W-TH32D1B-2487-519"	"devlet görevlileri olsun, sıra ormanı"	"korumaya"	"gelince ayak sürüyorlar. Çünkü ağacın"
"w"	"W-ND02A3A-1447-1315"	"Devlet demokratik bir düzende bunları"	"korumaya"	"mecburdur."" İtalyan yazar Bellini de"
"w"	"W-OC01A4A-1510-2242"	"devam ettirilip azaltılarak kesilir. Lepradan"	"korunmakta"	"BCG aşısı etkisiz bulunmuştur. BAKTERİYEL"
"w"	"W-DE05A1B-3415-1257"	"destek ve rehberlik, ailenin bütünlüğünü"	"korumaya"	"yönelik olmayacak mıdır? Veya, tamamen"
"w"	"W-SE39E1B-3036-1021"	"derstir. İnsanı soğuk ve sıcaktan"	"koruyan"	"elbise, hayâ duygusunun zedelenmesini önlediği"
"w"	"W-HE05A1B-3511-1093"	"dernekleşme çabasında oldukları görülmektedir Böylece;"	"korunmaya,"	"güçbirliği yapmaya ve dayanışmaya çalıştıkları"
"w"	"W-EE05A2A-3017-590"	"derece saygı duyan, kadın haklarını"	"koruyan"	"ve önem veren, kadın ve"
"w"	"W-PA16B4A-0291-2445"	"derdi vardı ki?"" ""Seni fazla"	"koruduğumu"	"düşünüyordu."" Biber sonunda sıkılıp yeniden"
"w"	"W-TE13C2A-1322-1186"	"denli hürdür. İnsan ne denli"	"korunuyorsa,"	"doğa da ancak o denli"
"w"	"W-TI42E1B-2942-2266"	"dengede olması gerekir. O dengeyi"	"koruyabilmek"	"için aşırı uçlara kaçmamak çok"
"w"	"W-UI44F1D-5118-986"	"deneyenler yoğurdun daha fazla tazeliğini"	"koruduğunu"	"belirttiler. Annem 1.5 hafta sonra"
"w"	"W-LC06A3A-1960-933"	"deney benzer şekilde katodik olarak"	"korunmakta"	"olan boru hatlarında da yapılabilir."
"w"	"W-OE05A1B-4179-925"	"demokratik ilkelerin ve insan haklarının"	"korunması,"	"Topluluğa 5 Nisan 1977 tarihli"
"w"	"W-NE05A1B-3958-647"	"demokratik hukuk devletinin varlığı ve"	"korunması"	"yönünden,, terörle mücadele kadar bu"
"w"	"W-MC06A1A-1952-526"	"demlemesi genç bitkileri de hastalıklardan"	"korur."	"Latin çiçeği demlemesi bitleri kovar."
"w"	"W-PE05A2A-1426-1064"	"deforme olarak petrolünü kaybetmesine karşın"	"korunan"	"kuzey kesimlerinde Anadorka-Permiyen çanağında D.P.O."
"w"	"W-VI05A1A-2640-1185"	"defasında değiştirilmeli, yatağı ve çarşafı"	"korumak"	"için altına muşamba vs. konulmamalıdır."
"w"	"W-TI27D1B-2808-2393"	"dedirtmek değil de nedir! Taksim'i"	"korumak"	"adına İstanbul'u felç etmek nasıl"
"w"	"W-QA16B1A-0713-283"	"dediklerimizin hırçın bir güç gösterisiyle"	"korunduklarını"	"izliyorum. Hüzün verici bir yalnızlıkları"
"w"	"W-II22C3A-0566-1208"	"dedikleri de kaç sene kalıcılığını"	"koruyabilir"	"ki? Yüz sene? Bin sene?"
"s"	"S-ACABQq-0423-58"	"dedik; sınır güvenliğini askerlerimiz korusun."	"Koruyabiliyor"	"mu; koruyamıyor; askerlerimizin sınıra yaklaşması"
"w"	"W-RA16B3A-0814-306"	"dedi. Gözümüz yollarda kaldı. Allah"	"korusun"	"bir şey mi oldu, diye"
"s"	"S-BEABXO-0452-243"	"de. Getir Ali. Onu da"	"gorumağ"	"önemli Ali. Yani. Sanki başka"
"w"	"W-RD39C4A-2646-1139"	"de"". İrkildi. ""Ne diyorsunuz? Allah"	"korusun!"""	"""Amin, ama ölmesi de mümkün,"
"w"	"W-MD02A4A-2687-586"	"de zaman zaman değineceğiz. TÜKETİCİNİN"	"KORUNMASI"	"KANUNU'NA GÖRE TURİSTİN HAK VE"
"s"	"S-ACABQq-0429-214"	"de yanlış yapıyorsunuz, Meclisin itibarını"	"korumak"	"zorundayız Sayın Başkanım. Ara verin."
"w"	"W-IF05A1B-4410-1978"	"de tüketiciyi belirsizlik ve istikrarsızlıktan"	"korumaktır."	"Gelişmekte olan ülkelerde tarımsal fiyat"
"w"	"W-TI44F1D-4754-2354"	"de senin gibi 1 yıl"	"korunmadık"	"ben 5 ayrı özel doktora"
"s"	"S-AEAASO-0039-80"	"de olabilir. Bedduasını alırsa Allah"	"korusun."	"Üzerse Allah korusun. Bu hususta"
"w"	"W-PD10A1A-2076-228"	"de kaynaklanabilmektedir. Diğer taraftan sosyal"	"korumanın"	"yetersizliği çok daha kapsamlı ekonomik,"
"w"	"W-SE20C0A-0238-189"	"de insanın kendisini bir başkasının"	"korumasına"	"terk etmesi ve kendine dokunulmasına"
"w"	"W-EE05A1B-3440-238"	"de güçlü basın karşısında kişileri"	"korumaya"	"yönelik temel bir hak olduğunu"
"w"	"W-UD03A3A-3310-744"	"de gitmiştir. Sadece kitabın içinde"	"korunanlar"	"değil; dinlediği masallar, türküler, destanlar"
"s"	"S-ACABPZ-0329-29"	"de gerçekten zarar vermeyen enstrümanı"	"koruyan"	"bi şey var. Ama toz"
"s"	"S-ADBBI^-0042-237"	"de durum kolay değildi; yıllardır"	"koruduğu,"	"kol kanat gerdiği bir kişiyi"
"w"	"W-EG37C2A-0562-1717"	"de bu bireyciliğin yıkıcı etkilerinden"	"korunmaya"	"çalışan bir bireyleşme (ancak özel"
"s"	"S-BEABXE-0082-240"	"de aynı. Başka türlü nasıl"	"korucaklar."	"Yani içine mutlaka bişe atıyorlar"
"w"	"W-SI45F2D-4906-719"	"de ama kendi vatandaşından bile"	"koruyanın"	"ordu olduğu ve bu koruma"
"w"	"W-UE36E1B-3356-495"	"dayanılmaz hafifliğini hissedelim"" dedik. ""Tam"	"korumalı"	"vücut kuşakları""mızı kuşakları""mızı kuşanıp iki"
"w"	"W-FE03A2A-1782-184"	"davranışı, kan karışmasına karşı kendini"	"korumak"	"için kast sistemini yaratmış olan"
"w"	"W-ED02A1B-3656-1612"	"davranışların ortaya çıkması durumunda geçici"	"korumalar"	"sağlanmalıdır. Kuramsal Yaklaşımlara İlişkin Uygulamaların"
"w"	"W-RA16B3A-1071-1615"	"davranmam gerektiğini öğretebilecek misin? Beni"	"koruyamayacağın"	"kadar büyük tehlikelerin neler olduğunu"
"w"	"W-SA14B1A-4732-418"	"davranacağıma karar veremiyordum. Belki de"	"korunma"	"iç güdüsüydü onunla evlenmem. Ama"
"w"	"W-MD30D1B-2209-801"	"davaya gönül vermiş insanların haklarını"	"koruyacak"	"şekilde yürütmemdir. Eğer benden bu"
"w"	"W-ME39C3A-1082-514"	"davalar açıldı.) Peki, yaşam düzenini"	"korumakla"	"görevli sorumluların hiç mi yetkisi"
"w"	"W-FE39C4A-1346-835"	"darbe teşebbüsü sırasında Rusya parlamentosunu"	"koruyan"	"askerlere ikisinin de ücretsiz servis"
"w"	"W-IF39C0A-0194-1733"	"Dar Gelir (Sanık Ahmet Salih"	"Korur,"	"Adnan Menderes seyahate çıktığı zaman.."
"w"	"W-LI27D1B-2828-828"	"damlarda serili yataklarda yatılmamalı. Akrepten"	"korunmak"	"için cibinlik kullanılmalı ve pencerelere"
"w"	"W-HI22C3A-0423-62"	"dalı düşün. Güneşin ışıklarından bile"	"koruduğu"	"o muhteşem mahsulü, nasıl sana"
"w"	"W-MC06A1A-1952-325"	"dallara güç verir ve hastalıklardan"	"korur."	"Potasyum doğal olarak eriyen bir"
"w"	"W-DE37C3A-1375-1184"	"dahil olmak üzere sömürüye karşı"	"korumak"	"amacıyla her türlü önlemi almakla"
"w"	"W-KC06A3A-1053-458"	"dahil birkaç imparator bu imparatorluğu"	"koruyabilmiş,"	"fakat diğerleri zayıf düşürmüştür, iç"
"w"	"W-TD36E1B-2844-2211"	"daha çok kentsel sit alanlarını"	"korumaya"	"yönelik kararlar alınmıştır. Bu kararlardan"
"w"	"W-LF05A1B-4442-2373"	"daha yüksek olduğundan alacaklıların çıkarlarının"	"korunması"	"amacını güden birtakım tedbirlerin alınması"
"w"	"W-RA16B4A-1074-1175"	"daha var. Aman aman Allah"	"korusun,"	"ben hayatımdan memnunum."" Ertesi gün"
"w"	"W-UE05A1B-4287-108"	"daha sonraki dönemlerde bu yükselişini"	"koruyamamıştır."	"“Serbest” “Serbest” “Serbest” meslek kategorisinde"
"w"	"W-CI22C2A-0677-2180"	"daha ileri. Doğum kontrol mekanizmasında"	"korunmayı,"	"%53 oranında erkeklerin aldığı önlemlerle"
"w"	"W-QE02A0A-1783-1425"	"daha güçlü olarak hissederler ve"	"korurlar."	"2. ""Zaman"" açısından Bir ülkede"
"s"	"S-ADBBI^-0042-235"	"daha fazla... Hep memnun olduğum,"	"koruduğum"	"ve geliştirdiğim bir haklı rekabet"
"w"	"W-IE05A1B-3542-1181"	"daha da ileri gidilerek, özel"	"korumaya"	"tabi mallardan söz edilmekte ve"
"w"	"W-GE39C2A-1062-520"	"daha ağzımda var"" diyerek kendini"	"korumaya"	"çalışmaktadır. Bu tutum zamanla bir"
"w"	"W-CI22C3A-1079-1477"	"da, üşüyorlar mı? Onları tüyleri"	"koruyor"""	"dedi. Aklım yattı. Bağrıma taş"
"w"	"W-GA16B2A-0139-2297"	"da, sanki beni bir şekilde"	"koruyordu."	"Çevremdeki bildik tanıdık eski dünyanın"
"s"	"S-BEABXn-0350-17"	"da önünde de peşmergeler bunları"	"koruyolardı"	"işte bi yere giderken. Hemen"
"s"	"S-BEABXw-0353-91"	"da var. Nerden kesecekler? Allah"	"korusun"	"da... Dizden kesecekler zaar bilmiyorum"
"w"	"W-FG03A1B-3192-1420"	"da tiyatroda sergiliyorlardı. Ancak bunların"	"korunması"	"için hiçbir önlem düşünmediklerinden üç"
"w"	"W-IF18E1C-4145-1895"	"da söz konusu dönemde canlılığını"	"korumuştur."	"Ayrıca, havayolu ulaştırmasının rekabete açılmasının"
"w"	"W-PE06A1B-4255-794"	"da sosyal sorumluluk öncelikle çevrenin"	"korunması,"	"demokratikleşme ve insan hakları gibi"
"w"	"W-MH13C2A-1091-2040"	"da olur. Niyetlerin bozulmasıyla devletin"	"korunması"	"zaafa uğrar. Zulme ve şiddetli"
"w"	"W-DA16B3A-2667-1405"	"da mezhep kavgalarına karşın birliğini"	"korumuştur,"	"sünni alevi ayrımı içinde. Din,"
"w"	"W-MD30D1B-2209-2101"	"da kökleşmesinin, birlik ve beraberliğimizin"	"korunmasının,"	"Atatürk ilke ve inkılaplarının yerleşmesinin"
"w"	"W-NI31D1B-2428-22"	"da Kolombiya Milli Takımı'nın kalesini"	"koruyan"	"ve daha önce prensip anlaşmasına"
"w"	"W-RI22C2A-0404-1533"	"da kitap vücudu gelen tehlikelerden"	"koruduğu"	"gibi bilinçaltı duyguları da yansıtır."
"w"	"W-FE05A1A-2057-1599"	"da islam dinine mensup olanların"	"korunması"	"için hükümler kabul edilmiştir. Büyük"
"w"	"W-VI22E1B-2915-1251"	"da ikaz ederdi. Yetimleri Devamlı"	"Korurdu"	"Peygamber Efendimiz, yetimlere olan merhametinden"
"w"	"W-LF05A1B-4449-93"	"da gösterilebilir. Sermayenin üretim gücünün"	"korunması"	"yaklaşımı, enflasyon dönemlerinde asıl olanın,"
"w"	"W-UI03C3A-1471-141"	"da gaybı (korunması gerekli olanı)"	"korurlar..."""	"Hizmet etmek... Eşimiz eve geldiğinde"
"w"	"W-UI12F1D-4851-1954"	"da diyemem. Bu yüzden kalbimizi"	"korumalı,"	"onun önemini unutmamalıyız. Kalbimizi sevmeliyiz."
"w"	"W-LD43A3A-1798-1136"	"da benim yararıma olduğu için"	"koruyorum."	"Bu saygının gelişmesi için evvela"
"s"	"S-ADABCo-0179-200"	"da belirtti. Buranın tarihi kimliğini"	"korumak"	"bizim için asıldı. Mesela hemen"
"w"	"W-DF05A3A-2981-1560"	"da başlangıçta saptanan standart paylarını"	"korumalı"	"ve üretim değiştirmemelidirler. 3.19. İşletme"
"w"	"W-TI44F1D-5102-323"	"da başarılı olunca aradaki farkı"	"korudu"	"ve 34. dakikaya da 8"
"w"	"W-QE02A0A-1783-1620"	"da Avrupa dışındaki azınlıklarını (Hıristiyanları)"	"korumaya"	"yöneldiler. Çünkü, hemen sınırlarında yer"
"w"	"W-JC05A4A-1768-1255"	"da ""iltizam""la ""iltizam""la devletin saygınlığı"	"korunamaz."	"Memuru yerli yersiz iftiralardan korumak,"
"w"	"W-SE05A1B-4201-1250"	"D. ÖZGÜN OLMAYAN VERİ TABANI"	"KORUMASININ"	"HUKUKİ NİTELİĞİ VE SÜRESİ a)"
"w"	"W-TC05A2A-1158-1644"	"d. Mesleki gizliliği her zaman"	"korur."	"e. Eğitim yönetim kurulunun politikalarını,"
"w"	"W-LD39E1B-2927-366"	"Cumhuriyetimizi, en iyi şekilde savunup,"	"koruyup,"	"kollayacağına inandığı Türk Gençliğine emanet"
"w"	"W-VI44F1D-4747-1097"	"cnm ben herşeye uyarım kilomu"	"korumak"	"değil amacım daha henüz 7-8"
"w"	"W-TD37C2A-0304-17"	"cinsellik konusuna önem vermezseniz, Allah"	"korusun"	"siz veya eşiniz büyük bir"
"w"	"W-PA16B4A-0099-2405"	"cinayete karışmış bir mağazanın saygınlığını"	"koruyamayacağını"	"düşünüyordum. Ama hiç de düşündüğüm"
"s"	"S-BEABXO-0056-72"	"cilt kanseri taramasına gitmeliymiş. Allah"	"korusun!"	"Kim sana dedi bunu? İnternette"
"w"	"W-JE42C0A-0284-783"	"cezalandırılacağı anlatılıyor. Emredenin kurtulacağı, dini"	"korumanın"	"ilk şart olduğu, müslümanın eliyle"
"s"	"S-ADAASK-0036-82"	"ceza yemeye <B> oluyorsun. Allah"	"korusun."	"O zaman biz bunlardan olamayız."
"w"	"W-VI31D1B-2434-1980"	"ceza puanıyla ilk sırada yerini"	"korurken,"	"Diyarbakırspor ise 377 ceza puanıyla"
"w"	"W-NA16B1A-0521-23"	"cevap, Cevahir'den değil, bir grup"	"korumanın"	"bir grubundan geldi. Müslüm önce"
"w"	"W-TD18E1C-4079-817"	"cevap vermek için çalışır, değerlerimizi"	"koruyup"	"yaşatır, ürettiği bilimsel bilgi, teknoloji"
"w"	"W-RE30D1B-2132-803"	"cevap Sınırı sadece biz mi"	"koruyacağız?"	"ABD ve Irak yönetiminin, direnişçilerin"
"w"	"W-TI27D1B-2471-1994"	"Cenneti"" diye adlandırılan Kızılırmak Deltası'nın"	"korunması"	"amacıyla ""alandaki mevcut bitki ve"
"w"	"W-TA16B4A-1264-2221"	"Cenevizlilerden beri her tür kaydın"	"korunup"	"saklandığı yerdi. Taş duvarlarının her"
"w"	"W-EE05A2A-3017-1661"	"Cemiyetleri'nin bu şekilde her bakımdan"	"korundukları"	"düşünülerek, bugüne kadar gösterdikleri çalışmalar"
"w"	"W-DA16B4A-0082-2286"	"Cemil Bey yerine sizi ben"	"koruyacağım,"	"ben katılacağım bu işe. Hüsrev"
"w"	"W-MD37C0A-0157-1034"	"caydırmak için uğraşılıyor. Enkidu'ya onu"	"koruması"	"öneriliyor. Annesi Tanrıça onu koruması"
"w"	"W-NA16B4A-0054-2250"	"canlarını, akıllarını, nesillerini ve mallarını"	"korumak"	"ve muhafaza altına almaktır. Bu"
"w"	"W-RE39C4A-0703-2025"	"can, mal ve ırz emniyetini"	"korumak"	"olduğu halde, Amerika'da az gelişmiş"
"w"	"W-NI09C2A-0472-2016"	"can çekişiyorlardı. Bazıları da soğuktan"	"korunmak"	"için birbirlerine sarılmışlardı. Getirdiğimiz yiyecekleri"
"w"	"W-SI19E1A-3995-2181"	"can katar. 1. Vücut sağlığımızı"	"korumak"	"için neler yapmalıyız? 2. Vücudumuzdaki"
"w"	"W-FD05A4A-2607-1301"	"can güvenliğini sağlayarak ticaret etkinliğini"	"korumak"	"ve arttırmak"" istemeleri gibi. Bütün"
"w"	"W-FH03A1B-2384-1762"	"c. Neslin muhafazası İnsan türünün"	"korunması"	"demektir. Nesillerin ruh beden,'zihin, beden,'zihin,"
"w"	"W-PB04A3A-1986-208"	"bırakılmayarak, hükümetler tarafından sulak alanların"	"korunması"	"için özel yasalar çıkarılmalı ve"
"s"	"S-BEABXO-0056-73"	"Büyülüymüşüm diye. Ba ba Allah"	"korusun!"	"Niye kendisine mi bulaşır? İnanma."
"w"	"W-IE39C0A-1693-425"	"büyük operasyonlar dışında zamanlarını kendilerini"	"korumak"	"için karakollarına, karargâhlarına kapanarak geçireceklerdi."
"w"	"W-RE09C3A-0028-592"	"Büyük Millet Meclisi Hükümeti'nin eşit"	"koruması"	"altındadırlar. Suç işlemeyenler, kendilerini bu"
"w"	"W-IE05A1B-3565-930"	"büyük güvencesi olan hukuki kesinliğin"	"korunabilmesi"	"için, yargıcın, yasa koyucunun açıkça"
"s"	"S-ACABTZ-0336-125"	"büyük bir değişiklik yapılıyor. Çevrenin"	"korunması,"	"çevre kirliliğinin önlenmesi ve çevre"
"w"	"W-TD30D1B-2231-779"	"bütünlüğünün korunması ve Türkmen haklarının"	"korunması"	"konularında sadece temenniler yapmıştır. Etkin"
"s"	"S-ADABPZ-0373-51"	"bütünlüğünü koruyacağıma Ve ebeliğin bütünlüğünü"	"koruyacağıma"	"And içerim And içerim <alkış>"
"w"	"W-LD39E1B-2927-1747"	"bütünlüğü ve birliğini dolayısıyla bekasını"	"koruyacaktır."	"1919'da olduğu gibi bundan böyle"
"s"	"S-AEABPZ-0331-120"	"bütün yaşama ortamlarının estetik özelliklerinin"	"korunmasını"	"ve daha da geliştirilmesini güvenceye"
"w"	"W-GA16B3A-0794-2398"	"bütün sırları bütün hatıraları gibi"	"koruyacak"	"beni ve hatıralarımı hissediyorum. Onu"
"w"	"W-GG22C1A-0531-1616"	"Bütün güçleriyle kendilerini korumak isteyenler,"	"koruyabilenler,"	"daha doğrusu, korumağı başarabilenler, onlar"
"w"	"W-UA16B1A-0913-517"	"Bütün canlılar yapıyor bunu. Beslenmek,"	"korunmak,"	"saklanmak, avlanmak, kısacası yaşamı sürdürmek"
"w"	"W-GE37C2A-0549-1863"	"bütün bu işleri Avrupa'nın statüquosunun"	"korunması"	"uğruna yaptığı için, bunlar olup"
"w"	"W-KF10A2A-1875-1701"	"Bütçe disiplini nasıl sağlanır, nasıl"	"korunur?"	"İstikrar ve Büyüme Sözleşmesi Aşırı"
"s"	"S-BEABXO-0093-114"	"Böylece kışın, böylece kışın soğuğundan"	"korunmayı"	"öğrenmişler. Bu sayede de tüm"
"w"	"W-JE39C4A-1476-1493"	"böylece güya ayrılmak istemeyen eşi"	"korumaktır."	"Pekiyi ya öteki eşin hakkı?"
"w"	"W-RB04A1A-1160-1307"	"Böylece Dalyan kumsalında deniz kaplumbağalarının"	"korunmasına"	"yönelik örnek bir davranış sergilenmiştir."
"w"	"W-FE05A2A-1057-1422"	"böylece bireysel ve kurumsal tasarruflar"	"korunur"	"ve arttırılırken yatırıma yönelik fonların"
"w"	"W-SE36E1B-3352-2194"	"Böyle durumlarda sükunetinizi ve konsantrasyonunuzu"	"korumanızın"	"yararını göreceksiniz. Benlik ikinci sırada"
"s"	"S-BEABXO-0056-74"	"böyle değiştiğine. Allah korusun! Allah"	"korusun."	"Bak. Allah şaşırtmasın. Acaba üstüne"
"w"	"W-IF10A2A-1880-63"	"böyle bir sektördeki firmaların rekabetten"	"korundukları"	"sürece önemli miktarlarda karlar elde"
"s"	"S-AEABUZ-0022-36"	"böyle atılıyorlar. Ondan sonra hakkını"	"koruyan"	"yok bilmem ne yok. Hani"
"w"	"W-GE39C2A-1367-1298"	"bölünmez. Fiziki varlığımızı hep birlikte"	"koruyacağız."	"Ancak farklı fikirlerin, farklı otonomilerin"
"w"	"W-FD36E1B-2848-1764"	"bölünmelerin ve antagonizmaların kulüp aidiyetinde"	"korunarak"	"aşılması gibi, bölgesel ayrımlar da"
"s"	"S-AEABPZ-0331-146"	"bölümünün korumaya alınması lazım. Kirlilikten"	"korunmak"	"için. Bunu biraz önce, Halil"
"w"	"W-TG03A0A-0203-951"	"bölümündeki ayna sahnesi dışında bütünlüğünü"	"koruduğunu"	"düşünüyorum. Ayna sahnesinde ise, parçalanma,"
"w"	"W-MD02A4A-2687-765"	"bölümdeki haklardan birisi de tüketicinin"	"korunmasına"	"ilişkin haktır. Tüketicin korunmasına ilişkin"
"w"	"W-PI22E1B-2909-1081"	"bölgeye uygun renkleri ile düşmanlarından"	"korunur"	"ve avlarını da fark edilmeden"
"w"	"W-IE39C0A-1693-849"	"bölgede halkın, tesislerin ve üslerin"	"korunması,"	"PKK'nın saldırı harekât olanağını azaltıcı"
"w"	"W-KD39C3A-0386-1724"	"Bölge kuruluncaya kadar sığınmacıların yaşamını"	"korumaya"	"yönelikti. Şimdi iş bu bölgenin"
"w"	"W-VB04A2A-1984-400"	"böcek saldırıları gibi dış etkenlerden"	"koruyan"	"ve çevre ile bitki arasında"
"w"	"W-KE05A1B-3630-1696"	"burjuvaziye karşı da göreli özerkliğini"	"koruyabilmektedir."	"Dolayısıyla, Türk devlet aygıtının asli"
"s"	"S-AEABUZ-0021-92"	"burda oturan bizler birbirimizi nasıl"	"koruruz,"	"kollarız, nasıl hayata sarılırız? O"
"s"	"S-ACABPA-0434-205"	"Burada siyasal partiler olabildiğince kimliklerini"	"korumak"	"durumundadırlar. Tek isimli çift turlu"
"w"	"W-LE05A1B-3695-2307"	"Bunun üzerine yetkililer Yahudilere polis"	"koruması"	"sağladılar. Birkaç gün geçici bir"
"w"	"W-GB04A2A-1277-1971"	"bunun amacı dokuyu proteolitik aktiviteden"	"korumaktır."	"Salınımı pankreastan yapılan zimojenler, sadece"
"w"	"W-GD02A3A-1059-1348"	"bunu yayımlamaktan kaçınmamalı, meslek gizliliğini"	"korumalı,"	"haberin kaynağını açıklamamalıdır. Ayrıca, gazeteci"
"w"	"W-FG43A2A-2012-1457"	"Bunu tartışmayalım. Biz kendi kimliğimizi"	"koruyor"	"muyuz, koruyamaz mıyız hiç önemli"
"w"	"W-QI09C2A-0631-2362"	"Bunları da bana sözde beni"	"koruyarak,"	"sözde ailemden beni ayrı tutarak"
"s"	"S-AEAB^o-0018-85"	"bunlar hoş şeyler değildir. Allah"	"korusun"	"herkesi hepimiz."
"w"	"W-SF10A2A-1865-2206"	"Buna karşılık işgücü piyasasının dinamizmini"	"korumaya"	"yönelik tedbirler ise iş güvencesini"
