"Register"	"Text"	"Left"	"-5;5"	"Right"
"w"	"W-KB04A3A-1259-1282"	"tezini de benimsiyorum. Özellikle de"	"korunacak"	"olanın herhangi bir orman ağacı"
"w"	"W-PI42E1B-2938-2011"	"tesettür demek, insanın kendi mahremiyetini"	"koruması"	"değil mi? Bir hanımın güzelliği,"
"w"	"W-DC06A3A-3364-529"	"termal incinme (İR katarat)'lerden katarat)'lerden"	"korunma"	"için bir ön termal yük"
"w"	"W-LD02A1B-4494-1485"	"terk etmemişlerdi. Eski Halk Destanlan'm"	"korumuşlar,"	"bazılanm İslami görüş ve inançlanna"
"w"	"W-KA16B2A-0308-2128"	"Teri mi önler? Soğuktan mı"	"korur?"	"Çocuğa bu yaşta fonksiyonsuzluğu öğreten"
"w"	"W-IA16B3A-0041-603"	"Teninin saydamlığını bu yaşına dek"	"koruyabildiğine"	"göre, gerçekten de öyle miydi"
"w"	"W-QG24D1B-2318-1676"	"ten sadık bir bekçi gibi"	"koruyor"	"ruhu, kat kat giysilerin altında."
"w"	"W-EF25D1B-2775-1743"	"temsilcilerini iş güvencesi ve işyerinde"	"korunmalarına"	"ait tedbirleri düzenliyor. Anayasaya göre,"
"w"	"W-HB04A1A-1537-494"	"temizliği ve hijyenik yönden iyi"	"korunması"	"gerekmektedir. Bugün kentlerin büyük sorunları"
"w"	"W-KI27D1B-2447-318"	"temiz koyları olan Göcek koylarının"	"korunabilmesi"	"için Muğla Valiliği yeni önlemler"
"w"	"W-ME05A1B-3918-1467"	"temelini oluşturan Anayasanın üstünlüğü ilkesinin"	"korunmasını"	"güçıeştirdiği için mahkemelere itiraz yetkisinin"
"w"	"W-KD03A0A-0261-25"	"temeli ne? İçgüdüler. Nedir içgüdüler?"	"Korunma,"	"beslenme, çoğalma değil mi? Eh"
"w"	"W-JF10A2A-1836-1005"	"temdit risklerine karşı aynı anda"	"korunmak"	"isterken, bazıları da sadece bir"
"w"	"W-UC29D1B-2436-2010"	"telif hakkı yasalarıyla hali hazırda"	"korunmaktadır,"	"bu şekilde diğer geliştiricilerin aynı"
"w"	"W-NA16B4A-0054-340"	"tekrarlanmasıydı. Bizde kalmadığı, annemi, babamdan"	"korumadığı"	"için ona çok kızdım. Gitme"
"w"	"W-LF25D1B-2155-1496"	"teknolojik seviyesi ile rekabet gücünün"	"korunması"	"olduğu belirtildi. Yüzde 66 küçüldük"
"w"	"W-HF05A1B-4403-1510"	"teknoloji değişmemişse 2/1 2/1 oranını"	"korumak"	"zorunda kalacaktır. Makinaların yarattığı ikinci"
"w"	"W-JA16B3A-1133-1009"	"tekkesini bunca zamandır çekip çeviren,"	"koruyup"	"kollayan, sarıp sarmalayan huzur ve"
"w"	"W-OG37F1B-2931-663"	"tek vücut direniyor, direnme hakkını"	"koruyor..."	"Zulmün olduğu yerde direnmek en"
"w"	"W-DD02A3A-2967-523"	"tek tek sözcükler olarak varlıklarını"	"korudukları"	"görülür. Bu sözcükler kaynaklandıkları dillerde"
"s"	"S-ADABCo-0217-189"	"tehlikesi yaşadı. İzdiham nedeniyle Başbakanın"	"korumaları"	"duruma müdahale etti ve Başbakan"
"w"	"W-TE39E1B-3037-763"	"tehlikeden hemen haberdar olur ve"	"korunmak"	"için önlem alır. Ayrıca bal"
"w"	"W-CE05A1B-3391-1575"	"tehlike halinde diğer yerlilerin kendilerini"	"korumalarını"	"sağlamak, bunları eğitim ve sanayiye"
"s"	"S-ACAAQq-0419-223"	"tehditlerle karşı karşıya bulunan çocukları"	"korumak"	"için çeşitli girişimler yürütmektedirler. Birçok"
"w"	"W-PF10E1B-3064-1685"	"tehditlerinden Symantec Client Security ile"	"korunduklarını"	"belirtiyor. Gökhan, çözümün; herkesin tedbir"
"w"	"W-TI27D1B-2471-1234"	"tehdit olarak algılar ve vücudu"	"korumak"	"için atağa geçer. Bu durum,"
"w"	"W-UE02A4A-0908-652"	"tehdit ettiği, onlara karşı kendilerini"	"korumaları"	"gerektiği öğretilmektedir. Günümüzde, Türklerle Almanların"
"w"	"W-RC01A4A-1084-296"	"tedavi ve fırsatçı enfeksiyonlara karşı"	"korunma"	"uygulanmaktadır. Hastalar aşağıdaki hastalıklara karşı"
"w"	"W-TI22C2A-0845-869"	"taşıyor göğsünde. Kalbini korur gibi"	"koruyor"	"onu çarpışlardan. Kalbi gül olmuş,"
"w"	"W-TF18E1C-4174-811"	"taşınmaz eski eserlerin onarım ve"	"korunmaları"	"için gerekli her türlü araç"
"w"	"W-JC05A2A-1769-1816"	"taşımacılık, kentsel düzenin oluşturulması ve"	"korunması,"	"gıda kontrolü, tüketicinin korunması, turizm"
"w"	"W-QB38E1B-2882-1843"	"tasvir edilmiş; ayrıca kamu sağlığının"	"korunmasına"	"dikkat ve itina gösterilen uygar"
"w"	"W-DF05A1B-4370-1660"	"tasfiye sonuna kadar tüzel kişiliğini"	"koruduğundan"	"şirket temsilcileri iflâs tasfiyesi devam"
"w"	"W-NF10A2A-1827-2000"	"tasarruf sahiplerinin hak ve yararlarının"	"korunmasını"	"düzenlemek ve denetlemek amacıyla çıkarılan"
"w"	"W-IE05A1B-3542-7"	"tasarlanacak önlemleri uygulamak yükümlülüğü getirerek"	"korumanın"	"gereğinde üye devletler arası görüşmeler"
"w"	"W-LF10A2A-1877-1202"	"tarımda da bu ürünlerin sanayi"	"korumaları"	"karşılıklı sıfırlanmıştır. Ancak Türkiye bu"
"w"	"W-LF10A2A-1877-2070"	"Tarım sektörünün ekonomik olarak önemini"	"koruduğu"	"Türkiye'de toplam transferlerin GSYİH içindeki"
"w"	"W-RE39E1B-2903-2134"	"tarikatlar, siyasetteki ağırlıklarını bugüne kadar"	"korudular."	"Türkiye'nin ABD yörüngesine girmesi ve"
"w"	"W-RI42E1B-2940-672"	"tarihten intikal eden müşterek isimlerin"	"korunması"	"gerekir. Başta zikredilen hadiste, ""kıyamet"
"w"	"W-HG03A3A-2010-843"	"tarihten gelen ölçülerini büyük ölçüde"	"koruyarak,"	"onu, bu yeni gelişmeler içinde"
"w"	"W-KE05A2A-2053-901"	"tarihli Weimar Anayasası'nın, anayasal düzeni"	"korumakta"	"yetersiz kalması ve Almanya'da rasyonel-sosyalist"
"w"	"W-ID02A1B-3829-2303"	"tarihi boyunca kendini en iyi"	"koruyan"	"yapılardan biridir. Modern çağda görülen"
"w"	"W-KF10A3A-1767-692"	"tarih boyunca dünya piyasalarında aşırı"	"korunmakta"	"olan mısır, buğday ve pamuk"
"w"	"W-TE05A2A-1399-2435"	"tarafından gönderilen mektupla Rusya karşısında"	"korunmayacağının"	"bildirilmesi ve NATO için verilen"
"w"	"W-FE02A1B-3464-1036"	"tarafından dövülmüş, halk arasına polis"	"koruması"	"olmadan girmemeye başlamıştır. Kuruluşun yıllık"
"w"	"W-RB04A1A-1160-2020"	"tarafından da imzalanmıştır. Doğal zenginliklerimizin"	"korunması"	"bakımından söz konusu anlaşma yükümlülüklerini"
"w"	"W-KA16B2A-0784-1777"	"taraftarı değildi ama şartlar olağanüstülüğünü"	"koruyacaktı."	"Köylü, şehirli ellerinde ne var"
"w"	"W-ND41C0A-0335-1278"	"taraftar-yazarlığın, ""yorumculuğun"" puan cetvelindeki yerini"	"koruması,"	"""yorumcu""ların ""yorumcu""ların olayların akışı üzerinde"
"w"	"W-HF10A2A-1876-219"	"taraftan, 2001 yılında en çok"	"korunacak"	"olan sektörler 14, 12, 4,"
"w"	"W-GD02A1A-0536-528"	"tanıtımının yapıldığı reklamcılık alanında liderliğini"	"korumuştur."	"Uluslararası reklamcılık alanında, ulusötesi dağıtımı"
"w"	"W-OD05A3A-0720-2360"	"tanımlanan ""merkez"", devletin üniter yapısının"	"korunması,"	"laik bir milliyetçilik anlayışı, din"
"w"	"W-DD02A1A-2690-2067"	"Tanzimat Fermanı ile verilen hakları"	"koruyacak"	"durumda değildir; ancak Kemâl'e'göre gazetelerin"
"w"	"W-LE39C3A-0067-129"	"tanrı-krallar düzeni kutsallık zırhlarına bürünerek"	"korudular."	"Güneş krallarda, firavunlarda, tanrı krallarda"
"w"	"W-DI22C3A-0719-1890"	"Tanrı kızları; babaların, ağabeylerin böylelerinden"	"korusun"	"ve yazıklar olsun! bir gökyüzü"
"w"	"W-JI41C3A-1509-60"	"tamamlıyor ki... Bu güzelliğin nasıl"	"korunduğunu"	"anlamak zor değil. Her birkaç"
"w"	"W-TI31D1B-2355-1867"	"tamamladı. İkinci yarıda da üstünlüğünü"	"koruyan"	"CSKA, maçtan 85-66 galip ayrıldı."
"w"	"W-TH32D1B-2487-1142"	"Tam da oradadır... Katillerin nasıl"	"korunduklarının,"	"nasıl salındıklarının, nasıl el üzerinde"
"w"	"W-VG37E1B-3069-140"	"tam bir doğa korumacıydı. Kelaynakların"	"korunması"	"için yapılan çalışmalarda aynı amaç"
"w"	"W-RE39C0A-0348-533"	"taleplerine ilişkin tarihi emelleri güncelliğini"	"korumaktadır."	"Bu sebeple ülkemizin karşı karşıya"
"w"	"W-LC06E1B-3086-1322"	"takvim reformu, günümüzde de geçerliliğini"	"korumaktadır."	"Takvim, Gregoryenre formla 10, önceki"
"w"	"W-}I22C1A-0428-1179"	"takan hanımlar kendilerini fort belasından"	"koruyabilirler."	"Lastiğin yumuşak dokusu hamle yapan"
"w"	"W-HA16B1A-0728-1647"	"tahta çit ve dikenli çalılıklar"	"koruyordu."	"Anna arsada şırıldayan suyun yanına"
"w"	"W-DE39C4A-0693-145"	"tahsis ederken vatandaş ""tarım toprağını"""	"korumak"	"için tarla çitinin önünde, elinde"
"w"	"W-QD36C0A-0222-1894"	"Taburunun ilk timleri kampı uzaktan"	"koruyan"	"Direniş Tepe'ye inmeye başladılar. İlk"
"w"	"W-LB04A1A-1574-935"	"tabanında müsilaj salan tüyler tarafından"	"korunan"	"vejetasyon noktası yer alır. Gemma-nın"
"w"	"W-SE05A1B-4201-1745"	"tabanı olarak korumak, veri tabanlarının"	"korunması"	"düşüncesinin temelinde yatan maksada uygun"
"w"	"W-SE05A1B-4201-1919"	"tabanlarının bu sözleşmeler kapsamında korunup"	"korunamayacağı"	"kuşkuludur. Örneğin bir konuyla ilgili"
"w"	"W-NF10A2A-1827-188"	"taahhüt etmiştir. 4054 sayılı Rekabetin"	"Korunması"	"Hakkında Kanun'un temel amacı, mal"
"w"	"W-OH42C0A-0319-1361"	"sığınırsa o kişiyi Yüce Allah"	"korur."	"İhlası tam olan Müslümana sihir"
"w"	"W-HE39E1B-2893-2099"	"Sığınılan yerin sığınak olabilme niteliğini"	"korumasını"	"ise yine o hareketin ""beceri"""
"s"	"S-ACABQq-0426-215"	"sırasında buralarda çalışan işçilerin hukuklarını"	"korumak"	"hususunda bugüne kadar ne yapmışsak,"
"w"	"W-RE22C1A-0247-1430"	"sırası dizilip avazımız çıktığınca ""küçüklerimizi"	"korumaya"""	"yemin etmek, bizim gibi ""küçükler"""
"w"	"W-NI22C2A-0698-2483"	"sıralarda, Kültür Bakanlığı, tarihi eserlerin"	"korunması"	"ve ortaya çıkarılması konusunda çalışmalar"
"w"	"W-KE05E1B-3299-409"	"sıralanmış. Taşhan'ın tarihi havasını hâlâ"	"koruyor"	"olmasında antika ve eski eşya"
"w"	"W-IE39C2A-2619-2440"	"sırada silahlıydı. Katiller onun kendini"	"koruyacağını"	"bildikleri için sinsice arkadan ateş"
"w"	"W-ME05A4A-2614-860"	"sınırın muvazaa tarafından da özenle"	"korunduğunun"	"bir göstergesidir ""Halk fırkası aleyhine"
"w"	"W-ME43C2A-3340-1989"	"sınırlar hala Rus birlikleri tarafından"	"korunmakta."	"Ben onları da görme imkanı"
"w"	"W-GH39C4A-1096-551"	"sınıf mücadelesi pratiği bakımından yerini"	"korumaktadır."	"Bilimi ya da felsefeyi, sınıf"
"w"	"W-CE05A2A-2051-1276"	"sınavlarda da ön sıradaki yerini"	"koruduğu"	"sonucunu çıkarmak gerekir. Bu sınavlar"
"w"	"W-HF10A2A-1876-2355"	"Sınai tasarımlar da anlaşma çerçevesinde"	"korunacaktır."	"Korunan tasarımların sahipleri, korunan tasarımların"
"w"	"W-HE06A1A-2069-102"	"sıcaklık dalgalanmaları, doğal nedenler dışında,"	"korunmalıdır."	"5.3.5. Erimiş Oksijen Erimiş oksijen"
"w"	"W-UA16B3A-1132-2288"	"sürüngen şiddetinin izleri bulunduğunu, bölgemizi"	"korumak"	"için şiddet kullanmaya eğilimli olduğumuzu"
"w"	"W-UE39C2A-1408-2127"	"sürülen eski Jitemci Cem Ersever'in"	"koruması"	"Trabzon eski Gümrükler Başmüdürü Ali"
"w"	"W-RE30D1B-2132-893"	"sürpriz olmadığını söyleyen Putin BDT'yi"	"koruyalım"	"Eski Sovyet cumhuriyetlerinden Kırgızistan'da gerçekleşen"
"w"	"W-LF10A2A-1877-1194"	"sürekli genişlemesi ve yüksek oranda"	"korunması,"	"Türkiye'nin rekabet gücünü kısıtlayan önemli"
"w"	"W-JH37C2A-0654-1614"	"süredir -çeşitli ifadelerle- ""Yaptıklarının demokrasiyi"	"korumak"	"için savaşmak"" olduğunu açıklayıp duruyorlar."
"w"	"W-OC40E1B-2874-1841"	"sürebilir. Casuslar yolda Özel bilgilerin"	"korunması"	"Son günlerde ziyaret ettiğiniz web"
"w"	"W-OH02A4A-1416-1223"	"süre dil/din dil/din bağlamında birliğini"	"koruyan"	"Avrupa, en büyük bölünmeyi halk"
"w"	"W-TE36E1B-3295-2189"	"sürdürecektir. Hamile olanlar bugünlerde kendilerini"	"korumalı..."	"""Ne Kömür, Ne Petrol, Ne"
"w"	"W-KE05A2A-2053-1807"	"sübjektif işlevinin yanında, hukuk düzenini"	"korumak"	"ve anayasa hukukunu geliştirmek gibi"
"w"	"W-LA16B2A-0514-2102"	"sözüm ona başarıları nasıl savunur,"	"korumak"	"istersiniz? isim kullanarak kitap ve"
"w"	"W-RF10E1B-2869-995"	"sözleşmeye aykırılık olmadığı sürece geçerliliğini"	"korur"	"ve üye işyeri çalışmamız devam"
"w"	"W-IE05A1B-3542-728"	"Sözleşmesi15 ile Arkeolojik Kültür Varlıklarının"	"Korunmasına"	"İlişkin 26.5.1969 tarihli ve 66"
"w"	"W-VD02A1B-4623-21"	"sözlere kanarlar; anneler çocuklarını kötülüklerden"	"koruyamazlar."	"Bir siyaset adamının seçimler sırasında"
"w"	"W-DF10A3A-1844-1924"	"Sözkonusu ettiğimiz dönemde iç güvenliği"	"korumakla"	"vali ve mütesellimler görevli idiler."
"w"	"W-PD03A3A-0867-1146"	"sözcüklerin simgelerini taşıyan muskaların insanı"	"koruduğuna"	"inanılırmış. Latince beşli anlamına gelen"
"w"	"W-UC29D1B-2436-341"	"söz konusu arka kapının kullanıcıların"	"korunması"	"için tasarlandığını iddia ederek, ""Umuyoruz"
"w"	"W-RA16B2A-0629-1995"	"söz ediliyordu. Çanta diğer özelliklerini"	"koruyor"	"olsa da tek parça üretilmiş"
"s"	"S-BEABXO-0091-67"	"söylüyorum ha kardeş yani Allah"	"korusun"	"yaa. Kardeş ben sana bişe"
"w"	"W-EA16B4A-0097-833"	"söylüyor. Çete, onu gözü gibi"	"koruyormuş."	"Çünkü çocukları kesme işini başka"
"w"	"W-DE05A3A-1909-1299"	"söylenebilir. Kuveyt, Irak'a karşı güvenliğini"	"koruyabilmek"	"için Sovyetler'le olduğu gibi ABD"
"w"	"W-OD36C1A-0154-1331"	"söylemini yeniden gündeme getirdi. Geleneklerini"	"koruyan"	"-ya da öyle görünen- bu"
"w"	"W-UE30D0B-2102-1047"	"suç sayılmasının, Türkiye'de insan haklarının"	"korunmasının"	"önündeki en büyük engel olduğu"""
"w"	"W-VC01A4A-0977-653"	"suyu üç gün buzdolabında bozulmadan"	"korunabilir."	"Her üç günde bir taze"
"w"	"W-SD18E1C-4173-1382"	"suyu ve sulama suyu kaynaklarının"	"korunmasının"	"öneminin, 2. Denizlerdeki yaşam ve"
"w"	"W-SG24D1B-2291-2391"	"Susanna'yı Kont'tan ve diğer erkeklerden"	"korumak"	"için uğraşması, dört perdelik bu"
"w"	"W-TE05A1B-4226-174"	"Suriye’yi, Suriye’yi, Irak’ı Irak’ı Irak’ı"	"korumak"	"için, Mısır’da Mısır’da Mısır’da barınabilmek"
"w"	"W-FA16B4A-3306-656"	"Suratı kızarıyor Ergin'in ama soğukkanlılığını"	"koruyor"	"yine de Ben polisiye olay"
"w"	"W-JC06A3A-1958-304"	"sunum ve istem miktarlarının, aynen"	"korunması"	"gereklidir. Bu nedenle ayırım yaptığımız"
"w"	"W-CI22C3A-1079-1623"	"soğuktan koruyan arkadlar, burada güneşten"	"koruyor."	"Kış ortasında bütün bulvar kahveleri"
"w"	"W-GH36C3A-0361-1324"	"soymak için taşıdıkları bıçaklarla ""kendilerini"	"korudular."""	"""Bu memlekette Müslümanlara hayat hakkı"
"w"	"W-SG37E1B-2935-1199"	"sosyal bir hayat olmalıdır. ŞEBNEM"	"KORUR"	"FİNCANCI ""Hepimiz Tecritteyiz"" oyununa hangi"
"w"	"W-VI07A2A-2643-187"	"sosların ve bazı yemeklerin sıcak"	"korunmasını"	"sağlar. Gazlı ve elektrikli modelleri"
"w"	"W-GI09C4A-1927-701"	"sorunları çözdüm, başıma bu gazetecilerin"	"korunması"	"projesini çıkarttınız, şimşekleri üzerimize çektiniz."
"w"	"W-PC29D1B-2440-1336"	"Sorun ne kadar çocuğu nasıl"	"koruyabilecek"	"olduğumuzdur. Hepimizin birinci önceliği bu"
"w"	"W-GD03A0A-0256-737"	"soru da şu Kendi haklarınızı"	"korumak"	"için konuştuğunuzda içinizde bir suçluluk"
"w"	"W-TA16B0A-0145-401"	"soramamam da bundan. Aman Allah"	"korusun."	"Ya öyle biri olsaydım. Merkez"
"w"	"W-QF10A2A-1817-698"	"sonuçlarına göre fikri mülkiyet haklarının"	"korunması"	"konusunda eksiklikleri bulunan ülkelere baskı"
"w"	"W-MF10A2A-1786-232"	"sonucunda elde edilen inovasyonların haklarını"	"korumak"	"ve lisans geliri elde etmek"
"w"	"W-IE39C0A-0193-2341"	"sonucu öldürülen eşiniz Uğur Mumcu'nun"	"korunması"	"hususunda, şifahi veya yazılı herhangi"
"w"	"W-KD02E3A-1646-1037"	"sonucu ihmal edilen işçilerin haklarını"	"korumak"	"için siyasal bir akım haline"
"w"	"W-ZI45F1D-4824-1329"	"sonucu da aynı ""Al karısından"	"korunmak"	"için bazı kadınlar da başlarına"
"w"	"W-RC01A4A-1168-844"	"sonuca ulaşmamız mümkün. İnsan sağlığının"	"korunmasında"	"bilinen yüzlerce tedavi metodundan en"
"w"	"W-KC29D1B-2794-2263"	"sonu itibarıyla, biyoteknolojiden, iletişime; çevre"	"korunmasından"	"enformasyon teknolojilerine kadar birçok alanda"
"w"	"W-QF25D1B-2161-1905"	"sonrasında yapılan satış hukuki geçerliliğini"	"korumaktadır"""	"açıklaması yaptı. TMSF'den, bazı basın"
"w"	"W-JA16B1A-0480-177"	"sonra çok bozulduğundan bu ifadeyi"	"koruyamaz"	"bu arada masaya bir ölüm"
"s"	"S-BEABXW-0173-65"	"sonra işte şey yolda allah"	"korusun"	"bişi olur ne var niye"
"w"	"W-PH42C3A-0819-1221"	"sonra ilim gelmelidir. Dini yaşamak,"	"korumak,"	"düşmana galebe çalmak, vs. hep"
"w"	"W-WI44F1D-5089-2022"	"sonra ekilen graftleri ne kadar"	"koruyabildin...(üstteki"	"koruyabildin...(üstteki yazımda yazdım) yabancı sitelerde"
"w"	"W-FA16B2A-0578-593"	"Sonra adamı yakalayacağım diye Allah"	"korusun"	"üç kişi birden paldır küldür"
"w"	"W-PF05A1B-4675-1884"	"sonlarına doğru çevreye ve çevre"	"korumasına"	"karşı daha hassas olunmasını gerekli"
"w"	"W-EF10A3A-1838-857"	"sona erişine değin bu statüsünü"	"korumasına"	"karşın, banknot çıkarma, devletin bankerliğini"
"w"	"W-JC05A4A-1768-1435"	"son çözümlemede devletten çok memur"	"korunmuştur."	"Oysa asıl olan devlet ve"
"s"	"S-ACAAQq-0419-118"	"son yıllarda geliştirdiği yeni projelerle,"	"korunmaya"	"muhtaç çocuklarımıza verdiği hizmetlerde önemli"
"w"	"W-UF10A2A-1872-1798"	"son iki yılda rekabet gücünü"	"korumak"	"amacıyla istihdam ve reel ücret"
"w"	"W-IC01A1B-3722-136"	"solüsyon ile 7 saat süreyle"	"korunmaya"	"alınmış ve daha sonra Langendorff"
"w"	"W-SI22C2A-0830-1627"	"solunda. Ön ve arkasında onu"	"koruyan"	"melekler vardır. O bunlardan habersizdir"
"w"	"W-SG03A1B-3272-1001"	"sokaklarda uçuşarak dolaştığına inanılırdı. Onlardan"	"korunmak"	"için akdiken çiğnenir, evlerin kapılarına"
"w"	"W-QD36E1B-2841-648"	"Sokak kapıları, evlerin iç dünyasını"	"koruyan"	"kale kapısı gibidir. Girişlerle beraber"
"s"	"S-ADABPZ-0372-41"	"sizlere ödeyeceğiz. Eczacılık mesleğinin onurunu"	"koruyan"	"ve yücelten, evrensel bilim ve"
"w"	"W-QE39C2A-1182-2486"	"Sizler gibi hayatın içinde gizlenmiş,"	"korunmuş,"	"örtünmüş ayrı bir hayat yaşamayız"
"w"	"W-RD36E1B-2842-2463"	"sizinle konuştum diye. Yoldan uzak"	"koruyun"	"beni, babam kocaman greyderiyle geçerken"
"w"	"W-VD05A0A-2036-2190"	"sizin hakkınızı bırakın, hani ben"	"korumasını"	"beklemiyorum orada, hani tamam beni"
"w"	"W-KE39E1B-2896-2418"	"siyasetsizlik, bir saflık arayışıyla kendisini"	"korumaya"	"alıyor. Siyasetin olmadığı yerde, ideolojik"
"w"	"W-MD02A1B-4509-848"	"siyasası içinde, kendi yerli karakterini"	"koruyarak"	"güçlendirme isteklerini yansıtmaktadır. Fes tecrübesi,"
"w"	"W-SC29D1B-2435-1529"	"sivil toplum örgütüdür. Ruh sağlığının"	"korunması"	"ve iyileştirilmesi için çalışan hekimler"
"w"	"W-VI45F1D-4801-2034"	"sivil ortamdaki itibarının daha iyi"	"korunması"	"için üst rütbeli subayların maaşı,"
"w"	"W-HE06A1A-2069-330"	"sistemini ve dolayısıyla suyun verimliliğini"	"korumak"	"için suya toplam alkaliliği 20"
"w"	"W-EC06A1B-3559-2001"	"sistemini oluşturan elemanların doğal dengesinin"	"korunması"	"ve sürekliliği, orman kaynağından faydalanan"
"w"	"W-HE05A1B-3528-1191"	"Sistemine katılmakla paranın dış değerini"	"koruyacaklarına"	"ilişkin söz altına girmişlerdir. Kuşkusuz,"
"w"	"W-OE05A1B-4175-2350"	"sistemimizde işletmeleri enflasyona karşı kısmen"	"koruyan"	"veya bu etkiyi gösteren düzenlemeler"
"w"	"W-UC40E1B-2880-27"	"sistemi her şeyi oynatabiliyor. Kopya"	"koruması"	"ve DRM gibi kelimeler, Linux"
"w"	"W-JE39C4A-1476-106"	"sigara içenin bu fiili kanunlarla"	"korunmuştur."	"Nefes almakta zorlanan ve tahammülü"
"w"	"W-PD30D1B-2201-2376"	"seçilme yaşını 25'e düşürüyor. ""Ormanların"	"Korunması"	"ve Geliştirilmesi""ni Geliştirilmesi""ni düzenleyen Anayasa'nın"
"w"	"W-VG37E1B-3069-2487"	"sevmekle başlar. Tanımadığımızı sevmeyiz, sevmediğimizi"	"korumayız."	"Bunun için hadi kuşlarımızı tanımaya"
"w"	"W-DA16B4A-0288-1650"	"sevişmesini görüyor mu çocuk? Çocuğu"	"korumak"	"gerek! Karanfilli Çingene çoktan yok"
"w"	"W-YI45F1C-5071-587"	"sevimlilik yapıyorlar. Senin manitanı yağmurdan"	"koruyup"	"şemsiye tutmanı yesinler ya. Bizimkiler"
"w"	"W-JI37C3A-0091-546"	"sevgisi ve desteğiyle yere yuvarlanmaktan"	"koruduğu"	"için de ona, Çok çok"
"w"	"W-OD02A1B-4545-398"	"sevgi ve inançla bağlanarak onu"	"koruyup"	"geliştirmenin mücadelesini vermiştir. Ali Şir"
"w"	"W-PI42E1B-2938-632"	"sevgi nefrete dönüşüvermişti. Erkeğinin namusunu"	"korudukça"	"güzeldi ve sevimliydi dişi. Şimdi"
"s"	"S-ADABAo-0318-99"	"sette. Evet. Bizim yanımızda bizi"	"korurdunuz."	"Şerif Gönen de aslında onun"
"w"	"W-LI09C3A-1047-2097"	"sesleri yankılanırken koridorları dolaşıyor, ""Tanrı"	"korusun,"""	"diye dualar ediyordu. Bu program"
"s"	"S-BEABXO-0269-19"	"sesler. Niye, o arabayı kim"	"koruyo"	"peki? Kendisinde yapışkan var tekerleklerinde."
"w"	"W-MI39C3A-1951-1362"	"seslenmeyi becerdiği için halk desteğini"	"koruyabildi."	"Şimdi, açıkça belli olan şu"
"w"	"W-EF05A1B-4375-1648"	"servetten alınan vergiler ise düzeyini"	"korumuştur."	"Gelirlerden alınan vergiler 1975'te 45.8"
"w"	"W-LA16B4A-0149-2031"	"servetlerin sonradan görme sahipleri boğazdaki"	"korumalı"	"sitelerinden laiklik sloganları atıyor. Gelir"
"w"	"W-LF05A1B-4449-2230"	"Sermayenin satın alma gücü olarak"	"korunması"	"yaklaşımında amaç, enflasyondan doğan kazanç"
"w"	"W-ME39C3A-2597-1486"	"serlerden, adâletleriyle de onları zulümlerden"	"koruduktan"	"ölçüde siyâsette başarılı sayılır ve"
"w"	"W-PE30D1B-2106-1705"	"serbestçe yürüyemiyor, otomobil kullanamıyor. Kendilerini"	"korumak"	"için peçe takmalarını anlıyorum"" diye"
"w"	"W-HA16B2A-0717-1934"	"seni bu fani dünyanın kötülüğünden"	"korusun"	"diye dua ettikten sonra içeri"
"w"	"W-VA14B1A-1604-2336"	"sen de radyasyon ışınlarından bizi"	"koruyacak"	"aracı çalıştır. Aracı toprağa göm."
"s"	"S-AEAASO-0039-77"	"sel gibi akıp gidiyor. Allah"	"korusun."	"Korkmak lazım. Öyleyse bu yolda"
"w"	"W-KF18E1C-4151-292"	"sektör halen emek yoğun yapısını"	"korumaktadır."	"Gelişmiş ülkelerde de emek yoğun"
"w"	"W-MI29D1B-2449-564"	"seksin daha uzun süre tahtını"	"koruyacağını"	"gösteriyor. Jane Fonda'nın başrolünü oynadığı"
"w"	"W-JE39E1B-2838-1973"	"seferki maksadı ""savaşmak değil barışı"	"korumak""tır."	"korumak""tır. Merkeze yerleşmek isteyen her"
"w"	"W-GE05A1B-3500-700"	"sebeple ifade şekline fikri hukuk"	"koruması"	"sağlanamaz. Bölge Mahkemesi, Apple işletme"
"w"	"W-NE39C0A-0215-399"	"sebebiyet vermişti. e. PKK, varlığını"	"korumak"	"maksadıyla hazırladığı tüzük gereği kendi"
"w"	"W-NI09C3A-0652-974"	"sebebi orduyu korumak değil, siyaseti"	"korumaktır."	"Ordunun siyasete karışması, siyaset piyasasında"
"w"	"W-RI41C3A-1291-182"	"sağlığını yiyeceklerine dikkat ederek de"	"korumalı."	"Yüksek zevklere düşkünlüğü nedeniyle damağında"
"s"	"S-AEABUZ-0021-211"	"sağlığımız iyi olursa ruh sağlığımızı"	"korumak"	"demek yani sürekli işte bir"
"w"	"W-IF18E1C-4145-717"	"sağlığı, okul sağlığı, zararlı alışkanlıklardan"	"korunma,"	"ağız ve diş sağlığı, yaşlı"
"w"	"W-IF18E1C-4145-1317"	"sağlıklı sürdürebilmeleri için, kamu sağlığının"	"korunmasını,"	"koruyucu, tedavi ve rehabilite edici"
"w"	"W-IF18E1C-4145-881"	"sağlık hizmetlerinin kalitesinin artırılmasına, çevrenin"	"korunmasına"	"ve geliştirilmesine çalışılacaktır. Gelişen haberleşme"
"s"	"S-ADBBI^-0042-151"	"sağlayan, ona hareket imkânı veren,"	"korunma,"	"barınma imkanı tanıyan, Suriye'ydi. Doğrusu"
"w"	"W-KE05E1B-3299-2193"	"sağlayabilir. Enflasyonunu yüzde 1 seviyesinde"	"koruyabilen"	"Avrupa Birliği ülkelerinde en az"
"w"	"W-IE05A2A-2048-2024"	"sağlar. Şekil zorunluluğu tarafların menfaatini"	"korumakta"	"ve bazen maddi kuralların etkililiğini"
"w"	"W-EE05A3A-2686-2078"	"sağlanmasını, Devletin ve devlet kuruluşlarının"	"korunmasını"	"hedef tutan her şeyi ifade"
"w"	"W-SE05A1B-4207-1343"	"sağlanması ise firmanın rekabet avantajlarını"	"korumasına"	"ve/veya ve/veya yeni rekabet avantajları"
"s"	"S-ACAAQq-0419-117"	"sağlanmaktadır. Başlatılan sevgi zinciri projesiyle,"	"korunmaya"	"muhtaç 450 çocuğun kreş ve"
"w"	"W-FD18E1C-4084-532"	"sağlanacaktır. Tüm partilerle birlikte çevre"	"korunması"	"takip edilecektir. EROZYON Güzel ülkemizde"
"w"	"W-LE05A1B-3680-1700"	"sağlanacak; Kosova'da Yugoslavya'nın toprak bütünlüğünün"	"korunması"	"şartıyla özerk bir yönetimin oluşturulması"
"w"	"W-QD36C0A-0222-316"	"sağlanabilir. Çünkü, insan beyni sahibini"	"koruyacak"	"gibi çalışmakta, iç güdüsel tepkiler"
"w"	"W-SD02A3A-0815-173"	"sağlamlık hem de yangınlara karşı"	"korunmak"	"için bedesten inşaatlarında taş kullanılmıştır."
"w"	"W-EC06A1B-3553-853"	"sağlamak ve dolgunun dış yüzeylerini"	"korumak"	"üzere inşa edilen kabuk zonunu"
"w"	"W-SI22C4A-0828-1574"	"sağa sola saldıran ""insan""lardan ""insan""lardan"	"korumaya"	"çalışıyorlardı!.. Hayır... İnsan bu olamazdı!.."
"w"	"W-SE22C2A-1395-2442"	"saçak insan doluydu. Yakıcı güneşten"	"korunmak"	"için bazıları şemsiye kullanıyordu. Asfalt"
"w"	"W-OH36C2A-1472-2170"	"sayıp dökerek yayınlarlar. Sizi aldatılmaktan"	"korurlar."	"Örneğin radyasyon yayma sakıncası olan"
"w"	"W-QA16B5A-0175-939"	"sayılırdık. Pencerenin önündeki set bizi"	"koruyordu."	"Binaya çarpan mermiler ancak pencerenin"
"w"	"W-JE39C2A-0422-1395"	"sayıları sıralamaya... Şu kadar çocuk"	"korunmaya,"	"bakıma muhtaçmış... Bakanlıkta şu şubenin"
