"Register"	"Text"	"Left"	"-5;5"	"Right"
"s"	"S-ACABQq-0423-219"	"Kurucu devletlerin, kendi millî kimliklerini"	"korumak"	"amacıyla, diğer kurucu devlet vatandaşlarının"
"w"	"W-GE39C2A-0026-1440"	"kurdukları Japon fabrikalar sıkı sıkıya"	"korunarak"	"her ırktan zengin ve fakirler,"
"w"	"W-JD02A3A-1347-1074"	"Kuran vahiylerinin yazılmasını, ezberlenmesini ve"	"korunmasını"	"esas alıyordu. Kendi sözleriyle Kuran"
"w"	"W-PF10A2A-1867-1163"	"kuran anlaşmanın ekinde yer alan"	"Korunma"	"Hükümleri Anlaşması'nda sözü edilen Topluluk"
"w"	"W-TH32D1B-2487-580"	"kuramaz mıydı?.. Bir canlıyı sevmenin,"	"korumanın,"	"ona kıyamamanın ilk dersi değil"
"w"	"W-KE05A1B-3631-1431"	"kurallar, normalde ceza hukuku tarafından"	"korunan"	"kamunun genel yararını ilgilendirmemektedir. Disiplin-ceza"
"w"	"W-DD36E1B-2846-1082"	"kural haline getirir. Bu ""türün"	"korunması"	"içgüdüsü"", ya da ""annelik duygusu"""
"s"	"S-AAAAFZ-0383-142"	"kullanımı tarımsal alanlarda, biyolojik çeşitliliğin"	"korunması"	"problemi <d 2> ve biyotik,"
"w"	"W-VC06A1A-2716-837"	"kullanımlar ve tarihi, kültürel ve"	"korunan"	"alanlar gibi farklı sektörleri içeren"
"w"	"W-RG37F1B-2934-158"	"kullanılmaya devam edildi. Doğaçlamalar belirleyiciliğini"	"korudu."	"Müziğin kullanım alanları ise kral"
"w"	"W-DE39C4A-0693-955"	"kullanılmasıdır? Yoksa hem ""tarihsel özelliğini"	"korumak"","	"hem de ""çağdaş yaşamın bir"
"w"	"W-LC06A3A-1960-673"	"kullanılmaktadır. Saf çinko anotlarla ile"	"korunan"	"demir metali arasında yaklaşık olarak"
"w"	"W-CC06E1B-3075-1424"	"kullanılan kafein, günümüzde de geçerliliğini"	"korumaktadır."	"Kafein, bu etkisini baş ağrısına"
"w"	"W-SE05A1B-4207-1398"	"kullanılacak teknolojinin karmaşıklığı arttıkça bilginin"	"korunması"	"ve transferi kolaylaşacaktır. İdeal olarak,"
"w"	"W-VF10A1A-1889-2253"	"kullanıcısı olan kişilerin temel haklarının"	"korunması"	"gözetilmeli, soruşturmaya veya uyuşmazlığa konu"
"s"	"S-ADBBI^-0042-131"	"kullanarak, büyükelçilik binasında misafir edilmesi,"	"korunması,"	"olacak iş değildi. Fakat şunu"
"w"	"W-NF10A2A-1827-378"	"kredi politikasını yürütmek, paranın değerinin"	"korunmasına"	"ilişkin önlemleri almak, para basma"
"w"	"W-DE04A1B-3412-1768"	"koşuyor ve Antigonos onların özgürlüklerini"	"koruyacağına"	"yemin ediyor. Antigonos bu belgeyi"
"s"	"S-ADABPZ-0372-178"	"koşullarında mesleğimizin varlığını ve önemini"	"koruması"	"için yeniliklere açık olmalı ve"
"s"	"S-ACABQq-0423-49"	"koşulları, birliği, tarafsızlığı ve onuru"	"koruyacak"	"nitelikte olmalıdır. Polisler adil bir"
"w"	"W-GD03A0A-0256-2008"	"koşulları altında bile akıl sağlığını"	"korur"	"ve mutlu olabilir. Eğer çocukluğunda"
"w"	"W-UE39C4A-2696-2351"	"koşullar çerçevesinde her türlü hakları"	"korunacaktır."	"Ancak temiz Türk işçisini sömüren,"
"s"	"S-AEABUZ-0021-210"	"koymalıyız ve kendi ruh sağlığımızı"	"korumak"	"için bulunduğumuz noktayı iyi gözlemeliyiz."
"s"	"S-BEABXf-0406-187"	"koyim, şey araçlarda geziyor emm,"	"korumalı"	"araçlarda. Dini lider olarak bakma"
"w"	"W-CE39E1B-2888-634"	"koydular. Şimdi programında özel teşebbüsün"	"korunması"	"ve geliştirilmesi olan yeni hükümet,"
"w"	"W-OI37C3A-0483-45"	"koruyucusu ve kurtarıcısı... Van kedilerini"	"korumak"	"için vakıf kurucusu... Anlattığı bir"
"w"	"W-CA16B2A-1299-207"	"koruyuculuğunu yitirmiş iyice. İçindeki bedeni"	"koruyup"	"saklaması bir yana, kendini bile"
"s"	"S-BEABXO-0093-8"	"koruyorlar başka? Üşüyoruz dimi? Üşümekten"	"koruyorlar,"	"soğuktan koruyorlar. Evet. Peki. Gel."
"s"	"S-ADAB]o-0193-13"	"koruyor. 30 metrelik bir mesafe"	"koruyor."	"Ama zil çalıp da son"
"s"	"S-BEABXO-0093-20"	"koruyo? Soğuktan. Aferin sana. Soğuktan"	"koruyo"	"değil mi? Eğer eğer kürkü"
"s"	"S-ADABPZ-0373-53"	"koruyacağıma Ve hemşirelik mesleğinin bütünlüğünü"	"koruyacağıma"	"And içerim. And içerim. <Alkış>"
"w"	"W-JC01A3A-1019-416"	"korunması, 4. Eklemin anatomik yapısının"	"korunması"	"ve normal fonksiyonunun restorasyonu. Eklem"
"w"	"W-VE05A2A-2710-2188"	"korunması ve geliştirilmesi, insan sağlığının"	"korunması,"	"doğal kaynakların ihtiyatlı ve rasyonel"
"w"	"W-VF10A1A-1889-1472"	"Korunması Hakkında Yönerge"" doğrultusunda tüketicinin"	"korunması"	"hakkında düzenlemelerle ilgili uyum çalışmalarının"
"w"	"W-PC40E1B-2875-1120"	"korunması gerektiğini belirtebiliyorsunuz. İyi bir"	"korunma"	"için tavsiye edilen, güvenlik seviyesini"
"w"	"W-QD36E1B-2841-1462"	"korunmak ve sağanak yağmurlardan yapıyı"	"korumak"	"için geniş ve uzun tutularak"
"s"	"S-AEABTZ-0040-152"	"korunma kabının olmaması. Sonuçta Dünya'da"	"korunma"	"kabı olmayan bi reaktörü batıda"
"w"	"W-KE05A1B-3627-41"	"korumanın sıfırlanması, Üçüncü ülkelere karşı"	"korumanın"	"azalması, Üçüncü ülkelere yönelik miktar"
"w"	"W-KD03A0A-0261-1547"	"korumak gibi, kaplumbağaları korumak, balinaları"	"korumak"	"gibi insanı korumak da birincil"
"w"	"W-IF18E1C-4145-977"	"koruma sağlamamaktadır. Diğer taraftan Kanun,"	"korumadan"	"yararlanan eserlere tecavüzlerin önlenmesi ve"
"w"	"W-DD36E1B-2846-261"	"Koruma Kurumu""nda, Kurumu""nda, ""Hava Kalitesinin"	"Korunması"","	"""Gürültü Kontrol"", ""Kamu Arazilerinin Turizm"
"w"	"W-IA16B2A-0354-2293"	"korkanlar, Allah'ın kendilerini her beladan"	"korumasını"	"isteyenler, ya da gerçekleşmesini istedikleri"
"w"	"W-CF05A4A-0445-1326"	"kopyesi tüketicide bulunmalıdır. 2. Tüketicinin"	"korunmasının"	"sağlanması Kapı kapı dolaşarak yapılan"
"w"	"W-MD05A2A-0682-329"	"kopuş davranışları benimsemek suretiyle kendilerini"	"korumaya"	"çalışmaktadır. Tabii olarak bilmedikleri, ama"
"w"	"W-JI22C3A-0861-547"	"konuşan bir kadının ""doğal özelliklerini"""	"koruması"	"mümkün mü? 24 saat geçmeden"
"w"	"W-OC03A3A-1418-1103"	"konusunda bu kapalılığını sonuna kadar"	"korudu."	"Farklı coğrafya mutfaklarından beslendi ama"
"w"	"W-MB04A3A-1261-2"	"konusu uygulamanın Anayasanın ""orman köylüsünün"	"korunması"""	"amacı dışında da değerlendirilmesine yol"
"w"	"W-IE39C0A-0193-240"	"konuda, ""Onu korumayıp da kimi"	"koruyacağız?"""	"diyecek kadar iddialıydı. Ankara Valisi"
"w"	"W-KE05A2A-2053-686"	"konuda uzmanlaşmış bir mahkeme tarafından"	"korunmasının"	"daha etkili olacağı, anayasa şikayetinin"
"w"	"W-KC01A1B-3770-1410"	"konu olmuştur. Sağlık psikolojisi ""Sağlığın"	"korunması"	"ve geliştirilmesi, hastalığın önlenmesi ve"
"w"	"W-KC06A1B-3773-201"	"kontrolü, ozon tabakasının korunması, ormanların"	"korunması"	"ve sürdürülebilir kalkınma vurgulanmıştır. 3.2"
"w"	"W-DC06A3A-3364-2017"	"konjuktivilerine raslanmıştır. Derinin korunması Derinin"	"korumasını"	"gerektiren tesisatlar gözün korunmasınını da"
"w"	"W-LF10A1A-1825-956"	"Kong'da finansçılar Honk Kong dolarına"	"korumakta"	"oldukça başarılı olmuşlar, ancak aynı"
"w"	"W-ME39C3A-0581-1571"	"komisyonun raporunda bu durum, ""Asayişin"	"korunması"	"için yapılan işgal, gerçekte bir"
"w"	"W-DF05A1B-4370-2157"	"kollektif şirket ortaklarının menfaatlerini yeterince"	"korumaktan"	"uzaktır, hem de, «yalnız «yalnız"
"w"	"W-DH03A1B-3100-2086"	"kollej ve manastır ruhani reislerince"	"korunmakta"	"ve iaşeleri temin edilmekte idi."
"s"	"S-AEABUZ-0021-93"	"kollayabiliriz. Kendi ruh sağlığımızı nasıl"	"koruruz."	"Ruh sağlığımız iyi olursa ruh"
"w"	"W-RE39E1B-2903-1872"	"kollamış, Maraş'ta, Çorum'da, Sivas'ta devletin"	"korunması"	"için mezhepçi terör ve katliam"
"w"	"W-OG24D1B-3361-1154"	"koleksiyoncuların sergilerini yapacağız. Böyle eserleri"	"koruyan,"	"saklayan, kendi koleksiyonunu sergileyen değil"
"w"	"W-PI22E1B-2909-1550"	"kocaman bir aferin, dedi kardeşimi"	"koruduğum"	"için. Yaz aylarında köy çok"
"w"	"W-VC29D1B-2437-1152"	"kişinin doktor tavsiyesi olmaksızın kanserden"	"korunmak"	"veya vücut direncini artırmak amacıyla"
"w"	"W-IE39C4A-1358-1703"	"kişilerden ve akıntılardan bu ülkeyi"	"korusun!"	"Bir daha göstermesin! Çekiç Güçteki"
"s"	"S-AEABPZ-0331-44"	"kişi karşısında çevresel değerlerin önemini"	"koruyamazsınız."	"Neden? Aç insanla, muhtaç insanla"
"w"	"W-SE09C3A-0408-1927"	"KIZIM ORDUNUN İÇİNE GİRSE YİNE"	"KORUR"	"KENDİNİ. HİÇBİR YERE GİTMİYORSUNUZ!"" Meğer"
"w"	"W-QE39E1B-3034-436"	"kitlesinin artması şeker hastalığına karşı"	"korunmada"	"da faydalı olabilmektedir. Egzersizler bırakıldığında"
"w"	"W-PA16B1A-0246-1757"	"kitleler halinde porno izliyor. Gençleri"	"korumak"	"toplumdaki arızayı gidermek isteyenlerin önce"
"w"	"W-VI13C1A-2637-2210"	"kitle partileri değişimi ve umudu"	"korudukları"	"müddetçe ayakta kalabilirler"" denilmiştir. Ancak"
"w"	"W-UE02A4A-0908-1744"	"kitle iletişim araçlarının olumsuz etkilerinden"	"korumak"	"ve sağlıklı bir kimlik edinmelerini"
"w"	"W-KD39C4A-1085-2276"	"kitap kapaklarındaki anlamlı dörtlüklerinizi titizlikle"	"koruyorum."	"Örneğin, emekli olduğum sırada yazdığınız"
"w"	"W-VF07A2A-1857-960"	"kirliliğini önleme ve tüketici haklarını"	"korumaya"	"yönelik düzenlemeler hazırlayınca (örneğin, Çevre"
"w"	"W-DA14B1A-1672-1150"	"kirletebileceğini çok iyi biliyorum. (Soğukkanlılığını"	"koruyamayacak"	"gibidir. Yutkunur. Birkaç basamak daha"
"w"	"W-QE02A0A-1783-1874"	"kimliğini devletin üst kimliğine karşı"	"korurken,"	"bireysel kimliğini de azınlık grubunun"
"w"	"W-SD36E1B-2843-1977"	"kimlik, ne kültür kalır. Onurumuzu"	"korumak"	"da, kültürümüzü geliştirmek ve kültürün"
"w"	"W-SF05A1B-4665-2433"	"kimler için turizme açılacağı, nasıl"	"korunacağı,"	"nasıl pazarlanacağı sorularının yanıtlanmasıdır. 2023"
"w"	"W-VC01A1B-4113-617"	"kimi kavramlar (yaşama saygı, yaşamın"	"korunması)"	"ve her şeye rağmen hastayı"
"w"	"W-FD02A4A-0645-1778"	"kimi ilkeler saptanmazsa durumun ciddiyetini"	"koruyacağı"	"açıktır. DSP de SHP de"
"w"	"W-LI37C3A-0632-324"	"kilo almaz, hem de gücünüzü"	"koruyabilirsiniz."	"Bu günler sizin enerjik ve"
"w"	"W-OI22E1B-2908-124"	"ki; bir kaplan bile annesinin"	"koruduğu"	"bir yavru file saldırmayı kolay"
"w"	"W-PA16B4A-0099-2145"	"ki, oraya inemezmişiz, yetkililer tarafından"	"korunmaya"	"alınmış. Kominin söyledikleri hiç inandırıcı"
"w"	"W-GE39C3A-0410-2146"	"ki, kamuoyu laikliği bu kadrolarla"	"korumanın"	"olanaklı olup olamayacağından büyük bir"
"w"	"W-MD02A3A-1519-1271"	"ki, insan haklarını saptayan, bunların"	"korunması"	"için de bir mekanizma getiren"
"w"	"W-ND39C3A-1754-921"	"ki demokrasi, değerini bilen ve"	"koruyanlar"	"için vardır. Özveriyle çalışmalı, demokrasiyi"
"w"	"W-TE36E1B-3353-37"	"kez kabullendi mi sonuna kadar"	"korur."	"İçgüdüsel olarak doğru olanı bilir"
"w"	"W-FC06A3A-1058-1907"	"kez 1906 yılında tarihi değerleri"	"korumak"	"için Asarıatika Nizamnamesi çıkarılmıştır. XX."
"w"	"W-EA16B2A-0448-1967"	"kestiği köpeğini. Bunca yıldır beni"	"korumuş."	"Bana sadık. Şimdi, işte, ""dağa"
"w"	"W-IE39E1B-3028-2116"	"keskince"" bir yolun adıdır denge."	"Korunması"	"oldukça önemli ve önemi ölçüsünde"
"w"	"W-KA16B4A-0100-1237"	"kesinlikle o adam."" ""Sakın arkadaşını"	"korumak"	"için böyle konuşuyor olmayasın?"" dedi"
"w"	"W-UD18E1C-3374-2247"	"kesimi faaliyetlerini düzenleyerek tüketici haklarının"	"koruyan"	"rekabete açık, sağlıklı ve etkin"
"w"	"W-TI45F1D-4704-1304"	"Kerkük'te! Nasıl yapacak? Amerikan Conileri'nin"	"koruması,"	"kollaması ve silah temini ile..."
"w"	"W-KE05E1B-3299-1305"	"kepenkler ve otomobil lastikleri ile"	"korumaya"	"çalıştılar köprülerini. Zorlu doğa koşullarına"
"w"	"W-OD05A2A-2605-2168"	"kentlerini aldılar. Bu kentler onları"	"korumaktan"	"vazgeçen Roma orduları tarafından terk"
"w"	"W-OE05A1B-4181-1206"	"kendisinin uluslararası barış ve güvenliğin"	"korunması"	"konusundaki yetkilerini arttıran, “Barış “Barış"
"w"	"W-VE02A3A-2592-432"	"kendisine oy vermeyenlerin de hakkının"	"korunduğu"	"mevcut anayasal düzene bağlı kalındığı"
"w"	"W-IE39E1B-2837-1033"	"kendini Türk devletinin üniter yapısını"	"korumaya"	"adamıştır. Eğer Kürt sorunu bir"
"w"	"W-LI37C3A-0632-773"	"Kendini sevmek, kendine sahip çıkmak,"	"korumak,"	"kollamak demektir. İnsanın en önce"
"w"	"W-LA16B2A-0621-1244"	"kendini koruyan emir mülkü de"	"korurdu,"	"mülkü koruyan emir, hep emir"
"w"	"W-RI41C3A-1462-1662"	"kendini beğenmişliğin ateşi yanmaktadır. Şevkatle"	"koruyan,"	"hassas bir şekilde seven, şövalye"
"w"	"W-FG43A2A-2012-1415"	"kendine soruyor mu, ""ben İngilizliğimi"	"koruyor"	"muyum, Almanlığımı koruyor muyum"" diye."
"w"	"W-QD03A2A-1033-1147"	"Kendimize güvenimizi yeniden kazanmalı ve"	"korumalıyız."	"Son söz olarak diyebiliriz ki,"
"w"	"W-DD02A3A-2704-2326"	"kendilerinin daha üstün olduğu inancını"	"korumaya"	"devam ederler ise de, daha"
"w"	"W-EF39C4A-0074-202"	"kendilerini reklamların aldatıcı, yanıltıcı yanlarından"	"korumaya"	"hazır olmadıkları için daha etkilidir."
"w"	"W-VG24D1B-2323-1284"	"kendilerini geleceğe ait bir hayalden"	"korumak"	"amacıyla onu tekrarlayarak taklit etmeye"
"w"	"W-CI22C2A-0677-1817"	"kendilerine tanınan özerklik hakları çerçevesinde"	"koruyup"	"savunmaktan yana olduklarını gösteriyorlardı. Amaç,"
"s"	"S-ADABPZ-0135-173"	"kendi temel hak ve özgürlüklerini"	"koruması"	"ile ilgili bir duyarlılık içinde."
"w"	"W-UE36E1B-3357-1831"	"kendi tasarımı ""Deli Aysel"" zırhıyla"	"korumaya"	"çalışmış; yaşsız, zamansız, mekânsız bir"
"w"	"W-JD02A3A-1347-1032"	"Kendi sözleriyle Kuran ayetleri arasında"	"korunması"	"gereken farkı sahâbilerin bildiklerinden kuşkusu"
"w"	"W-OA16B2A-0787-333"	"kendi ruhunu ve bedenini nasıl"	"koruyabilecek,"	"kendi çocuklarına ne verebilecek diye"
"w"	"W-VE30D1B-2136-738"	"kendi kültürlerini, geleneklerini ve bilinçlerini"	"korumalarını"	"gerektiriyor. Çocuklar hem Türkçeyi hem"
"w"	"W-SD02A1A-0176-1857"	"kendi işiyle uğraşacak. Asker memleketi"	"koruyacak..."""	"Belirtmek gerekir ki, bu gelişme"
"w"	"W-TD02A1B-4603-861"	"kendi dilindeki doğallığını ne kadar"	"koruduğunu"	"çevirinin yabancılığını da göz ardı"
"w"	"W-MI37E1B-3057-1979"	"kelebek gibi kalakalmıştım ortalıkta. Kendimi"	"korumak"	"isterken birinin kolunu yaraladım. Ben"
"w"	"W-TD36E1B-2844-34"	"kazı falan yapmasın, sadece ister"	"korumaya"	"yönelik, ister halkı eğitmeye ve"
"w"	"W-LE39C3A-1348-1285"	"kazanılmaz, halkın hakkı ve hukuku"	"korunamaz."	"Deniz BAYKAL ""Bir doktor, bir"
"w"	"W-KI43C3A-1802-1998"	"kazanmış ve bugüne kadar da"	"korumuştur."	"Osmanlı devleti devrinde eski İslâm"
"w"	"W-QC40E1B-2876-614"	"kayıtları sorunlardan en iyi şekilde"	"korumak"	"için ilk olarak programın kullanacağı"
"w"	"W-LF05A1B-4452-972"	"kaynaklı sorunlar, günümüzde de önemini"	"korumaktadır."	"Ekonomik gelişmelerin istikrarsızlığı, problemli krediler,"
"w"	"W-QB38E1B-2882-1157"	"kaynaklarının korunması heterozisin (gen çeşitliliği)"	"korunması"	"anlamına gelir. Gelecekte iklim, barınak,"
"w"	"W-FC06A3A-1058-451"	"kaynaklarının kirlenmesini önlemek, yeraltı sularını"	"korumak,"	"su kalitesini sürdürmek, diğer bir"
"w"	"W-SF05A1B-4665-671"	"kaynakları zengin yerlerdir. Coğrafi mekanın"	"korunması"	"turizmde rekabet gücünü yüksek kılar"
"w"	"W-RE05A1B-4284-345"	"kaynaklanan kaza ve hastalıklara karşı"	"korunması"	"gerektiğini vurguladığı Anayasasının başlangıç metni"
"w"	"W-NF25D1B-2142-2446"	"kaynaklanan etkilerin ne ölçüde geçerliliğini"	"koruduğunun"	"önemli bir göstergesi olacak. 2000"
"w"	"W-UC29D1B-2445-1853"	"kaynak ülkesi olma"" özelliğini hala"	"koruduğu,"	"dünya genelinde dolaşımda olan istenmeyen"
"w"	"W-OD37C2A-0365-115"	"kaymış bacağımı korumuş. Bir şekilde"	"korunmuşum"	"yani. Çocuklarımı koruyamadım diyordum ama"
"w"	"W-ED02A3A-2028-85"	"kaygı düzeyinin azaltılmasında, benliğin örselenmeden"	"korunmasında"	"önemli görevler yüklenmiştir. Bilindiği gibi,"
"w"	"W-KE02A1B-3638-967"	"kaydıyla, bireyimizin genç olabileceğini düşünüyoruz."	"Korunmuş"	"olan kafatası kemiklerinin kalınlığı ilk"
"w"	"W-QD36C0A-0222-199"	"kaybolmak için girdikleri, ateşlere karşı"	"koruması"	"olmayan çardak gibi bir yerde"
"w"	"W-TC01A1A-1301-560"	"KAYBININ KORUNMASI Kilo verilmesi onun"	"korunmasından"	"çok daha kolaydır. Verilen kilonun"
"w"	"W-QD02A0A-1696-435"	"kaybetmişti. Ablanın bekârlık yıllarında, onun"	"korumasında"	"büyümüştü. Abladan başka bir de"
"w"	"W-RE22C1A-0247-2009"	"katlı binanın enkazından annesinin gövdesi"	"korumuş"	"4 yaşındaki Murat'ı... Ana oğul,"
"w"	"W-RB04A2A-1387-255"	"karşıya kalmıştı. Oysa bu birliği"	"korumak,"	"ancak şeyler arasındaki tüm nitel"
"w"	"W-SI45F2D-4906-722"	"karşısında, kendilerini ve özellikle çocuklarını"	"koruyamayacak"	"kadar... İnsan cinsi ya da"
"w"	"W-RF05A1B-4664-2033"	"karşısında ciddiyetini ve güler yüzlülüğünü"	"korumalı,"	"uygun bir dille müşterinin sorununun"
"w"	"W-ED37C3A-0401-2290"	"karşısında ""doğal ve insancıl cinselliğin"""	"korunup"	"geliştirilmesi son derece güç olacaktı,"
"s"	"S-ACABQq-0429-193"	"Karşılıklı konuşmayalım. Sizler asıl sükûneti"	"korumakla"	"yükümlü insanlarsınız. Siz buna katkı"
"w"	"W-GD02A1B-3726-911"	"karşılaşırsa, tüketici olarak hakkını nasıl"	"koruyabilir?"	"Edindjgj malın kullanımını, bakımını dogru"
"w"	"W-LC06A2A-1976-456"	"karşılaşılan ve aşırı zararlı etkilerden"	"korunmuş"	"normal yapılar için öngörülmüştür. (c)"
"w"	"W-JA14B1A-1689-1937"	"karşı, öteki kefenin ağırlıklarıdır. Çocuğu"	"korur,"	"kendini ve başkalarını aldatır. Merhametlidir"
"w"	"W-QC05A2A-2047-2493"	"karşı çıktığı nokta- önemlidir ve"	"korunmalıdır."	"Ben bu ayırımın, Erikson'un savunduğu"
"w"	"W-IE05A2A-1016-1024"	"karşı OPEC'i kullanarak kendi çıkarlarını"	"korumaları"	"anlamına gelmektedir. Aslında bozuk rejimi"
"w"	"W-HE05A1B-3528-1659"	"karşı eski dar dalgalanma marjını"	"koruyorlardı."	"Böylece Avrupa Para Birliği'nin ikinci"
"w"	"W-CD02A1B-3398-827"	"karşı değil, gerçek yurttaş özgürlüklerinin"	"korunmasına"	"karşı da olumsuz etkilerde bulunurlar."
"w"	"W-SE36E1B-3352-1442"	"karşı bir zırh olmalı, bizi"	"korumalı"	"diye düşünürüz. Oysa giydiğimiz resmi"
"w"	"W-SI27D1B-2465-1951"	"karısı ise 40 yıl suskunluğunu"	"korudu."	"Milyonluk kalem Rooney İngiliz futbol"
"w"	"W-QF10A2A-1817-43"	"karton, delme çubukları), 3 kez"	"korunma"	"önlemleriyle (şeftaliler, ayakkabı, tekstil) ilgili"
"w"	"W-VA16B2A-1243-1965"	"Karnın dümdüz iniyorsa, belin inceliğini"	"koruyorsa,"	"en ufak bir hareketinle gergin"
"w"	"W-NI22C2A-0698-966"	"Karakullukçu ""Yanılmıyorsam, 1975'li yıllarda kıyıların"	"korunması"	"için bir kararname çıkarılmıştı. Kıyılar,"
"w"	"W-MC06A1B-3819-1761"	"karakteristik yollar daha çok bir"	"korunmanın"	"yakınında veya altındadır. Dışardaki bir"
"w"	"W-QD36C0A-0222-1958"	"karakol kendi bulunduğu mekanda kendisini"	"koruyordu."	"Gerçekte ise koruyamıyordu, çünkü birliğin"
"w"	"W-NE18E1C-0317-1976"	"Kara Kökenli Kaynaklardan Kirleticilere Karşı"	"Korunması"	"Hakkında Protokol, Atina 1980 *Akdeniz'de"
"w"	"W-CH03A1A-1515-1245"	"kapısına, imam Zeynül-Abidine sığındı ve"	"korundu."	"İmam Zeynül-Abidin çok bilgili, çok"
"w"	"W-II09C3A-1943-1383"	"Kapının iki tarafında demir parmaklıklarla"	"korunmuş"	"pencereler vardı. Pencereleri tabii açık"
"w"	"W-MA16B1A-0128-1137"	"Kapıları iyice örttüm. Üniformamı nasıl"	"koruyacaktım."	"Adama yarım yamalak İngilizcemle anlatmaya"
"w"	"W-PB04A1A-1545-2269"	"kapsül patojeni antikorların etkisine karşı"	"korur."	"Eğer bu kapsül maddesi çıkarılırsa"
"s"	"S-ACAAPZ-0030-132"	"kapsayan anne ve çocuk sağlığının"	"korunması"	"ve geliştirilmesinde sağlık insan gücünün"
"w"	"W-IF18E1C-4145-47"	"kapsamına alınacak, markaların tescil ile"	"korunması"	"sağlanacak, tescil işlemlerinde ilan ve"
"w"	"W-KC06A1B-3773-927"	"kapsam Buna göre, ekosistem ve"	"korunan"	"alan yönetimi esaslarını yansıtan bir"
"w"	"W-SD02A3A-1614-716"	"kapatacak şekilde örtülen başörtü tarzını"	"koruyanlar,"	"bu yeni tarz küçük ve"
"s"	"S-ADABCo-0282-30"	"Kapalı kaldığı sürece gündemdeki yerini"	"koruyan"	"Heybeliada'daki Ruhban Okulu'na dönüyoruz şimdi."
"w"	"W-ME05A1B-3923-527"	"kanıya uygunluğu ölçüsünde ikna ediciliğini"	"korumaktadır."	"Bu ada grubuna ilişkin olarak"
"w"	"W-NF05A1B-4440-1429"	"Kanun ve 4077 sayılı Tüketicinin"	"Korunması"	"Hakkındaki Kanunu, ayrıca Franchısıng ilişkilerine"
"w"	"W-SA14B1A-1586-556"	"kanserinden ölmüştü. Kitaplarda hastalıklardan nasıl"	"korunacağı"	"da yazıyor mu? Maviş Yazıyor"
"w"	"W-SE20C0A-0238-1220"	"kanatları kocaman, hem de abisini"	"koruyup"	"kollayacak kadar! Bunca şeyden sonra"
"w"	"W-MF25D1B-2788-1689"	"kanat ile DİSK'in eski halini"	"korumasını"	"isteyen gelenekçi kanat arasındaki çekişme,"
"w"	"W-SG37C0A-0189-1672"	"kanamasını kutsayan feminist yaklaşımlar gücünü"	"korudu;"	"Kisma K. Stepanich âdet kanaması"
"w"	"W-NE37C3A-0030-1279"	"kamuoyu oluşturucular grubuyla, darbeci ruhunu"	"koruyan"	"emekli subayların ""postmodern darbe"" tanımlaması"
"w"	"W-OE07A0A-2038-1935"	"kamu yönetiminin yurttaşlar nezdindeki meşruiyetinin"	"korunabilmesi"	"için gerek kamusal yetkinin kötüye"
"w"	"W-UI27D1B-2446-1479"	"kamu yararına kullanımı ve kıyıyı"	"korumak"	"amacına yönelik altyapı tesislerinin yapımına"
"w"	"W-SI27D1B-2818-895"	"kamu yararına aykırı buldu. ""Doğa"	"korunmalıydı"""	"Karayolları Genel Müdürlüğü'nün, şehir içinden"
"w"	"W-EB04A3A-1988-1915"	"kalırlar, bu sayede bentik populasyonlar"	"korunmuş"	"olur. Bentik hayvanların larvalarının planktonik"
"w"	"W-SI19E1A-4010-407"	"kalırdı? Ormanlar gibi hayvanlar da"	"korunmalıydı."	"Uzaktan gördüğü kayalık, şimdi düzgün"
"w"	"W-RI41C3A-1462-1016"	"kalmaya yatkın, sinsi hastalıklardan kendini"	"koruması"	"gerekir. Bunun yanı sıra, fıtık,"
"w"	"W-VF10A2A-1859-791"	"kalitesine sağlayacak, çevresel zenginliklerini de"	"koruyan"	"ve geliştiren, sürdürülebilir bir ekonomik"
"w"	"W-VE05A2A-2710-2113"	"Kalitenin artırılması, d. Doğal çevrenin"	"korunması,"	"hijyen koşullarının ve hayvan refahının"
"w"	"W-EF10A3A-1831-2087"	"kalite ölçütlerine uygunluğu sağlamak ve"	"korumak"	"önemli konulardandır. Bu bakımdan kaliteli"
"w"	"W-CE05A3A-1274-2064"	"kaldırılmayacak, sömürünün önlenmesi, emeğin hakkının"	"korunması"	"ve adil bir dağılımın sağlanması"
"w"	"W-NA16B1A-1565-1449"	"kaldırılacaktı ortadan. Eğer Bey, Beko'yu"	"korumaya"	"kalkarsa işte o zaman Cızir"
"s"	"S-ADBBAo-0443-94"	"kaldı. Evde kimse olmayınca kendimi"	"korurum."	"Farklı bir çocuktu, ""bilim adamı"
"w"	"W-LE39C3A-0067-1985"	"Kahhar ve kerim; kahreden ve"	"koruyan"	"bir devlet. Selçuklu-Osmanlı geleneği, aynı"
"w"	"W-JD03A3A-0897-1618"	"kah alevlenip kah sönerek varlığını"	"korumuştur."	"Kimi kültürlerde ise, ""yeni""ye ""yeni""ye"
"w"	"W-LA16B4A-0289-1767"	"kadının yanına geldi. Kadın kendini"	"korumak"	"için kolunu kaldırdı. Ama asker"
"w"	"W-SH42E1B-2919-248"	"kadın-erkek birlikteliğinde gözün ve kalbin"	"korunması"	"zorlaşmaktadır. Böyle bir durum erkekler"
"w"	"W-RI11F1D-5340-818"	"kadar... Bir yandan değer yargılarını"	"korumaya"	"çalışıyosun iyi şeyler yapmak için"
"w"	"W-RI41C3A-1291-1311"	"kadar üretken olabildiği, birikimlerini nasıl"	"koruyabildiği"	"hayret konusu olur. Gösterişsiz, küçük"
"w"	"W-TI22E1B-2913-912"	"kadar yaratıldığını. Otomobil motorlarını donmaktan"	"koruyan"	"""antifiriz"" gibi böceklerin hücrelerinde de"
"w"	"W-EA16B2A-0987-1793"	"kadar yalıyı bekleyen bekçiden, bahçeyi"	"koruyan"	"bahçıvandan ne farkımız var? Bizim"
"w"	"W-NE39E1B-2899-2274"	"kadar sürdürmüştür. Bu devlet bağımsızlığını"	"korumak"	"ile Batı'yla benzeşme arasındaki gerilim"
"w"	"W-UE30D1B-2112-746"	"kadar olan dönemde bu seyrini"	"koruyacağını"	"açıkladı. Merkez Bankası mayıs ayı"
"w"	"W-RI41C3A-1459-254"	"kadar kalıcı ve garantili olacaktır."	"Korumak"	"daha önemli, buna göre hareket"
"s"	"S-ADABAo-0318-128"	"kadar eylem yapılmışsa yani hakların"	"korunması"	"adına ne kadar eylem yapılmışsa"
"w"	"W-DF10A3A-1844-2366"	"kadar bu konumunu sürdürdü. İçgüvenliğin"	"Korunması"	"için Alınan Önlemler Osmanlı İmparatorluğu'nda"
"w"	"W-SC35A1A-1389-2015"	"kabuğundan elde edilir. Karaciğer hücrelerini"	"korur,"	"yüksek orandaki C vitamini içeriğine"
"w"	"W-EA16B2A-0987-2121"	"Kabul olan dua, bela gelirken"	"korur."	"Duanın belayı defetmesi de kaza"
"w"	"W-PE39C0A-0197-5"	"kabul edilir ve Osmanlı topçusunun"	"korumasına"	"alınır. 11 Ağustos 1914 günü"
"w"	"W-OG24D1B-3361-1262"	"janrı seçili bir tavır olarak"	"korunmuş."	"Tekand'ın buradaki tezi şu ""Günümüz"
"w"	"W-QD36C0A-0222-419"	"Jandarmanın da ancak kendi tesislerini"	"koruyabilecek"	"kadar silahlı gücü vardı. Kışla"
"w"	"W-UE30D1B-2124-193"	"jandarma ekipleri, karşılarında uyuşturucu maddeleri"	"koruyan"	"4 pitbull ile 100 yılanı"
"w"	"W-VG37E1B-3069-1261"	"İzmir'in ticaret merkezi olma konumunu"	"korumuş;"	"ticaret merkezi olmasının yanı sıra"
"w"	"W-QA14B1A-4729-865"	"İyi birşeydir herhalde... Koro Doğanın"	"korunması?"	"Cins Yemim şimdi doğayı... Koro"
"w"	"W-LI27D1B-3258-2140"	"İstanbulluların dinlenecek yeri kalmadı. Ormanların"	"korunması"	"için orman köylerine yönelik bir"
